Date,Name,Start,End,Duration,Latitude,Longitude,Category,Link
12/22/14,Laura's Home,2014-12-22T00:00:00-06:00,2014-12-22T10:36:51-06:00,38211,38.9219057145,-77.0772744833,Home,
12/22/14,Place in Ronald Reagan Washington National Airport,2014-12-22T10:55:51-06:00,2014-12-22T11:01:05-06:00,314,38.854126837,-77.043213578,,
12/22/14,Place in Ronald Reagan Washington National Airport,2014-12-22T11:07:15-06:00,2014-12-22T13:28:40-06:00,8485,38.853398535,-77.0431393619,,
12/22/14,Place in Logan International Airport,2014-12-22T14:28:51-06:00,2014-12-22T15:05:57-06:00,2226,42.3656368952,-71.0170021257,,
12/22/14,Fitzsimmons Home,2014-12-22T19:18:59-06:00,2014-12-23T00:00:00-06:00,16861,41.8771070061,-88.311048021,Home,
