<?xml version="1.0" encoding="UTF-8"?><kml xmlns="http://www.opengis.net/kml/2.2" xmlns:gx="http://www.google.com/kml/ext/2.2" xmlns:atom="http://www.w3.org/2005/Atom" xmlns:xal="urn:oasis:names:tc:ciq:xsdschema:xAL:2.0" xmlns:xsi="http://www.w3.org/2001/XMLSchema-instance">
  <Document>
    <atom:link href="http://www.moves-app.com"/>
    <description><![CDATA[<p align="center"><a href="http://www.moves-app.com"> <img src="http://www.moves-app.com/assets/moves.png"/> </a></p> <p align="center">Moves Storyline</p>]]></description>
    <Style id="place_Mexican Restaurant">
      <IconStyle>
        <scale>1.0</scale>
        <heading>0.0</heading>
        <Icon>
          <href>https://ss1.4sqi.net/img/categories/food/mexican.png</href>
          <refreshInterval>0.0</refreshInterval>
          <viewRefreshTime>0.0</viewRefreshTime>
          <viewBoundScale>0.0</viewBoundScale>
        </Icon>
      </IconStyle>
    </Style>
    <Style id="place_Community Center">
      <IconStyle>
        <scale>1.0</scale>
        <heading>0.0</heading>
        <Icon>
          <href>https://ss1.4sqi.net/img/categories/building/default.png</href>
          <refreshInterval>0.0</refreshInterval>
          <viewRefreshTime>0.0</viewRefreshTime>
          <viewBoundScale>0.0</viewBoundScale>
        </Icon>
      </IconStyle>
    </Style>
    <Style id="place_school">
      <IconStyle>
        <scale>1.0</scale>
        <heading>0.0</heading>
        <Icon>
          <href>http://ss1.4sqi.net/img/categories/building/school.png</href>
          <refreshInterval>0.0</refreshInterval>
          <viewRefreshTime>0.0</viewRefreshTime>
          <viewBoundScale>0.0</viewBoundScale>
        </Icon>
      </IconStyle>
    </Style>
    <Style id="place_Coffee Shop">
      <IconStyle>
        <scale>1.0</scale>
        <heading>0.0</heading>
        <Icon>
          <href>https://ss1.4sqi.net/img/categories/food/coffeeshop.png</href>
          <refreshInterval>0.0</refreshInterval>
          <viewRefreshTime>0.0</viewRefreshTime>
          <viewBoundScale>0.0</viewBoundScale>
        </Icon>
      </IconStyle>
    </Style>
    <Style id="place_work">
      <IconStyle>
        <scale>1.0</scale>
        <heading>0.0</heading>
        <Icon>
          <href>http://ss1.4sqi.net/img/categories/building/default.png</href>
          <refreshInterval>0.0</refreshInterval>
          <viewRefreshTime>0.0</viewRefreshTime>
          <viewBoundScale>0.0</viewBoundScale>
        </Icon>
      </IconStyle>
    </Style>
    <Style id="place_user">
      <IconStyle>
        <scale>1.0</scale>
        <heading>0.0</heading>
        <Icon>
          <href>http://maps.google.com/mapfiles/marker_white.png</href>
          <refreshInterval>0.0</refreshInterval>
          <viewRefreshTime>0.0</viewRefreshTime>
          <viewBoundScale>0.0</viewBoundScale>
        </Icon>
      </IconStyle>
    </Style>
    <Style id="place_Gastropub">
      <IconStyle>
        <scale>1.0</scale>
        <heading>0.0</heading>
        <Icon>
          <href>https://ss1.4sqi.net/img/categories/food/default.png</href>
          <refreshInterval>0.0</refreshInterval>
          <viewRefreshTime>0.0</viewRefreshTime>
          <viewBoundScale>0.0</viewBoundScale>
        </Icon>
      </IconStyle>
    </Style>
    <Style id="place_College Academic Building">
      <IconStyle>
        <scale>1.0</scale>
        <heading>0.0</heading>
        <Icon>
          <href>https://ss1.4sqi.net/img/categories/education/default.png</href>
          <refreshInterval>0.0</refreshInterval>
          <viewRefreshTime>0.0</viewRefreshTime>
          <viewBoundScale>0.0</viewBoundScale>
        </Icon>
      </IconStyle>
    </Style>
    <Style id="place_Salon / Barbershop">
      <IconStyle>
        <scale>1.0</scale>
        <heading>0.0</heading>
        <Icon>
          <href>https://ss1.4sqi.net/img/categories/shops/salon_barber.png</href>
          <refreshInterval>0.0</refreshInterval>
          <viewRefreshTime>0.0</viewRefreshTime>
          <viewBoundScale>0.0</viewBoundScale>
        </Icon>
      </IconStyle>
    </Style>
    <Style id="place_Multiplex">
      <IconStyle>
        <scale>1.0</scale>
        <heading>0.0</heading>
        <Icon>
          <href>https://ss1.4sqi.net/img/categories/arts_entertainment/movietheater.png</href>
          <refreshInterval>0.0</refreshInterval>
          <viewRefreshTime>0.0</viewRefreshTime>
          <viewBoundScale>0.0</viewBoundScale>
        </Icon>
      </IconStyle>
    </Style>
    <Style id="place_foursquare">
      <IconStyle>
        <scale>1.0</scale>
        <heading>0.0</heading>
        <Icon>
          <href>http://maps.google.com/mapfiles/marker_white.png</href>
          <refreshInterval>0.0</refreshInterval>
          <viewRefreshTime>0.0</viewRefreshTime>
          <viewBoundScale>0.0</viewBoundScale>
        </Icon>
      </IconStyle>
    </Style>
    <Style id="place_Grocery Store">
      <IconStyle>
        <scale>1.0</scale>
        <heading>0.0</heading>
        <Icon>
          <href>https://ss1.4sqi.net/img/categories/shops/food_grocery.png</href>
          <refreshInterval>0.0</refreshInterval>
          <viewRefreshTime>0.0</viewRefreshTime>
          <viewBoundScale>0.0</viewBoundScale>
        </Icon>
      </IconStyle>
    </Style>
    <Style id="place_Arts &amp; Crafts Store">
      <IconStyle>
        <scale>1.0</scale>
        <heading>0.0</heading>
        <Icon>
          <href>https://ss1.4sqi.net/img/categories/shops/artstore.png</href>
          <refreshInterval>0.0</refreshInterval>
          <viewRefreshTime>0.0</viewRefreshTime>
          <viewBoundScale>0.0</viewBoundScale>
        </Icon>
      </IconStyle>
    </Style>
    <Style id="place_Café">
      <IconStyle>
        <scale>1.0</scale>
        <heading>0.0</heading>
        <Icon>
          <href>https://ss1.4sqi.net/img/categories/food/cafe.png</href>
          <refreshInterval>0.0</refreshInterval>
          <viewRefreshTime>0.0</viewRefreshTime>
          <viewBoundScale>0.0</viewBoundScale>
        </Icon>
      </IconStyle>
    </Style>
    <Style id="place_unknown">
      <IconStyle>
        <scale>1.0</scale>
        <heading>0.0</heading>
        <Icon>
          <href>http://maps.google.com/mapfiles/marker_white.png</href>
          <refreshInterval>0.0</refreshInterval>
          <viewRefreshTime>0.0</viewRefreshTime>
          <viewBoundScale>0.0</viewBoundScale>
        </Icon>
      </IconStyle>
    </Style>
    <Style id="place_Ramen / Noodle House">
      <IconStyle>
        <scale>1.0</scale>
        <heading>0.0</heading>
        <Icon>
          <href>https://ss1.4sqi.net/img/categories/food/ramen.png</href>
          <refreshInterval>0.0</refreshInterval>
          <viewRefreshTime>0.0</viewRefreshTime>
          <viewBoundScale>0.0</viewBoundScale>
        </Icon>
      </IconStyle>
    </Style>
    <Style id="place_College Classroom">
      <IconStyle>
        <scale>1.0</scale>
        <heading>0.0</heading>
        <Icon>
          <href>https://ss1.4sqi.net/img/categories/education/default.png</href>
          <refreshInterval>0.0</refreshInterval>
          <viewRefreshTime>0.0</viewRefreshTime>
          <viewBoundScale>0.0</viewBoundScale>
        </Icon>
      </IconStyle>
    </Style>
    <Style id="place_Restaurant">
      <IconStyle>
        <scale>1.0</scale>
        <heading>0.0</heading>
        <Icon>
          <href>https://ss1.4sqi.net/img/categories/food/default.png</href>
          <refreshInterval>0.0</refreshInterval>
          <viewRefreshTime>0.0</viewRefreshTime>
          <viewBoundScale>0.0</viewBoundScale>
        </Icon>
      </IconStyle>
    </Style>
    <Style id="place_home">
      <IconStyle>
        <scale>1.0</scale>
        <heading>0.0</heading>
        <Icon>
          <href>http://ss1.4sqi.net/img/categories/building/home.png</href>
          <refreshInterval>0.0</refreshInterval>
          <viewRefreshTime>0.0</viewRefreshTime>
          <viewBoundScale>0.0</viewBoundScale>
        </Icon>
      </IconStyle>
    </Style>
    <Style id="place_Drugstore / Pharmacy">
      <IconStyle>
        <scale>1.0</scale>
        <heading>0.0</heading>
        <Icon>
          <href>https://ss1.4sqi.net/img/categories/shops/drugstore.png</href>
          <refreshInterval>0.0</refreshInterval>
          <viewRefreshTime>0.0</viewRefreshTime>
          <viewBoundScale>0.0</viewBoundScale>
        </Icon>
      </IconStyle>
    </Style>
    <Style id="place_Burger Joint">
      <IconStyle>
        <scale>1.0</scale>
        <heading>0.0</heading>
        <Icon>
          <href>https://ss1.4sqi.net/img/categories/food/burger.png</href>
          <refreshInterval>0.0</refreshInterval>
          <viewRefreshTime>0.0</viewRefreshTime>
          <viewBoundScale>0.0</viewBoundScale>
        </Icon>
      </IconStyle>
    </Style>
    <Style id="place_Student Center">
      <IconStyle>
        <scale>1.0</scale>
        <heading>0.0</heading>
        <Icon>
          <href>https://ss1.4sqi.net/img/categories/education/default.png</href>
          <refreshInterval>0.0</refreshInterval>
          <viewRefreshTime>0.0</viewRefreshTime>
          <viewBoundScale>0.0</viewBoundScale>
        </Icon>
      </IconStyle>
    </Style>
    <Folder>
      <name><![CDATA[11/1/14]]></name>
      <Placemark id="1414814400000">
        <name><![CDATA[Aryan Sameri Home]]></name>
        <description><![CDATA[<p>11/1/14<br/> 12:00 AM to 2:07 AM<br/> 2:07 hours</p>]]></description>
        <TimeSpan>
          <begin>2014-11-01T00:00:01-04:00</begin>
          <end>2014-11-01T02:07:36-04:00</end>
        </TimeSpan>
        <styleUrl>#place_home</styleUrl>
        <Point>
          <coordinates>-71.131486428,42.3593842284</coordinates>
        </Point>
      </Placemark>
      <Placemark id="1414822907000">
        <name><![CDATA[Home]]></name>
        <description><![CDATA[<p>11/1/14<br/> 2:21 AM to 10:33 AM<br/> 8:11 hours</p>]]></description>
        <TimeSpan>
          <begin>2014-11-01T02:21:48-04:00</begin>
          <end>2014-11-01T10:33:07-04:00</end>
        </TimeSpan>
        <styleUrl>#place_home</styleUrl>
        <Point>
          <coordinates>-71.1114458017,42.3754311174</coordinates>
        </Point>
      </Placemark>
      <Placemark id="1414852600000">
        <name><![CDATA[Starbucks]]></name>
        <atom:link href="http://foursquare.com/venue/4a5a3eb5f964a520f9b91fe3"/>
        <description><![CDATA[<p>11/1/14<br/> 10:36 AM to 10:41 AM<br/> 4 min</p> <p>Coffee Shop<br/> <a href="http://foursquare.com/venue/4a5a3eb5f964a520f9b91fe3">More details (Foursquare)</a> </p>]]></description>
        <TimeSpan>
          <begin>2014-11-01T10:36:41-04:00</begin>
          <end>2014-11-01T10:41:35-04:00</end>
        </TimeSpan>
        <styleUrl>#place_Coffee Shop</styleUrl>
        <Point>
          <coordinates>-71.11295,42.373886</coordinates>
        </Point>
      </Placemark>
      <Placemark id="1414854226000">
        <name><![CDATA[Aldrich Hall]]></name>
        <atom:link href="http://foursquare.com/venue/4ac64359f964a5206eb320e3"/>
        <description><![CDATA[<p>11/1/14<br/> 11:03 AM to 12:31 PM<br/> 1:28 hours</p> <p>College Academic Building<br/> <a href="http://foursquare.com/venue/4ac64359f964a5206eb320e3">More details (Foursquare)</a> </p>]]></description>
        <TimeSpan>
          <begin>2014-11-01T11:03:47-04:00</begin>
          <end>2014-11-01T12:31:49-04:00</end>
        </TimeSpan>
        <styleUrl>#place_College Academic Building</styleUrl>
        <Point>
          <coordinates>-71.12210915179602,42.36578780710847</coordinates>
        </Point>
      </Placemark>
      <Placemark id="1414859706000">
        <name><![CDATA[Place in Allston]]></name>
        <description><![CDATA[<p>11/1/14<br/> 12:35 PM to 12:38 PM<br/> 3 min</p>]]></description>
        <TimeSpan>
          <begin>2014-11-01T12:35:07-04:00</begin>
          <end>2014-11-01T12:38:37-04:00</end>
        </TimeSpan>
        <styleUrl>#place_unknown</styleUrl>
        <Point>
          <coordinates>-71.1228040051,42.366714043</coordinates>
        </Point>
      </Placemark>
      <Placemark id="1414860820000">
        <name><![CDATA[Crema Cafe]]></name>
        <atom:link href="http://foursquare.com/venue/49ce832ef964a5204f5a1fe3"/>
        <description><![CDATA[<p>11/1/14<br/> 12:53 PM to 4:02 PM<br/> 3:09 hours</p> <p>Café<br/> <a href="http://foursquare.com/venue/49ce832ef964a5204f5a1fe3">More details (Foursquare)</a> </p>]]></description>
        <TimeSpan>
          <begin>2014-11-01T12:53:41-04:00</begin>
          <end>2014-11-01T16:02:40-04:00</end>
        </TimeSpan>
        <styleUrl>#place_Café</styleUrl>
        <Point>
          <coordinates>-71.12068752421654,42.37349310617621</coordinates>
        </Point>
      </Placemark>
      <Placemark id="1414872916000">
        <name><![CDATA[Home]]></name>
        <description><![CDATA[<p>11/1/14<br/> 4:15 PM to 12:00 AM<br/> 7:44 hours</p>]]></description>
        <TimeSpan>
          <begin>2014-11-01T16:15:17-04:00</begin>
          <end>2014-11-01T23:59:59-04:00</end>
        </TimeSpan>
        <styleUrl>#place_home</styleUrl>
        <Point>
          <coordinates>-71.1114458017,42.3754311174</coordinates>
        </Point>
      </Placemark>
    </Folder>
    <Folder>
      <name><![CDATA[11/2/14]]></name>
      <Placemark id="1414900800000">
        <name><![CDATA[Home]]></name>
        <description><![CDATA[<p>11/2/14<br/> 12:00 AM to 8:21 AM<br/> 9:21 hours</p>]]></description>
        <TimeSpan>
          <begin>2014-11-02T00:00:01-04:00</begin>
          <end>2014-11-02T08:21:10-05:00</end>
        </TimeSpan>
        <styleUrl>#place_home</styleUrl>
        <Point>
          <coordinates>-71.1114458017,42.3754311174</coordinates>
        </Point>
      </Placemark>
      <Placemark id="1414935320000">
        <name><![CDATA[Home]]></name>
        <description><![CDATA[<p>11/2/14<br/> 8:35 AM to 11:47 AM<br/> 3:12 hours</p>]]></description>
        <TimeSpan>
          <begin>2014-11-02T08:35:21-05:00</begin>
          <end>2014-11-02T11:47:40-05:00</end>
        </TimeSpan>
        <styleUrl>#place_home</styleUrl>
        <Point>
          <coordinates>-71.1114458017,42.3754311174</coordinates>
        </Point>
      </Placemark>
      <Placemark id="1414947789000">
        <name><![CDATA[Wagamama]]></name>
        <atom:link href="http://foursquare.com/venue/49e00a10f964a5203b611fe3"/>
        <description><![CDATA[<p>11/2/14<br/> 12:03 PM to 1:05 PM<br/> 1:02 hours</p> <p>Ramen / Noodle House<br/> <a href="http://foursquare.com/venue/49e00a10f964a5203b611fe3">More details (Foursquare)</a> </p>]]></description>
        <TimeSpan>
          <begin>2014-11-02T12:03:10-05:00</begin>
          <end>2014-11-02T13:05:30-05:00</end>
        </TimeSpan>
        <styleUrl>#place_Ramen / Noodle House</styleUrl>
        <Point>
          <coordinates>-71.1207515001297,42.37189721215247</coordinates>
        </Point>
      </Placemark>
      <Placemark id="1414951826000">
        <name><![CDATA[CVS/pharmacy]]></name>
        <atom:link href="http://foursquare.com/venue/49df6a3ff964a520c6601fe3"/>
        <description><![CDATA[<p>11/2/14<br/> 1:10 PM to 1:17 PM<br/> 7 min</p> <p>Drugstore / Pharmacy<br/> <a href="http://foursquare.com/venue/49df6a3ff964a520c6601fe3">More details (Foursquare)</a> </p>]]></description>
        <TimeSpan>
          <begin>2014-11-02T13:10:27-05:00</begin>
          <end>2014-11-02T13:17:41-05:00</end>
        </TimeSpan>
        <styleUrl>#place_Drugstore / Pharmacy</styleUrl>
        <Point>
          <coordinates>-71.11899197101593,42.37402935435937</coordinates>
        </Point>
      </Placemark>
      <Placemark id="1414952802000">
        <name><![CDATA[Home]]></name>
        <description><![CDATA[<p>11/2/14<br/> 1:26 PM to 3:51 PM<br/> 2:25 hours</p>]]></description>
        <TimeSpan>
          <begin>2014-11-02T13:26:43-05:00</begin>
          <end>2014-11-02T15:51:43-05:00</end>
        </TimeSpan>
        <styleUrl>#place_home</styleUrl>
        <Point>
          <coordinates>-71.1114458017,42.3754311174</coordinates>
        </Point>
      </Placemark>
      <Placemark id="1414962196000">
        <name><![CDATA[Experiment Fund]]></name>
        <description><![CDATA[<p>11/2/14<br/> 4:03 PM to 5:34 PM<br/> 1:30 hours</p>]]></description>
        <TimeSpan>
          <begin>2014-11-02T16:03:17-05:00</begin>
          <end>2014-11-02T17:34:03-05:00</end>
        </TimeSpan>
        <styleUrl>#place_work</styleUrl>
        <Point>
          <coordinates>-71.11951231956482,42.37313766800413</coordinates>
        </Point>
      </Placemark>
      <Placemark id="1414968748000">
        <name><![CDATA[Home]]></name>
        <description><![CDATA[<p>11/2/14<br/> 5:52 PM to 12:00 AM<br/> 6:07 hours</p>]]></description>
        <TimeSpan>
          <begin>2014-11-02T17:52:29-05:00</begin>
          <end>2014-11-02T23:59:59-05:00</end>
        </TimeSpan>
        <styleUrl>#place_home</styleUrl>
        <Point>
          <coordinates>-71.1114458017,42.3754311174</coordinates>
        </Point>
      </Placemark>
    </Folder>
    <Folder>
      <name><![CDATA[11/3/14]]></name>
      <Placemark id="1414990800000">
        <name><![CDATA[Home]]></name>
        <description><![CDATA[<p>11/3/14<br/> 12:00 AM to 7:35 AM<br/> 7:35 hours</p>]]></description>
        <TimeSpan>
          <begin>2014-11-03T00:00:01-05:00</begin>
          <end>2014-11-03T07:35:03-05:00</end>
        </TimeSpan>
        <styleUrl>#place_home</styleUrl>
        <Point>
          <coordinates>-71.1114458017,42.3754311174</coordinates>
        </Point>
      </Placemark>
      <Placemark id="1415019520000">
        <name><![CDATA[Aldrich Hall]]></name>
        <atom:link href="http://foursquare.com/venue/4ac64359f964a5206eb320e3"/>
        <description><![CDATA[<p>11/3/14<br/> 7:58 AM to 3:42 PM<br/> 7:43 hours</p> <p>College Academic Building<br/> <a href="http://foursquare.com/venue/4ac64359f964a5206eb320e3">More details (Foursquare)</a> </p>]]></description>
        <TimeSpan>
          <begin>2014-11-03T07:58:41-05:00</begin>
          <end>2014-11-03T15:42:25-05:00</end>
        </TimeSpan>
        <styleUrl>#place_College Academic Building</styleUrl>
        <Point>
          <coordinates>-71.12210915179602,42.36578780710847</coordinates>
        </Point>
      </Placemark>
      <Placemark id="1415048640000">
        <name><![CDATA[Home]]></name>
        <description><![CDATA[<p>11/3/14<br/> 4:04 PM to 7:08 PM<br/> 3:04 hours</p>]]></description>
        <TimeSpan>
          <begin>2014-11-03T16:04:01-05:00</begin>
          <end>2014-11-03T19:08:40-05:00</end>
        </TimeSpan>
        <styleUrl>#place_home</styleUrl>
        <Point>
          <coordinates>-71.1114458017,42.3754311174</coordinates>
        </Point>
      </Placemark>
      <Placemark id="1415060715000">
        <name><![CDATA[K.C. Young Home]]></name>
        <description><![CDATA[<p>11/3/14<br/> 7:25 PM to 11:50 PM<br/> 4:25 hours</p>]]></description>
        <TimeSpan>
          <begin>2014-11-03T19:25:16-05:00</begin>
          <end>2014-11-03T23:50:55-05:00</end>
        </TimeSpan>
        <styleUrl>#place_home</styleUrl>
        <Point>
          <coordinates>-71.1199653739,42.3649899572</coordinates>
        </Point>
      </Placemark>
    </Folder>
    <Folder>
      <name><![CDATA[11/4/14]]></name>
      <Placemark id="1415077656000">
        <name><![CDATA[Home]]></name>
        <description><![CDATA[<p>11/4/14<br/> 12:07 AM to 7:34 AM<br/> 7:26 hours</p>]]></description>
        <TimeSpan>
          <begin>2014-11-04T00:07:37-05:00</begin>
          <end>2014-11-04T07:34:11-05:00</end>
        </TimeSpan>
        <styleUrl>#place_home</styleUrl>
        <Point>
          <coordinates>-71.1114458017,42.3754311174</coordinates>
        </Point>
      </Placemark>
      <Placemark id="1415105495000">
        <name><![CDATA[Aldrich Hall]]></name>
        <atom:link href="http://foursquare.com/venue/4ac64359f964a5206eb320e3"/>
        <description><![CDATA[<p>11/4/14<br/> 7:51 AM to 12:14 PM<br/> 4:22 hours</p> <p>College Academic Building<br/> <a href="http://foursquare.com/venue/4ac64359f964a5206eb320e3">More details (Foursquare)</a> </p>]]></description>
        <TimeSpan>
          <begin>2014-11-04T07:51:36-05:00</begin>
          <end>2014-11-04T12:13:59-05:00</end>
        </TimeSpan>
        <styleUrl>#place_College Academic Building</styleUrl>
        <Point>
          <coordinates>-71.12210915179602,42.36578780710847</coordinates>
        </Point>
      </Placemark>
      <Placemark id="1415121397000">
        <name><![CDATA[Aldrich Hall]]></name>
        <atom:link href="http://foursquare.com/venue/4ac64359f964a5206eb320e3"/>
        <description><![CDATA[<p>11/4/14<br/> 12:16 PM to 2:39 PM<br/> 2:22 hours</p> <p>College Academic Building<br/> <a href="http://foursquare.com/venue/4ac64359f964a5206eb320e3">More details (Foursquare)</a> </p>]]></description>
        <TimeSpan>
          <begin>2014-11-04T12:16:38-05:00</begin>
          <end>2014-11-04T14:39:35-05:00</end>
        </TimeSpan>
        <styleUrl>#place_College Academic Building</styleUrl>
        <Point>
          <coordinates>-71.12210915179602,42.36578780710847</coordinates>
        </Point>
      </Placemark>
      <Placemark id="1415131760000">
        <name><![CDATA[Place in Old Cambridge]]></name>
        <description><![CDATA[<p>11/4/14<br/> 3:09 PM to 3:14 PM<br/> 5 min</p>]]></description>
        <TimeSpan>
          <begin>2014-11-04T15:09:21-05:00</begin>
          <end>2014-11-04T15:14:26-05:00</end>
        </TimeSpan>
        <styleUrl>#place_unknown</styleUrl>
        <Point>
          <coordinates>-71.1166828526,42.3823000717</coordinates>
        </Point>
      </Placemark>
      <Placemark id="1415133161000">
        <name><![CDATA[Home]]></name>
        <description><![CDATA[<p>11/4/14<br/> 3:32 PM to 4:54 PM<br/> 1:21 hours</p>]]></description>
        <TimeSpan>
          <begin>2014-11-04T15:32:42-05:00</begin>
          <end>2014-11-04T16:54:26-05:00</end>
        </TimeSpan>
        <styleUrl>#place_home</styleUrl>
        <Point>
          <coordinates>-71.1114458017,42.3754311174</coordinates>
        </Point>
      </Placemark>
    </Folder>
    <Folder>
      <name><![CDATA[11/5/14]]></name>
      <Placemark id="1415173130000">
        <name><![CDATA[Home]]></name>
        <description><![CDATA[<p>11/5/14<br/> 2:38 AM to 7:19 AM<br/> 4:40 hours</p>]]></description>
        <TimeSpan>
          <begin>2014-11-05T02:38:51-05:00</begin>
          <end>2014-11-05T07:19:47-05:00</end>
        </TimeSpan>
        <styleUrl>#place_home</styleUrl>
        <Point>
          <coordinates>-71.1114458017,42.3754311174</coordinates>
        </Point>
      </Placemark>
      <Placemark id="1415190212000">
        <name><![CDATA[Broadway Marketplace]]></name>
        <atom:link href="http://foursquare.com/venue/4a661612f964a520ffc71fe3"/>
        <description><![CDATA[<p>11/5/14<br/> 7:23 AM to 7:28 AM<br/> 4 min</p> <p>Grocery Store<br/> <a href="http://foursquare.com/venue/4a661612f964a520ffc71fe3">More details (Foursquare)</a> </p>]]></description>
        <TimeSpan>
          <begin>2014-11-05T07:23:33-05:00</begin>
          <end>2014-11-05T07:28:05-05:00</end>
        </TimeSpan>
        <styleUrl>#place_Grocery Store</styleUrl>
        <Point>
          <coordinates>-71.11300484548056,42.37405171427381</coordinates>
        </Point>
      </Placemark>
      <Placemark id="1415191740000">
        <name><![CDATA[Aldrich Hall]]></name>
        <atom:link href="http://foursquare.com/venue/4ac64359f964a5206eb320e3"/>
        <description><![CDATA[<p>11/5/14<br/> 7:49 AM to 2:57 PM<br/> 7:08 hours</p> <p>College Academic Building<br/> <a href="http://foursquare.com/venue/4ac64359f964a5206eb320e3">More details (Foursquare)</a> </p>]]></description>
        <TimeSpan>
          <begin>2014-11-05T07:49:01-05:00</begin>
          <end>2014-11-05T14:57:06-05:00</end>
        </TimeSpan>
        <styleUrl>#place_College Academic Building</styleUrl>
        <Point>
          <coordinates>-71.12210915179602,42.36578780710847</coordinates>
        </Point>
      </Placemark>
      <Placemark id="1415218767000">
        <name><![CDATA[Home]]></name>
        <description><![CDATA[<p>11/5/14<br/> 3:19 PM to 6:13 PM<br/> 2:53 hours</p>]]></description>
        <TimeSpan>
          <begin>2014-11-05T15:19:28-05:00</begin>
          <end>2014-11-05T18:13:01-05:00</end>
        </TimeSpan>
        <styleUrl>#place_home</styleUrl>
        <Point>
          <coordinates>-71.1114458017,42.3754311174</coordinates>
        </Point>
      </Placemark>
      <Placemark id="1415230061000">
        <name><![CDATA[Park]]></name>
        <atom:link href="http://foursquare.com/venue/4f7c8902e4b032c26c6798db"/>
        <description><![CDATA[<p>11/5/14<br/> 6:27 PM to 8:17 PM<br/> 1:49 hours</p> <p>Gastropub<br/> <a href="http://foursquare.com/venue/4f7c8902e4b032c26c6798db">More details (Foursquare)</a> </p>]]></description>
        <TimeSpan>
          <begin>2014-11-05T18:27:42-05:00</begin>
          <end>2014-11-05T20:17:17-05:00</end>
        </TimeSpan>
        <styleUrl>#place_Gastropub</styleUrl>
        <Point>
          <coordinates>-71.12097185013617,42.37169409933257</coordinates>
        </Point>
      </Placemark>
      <Placemark id="1415237375000">
        <name><![CDATA[Home]]></name>
        <description><![CDATA[<p>11/5/14<br/> 8:29 PM to 12:00 AM<br/> 3:30 hours</p>]]></description>
        <TimeSpan>
          <begin>2014-11-05T20:29:36-05:00</begin>
          <end>2014-11-05T23:59:59-05:00</end>
        </TimeSpan>
        <styleUrl>#place_home</styleUrl>
        <Point>
          <coordinates>-71.1114458017,42.3754311174</coordinates>
        </Point>
      </Placemark>
    </Folder>
    <Folder>
      <name><![CDATA[11/6/14]]></name>
      <Placemark id="1415250000000">
        <name><![CDATA[Home]]></name>
        <description><![CDATA[<p>11/6/14<br/> 12:00 AM to 7:46 AM<br/> 7:46 hours</p>]]></description>
        <TimeSpan>
          <begin>2014-11-06T00:00:01-05:00</begin>
          <end>2014-11-06T07:46:32-05:00</end>
        </TimeSpan>
        <styleUrl>#place_home</styleUrl>
        <Point>
          <coordinates>-71.1114458017,42.3754311174</coordinates>
        </Point>
      </Placemark>
      <Placemark id="1415279276000">
        <name><![CDATA[Spangler Center]]></name>
        <atom:link href="http://foursquare.com/venue/4aeee0b0f964a52081d421e3"/>
        <description><![CDATA[<p>11/6/14<br/> 8:07 AM to 1:03 PM<br/> 4:55 hours</p> <p>Student Center<br/> <a href="http://foursquare.com/venue/4aeee0b0f964a52081d421e3">More details (Foursquare)</a> </p>]]></description>
        <TimeSpan>
          <begin>2014-11-06T08:07:57-05:00</begin>
          <end>2014-11-06T13:03:26-05:00</end>
        </TimeSpan>
        <styleUrl>#place_Student Center</styleUrl>
        <Point>
          <coordinates>-71.12218458495514,42.36522543920124</coordinates>
        </Point>
      </Placemark>
      <Placemark id="1415297238000">
        <name><![CDATA[Batten Hall]]></name>
        <atom:link href="http://foursquare.com/venue/4f8c1d88e4b002b90db5dda7"/>
        <description><![CDATA[<p>11/6/14<br/> 1:07 PM to 2:24 PM<br/> 1:16 hours</p> <p>College Academic Building<br/> <a href="http://foursquare.com/venue/4f8c1d88e4b002b90db5dda7">More details (Foursquare)</a> </p>]]></description>
        <TimeSpan>
          <begin>2014-11-06T13:07:19-05:00</begin>
          <end>2014-11-06T14:24:14-05:00</end>
        </TimeSpan>
        <styleUrl>#place_College Academic Building</styleUrl>
        <Point>
          <coordinates>-71.12383604049683,42.3640615623146</coordinates>
        </Point>
      </Placemark>
      <Placemark id="1415303689000">
        <name><![CDATA[Home]]></name>
        <description><![CDATA[<p>11/6/14<br/> 2:54 PM to 8:00 PM<br/> 5:06 hours</p>]]></description>
        <TimeSpan>
          <begin>2014-11-06T14:54:50-05:00</begin>
          <end>2014-11-06T20:00:51-05:00</end>
        </TimeSpan>
        <styleUrl>#place_home</styleUrl>
        <Point>
          <coordinates>-71.1114458017,42.3754311174</coordinates>
        </Point>
      </Placemark>
      <Placemark id="1415322581000">
        <name><![CDATA[Will Whitney and Benjana Guraziu Home]]></name>
        <description><![CDATA[<p>11/6/14<br/> 8:09 PM to 10:31 PM<br/> 2:21 hours</p>]]></description>
        <TimeSpan>
          <begin>2014-11-06T20:09:42-05:00</begin>
          <end>2014-11-06T22:31:39-05:00</end>
        </TimeSpan>
        <styleUrl>#place_home</styleUrl>
        <Point>
          <coordinates>-71.1114357056,42.3700145918</coordinates>
        </Point>
      </Placemark>
      <Placemark id="1415331665000">
        <name><![CDATA[Home]]></name>
        <description><![CDATA[<p>11/6/14<br/> 10:41 PM to 12:00 AM<br/> 1:18 hours</p>]]></description>
        <TimeSpan>
          <begin>2014-11-06T22:41:06-05:00</begin>
          <end>2014-11-06T23:59:59-05:00</end>
        </TimeSpan>
        <styleUrl>#place_home</styleUrl>
        <Point>
          <coordinates>-71.1114458017,42.3754311174</coordinates>
        </Point>
      </Placemark>
    </Folder>
    <Folder>
      <name><![CDATA[11/7/14]]></name>
      <Placemark id="1415336400000">
        <name><![CDATA[Home]]></name>
        <description><![CDATA[<p>11/7/14<br/> 12:00 AM to 7:21 AM<br/> 7:21 hours</p>]]></description>
        <TimeSpan>
          <begin>2014-11-07T00:00:01-05:00</begin>
          <end>2014-11-07T07:21:54-05:00</end>
        </TimeSpan>
        <styleUrl>#place_home</styleUrl>
        <Point>
          <coordinates>-71.1114458017,42.3754311174</coordinates>
        </Point>
      </Placemark>
      <Placemark id="1415364357000">
        <name><![CDATA[Spangler Center]]></name>
        <atom:link href="http://foursquare.com/venue/4aeee0b0f964a52081d421e3"/>
        <description><![CDATA[<p>11/7/14<br/> 7:45 AM to 8:49 AM<br/> 1:03 hours</p> <p>Student Center<br/> <a href="http://foursquare.com/venue/4aeee0b0f964a52081d421e3">More details (Foursquare)</a> </p>]]></description>
        <TimeSpan>
          <begin>2014-11-07T07:45:58-05:00</begin>
          <end>2014-11-07T08:49:22-05:00</end>
        </TimeSpan>
        <styleUrl>#place_Student Center</styleUrl>
        <Point>
          <coordinates>-71.12218458495514,42.36522543920124</coordinates>
        </Point>
      </Placemark>
      <Placemark id="1415368455000">
        <name><![CDATA[Aldrich Hall]]></name>
        <atom:link href="http://foursquare.com/venue/4ac64359f964a5206eb320e3"/>
        <description><![CDATA[<p>11/7/14<br/> 8:54 AM to 12:53 PM<br/> 3:59 hours</p> <p>College Academic Building<br/> <a href="http://foursquare.com/venue/4ac64359f964a5206eb320e3">More details (Foursquare)</a> </p>]]></description>
        <TimeSpan>
          <begin>2014-11-07T08:54:16-05:00</begin>
          <end>2014-11-07T12:53:40-05:00</end>
        </TimeSpan>
        <styleUrl>#place_College Academic Building</styleUrl>
        <Point>
          <coordinates>-71.12210915179602,42.36578780710847</coordinates>
        </Point>
      </Placemark>
      <Placemark id="1415383210000">
        <name><![CDATA[Aldrich Hall]]></name>
        <atom:link href="http://foursquare.com/venue/4ac64359f964a5206eb320e3"/>
        <description><![CDATA[<p>11/7/14<br/> 1:00 PM to 3:12 PM<br/> 2:12 hours</p> <p>College Academic Building<br/> <a href="http://foursquare.com/venue/4ac64359f964a5206eb320e3">More details (Foursquare)</a> </p>]]></description>
        <TimeSpan>
          <begin>2014-11-07T13:00:11-05:00</begin>
          <end>2014-11-07T15:12:21-05:00</end>
        </TimeSpan>
        <styleUrl>#place_College Academic Building</styleUrl>
        <Point>
          <coordinates>-71.12210915179602,42.36578780710847</coordinates>
        </Point>
      </Placemark>
      <Placemark id="1415392964000">
        <name><![CDATA[Floyd's 99 Barbershop]]></name>
        <atom:link href="http://foursquare.com/venue/4a9d711ff964a520443820e3"/>
        <description><![CDATA[<p>11/7/14<br/> 3:42 PM to 4:35 PM<br/> 52 min</p> <p>Salon / Barbershop<br/> <a href="http://foursquare.com/venue/4a9d711ff964a520443820e3">More details (Foursquare)</a> </p>]]></description>
        <TimeSpan>
          <begin>2014-11-07T15:42:45-05:00</begin>
          <end>2014-11-07T16:35:21-05:00</end>
        </TimeSpan>
        <styleUrl>#place_Salon / Barbershop</styleUrl>
        <Point>
          <coordinates>-71.11979826,42.38213717937469</coordinates>
        </Point>
      </Placemark>
      <Placemark id="1415397276000">
        <name><![CDATA[Home]]></name>
        <description><![CDATA[<p>11/7/14<br/> 4:54 PM to 6:00 PM<br/> 1:05 hours</p>]]></description>
        <TimeSpan>
          <begin>2014-11-07T16:54:37-05:00</begin>
          <end>2014-11-07T18:00:12-05:00</end>
        </TimeSpan>
        <styleUrl>#place_home</styleUrl>
        <Point>
          <coordinates>-71.1114458017,42.3754311174</coordinates>
        </Point>
      </Placemark>
      <Placemark id="1415401841000">
        <name><![CDATA[Ethan Bernstein Home]]></name>
        <description><![CDATA[<p>11/7/14<br/> 6:10 PM to 8:36 PM<br/> 2:26 hours</p>]]></description>
        <TimeSpan>
          <begin>2014-11-07T18:10:42-05:00</begin>
          <end>2014-11-07T20:36:58-05:00</end>
        </TimeSpan>
        <styleUrl>#place_home</styleUrl>
        <Point>
          <coordinates>-71.1130447028,42.3717835414</coordinates>
        </Point>
      </Placemark>
      <Placemark id="1415411322000">
        <name><![CDATA[Tasty Burger]]></name>
        <atom:link href="http://foursquare.com/venue/50ce07b5e4b0ed7c4302d2bc"/>
        <description><![CDATA[<p>11/7/14<br/> 8:48 PM to 12:00 AM<br/> 3:11 hours</p> <p>Burger Joint<br/> <a href="http://foursquare.com/venue/50ce07b5e4b0ed7c4302d2bc">More details (Foursquare)</a> </p>]]></description>
        <TimeSpan>
          <begin>2014-11-07T20:48:43-05:00</begin>
          <end>2014-11-07T23:59:59-05:00</end>
        </TimeSpan>
        <styleUrl>#place_Burger Joint</styleUrl>
        <Point>
          <coordinates>-71.12003183306106,42.37250286669323</coordinates>
        </Point>
      </Placemark>
    </Folder>
    <Folder>
      <name><![CDATA[11/8/14]]></name>
      <Placemark id="1415422800000">
        <name><![CDATA[Tasty Burger]]></name>
        <atom:link href="http://foursquare.com/venue/50ce07b5e4b0ed7c4302d2bc"/>
        <description><![CDATA[<p>11/8/14<br/> 12:00 AM to 1:03 AM<br/> 1:03 hours</p> <p>Burger Joint<br/> <a href="http://foursquare.com/venue/50ce07b5e4b0ed7c4302d2bc">More details (Foursquare)</a> </p>]]></description>
        <TimeSpan>
          <begin>2014-11-08T00:00:01-05:00</begin>
          <end>2014-11-08T01:03:02-05:00</end>
        </TimeSpan>
        <styleUrl>#place_Burger Joint</styleUrl>
        <Point>
          <coordinates>-71.12003183306106,42.37250286669323</coordinates>
        </Point>
      </Placemark>
      <Placemark id="1415426978000">
        <name><![CDATA[Daedalus]]></name>
        <atom:link href="http://foursquare.com/venue/44e1b94ff964a5201f371fe3"/>
        <description><![CDATA[<p>11/8/14<br/> 1:09 AM to 2:21 AM<br/> 1:11 hours</p> <p>Restaurant<br/> <a href="http://foursquare.com/venue/44e1b94ff964a5201f371fe3">More details (Foursquare)</a> </p>]]></description>
        <TimeSpan>
          <begin>2014-11-08T01:09:39-05:00</begin>
          <end>2014-11-08T02:21:31-05:00</end>
        </TimeSpan>
        <styleUrl>#place_Restaurant</styleUrl>
        <Point>
          <coordinates>-71.1165560717644,42.37134308090408</coordinates>
        </Point>
      </Placemark>
      <Placemark id="1415431601000">
        <name><![CDATA[Ethan Bernstein Home]]></name>
        <description><![CDATA[<p>11/8/14<br/> 2:26 AM to 2:51 AM<br/> 25 min</p>]]></description>
        <TimeSpan>
          <begin>2014-11-08T02:26:42-05:00</begin>
          <end>2014-11-08T02:51:42-05:00</end>
        </TimeSpan>
        <styleUrl>#place_home</styleUrl>
        <Point>
          <coordinates>-71.1130447028,42.3717835414</coordinates>
        </Point>
      </Placemark>
      <Placemark id="1415433498000">
        <name><![CDATA[Home]]></name>
        <description><![CDATA[<p>11/8/14<br/> 2:58 AM to 4:35 PM<br/> 13:37 hours</p>]]></description>
        <TimeSpan>
          <begin>2014-11-08T02:58:19-05:00</begin>
          <end>2014-11-08T16:35:49-05:00</end>
        </TimeSpan>
        <styleUrl>#place_home</styleUrl>
        <Point>
          <coordinates>-71.1114458017,42.3754311174</coordinates>
        </Point>
      </Placemark>
      <Placemark id="1415489462000">
        <name><![CDATA[Showcase Providence Place & IMAX]]></name>
        <atom:link href="http://foursquare.com/venue/4b303561f964a520caf724e3"/>
        <description><![CDATA[<p>11/8/14<br/> 6:31 PM to 9:34 PM<br/> 3:03 hours</p> <p>Multiplex<br/> <a href="http://foursquare.com/venue/4b303561f964a520caf724e3">More details (Foursquare)</a> </p>]]></description>
        <TimeSpan>
          <begin>2014-11-08T18:31:03-05:00</begin>
          <end>2014-11-08T21:34:23-05:00</end>
        </TimeSpan>
        <styleUrl>#place_Multiplex</styleUrl>
        <Point>
          <coordinates>-71.415854,41.827683</coordinates>
        </Point>
      </Placemark>
      <Placemark id="1415500923000">
        <name><![CDATA[Place in Providence Place Mall]]></name>
        <description><![CDATA[<p>11/8/14<br/> 9:42 PM to 9:51 PM<br/> 9 min</p>]]></description>
        <TimeSpan>
          <begin>2014-11-08T21:42:04-05:00</begin>
          <end>2014-11-08T21:51:02-05:00</end>
        </TimeSpan>
        <styleUrl>#place_unknown</styleUrl>
        <Point>
          <coordinates>-71.4167024169,41.8288273381</coordinates>
        </Point>
      </Placemark>
      <Placemark id="1415501611000">
        <name><![CDATA[Place in Providence]]></name>
        <description><![CDATA[<p>11/8/14<br/> 9:53 PM to 10:03 PM<br/> 9 min</p>]]></description>
        <TimeSpan>
          <begin>2014-11-08T21:53:32-05:00</begin>
          <end>2014-11-08T22:03:24-05:00</end>
        </TimeSpan>
        <styleUrl>#place_unknown</styleUrl>
        <Point>
          <coordinates>-71.4181449629,41.8279771792</coordinates>
        </Point>
      </Placemark>
      <Placemark id="1415506308000">
        <name><![CDATA[Home]]></name>
        <description><![CDATA[<p>11/8/14<br/> 11:11 PM to 12:00 AM<br/> 48 min</p>]]></description>
        <TimeSpan>
          <begin>2014-11-08T23:11:49-05:00</begin>
          <end>2014-11-08T23:59:59-05:00</end>
        </TimeSpan>
        <styleUrl>#place_home</styleUrl>
        <Point>
          <coordinates>-71.1114458017,42.3754311174</coordinates>
        </Point>
      </Placemark>
    </Folder>
    <Folder>
      <name><![CDATA[11/9/14]]></name>
      <Placemark id="1415509200000">
        <name><![CDATA[Home]]></name>
        <description><![CDATA[<p>11/9/14<br/> 12:00 AM to 11:42 AM<br/> 11:42 hours</p>]]></description>
        <TimeSpan>
          <begin>2014-11-09T00:00:01-05:00</begin>
          <end>2014-11-09T11:42:28-05:00</end>
        </TimeSpan>
        <styleUrl>#place_home</styleUrl>
        <Point>
          <coordinates>-71.1114458017,42.3754311174</coordinates>
        </Point>
      </Placemark>
      <Placemark id="1415552108000">
        <name><![CDATA[Park]]></name>
        <atom:link href="http://foursquare.com/venue/4f7c8902e4b032c26c6798db"/>
        <description><![CDATA[<p>11/9/14<br/> 11:55 AM to 12:45 PM<br/> 50 min</p> <p>Gastropub<br/> <a href="http://foursquare.com/venue/4f7c8902e4b032c26c6798db">More details (Foursquare)</a> </p>]]></description>
        <TimeSpan>
          <begin>2014-11-09T11:55:09-05:00</begin>
          <end>2014-11-09T12:45:49-05:00</end>
        </TimeSpan>
        <styleUrl>#place_Gastropub</styleUrl>
        <Point>
          <coordinates>-71.12097185013617,42.37169409933257</coordinates>
        </Point>
      </Placemark>
      <Placemark id="1415555907000">
        <name><![CDATA[Home]]></name>
        <description><![CDATA[<p>11/9/14<br/> 12:58 PM to 12:00 AM<br/> 11:01 hours</p>]]></description>
        <TimeSpan>
          <begin>2014-11-09T12:58:28-05:00</begin>
          <end>2014-11-09T23:59:59-05:00</end>
        </TimeSpan>
        <styleUrl>#place_home</styleUrl>
        <Point>
          <coordinates>-71.1114458017,42.3754311174</coordinates>
        </Point>
      </Placemark>
    </Folder>
    <Folder>
      <name><![CDATA[11/10/14]]></name>
      <Placemark id="1415595600000">
        <name><![CDATA[Home]]></name>
        <description><![CDATA[<p>11/10/14<br/> 12:00 AM to 7:37 AM<br/> 7:37 hours</p>]]></description>
        <TimeSpan>
          <begin>2014-11-10T00:00:01-05:00</begin>
          <end>2014-11-10T07:37:45-05:00</end>
        </TimeSpan>
        <styleUrl>#place_home</styleUrl>
        <Point>
          <coordinates>-71.1114458017,42.3754311174</coordinates>
        </Point>
      </Placemark>
      <Placemark id="1415624515000">
        <name><![CDATA[Aldrich Hall]]></name>
        <atom:link href="http://foursquare.com/venue/4ac64359f964a5206eb320e3"/>
        <description><![CDATA[<p>11/10/14<br/> 8:01 AM to 12:14 PM<br/> 4:12 hours</p> <p>College Academic Building<br/> <a href="http://foursquare.com/venue/4ac64359f964a5206eb320e3">More details (Foursquare)</a> </p>]]></description>
        <TimeSpan>
          <begin>2014-11-10T08:01:56-05:00</begin>
          <end>2014-11-10T12:14:33-05:00</end>
        </TimeSpan>
        <styleUrl>#place_College Academic Building</styleUrl>
        <Point>
          <coordinates>-71.12210915179602,42.36578780710847</coordinates>
        </Point>
      </Placemark>
      <Placemark id="1415641536000">
        <name><![CDATA[Home]]></name>
        <description><![CDATA[<p>11/10/14<br/> 12:45 PM to 6:59 PM<br/> 6:14 hours</p>]]></description>
        <TimeSpan>
          <begin>2014-11-10T12:45:37-05:00</begin>
          <end>2014-11-10T18:59:43-05:00</end>
        </TimeSpan>
        <styleUrl>#place_home</styleUrl>
        <Point>
          <coordinates>-71.1114458017,42.3754311174</coordinates>
        </Point>
      </Placemark>
      <Placemark id="1415664770000">
        <name><![CDATA[Tasty Burger]]></name>
        <atom:link href="http://foursquare.com/venue/50ce07b5e4b0ed7c4302d2bc"/>
        <description><![CDATA[<p>11/10/14<br/> 7:12 PM to 11:33 PM<br/> 4:20 hours</p> <p>Burger Joint<br/> <a href="http://foursquare.com/venue/50ce07b5e4b0ed7c4302d2bc">More details (Foursquare)</a> </p>]]></description>
        <TimeSpan>
          <begin>2014-11-10T19:12:51-05:00</begin>
          <end>2014-11-10T23:33:43-05:00</end>
        </TimeSpan>
        <styleUrl>#place_Burger Joint</styleUrl>
        <Point>
          <coordinates>-71.12003183306106,42.37250286669323</coordinates>
        </Point>
      </Placemark>
      <Placemark id="1415681241000">
        <name><![CDATA[Home]]></name>
        <description><![CDATA[<p>11/10/14<br/> 11:47 PM to 12:00 AM<br/> 12 min</p>]]></description>
        <TimeSpan>
          <begin>2014-11-10T23:47:22-05:00</begin>
          <end>2014-11-10T23:59:59-05:00</end>
        </TimeSpan>
        <styleUrl>#place_home</styleUrl>
        <Point>
          <coordinates>-71.1114458017,42.3754311174</coordinates>
        </Point>
      </Placemark>
    </Folder>
    <Folder>
      <name><![CDATA[11/11/14]]></name>
      <Placemark id="1415682000000">
        <name><![CDATA[Home]]></name>
        <description><![CDATA[<p>11/11/14<br/> 12:00 AM to 2:03 PM<br/> 14:03 hours</p>]]></description>
        <TimeSpan>
          <begin>2014-11-11T00:00:01-05:00</begin>
          <end>2014-11-11T14:03:36-05:00</end>
        </TimeSpan>
        <styleUrl>#place_home</styleUrl>
        <Point>
          <coordinates>-71.1114458017,42.3754311174</coordinates>
        </Point>
      </Placemark>
      <Placemark id="1415734153000">
        <name><![CDATA[Michaels]]></name>
        <atom:link href="http://foursquare.com/venue/505dbfcee4b02c96b410cb99"/>
        <description><![CDATA[<p>11/11/14<br/> 2:29 PM to 3:04 PM<br/> 34 min</p> <p>Arts & Crafts Store<br/> <a href="http://foursquare.com/venue/505dbfcee4b02c96b410cb99">More details (Foursquare)</a> </p>]]></description>
        <TimeSpan>
          <begin>2014-11-11T14:29:14-05:00</begin>
          <end>2014-11-11T15:04:04-05:00</end>
        </TimeSpan>
        <styleUrl>#place_Arts &amp; Crafts Store</styleUrl>
        <Point>
          <coordinates>-71.117966,42.389114</coordinates>
        </Point>
      </Placemark>
      <Placemark id="1415737696000">
        <name><![CDATA[Home]]></name>
        <description><![CDATA[<p>11/11/14<br/> 3:28 PM to 10:27 PM<br/> 6:59 hours</p>]]></description>
        <TimeSpan>
          <begin>2014-11-11T15:28:17-05:00</begin>
          <end>2014-11-11T22:27:29-05:00</end>
        </TimeSpan>
        <styleUrl>#place_home</styleUrl>
        <Point>
          <coordinates>-71.1114458017,42.3754311174</coordinates>
        </Point>
      </Placemark>
      <Placemark id="1415763948000">
        <name><![CDATA[Home]]></name>
        <description><![CDATA[<p>11/11/14<br/> 10:45 PM to 12:00 AM<br/> 1:14 hours</p>]]></description>
        <TimeSpan>
          <begin>2014-11-11T22:45:49-05:00</begin>
          <end>2014-11-11T23:59:59-05:00</end>
        </TimeSpan>
        <styleUrl>#place_home</styleUrl>
        <Point>
          <coordinates>-71.1114458017,42.3754311174</coordinates>
        </Point>
      </Placemark>
    </Folder>
    <Folder>
      <name><![CDATA[11/12/14]]></name>
      <Placemark id="1415768400000">
        <name><![CDATA[Home]]></name>
        <description><![CDATA[<p>11/12/14<br/> 12:00 AM to 7:43 AM<br/> 7:43 hours</p>]]></description>
        <TimeSpan>
          <begin>2014-11-12T00:00:01-05:00</begin>
          <end>2014-11-12T07:43:56-05:00</end>
        </TimeSpan>
        <styleUrl>#place_home</styleUrl>
        <Point>
          <coordinates>-71.1114458017,42.3754311174</coordinates>
        </Point>
      </Placemark>
      <Placemark id="1415797741000">
        <name><![CDATA[Spangler Center]]></name>
        <atom:link href="http://foursquare.com/venue/4aeee0b0f964a52081d421e3"/>
        <description><![CDATA[<p>11/12/14<br/> 8:09 AM to 8:56 AM<br/> 47 min</p> <p>Student Center<br/> <a href="http://foursquare.com/venue/4aeee0b0f964a52081d421e3">More details (Foursquare)</a> </p>]]></description>
        <TimeSpan>
          <begin>2014-11-12T08:09:02-05:00</begin>
          <end>2014-11-12T08:56:34-05:00</end>
        </TimeSpan>
        <styleUrl>#place_Student Center</styleUrl>
        <Point>
          <coordinates>-71.12218458495514,42.36522543920124</coordinates>
        </Point>
      </Placemark>
      <Placemark id="1415800861000">
        <name><![CDATA[Aldrich Hall]]></name>
        <atom:link href="http://foursquare.com/venue/4ac64359f964a5206eb320e3"/>
        <description><![CDATA[<p>11/12/14<br/> 9:01 AM to 4:25 PM<br/> 7:24 hours</p> <p>College Academic Building<br/> <a href="http://foursquare.com/venue/4ac64359f964a5206eb320e3">More details (Foursquare)</a> </p>]]></description>
        <TimeSpan>
          <begin>2014-11-12T09:01:02-05:00</begin>
          <end>2014-11-12T16:25:56-05:00</end>
        </TimeSpan>
        <styleUrl>#place_College Academic Building</styleUrl>
        <Point>
          <coordinates>-71.12210915179602,42.36578780710847</coordinates>
        </Point>
      </Placemark>
      <Placemark id="1415832820000">
        <name><![CDATA[Impact Hub Boston]]></name>
        <atom:link href="http://foursquare.com/venue/535ef432498eb46f6389ecf5"/>
        <description><![CDATA[<p>11/12/14<br/> 5:53 PM to 6:52 PM<br/> 59 min</p> <p>Community Center<br/> <a href="http://foursquare.com/venue/535ef432498eb46f6389ecf5">More details (Foursquare)</a> </p>]]></description>
        <TimeSpan>
          <begin>2014-11-12T17:53:41-05:00</begin>
          <end>2014-11-12T18:52:54-05:00</end>
        </TimeSpan>
        <styleUrl>#place_Community Center</styleUrl>
        <Point>
          <coordinates>-71.05773051318191,42.3568123867606</coordinates>
        </Point>
      </Placemark>
      <Placemark id="1415836533000">
        <name><![CDATA[Place in Dock Square]]></name>
        <description><![CDATA[<p>11/12/14<br/> 6:55 PM to 7:09 PM<br/> 14 min</p>]]></description>
        <TimeSpan>
          <begin>2014-11-12T18:55:34-05:00</begin>
          <end>2014-11-12T19:09:32-05:00</end>
        </TimeSpan>
        <styleUrl>#place_unknown</styleUrl>
        <Point>
          <coordinates>-71.0570839524,42.3555794765</coordinates>
        </Point>
      </Placemark>
      <Placemark id="1415838556000">
        <name><![CDATA[Aldrich 007]]></name>
        <atom:link href="http://foursquare.com/venue/4f26a4c1e4b0717a6a95ebb2"/>
        <description><![CDATA[<p>11/12/14<br/> 7:29 PM to 8:04 PM<br/> 35 min</p> <p>College Classroom<br/> <a href="http://foursquare.com/venue/4f26a4c1e4b0717a6a95ebb2">More details (Foursquare)</a> </p>]]></description>
        <TimeSpan>
          <begin>2014-11-12T19:29:17-05:00</begin>
          <end>2014-11-12T20:04:50-05:00</end>
        </TimeSpan>
        <styleUrl>#place_College Classroom</styleUrl>
        <Point>
          <coordinates>-71.12248051490364,42.36595739324783</coordinates>
        </Point>
      </Placemark>
      <Placemark id="1415840986000">
        <name><![CDATA[Place in Allston]]></name>
        <description><![CDATA[<p>11/12/14<br/> 8:09 PM to 9:18 PM<br/> 1:09 hours</p>]]></description>
        <TimeSpan>
          <begin>2014-11-12T20:09:47-05:00</begin>
          <end>2014-11-12T21:18:45-05:00</end>
        </TimeSpan>
        <styleUrl>#place_unknown</styleUrl>
        <Point>
          <coordinates>-71.1240390179,42.3675664776</coordinates>
        </Point>
      </Placemark>
      <Placemark id="1415846117000">
        <name><![CDATA[Border Cafe]]></name>
        <atom:link href="http://foursquare.com/venue/3fd66200f964a520bded1ee3"/>
        <description><![CDATA[<p>11/12/14<br/> 9:35 PM to 12:00 AM<br/> 2:24 hours</p> <p>Mexican Restaurant<br/> <a href="http://foursquare.com/venue/3fd66200f964a520bded1ee3">More details (Foursquare)</a> </p>]]></description>
        <TimeSpan>
          <begin>2014-11-12T21:35:18-05:00</begin>
          <end>2014-11-12T23:59:59-05:00</end>
        </TimeSpan>
        <styleUrl>#place_Mexican Restaurant</styleUrl>
        <Point>
          <coordinates>-71.120141,42.3743468</coordinates>
        </Point>
      </Placemark>
    </Folder>
    <Folder>
      <name><![CDATA[11/13/14]]></name>
      <Placemark id="1415854800000">
        <name><![CDATA[Border Cafe]]></name>
        <atom:link href="http://foursquare.com/venue/3fd66200f964a520bded1ee3"/>
        <description><![CDATA[<p>11/13/14<br/> 12:00 AM to 12:08 AM<br/> 8 min</p> <p>Mexican Restaurant<br/> <a href="http://foursquare.com/venue/3fd66200f964a520bded1ee3">More details (Foursquare)</a> </p>]]></description>
        <TimeSpan>
          <begin>2014-11-13T00:00:01-05:00</begin>
          <end>2014-11-13T00:08:45-05:00</end>
        </TimeSpan>
        <styleUrl>#place_Mexican Restaurant</styleUrl>
        <Point>
          <coordinates>-71.120141,42.3743468</coordinates>
        </Point>
      </Placemark>
      <Placemark id="1415856210000">
        <name><![CDATA[Home]]></name>
        <description><![CDATA[<p>11/13/14<br/> 12:23 AM to 7:42 AM<br/> 7:19 hours</p>]]></description>
        <TimeSpan>
          <begin>2014-11-13T00:23:31-05:00</begin>
          <end>2014-11-13T07:42:56-05:00</end>
        </TimeSpan>
        <styleUrl>#place_home</styleUrl>
        <Point>
          <coordinates>-71.1114458017,42.3754311174</coordinates>
        </Point>
      </Placemark>
      <Placemark id="1415883905000">
        <name><![CDATA[Aldrich Hall]]></name>
        <atom:link href="http://foursquare.com/venue/4ac64359f964a5206eb320e3"/>
        <description><![CDATA[<p>11/13/14<br/> 8:05 AM to 12:16 PM<br/> 4:11 hours</p> <p>College Academic Building<br/> <a href="http://foursquare.com/venue/4ac64359f964a5206eb320e3">More details (Foursquare)</a> </p>]]></description>
        <TimeSpan>
          <begin>2014-11-13T08:05:06-05:00</begin>
          <end>2014-11-13T12:16:41-05:00</end>
        </TimeSpan>
        <styleUrl>#place_College Academic Building</styleUrl>
        <Point>
          <coordinates>-71.12210915179602,42.36578780710847</coordinates>
        </Point>
      </Placemark>
      <Placemark id="1415900388000">
        <name><![CDATA[Home]]></name>
        <description><![CDATA[<p>11/13/14<br/> 12:39 PM to 1:15 PM<br/> 35 min</p>]]></description>
        <TimeSpan>
          <begin>2014-11-13T12:39:49-05:00</begin>
          <end>2014-11-13T13:15:37-05:00</end>
        </TimeSpan>
        <styleUrl>#place_home</styleUrl>
        <Point>
          <coordinates>-71.1114458017,42.3754311174</coordinates>
        </Point>
      </Placemark>
      <Placemark id="1415903180000">
        <name><![CDATA[Petsi Pies]]></name>
        <atom:link href="http://foursquare.com/venue/49f9f896f964a5209f6d1fe3"/>
        <description><![CDATA[<p>11/13/14<br/> 1:26 PM to 2:02 PM<br/> 35 min</p> <p>Coffee Shop<br/> <a href="http://foursquare.com/venue/49f9f896f964a5209f6d1fe3">More details (Foursquare)</a> </p>]]></description>
        <TimeSpan>
          <begin>2014-11-13T13:26:21-05:00</begin>
          <end>2014-11-13T14:02:03-05:00</end>
        </TimeSpan>
        <styleUrl>#place_Coffee Shop</styleUrl>
        <Point>
          <coordinates>-71.11353635787964,42.36892873750989</coordinates>
        </Point>
      </Placemark>
      <Placemark id="1415906017000">
        <name><![CDATA[Home]]></name>
        <description><![CDATA[<p>11/13/14<br/> 2:13 PM to 4:33 PM<br/> 2:19 hours</p>]]></description>
        <TimeSpan>
          <begin>2014-11-13T14:13:38-05:00</begin>
          <end>2014-11-13T16:33:22-05:00</end>
        </TimeSpan>
        <styleUrl>#place_home</styleUrl>
        <Point>
          <coordinates>-71.1114458017,42.3754311174</coordinates>
        </Point>
      </Placemark>
    </Folder>
  </Document>
</kml>
