<?xml version="1.0" encoding="UTF-8"?><kml xmlns="http://www.opengis.net/kml/2.2" xmlns:gx="http://www.google.com/kml/ext/2.2" xmlns:atom="http://www.w3.org/2005/Atom" xmlns:xal="urn:oasis:names:tc:ciq:xsdschema:xAL:2.0" xmlns:xsi="http://www.w3.org/2001/XMLSchema-instance">
  <Document>
    <atom:link href="http://www.moves-app.com"/>
    <description><![CDATA[<p align="center"><a href="http://www.moves-app.com"> <img src="http://www.moves-app.com/assets/moves.png"/> </a></p> <p align="center">Moves Storyline</p>]]></description>
    <Style id="place_Liquor Store">
      <IconStyle>
        <scale>1.0</scale>
        <heading>0.0</heading>
        <Icon>
          <href>https://ss1.4sqi.net/img/categories/shops/default.png</href>
          <refreshInterval>0.0</refreshInterval>
          <viewRefreshTime>0.0</viewRefreshTime>
          <viewBoundScale>0.0</viewBoundScale>
        </Icon>
      </IconStyle>
    </Style>
    <Style id="place_Gym">
      <IconStyle>
        <scale>1.0</scale>
        <heading>0.0</heading>
        <Icon>
          <href>https://ss1.4sqi.net/img/categories/building/gym.png</href>
          <refreshInterval>0.0</refreshInterval>
          <viewRefreshTime>0.0</viewRefreshTime>
          <viewBoundScale>0.0</viewBoundScale>
        </Icon>
      </IconStyle>
    </Style>
    <Style id="place_Mexican Restaurant">
      <IconStyle>
        <scale>1.0</scale>
        <heading>0.0</heading>
        <Icon>
          <href>https://ss1.4sqi.net/img/categories/food/mexican.png</href>
          <refreshInterval>0.0</refreshInterval>
          <viewRefreshTime>0.0</viewRefreshTime>
          <viewBoundScale>0.0</viewBoundScale>
        </Icon>
      </IconStyle>
    </Style>
    <Style id="place_Paper / Office Supplies Store">
      <IconStyle>
        <scale>1.0</scale>
        <heading>0.0</heading>
        <Icon>
          <href>https://ss1.4sqi.net/img/categories/shops/papergoods.png</href>
          <refreshInterval>0.0</refreshInterval>
          <viewRefreshTime>0.0</viewRefreshTime>
          <viewBoundScale>0.0</viewBoundScale>
        </Icon>
      </IconStyle>
    </Style>
    <Style id="place_Hotel">
      <IconStyle>
        <scale>1.0</scale>
        <heading>0.0</heading>
        <Icon>
          <href>https://ss1.4sqi.net/img/categories/travel/hotel.png</href>
          <refreshInterval>0.0</refreshInterval>
          <viewRefreshTime>0.0</viewRefreshTime>
          <viewBoundScale>0.0</viewBoundScale>
        </Icon>
      </IconStyle>
    </Style>
    <Style id="place_College Residence Hall">
      <IconStyle>
        <scale>1.0</scale>
        <heading>0.0</heading>
        <Icon>
          <href>https://ss1.4sqi.net/img/categories/education/default.png</href>
          <refreshInterval>0.0</refreshInterval>
          <viewRefreshTime>0.0</viewRefreshTime>
          <viewBoundScale>0.0</viewBoundScale>
        </Icon>
      </IconStyle>
    </Style>
    <Style id="place_school">
      <IconStyle>
        <scale>1.0</scale>
        <heading>0.0</heading>
        <Icon>
          <href>http://ss1.4sqi.net/img/categories/building/school.png</href>
          <refreshInterval>0.0</refreshInterval>
          <viewRefreshTime>0.0</viewRefreshTime>
          <viewBoundScale>0.0</viewBoundScale>
        </Icon>
      </IconStyle>
    </Style>
    <Style id="place_Arepa Restaurant">
      <IconStyle>
        <scale>1.0</scale>
        <heading>0.0</heading>
        <Icon>
          <href>https://ss1.4sqi.net/img/categories/food/default.png</href>
          <refreshInterval>0.0</refreshInterval>
          <viewRefreshTime>0.0</viewRefreshTime>
          <viewBoundScale>0.0</viewBoundScale>
        </Icon>
      </IconStyle>
    </Style>
    <Style id="place_Electronics Store">
      <IconStyle>
        <scale>1.0</scale>
        <heading>0.0</heading>
        <Icon>
          <href>https://ss1.4sqi.net/img/categories/shops/technology.png</href>
          <refreshInterval>0.0</refreshInterval>
          <viewRefreshTime>0.0</viewRefreshTime>
          <viewBoundScale>0.0</viewBoundScale>
        </Icon>
      </IconStyle>
    </Style>
    <Style id="place_College Technology Building">
      <IconStyle>
        <scale>1.0</scale>
        <heading>0.0</heading>
        <Icon>
          <href>https://ss1.4sqi.net/img/categories/education/default.png</href>
          <refreshInterval>0.0</refreshInterval>
          <viewRefreshTime>0.0</viewRefreshTime>
          <viewBoundScale>0.0</viewBoundScale>
        </Icon>
      </IconStyle>
    </Style>
    <Style id="place_Supermarket">
      <IconStyle>
        <scale>1.0</scale>
        <heading>0.0</heading>
        <Icon>
          <href>https://ss1.4sqi.net/img/categories/shops/food_grocery.png</href>
          <refreshInterval>0.0</refreshInterval>
          <viewRefreshTime>0.0</viewRefreshTime>
          <viewBoundScale>0.0</viewBoundScale>
        </Icon>
      </IconStyle>
    </Style>
    <Style id="place_Pub">
      <IconStyle>
        <scale>1.0</scale>
        <heading>0.0</heading>
        <Icon>
          <href>https://ss1.4sqi.net/img/categories/nightlife/pub.png</href>
          <refreshInterval>0.0</refreshInterval>
          <viewRefreshTime>0.0</viewRefreshTime>
          <viewBoundScale>0.0</viewBoundScale>
        </Icon>
      </IconStyle>
    </Style>
    <Style id="place_Coffee Shop">
      <IconStyle>
        <scale>1.0</scale>
        <heading>0.0</heading>
        <Icon>
          <href>https://ss1.4sqi.net/img/categories/food/coffeeshop.png</href>
          <refreshInterval>0.0</refreshInterval>
          <viewRefreshTime>0.0</viewRefreshTime>
          <viewBoundScale>0.0</viewBoundScale>
        </Icon>
      </IconStyle>
    </Style>
    <Style id="place_American Restaurant">
      <IconStyle>
        <scale>1.0</scale>
        <heading>0.0</heading>
        <Icon>
          <href>https://ss1.4sqi.net/img/categories/food/default.png</href>
          <refreshInterval>0.0</refreshInterval>
          <viewRefreshTime>0.0</viewRefreshTime>
          <viewBoundScale>0.0</viewBoundScale>
        </Icon>
      </IconStyle>
    </Style>
    <Style id="place_College Administrative Building">
      <IconStyle>
        <scale>1.0</scale>
        <heading>0.0</heading>
        <Icon>
          <href>https://ss1.4sqi.net/img/categories/education/default.png</href>
          <refreshInterval>0.0</refreshInterval>
          <viewRefreshTime>0.0</viewRefreshTime>
          <viewBoundScale>0.0</viewBoundScale>
        </Icon>
      </IconStyle>
    </Style>
    <Style id="place_work">
      <IconStyle>
        <scale>1.0</scale>
        <heading>0.0</heading>
        <Icon>
          <href>http://ss1.4sqi.net/img/categories/building/default.png</href>
          <refreshInterval>0.0</refreshInterval>
          <viewRefreshTime>0.0</viewRefreshTime>
          <viewBoundScale>0.0</viewBoundScale>
        </Icon>
      </IconStyle>
    </Style>
    <Style id="place_user">
      <IconStyle>
        <scale>1.0</scale>
        <heading>0.0</heading>
        <Icon>
          <href>http://maps.google.com/mapfiles/marker_white.png</href>
          <refreshInterval>0.0</refreshInterval>
          <viewRefreshTime>0.0</viewRefreshTime>
          <viewBoundScale>0.0</viewBoundScale>
        </Icon>
      </IconStyle>
    </Style>
    <Style id="place_Rental Car Location">
      <IconStyle>
        <scale>1.0</scale>
        <heading>0.0</heading>
        <Icon>
          <href>https://ss1.4sqi.net/img/categories/travel/airport_rentalcar.png</href>
          <refreshInterval>0.0</refreshInterval>
          <viewRefreshTime>0.0</viewRefreshTime>
          <viewBoundScale>0.0</viewBoundScale>
        </Icon>
      </IconStyle>
    </Style>
    <Style id="place_Nightclub">
      <IconStyle>
        <scale>1.0</scale>
        <heading>0.0</heading>
        <Icon>
          <href>https://ss1.4sqi.net/img/categories/nightlife/danceparty.png</href>
          <refreshInterval>0.0</refreshInterval>
          <viewRefreshTime>0.0</viewRefreshTime>
          <viewBoundScale>0.0</viewBoundScale>
        </Icon>
      </IconStyle>
    </Style>
    <Style id="place_Gastropub">
      <IconStyle>
        <scale>1.0</scale>
        <heading>0.0</heading>
        <Icon>
          <href>https://ss1.4sqi.net/img/categories/food/default.png</href>
          <refreshInterval>0.0</refreshInterval>
          <viewRefreshTime>0.0</viewRefreshTime>
          <viewBoundScale>0.0</viewBoundScale>
        </Icon>
      </IconStyle>
    </Style>
    <Style id="place_College Academic Building">
      <IconStyle>
        <scale>1.0</scale>
        <heading>0.0</heading>
        <Icon>
          <href>https://ss1.4sqi.net/img/categories/education/default.png</href>
          <refreshInterval>0.0</refreshInterval>
          <viewRefreshTime>0.0</viewRefreshTime>
          <viewBoundScale>0.0</viewBoundScale>
        </Icon>
      </IconStyle>
    </Style>
    <Style id="place_Salon / Barbershop">
      <IconStyle>
        <scale>1.0</scale>
        <heading>0.0</heading>
        <Icon>
          <href>https://ss1.4sqi.net/img/categories/shops/salon_barber.png</href>
          <refreshInterval>0.0</refreshInterval>
          <viewRefreshTime>0.0</viewRefreshTime>
          <viewBoundScale>0.0</viewBoundScale>
        </Icon>
      </IconStyle>
    </Style>
    <Style id="place_College Gym">
      <IconStyle>
        <scale>1.0</scale>
        <heading>0.0</heading>
        <Icon>
          <href>https://ss1.4sqi.net/img/categories/education/gym.png</href>
          <refreshInterval>0.0</refreshInterval>
          <viewRefreshTime>0.0</viewRefreshTime>
          <viewBoundScale>0.0</viewBoundScale>
        </Icon>
      </IconStyle>
    </Style>
    <Style id="place_foursquare">
      <IconStyle>
        <scale>1.0</scale>
        <heading>0.0</heading>
        <Icon>
          <href>http://maps.google.com/mapfiles/marker_white.png</href>
          <refreshInterval>0.0</refreshInterval>
          <viewRefreshTime>0.0</viewRefreshTime>
          <viewBoundScale>0.0</viewBoundScale>
        </Icon>
      </IconStyle>
    </Style>
    <Style id="place_Jazz Club">
      <IconStyle>
        <scale>1.0</scale>
        <heading>0.0</heading>
        <Icon>
          <href>https://ss1.4sqi.net/img/categories/arts_entertainment/musicvenue.png</href>
          <refreshInterval>0.0</refreshInterval>
          <viewRefreshTime>0.0</viewRefreshTime>
          <viewBoundScale>0.0</viewBoundScale>
        </Icon>
      </IconStyle>
    </Style>
    <Style id="place_Tech Startup">
      <IconStyle>
        <scale>1.0</scale>
        <heading>0.0</heading>
        <Icon>
          <href>https://ss1.4sqi.net/img/categories/shops/technology.png</href>
          <refreshInterval>0.0</refreshInterval>
          <viewRefreshTime>0.0</viewRefreshTime>
          <viewBoundScale>0.0</viewBoundScale>
        </Icon>
      </IconStyle>
    </Style>
    <Style id="place_Post Office">
      <IconStyle>
        <scale>1.0</scale>
        <heading>0.0</heading>
        <Icon>
          <href>https://ss1.4sqi.net/img/categories/building/postoffice.png</href>
          <refreshInterval>0.0</refreshInterval>
          <viewRefreshTime>0.0</viewRefreshTime>
          <viewBoundScale>0.0</viewBoundScale>
        </Icon>
      </IconStyle>
    </Style>
    <Style id="place_Grocery Store">
      <IconStyle>
        <scale>1.0</scale>
        <heading>0.0</heading>
        <Icon>
          <href>https://ss1.4sqi.net/img/categories/shops/food_grocery.png</href>
          <refreshInterval>0.0</refreshInterval>
          <viewRefreshTime>0.0</viewRefreshTime>
          <viewBoundScale>0.0</viewBoundScale>
        </Icon>
      </IconStyle>
    </Style>
    <Style id="place_Bus Line">
      <IconStyle>
        <scale>1.0</scale>
        <heading>0.0</heading>
        <Icon>
          <href>https://ss1.4sqi.net/img/categories/travel/busstation.png</href>
          <refreshInterval>0.0</refreshInterval>
          <viewRefreshTime>0.0</viewRefreshTime>
          <viewBoundScale>0.0</viewBoundScale>
        </Icon>
      </IconStyle>
    </Style>
    <Style id="place_Department Store">
      <IconStyle>
        <scale>1.0</scale>
        <heading>0.0</heading>
        <Icon>
          <href>https://ss1.4sqi.net/img/categories/shops/default.png</href>
          <refreshInterval>0.0</refreshInterval>
          <viewRefreshTime>0.0</viewRefreshTime>
          <viewBoundScale>0.0</viewBoundScale>
        </Icon>
      </IconStyle>
    </Style>
    <Style id="place_Café">
      <IconStyle>
        <scale>1.0</scale>
        <heading>0.0</heading>
        <Icon>
          <href>https://ss1.4sqi.net/img/categories/food/cafe.png</href>
          <refreshInterval>0.0</refreshInterval>
          <viewRefreshTime>0.0</viewRefreshTime>
          <viewBoundScale>0.0</viewBoundScale>
        </Icon>
      </IconStyle>
    </Style>
    <Style id="place_unknown">
      <IconStyle>
        <scale>1.0</scale>
        <heading>0.0</heading>
        <Icon>
          <href>http://maps.google.com/mapfiles/marker_white.png</href>
          <refreshInterval>0.0</refreshInterval>
          <viewRefreshTime>0.0</viewRefreshTime>
          <viewBoundScale>0.0</viewBoundScale>
        </Icon>
      </IconStyle>
    </Style>
    <Style id="place_Ramen / Noodle House">
      <IconStyle>
        <scale>1.0</scale>
        <heading>0.0</heading>
        <Icon>
          <href>https://ss1.4sqi.net/img/categories/food/ramen.png</href>
          <refreshInterval>0.0</refreshInterval>
          <viewRefreshTime>0.0</viewRefreshTime>
          <viewBoundScale>0.0</viewBoundScale>
        </Icon>
      </IconStyle>
    </Style>
    <Style id="place_Southern / Soul Food Restaurant">
      <IconStyle>
        <scale>1.0</scale>
        <heading>0.0</heading>
        <Icon>
          <href>https://ss1.4sqi.net/img/categories/food/southern.png</href>
          <refreshInterval>0.0</refreshInterval>
          <viewRefreshTime>0.0</viewRefreshTime>
          <viewBoundScale>0.0</viewBoundScale>
        </Icon>
      </IconStyle>
    </Style>
    <Style id="place_Airport">
      <IconStyle>
        <scale>1.0</scale>
        <heading>0.0</heading>
        <Icon>
          <href>https://ss1.4sqi.net/img/categories/travel/airport.png</href>
          <refreshInterval>0.0</refreshInterval>
          <viewRefreshTime>0.0</viewRefreshTime>
          <viewBoundScale>0.0</viewBoundScale>
        </Icon>
      </IconStyle>
    </Style>
    <Style id="place_Drugstore / Pharmacy">
      <IconStyle>
        <scale>1.0</scale>
        <heading>0.0</heading>
        <Icon>
          <href>https://ss1.4sqi.net/img/categories/shops/drugstore.png</href>
          <refreshInterval>0.0</refreshInterval>
          <viewRefreshTime>0.0</viewRefreshTime>
          <viewBoundScale>0.0</viewBoundScale>
        </Icon>
      </IconStyle>
    </Style>
    <Style id="place_home">
      <IconStyle>
        <scale>1.0</scale>
        <heading>0.0</heading>
        <Icon>
          <href>http://ss1.4sqi.net/img/categories/building/home.png</href>
          <refreshInterval>0.0</refreshInterval>
          <viewRefreshTime>0.0</viewRefreshTime>
          <viewBoundScale>0.0</viewBoundScale>
        </Icon>
      </IconStyle>
    </Style>
    <Style id="place_Office">
      <IconStyle>
        <scale>1.0</scale>
        <heading>0.0</heading>
        <Icon>
          <href>https://ss1.4sqi.net/img/categories/building/default.png</href>
          <refreshInterval>0.0</refreshInterval>
          <viewRefreshTime>0.0</viewRefreshTime>
          <viewBoundScale>0.0</viewBoundScale>
        </Icon>
      </IconStyle>
    </Style>
    <Style id="place_New American Restaurant">
      <IconStyle>
        <scale>1.0</scale>
        <heading>0.0</heading>
        <Icon>
          <href>https://ss1.4sqi.net/img/categories/food/default.png</href>
          <refreshInterval>0.0</refreshInterval>
          <viewRefreshTime>0.0</viewRefreshTime>
          <viewBoundScale>0.0</viewBoundScale>
        </Icon>
      </IconStyle>
    </Style>
    <Style id="place_Subway">
      <IconStyle>
        <scale>1.0</scale>
        <heading>0.0</heading>
        <Icon>
          <href>https://ss1.4sqi.net/img/categories/travel/subway.png</href>
          <refreshInterval>0.0</refreshInterval>
          <viewRefreshTime>0.0</viewRefreshTime>
          <viewBoundScale>0.0</viewBoundScale>
        </Icon>
      </IconStyle>
    </Style>
    <Style id="place_Bus Station">
      <IconStyle>
        <scale>1.0</scale>
        <heading>0.0</heading>
        <Icon>
          <href>https://ss1.4sqi.net/img/categories/travel/busstation.png</href>
          <refreshInterval>0.0</refreshInterval>
          <viewRefreshTime>0.0</viewRefreshTime>
          <viewBoundScale>0.0</viewBoundScale>
        </Icon>
      </IconStyle>
    </Style>
    <Style id="place_Student Center">
      <IconStyle>
        <scale>1.0</scale>
        <heading>0.0</heading>
        <Icon>
          <href>https://ss1.4sqi.net/img/categories/education/default.png</href>
          <refreshInterval>0.0</refreshInterval>
          <viewRefreshTime>0.0</viewRefreshTime>
          <viewBoundScale>0.0</viewBoundScale>
        </Icon>
      </IconStyle>
    </Style>
    <Folder>
      <name><![CDATA[9/1/14]]></name>
      <Placemark id="1409544000000">
        <name><![CDATA[Home]]></name>
        <description><![CDATA[<p>9/1/14<br/> 12:00 AM to 3:04 PM<br/> 15:04 hours</p>]]></description>
        <TimeSpan>
          <begin>2014-09-01T00:00:01-04:00</begin>
          <end>2014-09-01T15:04:32-04:00</end>
        </TimeSpan>
        <styleUrl>#place_home</styleUrl>
        <Point>
          <coordinates>-71.1114458017,42.3754311174</coordinates>
        </Point>
      </Placemark>
      <Placemark id="1409601024000">
        <name><![CDATA[Whole Foods Market]]></name>
        <atom:link href="http://foursquare.com/venue/4a5498d4f964a52026b31fe3"/>
        <description><![CDATA[<p>9/1/14<br/> 3:50 PM to 4:46 PM<br/> 56 min</p> <p>Supermarket<br/> <a href="http://foursquare.com/venue/4a5498d4f964a52026b31fe3">More details (Foursquare)</a> </p>]]></description>
        <TimeSpan>
          <begin>2014-09-01T15:50:25-04:00</begin>
          <end>2014-09-01T16:46:32-04:00</end>
        </TimeSpan>
        <styleUrl>#place_Supermarket</styleUrl>
        <Point>
          <coordinates>-71.114178,42.36137</coordinates>
        </Point>
      </Placemark>
      <Placemark id="1409605703000">
        <name><![CDATA[Home]]></name>
        <description><![CDATA[<p>9/1/14<br/> 5:08 PM to 7:03 PM<br/> 1:55 hours</p>]]></description>
        <TimeSpan>
          <begin>2014-09-01T17:08:24-04:00</begin>
          <end>2014-09-01T19:03:44-04:00</end>
        </TimeSpan>
        <styleUrl>#place_home</styleUrl>
        <Point>
          <coordinates>-71.1114458017,42.3754311174</coordinates>
        </Point>
      </Placemark>
      <Placemark id="1409613309000">
        <name><![CDATA[CVS/pharmacy]]></name>
        <atom:link href="http://foursquare.com/venue/49df6a3ff964a520c6601fe3"/>
        <description><![CDATA[<p>9/1/14<br/> 7:15 PM to 7:19 PM<br/> 4 min</p> <p>Drugstore / Pharmacy<br/> <a href="http://foursquare.com/venue/49df6a3ff964a520c6601fe3">More details (Foursquare)</a> </p>]]></description>
        <TimeSpan>
          <begin>2014-09-01T19:15:10-04:00</begin>
          <end>2014-09-01T19:19:56-04:00</end>
        </TimeSpan>
        <styleUrl>#place_Drugstore / Pharmacy</styleUrl>
        <Point>
          <coordinates>-71.11899197101593,42.37402935435937</coordinates>
        </Point>
      </Placemark>
      <Placemark id="1409614179000">
        <name><![CDATA[Home]]></name>
        <description><![CDATA[<p>9/1/14<br/> 7:29 PM to 12:00 AM<br/> 4:30 hours</p>]]></description>
        <TimeSpan>
          <begin>2014-09-01T19:29:40-04:00</begin>
          <end>2014-09-01T23:59:59-04:00</end>
        </TimeSpan>
        <styleUrl>#place_home</styleUrl>
        <Point>
          <coordinates>-71.1114458017,42.3754311174</coordinates>
        </Point>
      </Placemark>
    </Folder>
    <Folder>
      <name><![CDATA[9/2/14]]></name>
      <Placemark id="1409630400000">
        <name><![CDATA[Home]]></name>
        <description><![CDATA[<p>9/2/14<br/> 12:00 AM to 7:32 AM<br/> 7:32 hours</p>]]></description>
        <TimeSpan>
          <begin>2014-09-02T00:00:01-04:00</begin>
          <end>2014-09-02T07:32:31-04:00</end>
        </TimeSpan>
        <styleUrl>#place_home</styleUrl>
        <Point>
          <coordinates>-71.1114458017,42.3754311174</coordinates>
        </Point>
      </Placemark>
      <Placemark id="1409659129000">
        <name><![CDATA[Harvard Innovation Lab]]></name>
        <atom:link href="http://foursquare.com/venue/4e5d4676ae60839ea2e29e64"/>
        <description><![CDATA[<p>9/2/14<br/> 7:58 AM to 8:55 AM<br/> 57 min</p> <p>College Technology Building<br/> <a href="http://foursquare.com/venue/4e5d4676ae60839ea2e29e64">More details (Foursquare)</a> </p>]]></description>
        <TimeSpan>
          <begin>2014-09-02T07:58:50-04:00</begin>
          <end>2014-09-02T08:55:54-04:00</end>
        </TimeSpan>
        <styleUrl>#place_College Technology Building</styleUrl>
        <Point>
          <coordinates>-71.12407621183526,42.36403242532342</coordinates>
        </Point>
      </Placemark>
      <Placemark id="1409663020000">
        <name><![CDATA[Aldrich Hall]]></name>
        <atom:link href="http://foursquare.com/venue/4ac64359f964a5206eb320e3"/>
        <description><![CDATA[<p>9/2/14<br/> 9:03 AM to 12:19 PM<br/> 3:16 hours</p> <p>College Academic Building<br/> <a href="http://foursquare.com/venue/4ac64359f964a5206eb320e3">More details (Foursquare)</a> </p>]]></description>
        <TimeSpan>
          <begin>2014-09-02T09:03:41-04:00</begin>
          <end>2014-09-02T12:19:51-04:00</end>
        </TimeSpan>
        <styleUrl>#place_College Academic Building</styleUrl>
        <Point>
          <coordinates>-71.12210915179602,42.36578780710847</coordinates>
        </Point>
      </Placemark>
      <Placemark id="1409675625000">
        <name><![CDATA[Orinoco]]></name>
        <atom:link href="http://foursquare.com/venue/4f106cace4b072565b8bd1b6"/>
        <description><![CDATA[<p>9/2/14<br/> 12:33 PM to 1:13 PM<br/> 39 min</p> <p>Arepa Restaurant<br/> <a href="http://foursquare.com/venue/4f106cace4b072565b8bd1b6">More details (Foursquare)</a> </p>]]></description>
        <TimeSpan>
          <begin>2014-09-02T12:33:46-04:00</begin>
          <end>2014-09-02T13:13:15-04:00</end>
        </TimeSpan>
        <styleUrl>#place_Arepa Restaurant</styleUrl>
        <Point>
          <coordinates>-71.12049603929978,42.37190996862827</coordinates>
        </Point>
      </Placemark>
      <Placemark id="1409678513000">
        <name><![CDATA[Place in Old Cambridge]]></name>
        <description><![CDATA[<p>9/2/14<br/> 1:21 PM to 1:24 PM<br/> 2 min</p>]]></description>
        <TimeSpan>
          <begin>2014-09-02T13:21:54-04:00</begin>
          <end>2014-09-02T13:24:11-04:00</end>
        </TimeSpan>
        <styleUrl>#place_unknown</styleUrl>
        <Point>
          <coordinates>-71.1146043361,42.3711849193</coordinates>
        </Point>
      </Placemark>
      <Placemark id="1409679337000">
        <name><![CDATA[Home]]></name>
        <description><![CDATA[<p>9/2/14<br/> 1:35 PM to 6:51 PM<br/> 5:15 hours</p>]]></description>
        <TimeSpan>
          <begin>2014-09-02T13:35:38-04:00</begin>
          <end>2014-09-02T18:51:14-04:00</end>
        </TimeSpan>
        <styleUrl>#place_home</styleUrl>
        <Point>
          <coordinates>-71.1114458017,42.3754311174</coordinates>
        </Point>
      </Placemark>
      <Placemark id="1409699314000">
        <name><![CDATA[First Printer]]></name>
        <atom:link href="http://foursquare.com/venue/4f249887e4b006e5c25df9a2"/>
        <description><![CDATA[<p>9/2/14<br/> 7:08 PM to 8:17 PM<br/> 1:08 hours</p> <p>Southern / Soul Food Restaurant<br/> <a href="http://foursquare.com/venue/4f249887e4b006e5c25df9a2">More details (Foursquare)</a> </p>]]></description>
        <TimeSpan>
          <begin>2014-09-02T19:08:35-04:00</begin>
          <end>2014-09-02T20:16:59-04:00</end>
        </TimeSpan>
        <styleUrl>#place_Southern / Soul Food Restaurant</styleUrl>
        <Point>
          <coordinates>-71.11881909172456,42.37291150229456</coordinates>
        </Point>
      </Placemark>
      <Placemark id="1409703654000">
        <name><![CDATA[Orinoco]]></name>
        <atom:link href="http://foursquare.com/venue/4f106cace4b072565b8bd1b6"/>
        <description><![CDATA[<p>9/2/14<br/> 8:20 PM to 9:17 PM<br/> 56 min</p> <p>Arepa Restaurant<br/> <a href="http://foursquare.com/venue/4f106cace4b072565b8bd1b6">More details (Foursquare)</a> </p>]]></description>
        <TimeSpan>
          <begin>2014-09-02T20:20:55-04:00</begin>
          <end>2014-09-02T21:17:31-04:00</end>
        </TimeSpan>
        <styleUrl>#place_Arepa Restaurant</styleUrl>
        <Point>
          <coordinates>-71.12049603929978,42.37190996862827</coordinates>
        </Point>
      </Placemark>
      <Placemark id="1409708217000">
        <name><![CDATA[Home]]></name>
        <description><![CDATA[<p>9/2/14<br/> 9:36 PM to 12:00 AM<br/> 2:23 hours</p>]]></description>
        <TimeSpan>
          <begin>2014-09-02T21:36:58-04:00</begin>
          <end>2014-09-02T23:59:59-04:00</end>
        </TimeSpan>
        <styleUrl>#place_home</styleUrl>
        <Point>
          <coordinates>-71.1114458017,42.3754311174</coordinates>
        </Point>
      </Placemark>
    </Folder>
    <Folder>
      <name><![CDATA[9/3/14]]></name>
      <Placemark id="1409716800000">
        <name><![CDATA[Home]]></name>
        <description><![CDATA[<p>9/3/14<br/> 12:00 AM to 7:31 AM<br/> 7:31 hours</p>]]></description>
        <TimeSpan>
          <begin>2014-09-03T00:00:01-04:00</begin>
          <end>2014-09-03T07:31:03-04:00</end>
        </TimeSpan>
        <styleUrl>#place_home</styleUrl>
        <Point>
          <coordinates>-71.1114458017,42.3754311174</coordinates>
        </Point>
      </Placemark>
      <Placemark id="1409745217000">
        <name><![CDATA[Harvard Innovation Lab]]></name>
        <atom:link href="http://foursquare.com/venue/4e5d4676ae60839ea2e29e64"/>
        <description><![CDATA[<p>9/3/14<br/> 7:53 AM to 8:47 AM<br/> 54 min</p> <p>College Technology Building<br/> <a href="http://foursquare.com/venue/4e5d4676ae60839ea2e29e64">More details (Foursquare)</a> </p>]]></description>
        <TimeSpan>
          <begin>2014-09-03T07:53:38-04:00</begin>
          <end>2014-09-03T08:47:56-04:00</end>
        </TimeSpan>
        <styleUrl>#place_College Technology Building</styleUrl>
        <Point>
          <coordinates>-71.12407621183526,42.36403242532342</coordinates>
        </Point>
      </Placemark>
      <Placemark id="1409748781000">
        <name><![CDATA[Aldrich Hall]]></name>
        <atom:link href="http://foursquare.com/venue/4ac64359f964a5206eb320e3"/>
        <description><![CDATA[<p>9/3/14<br/> 8:53 AM to 12:19 PM<br/> 3:26 hours</p> <p>College Academic Building<br/> <a href="http://foursquare.com/venue/4ac64359f964a5206eb320e3">More details (Foursquare)</a> </p>]]></description>
        <TimeSpan>
          <begin>2014-09-03T08:53:02-04:00</begin>
          <end>2014-09-03T12:19:37-04:00</end>
        </TimeSpan>
        <styleUrl>#place_College Academic Building</styleUrl>
        <Point>
          <coordinates>-71.12210915179602,42.36578780710847</coordinates>
        </Point>
      </Placemark>
      <Placemark id="1409762398000">
        <name><![CDATA[Home]]></name>
        <description><![CDATA[<p>9/3/14<br/> 12:39 PM to 2:16 PM<br/> 1:36 hours</p>]]></description>
        <TimeSpan>
          <begin>2014-09-03T12:39:59-04:00</begin>
          <end>2014-09-03T14:16:20-04:00</end>
        </TimeSpan>
        <styleUrl>#place_home</styleUrl>
        <Point>
          <coordinates>-71.1114458017,42.3754311174</coordinates>
        </Point>
      </Placemark>
      <Placemark id="1409769197000">
        <name><![CDATA[Floyd's 99 Barbershop]]></name>
        <atom:link href="http://foursquare.com/venue/4a9d711ff964a520443820e3"/>
        <description><![CDATA[<p>9/3/14<br/> 2:33 PM to 2:59 PM<br/> 26 min</p> <p>Salon / Barbershop<br/> <a href="http://foursquare.com/venue/4a9d711ff964a520443820e3">More details (Foursquare)</a> </p>]]></description>
        <TimeSpan>
          <begin>2014-09-03T14:33:18-04:00</begin>
          <end>2014-09-03T14:59:28-04:00</end>
        </TimeSpan>
        <styleUrl>#place_Salon / Barbershop</styleUrl>
        <Point>
          <coordinates>-71.11979826,42.38213717937469</coordinates>
        </Point>
      </Placemark>
      <Placemark id="1409772780000">
        <name><![CDATA[Aldrich Hall]]></name>
        <atom:link href="http://foursquare.com/venue/4ac64359f964a5206eb320e3"/>
        <description><![CDATA[<p>9/3/14<br/> 3:33 PM to 5:15 PM<br/> 1:42 hours</p> <p>College Academic Building<br/> <a href="http://foursquare.com/venue/4ac64359f964a5206eb320e3">More details (Foursquare)</a> </p>]]></description>
        <TimeSpan>
          <begin>2014-09-03T15:33:01-04:00</begin>
          <end>2014-09-03T17:15:12-04:00</end>
        </TimeSpan>
        <styleUrl>#place_College Academic Building</styleUrl>
        <Point>
          <coordinates>-71.12210915179602,42.36578780710847</coordinates>
        </Point>
      </Placemark>
      <Placemark id="1409779517000">
        <name><![CDATA[Wagamama]]></name>
        <atom:link href="http://foursquare.com/venue/49e00a10f964a5203b611fe3"/>
        <description><![CDATA[<p>9/3/14<br/> 5:25 PM to 7:03 PM<br/> 1:37 hours</p> <p>Ramen / Noodle House<br/> <a href="http://foursquare.com/venue/49e00a10f964a5203b611fe3">More details (Foursquare)</a> </p>]]></description>
        <TimeSpan>
          <begin>2014-09-03T17:25:18-04:00</begin>
          <end>2014-09-03T19:03:14-04:00</end>
        </TimeSpan>
        <styleUrl>#place_Ramen / Noodle House</styleUrl>
        <Point>
          <coordinates>-71.1207515001297,42.37189721215247</coordinates>
        </Point>
      </Placemark>
      <Placemark id="1409786443000">
        <name><![CDATA[Home]]></name>
        <description><![CDATA[<p>9/3/14<br/> 7:20 PM to 12:00 AM<br/> 4:39 hours</p>]]></description>
        <TimeSpan>
          <begin>2014-09-03T19:20:44-04:00</begin>
          <end>2014-09-03T23:59:59-04:00</end>
        </TimeSpan>
        <styleUrl>#place_home</styleUrl>
        <Point>
          <coordinates>-71.1114458017,42.3754311174</coordinates>
        </Point>
      </Placemark>
    </Folder>
    <Folder>
      <name><![CDATA[9/4/14]]></name>
      <Placemark id="1409803200000">
        <name><![CDATA[Home]]></name>
        <description><![CDATA[<p>9/4/14<br/> 12:00 AM to 7:26 AM<br/> 7:26 hours</p>]]></description>
        <TimeSpan>
          <begin>2014-09-04T00:00:01-04:00</begin>
          <end>2014-09-04T07:26:38-04:00</end>
        </TimeSpan>
        <styleUrl>#place_home</styleUrl>
        <Point>
          <coordinates>-71.1114458017,42.3754311174</coordinates>
        </Point>
      </Placemark>
      <Placemark id="1409831316000">
        <name><![CDATA[Harvard Innovation Lab]]></name>
        <atom:link href="http://foursquare.com/venue/4e5d4676ae60839ea2e29e64"/>
        <description><![CDATA[<p>9/4/14<br/> 7:48 AM to 8:56 AM<br/> 1:08 hours</p> <p>College Technology Building<br/> <a href="http://foursquare.com/venue/4e5d4676ae60839ea2e29e64">More details (Foursquare)</a> </p>]]></description>
        <TimeSpan>
          <begin>2014-09-04T07:48:37-04:00</begin>
          <end>2014-09-04T08:56:54-04:00</end>
        </TimeSpan>
        <styleUrl>#place_College Technology Building</styleUrl>
        <Point>
          <coordinates>-71.12407621183526,42.36403242532342</coordinates>
        </Point>
      </Placemark>
      <Placemark id="1409835801000">
        <name><![CDATA[Aldrich Hall]]></name>
        <atom:link href="http://foursquare.com/venue/4ac64359f964a5206eb320e3"/>
        <description><![CDATA[<p>9/4/14<br/> 9:03 AM to 1:04 PM<br/> 4:01 hours</p> <p>College Academic Building<br/> <a href="http://foursquare.com/venue/4ac64359f964a5206eb320e3">More details (Foursquare)</a> </p>]]></description>
        <TimeSpan>
          <begin>2014-09-04T09:03:22-04:00</begin>
          <end>2014-09-04T13:04:42-04:00</end>
        </TimeSpan>
        <styleUrl>#place_College Academic Building</styleUrl>
        <Point>
          <coordinates>-71.12210915179602,42.36578780710847</coordinates>
        </Point>
      </Placemark>
      <Placemark id="1409850720000">
        <name><![CDATA[Harvard Innovation Lab]]></name>
        <atom:link href="http://foursquare.com/venue/4e5d4676ae60839ea2e29e64"/>
        <description><![CDATA[<p>9/4/14<br/> 1:12 PM to 2:50 PM<br/> 1:38 hours</p> <p>College Technology Building<br/> <a href="http://foursquare.com/venue/4e5d4676ae60839ea2e29e64">More details (Foursquare)</a> </p>]]></description>
        <TimeSpan>
          <begin>2014-09-04T13:12:01-04:00</begin>
          <end>2014-09-04T14:50:01-04:00</end>
        </TimeSpan>
        <styleUrl>#place_College Technology Building</styleUrl>
        <Point>
          <coordinates>-71.12402979165076,42.36427488545988</coordinates>
        </Point>
      </Placemark>
      <Placemark id="1409857944000">
        <name><![CDATA[CVS/pharmacy]]></name>
        <atom:link href="http://foursquare.com/venue/49df6a3ff964a520c6601fe3"/>
        <description><![CDATA[<p>9/4/14<br/> 3:12 PM to 3:15 PM<br/> 3 min</p> <p>Drugstore / Pharmacy<br/> <a href="http://foursquare.com/venue/49df6a3ff964a520c6601fe3">More details (Foursquare)</a> </p>]]></description>
        <TimeSpan>
          <begin>2014-09-04T15:12:25-04:00</begin>
          <end>2014-09-04T15:15:52-04:00</end>
        </TimeSpan>
        <styleUrl>#place_Drugstore / Pharmacy</styleUrl>
        <Point>
          <coordinates>-71.11899197101593,42.37402935435937</coordinates>
        </Point>
      </Placemark>
      <Placemark id="1409858821000">
        <name><![CDATA[Home]]></name>
        <description><![CDATA[<p>9/4/14<br/> 3:27 PM to 5:00 PM<br/> 1:33 hours</p>]]></description>
        <TimeSpan>
          <begin>2014-09-04T15:27:02-04:00</begin>
          <end>2014-09-04T17:00:16-04:00</end>
        </TimeSpan>
        <styleUrl>#place_home</styleUrl>
        <Point>
          <coordinates>-71.1114458017,42.3754311174</coordinates>
        </Point>
      </Placemark>
      <Placemark id="1409866885000">
        <name><![CDATA[Home]]></name>
        <description><![CDATA[<p>9/4/14<br/> 5:41 PM to 12:00 AM<br/> 6:18 hours</p>]]></description>
        <TimeSpan>
          <begin>2014-09-04T17:41:26-04:00</begin>
          <end>2014-09-04T23:59:59-04:00</end>
        </TimeSpan>
        <styleUrl>#place_home</styleUrl>
        <Point>
          <coordinates>-71.1114458017,42.3754311174</coordinates>
        </Point>
      </Placemark>
    </Folder>
    <Folder>
      <name><![CDATA[9/5/14]]></name>
      <Placemark id="1409889600000">
        <name><![CDATA[Home]]></name>
        <description><![CDATA[<p>9/5/14<br/> 12:00 AM to 7:29 AM<br/> 7:29 hours</p>]]></description>
        <TimeSpan>
          <begin>2014-09-05T00:00:01-04:00</begin>
          <end>2014-09-05T07:29:12-04:00</end>
        </TimeSpan>
        <styleUrl>#place_home</styleUrl>
        <Point>
          <coordinates>-71.1114458017,42.3754311174</coordinates>
        </Point>
      </Placemark>
      <Placemark id="1409917894000">
        <name><![CDATA[Harvard Innovation Lab]]></name>
        <atom:link href="http://foursquare.com/venue/4e5d4676ae60839ea2e29e64"/>
        <description><![CDATA[<p>9/5/14<br/> 7:51 AM to 8:55 AM<br/> 1:03 hours</p> <p>College Technology Building<br/> <a href="http://foursquare.com/venue/4e5d4676ae60839ea2e29e64">More details (Foursquare)</a> </p>]]></description>
        <TimeSpan>
          <begin>2014-09-05T07:51:35-04:00</begin>
          <end>2014-09-05T08:55:30-04:00</end>
        </TimeSpan>
        <styleUrl>#place_College Technology Building</styleUrl>
        <Point>
          <coordinates>-71.12402979165076,42.36427488545988</coordinates>
        </Point>
      </Placemark>
      <Placemark id="1409922154000">
        <name><![CDATA[Aldrich Hall]]></name>
        <atom:link href="http://foursquare.com/venue/4ac64359f964a5206eb320e3"/>
        <description><![CDATA[<p>9/5/14<br/> 9:02 AM to 1:34 PM<br/> 4:32 hours</p> <p>College Academic Building<br/> <a href="http://foursquare.com/venue/4ac64359f964a5206eb320e3">More details (Foursquare)</a> </p>]]></description>
        <TimeSpan>
          <begin>2014-09-05T09:02:35-04:00</begin>
          <end>2014-09-05T13:34:56-04:00</end>
        </TimeSpan>
        <styleUrl>#place_College Academic Building</styleUrl>
        <Point>
          <coordinates>-71.12210915179602,42.36578780710847</coordinates>
        </Point>
      </Placemark>
      <Placemark id="1409940276000">
        <name><![CDATA[Home]]></name>
        <description><![CDATA[<p>9/5/14<br/> 2:04 PM to 2:42 PM<br/> 38 min</p>]]></description>
        <TimeSpan>
          <begin>2014-09-05T14:04:37-04:00</begin>
          <end>2014-09-05T14:42:52-04:00</end>
        </TimeSpan>
        <styleUrl>#place_home</styleUrl>
        <Point>
          <coordinates>-71.1114458017,42.3754311174</coordinates>
        </Point>
      </Placemark>
      <Placemark id="1409943480000">
        <name><![CDATA[US Post Office]]></name>
        <atom:link href="http://foursquare.com/venue/49cd318af964a520cc591fe3"/>
        <description><![CDATA[<p>9/5/14<br/> 2:58 PM to 3:06 PM<br/> 8 min</p> <p>Post Office<br/> <a href="http://foursquare.com/venue/49cd318af964a520cc591fe3">More details (Foursquare)</a> </p>]]></description>
        <TimeSpan>
          <begin>2014-09-05T14:58:01-04:00</begin>
          <end>2014-09-05T15:06:38-04:00</end>
        </TimeSpan>
        <styleUrl>#place_Post Office</styleUrl>
        <Point>
          <coordinates>-71.12294,42.373417</coordinates>
        </Point>
      </Placemark>
      <Placemark id="1409944909000">
        <name><![CDATA[Spangler Center]]></name>
        <atom:link href="http://foursquare.com/venue/4aeee0b0f964a52081d421e3"/>
        <description><![CDATA[<p>9/5/14<br/> 3:21 PM to 5:43 PM<br/> 2:21 hours</p> <p>Student Center<br/> <a href="http://foursquare.com/venue/4aeee0b0f964a52081d421e3">More details (Foursquare)</a> </p>]]></description>
        <TimeSpan>
          <begin>2014-09-05T15:21:50-04:00</begin>
          <end>2014-09-05T17:43:18-04:00</end>
        </TimeSpan>
        <styleUrl>#place_Student Center</styleUrl>
        <Point>
          <coordinates>-71.12218458495514,42.36522543920124</coordinates>
        </Point>
      </Placemark>
      <Placemark id="1409954484000">
        <name><![CDATA[Beat Hotel]]></name>
        <atom:link href="http://foursquare.com/venue/51f29465498edf6fd54a0373"/>
        <description><![CDATA[<p>9/5/14<br/> 6:01 PM to 8:11 PM<br/> 2:10 hours</p> <p>Jazz Club<br/> <a href="http://foursquare.com/venue/51f29465498edf6fd54a0373">More details (Foursquare)</a> </p>]]></description>
        <TimeSpan>
          <begin>2014-09-05T18:01:25-04:00</begin>
          <end>2014-09-05T20:11:47-04:00</end>
        </TimeSpan>
        <styleUrl>#place_Jazz Club</styleUrl>
        <Point>
          <coordinates>-71.12040319809506,42.37339550830445</coordinates>
        </Point>
      </Placemark>
      <Placemark id="1409962620000">
        <name><![CDATA[Orinoco]]></name>
        <atom:link href="http://foursquare.com/venue/4f106cace4b072565b8bd1b6"/>
        <description><![CDATA[<p>9/5/14<br/> 8:17 PM to 8:27 PM<br/> 10 min</p> <p>Arepa Restaurant<br/> <a href="http://foursquare.com/venue/4f106cace4b072565b8bd1b6">More details (Foursquare)</a> </p>]]></description>
        <TimeSpan>
          <begin>2014-09-05T20:17:01-04:00</begin>
          <end>2014-09-05T20:27:42-04:00</end>
        </TimeSpan>
        <styleUrl>#place_Arepa Restaurant</styleUrl>
        <Point>
          <coordinates>-71.12049603929978,42.37190996862827</coordinates>
        </Point>
      </Placemark>
      <Placemark id="1409973180000">
        <name><![CDATA[Home]]></name>
        <description><![CDATA[<p>9/5/14<br/> 11:13 PM to 12:00 AM<br/> 47 min</p>]]></description>
        <TimeSpan>
          <begin>2014-09-05T23:13:01-04:00</begin>
          <end>2014-09-05T23:59:59-04:00</end>
        </TimeSpan>
        <styleUrl>#place_home</styleUrl>
        <Point>
          <coordinates>-71.1114458017,42.3754311174</coordinates>
        </Point>
      </Placemark>
    </Folder>
    <Folder>
      <name><![CDATA[9/6/14]]></name>
      <Placemark id="1409976000000">
        <name><![CDATA[Home]]></name>
        <description><![CDATA[<p>9/6/14<br/> 12:00 AM to 8:48 AM<br/> 8:48 hours</p>]]></description>
        <TimeSpan>
          <begin>2014-09-06T00:00:01-04:00</begin>
          <end>2014-09-06T08:48:43-04:00</end>
        </TimeSpan>
        <styleUrl>#place_home</styleUrl>
        <Point>
          <coordinates>-71.1114458017,42.3754311174</coordinates>
        </Point>
      </Placemark>
      <Placemark id="1410009172000">
        <name><![CDATA[Aldrich Hall]]></name>
        <atom:link href="http://foursquare.com/venue/4ac64359f964a5206eb320e3"/>
        <description><![CDATA[<p>9/6/14<br/> 9:12 AM to 12:36 PM<br/> 3:24 hours</p> <p>College Academic Building<br/> <a href="http://foursquare.com/venue/4ac64359f964a5206eb320e3">More details (Foursquare)</a> </p>]]></description>
        <TimeSpan>
          <begin>2014-09-06T09:12:53-04:00</begin>
          <end>2014-09-06T12:36:51-04:00</end>
        </TimeSpan>
        <styleUrl>#place_College Academic Building</styleUrl>
        <Point>
          <coordinates>-71.12210915179602,42.36578780710847</coordinates>
        </Point>
      </Placemark>
      <Placemark id="1410023363000">
        <name><![CDATA[Broadway Marketplace]]></name>
        <atom:link href="http://foursquare.com/venue/4a661612f964a520ffc71fe3"/>
        <description><![CDATA[<p>9/6/14<br/> 1:09 PM to 1:13 PM<br/> 4 min</p> <p>Grocery Store<br/> <a href="http://foursquare.com/venue/4a661612f964a520ffc71fe3">More details (Foursquare)</a> </p>]]></description>
        <TimeSpan>
          <begin>2014-09-06T13:09:24-04:00</begin>
          <end>2014-09-06T13:13:38-04:00</end>
        </TimeSpan>
        <styleUrl>#place_Grocery Store</styleUrl>
        <Point>
          <coordinates>-71.11300484548056,42.37405171427381</coordinates>
        </Point>
      </Placemark>
      <Placemark id="1410023806000">
        <name><![CDATA[Home]]></name>
        <description><![CDATA[<p>9/6/14<br/> 1:16 PM to 7:32 PM<br/> 6:15 hours</p>]]></description>
        <TimeSpan>
          <begin>2014-09-06T13:16:47-04:00</begin>
          <end>2014-09-06T19:32:13-04:00</end>
        </TimeSpan>
        <styleUrl>#place_home</styleUrl>
        <Point>
          <coordinates>-71.1114458017,42.3754311174</coordinates>
        </Point>
      </Placemark>
      <Placemark id="1410046672000">
        <name><![CDATA[Broadway Marketplace]]></name>
        <atom:link href="http://foursquare.com/venue/4a661612f964a520ffc71fe3"/>
        <description><![CDATA[<p>9/6/14<br/> 7:37 PM to 7:52 PM<br/> 14 min</p> <p>Grocery Store<br/> <a href="http://foursquare.com/venue/4a661612f964a520ffc71fe3">More details (Foursquare)</a> </p>]]></description>
        <TimeSpan>
          <begin>2014-09-06T19:37:53-04:00</begin>
          <end>2014-09-06T19:52:49-04:00</end>
        </TimeSpan>
        <styleUrl>#place_Grocery Store</styleUrl>
        <Point>
          <coordinates>-71.11300484548056,42.37405171427381</coordinates>
        </Point>
      </Placemark>
      <Placemark id="1410047849000">
        <name><![CDATA[Home]]></name>
        <description><![CDATA[<p>9/6/14<br/> 7:57 PM to 9:01 PM<br/> 1:04 hours</p>]]></description>
        <TimeSpan>
          <begin>2014-09-06T19:57:30-04:00</begin>
          <end>2014-09-06T21:01:40-04:00</end>
        </TimeSpan>
        <styleUrl>#place_home</styleUrl>
        <Point>
          <coordinates>-71.1114458017,42.3754311174</coordinates>
        </Point>
      </Placemark>
      <Placemark id="1410052583000">
        <name><![CDATA[Home]]></name>
        <description><![CDATA[<p>9/6/14<br/> 9:16 PM to 12:00 AM<br/> 2:43 hours</p>]]></description>
        <TimeSpan>
          <begin>2014-09-06T21:16:24-04:00</begin>
          <end>2014-09-06T23:59:59-04:00</end>
        </TimeSpan>
        <styleUrl>#place_home</styleUrl>
        <Point>
          <coordinates>-71.1114458017,42.3754311174</coordinates>
        </Point>
      </Placemark>
    </Folder>
    <Folder>
      <name><![CDATA[9/7/14]]></name>
      <Placemark id="1410062400000">
        <name><![CDATA[Home]]></name>
        <description><![CDATA[<p>9/7/14<br/> 12:00 AM to 4:38 PM<br/> 16:38 hours</p>]]></description>
        <TimeSpan>
          <begin>2014-09-07T00:00:01-04:00</begin>
          <end>2014-09-07T16:38:50-04:00</end>
        </TimeSpan>
        <styleUrl>#place_home</styleUrl>
        <Point>
          <coordinates>-71.1114458017,42.3754311174</coordinates>
        </Point>
      </Placemark>
      <Placemark id="1410123192000">
        <name><![CDATA[Hemenway Gym]]></name>
        <atom:link href="http://foursquare.com/venue/4a9d3432f964a520ed3720e3"/>
        <description><![CDATA[<p>9/7/14<br/> 4:53 PM to 5:50 PM<br/> 56 min</p> <p>Gym<br/> <a href="http://foursquare.com/venue/4a9d3432f964a520ed3720e3">More details (Foursquare)</a> </p>]]></description>
        <TimeSpan>
          <begin>2014-09-07T16:53:13-04:00</begin>
          <end>2014-09-07T17:50:07-04:00</end>
        </TimeSpan>
        <styleUrl>#place_Gym</styleUrl>
        <Point>
          <coordinates>-71.11979972974,42.37697342388555</coordinates>
        </Point>
      </Placemark>
      <Placemark id="1410127761000">
        <name><![CDATA[Home]]></name>
        <description><![CDATA[<p>9/7/14<br/> 6:09 PM to 12:00 AM<br/> 5:50 hours</p>]]></description>
        <TimeSpan>
          <begin>2014-09-07T18:09:22-04:00</begin>
          <end>2014-09-07T23:59:59-04:00</end>
        </TimeSpan>
        <styleUrl>#place_home</styleUrl>
        <Point>
          <coordinates>-71.1114458017,42.3754311174</coordinates>
        </Point>
      </Placemark>
    </Folder>
    <Folder>
      <name><![CDATA[9/8/14]]></name>
      <Placemark id="1410148800000">
        <name><![CDATA[Home]]></name>
        <description><![CDATA[<p>9/8/14<br/> 12:00 AM to 7:17 AM<br/> 7:17 hours</p>]]></description>
        <TimeSpan>
          <begin>2014-09-08T00:00:01-04:00</begin>
          <end>2014-09-08T07:17:26-04:00</end>
        </TimeSpan>
        <styleUrl>#place_home</styleUrl>
        <Point>
          <coordinates>-71.1114458017,42.3754311174</coordinates>
        </Point>
      </Placemark>
      <Placemark id="1410176667000">
        <name><![CDATA[Harvard Innovation Lab]]></name>
        <atom:link href="http://foursquare.com/venue/4e5d4676ae60839ea2e29e64"/>
        <description><![CDATA[<p>9/8/14<br/> 7:44 AM to 8:56 AM<br/> 1:11 hours</p> <p>College Technology Building<br/> <a href="http://foursquare.com/venue/4e5d4676ae60839ea2e29e64">More details (Foursquare)</a> </p>]]></description>
        <TimeSpan>
          <begin>2014-09-08T07:44:28-04:00</begin>
          <end>2014-09-08T08:56:25-04:00</end>
        </TimeSpan>
        <styleUrl>#place_College Technology Building</styleUrl>
        <Point>
          <coordinates>-71.12402979165076,42.36427488545988</coordinates>
        </Point>
      </Placemark>
      <Placemark id="1410181027000">
        <name><![CDATA[Aldrich Hall]]></name>
        <atom:link href="http://foursquare.com/venue/4ac64359f964a5206eb320e3"/>
        <description><![CDATA[<p>9/8/14<br/> 8:57 AM to 4:09 PM<br/> 7:12 hours</p> <p>College Academic Building<br/> <a href="http://foursquare.com/venue/4ac64359f964a5206eb320e3">More details (Foursquare)</a> </p>]]></description>
        <TimeSpan>
          <begin>2014-09-08T08:57:08-04:00</begin>
          <end>2014-09-08T16:09:27-04:00</end>
        </TimeSpan>
        <styleUrl>#place_College Academic Building</styleUrl>
        <Point>
          <coordinates>-71.12210915179602,42.36578780710847</coordinates>
        </Point>
      </Placemark>
      <Placemark id="1410207705000">
        <name><![CDATA[Leverett House]]></name>
        <atom:link href="http://foursquare.com/venue/4b5b9c2ef964a520cb0a29e3"/>
        <description><![CDATA[<p>9/8/14<br/> 4:21 PM to 4:23 PM<br/> 2 min</p> <p>College Residence Hall<br/> <a href="http://foursquare.com/venue/4b5b9c2ef964a520cb0a29e3">More details (Foursquare)</a> </p>]]></description>
        <TimeSpan>
          <begin>2014-09-08T16:21:46-04:00</begin>
          <end>2014-09-08T16:23:54-04:00</end>
        </TimeSpan>
        <styleUrl>#place_College Residence Hall</styleUrl>
        <Point>
          <coordinates>-71.11702028202814,42.36972025201748</coordinates>
        </Point>
      </Placemark>
      <Placemark id="1410208238000">
        <name><![CDATA[Broadway Marketplace]]></name>
        <atom:link href="http://foursquare.com/venue/4a661612f964a520ffc71fe3"/>
        <description><![CDATA[<p>9/8/14<br/> 4:30 PM to 4:36 PM<br/> 5 min</p> <p>Grocery Store<br/> <a href="http://foursquare.com/venue/4a661612f964a520ffc71fe3">More details (Foursquare)</a> </p>]]></description>
        <TimeSpan>
          <begin>2014-09-08T16:30:39-04:00</begin>
          <end>2014-09-08T16:36:13-04:00</end>
        </TimeSpan>
        <styleUrl>#place_Grocery Store</styleUrl>
        <Point>
          <coordinates>-71.11300484548056,42.37405171427381</coordinates>
        </Point>
      </Placemark>
      <Placemark id="1410208859000">
        <name><![CDATA[Home]]></name>
        <description><![CDATA[<p>9/8/14<br/> 4:40 PM to 7:11 PM<br/> 2:30 hours</p>]]></description>
        <TimeSpan>
          <begin>2014-09-08T16:41:00-04:00</begin>
          <end>2014-09-08T19:11:42-04:00</end>
        </TimeSpan>
        <styleUrl>#place_home</styleUrl>
        <Point>
          <coordinates>-71.1114458017,42.3754311174</coordinates>
        </Point>
      </Placemark>
      <Placemark id="1410218522000">
        <name><![CDATA[Border Cafe]]></name>
        <atom:link href="http://foursquare.com/venue/3fd66200f964a520bded1ee3"/>
        <description><![CDATA[<p>9/8/14<br/> 7:22 PM to 9:10 PM<br/> 1:48 hours</p> <p>Mexican Restaurant<br/> <a href="http://foursquare.com/venue/3fd66200f964a520bded1ee3">More details (Foursquare)</a> </p>]]></description>
        <TimeSpan>
          <begin>2014-09-08T19:22:03-04:00</begin>
          <end>2014-09-08T21:10:48-04:00</end>
        </TimeSpan>
        <styleUrl>#place_Mexican Restaurant</styleUrl>
        <Point>
          <coordinates>-71.120141,42.3743468</coordinates>
        </Point>
      </Placemark>
      <Placemark id="1410225834000">
        <name><![CDATA[Home]]></name>
        <description><![CDATA[<p>9/8/14<br/> 9:23 PM to 12:00 AM<br/> 2:36 hours</p>]]></description>
        <TimeSpan>
          <begin>2014-09-08T21:23:55-04:00</begin>
          <end>2014-09-08T23:59:59-04:00</end>
        </TimeSpan>
        <styleUrl>#place_home</styleUrl>
        <Point>
          <coordinates>-71.1114458017,42.3754311174</coordinates>
        </Point>
      </Placemark>
    </Folder>
    <Folder>
      <name><![CDATA[9/9/14]]></name>
      <Placemark id="1410235200000">
        <name><![CDATA[Home]]></name>
        <description><![CDATA[<p>9/9/14<br/> 12:00 AM to 6:55 AM<br/> 6:55 hours</p>]]></description>
        <TimeSpan>
          <begin>2014-09-09T00:00:01-04:00</begin>
          <end>2014-09-09T06:55:35-04:00</end>
        </TimeSpan>
        <styleUrl>#place_home</styleUrl>
        <Point>
          <coordinates>-71.1114458017,42.3754311174</coordinates>
        </Point>
      </Placemark>
      <Placemark id="1410261729000">
        <name><![CDATA[Harvard Innovation Lab]]></name>
        <atom:link href="http://foursquare.com/venue/4e5d4676ae60839ea2e29e64"/>
        <description><![CDATA[<p>9/9/14<br/> 7:22 AM to 8:57 AM<br/> 1:35 hours</p> <p>College Technology Building<br/> <a href="http://foursquare.com/venue/4e5d4676ae60839ea2e29e64">More details (Foursquare)</a> </p>]]></description>
        <TimeSpan>
          <begin>2014-09-09T07:22:10-04:00</begin>
          <end>2014-09-09T08:57:24-04:00</end>
        </TimeSpan>
        <styleUrl>#place_College Technology Building</styleUrl>
        <Point>
          <coordinates>-71.12407621183526,42.36403242532342</coordinates>
        </Point>
      </Placemark>
      <Placemark id="1410267889000">
        <name><![CDATA[Aldrich Hall]]></name>
        <atom:link href="http://foursquare.com/venue/4ac64359f964a5206eb320e3"/>
        <description><![CDATA[<p>9/9/14<br/> 9:04 AM to 2:50 PM<br/> 5:45 hours</p> <p>College Academic Building<br/> <a href="http://foursquare.com/venue/4ac64359f964a5206eb320e3">More details (Foursquare)</a> </p>]]></description>
        <TimeSpan>
          <begin>2014-09-09T09:04:50-04:00</begin>
          <end>2014-09-09T14:50:18-04:00</end>
        </TimeSpan>
        <styleUrl>#place_College Academic Building</styleUrl>
        <Point>
          <coordinates>-71.12210915179602,42.36578780710847</coordinates>
        </Point>
      </Placemark>
      <Placemark id="1410290120000">
        <name><![CDATA[Home]]></name>
        <description><![CDATA[<p>9/9/14<br/> 3:15 PM to 6:30 PM<br/> 3:15 hours</p>]]></description>
        <TimeSpan>
          <begin>2014-09-09T15:15:21-04:00</begin>
          <end>2014-09-09T18:30:53-04:00</end>
        </TimeSpan>
        <styleUrl>#place_home</styleUrl>
        <Point>
          <coordinates>-71.1114458017,42.3754311174</coordinates>
        </Point>
      </Placemark>
      <Placemark id="1410302110000">
        <name><![CDATA[Broadway Marketplace]]></name>
        <atom:link href="http://foursquare.com/venue/4a661612f964a520ffc71fe3"/>
        <description><![CDATA[<p>9/9/14<br/> 6:35 PM to 6:38 PM<br/> 3 min</p> <p>Grocery Store<br/> <a href="http://foursquare.com/venue/4a661612f964a520ffc71fe3">More details (Foursquare)</a> </p>]]></description>
        <TimeSpan>
          <begin>2014-09-09T18:35:11-04:00</begin>
          <end>2014-09-09T18:38:27-04:00</end>
        </TimeSpan>
        <styleUrl>#place_Grocery Store</styleUrl>
        <Point>
          <coordinates>-71.11300484548056,42.37405171427381</coordinates>
        </Point>
      </Placemark>
      <Placemark id="1410302535000">
        <name><![CDATA[Home]]></name>
        <description><![CDATA[<p>9/9/14<br/> 6:42 PM to 12:00 AM<br/> 5:17 hours</p>]]></description>
        <TimeSpan>
          <begin>2014-09-09T18:42:16-04:00</begin>
          <end>2014-09-09T23:59:59-04:00</end>
        </TimeSpan>
        <styleUrl>#place_home</styleUrl>
        <Point>
          <coordinates>-71.1114458017,42.3754311174</coordinates>
        </Point>
      </Placemark>
    </Folder>
    <Folder>
      <name><![CDATA[9/10/14]]></name>
      <Placemark id="1410321600000">
        <name><![CDATA[Home]]></name>
        <description><![CDATA[<p>9/10/14<br/> 12:00 AM to 9:56 AM<br/> 9:56 hours</p>]]></description>
        <TimeSpan>
          <begin>2014-09-10T00:00:01-04:00</begin>
          <end>2014-09-10T09:56:17-04:00</end>
        </TimeSpan>
        <styleUrl>#place_home</styleUrl>
        <Point>
          <coordinates>-71.1114458017,42.3754311174</coordinates>
        </Point>
      </Placemark>
      <Placemark id="1410358794000">
        <name><![CDATA[Spangler Center]]></name>
        <atom:link href="http://foursquare.com/venue/4aeee0b0f964a52081d421e3"/>
        <description><![CDATA[<p>9/10/14<br/> 10:19 AM to 5:16 PM<br/> 6:56 hours</p> <p>Student Center<br/> <a href="http://foursquare.com/venue/4aeee0b0f964a52081d421e3">More details (Foursquare)</a> </p>]]></description>
        <TimeSpan>
          <begin>2014-09-10T10:19:55-04:00</begin>
          <end>2014-09-10T17:16:18-04:00</end>
        </TimeSpan>
        <styleUrl>#place_Student Center</styleUrl>
        <Point>
          <coordinates>-71.12218458495514,42.36522543920124</coordinates>
        </Point>
      </Placemark>
      <Placemark id="1410385245000">
        <name><![CDATA[Home]]></name>
        <description><![CDATA[<p>9/10/14<br/> 5:40 PM to 9:59 PM<br/> 4:18 hours</p>]]></description>
        <TimeSpan>
          <begin>2014-09-10T17:40:46-04:00</begin>
          <end>2014-09-10T21:59:12-04:00</end>
        </TimeSpan>
        <styleUrl>#place_home</styleUrl>
        <Point>
          <coordinates>-71.1114458017,42.3754311174</coordinates>
        </Point>
      </Placemark>
      <Placemark id="1410401273000">
        <name><![CDATA[Will Whitney and Benjana Guraziu Home]]></name>
        <description><![CDATA[<p>9/10/14<br/> 10:07 PM to 10:20 PM<br/> 13 min</p>]]></description>
        <TimeSpan>
          <begin>2014-09-10T22:07:54-04:00</begin>
          <end>2014-09-10T22:20:54-04:00</end>
        </TimeSpan>
        <styleUrl>#place_home</styleUrl>
        <Point>
          <coordinates>-71.1114357056,42.3700145918</coordinates>
        </Point>
      </Placemark>
      <Placemark id="1410403357000">
        <name><![CDATA[Whisky Saigon]]></name>
        <atom:link href="http://foursquare.com/venue/5279339111d23f7e3e40c260"/>
        <description><![CDATA[<p>9/10/14<br/> 10:42 PM to 11:43 PM<br/> 1:00 hours</p> <p>Nightclub<br/> <a href="http://foursquare.com/venue/5279339111d23f7e3e40c260">More details (Foursquare)</a> </p>]]></description>
        <TimeSpan>
          <begin>2014-09-10T22:42:38-04:00</begin>
          <end>2014-09-10T23:43:20-04:00</end>
        </TimeSpan>
        <styleUrl>#place_Nightclub</styleUrl>
        <Point>
          <coordinates>-71.06571601465738,42.35241910162504</coordinates>
        </Point>
      </Placemark>
    </Folder>
    <Folder>
      <name><![CDATA[9/11/14]]></name>
      <Placemark id="1410408530000">
        <name><![CDATA[Home]]></name>
        <description><![CDATA[<p>9/11/14<br/> 12:08 AM to 7:30 AM<br/> 7:21 hours</p>]]></description>
        <TimeSpan>
          <begin>2014-09-11T00:08:51-04:00</begin>
          <end>2014-09-11T07:30:25-04:00</end>
        </TimeSpan>
        <styleUrl>#place_home</styleUrl>
        <Point>
          <coordinates>-71.1114458017,42.3754311174</coordinates>
        </Point>
      </Placemark>
      <Placemark id="1410435809000">
        <name><![CDATA[Starbucks]]></name>
        <atom:link href="http://foursquare.com/venue/49bc4e56f964a52028541fe3"/>
        <description><![CDATA[<p>9/11/14<br/> 7:43 AM to 7:47 AM<br/> 3 min</p> <p>Café<br/> <a href="http://foursquare.com/venue/49bc4e56f964a52028541fe3">More details (Foursquare)</a> </p>]]></description>
        <TimeSpan>
          <begin>2014-09-11T07:43:30-04:00</begin>
          <end>2014-09-11T07:47:22-04:00</end>
        </TimeSpan>
        <styleUrl>#place_Café</styleUrl>
        <Point>
          <coordinates>-71.119452,42.372485</coordinates>
        </Point>
      </Placemark>
      <Placemark id="1410436935000">
        <name><![CDATA[Aldrich Hall]]></name>
        <atom:link href="http://foursquare.com/venue/4ac64359f964a5206eb320e3"/>
        <description><![CDATA[<p>9/11/14<br/> 8:02 AM to 9:47 AM<br/> 1:44 hours</p> <p>College Academic Building<br/> <a href="http://foursquare.com/venue/4ac64359f964a5206eb320e3">More details (Foursquare)</a> </p>]]></description>
        <TimeSpan>
          <begin>2014-09-11T08:02:16-04:00</begin>
          <end>2014-09-11T09:47:07-04:00</end>
        </TimeSpan>
        <styleUrl>#place_College Academic Building</styleUrl>
        <Point>
          <coordinates>-71.12210915179602,42.36578780710847</coordinates>
        </Point>
      </Placemark>
      <Placemark id="1410444058000">
        <name><![CDATA[Harvard Innovation Lab]]></name>
        <atom:link href="http://foursquare.com/venue/4e5d4676ae60839ea2e29e64"/>
        <description><![CDATA[<p>9/11/14<br/> 10:00 AM to 12:04 PM<br/> 2:03 hours</p> <p>College Technology Building<br/> <a href="http://foursquare.com/venue/4e5d4676ae60839ea2e29e64">More details (Foursquare)</a> </p>]]></description>
        <TimeSpan>
          <begin>2014-09-11T10:00:59-04:00</begin>
          <end>2014-09-11T12:04:10-04:00</end>
        </TimeSpan>
        <styleUrl>#place_College Technology Building</styleUrl>
        <Point>
          <coordinates>-71.12402979165076,42.36427488545988</coordinates>
        </Point>
      </Placemark>
      <Placemark id="1410452575000">
        <name><![CDATA[Orinoco]]></name>
        <atom:link href="http://foursquare.com/venue/4f106cace4b072565b8bd1b6"/>
        <description><![CDATA[<p>9/11/14<br/> 12:22 PM to 1:35 PM<br/> 1:12 hours</p> <p>Arepa Restaurant<br/> <a href="http://foursquare.com/venue/4f106cace4b072565b8bd1b6">More details (Foursquare)</a> </p>]]></description>
        <TimeSpan>
          <begin>2014-09-11T12:22:56-04:00</begin>
          <end>2014-09-11T13:35:22-04:00</end>
        </TimeSpan>
        <styleUrl>#place_Arepa Restaurant</styleUrl>
        <Point>
          <coordinates>-71.12049603929978,42.37190996862827</coordinates>
        </Point>
      </Placemark>
      <Placemark id="1410457084000">
        <name><![CDATA[The Red House Restaurant]]></name>
        <atom:link href="http://foursquare.com/venue/4409e8acf964a52068301fe3"/>
        <description><![CDATA[<p>9/11/14<br/> 1:38 PM to 2:39 PM<br/> 1:01 hours</p> <p>New American Restaurant<br/> <a href="http://foursquare.com/venue/4409e8acf964a52068301fe3">More details (Foursquare)</a> </p>]]></description>
        <TimeSpan>
          <begin>2014-09-11T13:38:05-04:00</begin>
          <end>2014-09-11T14:39:33-04:00</end>
        </TimeSpan>
        <styleUrl>#place_New American Restaurant</styleUrl>
        <Point>
          <coordinates>-71.121291,42.37249515</coordinates>
        </Point>
      </Placemark>
      <Placemark id="1410461919000">
        <name><![CDATA[Place in Allston]]></name>
        <description><![CDATA[<p>9/11/14<br/> 2:58 PM to 6:09 PM<br/> 3:10 hours</p>]]></description>
        <TimeSpan>
          <begin>2014-09-11T14:58:40-04:00</begin>
          <end>2014-09-11T18:09:03-04:00</end>
        </TimeSpan>
        <styleUrl>#place_unknown</styleUrl>
        <Point>
          <coordinates>-71.1209586691,42.3654244908</coordinates>
        </Point>
      </Placemark>
      <Placemark id="1410474110000">
        <name><![CDATA[Park]]></name>
        <atom:link href="http://foursquare.com/venue/4f7c8902e4b032c26c6798db"/>
        <description><![CDATA[<p>9/11/14<br/> 6:21 PM to 7:49 PM<br/> 1:27 hours</p> <p>Gastropub<br/> <a href="http://foursquare.com/venue/4f7c8902e4b032c26c6798db">More details (Foursquare)</a> </p>]]></description>
        <TimeSpan>
          <begin>2014-09-11T18:21:51-04:00</begin>
          <end>2014-09-11T19:49:04-04:00</end>
        </TimeSpan>
        <styleUrl>#place_Gastropub</styleUrl>
        <Point>
          <coordinates>-71.12097185013617,42.37169409933257</coordinates>
        </Point>
      </Placemark>
      <Placemark id="1410480099000">
        <name><![CDATA[Place in Old Cambridge]]></name>
        <description><![CDATA[<p>9/11/14<br/> 8:01 PM to 8:07 PM<br/> 5 min</p>]]></description>
        <TimeSpan>
          <begin>2014-09-11T20:01:40-04:00</begin>
          <end>2014-09-11T20:07:32-04:00</end>
        </TimeSpan>
        <styleUrl>#place_unknown</styleUrl>
        <Point>
          <coordinates>-71.1146211906,42.3687046575</coordinates>
        </Point>
      </Placemark>
      <Placemark id="1410480766000">
        <name><![CDATA[Place in Cambridgeport]]></name>
        <description><![CDATA[<p>9/11/14<br/> 8:12 PM to 9:46 PM<br/> 1:33 hours</p>]]></description>
        <TimeSpan>
          <begin>2014-09-11T20:12:47-04:00</begin>
          <end>2014-09-11T21:45:59-04:00</end>
        </TimeSpan>
        <styleUrl>#place_unknown</styleUrl>
        <Point>
          <coordinates>-71.1136032727,42.3660799784</coordinates>
        </Point>
      </Placemark>
      <Placemark id="1410487329000">
        <name><![CDATA[Home]]></name>
        <description><![CDATA[<p>9/11/14<br/> 10:02 PM to 12:00 AM<br/> 1:57 hours</p>]]></description>
        <TimeSpan>
          <begin>2014-09-11T22:02:10-04:00</begin>
          <end>2014-09-11T23:59:59-04:00</end>
        </TimeSpan>
        <styleUrl>#place_home</styleUrl>
        <Point>
          <coordinates>-71.1114458017,42.3754311174</coordinates>
        </Point>
      </Placemark>
    </Folder>
    <Folder>
      <name><![CDATA[9/12/14]]></name>
      <Placemark id="1410494400000">
        <name><![CDATA[Home]]></name>
        <description><![CDATA[<p>9/12/14<br/> 12:00 AM to 6:48 AM<br/> 6:48 hours</p>]]></description>
        <TimeSpan>
          <begin>2014-09-12T00:00:01-04:00</begin>
          <end>2014-09-12T06:48:37-04:00</end>
        </TimeSpan>
        <styleUrl>#place_home</styleUrl>
        <Point>
          <coordinates>-71.1114458017,42.3754311174</coordinates>
        </Point>
      </Placemark>
      <Placemark id="1410519653000">
        <name><![CDATA[Starbucks]]></name>
        <atom:link href="http://foursquare.com/venue/49bc4e56f964a52028541fe3"/>
        <description><![CDATA[<p>9/12/14<br/> 7:00 AM to 7:03 AM<br/> 2 min</p> <p>Café<br/> <a href="http://foursquare.com/venue/49bc4e56f964a52028541fe3">More details (Foursquare)</a> </p>]]></description>
        <TimeSpan>
          <begin>2014-09-12T07:00:54-04:00</begin>
          <end>2014-09-12T07:03:05-04:00</end>
        </TimeSpan>
        <styleUrl>#place_Café</styleUrl>
        <Point>
          <coordinates>-71.119452,42.372485</coordinates>
        </Point>
      </Placemark>
      <Placemark id="1410520897000">
        <name><![CDATA[Harvard Innovation Lab]]></name>
        <atom:link href="http://foursquare.com/venue/4e5d4676ae60839ea2e29e64"/>
        <description><![CDATA[<p>9/12/14<br/> 7:21 AM to 8:52 AM<br/> 1:30 hours</p> <p>College Technology Building<br/> <a href="http://foursquare.com/venue/4e5d4676ae60839ea2e29e64">More details (Foursquare)</a> </p>]]></description>
        <TimeSpan>
          <begin>2014-09-12T07:21:38-04:00</begin>
          <end>2014-09-12T08:52:30-04:00</end>
        </TimeSpan>
        <styleUrl>#place_College Technology Building</styleUrl>
        <Point>
          <coordinates>-71.12402979165076,42.36427488545988</coordinates>
        </Point>
      </Placemark>
      <Placemark id="1410526907000">
        <name><![CDATA[Aldrich Hall]]></name>
        <atom:link href="http://foursquare.com/venue/4ac64359f964a5206eb320e3"/>
        <description><![CDATA[<p>9/12/14<br/> 9:01 AM to 3:01 PM<br/> 5:59 hours</p> <p>College Academic Building<br/> <a href="http://foursquare.com/venue/4ac64359f964a5206eb320e3">More details (Foursquare)</a> </p>]]></description>
        <TimeSpan>
          <begin>2014-09-12T09:01:48-04:00</begin>
          <end>2014-09-12T15:01:37-04:00</end>
        </TimeSpan>
        <styleUrl>#place_College Academic Building</styleUrl>
        <Point>
          <coordinates>-71.12210915179602,42.36578780710847</coordinates>
        </Point>
      </Placemark>
      <Placemark id="1410548782000">
        <name><![CDATA[Place in Allston]]></name>
        <description><![CDATA[<p>9/12/14<br/> 3:06 PM to 3:10 PM<br/> 3 min</p>]]></description>
        <TimeSpan>
          <begin>2014-09-12T15:06:23-04:00</begin>
          <end>2014-09-12T15:10:12-04:00</end>
        </TimeSpan>
        <styleUrl>#place_unknown</styleUrl>
        <Point>
          <coordinates>-71.1218881979,42.365625742</coordinates>
        </Point>
      </Placemark>
      <Placemark id="1410549306000">
        <name><![CDATA[Aldrich Hall]]></name>
        <atom:link href="http://foursquare.com/venue/4ac64359f964a5206eb320e3"/>
        <description><![CDATA[<p>9/12/14<br/> 3:15 PM to 5:42 PM<br/> 2:26 hours</p> <p>College Academic Building<br/> <a href="http://foursquare.com/venue/4ac64359f964a5206eb320e3">More details (Foursquare)</a> </p>]]></description>
        <TimeSpan>
          <begin>2014-09-12T15:15:07-04:00</begin>
          <end>2014-09-12T17:42:04-04:00</end>
        </TimeSpan>
        <styleUrl>#place_College Academic Building</styleUrl>
        <Point>
          <coordinates>-71.12210915179602,42.36578780710847</coordinates>
        </Point>
      </Placemark>
      <Placemark id="1410559088000">
        <name><![CDATA[The Charles Hotel]]></name>
        <atom:link href="http://foursquare.com/venue/4a3eb3f3f964a5204fa31fe3"/>
        <description><![CDATA[<p>9/12/14<br/> 5:58 PM to 7:41 PM<br/> 1:43 hours</p> <p>Hotel<br/> <a href="http://foursquare.com/venue/4a3eb3f3f964a5204fa31fe3">More details (Foursquare)</a> </p>]]></description>
        <TimeSpan>
          <begin>2014-09-12T17:58:09-04:00</begin>
          <end>2014-09-12T19:41:50-04:00</end>
        </TimeSpan>
        <styleUrl>#place_Hotel</styleUrl>
        <Point>
          <coordinates>-71.12295627593994,42.3724718672702</coordinates>
        </Point>
      </Placemark>
      <Placemark id="1410566363000">
        <name><![CDATA[Home]]></name>
        <description><![CDATA[<p>9/12/14<br/> 7:59 PM to 12:00 AM<br/> 4:00 hours</p>]]></description>
        <TimeSpan>
          <begin>2014-09-12T19:59:24-04:00</begin>
          <end>2014-09-12T23:59:59-04:00</end>
        </TimeSpan>
        <styleUrl>#place_home</styleUrl>
        <Point>
          <coordinates>-71.1114458017,42.3754311174</coordinates>
        </Point>
      </Placemark>
    </Folder>
    <Folder>
      <name><![CDATA[9/13/14]]></name>
      <Placemark id="1410580800000">
        <name><![CDATA[Home]]></name>
        <description><![CDATA[<p>9/13/14<br/> 12:00 AM to 3:34 PM<br/> 15:34 hours</p>]]></description>
        <TimeSpan>
          <begin>2014-09-13T00:00:01-04:00</begin>
          <end>2014-09-13T15:34:06-04:00</end>
        </TimeSpan>
        <styleUrl>#place_home</styleUrl>
        <Point>
          <coordinates>-71.1114458017,42.3754311174</coordinates>
        </Point>
      </Placemark>
      <Placemark id="1410637706000">
        <name><![CDATA[Hemenway Gym]]></name>
        <atom:link href="http://foursquare.com/venue/4a9d3432f964a520ed3720e3"/>
        <description><![CDATA[<p>9/13/14<br/> 3:48 PM to 4:23 PM<br/> 34 min</p> <p>Gym<br/> <a href="http://foursquare.com/venue/4a9d3432f964a520ed3720e3">More details (Foursquare)</a> </p>]]></description>
        <TimeSpan>
          <begin>2014-09-13T15:48:27-04:00</begin>
          <end>2014-09-13T16:23:07-04:00</end>
        </TimeSpan>
        <styleUrl>#place_Gym</styleUrl>
        <Point>
          <coordinates>-71.11979972974,42.37697342388555</coordinates>
        </Point>
      </Placemark>
      <Placemark id="1410640686000">
        <name><![CDATA[Home]]></name>
        <description><![CDATA[<p>9/13/14<br/> 4:38 PM to 12:00 AM<br/> 7:21 hours</p>]]></description>
        <TimeSpan>
          <begin>2014-09-13T16:38:07-04:00</begin>
          <end>2014-09-13T23:59:59-04:00</end>
        </TimeSpan>
        <styleUrl>#place_home</styleUrl>
        <Point>
          <coordinates>-71.1114458017,42.3754311174</coordinates>
        </Point>
      </Placemark>
    </Folder>
    <Folder>
      <name><![CDATA[9/14/14]]></name>
      <Placemark id="1410667200000">
        <name><![CDATA[Home]]></name>
        <description><![CDATA[<p>9/14/14<br/> 12:00 AM to 1:03 PM<br/> 13:03 hours</p>]]></description>
        <TimeSpan>
          <begin>2014-09-14T00:00:01-04:00</begin>
          <end>2014-09-14T13:03:41-04:00</end>
        </TimeSpan>
        <styleUrl>#place_home</styleUrl>
        <Point>
          <coordinates>-71.1114458017,42.3754311174</coordinates>
        </Point>
      </Placemark>
      <Placemark id="1410715106000">
        <name><![CDATA[Staples]]></name>
        <atom:link href="http://foursquare.com/venue/4b1e88eaf964a520321b24e3"/>
        <description><![CDATA[<p>9/14/14<br/> 1:18 PM to 1:24 PM<br/> 6 min</p> <p>Paper / Office Supplies Store<br/> <a href="http://foursquare.com/venue/4b1e88eaf964a520321b24e3">More details (Foursquare)</a> </p>]]></description>
        <TimeSpan>
          <begin>2014-09-14T13:18:27-04:00</begin>
          <end>2014-09-14T13:24:39-04:00</end>
        </TimeSpan>
        <styleUrl>#place_Paper / Office Supplies Store</styleUrl>
        <Point>
          <coordinates>-71.119043,42.373776</coordinates>
        </Point>
      </Placemark>
      <Placemark id="1410715852000">
        <name><![CDATA[Adams House]]></name>
        <atom:link href="http://foursquare.com/venue/4b5e4514f964a520f28629e3"/>
        <description><![CDATA[<p>9/14/14<br/> 1:30 PM to 1:33 PM<br/> 2 min</p> <p>College Residence Hall<br/> <a href="http://foursquare.com/venue/4b5e4514f964a520f28629e3">More details (Foursquare)</a> </p>]]></description>
        <TimeSpan>
          <begin>2014-09-14T13:30:53-04:00</begin>
          <end>2014-09-14T13:33:18-04:00</end>
        </TimeSpan>
        <styleUrl>#place_College Residence Hall</styleUrl>
        <Point>
          <coordinates>-71.11655026913272,42.3717166982379</coordinates>
        </Point>
      </Placemark>
      <Placemark id="1410716721000">
        <name><![CDATA[Home]]></name>
        <description><![CDATA[<p>9/14/14<br/> 1:45 PM to 12:00 AM<br/> 10:14 hours</p>]]></description>
        <TimeSpan>
          <begin>2014-09-14T13:45:22-04:00</begin>
          <end>2014-09-14T23:59:59-04:00</end>
        </TimeSpan>
        <styleUrl>#place_home</styleUrl>
        <Point>
          <coordinates>-71.1114458017,42.3754311174</coordinates>
        </Point>
      </Placemark>
    </Folder>
    <Folder>
      <name><![CDATA[9/15/14]]></name>
      <Placemark id="1410753600000">
        <name><![CDATA[Home]]></name>
        <description><![CDATA[<p>9/15/14<br/> 12:00 AM to 7:26 AM<br/> 7:26 hours</p>]]></description>
        <TimeSpan>
          <begin>2014-09-15T00:00:01-04:00</begin>
          <end>2014-09-15T07:26:05-04:00</end>
        </TimeSpan>
        <styleUrl>#place_home</styleUrl>
        <Point>
          <coordinates>-71.1114458017,42.3754311174</coordinates>
        </Point>
      </Placemark>
      <Placemark id="1410782067000">
        <name><![CDATA[Harvard Innovation Lab]]></name>
        <atom:link href="http://foursquare.com/venue/4e5d4676ae60839ea2e29e64"/>
        <description><![CDATA[<p>9/15/14<br/> 7:54 AM to 8:55 AM<br/> 1:01 hours</p> <p>College Technology Building<br/> <a href="http://foursquare.com/venue/4e5d4676ae60839ea2e29e64">More details (Foursquare)</a> </p>]]></description>
        <TimeSpan>
          <begin>2014-09-15T07:54:28-04:00</begin>
          <end>2014-09-15T08:55:48-04:00</end>
        </TimeSpan>
        <styleUrl>#place_College Technology Building</styleUrl>
        <Point>
          <coordinates>-71.12402979165076,42.36427488545988</coordinates>
        </Point>
      </Placemark>
      <Placemark id="1410786297000">
        <name><![CDATA[Aldrich Hall]]></name>
        <atom:link href="http://foursquare.com/venue/4ac64359f964a5206eb320e3"/>
        <description><![CDATA[<p>9/15/14<br/> 9:04 AM to 1:01 PM<br/> 3:56 hours</p> <p>College Academic Building<br/> <a href="http://foursquare.com/venue/4ac64359f964a5206eb320e3">More details (Foursquare)</a> </p>]]></description>
        <TimeSpan>
          <begin>2014-09-15T09:04:58-04:00</begin>
          <end>2014-09-15T13:01:07-04:00</end>
        </TimeSpan>
        <styleUrl>#place_College Academic Building</styleUrl>
        <Point>
          <coordinates>-71.12210915179602,42.36578780710847</coordinates>
        </Point>
      </Placemark>
      <Placemark id="1410801899000">
        <name><![CDATA[Broadway Marketplace]]></name>
        <atom:link href="http://foursquare.com/venue/4a661612f964a520ffc71fe3"/>
        <description><![CDATA[<p>9/15/14<br/> 1:24 PM to 1:31 PM<br/> 6 min</p> <p>Grocery Store<br/> <a href="http://foursquare.com/venue/4a661612f964a520ffc71fe3">More details (Foursquare)</a> </p>]]></description>
        <TimeSpan>
          <begin>2014-09-15T13:25:00-04:00</begin>
          <end>2014-09-15T13:31:19-04:00</end>
        </TimeSpan>
        <styleUrl>#place_Grocery Store</styleUrl>
        <Point>
          <coordinates>-71.11300484548056,42.37405171427381</coordinates>
        </Point>
      </Placemark>
      <Placemark id="1410802561000">
        <name><![CDATA[Home]]></name>
        <description><![CDATA[<p>9/15/14<br/> 1:36 PM to 3:30 PM<br/> 1:54 hours</p>]]></description>
        <TimeSpan>
          <begin>2014-09-15T13:36:02-04:00</begin>
          <end>2014-09-15T15:30:02-04:00</end>
        </TimeSpan>
        <styleUrl>#place_home</styleUrl>
        <Point>
          <coordinates>-71.1114458017,42.3754311174</coordinates>
        </Point>
      </Placemark>
      <Placemark id="1410810841000">
        <name><![CDATA[Aldrich Hall]]></name>
        <atom:link href="http://foursquare.com/venue/4ac64359f964a5206eb320e3"/>
        <description><![CDATA[<p>9/15/14<br/> 3:54 PM to 4:32 PM<br/> 38 min</p> <p>College Academic Building<br/> <a href="http://foursquare.com/venue/4ac64359f964a5206eb320e3">More details (Foursquare)</a> </p>]]></description>
        <TimeSpan>
          <begin>2014-09-15T15:54:02-04:00</begin>
          <end>2014-09-15T16:32:15-04:00</end>
        </TimeSpan>
        <styleUrl>#place_College Academic Building</styleUrl>
        <Point>
          <coordinates>-71.12210915179602,42.36578780710847</coordinates>
        </Point>
      </Placemark>
      <Placemark id="1410813418000">
        <name><![CDATA[Harvard Innovation Lab]]></name>
        <atom:link href="http://foursquare.com/venue/4e5d4676ae60839ea2e29e64"/>
        <description><![CDATA[<p>9/15/14<br/> 4:36 PM to 6:00 PM<br/> 1:23 hours</p> <p>College Technology Building<br/> <a href="http://foursquare.com/venue/4e5d4676ae60839ea2e29e64">More details (Foursquare)</a> </p>]]></description>
        <TimeSpan>
          <begin>2014-09-15T16:36:59-04:00</begin>
          <end>2014-09-15T18:00:28-04:00</end>
        </TimeSpan>
        <styleUrl>#place_College Technology Building</styleUrl>
        <Point>
          <coordinates>-71.12402979165076,42.36427488545988</coordinates>
        </Point>
      </Placemark>
      <Placemark id="1410820890000">
        <name><![CDATA[Home]]></name>
        <description><![CDATA[<p>9/15/14<br/> 6:41 PM to 9:12 PM<br/> 2:30 hours</p>]]></description>
        <TimeSpan>
          <begin>2014-09-15T18:41:31-04:00</begin>
          <end>2014-09-15T21:12:03-04:00</end>
        </TimeSpan>
        <styleUrl>#place_home</styleUrl>
        <Point>
          <coordinates>-71.1114458017,42.3754311174</coordinates>
        </Point>
      </Placemark>
      <Placemark id="1410830398000">
        <name><![CDATA[The Kirkland Tap & Trotter]]></name>
        <atom:link href="http://foursquare.com/venue/52268df493cd24f393bf6d33"/>
        <description><![CDATA[<p>9/15/14<br/> 9:19 PM to 10:45 PM<br/> 1:25 hours</p> <p>Gastropub<br/> <a href="http://foursquare.com/venue/52268df493cd24f393bf6d33">More details (Foursquare)</a> </p>]]></description>
        <TimeSpan>
          <begin>2014-09-15T21:19:59-04:00</begin>
          <end>2014-09-15T22:45:09-04:00</end>
        </TimeSpan>
        <styleUrl>#place_Gastropub</styleUrl>
        <Point>
          <coordinates>-71.10686302185059,42.37823398029997</coordinates>
        </Point>
      </Placemark>
      <Placemark id="1410836119000">
        <name><![CDATA[Home]]></name>
        <description><![CDATA[<p>9/15/14<br/> 10:55 PM to 12:00 AM<br/> 1:04 hours</p>]]></description>
        <TimeSpan>
          <begin>2014-09-15T22:55:20-04:00</begin>
          <end>2014-09-15T23:59:59-04:00</end>
        </TimeSpan>
        <styleUrl>#place_home</styleUrl>
        <Point>
          <coordinates>-71.1114458017,42.3754311174</coordinates>
        </Point>
      </Placemark>
    </Folder>
    <Folder>
      <name><![CDATA[9/16/14]]></name>
      <Placemark id="1410840000000">
        <name><![CDATA[Home]]></name>
        <description><![CDATA[<p>9/16/14<br/> 12:00 AM to 6:48 AM<br/> 6:48 hours</p>]]></description>
        <TimeSpan>
          <begin>2014-09-16T00:00:01-04:00</begin>
          <end>2014-09-16T06:48:18-04:00</end>
        </TimeSpan>
        <styleUrl>#place_home</styleUrl>
        <Point>
          <coordinates>-71.1114458017,42.3754311174</coordinates>
        </Point>
      </Placemark>
      <Placemark id="1410865195000">
        <name><![CDATA[Starbucks]]></name>
        <atom:link href="http://foursquare.com/venue/49bc4e56f964a52028541fe3"/>
        <description><![CDATA[<p>9/16/14<br/> 6:59 AM to 7:04 AM<br/> 4 min</p> <p>Café<br/> <a href="http://foursquare.com/venue/49bc4e56f964a52028541fe3">More details (Foursquare)</a> </p>]]></description>
        <TimeSpan>
          <begin>2014-09-16T06:59:56-04:00</begin>
          <end>2014-09-16T07:04:18-04:00</end>
        </TimeSpan>
        <styleUrl>#place_Café</styleUrl>
        <Point>
          <coordinates>-71.119452,42.372485</coordinates>
        </Point>
      </Placemark>
      <Placemark id="1410866577000">
        <name><![CDATA[Harvard Innovation Lab]]></name>
        <atom:link href="http://foursquare.com/venue/4e5d4676ae60839ea2e29e64"/>
        <description><![CDATA[<p>9/16/14<br/> 7:22 AM to 8:52 AM<br/> 1:29 hours</p> <p>College Technology Building<br/> <a href="http://foursquare.com/venue/4e5d4676ae60839ea2e29e64">More details (Foursquare)</a> </p>]]></description>
        <TimeSpan>
          <begin>2014-09-16T07:22:58-04:00</begin>
          <end>2014-09-16T08:52:31-04:00</end>
        </TimeSpan>
        <styleUrl>#place_College Technology Building</styleUrl>
        <Point>
          <coordinates>-71.12402979165076,42.36427488545988</coordinates>
        </Point>
      </Placemark>
      <Placemark id="1410872411000">
        <name><![CDATA[Aldrich Hall]]></name>
        <atom:link href="http://foursquare.com/venue/4ac64359f964a5206eb320e3"/>
        <description><![CDATA[<p>9/16/14<br/> 9:00 AM to 12:15 PM<br/> 3:15 hours</p> <p>College Academic Building<br/> <a href="http://foursquare.com/venue/4ac64359f964a5206eb320e3">More details (Foursquare)</a> </p>]]></description>
        <TimeSpan>
          <begin>2014-09-16T09:00:12-04:00</begin>
          <end>2014-09-16T12:15:38-04:00</end>
        </TimeSpan>
        <styleUrl>#place_College Academic Building</styleUrl>
        <Point>
          <coordinates>-71.12210915179602,42.36578780710847</coordinates>
        </Point>
      </Placemark>
      <Placemark id="1410884501000">
        <name><![CDATA[Morgan Hall]]></name>
        <atom:link href="http://foursquare.com/venue/4adf6b74f964a520697a21e3"/>
        <description><![CDATA[<p>9/16/14<br/> 12:21 PM to 12:46 PM<br/> 24 min</p> <p>College Administrative Building<br/> <a href="http://foursquare.com/venue/4adf6b74f964a520697a21e3">More details (Foursquare)</a> </p>]]></description>
        <TimeSpan>
          <begin>2014-09-16T12:21:42-04:00</begin>
          <end>2014-09-16T12:45:59-04:00</end>
        </TimeSpan>
        <styleUrl>#place_College Administrative Building</styleUrl>
        <Point>
          <coordinates>-71.1239079386408,42.36670606297722</coordinates>
        </Point>
      </Placemark>
      <Placemark id="1410886803000">
        <name><![CDATA[Aldrich Hall]]></name>
        <atom:link href="http://foursquare.com/venue/4ac64359f964a5206eb320e3"/>
        <description><![CDATA[<p>9/16/14<br/> 1:00 PM to 4:08 PM<br/> 3:08 hours</p> <p>College Academic Building<br/> <a href="http://foursquare.com/venue/4ac64359f964a5206eb320e3">More details (Foursquare)</a> </p>]]></description>
        <TimeSpan>
          <begin>2014-09-16T13:00:04-04:00</begin>
          <end>2014-09-16T16:08:14-04:00</end>
        </TimeSpan>
        <styleUrl>#place_College Academic Building</styleUrl>
        <Point>
          <coordinates>-71.12210915179602,42.36578780710847</coordinates>
        </Point>
      </Placemark>
      <Placemark id="1410899479000">
        <name><![CDATA[Broadway Marketplace]]></name>
        <atom:link href="http://foursquare.com/venue/4a661612f964a520ffc71fe3"/>
        <description><![CDATA[<p>9/16/14<br/> 4:31 PM to 4:41 PM<br/> 10 min</p> <p>Grocery Store<br/> <a href="http://foursquare.com/venue/4a661612f964a520ffc71fe3">More details (Foursquare)</a> </p>]]></description>
        <TimeSpan>
          <begin>2014-09-16T16:31:20-04:00</begin>
          <end>2014-09-16T16:41:34-04:00</end>
        </TimeSpan>
        <styleUrl>#place_Grocery Store</styleUrl>
        <Point>
          <coordinates>-71.11300484548056,42.37405171427381</coordinates>
        </Point>
      </Placemark>
      <Placemark id="1410900421000">
        <name><![CDATA[Home]]></name>
        <description><![CDATA[<p>9/16/14<br/> 4:47 PM to 7:51 PM<br/> 3:04 hours</p>]]></description>
        <TimeSpan>
          <begin>2014-09-16T16:47:02-04:00</begin>
          <end>2014-09-16T19:51:05-04:00</end>
        </TimeSpan>
        <styleUrl>#place_home</styleUrl>
        <Point>
          <coordinates>-71.1114458017,42.3754311174</coordinates>
        </Point>
      </Placemark>
      <Placemark id="1410913054000">
        <name><![CDATA[Park]]></name>
        <atom:link href="http://foursquare.com/venue/4f7c8902e4b032c26c6798db"/>
        <description><![CDATA[<p>9/16/14<br/> 8:17 PM to 9:57 PM<br/> 1:39 hours</p> <p>Gastropub<br/> <a href="http://foursquare.com/venue/4f7c8902e4b032c26c6798db">More details (Foursquare)</a> </p>]]></description>
        <TimeSpan>
          <begin>2014-09-16T20:17:35-04:00</begin>
          <end>2014-09-16T21:57:22-04:00</end>
        </TimeSpan>
        <styleUrl>#place_Gastropub</styleUrl>
        <Point>
          <coordinates>-71.12097185013617,42.37169409933257</coordinates>
        </Point>
      </Placemark>
      <Placemark id="1410920253000">
        <name><![CDATA[Home]]></name>
        <description><![CDATA[<p>9/16/14<br/> 10:17 PM to 12:00 AM<br/> 1:42 hours</p>]]></description>
        <TimeSpan>
          <begin>2014-09-16T22:17:34-04:00</begin>
          <end>2014-09-16T23:59:59-04:00</end>
        </TimeSpan>
        <styleUrl>#place_home</styleUrl>
        <Point>
          <coordinates>-71.1114458017,42.3754311174</coordinates>
        </Point>
      </Placemark>
    </Folder>
    <Folder>
      <name><![CDATA[9/17/14]]></name>
      <Placemark id="1410926400000">
        <name><![CDATA[Home]]></name>
        <description><![CDATA[<p>9/17/14<br/> 12:00 AM to 6:54 AM<br/> 6:54 hours</p>]]></description>
        <TimeSpan>
          <begin>2014-09-17T00:00:01-04:00</begin>
          <end>2014-09-17T06:54:39-04:00</end>
        </TimeSpan>
        <styleUrl>#place_home</styleUrl>
        <Point>
          <coordinates>-71.1114458017,42.3754311174</coordinates>
        </Point>
      </Placemark>
      <Placemark id="1410952889000">
        <name><![CDATA[Harvard Innovation Lab]]></name>
        <atom:link href="http://foursquare.com/venue/4e5d4676ae60839ea2e29e64"/>
        <description><![CDATA[<p>9/17/14<br/> 7:21 AM to 8:53 AM<br/> 1:32 hours</p> <p>College Technology Building<br/> <a href="http://foursquare.com/venue/4e5d4676ae60839ea2e29e64">More details (Foursquare)</a> </p>]]></description>
        <TimeSpan>
          <begin>2014-09-17T07:21:30-04:00</begin>
          <end>2014-09-17T08:53:28-04:00</end>
        </TimeSpan>
        <styleUrl>#place_College Technology Building</styleUrl>
        <Point>
          <coordinates>-71.12407621183526,42.36403242532342</coordinates>
        </Point>
      </Placemark>
      <Placemark id="1410958858000">
        <name><![CDATA[Aldrich Hall]]></name>
        <atom:link href="http://foursquare.com/venue/4ac64359f964a5206eb320e3"/>
        <description><![CDATA[<p>9/17/14<br/> 9:00 AM to 2:50 PM<br/> 5:49 hours</p> <p>College Academic Building<br/> <a href="http://foursquare.com/venue/4ac64359f964a5206eb320e3">More details (Foursquare)</a> </p>]]></description>
        <TimeSpan>
          <begin>2014-09-17T09:00:59-04:00</begin>
          <end>2014-09-17T14:50:02-04:00</end>
        </TimeSpan>
        <styleUrl>#place_College Academic Building</styleUrl>
        <Point>
          <coordinates>-71.12210915179602,42.36578780710847</coordinates>
        </Point>
      </Placemark>
      <Placemark id="1410985089000">
        <name><![CDATA[Home]]></name>
        <description><![CDATA[<p>9/17/14<br/> 4:18 PM to 6:59 PM<br/> 2:41 hours</p>]]></description>
        <TimeSpan>
          <begin>2014-09-17T16:18:10-04:00</begin>
          <end>2014-09-17T18:59:29-04:00</end>
        </TimeSpan>
        <styleUrl>#place_home</styleUrl>
        <Point>
          <coordinates>-71.1114458017,42.3754311174</coordinates>
        </Point>
      </Placemark>
      <Placemark id="1410995406000">
        <name><![CDATA[Border Cafe]]></name>
        <atom:link href="http://foursquare.com/venue/3fd66200f964a520bded1ee3"/>
        <description><![CDATA[<p>9/17/14<br/> 7:10 PM to 8:06 PM<br/> 56 min</p> <p>Mexican Restaurant<br/> <a href="http://foursquare.com/venue/3fd66200f964a520bded1ee3">More details (Foursquare)</a> </p>]]></description>
        <TimeSpan>
          <begin>2014-09-17T19:10:07-04:00</begin>
          <end>2014-09-17T20:06:36-04:00</end>
        </TimeSpan>
        <styleUrl>#place_Mexican Restaurant</styleUrl>
        <Point>
          <coordinates>-71.120141,42.3743468</coordinates>
        </Point>
      </Placemark>
      <Placemark id="1410999767000">
        <name><![CDATA[Home]]></name>
        <description><![CDATA[<p>9/17/14<br/> 8:22 PM to 12:00 AM<br/> 3:37 hours</p>]]></description>
        <TimeSpan>
          <begin>2014-09-17T20:22:48-04:00</begin>
          <end>2014-09-17T23:59:59-04:00</end>
        </TimeSpan>
        <styleUrl>#place_home</styleUrl>
        <Point>
          <coordinates>-71.1114458017,42.3754311174</coordinates>
        </Point>
      </Placemark>
    </Folder>
    <Folder>
      <name><![CDATA[9/18/14]]></name>
      <Placemark id="1411012800000">
        <name><![CDATA[Home]]></name>
        <description><![CDATA[<p>9/18/14<br/> 12:00 AM to 7:26 AM<br/> 7:26 hours</p>]]></description>
        <TimeSpan>
          <begin>2014-09-18T00:00:01-04:00</begin>
          <end>2014-09-18T07:26:14-04:00</end>
        </TimeSpan>
        <styleUrl>#place_home</styleUrl>
        <Point>
          <coordinates>-71.1114458017,42.3754311174</coordinates>
        </Point>
      </Placemark>
      <Placemark id="1411041154000">
        <name><![CDATA[Harvard Innovation Lab]]></name>
        <atom:link href="http://foursquare.com/venue/4e5d4676ae60839ea2e29e64"/>
        <description><![CDATA[<p>9/18/14<br/> 7:52 AM to 8:53 AM<br/> 1:00 hours</p> <p>College Technology Building<br/> <a href="http://foursquare.com/venue/4e5d4676ae60839ea2e29e64">More details (Foursquare)</a> </p>]]></description>
        <TimeSpan>
          <begin>2014-09-18T07:52:35-04:00</begin>
          <end>2014-09-18T08:53:31-04:00</end>
        </TimeSpan>
        <styleUrl>#place_College Technology Building</styleUrl>
        <Point>
          <coordinates>-71.12402979165076,42.36427488545988</coordinates>
        </Point>
      </Placemark>
      <Placemark id="1411045216000">
        <name><![CDATA[Aldrich Hall]]></name>
        <atom:link href="http://foursquare.com/venue/4ac64359f964a5206eb320e3"/>
        <description><![CDATA[<p>9/18/14<br/> 9:00 AM to 3:08 PM<br/> 6:07 hours</p> <p>College Academic Building<br/> <a href="http://foursquare.com/venue/4ac64359f964a5206eb320e3">More details (Foursquare)</a> </p>]]></description>
        <TimeSpan>
          <begin>2014-09-18T09:00:17-04:00</begin>
          <end>2014-09-18T15:08:06-04:00</end>
        </TimeSpan>
        <styleUrl>#place_College Academic Building</styleUrl>
        <Point>
          <coordinates>-71.12210915179602,42.36578780710847</coordinates>
        </Point>
      </Placemark>
      <Placemark id="1411068088000">
        <name><![CDATA[RadioShack]]></name>
        <atom:link href="http://foursquare.com/venue/4af22b6bf964a5204fe621e3"/>
        <description><![CDATA[<p>9/18/14<br/> 3:21 PM to 3:28 PM<br/> 7 min</p> <p>Electronics Store<br/> <a href="http://foursquare.com/venue/4af22b6bf964a5204fe621e3">More details (Foursquare)</a> </p>]]></description>
        <TimeSpan>
          <begin>2014-09-18T15:21:29-04:00</begin>
          <end>2014-09-18T15:28:55-04:00</end>
        </TimeSpan>
        <styleUrl>#place_Electronics Store</styleUrl>
        <Point>
          <coordinates>-71.11988313496113,42.37280711531639</coordinates>
        </Point>
      </Placemark>
      <Placemark id="1411072073000">
        <name><![CDATA[Place in Logan International Airport]]></name>
        <description><![CDATA[<p>9/18/14<br/> 4:27 PM to 5:11 PM<br/> 43 min</p>]]></description>
        <TimeSpan>
          <begin>2014-09-18T16:27:54-04:00</begin>
          <end>2014-09-18T17:11:22-04:00</end>
        </TimeSpan>
        <styleUrl>#place_unknown</styleUrl>
        <Point>
          <coordinates>-71.0153481493,42.3663871252</coordinates>
        </Point>
      </Placemark>
      <Placemark id="1411082492000">
        <name><![CDATA[Place in Buckingham]]></name>
        <description><![CDATA[<p>9/18/14<br/> 7:21 PM to 7:30 PM<br/> 9 min</p>]]></description>
        <TimeSpan>
          <begin>2014-09-18T19:21:33-04:00</begin>
          <end>2014-09-18T19:30:51-04:00</end>
        </TimeSpan>
        <styleUrl>#place_unknown</styleUrl>
        <Point>
          <coordinates>-77.1080911337,38.8760558318</coordinates>
        </Point>
      </Placemark>
      <Placemark id="1411084321000">
        <name><![CDATA[NTN24-Washington, DC]]></name>
        <atom:link href="http://foursquare.com/venue/4ec5b5509a52756c53a0be9c"/>
        <description><![CDATA[<p>9/18/14<br/> 7:52 PM to 8:47 PM<br/> 55 min</p> <p>Office<br/> <a href="http://foursquare.com/venue/4ec5b5509a52756c53a0be9c">More details (Foursquare)</a> </p>]]></description>
        <TimeSpan>
          <begin>2014-09-18T19:52:02-04:00</begin>
          <end>2014-09-18T20:47:56-04:00</end>
        </TimeSpan>
        <styleUrl>#place_Office</styleUrl>
        <Point>
          <coordinates>-77.03193625222163,38.900182458396</coordinates>
        </Point>
      </Placemark>
      <Placemark id="1411094950000">
        <name><![CDATA[Laura's Home]]></name>
        <description><![CDATA[<p>9/18/14<br/> 10:49 PM to 12:00 AM<br/> 1:10 hours</p>]]></description>
        <TimeSpan>
          <begin>2014-09-18T22:49:11-04:00</begin>
          <end>2014-09-18T23:59:59-04:00</end>
        </TimeSpan>
        <styleUrl>#place_home</styleUrl>
        <Point>
          <coordinates>-77.0772744833,38.9219057145</coordinates>
        </Point>
      </Placemark>
    </Folder>
    <Folder>
      <name><![CDATA[9/19/14]]></name>
      <Placemark id="1411099200000">
        <name><![CDATA[Laura's Home]]></name>
        <description><![CDATA[<p>9/19/14<br/> 12:00 AM to 9:53 AM<br/> 9:53 hours</p>]]></description>
        <TimeSpan>
          <begin>2014-09-19T00:00:01-04:00</begin>
          <end>2014-09-19T09:53:28-04:00</end>
        </TimeSpan>
        <styleUrl>#place_home</styleUrl>
        <Point>
          <coordinates>-77.0772744833,38.9219057145</coordinates>
        </Point>
      </Placemark>
      <Placemark id="1411135418000">
        <name><![CDATA[Starbucks]]></name>
        <atom:link href="http://foursquare.com/venue/4ae84ab0f964a52085ae21e3"/>
        <description><![CDATA[<p>9/19/14<br/> 10:03 AM to 12:17 PM<br/> 2:13 hours</p> <p>Coffee Shop<br/> <a href="http://foursquare.com/venue/4ae84ab0f964a52085ae21e3">More details (Foursquare)</a> </p>]]></description>
        <TimeSpan>
          <begin>2014-09-19T10:03:39-04:00</begin>
          <end>2014-09-19T12:17:14-04:00</end>
        </TimeSpan>
        <styleUrl>#place_Coffee Shop</styleUrl>
        <Point>
          <coordinates>-77.07147493555041,38.92009508267315</coordinates>
        </Point>
      </Placemark>
      <Placemark id="1411144028000">
        <name><![CDATA[Laura's Home]]></name>
        <description><![CDATA[<p>9/19/14<br/> 12:27 PM to 12:56 PM<br/> 28 min</p>]]></description>
        <TimeSpan>
          <begin>2014-09-19T12:27:09-04:00</begin>
          <end>2014-09-19T12:56:00-04:00</end>
        </TimeSpan>
        <styleUrl>#place_home</styleUrl>
        <Point>
          <coordinates>-77.0772744833,38.9219057145</coordinates>
        </Point>
      </Placemark>
      <Placemark id="1411146195000">
        <name><![CDATA[Surfside]]></name>
        <atom:link href="http://foursquare.com/venue/4a02762ef964a52056711fe3"/>
        <description><![CDATA[<p>9/19/14<br/> 1:03 PM to 1:07 PM<br/> 4 min</p> <p>Mexican Restaurant<br/> <a href="http://foursquare.com/venue/4a02762ef964a52056711fe3">More details (Foursquare)</a> </p>]]></description>
        <TimeSpan>
          <begin>2014-09-19T13:03:16-04:00</begin>
          <end>2014-09-19T13:07:28-04:00</end>
        </TimeSpan>
        <styleUrl>#place_Mexican Restaurant</styleUrl>
        <Point>
          <coordinates>-77.072873711586,38.92206976004444</coordinates>
        </Point>
      </Placemark>
      <Placemark id="1411146867000">
        <name><![CDATA[Laura's Home]]></name>
        <description><![CDATA[<p>9/19/14<br/> 1:14 PM to 12:00 AM<br/> 10:45 hours</p>]]></description>
        <TimeSpan>
          <begin>2014-09-19T13:14:28-04:00</begin>
          <end>2014-09-19T23:59:59-04:00</end>
        </TimeSpan>
        <styleUrl>#place_home</styleUrl>
        <Point>
          <coordinates>-77.0772744833,38.9219057145</coordinates>
        </Point>
      </Placemark>
    </Folder>
    <Folder>
      <name><![CDATA[9/20/14]]></name>
      <Placemark id="1411185600000">
        <name><![CDATA[Laura's Home]]></name>
        <description><![CDATA[<p>9/20/14<br/> 12:00 AM to 3:11 PM<br/> 15:11 hours</p>]]></description>
        <TimeSpan>
          <begin>2014-09-20T00:00:01-04:00</begin>
          <end>2014-09-20T15:11:28-04:00</end>
        </TimeSpan>
        <styleUrl>#place_home</styleUrl>
        <Point>
          <coordinates>-77.0772744833,38.9219057145</coordinates>
        </Point>
      </Placemark>
      <Placemark id="1411240985000">
        <name><![CDATA[CVS/pharmacy]]></name>
        <atom:link href="http://foursquare.com/venue/4a89f3c7f964a520790920e3"/>
        <description><![CDATA[<p>9/20/14<br/> 3:23 PM to 3:30 PM<br/> 7 min</p> <p>Drugstore / Pharmacy<br/> <a href="http://foursquare.com/venue/4a89f3c7f964a520790920e3">More details (Foursquare)</a> </p>]]></description>
        <TimeSpan>
          <begin>2014-09-20T15:23:06-04:00</begin>
          <end>2014-09-20T15:30:27-04:00</end>
        </TimeSpan>
        <styleUrl>#place_Drugstore / Pharmacy</styleUrl>
        <Point>
          <coordinates>-77.071487,38.92005</coordinates>
        </Point>
      </Placemark>
      <Placemark id="1411242846000">
        <name><![CDATA[Apple Store]]></name>
        <atom:link href="http://foursquare.com/venue/4bdb67c03904a59377434a9e"/>
        <description><![CDATA[<p>9/20/14<br/> 3:54 PM to 3:57 PM<br/> 2 min</p> <p>Electronics Store<br/> <a href="http://foursquare.com/venue/4bdb67c03904a59377434a9e">More details (Foursquare)</a> </p>]]></description>
        <TimeSpan>
          <begin>2014-09-20T15:54:07-04:00</begin>
          <end>2014-09-20T15:57:01-04:00</end>
