<?xml version="1.0" encoding="UTF-8"?><kml xmlns="http://www.opengis.net/kml/2.2" xmlns:gx="http://www.google.com/kml/ext/2.2" xmlns:atom="http://www.w3.org/2005/Atom" xmlns:xal="urn:oasis:names:tc:ciq:xsdschema:xAL:2.0" xmlns:xsi="http://www.w3.org/2001/XMLSchema-instance">
  <Document>
    <atom:link href="http://www.moves-app.com"/>
    <description><![CDATA[<p align="center"><a href="http://www.moves-app.com"> <img src="http://www.moves-app.com/assets/moves.png"/> </a></p> <p align="center">Moves Storyline</p>]]></description>
    <Style id="place_Food Court">
      <IconStyle>
        <scale>1.0</scale>
        <heading>0.0</heading>
        <Icon>
          <href>https://ss1.4sqi.net/img/categories/shops/food_foodcourt.png</href>
          <refreshInterval>0.0</refreshInterval>
          <viewRefreshTime>0.0</viewRefreshTime>
          <viewBoundScale>0.0</viewBoundScale>
        </Icon>
      </IconStyle>
    </Style>
    <Style id="place_Tapas Restaurant">
      <IconStyle>
        <scale>1.0</scale>
        <heading>0.0</heading>
        <Icon>
          <href>https://ss1.4sqi.net/img/categories/food/default.png</href>
          <refreshInterval>0.0</refreshInterval>
          <viewRefreshTime>0.0</viewRefreshTime>
          <viewBoundScale>0.0</viewBoundScale>
        </Icon>
      </IconStyle>
    </Style>
    <Style id="place_Mexican Restaurant">
      <IconStyle>
        <scale>1.0</scale>
        <heading>0.0</heading>
        <Icon>
          <href>https://ss1.4sqi.net/img/categories/food/mexican.png</href>
          <refreshInterval>0.0</refreshInterval>
          <viewRefreshTime>0.0</viewRefreshTime>
          <viewBoundScale>0.0</viewBoundScale>
        </Icon>
      </IconStyle>
    </Style>
    <Style id="place_Building">
      <IconStyle>
        <scale>1.0</scale>
        <heading>0.0</heading>
        <Icon>
          <href>https://ss1.4sqi.net/img/categories/building/default.png</href>
          <refreshInterval>0.0</refreshInterval>
          <viewRefreshTime>0.0</viewRefreshTime>
          <viewBoundScale>0.0</viewBoundScale>
        </Icon>
      </IconStyle>
    </Style>
    <Style id="place_Resort">
      <IconStyle>
        <scale>1.0</scale>
        <heading>0.0</heading>
        <Icon>
          <href>https://ss1.4sqi.net/img/categories/travel/resort.png</href>
          <refreshInterval>0.0</refreshInterval>
          <viewRefreshTime>0.0</viewRefreshTime>
          <viewBoundScale>0.0</viewBoundScale>
        </Icon>
      </IconStyle>
    </Style>
    <Style id="place_Hotel">
      <IconStyle>
        <scale>1.0</scale>
        <heading>0.0</heading>
        <Icon>
          <href>https://ss1.4sqi.net/img/categories/travel/hotel.png</href>
          <refreshInterval>0.0</refreshInterval>
          <viewRefreshTime>0.0</viewRefreshTime>
          <viewBoundScale>0.0</viewBoundScale>
        </Icon>
      </IconStyle>
    </Style>
    <Style id="place_Garden">
      <IconStyle>
        <scale>1.0</scale>
        <heading>0.0</heading>
        <Icon>
          <href>https://ss1.4sqi.net/img/categories/parks_outdoors/garden.png</href>
          <refreshInterval>0.0</refreshInterval>
          <viewRefreshTime>0.0</viewRefreshTime>
          <viewBoundScale>0.0</viewBoundScale>
        </Icon>
      </IconStyle>
    </Style>
    <Style id="place_school">
      <IconStyle>
        <scale>1.0</scale>
        <heading>0.0</heading>
        <Icon>
          <href>http://ss1.4sqi.net/img/categories/building/school.png</href>
          <refreshInterval>0.0</refreshInterval>
          <viewRefreshTime>0.0</viewRefreshTime>
          <viewBoundScale>0.0</viewBoundScale>
        </Icon>
      </IconStyle>
    </Style>
    <Style id="place_Plaza">
      <IconStyle>
        <scale>1.0</scale>
        <heading>0.0</heading>
        <Icon>
          <href>https://ss1.4sqi.net/img/categories/parks_outdoors/default.png</href>
          <refreshInterval>0.0</refreshInterval>
          <viewRefreshTime>0.0</viewRefreshTime>
          <viewBoundScale>0.0</viewBoundScale>
        </Icon>
      </IconStyle>
    </Style>
    <Style id="place_Harbor / Marina">
      <IconStyle>
        <scale>1.0</scale>
        <heading>0.0</heading>
        <Icon>
          <href>https://ss1.4sqi.net/img/categories/parks_outdoors/harbor.png</href>
          <refreshInterval>0.0</refreshInterval>
          <viewRefreshTime>0.0</viewRefreshTime>
          <viewBoundScale>0.0</viewBoundScale>
        </Icon>
      </IconStyle>
    </Style>
    <Style id="place_Pub">
      <IconStyle>
        <scale>1.0</scale>
        <heading>0.0</heading>
        <Icon>
          <href>https://ss1.4sqi.net/img/categories/nightlife/pub.png</href>
          <refreshInterval>0.0</refreshInterval>
          <viewRefreshTime>0.0</viewRefreshTime>
          <viewBoundScale>0.0</viewBoundScale>
        </Icon>
      </IconStyle>
    </Style>
    <Style id="place_Clothing Store">
      <IconStyle>
        <scale>1.0</scale>
        <heading>0.0</heading>
        <Icon>
          <href>https://ss1.4sqi.net/img/categories/shops/apparel.png</href>
          <refreshInterval>0.0</refreshInterval>
          <viewRefreshTime>0.0</viewRefreshTime>
          <viewBoundScale>0.0</viewBoundScale>
        </Icon>
      </IconStyle>
    </Style>
    <Style id="place_Coffee Shop">
      <IconStyle>
        <scale>1.0</scale>
        <heading>0.0</heading>
        <Icon>
          <href>https://ss1.4sqi.net/img/categories/food/coffeeshop.png</href>
          <refreshInterval>0.0</refreshInterval>
          <viewRefreshTime>0.0</viewRefreshTime>
          <viewBoundScale>0.0</viewBoundScale>
        </Icon>
      </IconStyle>
    </Style>
    <Style id="place_Historic Site">
      <IconStyle>
        <scale>1.0</scale>
        <heading>0.0</heading>
        <Icon>
          <href>https://ss1.4sqi.net/img/categories/arts_entertainment/museum.png</href>
          <refreshInterval>0.0</refreshInterval>
          <viewRefreshTime>0.0</viewRefreshTime>
          <viewBoundScale>0.0</viewBoundScale>
        </Icon>
      </IconStyle>
    </Style>
    <Style id="place_Train Station">
      <IconStyle>
        <scale>1.0</scale>
        <heading>0.0</heading>
        <Icon>
          <href>https://ss1.4sqi.net/img/categories/travel/trainstation.png</href>
          <refreshInterval>0.0</refreshInterval>
          <viewRefreshTime>0.0</viewRefreshTime>
          <viewBoundScale>0.0</viewBoundScale>
        </Icon>
      </IconStyle>
    </Style>
    <Style id="place_Mall">
      <IconStyle>
        <scale>1.0</scale>
        <heading>0.0</heading>
        <Icon>
          <href>https://ss1.4sqi.net/img/categories/shops/default.png</href>
          <refreshInterval>0.0</refreshInterval>
          <viewRefreshTime>0.0</viewRefreshTime>
          <viewBoundScale>0.0</viewBoundScale>
        </Icon>
      </IconStyle>
    </Style>
    <Style id="place_American Restaurant">
      <IconStyle>
        <scale>1.0</scale>
        <heading>0.0</heading>
        <Icon>
          <href>https://ss1.4sqi.net/img/categories/food/default.png</href>
          <refreshInterval>0.0</refreshInterval>
          <viewRefreshTime>0.0</viewRefreshTime>
          <viewBoundScale>0.0</viewBoundScale>
        </Icon>
      </IconStyle>
    </Style>
    <Style id="place_Sandwich Place">
      <IconStyle>
        <scale>1.0</scale>
        <heading>0.0</heading>
        <Icon>
          <href>https://ss1.4sqi.net/img/categories/food/sandwiches.png</href>
          <refreshInterval>0.0</refreshInterval>
          <viewRefreshTime>0.0</viewRefreshTime>
          <viewBoundScale>0.0</viewBoundScale>
        </Icon>
      </IconStyle>
    </Style>
    <Style id="place_Women's Store">
      <IconStyle>
        <scale>1.0</scale>
        <heading>0.0</heading>
        <Icon>
          <href>https://ss1.4sqi.net/img/categories/shops/apparel_women.png</href>
          <refreshInterval>0.0</refreshInterval>
          <viewRefreshTime>0.0</viewRefreshTime>
          <viewBoundScale>0.0</viewBoundScale>
        </Icon>
      </IconStyle>
    </Style>
    <Style id="place_work">
      <IconStyle>
        <scale>1.0</scale>
        <heading>0.0</heading>
        <Icon>
          <href>http://ss1.4sqi.net/img/categories/building/default.png</href>
          <refreshInterval>0.0</refreshInterval>
          <viewRefreshTime>0.0</viewRefreshTime>
          <viewBoundScale>0.0</viewBoundScale>
        </Icon>
      </IconStyle>
    </Style>
    <Style id="place_Ice Cream Shop">
      <IconStyle>
        <scale>1.0</scale>
        <heading>0.0</heading>
        <Icon>
          <href>https://ss1.4sqi.net/img/categories/food/icecream.png</href>
          <refreshInterval>0.0</refreshInterval>
          <viewRefreshTime>0.0</viewRefreshTime>
          <viewBoundScale>0.0</viewBoundScale>
        </Icon>
      </IconStyle>
    </Style>
    <Style id="place_user">
      <IconStyle>
        <scale>1.0</scale>
        <heading>0.0</heading>
        <Icon>
          <href>http://maps.google.com/mapfiles/marker_white.png</href>
          <refreshInterval>0.0</refreshInterval>
          <viewRefreshTime>0.0</viewRefreshTime>
          <viewBoundScale>0.0</viewBoundScale>
        </Icon>
      </IconStyle>
    </Style>
    <Style id="place_Seafood Restaurant">
      <IconStyle>
        <scale>1.0</scale>
        <heading>0.0</heading>
        <Icon>
          <href>https://ss1.4sqi.net/img/categories/food/seafood.png</href>
          <refreshInterval>0.0</refreshInterval>
          <viewRefreshTime>0.0</viewRefreshTime>
          <viewBoundScale>0.0</viewBoundScale>
        </Icon>
      </IconStyle>
    </Style>
    <Style id="place_Brazilian Restaurant">
      <IconStyle>
        <scale>1.0</scale>
        <heading>0.0</heading>
        <Icon>
          <href>https://ss1.4sqi.net/img/categories/food/brazilian.png</href>
          <refreshInterval>0.0</refreshInterval>
          <viewRefreshTime>0.0</viewRefreshTime>
          <viewBoundScale>0.0</viewBoundScale>
        </Icon>
      </IconStyle>
    </Style>
    <Style id="place_Gastropub">
      <IconStyle>
        <scale>1.0</scale>
        <heading>0.0</heading>
        <Icon>
          <href>https://ss1.4sqi.net/img/categories/food/default.png</href>
          <refreshInterval>0.0</refreshInterval>
          <viewRefreshTime>0.0</viewRefreshTime>
          <viewBoundScale>0.0</viewBoundScale>
        </Icon>
      </IconStyle>
    </Style>
    <Style id="place_Caribbean Restaurant">
      <IconStyle>
        <scale>1.0</scale>
        <heading>0.0</heading>
        <Icon>
          <href>https://ss1.4sqi.net/img/categories/food/default.png</href>
          <refreshInterval>0.0</refreshInterval>
          <viewRefreshTime>0.0</viewRefreshTime>
          <viewBoundScale>0.0</viewBoundScale>
        </Icon>
      </IconStyle>
    </Style>
    <Style id="place_College Academic Building">
      <IconStyle>
        <scale>1.0</scale>
        <heading>0.0</heading>
        <Icon>
          <href>https://ss1.4sqi.net/img/categories/education/default.png</href>
          <refreshInterval>0.0</refreshInterval>
          <viewRefreshTime>0.0</viewRefreshTime>
          <viewBoundScale>0.0</viewBoundScale>
        </Icon>
      </IconStyle>
    </Style>
    <Style id="place_Salon / Barbershop">
      <IconStyle>
        <scale>1.0</scale>
        <heading>0.0</heading>
        <Icon>
          <href>https://ss1.4sqi.net/img/categories/shops/salon_barber.png</href>
          <refreshInterval>0.0</refreshInterval>
          <viewRefreshTime>0.0</viewRefreshTime>
          <viewBoundScale>0.0</viewBoundScale>
        </Icon>
      </IconStyle>
    </Style>
    <Style id="place_foursquare">
      <IconStyle>
        <scale>1.0</scale>
        <heading>0.0</heading>
        <Icon>
          <href>http://maps.google.com/mapfiles/marker_white.png</href>
          <refreshInterval>0.0</refreshInterval>
          <viewRefreshTime>0.0</viewRefreshTime>
          <viewBoundScale>0.0</viewBoundScale>
        </Icon>
      </IconStyle>
    </Style>
    <Style id="place_Tech Startup">
      <IconStyle>
        <scale>1.0</scale>
        <heading>0.0</heading>
        <Icon>
          <href>https://ss1.4sqi.net/img/categories/shops/technology.png</href>
          <refreshInterval>0.0</refreshInterval>
          <viewRefreshTime>0.0</viewRefreshTime>
          <viewBoundScale>0.0</viewBoundScale>
        </Icon>
      </IconStyle>
    </Style>
    <Style id="place_Grocery Store">
      <IconStyle>
        <scale>1.0</scale>
        <heading>0.0</heading>
        <Icon>
          <href>https://ss1.4sqi.net/img/categories/shops/food_grocery.png</href>
          <refreshInterval>0.0</refreshInterval>
          <viewRefreshTime>0.0</viewRefreshTime>
          <viewBoundScale>0.0</viewBoundScale>
        </Icon>
      </IconStyle>
    </Style>
    <Style id="place_Bus Line">
      <IconStyle>
        <scale>1.0</scale>
        <heading>0.0</heading>
        <Icon>
          <href>https://ss1.4sqi.net/img/categories/travel/busstation.png</href>
          <refreshInterval>0.0</refreshInterval>
          <viewRefreshTime>0.0</viewRefreshTime>
          <viewBoundScale>0.0</viewBoundScale>
        </Icon>
      </IconStyle>
    </Style>
    <Style id="place_Dessert Shop">
      <IconStyle>
        <scale>1.0</scale>
        <heading>0.0</heading>
        <Icon>
          <href>https://ss1.4sqi.net/img/categories/food/dessert.png</href>
          <refreshInterval>0.0</refreshInterval>
          <viewRefreshTime>0.0</viewRefreshTime>
          <viewBoundScale>0.0</viewBoundScale>
        </Icon>
      </IconStyle>
    </Style>
    <Style id="place_College Quad">
      <IconStyle>
        <scale>1.0</scale>
        <heading>0.0</heading>
        <Icon>
          <href>https://ss1.4sqi.net/img/categories/education/default.png</href>
          <refreshInterval>0.0</refreshInterval>
          <viewRefreshTime>0.0</viewRefreshTime>
          <viewBoundScale>0.0</viewBoundScale>
        </Icon>
      </IconStyle>
    </Style>
    <Style id="place_Department Store">
      <IconStyle>
        <scale>1.0</scale>
        <heading>0.0</heading>
        <Icon>
          <href>https://ss1.4sqi.net/img/categories/shops/default.png</href>
          <refreshInterval>0.0</refreshInterval>
          <viewRefreshTime>0.0</viewRefreshTime>
          <viewBoundScale>0.0</viewBoundScale>
        </Icon>
      </IconStyle>
    </Style>
    <Style id="place_unknown">
      <IconStyle>
        <scale>1.0</scale>
        <heading>0.0</heading>
        <Icon>
          <href>http://maps.google.com/mapfiles/marker_white.png</href>
          <refreshInterval>0.0</refreshInterval>
          <viewRefreshTime>0.0</viewRefreshTime>
          <viewBoundScale>0.0</viewBoundScale>
        </Icon>
      </IconStyle>
    </Style>
    <Style id="place_University">
      <IconStyle>
        <scale>1.0</scale>
        <heading>0.0</heading>
        <Icon>
          <href>https://ss1.4sqi.net/img/categories/education/default.png</href>
          <refreshInterval>0.0</refreshInterval>
          <viewRefreshTime>0.0</viewRefreshTime>
          <viewBoundScale>0.0</viewBoundScale>
        </Icon>
      </IconStyle>
    </Style>
    <Style id="place_Ramen / Noodle House">
      <IconStyle>
        <scale>1.0</scale>
        <heading>0.0</heading>
        <Icon>
          <href>https://ss1.4sqi.net/img/categories/food/ramen.png</href>
          <refreshInterval>0.0</refreshInterval>
          <viewRefreshTime>0.0</viewRefreshTime>
          <viewBoundScale>0.0</viewBoundScale>
        </Icon>
      </IconStyle>
    </Style>
    <Style id="place_Castle">
      <IconStyle>
        <scale>1.0</scale>
        <heading>0.0</heading>
        <Icon>
          <href>https://ss1.4sqi.net/img/categories/parks_outdoors/default.png</href>
          <refreshInterval>0.0</refreshInterval>
          <viewRefreshTime>0.0</viewRefreshTime>
          <viewBoundScale>0.0</viewBoundScale>
        </Icon>
      </IconStyle>
    </Style>
    <Style id="place_Bar">
      <IconStyle>
        <scale>1.0</scale>
        <heading>0.0</heading>
        <Icon>
          <href>https://ss1.4sqi.net/img/categories/nightlife/bar.png</href>
          <refreshInterval>0.0</refreshInterval>
          <viewRefreshTime>0.0</viewRefreshTime>
          <viewBoundScale>0.0</viewBoundScale>
        </Icon>
      </IconStyle>
    </Style>
    <Style id="place_Airport">
      <IconStyle>
        <scale>1.0</scale>
        <heading>0.0</heading>
        <Icon>
          <href>https://ss1.4sqi.net/img/categories/travel/airport.png</href>
          <refreshInterval>0.0</refreshInterval>
          <viewRefreshTime>0.0</viewRefreshTime>
          <viewBoundScale>0.0</viewBoundScale>
        </Icon>
      </IconStyle>
    </Style>
    <Style id="place_home">
      <IconStyle>
        <scale>1.0</scale>
        <heading>0.0</heading>
        <Icon>
          <href>http://ss1.4sqi.net/img/categories/building/home.png</href>
          <refreshInterval>0.0</refreshInterval>
          <viewRefreshTime>0.0</viewRefreshTime>
          <viewBoundScale>0.0</viewBoundScale>
        </Icon>
      </IconStyle>
    </Style>
    <Style id="place_Drugstore / Pharmacy">
      <IconStyle>
        <scale>1.0</scale>
        <heading>0.0</heading>
        <Icon>
          <href>https://ss1.4sqi.net/img/categories/shops/drugstore.png</href>
          <refreshInterval>0.0</refreshInterval>
          <viewRefreshTime>0.0</viewRefreshTime>
          <viewBoundScale>0.0</viewBoundScale>
        </Icon>
      </IconStyle>
    </Style>
    <Style id="place_Office">
      <IconStyle>
        <scale>1.0</scale>
        <heading>0.0</heading>
        <Icon>
          <href>https://ss1.4sqi.net/img/categories/building/default.png</href>
          <refreshInterval>0.0</refreshInterval>
          <viewRefreshTime>0.0</viewRefreshTime>
          <viewBoundScale>0.0</viewBoundScale>
        </Icon>
      </IconStyle>
    </Style>
    <Style id="place_Lounge">
      <IconStyle>
        <scale>1.0</scale>
        <heading>0.0</heading>
        <Icon>
          <href>https://ss1.4sqi.net/img/categories/nightlife/lounge.png</href>
          <refreshInterval>0.0</refreshInterval>
          <viewRefreshTime>0.0</viewRefreshTime>
          <viewBoundScale>0.0</viewBoundScale>
        </Icon>
      </IconStyle>
    </Style>
    <Style id="place_Bus Station">
      <IconStyle>
        <scale>1.0</scale>
        <heading>0.0</heading>
        <Icon>
          <href>https://ss1.4sqi.net/img/categories/travel/busstation.png</href>
          <refreshInterval>0.0</refreshInterval>
          <viewRefreshTime>0.0</viewRefreshTime>
          <viewBoundScale>0.0</viewBoundScale>
        </Icon>
      </IconStyle>
    </Style>
    <Style id="place_Student Center">
      <IconStyle>
        <scale>1.0</scale>
        <heading>0.0</heading>
        <Icon>
          <href>https://ss1.4sqi.net/img/categories/education/default.png</href>
          <refreshInterval>0.0</refreshInterval>
          <viewRefreshTime>0.0</viewRefreshTime>
          <viewBoundScale>0.0</viewBoundScale>
        </Icon>
      </IconStyle>
    </Style>
    <Style id="place_Park">
      <IconStyle>
        <scale>1.0</scale>
        <heading>0.0</heading>
        <Icon>
          <href>https://ss1.4sqi.net/img/categories/parks_outdoors/default.png</href>
          <refreshInterval>0.0</refreshInterval>
          <viewRefreshTime>0.0</viewRefreshTime>
          <viewBoundScale>0.0</viewBoundScale>
        </Icon>
      </IconStyle>
    </Style>
    <Style id="place_Burger Joint">
      <IconStyle>
        <scale>1.0</scale>
        <heading>0.0</heading>
        <Icon>
          <href>https://ss1.4sqi.net/img/categories/food/burger.png</href>
          <refreshInterval>0.0</refreshInterval>
          <viewRefreshTime>0.0</viewRefreshTime>
          <viewBoundScale>0.0</viewBoundScale>
        </Icon>
      </IconStyle>
    </Style>
    <Folder>
      <name><![CDATA[6/1/14]]></name>
      <Placemark id="1401598800000">
        <name><![CDATA[Home]]></name>
        <description><![CDATA[<p>6/1/14<br/> 12:00 AM to 10:18 AM<br/> 10:18 hours</p>]]></description>
        <TimeSpan>
          <begin>2014-06-01T00:00:01-05:00</begin>
          <end>2014-06-01T10:18:28-05:00</end>
        </TimeSpan>
        <styleUrl>#place_home</styleUrl>
        <Point>
          <coordinates>-71.1114458017,42.3754311174</coordinates>
        </Point>
      </Placemark>
      <Placemark id="1401637014000">
        <name><![CDATA[Floyd's 99 Barbershop]]></name>
        <atom:link href="http://foursquare.com/venue/4a9d711ff964a520443820e3"/>
        <description><![CDATA[<p>6/1/14<br/> 10:36 AM to 11:10 AM<br/> 33 min</p> <p>Salon / Barbershop<br/> <a href="http://foursquare.com/venue/4a9d711ff964a520443820e3">More details (Foursquare)</a> </p>]]></description>
        <TimeSpan>
          <begin>2014-06-01T10:36:55-05:00</begin>
          <end>2014-06-01T11:10:52-05:00</end>
        </TimeSpan>
        <styleUrl>#place_Salon / Barbershop</styleUrl>
        <Point>
          <coordinates>-71.11979826,42.38213717937469</coordinates>
        </Point>
      </Placemark>
      <Placemark id="1401640173000">
        <name><![CDATA[Home]]></name>
        <description><![CDATA[<p>6/1/14<br/> 11:29 AM to 12:00 PM<br/> 31 min</p>]]></description>
        <TimeSpan>
          <begin>2014-06-01T11:29:34-05:00</begin>
          <end>2014-06-01T12:00:37-05:00</end>
        </TimeSpan>
        <styleUrl>#place_home</styleUrl>
        <Point>
          <coordinates>-71.1114458017,42.3754311174</coordinates>
        </Point>
      </Placemark>
      <Placemark id="1401643040000">
        <name><![CDATA[Russell House Tavern]]></name>
        <atom:link href="http://foursquare.com/venue/4b96aba8f964a520e2dc34e3"/>
        <description><![CDATA[<p>6/1/14<br/> 12:17 PM to 1:32 PM<br/> 1:14 hours</p> <p>Gastropub<br/> <a href="http://foursquare.com/venue/4b96aba8f964a520e2dc34e3">More details (Foursquare)</a> </p>]]></description>
        <TimeSpan>
          <begin>2014-06-01T12:17:21-05:00</begin>
          <end>2014-06-01T13:32:13-05:00</end>
        </TimeSpan>
        <styleUrl>#place_Gastropub</styleUrl>
        <Point>
          <coordinates>-71.11951231956482,42.37313766800413</coordinates>
        </Point>
      </Placemark>
      <Placemark id="1401648405000">
        <name><![CDATA[Broadway Marketplace]]></name>
        <atom:link href="http://foursquare.com/venue/4a661612f964a520ffc71fe3"/>
        <description><![CDATA[<p>6/1/14<br/> 1:46 PM to 1:49 PM<br/> 2 min</p> <p>Grocery Store<br/> <a href="http://foursquare.com/venue/4a661612f964a520ffc71fe3">More details (Foursquare)</a> </p>]]></description>
        <TimeSpan>
          <begin>2014-06-01T13:46:46-05:00</begin>
          <end>2014-06-01T13:49:20-05:00</end>
        </TimeSpan>
        <styleUrl>#place_Grocery Store</styleUrl>
        <Point>
          <coordinates>-71.11300484548056,42.37405171427381</coordinates>
        </Point>
      </Placemark>
      <Placemark id="1401648780000">
        <name><![CDATA[Home]]></name>
        <description><![CDATA[<p>6/1/14<br/> 1:53 PM to 3:45 PM<br/> 1:52 hours</p>]]></description>
        <TimeSpan>
          <begin>2014-06-01T13:53:01-05:00</begin>
          <end>2014-06-01T15:45:16-05:00</end>
        </TimeSpan>
        <styleUrl>#place_home</styleUrl>
        <Point>
          <coordinates>-71.1114458017,42.3754311174</coordinates>
        </Point>
      </Placemark>
      <Placemark id="1401656210000">
        <name><![CDATA[Harvard Yard]]></name>
        <atom:link href="http://foursquare.com/venue/4abd2012f964a520948820e3"/>
        <description><![CDATA[<p>6/1/14<br/> 3:56 PM to 4:19 PM<br/> 22 min</p> <p>College Quad<br/> <a href="http://foursquare.com/venue/4abd2012f964a520948820e3">More details (Foursquare)</a> </p>]]></description>
        <TimeSpan>
          <begin>2014-06-01T15:56:51-05:00</begin>
          <end>2014-06-01T16:19:20-05:00</end>
        </TimeSpan>
        <styleUrl>#place_College Quad</styleUrl>
        <Point>
          <coordinates>-71.11741499632876,42.37467597125794</coordinates>
        </Point>
      </Placemark>
      <Placemark id="1401659428000">
        <name><![CDATA[Totto Ramen Boston]]></name>
        <atom:link href="http://foursquare.com/venue/535e8c74498ec936982e65a7"/>
        <description><![CDATA[<p>6/1/14<br/> 4:50 PM to 5:20 PM<br/> 30 min</p> <p>Ramen / Noodle House<br/> <a href="http://foursquare.com/venue/535e8c74498ec936982e65a7">More details (Foursquare)</a> </p>]]></description>
        <TimeSpan>
          <begin>2014-06-01T16:50:29-05:00</begin>
          <end>2014-06-01T17:20:45-05:00</end>
        </TimeSpan>
        <styleUrl>#place_Ramen / Noodle House</styleUrl>
        <Point>
          <coordinates>-71.1329423682022,42.35305002287387</coordinates>
        </Point>
      </Placemark>
      <Placemark id="1401662298000">
        <name><![CDATA[Place in Allston]]></name>
        <description><![CDATA[<p>6/1/14<br/> 5:38 PM to 5:40 PM<br/> 2 min</p>]]></description>
        <TimeSpan>
          <begin>2014-06-01T17:38:19-05:00</begin>
          <end>2014-06-01T17:40:25-05:00</end>
        </TimeSpan>
        <styleUrl>#place_unknown</styleUrl>
        <Point>
          <coordinates>-71.1265328805,42.3578670953</coordinates>
        </Point>
      </Placemark>
      <Placemark id="1401664904000">
        <name><![CDATA[Home]]></name>
        <description><![CDATA[<p>6/1/14<br/> 6:21 PM to 6:27 PM<br/> 5 min</p>]]></description>
        <TimeSpan>
          <begin>2014-06-01T18:21:45-05:00</begin>
          <end>2014-06-01T18:27:13-05:00</end>
        </TimeSpan>
        <styleUrl>#place_home</styleUrl>
        <Point>
          <coordinates>-71.1114458017,42.3754311174</coordinates>
        </Point>
      </Placemark>
      <Placemark id="1401665776000">
        <name><![CDATA[Tory Row]]></name>
        <atom:link href="http://foursquare.com/venue/49e79621f964a520cf641fe3"/>
        <description><![CDATA[<p>6/1/14<br/> 6:36 PM to 8:06 PM<br/> 1:30 hours</p> <p>American Restaurant<br/> <a href="http://foursquare.com/venue/49e79621f964a520cf641fe3">More details (Foursquare)</a> </p>]]></description>
        <TimeSpan>
          <begin>2014-06-01T18:36:17-05:00</begin>
          <end>2014-06-01T20:06:34-05:00</end>
        </TimeSpan>
        <styleUrl>#place_American Restaurant</styleUrl>
        <Point>
          <coordinates>-71.119457,42.373379</coordinates>
        </Point>
      </Placemark>
      <Placemark id="1401672140000">
        <name><![CDATA[Home]]></name>
        <description><![CDATA[<p>6/1/14<br/> 8:22 PM to 12:00 AM<br/> 3:37 hours</p>]]></description>
        <TimeSpan>
          <begin>2014-06-01T20:22:21-05:00</begin>
          <end>2014-06-01T23:59:59-05:00</end>
        </TimeSpan>
        <styleUrl>#place_home</styleUrl>
        <Point>
          <coordinates>-71.1114458017,42.3754311174</coordinates>
        </Point>
      </Placemark>
    </Folder>
    <Folder>
      <name><![CDATA[6/2/14]]></name>
      <Placemark id="1401685200000">
        <name><![CDATA[Home]]></name>
        <description><![CDATA[<p>6/2/14<br/> 12:00 AM to 8:15 AM<br/> 8:15 hours</p>]]></description>
        <TimeSpan>
          <begin>2014-06-02T00:00:01-05:00</begin>
          <end>2014-06-02T08:15:33-05:00</end>
        </TimeSpan>
        <styleUrl>#place_home</styleUrl>
        <Point>
          <coordinates>-71.1114458017,42.3754311174</coordinates>
        </Point>
      </Placemark>
      <Placemark id="1401715177000">
        <name><![CDATA[Starbucks]]></name>
        <atom:link href="http://foursquare.com/venue/4a5a3eb5f964a520f9b91fe3"/>
        <description><![CDATA[<p>6/2/14<br/> 8:19 AM to 8:27 AM<br/> 7 min</p> <p>Coffee Shop<br/> <a href="http://foursquare.com/venue/4a5a3eb5f964a520f9b91fe3">More details (Foursquare)</a> </p>]]></description>
        <TimeSpan>
          <begin>2014-06-02T08:19:38-05:00</begin>
          <end>2014-06-02T08:27:33-05:00</end>
        </TimeSpan>
        <styleUrl>#place_Coffee Shop</styleUrl>
        <Point>
          <coordinates>-71.11295,42.373886</coordinates>
        </Point>
      </Placemark>
      <Placemark id="1401716381000">
        <name><![CDATA[Proximate]]></name>
        <atom:link href="http://foursquare.com/venue/51c8c0d1498e5d4d09a48362"/>
        <description><![CDATA[<p>6/2/14<br/> 8:39 AM to 9:42 AM<br/> 1:02 hours</p> <p>Tech Startup<br/> <a href="http://foursquare.com/venue/51c8c0d1498e5d4d09a48362">More details (Foursquare)</a> </p>]]></description>
        <TimeSpan>
          <begin>2014-06-02T08:39:42-05:00</begin>
          <end>2014-06-02T09:42:36-05:00</end>
        </TimeSpan>
        <styleUrl>#place_Tech Startup</styleUrl>
        <Point>
          <coordinates>-71.117205,42.378716</coordinates>
        </Point>
      </Placemark>
      <Placemark id="1401720341000">
        <name><![CDATA[Proximate]]></name>
        <atom:link href="http://foursquare.com/venue/51c8c0d1498e5d4d09a48362"/>
        <description><![CDATA[<p>6/2/14<br/> 9:45 AM to 12:01 PM<br/> 2:16 hours</p> <p>Tech Startup<br/> <a href="http://foursquare.com/venue/51c8c0d1498e5d4d09a48362">More details (Foursquare)</a> </p>]]></description>
        <TimeSpan>
          <begin>2014-06-02T09:45:42-05:00</begin>
          <end>2014-06-02T12:01:41-05:00</end>
        </TimeSpan>
        <styleUrl>#place_Tech Startup</styleUrl>
        <Point>
          <coordinates>-71.117205,42.378716</coordinates>
        </Point>
      </Placemark>
      <Placemark id="1401729134000">
        <name><![CDATA[Home]]></name>
        <description><![CDATA[<p>6/2/14<br/> 12:12 PM to 5:21 PM<br/> 5:09 hours</p>]]></description>
        <TimeSpan>
          <begin>2014-06-02T12:12:15-05:00</begin>
          <end>2014-06-02T17:21:44-05:00</end>
        </TimeSpan>
        <styleUrl>#place_home</styleUrl>
        <Point>
          <coordinates>-71.1114458017,42.3754311174</coordinates>
        </Point>
      </Placemark>
      <Placemark id="1401749478000">
        <name><![CDATA[Home]]></name>
        <description><![CDATA[<p>6/2/14<br/> 5:51 PM to 12:00 AM<br/> 6:08 hours</p>]]></description>
        <TimeSpan>
          <begin>2014-06-02T17:51:19-05:00</begin>
          <end>2014-06-02T23:59:59-05:00</end>
        </TimeSpan>
        <styleUrl>#place_home</styleUrl>
        <Point>
          <coordinates>-71.1114458017,42.3754311174</coordinates>
        </Point>
      </Placemark>
    </Folder>
    <Folder>
      <name><![CDATA[6/3/14]]></name>
      <Placemark id="1401771600000">
        <name><![CDATA[Home]]></name>
        <description><![CDATA[<p>6/3/14<br/> 12:00 AM to 8:32 AM<br/> 8:32 hours</p>]]></description>
        <TimeSpan>
          <begin>2014-06-03T00:00:01-05:00</begin>
          <end>2014-06-03T08:31:59-05:00</end>
        </TimeSpan>
        <styleUrl>#place_home</styleUrl>
        <Point>
          <coordinates>-71.1114458017,42.3754311174</coordinates>
        </Point>
      </Placemark>
      <Placemark id="1401802635000">
        <name><![CDATA[Starbucks]]></name>
        <atom:link href="http://foursquare.com/venue/4a5a3eb5f964a520f9b91fe3"/>
        <description><![CDATA[<p>6/3/14<br/> 8:37 AM to 8:41 AM<br/> 4 min</p> <p>Coffee Shop<br/> <a href="http://foursquare.com/venue/4a5a3eb5f964a520f9b91fe3">More details (Foursquare)</a> </p>]]></description>
        <TimeSpan>
          <begin>2014-06-03T08:37:16-05:00</begin>
          <end>2014-06-03T08:41:39-05:00</end>
        </TimeSpan>
        <styleUrl>#place_Coffee Shop</styleUrl>
        <Point>
          <coordinates>-71.11295,42.373886</coordinates>
        </Point>
      </Placemark>
      <Placemark id="1401803536000">
        <name><![CDATA[Proximate]]></name>
        <atom:link href="http://foursquare.com/venue/51c8c0d1498e5d4d09a48362"/>
        <description><![CDATA[<p>6/3/14<br/> 8:52 AM to 11:12 AM<br/> 2:20 hours</p> <p>Tech Startup<br/> <a href="http://foursquare.com/venue/51c8c0d1498e5d4d09a48362">More details (Foursquare)</a> </p>]]></description>
        <TimeSpan>
          <begin>2014-06-03T08:52:17-05:00</begin>
          <end>2014-06-03T11:12:47-05:00</end>
        </TimeSpan>
        <styleUrl>#place_Tech Startup</styleUrl>
        <Point>
          <coordinates>-71.117205,42.378716</coordinates>
        </Point>
      </Placemark>
      <Placemark id="1401812577000">
        <name><![CDATA[Home]]></name>
        <description><![CDATA[<p>6/3/14<br/> 11:22 AM to 12:35 PM<br/> 1:12 hours</p>]]></description>
        <TimeSpan>
          <begin>2014-06-03T11:22:58-05:00</begin>
          <end>2014-06-03T12:35:30-05:00</end>
        </TimeSpan>
        <styleUrl>#place_home</styleUrl>
        <Point>
          <coordinates>-71.1114458017,42.3754311174</coordinates>
        </Point>
      </Placemark>
      <Placemark id="1401817738000">
        <name><![CDATA[Proximate]]></name>
        <atom:link href="http://foursquare.com/venue/51c8c0d1498e5d4d09a48362"/>
        <description><![CDATA[<p>6/3/14<br/> 12:48 PM to 2:42 PM<br/> 1:53 hours</p> <p>Tech Startup<br/> <a href="http://foursquare.com/venue/51c8c0d1498e5d4d09a48362">More details (Foursquare)</a> </p>]]></description>
        <TimeSpan>
          <begin>2014-06-03T12:48:59-05:00</begin>
          <end>2014-06-03T14:42:01-05:00</end>
        </TimeSpan>
        <styleUrl>#place_Tech Startup</styleUrl>
        <Point>
          <coordinates>-71.117205,42.378716</coordinates>
        </Point>
      </Placemark>
      <Placemark id="1401825308000">
        <name><![CDATA[Home]]></name>
        <description><![CDATA[<p>6/3/14<br/> 2:55 PM to 3:14 PM<br/> 19 min</p>]]></description>
        <TimeSpan>
          <begin>2014-06-03T14:55:09-05:00</begin>
          <end>2014-06-03T15:14:32-05:00</end>
        </TimeSpan>
        <styleUrl>#place_home</styleUrl>
        <Point>
          <coordinates>-71.1114458017,42.3754311174</coordinates>
        </Point>
      </Placemark>
      <Placemark id="1401827086000">
        <name><![CDATA[Proximate]]></name>
        <atom:link href="http://foursquare.com/venue/51c8c0d1498e5d4d09a48362"/>
        <description><![CDATA[<p>6/3/14<br/> 3:24 PM to 6:41 PM<br/> 3:16 hours</p> <p>Tech Startup<br/> <a href="http://foursquare.com/venue/51c8c0d1498e5d4d09a48362">More details (Foursquare)</a> </p>]]></description>
        <TimeSpan>
          <begin>2014-06-03T15:24:47-05:00</begin>
          <end>2014-06-03T18:41:31-05:00</end>
        </TimeSpan>
        <styleUrl>#place_Tech Startup</styleUrl>
        <Point>
          <coordinates>-71.117205,42.378716</coordinates>
        </Point>
      </Placemark>
      <Placemark id="1401839634000">
        <name><![CDATA[Home]]></name>
        <description><![CDATA[<p>6/3/14<br/> 6:53 PM to 12:00 AM<br/> 5:06 hours</p>]]></description>
        <TimeSpan>
          <begin>2014-06-03T18:53:55-05:00</begin>
          <end>2014-06-03T23:59:59-05:00</end>
        </TimeSpan>
        <styleUrl>#place_home</styleUrl>
        <Point>
          <coordinates>-71.1114458017,42.3754311174</coordinates>
        </Point>
      </Placemark>
    </Folder>
    <Folder>
      <name><![CDATA[6/4/14]]></name>
      <Placemark id="1401858000000">
        <name><![CDATA[Home]]></name>
        <description><![CDATA[<p>6/4/14<br/> 12:00 AM to 8:22 AM<br/> 8:22 hours</p>]]></description>
        <TimeSpan>
          <begin>2014-06-04T00:00:01-05:00</begin>
          <end>2014-06-04T08:22:57-05:00</end>
        </TimeSpan>
        <styleUrl>#place_home</styleUrl>
        <Point>
          <coordinates>-71.1114458017,42.3754311174</coordinates>
        </Point>
      </Placemark>
      <Placemark id="1401888390000">
        <name><![CDATA[Broadway Marketplace]]></name>
        <atom:link href="http://foursquare.com/venue/4a661612f964a520ffc71fe3"/>
        <description><![CDATA[<p>6/4/14<br/> 8:26 AM to 8:35 AM<br/> 9 min</p> <p>Grocery Store<br/> <a href="http://foursquare.com/venue/4a661612f964a520ffc71fe3">More details (Foursquare)</a> </p>]]></description>
        <TimeSpan>
          <begin>2014-06-04T08:26:31-05:00</begin>
          <end>2014-06-04T08:35:33-05:00</end>
        </TimeSpan>
        <styleUrl>#place_Grocery Store</styleUrl>
        <Point>
          <coordinates>-71.11300484548056,42.37405171427381</coordinates>
        </Point>
      </Placemark>
      <Placemark id="1401890306000">
        <name><![CDATA[FSG Social Impact Advisors]]></name>
        <description><![CDATA[<p>6/4/14<br/> 8:58 AM to 10:13 AM<br/> 1:14 hours</p>]]></description>
        <TimeSpan>
          <begin>2014-06-04T08:58:27-05:00</begin>
          <end>2014-06-04T10:12:59-05:00</end>
        </TimeSpan>
        <styleUrl>#place_work</styleUrl>
        <Point>
          <coordinates>-71.0745465106,42.3506068376</coordinates>
        </Point>
      </Placemark>
      <Placemark id="1401897728000">
        <name><![CDATA[Cambridge Innovation Center]]></name>
        <atom:link href="http://foursquare.com/venue/4a36cd32f964a520e99d1fe3"/>
        <description><![CDATA[<p>6/4/14<br/> 11:02 AM to 12:23 PM<br/> 1:21 hours</p> <p>Building<br/> <a href="http://foursquare.com/venue/4a36cd32f964a520e99d1fe3">More details (Foursquare)</a> </p>]]></description>
        <TimeSpan>
          <begin>2014-06-04T11:02:09-05:00</begin>
          <end>2014-06-04T12:23:13-05:00</end>
        </TimeSpan>
        <styleUrl>#place_Building</styleUrl>
        <Point>
          <coordinates>-71.08413546391985,42.36276679726148</coordinates>
        </Point>
      </Placemark>
      <Placemark id="1401903761000">
        <name><![CDATA[Border Cafe]]></name>
        <atom:link href="http://foursquare.com/venue/3fd66200f964a520bded1ee3"/>
        <description><![CDATA[<p>6/4/14<br/> 12:42 PM to 1:22 PM<br/> 39 min</p> <p>Mexican Restaurant<br/> <a href="http://foursquare.com/venue/3fd66200f964a520bded1ee3">More details (Foursquare)</a> </p>]]></description>
        <TimeSpan>
          <begin>2014-06-04T12:42:42-05:00</begin>
          <end>2014-06-04T13:21:59-05:00</end>
        </TimeSpan>
        <styleUrl>#place_Mexican Restaurant</styleUrl>
        <Point>
          <coordinates>-71.120141,42.3743468</coordinates>
        </Point>
      </Placemark>
      <Placemark id="1401906571000">
        <name><![CDATA[Maxwell Dworkin]]></name>
        <atom:link href="http://foursquare.com/venue/4a6ea6f3f964a520ffd41fe3"/>
        <description><![CDATA[<p>6/4/14<br/> 1:29 PM to 2:14 PM<br/> 45 min</p> <p>College Academic Building<br/> <a href="http://foursquare.com/venue/4a6ea6f3f964a520ffd41fe3">More details (Foursquare)</a> </p>]]></description>
        <TimeSpan>
          <begin>2014-06-04T13:29:32-05:00</begin>
          <end>2014-06-04T14:14:42-05:00</end>
        </TimeSpan>
        <styleUrl>#place_College Academic Building</styleUrl>
        <Point>
          <coordinates>-71.11702608465302,42.37878967029998</coordinates>
        </Point>
      </Placemark>
      <Placemark id="1401909590000">
        <name><![CDATA[Proximate]]></name>
        <atom:link href="http://foursquare.com/venue/51c8c0d1498e5d4d09a48362"/>
        <description><![CDATA[<p>6/4/14<br/> 2:19 PM to 7:27 PM<br/> 5:07 hours</p> <p>Tech Startup<br/> <a href="http://foursquare.com/venue/51c8c0d1498e5d4d09a48362">More details (Foursquare)</a> </p>]]></description>
        <TimeSpan>
          <begin>2014-06-04T14:19:51-05:00</begin>
          <end>2014-06-04T19:27:23-05:00</end>
        </TimeSpan>
        <styleUrl>#place_Tech Startup</styleUrl>
        <Point>
          <coordinates>-71.117205,42.378716</coordinates>
        </Point>
      </Placemark>
      <Placemark id="1401928712000">
        <name><![CDATA[Home]]></name>
        <description><![CDATA[<p>6/4/14<br/> 7:38 PM to 12:00 AM<br/> 4:21 hours</p>]]></description>
        <TimeSpan>
          <begin>2014-06-04T19:38:33-05:00</begin>
          <end>2014-06-04T23:59:59-05:00</end>
        </TimeSpan>
        <styleUrl>#place_home</styleUrl>
        <Point>
          <coordinates>-71.1114458017,42.3754311174</coordinates>
        </Point>
      </Placemark>
    </Folder>
    <Folder>
      <name><![CDATA[6/5/14]]></name>
      <Placemark id="1401944400000">
        <name><![CDATA[Home]]></name>
        <description><![CDATA[<p>6/5/14<br/> 12:00 AM to 9:30 AM<br/> 9:30 hours</p>]]></description>
        <TimeSpan>
          <begin>2014-06-05T00:00:01-05:00</begin>
          <end>2014-06-05T09:30:42-05:00</end>
        </TimeSpan>
        <styleUrl>#place_home</styleUrl>
        <Point>
          <coordinates>-71.1114458017,42.3754311174</coordinates>
        </Point>
      </Placemark>
      <Placemark id="1401981616000">
        <name><![CDATA[Home]]></name>
        <description><![CDATA[<p>6/5/14<br/> 10:20 AM to 11:09 AM<br/> 49 min</p>]]></description>
        <TimeSpan>
          <begin>2014-06-05T10:20:17-05:00</begin>
          <end>2014-06-05T11:09:52-05:00</end>
        </TimeSpan>
        <styleUrl>#place_home</styleUrl>
        <Point>
          <coordinates>-71.1114458017,42.3754311174</coordinates>
        </Point>
      </Placemark>
      <Placemark id="1401986505000">
        <name><![CDATA[Home]]></name>
        <description><![CDATA[<p>6/5/14<br/> 11:41 AM to 12:03 PM<br/> 22 min</p>]]></description>
        <TimeSpan>
          <begin>2014-06-05T11:41:46-05:00</begin>
          <end>2014-06-05T12:03:47-05:00</end>
        </TimeSpan>
        <styleUrl>#place_home</styleUrl>
        <Point>
          <coordinates>-71.1114458017,42.3754311174</coordinates>
        </Point>
      </Placemark>
      <Placemark id="1401991015000">
        <name><![CDATA[Home]]></name>
        <description><![CDATA[<p>6/5/14<br/> 12:56 PM to 7:40 PM<br/> 6:43 hours</p>]]></description>
        <TimeSpan>
          <begin>2014-06-05T12:56:56-05:00</begin>
          <end>2014-06-05T19:40:21-05:00</end>
        </TimeSpan>
        <styleUrl>#place_home</styleUrl>
        <Point>
          <coordinates>-71.1114458017,42.3754311174</coordinates>
        </Point>
      </Placemark>
      <Placemark id="1402016148000">
        <name><![CDATA[Shake Shack]]></name>
        <atom:link href="http://foursquare.com/venue/52b9c0cb498eaffe14f7e162"/>
        <description><![CDATA[<p>6/5/14<br/> 7:55 PM to 8:05 PM<br/> 9 min</p> <p>Burger Joint<br/> <a href="http://foursquare.com/venue/52b9c0cb498eaffe14f7e162">More details (Foursquare)</a> </p>]]></description>
        <TimeSpan>
          <begin>2014-06-05T19:55:49-05:00</begin>
          <end>2014-06-05T20:05:16-05:00</end>
        </TimeSpan>
        <styleUrl>#place_Burger Joint</styleUrl>
        <Point>
          <coordinates>-71.12084999619532,42.37224129812891</coordinates>
        </Point>
      </Placemark>
      <Placemark id="1402017686000">
        <name><![CDATA[Home]]></name>
        <description><![CDATA[<p>6/5/14<br/> 8:21 PM to 12:00 AM<br/> 3:38 hours</p>]]></description>
        <TimeSpan>
          <begin>2014-06-05T20:21:27-05:00</begin>
          <end>2014-06-05T23:59:59-05:00</end>
        </TimeSpan>
        <styleUrl>#place_home</styleUrl>
        <Point>
          <coordinates>-71.1114458017,42.3754311174</coordinates>
        </Point>
      </Placemark>
    </Folder>
    <Folder>
      <name><![CDATA[6/6/14]]></name>
      <Placemark id="1402030800000">
        <name><![CDATA[Home]]></name>
        <description><![CDATA[<p>6/6/14<br/> 12:00 AM to 9:43 AM<br/> 9:43 hours</p>]]></description>
        <TimeSpan>
          <begin>2014-06-06T00:00:01-05:00</begin>
          <end>2014-06-06T09:43:39-05:00</end>
        </TimeSpan>
        <styleUrl>#place_home</styleUrl>
        <Point>
          <coordinates>-71.1114458017,42.3754311174</coordinates>
        </Point>
      </Placemark>
      <Placemark id="1402066713000">
        <name><![CDATA[Harvard Alumni Association]]></name>
        <atom:link href="http://foursquare.com/venue/4b5dc68df964a520026b29e3"/>
        <description><![CDATA[<p>6/6/14<br/> 9:58 AM to 11:21 AM<br/> 1:23 hours</p> <p>University<br/> <a href="http://foursquare.com/venue/4b5dc68df964a520026b29e3">More details (Foursquare)</a> </p>]]></description>
        <TimeSpan>
          <begin>2014-06-06T09:58:34-05:00</begin>
          <end>2014-06-06T11:21:51-05:00</end>
        </TimeSpan>
        <styleUrl>#place_University</styleUrl>
        <Point>
          <coordinates>-71.12325225275964,42.37317592010315</coordinates>
        </Point>
      </Placemark>
      <Placemark id="1402072303000">
        <name><![CDATA[Proximate]]></name>
        <atom:link href="http://foursquare.com/venue/51c8c0d1498e5d4d09a48362"/>
        <description><![CDATA[<p>6/6/14<br/> 11:31 AM to 1:31 PM<br/> 1:59 hours</p> <p>Tech Startup<br/> <a href="http://foursquare.com/venue/51c8c0d1498e5d4d09a48362">More details (Foursquare)</a> </p>]]></description>
        <TimeSpan>
          <begin>2014-06-06T11:31:44-05:00</begin>
          <end>2014-06-06T13:31:05-05:00</end>
        </TimeSpan>
        <styleUrl>#place_Tech Startup</styleUrl>
        <Point>
          <coordinates>-71.117205,42.378716</coordinates>
        </Point>
      </Placemark>
      <Placemark id="1402080009000">
        <name><![CDATA[Border Cafe]]></name>
        <atom:link href="http://foursquare.com/venue/3fd66200f964a520bded1ee3"/>
        <description><![CDATA[<p>6/6/14<br/> 1:40 PM to 2:41 PM<br/> 1:01 hours</p> <p>Mexican Restaurant<br/> <a href="http://foursquare.com/venue/3fd66200f964a520bded1ee3">More details (Foursquare)</a> </p>]]></description>
        <TimeSpan>
          <begin>2014-06-06T13:40:10-05:00</begin>
          <end>2014-06-06T14:41:31-05:00</end>
        </TimeSpan>
        <styleUrl>#place_Mexican Restaurant</styleUrl>
        <Point>
          <coordinates>-71.120141,42.3743468</coordinates>
        </Point>
      </Placemark>
      <Placemark id="1402084245000">
        <name><![CDATA[Proximate]]></name>
        <atom:link href="http://foursquare.com/venue/51c8c0d1498e5d4d09a48362"/>
        <description><![CDATA[<p>6/6/14<br/> 2:50 PM to 4:06 PM<br/> 1:16 hours</p> <p>Tech Startup<br/> <a href="http://foursquare.com/venue/51c8c0d1498e5d4d09a48362">More details (Foursquare)</a> </p>]]></description>
        <TimeSpan>
          <begin>2014-06-06T14:50:46-05:00</begin>
          <end>2014-06-06T16:06:51-05:00</end>
        </TimeSpan>
        <styleUrl>#place_Tech Startup</styleUrl>
        <Point>
          <coordinates>-71.117205,42.378716</coordinates>
        </Point>
      </Placemark>
      <Placemark id="1402089445000">
        <name><![CDATA[Home]]></name>
        <description><![CDATA[<p>6/6/14<br/> 4:17 PM to 8:46 PM<br/> 4:28 hours</p>]]></description>
        <TimeSpan>
          <begin>2014-06-06T16:17:26-05:00</begin>
          <end>2014-06-06T20:46:09-05:00</end>
        </TimeSpan>
        <styleUrl>#place_home</styleUrl>
        <Point>
          <coordinates>-71.1114458017,42.3754311174</coordinates>
        </Point>
      </Placemark>
      <Placemark id="1402106354000">
        <name><![CDATA[The Boathouse]]></name>
        <atom:link href="http://foursquare.com/venue/50620ab3e4b0100721c85f46"/>
        <description><![CDATA[<p>6/6/14<br/> 8:59 PM to 11:36 PM<br/> 2:37 hours</p> <p>Pub<br/> <a href="http://foursquare.com/venue/50620ab3e4b0100721c85f46">More details (Foursquare)</a> </p>]]></description>
        <TimeSpan>
          <begin>2014-06-06T20:59:15-05:00</begin>
          <end>2014-06-06T23:36:40-05:00</end>
        </TimeSpan>
        <styleUrl>#place_Pub</styleUrl>
        <Point>
          <coordinates>-71.11674755856328,42.37140413215364</coordinates>
        </Point>
      </Placemark>
      <Placemark id="1402116537000">
        <name><![CDATA[Home]]></name>
        <description><![CDATA[<p>6/6/14<br/> 11:48 PM to 12:00 AM<br/> 11 min</p>]]></description>
        <TimeSpan>
          <begin>2014-06-06T23:48:58-05:00</begin>
          <end>2014-06-06T23:59:59-05:00</end>
        </TimeSpan>
        <styleUrl>#place_home</styleUrl>
        <Point>
          <coordinates>-71.1114458017,42.3754311174</coordinates>
        </Point>
      </Placemark>
    </Folder>
    <Folder>
      <name><![CDATA[6/7/14]]></name>
      <Placemark id="1402117200000">
        <name><![CDATA[Home]]></name>
        <description><![CDATA[<p>6/7/14<br/> 12:00 AM to 2:35 PM<br/> 14:35 hours</p>]]></description>
        <TimeSpan>
          <begin>2014-06-07T00:00:01-05:00</begin>
          <end>2014-06-07T14:35:15-05:00</end>
        </TimeSpan>
        <styleUrl>#place_home</styleUrl>
        <Point>
          <coordinates>-71.1114458017,42.3754311174</coordinates>
        </Point>
      </Placemark>
      <Placemark id="1402170528000">
        <name><![CDATA[Place in Cambridge]]></name>
        <description><![CDATA[<p>6/7/14<br/> 2:48 PM to 2:53 PM<br/> 4 min</p>]]></description>
        <TimeSpan>
          <begin>2014-06-07T14:48:49-05:00</begin>
          <end>2014-06-07T14:53:12-05:00</end>
        </TimeSpan>
        <styleUrl>#place_unknown</styleUrl>
        <Point>
          <coordinates>-71.1010255055,42.3737495369</coordinates>
        </Point>
      </Placemark>
      <Placemark id="1402172595000">
        <name><![CDATA[CambridgeSide Galleria]]></name>
        <atom:link href="http://foursquare.com/venue/4f31f48fe4b0acb1ec68d253"/>
        <description><![CDATA[<p>6/7/14<br/> 3:23 PM to 4:20 PM<br/> 56 min</p> <p>Mall<br/> <a href="http://foursquare.com/venue/4f31f48fe4b0acb1ec68d253">More details (Foursquare)</a> </p>]]></description>
        <TimeSpan>
          <begin>2014-06-07T15:23:16-05:00</begin>
          <end>2014-06-07T16:20:00-05:00</end>
        </TimeSpan>
        <styleUrl>#place_Mall</styleUrl>
        <Point>
          <coordinates>-71.07652187347412,42.36718484186633</coordinates>
        </Point>
      </Placemark>
      <Placemark id="1402176221000">
        <name><![CDATA[CambridgeSide Galleria]]></name>
        <atom:link href="http://foursquare.com/venue/4f31f48fe4b0acb1ec68d253"/>
        <description><![CDATA[<p>6/7/14<br/> 4:23 PM to 4:29 PM<br/> 6 min</p> <p>Mall<br/> <a href="http://foursquare.com/venue/4f31f48fe4b0acb1ec68d253">More details (Foursquare)</a> </p>]]></description>
        <TimeSpan>
          <begin>2014-06-07T16:23:42-05:00</begin>
          <end>2014-06-07T16:29:57-05:00</end>
        </TimeSpan>
        <styleUrl>#place_Mall</styleUrl>
        <Point>
          <coordinates>-71.07652187347412,42.36718484186633</coordinates>
        </Point>
      </Placemark>
      <Placemark id="1402176820000">
        <name><![CDATA[CambridgeSide Galleria]]></name>
        <atom:link href="http://foursquare.com/venue/4f31f48fe4b0acb1ec68d253"/>
        <description><![CDATA[<p>6/7/14<br/> 4:33 PM to 4:37 PM<br/> 3 min</p> <p>Mall<br/> <a href="http://foursquare.com/venue/4f31f48fe4b0acb1ec68d253">More details (Foursquare)</a> </p>]]></description>
        <TimeSpan>
          <begin>2014-06-07T16:33:41-05:00</begin>
          <end>2014-06-07T16:37:01-05:00</end>
        </TimeSpan>
        <styleUrl>#place_Mall</styleUrl>
        <Point>
          <coordinates>-71.07652187347412,42.36718484186633</coordinates>
        </Point>
      </Placemark>
      <Placemark id="1402177421000">
        <name><![CDATA[Place in East Cambridge]]></name>
        <description><![CDATA[<p>6/7/14<br/> 4:43 PM to 4:48 PM<br/> 4 min</p>]]></description>
        <TimeSpan>
          <begin>2014-06-07T16:43:42-05:00</begin>
          <end>2014-06-07T16:48:06-05:00</end>
        </TimeSpan>
        <styleUrl>#place_unknown</styleUrl>
        <Point>
          <coordinates>-71.073973276,42.3686810335</coordinates>
        </Point>
      </Placemark>
      <Placemark id="1402178088000">
        <name><![CDATA[ArtBar]]></name>
        <atom:link href="http://foursquare.com/venue/4b3be5b9f964a520e37d25e3"/>
        <description><![CDATA[<p>6/7/14<br/> 4:54 PM to 5:50 PM<br/> 55 min</p> <p>Bar<br/> <a href="http://foursquare.com/venue/4b3be5b9f964a520e37d25e3">More details (Foursquare)</a> </p>]]></description>
        <TimeSpan>
          <begin>2014-06-07T16:54:49-05:00</begin>
          <end>2014-06-07T17:50:32-05:00</end>
        </TimeSpan>
        <styleUrl>#place_Bar</styleUrl>
        <Point>
          <coordinates>-71.07431173324585,42.36710557273224</coordinates>
        </Point>
      </Placemark>
      <Placemark id="1402182443000">
        <name><![CDATA[The Liberty Hotel]]></name>
        <atom:link href="http://foursquare.com/venue/4a22c63ef964a520877d1fe3"/>
        <description><![CDATA[<p>6/7/14<br/> 6:07 PM to 6:18 PM<br/> 11 min</p> <p>Hotel<br/> <a href="http://foursquare.com/venue/4a22c63ef964a520877d1fe3">More details (Foursquare)</a> </p>]]></description>
        <TimeSpan>
          <begin>2014-06-07T18:07:24-05:00</begin>
          <end>2014-06-07T18:18:25-05:00</end>
        </TimeSpan>
        <styleUrl>#place_Hotel</styleUrl>
        <Point>
          <coordinates>-71.07024841380209,42.361924841884</coordinates>
        </Point>
      </Placemark>
      <Placemark id="1402183780000">
        <name><![CDATA[Boston Public Garden]]></name>
        <atom:link href="http://foursquare.com/venue/44cf0ff8f964a5201c361fe3"/>
        <description><![CDATA[<p>6/7/14<br/> 6:29 PM to 6:33 PM<br/> 4 min</p> <p>Garden<br/> <a href="http://foursquare.com/venue/44cf0ff8f964a5201c361fe3">More details (Foursquare)</a> </p>]]></description>
        <TimeSpan>
          <begin>2014-06-07T18:29:41-05:00</begin>
          <end>2014-06-07T18:33:58-05:00</end>
        </TimeSpan>
        <styleUrl>#place_Garden</styleUrl>
        <Point>
          <coordinates>-71.06991291046143,42.35411597423369</coordinates>
        </Point>
      </Placemark>
      <Placemark id="1402185141000">
        <name><![CDATA[Max Brenner]]></name>
        <atom:link href="http://foursquare.com/venue/4d8cc1941716a143144b07f7"/>
        <description><![CDATA[<p>6/7/14<br/> 6:52 PM to 7:57 PM<br/> 1:05 hours</p> <p>Dessert Shop<br/> <a href="http://foursquare.com/venue/4d8cc1941716a143144b07f7">More details (Foursquare)</a> </p>]]></description>
        <TimeSpan>
          <begin>2014-06-07T18:52:22-05:00</begin>
          <end>2014-06-07T19:57:44-05:00</end>
        </TimeSpan>
        <styleUrl>#place_Dessert Shop</styleUrl>
        <Point>
          <coordinates>-71.08100652694702,42.34925954525904</coordinates>
        </Point>
      </Placemark>
      <Placemark id="1402189338000">
        <name><![CDATA[Trader Joe's]]></name>
        <atom:link href="http://foursquare.com/venue/4a28402bf964a52004951fe3"/>
        <description><![CDATA[<p>6/7/14<br/> 8:02 PM to 8:20 PM<br/> 18 min</p> <p>Grocery Store<br/> <a href="http://foursquare.com/venue/4a28402bf964a52004951fe3">More details (Foursquare)</a> </p>]]></description>
        <TimeSpan>
          <begin>2014-06-07T20:02:19-05:00</begin>
          <end>2014-06-07T20:20:40-05:00</end>
        </TimeSpan>
        <styleUrl>#place_Grocery Store</styleUrl>
        <Point>
          <coordinates>-71.084214,42.348218</coordinates>
        </Point>
      </Placemark>
      <Placemark id="1402190783000">
        <name><![CDATA[MBTA Bus Stop | Massachusetts Ave. & Newbury St.]]></name>
        <atom:link href="http://foursquare.com/venue/4e498e94b61c6886484fde5c"/>
        <description><![CDATA[<p>6/7/14<br/> 8:26 PM to 8:42 PM<br/> 16 min</p> <p>Bus Station<br/> <a href="http://foursquare.com/venue/4e498e94b61c6886484fde5c">More details (Foursquare)</a> </p>]]></description>
        <TimeSpan>
          <begin>2014-06-07T20:26:24-05:00</begin>
          <end>2014-06-07T20:42:22-05:00</end>
        </TimeSpan>
        <styleUrl>#place_Bus Station</styleUrl>
        <Point>
          <coordinates>-71.08813047409058,42.34801465325017</coordinates>
        </Point>
      </Placemark>
      <Placemark id="1402192507000">
        <name><![CDATA[Home]]></name>
        <description><![CDATA[<p>6/7/14<br/> 8:55 PM to 12:00 AM<br/> 3:04 hours</p>]]></description>
        <TimeSpan>
          <begin>2014-06-07T20:55:08-05:00</begin>
          <end>2014-06-07T23:59:59-05:00</end>
        </TimeSpan>
        <styleUrl>#place_home</styleUrl>
        <Point>
          <coordinates>-71.1114458017,42.3754311174</coordinates>
        </Point>
      </Placemark>
    </Folder>
    <Folder>
      <name><![CDATA[6/8/14]]></name>
      <Placemark id="1402203600000">
        <name><![CDATA[Home]]></name>
        <description><![CDATA[<p>6/8/14<br/> 12:00 AM to 11:56 AM<br/> 11:56 hours</p>]]></description>
        <TimeSpan>
          <begin>2014-06-08T00:00:01-05:00</begin>
          <end>2014-06-08T11:56:33-05:00</end>
        </TimeSpan>
        <styleUrl>#place_home</styleUrl>
        <Point>
          <coordinates>-71.1114458017,42.3754311174</coordinates>
        </Point>
      </Placemark>
      <Placemark id="1402248777000">
        <name><![CDATA[Frankel Home]]></name>
        <description><![CDATA[<p>6/8/14<br/> 12:32 PM to 5:41 PM<br/> 5:08 hours</p>]]></description>
        <TimeSpan>
          <begin>2014-06-08T12:32:58-05:00</begin>
          <end>2014-06-08T17:41:43-05:00</end>
        </TimeSpan>
        <styleUrl>#place_home</styleUrl>
        <Point>
          <coordinates>-71.3302266069,42.3485322044</coordinates>
        </Point>
      </Placemark>
      <Placemark id="1402269003000">
        <name><![CDATA[Home]]></name>
        <description><![CDATA[<p>6/8/14<br/> 6:10 PM to 12:00 AM<br/> 5:49 hours</p>]]></description>
        <TimeSpan>
          <begin>2014-06-08T18:10:04-05:00</begin>
          <end>2014-06-08T23:59:59-05:00</end>
        </TimeSpan>
        <styleUrl>#place_home</styleUrl>
        <Point>
          <coordinates>-71.1114458017,42.3754311174</coordinates>
        </Point>
      </Placemark>
    </Folder>
    <Folder>
      <name><![CDATA[6/9/14]]></name>
      <Placemark id="1402290000000">
        <name><![CDATA[Home]]></name>
        <description><![CDATA[<p>6/9/14<br/> 12:00 AM to 9:05 PM<br/> 21:05 hours</p>]]></description>
        <TimeSpan>
          <begin>2014-06-09T00:00:01-05:00</begin>
          <end>2014-06-09T21:05:52-05:00</end>
        </TimeSpan>
        <styleUrl>#place_home</styleUrl>
        <Point>
          <coordinates>-71.1114458017,42.3754311174</coordinates>
        </Point>
      </Placemark>
      <Placemark id="1402366632000">
        <name><![CDATA[CVS/pharmacy]]></name>
        <atom:link href="http://foursquare.com/venue/49df6a3ff964a520c6601fe3"/>
        <description><![CDATA[<p>6/9/14<br/> 9:17 PM to 9:38 PM<br/> 21 min</p> <p>Drugstore / Pharmacy<br/> <a href="http://foursquare.com/venue/49df6a3ff964a520c6601fe3">More details (Foursquare)</a> </p>]]></description>
        <TimeSpan>
          <begin>2014-06-09T21:17:13-05:00</begin>
          <end>2014-06-09T21:38:31-05:00</end>
        </TimeSpan>
        <styleUrl>#place_Drugstore / Pharmacy</styleUrl>
        <Point>
          <coordinates>-71.11899197101593,42.37402935435937</coordinates>
        </Point>
      </Placemark>
      <Placemark id="1402368614000">
        <name><![CDATA[Home]]></name>
        <description><![CDATA[<p>6/9/14<br/> 9:50 PM to 12:00 AM<br/> 2:09 hours</p>]]></description>
        <TimeSpan>
          <begin>2014-06-09T21:50:15-05:00</begin>
          <end>2014-06-09T23:59:59-05:00</end>
        </TimeSpan>
        <styleUrl>#place_home</styleUrl>
        <Point>
          <coordinates>-71.1114458017,42.3754311174</coordinates>
        </Point>
      </Placemark>
    </Folder>
    <Folder>
      <name><![CDATA[6/10/14]]></name>
      <Placemark id="1402376400000">
        <name><![CDATA[Home]]></name>
        <description><![CDATA[<p>6/10/14<br/> 12:00 AM to 8:04 AM<br/> 8:04 hours</p>]]></description>
        <TimeSpan>
          <begin>2014-06-10T00:00:01-05:00</begin>
          <end>2014-06-10T08:04:38-05:00</end>
        </TimeSpan>
        <styleUrl>#place_home</styleUrl>
        <Point>
          <coordinates>-71.1114458017,42.3754311174</coordinates>
        </Point>
      </Placemark>
      <Placemark id="1402406520000">
        <name><![CDATA[Spangler Center]]></name>
        <atom:link href="http://foursquare.com/venue/4aeee0b0f964a52081d421e3"/>
        <description><![CDATA[<p>6/10/14<br/> 8:22 AM to 8:43 AM<br/> 21 min</p> <p>Student Center<br/> <a href="http://foursquare.com/venue/4aeee0b0f964a52081d421e3">More details (Foursquare)</a> </p>]]></description>
        <TimeSpan>
          <begin>2014-06-10T08:22:01-05:00</begin>
          <end>2014-06-10T08:43:45-05:00</end>
        </TimeSpan>
        <styleUrl>#place_Student Center</styleUrl>
        <Point>
          <coordinates>-71.12218458495514,42.36522543920124</coordinates>
        </Point>
      </Placemark>
      <Placemark id="1402408885000">
        <name><![CDATA[CVS/pharmacy]]></name>
        <atom:link href="http://foursquare.com/venue/49df6a3ff964a520c6601fe3"/>
        <description><![CDATA[<p>6/10/14<br/> 9:01 AM to 9:09 AM<br/> 8 min</p> <p>Drugstore / Pharmacy<br/> <a href="http://foursquare.com/venue/49df6a3ff964a520c6601fe3">More details (Foursquare)</a> </p>]]></description>
        <TimeSpan>
          <begin>2014-06-10T09:01:26-05:00</begin>
          <end>2014-06-10T09:09:40-05:00</end>
        </TimeSpan>
        <styleUrl>#place_Drugstore / Pharmacy</styleUrl>
        <Point>
          <coordinates>-71.11899197101593,42.37402935435937</coordinates>
        </Point>
      </Placemark>
      <Placemark id="1402410191000">
        <name><![CDATA[Proximate]]></name>
        <atom:link href="http://foursquare.com/venue/51c8c0d1498e5d4d09a48362"/>
        <description><![CDATA[<p>6/10/14<br/> 9:23 AM to 11:19 AM<br/> 1:56 hours</p> <p>Tech Startup<br/> <a href="http://foursquare.com/venue/51c8c0d1498e5d4d09a48362">More details (Foursquare)</a> </p>]]></description>
        <TimeSpan>
          <begin>2014-06-10T09:23:12-05:00</begin>
          <end>2014-06-10T11:19:35-05:00</end>
        </TimeSpan>
        <styleUrl>#place_Tech Startup</styleUrl>
        <Point>
          <coordinates>-71.117205,42.378716</coordinates>
        </Point>
      </Placemark>
      <Placemark id="1402417979000">
        <name><![CDATA[Home]]></name>
        <description><![CDATA[<p>6/10/14<br/> 11:32 AM to 11:53 AM<br/> 20 min</p>]]></description>
        <TimeSpan>
          <begin>2014-06-10T11:33:00-05:00</begin>
          <end>2014-06-10T11:53:34-05:00</end>
        </TimeSpan>
        <styleUrl>#place_home</styleUrl>
        <Point>
          <coordinates>-71.1114458017,42.3754311174</coordinates>
        </Point>
      </Placemark>
      <Placemark id="1402419896000">
        <name><![CDATA[Proximate]]></name>
        <atom:link href="http://foursquare.com/venue/51c8c0d1498e5d4d09a48362"/>
        <description><![CDATA[<p>6/10/14<br/> 12:04 PM to 1:27 PM<br/> 1:22 hours</p> <p>Tech Startup<br/> <a href="http://foursquare.com/venue/51c8c0d1498e5d4d09a48362">More details (Foursquare)</a> </p>]]></description>
        <TimeSpan>
          <begin>2014-06-10T12:04:57-05:00</begin>
          <end>2014-06-10T13:27:02-05:00</end>
        </TimeSpan>
        <styleUrl>#place_Tech Startup</styleUrl>
        <Point>
          <coordinates>-71.117205,42.378716</coordinates>
        </Point>
      </Placemark>
      <Placemark id="1402426453000">
        <name><![CDATA[Proximate]]></name>
        <atom:link href="http://foursquare.com/venue/51c8c0d1498e5d4d09a48362"/>
        <description><![CDATA[<p>6/10/14<br/> 1:54 PM to 6:13 PM<br/> 4:19 hours</p> <p>Tech Startup<br/> <a href="http://foursquare.com/venue/51c8c0d1498e5d4d09a48362">More details (Foursquare)</a> </p>]]></description>
        <TimeSpan>
          <begin>2014-06-10T13:54:14-05:00</begin>
          <end>2014-06-10T18:13:51-05:00</end>
        </TimeSpan>
        <styleUrl>#place_Tech Startup</styleUrl>
        <Point>
          <coordinates>-71.117205,42.378716</coordinates>
        </Point>
      </Placemark>
      <Placemark id="1402442770000">
        <name><![CDATA[Home]]></name>
        <description><![CDATA[<p>6/10/14<br/> 6:26 PM to 12:00 AM<br/> 5:33 hours</p>]]></description>
        <TimeSpan>
          <begin>2014-06-10T18:26:11-05:00</begin>
          <end>2014-06-10T23:59:59-05:00</end>
        </TimeSpan>
        <styleUrl>#place_home</styleUrl>
        <Point>
          <coordinates>-71.1114458017,42.3754311174</coordinates>
        </Point>
      </Placemark>
    </Folder>
    <Folder>
      <name><![CDATA[6/11/14]]></name>
      <Placemark id="1402462800000">
        <name><![CDATA[Home]]></name>
        <description><![CDATA[<p>6/11/14<br/> 12:00 AM to 9:05 AM<br/> 9:05 hours</p>]]></description>
        <TimeSpan>
          <begin>2014-06-11T00:00:01-05:00</begin>
          <end>2014-06-11T09:05:03-05:00</end>
        </TimeSpan>
        <styleUrl>#place_home</styleUrl>
        <Point>
          <coordinates>-71.1114458017,42.3754311174</coordinates>
        </Point>
      </Placemark>
      <Placemark id="1402496630000">
        <name><![CDATA[Maxwell Dworkin]]></name>
        <atom:link href="http://foursquare.com/venue/4a6ea6f3f964a520ffd41fe3"/>
        <description><![CDATA[<p>6/11/14<br/> 9:23 AM to 9:42 AM<br/> 18 min</p> <p>College Academic Building<br/> <a href="http://foursquare.com/venue/4a6ea6f3f964a520ffd41fe3">More details (Foursquare)</a> </p>]]></description>
        <TimeSpan>
          <begin>2014-06-11T09:23:51-05:00</begin>
          <end>2014-06-11T09:42:32-05:00</end>
        </TimeSpan>
        <styleUrl>#place_College Academic Building</styleUrl>
        <Point>
          <coordinates>-71.11702608465302,42.37878967029998</coordinates>
        </Point>
      </Placemark>
      <Placemark id="1402498284000">
        <name><![CDATA[Tory Row]]></name>
        <atom:link href="http://foursquare.com/venue/49e79621f964a520cf641fe3"/>
        <description><![CDATA[<p>6/11/14<br/> 9:51 AM to 11:47 AM<br/> 1:56 hours</p> <p>American Restaurant<br/> <a href="http://foursquare.com/venue/49e79621f964a520cf641fe3">More details (Foursquare)</a> </p>]]></description>
        <TimeSpan>
          <begin>2014-06-11T09:51:25-05:00</begin>
          <end>2014-06-11T11:47:56-05:00</end>
        </TimeSpan>
        <styleUrl>#place_American Restaurant</styleUrl>
        <Point>
          <coordinates>-71.119457,42.373379</coordinates>
        </Point>
      </Placemark>
      <Placemark id="1402505480000">
        <name><![CDATA[Border Cafe]]></name>
        <atom:link href="http://foursquare.com/venue/3fd66200f964a520bded1ee3"/>
        <description><![CDATA[<p>6/11/14<br/> 11:51 AM to 12:41 PM<br/> 49 min</p> <p>Mexican Restaurant<br/> <a href="http://foursquare.com/venue/3fd66200f964a520bded1ee3">More details (Foursquare)</a> </p>]]></description>
        <TimeSpan>
          <begin>2014-06-11T11:51:21-05:00</begin>
          <end>2014-06-11T12:41:07-05:00</end>
        </TimeSpan>
        <styleUrl>#place_Mexican Restaurant</styleUrl>
        <Point>
          <coordinates>-71.120141,42.3743468</coordinates>
        </Point>
      </Placemark>
      <Placemark id="1402509054000">
        <name><![CDATA[Maxwell Dworkin]]></name>
        <atom:link href="http://foursquare.com/venue/4a6ea6f3f964a520ffd41fe3"/>
        <description><![CDATA[<p>6/11/14<br/> 12:50 PM to 4:14 PM<br/> 3:23 hours</p> <p>College Academic Building<br/> <a href="http://foursquare.com/venue/4a6ea6f3f964a520ffd41fe3">More details (Foursquare)</a> </p>]]></description>
        <TimeSpan>
          <begin>2014-06-11T12:50:55-05:00</begin>
          <end>2014-06-11T16:14:41-05:00</end>
        </TimeSpan>
        <styleUrl>#place_College Academic Building</styleUrl>
        <Point>
          <coordinates>-71.11702608465302,42.37878967029998</coordinates>
        </Point>
      </Placemark>
      <Placemark id="1402522047000">
        <name><![CDATA[Wagamama]]></name>
        <atom:link href="http://foursquare.com/venue/49e00a10f964a5203b611fe3"/>
        <description><![CDATA[<p>6/11/14<br/> 4:27 PM to 6:08 PM<br/> 1:41 hours</p> <p>Ramen / Noodle House<br/> <a href="http://foursquare.com/venue/49e00a10f964a5203b611fe3">More details (Foursquare)</a> </p>]]></description>
        <TimeSpan>
          <begin>2014-06-11T16:27:28-05:00</begin>
          <end>2014-06-11T18:08:38-05:00</end>
        </TimeSpan>
        <styleUrl>#place_Ramen / Noodle House</styleUrl>
        <Point>
          <coordinates>-71.1207515001297,42.37189721215247</coordinates>
        </Point>
      </Placemark>
      <Placemark id="1402529024000">
        <name><![CDATA[Home]]></name>
        <description><![CDATA[<p>6/11/14<br/> 6:23 PM to 12:00 AM<br/> 5:36 hours</p>]]></description>
        <TimeSpan>
          <begin>2014-06-11T18:23:45-05:00</begin>
          <end>2014-06-11T23:59:59-05:00</end>
        </TimeSpan>
        <styleUrl>#place_home</styleUrl>
        <Point>
          <coordinates>-71.1114458017,42.3754311174</coordinates>
        </Point>
      </Placemark>
    </Folder>
    <Folder>
      <name><![CDATA[6/12/14]]></name>
      <Placemark id="1402549200000">
        <name><![CDATA[Home]]></name>
        <description><![CDATA[<p>6/12/14<br/> 12:00 AM to 11:02 AM<br/> 11:02 hours</p>]]></description>
        <TimeSpan>
          <begin>2014-06-12T00:00:01-05:00</begin>
          <end>2014-06-12T11:02:21-05:00</end>
        </TimeSpan>
        <styleUrl>#place_home</styleUrl>
        <Point>
          <coordinates>-71.1114458017,42.3754311174</coordinates>
        </Point>
      </Placemark>
      <Placemark id="1402589684000">
        <name><![CDATA[Proximate]]></name>
        <atom:link href="http://foursquare.com/venue/51c8c0d1498e5d4d09a48362"/>
        <description><![CDATA[<p>6/12/14<br/> 11:14 AM to 11:23 AM<br/> 8 min</p> <p>Tech Startup<br/> <a href="http://foursquare.com/venue/51c8c0d1498e5d4d09a48362">More details (Foursquare)</a> </p>]]></description>
        <TimeSpan>
          <begin>2014-06-12T11:14:45-05:00</begin>
          <end>2014-06-12T11:23:42-05:00</end>
        </TimeSpan>
        <styleUrl>#place_Tech Startup</styleUrl>
        <Point>
          <coordinates>-71.117205,42.378716</coordinates>
        </Point>
      </Placemark>
      <Placemark id="1402590589000">
        <name><![CDATA[Science Center Plaza]]></name>
        <atom:link href="http://foursquare.com/venue/517c126de4b0db4bc4f91b0a"/>
        <description><![CDATA[<p>6/12/14<br/> 11:29 AM to 11:36 AM<br/> 6 min</p> <p>Plaza<br/> <a href="http://foursquare.com/venue/517c126de4b0db4bc4f91b0a">More details (Foursquare)</a> </p>]]></description>
        <TimeSpan>
          <begin>2014-06-12T11:29:50-05:00</begin>
          <end>2014-06-12T11:36:35-05:00</end>
        </TimeSpan>
        <styleUrl>#place_Plaza</styleUrl>
        <Point>
          <coordinates>-71.11671274278848,42.37586051920407</coordinates>
        </Point>
      </Placemark>
      <Placemark id="1402591435000">
        <name><![CDATA[Proximate]]></name>
        <atom:link href="http://foursquare.com/venue/51c8c0d1498e5d4d09a48362"/>
        <description><![CDATA[<p>6/12/14<br/> 11:43 AM to 3:24 PM<br/> 3:40 hours</p> <p>Tech Startup<br/> <a href="http://foursquare.com/venue/51c8c0d1498e5d4d09a48362">More details (Foursquare)</a> </p>]]></description>
        <TimeSpan>
          <begin>2014-06-12T11:43:56-05:00</begin>
          <end>2014-06-12T15:24:14-05:00</end>
        </TimeSpan>
        <styleUrl>#place_Tech Startup</styleUrl>
        <Point>
          <coordinates>-71.117205,42.378716</coordinates>
        </Point>
      </Placemark>
      <Placemark id="1402605295000">
        <name><![CDATA[Home]]></name>
        <description><![CDATA[<p>6/12/14<br/> 3:34 PM to 3:40 PM<br/> 5 min</p>]]></description>
        <TimeSpan>
          <begin>2014-06-12T15:34:56-05:00</begin>
          <end>2014-06-12T15:40:01-05:00</end>
        </TimeSpan>
        <styleUrl>#place_home</styleUrl>
        <Point>
          <coordinates>-71.1114458017,42.3754311174</coordinates>
        </Point>
      </Placemark>
      <Placemark id="1402608156000">
        <name><![CDATA[City Hall Plaza]]></name>
        <atom:link href="http://foursquare.com/venue/4a74b8c9f964a5205edf1fe3"/>
        <description><![CDATA[<p>6/12/14<br/> 4:22 PM to 4:54 PM<br/> 31 min</p> <p>Plaza<br/> <a href="http://foursquare.com/venue/4a74b8c9f964a5205edf1fe3">More details (Foursquare)</a> </p>]]></description>
        <TimeSpan>
          <begin>2014-06-12T16:22:37-05:00</begin>
          <end>2014-06-12T16:54:12-05:00</end>
        </TimeSpan>
        <styleUrl>#place_Plaza</styleUrl>
        <Point>
          <coordinates>-71.05896949768066,42.36006607480819</coordinates>
        </Point>
      </Placemark>
      <Placemark id="1402610901000">
        <name><![CDATA[Place in Dock Square]]></name>
        <description><![CDATA[<p>6/12/14<br/> 5:08 PM to 5:14 PM<br/> 6 min</p>]]></description>
        <TimeSpan>
          <begin>2014-06-12T17:08:22-05:00</begin>
          <end>2014-06-12T17:14:45-05:00</end>
        </TimeSpan>
        <styleUrl>#place_unknown</styleUrl>
        <Point>
          <coordinates>-71.0616645251,42.3560961304</coordinates>
        </Point>
      </Placemark>
      <Placemark id="1402613273000">
        <name><![CDATA[Home]]></name>
        <description><![CDATA[<p>6/12/14<br/> 5:47 PM to 8:31 PM<br/> 2:44 hours</p>]]></description>
        <TimeSpan>
          <begin>2014-06-12T17:47:54-05:00</begin>
          <end>2014-06-12T20:31:58-05:00</end>
        </TimeSpan>
        <styleUrl>#place_home</styleUrl>
        <Point>
          <coordinates>-71.1114458017,42.3754311174</coordinates>
        </Point>
      </Placemark>
      <Placemark id="1402625005000">
        <name><![CDATA[Place in Dock Square]]></name>
        <description><![CDATA[<p>6/12/14<br/> 9:03 PM to 9:32 PM<br/> 29 min</p>]]></description>
        <TimeSpan>
          <begin>2014-06-12T21:03:26-05:00</begin>
          <end>2014-06-12T21:32:35-05:00</end>
        </TimeSpan>
        <styleUrl>#place_unknown</styleUrl>
        <Point>
          <coordinates>-71.0558817924,42.3502768895</coordinates>
        </Point>
      </Placemark>
    </Folder>
    <Folder>
      <name><![CDATA[6/13/14]]></name>
      <Placemark id="1402649365000">
        <name><![CDATA[Place in Powelton]]></name>
        <description><![CDATA[<p>6/13/14<br/> 3:49 AM to 4:00 AM<br/> 11 min</p>]]></description>
        <TimeSpan>
          <begin>2014-06-13T03:49:26-05:00</begin>
          <end>2014-06-13T04:00:58-05:00</end>
        </TimeSpan>
        <styleUrl>#place_unknown</styleUrl>
        <Point>
          <coordinates>-75.1851245546,39.9562125044</coordinates>
        </Point>
      </Placemark>
      <Placemark id="1402662862000">
        <name><![CDATA[Union Station]]></name>
        <atom:link href="http://foursquare.com/venue/430a6700f964a52036271fe3"/>
        <description><![CDATA[<p>6/13/14<br/> 7:34 AM to 7:35 AM<br/> 1 min</p> <p>Train Station<br/> <a href="http://foursquare.com/venue/430a6700f964a52036271fe3">More details (Foursquare)</a> </p>]]></description>
        <TimeSpan>
          <begin>2014-06-13T07:34:23-05:00</begin>
          <end>2014-06-13T07:35:37-05:00</end>
        </TimeSpan>
        <styleUrl>#place_Train Station</styleUrl>
        <Point>
          <coordinates>-77.0061671733856,38.89756277173564</coordinates>
        </Point>
      </Placemark>
      <Placemark id="1402663065000">
        <name><![CDATA[Union Station]]></name>
        <atom:link href="http://foursquare.com/venue/430a6700f964a52036271fe3"/>
        <description><![CDATA[<p>6/13/14<br/> 7:37 AM to 7:54 AM<br/> 16 min</p> <p>Train Station<br/> <a href="http://foursquare.com/venue/430a6700f964a52036271fe3">More details (Foursquare)</a> </p>]]></description>
        <TimeSpan>
          <begin>2014-06-13T07:37:46-05:00</begin>
          <end>2014-06-13T07:54:05-05:00</end>
        </TimeSpan>
        <styleUrl>#place_Train Station</styleUrl>
        <Point>
          <coordinates>-77.0061671733856,38.89756277173564</coordinates>
        </Point>
      </Placemark>
      <Placemark id="1402665748000">
        <name><![CDATA[Laura's Home]]></name>
        <description><![CDATA[<p>6/13/14<br/> 8:22 AM to 8:34 PM<br/> 12:12 hours</p>]]></description>
        <TimeSpan>
          <begin>2014-06-13T08:22:29-05:00</begin>
          <end>2014-06-13T20:34:45-05:00</end>
        </TimeSpan>
        <styleUrl>#place_home</styleUrl>
        <Point>
          <coordinates>-77.0772744833,38.9219057145</coordinates>
        </Point>
      </Placemark>
      <Placemark id="1402710430000">
        <name><![CDATA[Whole Foods Market]]></name>
        <atom:link href="http://foursquare.com/venue/4aad58b8f964a520d25f20e3"/>
        <description><![CDATA[<p>6/13/14<br/> 8:47 PM to 9:05 PM<br/> 18 min</p> <p>Grocery Store<br/> <a href="http://foursquare.com/venue/4aad58b8f964a520d25f20e3">More details (Foursquare)</a> </p>]]></description>
        <TimeSpan>
          <begin>2014-06-13T20:47:11-05:00</begin>
          <end>2014-06-13T21:05:56-05:00</end>
        </TimeSpan>
        <styleUrl>#place_Grocery Store</styleUrl>
        <Point>
          <coordinates>-77.071804,38.920938</coordinates>
        </Point>
      </Placemark>
      <Placemark id="1402712168000">
        <name><![CDATA[Laura's Home]]></name>
        <description><![CDATA[<p>6/13/14<br/> 9:16 PM to 12:00 AM<br/> 2:43 hours</p>]]></description>
        <TimeSpan>
          <begin>2014-06-13T21:16:09-05:00</begin>
          <end>2014-06-13T23:59:59-05:00</end>
        </TimeSpan>
        <styleUrl>#place_home</styleUrl>
        <Point>
          <coordinates>-77.0772744833,38.9219057145</coordinates>
        </Point>
      </Placemark>
    </Folder>
    <Folder>
      <name><![CDATA[6/14/14]]></name>
      <Placemark id="1402722000000">
        <name><![CDATA[Laura's Home]]></name>
        <description><![CDATA[<p>6/14/14<br/> 12:00 AM to 4:08 PM<br/> 16:08 hours</p>]]></description>
        <TimeSpan>
          <begin>2014-06-14T00:00:01-05:00</begin>
          <end>2014-06-14T16:08:08-05:00</end>
        </TimeSpan>
        <styleUrl>#place_home</styleUrl>
        <Point>
          <coordinates>-77.0772744833,38.9219057145</coordinates>
        </Point>
      </Placemark>
      <Placemark id="1402781207000">
        <name><![CDATA[Safeway]]></name>
        <atom:link href="http://foursquare.com/venue/4bb614dc2f70c9b656d68430"/>
        <description><![CDATA[<p>6/14/14<br/> 4:26 PM to 4:53 PM<br/> 26 min</p> <p>Grocery Store<br/> <a href="http://foursquare.com/venue/4bb614dc2f70c9b656d68430">More details (Foursquare)</a> </p>]]></description>
        <TimeSpan>
          <begin>2014-06-14T16:26:48-05:00</begin>
          <end>2014-06-14T16:53:39-05:00</end>
        </TimeSpan>
        <styleUrl>#place_Grocery Store</styleUrl>
        <Point>
          <coordinates>-77.06758975982666,38.91567980755536</coordinates>
        </Point>
      </Placemark>
      <Placemark id="1402784000000">
        <name><![CDATA[Laura's Home]]></name>
        <description><![CDATA[<p>6/14/14<br/> 5:13 PM to 12:00 AM<br/> 6:46 hours</p>]]></description>
        <TimeSpan>
          <begin>2014-06-14T17:13:21-05:00</begin>
          <end>2014-06-14T23:59:59-05:00</end>
        </TimeSpan>
        <styleUrl>#place_home</styleUrl>
        <Point>
          <coordinates>-77.0772744833,38.9219057145</coordinates>
        </Point>
      </Placemark>
    </Folder>
    <Folder>
      <name><![CDATA[6/15/14]]></name>
      <Placemark id="1402808400000">
        <name><![CDATA[Laura's Home]]></name>
        <description><![CDATA[<p>6/15/14<br/> 12:00 AM to 2:24 PM<br/> 14:24 hours</p>]]></description>
        <TimeSpan>
          <begin>2014-06-15T00:00:01-05:00</begin>
          <end>2014-06-15T14:24:57-05:00</end>
        </TimeSpan>
        <styleUrl>#place_home</styleUrl>
        <Point>
          <coordinates>-77.0772744833,38.9219057145</coordinates>
        </Point>
      </Placemark>
      <Placemark id="1402861448000">
        <name><![CDATA[Place in Burleith]]></name>
        <description><![CDATA[<p>6/15/14<br/> 2:44 PM to 2:47 PM<br/> 3 min</p>]]></description>
        <TimeSpan>
          <begin>2014-06-15T14:44:09-05:00</begin>
          <end>2014-06-15T14:47:41-05:00</end>
        </TimeSpan>
        <styleUrl>#place_unknown</styleUrl>
        <Point>
          <coordinates>-77.0684111497,38.9157435198</coordinates>
        </Point>
      </Placemark>
      <Placemark id="1402862624000">
        <name><![CDATA[Place in Cloisters]]></name>
        <description><![CDATA[<p>6/15/14<br/> 3:03 PM to 3:10 PM<br/> 6 min</p>]]></description>
        <TimeSpan>
          <begin>2014-06-15T15:03:45-05:00</begin>
          <end>2014-06-15T15:10:03-05:00</end>
        </TimeSpan>
        <styleUrl>#place_unknown</styleUrl>
        <Point>
          <coordinates>-77.0638223339,38.9078022221</coordinates>
        </Point>
      </Placemark>
      <Placemark id="1402863164000">
        <name><![CDATA[Loft]]></name>
        <atom:link href="http://foursquare.com/venue/4fc01863e4b04422a0a2cd57"/>
        <description><![CDATA[<p>6/15/14<br/> 3:12 PM to 3:23 PM<br/> 10 min</p> <p>Women's Store<br/> <a href="http://foursquare.com/venue/4fc01863e4b04422a0a2cd57">More details (Foursquare)</a> </p>]]></description>
        <TimeSpan>
          <begin>2014-06-15T15:12:45-05:00</begin>
          <end>2014-06-15T15:23:37-05:00</end>
        </TimeSpan>
        <styleUrl>#place_Women's Store</styleUrl>
        <Point>
          <coordinates>-77.06249230880837,38.90613336217169</coordinates>
        </Point>
      </Placemark>
      <Placemark id="1402864157000">
        <name><![CDATA[H&M]]></name>
        <atom:link href="http://foursquare.com/venue/49f5dde7f964a520c36b1fe3"/>
        <description><![CDATA[<p>6/15/14<br/> 3:29 PM to 4:17 PM<br/> 47 min</p> <p>Clothing Store<br/> <a href="http://foursquare.com/venue/49f5dde7f964a520c36b1fe3">More details (Foursquare)</a> </p>]]></description>
        <TimeSpan>
          <begin>2014-06-15T15:29:18-05:00</begin>
          <end>2014-06-15T16:17:07-05:00</end>
        </TimeSpan>
        <styleUrl>#place_Clothing Store</styleUrl>
        <Point>
          <coordinates>-77.06373810768127,38.90479344272695</coordinates>
        </Point>
      </Placemark>
      <Placemark id="1402868418000">
        <name><![CDATA[Sequoia]]></name>
        <atom:link href="http://foursquare.com/venue/4b1a9856f964a52010ed23e3"/>
        <description><![CDATA[<p>6/15/14<br/> 4:40 PM to 6:59 PM<br/> 2:19 hours</p> <p>American Restaurant<br/> <a href="http://foursquare.com/venue/4b1a9856f964a52010ed23e3">More details (Foursquare)</a> </p>]]></description>
        <TimeSpan>
          <begin>2014-06-15T16:40:19-05:00</begin>
          <end>2014-06-15T18:59:26-05:00</end>
        </TimeSpan>
        <styleUrl>#place_American Restaurant</styleUrl>
        <Point>
          <coordinates>-77.0595645904541,38.90101955850752</coordinates>
        </Point>
      </Placemark>
      <Placemark id="1402879003000">
        <name><![CDATA[Whole Foods Market]]></name>
        <atom:link href="http://foursquare.com/venue/4aad58b8f964a520d25f20e3"/>
        <description><![CDATA[<p>6/15/14<br/> 7:36 PM to 7:41 PM<br/> 4 min</p> <p>Grocery Store<br/> <a href="http://foursquare.com/venue/4aad58b8f964a520d25f20e3">More details (Foursquare)</a> </p>]]></description>
        <TimeSpan>
          <begin>2014-06-15T19:36:44-05:00</begin>
          <end>2014-06-15T19:41:09-05:00</end>
        </TimeSpan>
        <styleUrl>#place_Grocery Store</styleUrl>
        <Point>
          <coordinates>-77.071804,38.920938</coordinates>
        </Point>
      </Placemark>
      <Placemark id="1402879902000">
        <name><![CDATA[Laura's Home]]></name>
        <description><![CDATA[<p>6/15/14<br/> 7:51 PM to 12:00 AM<br/> 4:08 hours</p>]]></description>
        <TimeSpan>
          <begin>2014-06-15T19:51:43-05:00</begin>
          <end>2014-06-15T23:59:59-05:00</end>
        </TimeSpan>
        <styleUrl>#place_home</styleUrl>
        <Point>
          <coordinates>-77.0772744833,38.9219057145</coordinates>
        </Point>
      </Placemark>
    </Folder>
    <Folder>
      <name><![CDATA[6/16/14]]></name>
      <Placemark id="1402894800000">
        <name><![CDATA[Laura's Home]]></name>
        <description><![CDATA[<p>6/16/14<br/> 12:00 AM to 1:02 PM<br/> 13:02 hours</p>]]></description>
        <TimeSpan>
          <begin>2014-06-16T00:00:01-05:00</begin>
          <end>2014-06-16T13:02:08-05:00</end>
        </TimeSpan>
        <styleUrl>#place_home</styleUrl>
        <Point>
          <coordinates>-77.0772744833,38.9219057145</coordinates>
        </Point>
      </Placemark>
      <Placemark id="1402943390000">
        <name><![CDATA[Chadwicks]]></name>
        <atom:link href="http://foursquare.com/venue/41abb800f964a520571e1fe3"/>
        <description><![CDATA[<p>6/16/14<br/> 1:29 PM to 3:51 PM<br/> 2:21 hours</p> <p>American Restaurant<br/> <a href="http://foursquare.com/venue/41abb800f964a520571e1fe3">More details (Foursquare)</a> </p>]]></description>
        <TimeSpan>
          <begin>2014-06-16T13:29:51-05:00</begin>
          <end>2014-06-16T15:51:18-05:00</end>
        </TimeSpan>
        <styleUrl>#place_American Restaurant</styleUrl>
        <Point>
          <coordinates>-77.062908,38.902664</coordinates>
        </Point>
      </Placemark>
      <Placemark id="1402952363000">
        <name><![CDATA[Sequoia]]></name>
        <atom:link href="http://foursquare.com/venue/4b1a9856f964a52010ed23e3"/>
        <description><![CDATA[<p>6/16/14<br/> 3:59 PM to 7:08 PM<br/> 3:09 hours</p> <p>American Restaurant<br/> <a href="http://foursquare.com/venue/4b1a9856f964a52010ed23e3">More details (Foursquare)</a> </p>]]></description>
        <TimeSpan>
          <begin>2014-06-16T15:59:24-05:00</begin>
          <end>2014-06-16T19:08:57-05:00</end>
        </TimeSpan>
        <styleUrl>#place_American Restaurant</styleUrl>
        <Point>
          <coordinates>-77.0595645904541,38.90101955850752</coordinates>
        </Point>
      </Placemark>
      <Placemark id="1402964470000">
        <name><![CDATA[Place in Cookes Park]]></name>
        <description><![CDATA[<p>6/16/14<br/> 7:21 PM to 8:50 PM<br/> 1:28 hours</p>]]></description>
        <TimeSpan>
          <begin>2014-06-16T19:21:11-05:00</begin>
          <end>2014-06-16T20:50:08-05:00</end>
        </TimeSpan>
        <styleUrl>#place_unknown</styleUrl>
        <Point>
          <coordinates>-77.0611697728,38.9043879601</coordinates>
        </Point>
      </Placemark>
      <Placemark id="1402970441000">
        <name><![CDATA[Laura's Home]]></name>
        <description><![CDATA[<p>6/16/14<br/> 9:00 PM to 12:00 AM<br/> 2:59 hours</p>]]></description>
        <TimeSpan>
          <begin>2014-06-16T21:00:42-05:00</begin>
          <end>2014-06-16T23:59:59-05:00</end>
        </TimeSpan>
        <styleUrl>#place_home</styleUrl>
        <Point>
          <coordinates>-77.0772744833,38.9219057145</coordinates>
        </Point>
      </Placemark>
    </Folder>
    <Folder>
      <name><![CDATA[6/17/14]]></name>
      <Placemark id="1402981200000">
        <name><![CDATA[Laura's Home]]></name>
        <description><![CDATA[<p>6/17/14<br/> 12:00 AM to 10:45 AM<br/> 10:45 hours</p>]]></description>
        <TimeSpan>
          <begin>2014-06-17T00:00:01-05:00</begin>
          <end>2014-06-17T10:45:00-05:00</end>
        </TimeSpan>
        <styleUrl>#place_home</styleUrl>
        <Point>
          <coordinates>-77.0772744833,38.9219057145</coordinates>
        </Point>
      </Placemark>
      <Placemark id="1403020422000">
        <name><![CDATA[WMATA Bus Stop #1001805 (31, 32, 36)]]></name>
        <atom:link href="http://foursquare.com/venue/4e9b7ac54901d3b0b7587b98"/>
        <description><![CDATA[<p>6/17/14<br/> 10:53 AM to 11:18 AM<br/> 24 min</p> <p>Bus Line<br/> <a href="http://foursquare.com/venue/4e9b7ac54901d3b0b7587b98">More details (Foursquare)</a> </p>]]></description>
        <TimeSpan>
          <begin>2014-06-17T10:53:43-05:00</begin>
          <end>2014-06-17T11:18:10-05:00</end>
        </TimeSpan>
        <styleUrl>#place_Bus Line</styleUrl>
        <Point>
          <coordinates>-77.07277336996707,38.92229853987276</coordinates>
        </Point>
      </Placemark>
      <Placemark id="1403024872000">
        <name><![CDATA[NTN24]]></name>
        <atom:link href="http://foursquare.com/venue/4ec5b4b38b81dcfdc16568d3"/>
        <description><![CDATA[<p>6/17/14<br/> 12:07 PM to 12:24 PM<br/> 16 min</p> <p>Office<br/> <a href="http://foursquare.com/venue/4ec5b4b38b81dcfdc16568d3">More details (Foursquare)</a> </p>]]></description>
        <TimeSpan>
          <begin>2014-06-17T12:07:53-05:00</begin>
          <end>2014-06-17T12:24:37-05:00</end>
        </TimeSpan>
        <styleUrl>#place_Office</styleUrl>
        <Point>
          <coordinates>-77.032106,38.901567</coordinates>
        </Point>
      </Placemark>
      <Placemark id="1403026676000">
        <name><![CDATA[Eat at National Place]]></name>
        <atom:link href="http://foursquare.com/venue/4b607467f964a520f1e629e3"/>
        <description><![CDATA[<p>6/17/14<br/> 12:37 PM to 1:08 PM<br/> 30 min</p> <p>Food Court<br/> <a href="http://foursquare.com/venue/4b607467f964a520f1e629e3">More details (Foursquare)</a> </p>]]></description>
        <TimeSpan>
          <begin>2014-06-17T12:37:57-05:00</begin>
          <end>2014-06-17T13:08:03-05:00</end>
        </TimeSpan>
        <styleUrl>#place_Food Court</styleUrl>
        <Point>
          <coordinates>-77.03016505709523,38.89736635211879</coordinates>
        </Point>
      </Placemark>
      <Placemark id="1403029000000">
        <name><![CDATA[NTN24]]></name>
        <atom:link href="http://foursquare.com/venue/4ec5b4b38b81dcfdc16568d3"/>
        <description><![CDATA[<p>6/17/14<br/> 1:16 PM to 5:42 PM<br/> 4:26 hours</p> <p>Office<br/> <a href="http://foursquare.com/venue/4ec5b4b38b81dcfdc16568d3">More details (Foursquare)</a> </p>]]></description>
        <TimeSpan>
          <begin>2014-06-17T13:16:41-05:00</begin>
          <end>2014-06-17T17:42:40-05:00</end>
        </TimeSpan>
        <styleUrl>#place_Office</styleUrl>
        <Point>
          <coordinates>-77.032106,38.901567</coordinates>
        </Point>
      </Placemark>
      <Placemark id="1403046648000">
        <name><![CDATA[Trader Joe's]]></name>
        <atom:link href="http://foursquare.com/venue/4a04a703f964a52016721fe3"/>
        <description><![CDATA[<p>6/17/14<br/> 6:10 PM to 6:34 PM<br/> 24 min</p> <p>Grocery Store<br/> <a href="http://foursquare.com/venue/4a04a703f964a52016721fe3">More details (Foursquare)</a> </p>]]></description>
        <TimeSpan>
          <begin>2014-06-17T18:10:49-05:00</begin>
          <end>2014-06-17T18:34:49-05:00</end>
        </TimeSpan>
        <styleUrl>#place_Grocery Store</styleUrl>
        <Point>
          <coordinates>-77.05326165317148,38.90410567190644</coordinates>
        </Point>
      </Placemark>
      <Placemark id="1403049195000">
        <name><![CDATA[Laura's Home]]></name>
        <description><![CDATA[<p>6/17/14<br/> 6:53 PM to 12:00 AM<br/> 5:06 hours</p>]]></description>
        <TimeSpan>
          <begin>2014-06-17T18:53:16-05:00</begin>
          <end>2014-06-17T23:59:59-05:00</end>
        </TimeSpan>
        <styleUrl>#place_home</styleUrl>
        <Point>
          <coordinates>-77.0772744833,38.9219057145</coordinates>
        </Point>
      </Placemark>
    </Folder>
    <Folder>
      <name><![CDATA[6/18/14]]></name>
      <Placemark id="1403067600000">
        <name><![CDATA[Laura's Home]]></name>
        <description><![CDATA[<p>6/18/14<br/> 12:00 AM to 8:32 AM<br/> 8:32 hours</p>]]></description>
        <TimeSpan>
          <begin>2014-06-18T00:00:01-05:00</begin>
          <end>2014-06-18T08:32:48-05:00</end>
        </TimeSpan>
        <styleUrl>#place_home</styleUrl>
        <Point>
          <coordinates>-77.0772744833,38.9219057145</coordinates>
        </Point>
      </Placemark>
      <Placemark id="1403099004000">
        <name><![CDATA[CVS/pharmacy]]></name>
        <atom:link href="http://foursquare.com/venue/4a89f3c7f964a520790920e3"/>
        <description><![CDATA[<p>6/18/14<br/> 8:43 AM to 9:13 AM<br/> 30 min</p> <p>Drugstore / Pharmacy<br/> <a href="http://foursquare.com/venue/4a89f3c7f964a520790920e3">More details (Foursquare)</a> </p>]]></description>
        <TimeSpan>
          <begin>2014-06-18T08:43:25-05:00</begin>
          <end>2014-06-18T09:13:47-05:00</end>
        </TimeSpan>
        <styleUrl>#place_Drugstore / Pharmacy</styleUrl>
        <Point>
          <coordinates>-77.071487,38.92005</coordinates>
        </Point>
      </Placemark>
      <Placemark id="1403102752000">
        <name><![CDATA[NTN24]]></name>
        <atom:link href="http://foursquare.com/venue/4ec5b4b38b81dcfdc16568d3"/>
        <description><![CDATA[<p>6/18/14<br/> 9:45 AM to 11:12 AM<br/> 1:27 hours</p> <p>Office<br/> <a href="http://foursquare.com/venue/4ec5b4b38b81dcfdc16568d3">More details (Foursquare)</a> </p>]]></description>
        <TimeSpan>
          <begin>2014-06-18T09:45:53-05:00</begin>
          <end>2014-06-18T11:12:57-05:00</end>
        </TimeSpan>
        <styleUrl>#place_Office</styleUrl>
        <Point>
          <coordinates>-77.032106,38.901567</coordinates>
        </Point>
      </Placemark>
      <Placemark id="1403108919000">
        <name><![CDATA[NTN24]]></name>
        <atom:link href="http://foursquare.com/venue/4ec5b4b38b81dcfdc16568d3"/>
        <description><![CDATA[<p>6/18/14<br/> 11:28 AM to 2:13 PM<br/> 2:44 hours</p> <p>Office<br/> <a href="http://foursquare.com/venue/4ec5b4b38b81dcfdc16568d3">More details (Foursquare)</a> </p>]]></description>
        <TimeSpan>
          <begin>2014-06-18T11:28:40-05:00</begin>
          <end>2014-06-18T14:13:11-05:00</end>
        </TimeSpan>
        <styleUrl>#place_Office</styleUrl>
        <Point>
          <coordinates>-77.032106,38.901567</coordinates>
        </Point>
      </Placemark>
      <Placemark id="1403119714000">
        <name><![CDATA[Union Station]]></name>
        <atom:link href="http://foursquare.com/venue/430a6700f964a52036271fe3"/>
        <description><![CDATA[<p>6/18/14<br/> 2:28 PM to 2:40 PM<br/> 12 min</p> <p>Train Station<br/> <a href="http://foursquare.com/venue/430a6700f964a52036271fe3">More details (Foursquare)</a> </p>]]></description>
        <TimeSpan>
          <begin>2014-06-18T14:28:35-05:00</begin>
          <end>2014-06-18T14:40:51-05:00</end>
        </TimeSpan>
        <styleUrl>#place_Train Station</styleUrl>
        <Point>
          <coordinates>-77.0061671733856,38.89756277173564</coordinates>
        </Point>
      </Placemark>
      <Placemark id="1403120487000">
        <name><![CDATA[Place in East End]]></name>
        <description><![CDATA[<p>6/18/14<br/> 2:41 PM to 3:05 PM<br/> 23 min</p>]]></description>
        <TimeSpan>
          <begin>2014-06-18T14:41:28-05:00</begin>
          <end>2014-06-18T15:05:04-05:00</end>
        </TimeSpan>
        <styleUrl>#place_unknown</styleUrl>
        <Point>
          <coordinates>-77.0055473762,38.8998032103</coordinates>
        </Point>
      </Placemark>
      <Placemark id="1403151284000">
        <name><![CDATA[Place in Uptown]]></name>
        <description><![CDATA[<p>6/18/14<br/> 11:14 PM to 11:41 PM<br/> 27 min</p>]]></description>
        <TimeSpan>
          <begin>2014-06-18T23:14:45-05:00</begin>
          <end>2014-06-18T23:41:46-05:00</end>
        </TimeSpan>
        <styleUrl>#place_unknown</styleUrl>
        <Point>
          <coordinates>-79.9908144618,40.445879205</coordinates>
        </Point>
      </Placemark>
    </Folder>
    <Folder>
      <name><![CDATA[6/19/14]]></name>
      <Placemark id="1403171425000">
        <name><![CDATA[Place in Toledo]]></name>
        <description><![CDATA[<p>6/19/14<br/> 4:50 AM to 4:59 AM<br/> 9 min</p>]]></description>
        <TimeSpan>
          <begin>2014-06-19T04:50:26-05:00</begin>
          <end>2014-06-19T04:59:35-05:00</end>
        </TimeSpan>
        <styleUrl>#place_unknown</styleUrl>
        <Point>
          <coordinates>-83.5415580982,41.6381386279</coordinates>
        </Point>
      </Placemark>
      <Placemark id="1403187568000">
        <name><![CDATA[Place in Elkhart]]></name>
        <description><![CDATA[<p>6/19/14<br/> 9:19 AM to 9:24 AM<br/> 4 min</p>]]></description>
        <TimeSpan>
          <begin>2014-06-19T09:19:29-05:00</begin>
          <end>2014-06-19T09:24:23-05:00</end>
        </TimeSpan>
        <styleUrl>#place_unknown</styleUrl>
        <Point>
          <coordinates>-85.9730152589,41.6816401257</coordinates>
        </Point>
      </Placemark>
      <Placemark id="1403192148000">
        <name><![CDATA[Place in Porter County]]></name>
        <description><![CDATA[<p>6/19/14<br/> 10:35 AM to 11:10 AM<br/> 35 min</p>]]></description>
        <TimeSpan>
          <begin>2014-06-19T10:35:49-05:00</begin>
          <end>2014-06-19T11:10:54-05:00</end>
        </TimeSpan>
        <styleUrl>#place_unknown</styleUrl>
        <Point>
          <coordinates>-86.9828823579,41.602431962</coordinates>
        </Point>
      </Placemark>
      <Placemark id="1403200300000">
        <name><![CDATA[Place in Gateway Center IV]]></name>
        <description><![CDATA[<p>6/19/14<br/> 12:51 PM to 12:55 PM<br/> 3 min</p>]]></description>
        <TimeSpan>
          <begin>2014-06-19T12:51:41-05:00</begin>
          <end>2014-06-19T12:55:19-05:00</end>
        </TimeSpan>
        <styleUrl>#place_unknown</styleUrl>
        <Point>
          <coordinates>-87.6384495601,41.8775149268</coordinates>
        </Point>
      </Placemark>
      <Placemark id="1403201212000">
        <name><![CDATA[Place in Indian Boundary Line (1816-1833)]]></name>
        <description><![CDATA[<p>6/19/14<br/> 1:06 PM to 1:27 PM<br/> 20 min</p>]]></description>
        <TimeSpan>
          <begin>2014-06-19T13:06:53-05:00</begin>
          <end>2014-06-19T13:27:06-05:00</end>
        </TimeSpan>
        <styleUrl>#place_unknown</styleUrl>
        <Point>
          <coordinates>-87.6407224134,41.8818651979</coordinates>
        </Point>
      </Placemark>
      <Placemark id="1403202427000">
        <name><![CDATA[Place in Ogilvie Transportation Center]]></name>
        <description><![CDATA[<p>6/19/14<br/> 1:27 PM to 1:49 PM<br/> 21 min</p>]]></description>
        <TimeSpan>
          <begin>2014-06-19T13:27:08-05:00</begin>
          <end>2014-06-19T13:49:01-05:00</end>
        </TimeSpan>
        <styleUrl>#place_unknown</styleUrl>
        <Point>
          <coordinates>-87.640851031,41.8830321351</coordinates>
        </Point>
      </Placemark>
      <Placemark id="1403208225000">
        <name><![CDATA[Fitzsimmons Home]]></name>
        <description><![CDATA[<p>6/19/14<br/> 3:03 PM to 3:33 PM<br/> 29 min</p>]]></description>
        <TimeSpan>
          <begin>2014-06-19T15:03:46-05:00</begin>
          <end>2014-06-19T15:33:05-05:00</end>
        </TimeSpan>
        <styleUrl>#place_home</styleUrl>
        <Point>
          <coordinates>-88.311048021,41.8771070061</coordinates>
        </Point>
      </Placemark>
      <Placemark id="1403210439000">
        <name><![CDATA[Place in Walmart]]></name>
        <description><![CDATA[<p>6/19/14<br/> 3:40 PM to 4:03 PM<br/> 23 min</p>]]></description>
        <TimeSpan>
          <begin>2014-06-19T15:40:40-05:00</begin>
          <end>2014-06-19T16:03:45-05:00</end>
        </TimeSpan>
        <styleUrl>#place_unknown</styleUrl>
        <Point>
