<?xml version="1.0" encoding="UTF-8"?><kml xmlns="http://www.opengis.net/kml/2.2" xmlns:gx="http://www.google.com/kml/ext/2.2" xmlns:atom="http://www.w3.org/2005/Atom" xmlns:xal="urn:oasis:names:tc:ciq:xsdschema:xAL:2.0" xmlns:xsi="http://www.w3.org/2001/XMLSchema-instance">
  <Document>
    <atom:link href="http://www.moves-app.com"/>
    <description><![CDATA[<p align="center"><a href="http://www.moves-app.com"> <img src="http://www.moves-app.com/assets/moves.png"/> </a></p> <p align="center">Moves Storyline</p>]]></description>
    <Style id="place_Liquor Store">
      <IconStyle>
        <scale>1.0</scale>
        <heading>0.0</heading>
        <Icon>
          <href>https://ss1.4sqi.net/img/categories/shops/default.png</href>
          <refreshInterval>0.0</refreshInterval>
          <viewRefreshTime>0.0</viewRefreshTime>
          <viewBoundScale>0.0</viewBoundScale>
        </Icon>
      </IconStyle>
    </Style>
    <Style id="place_Tapas Restaurant">
      <IconStyle>
        <scale>1.0</scale>
        <heading>0.0</heading>
        <Icon>
          <href>https://ss1.4sqi.net/img/categories/food/default.png</href>
          <refreshInterval>0.0</refreshInterval>
          <viewRefreshTime>0.0</viewRefreshTime>
          <viewBoundScale>0.0</viewBoundScale>
        </Icon>
      </IconStyle>
    </Style>
    <Style id="place_Mexican Restaurant">
      <IconStyle>
        <scale>1.0</scale>
        <heading>0.0</heading>
        <Icon>
          <href>https://ss1.4sqi.net/img/categories/food/mexican.png</href>
          <refreshInterval>0.0</refreshInterval>
          <viewRefreshTime>0.0</viewRefreshTime>
          <viewBoundScale>0.0</viewBoundScale>
        </Icon>
      </IconStyle>
    </Style>
    <Style id="place_Community Center">
      <IconStyle>
        <scale>1.0</scale>
        <heading>0.0</heading>
        <Icon>
          <href>https://ss1.4sqi.net/img/categories/building/default.png</href>
          <refreshInterval>0.0</refreshInterval>
          <viewRefreshTime>0.0</viewRefreshTime>
          <viewBoundScale>0.0</viewBoundScale>
        </Icon>
      </IconStyle>
    </Style>
    <Style id="place_Hotel">
      <IconStyle>
        <scale>1.0</scale>
        <heading>0.0</heading>
        <Icon>
          <href>https://ss1.4sqi.net/img/categories/travel/hotel.png</href>
          <refreshInterval>0.0</refreshInterval>
          <viewRefreshTime>0.0</viewRefreshTime>
          <viewBoundScale>0.0</viewBoundScale>
        </Icon>
      </IconStyle>
    </Style>
    <Style id="place_College Residence Hall">
      <IconStyle>
        <scale>1.0</scale>
        <heading>0.0</heading>
        <Icon>
          <href>https://ss1.4sqi.net/img/categories/education/default.png</href>
          <refreshInterval>0.0</refreshInterval>
          <viewRefreshTime>0.0</viewRefreshTime>
          <viewBoundScale>0.0</viewBoundScale>
        </Icon>
      </IconStyle>
    </Style>
    <Style id="place_school">
      <IconStyle>
        <scale>1.0</scale>
        <heading>0.0</heading>
        <Icon>
          <href>http://ss1.4sqi.net/img/categories/building/school.png</href>
          <refreshInterval>0.0</refreshInterval>
          <viewRefreshTime>0.0</viewRefreshTime>
          <viewBoundScale>0.0</viewBoundScale>
        </Icon>
      </IconStyle>
    </Style>
    <Style id="place_Frozen Yogurt">
      <IconStyle>
        <scale>1.0</scale>
        <heading>0.0</heading>
        <Icon>
          <href>https://ss1.4sqi.net/img/categories/food/default.png</href>
          <refreshInterval>0.0</refreshInterval>
          <viewRefreshTime>0.0</viewRefreshTime>
          <viewBoundScale>0.0</viewBoundScale>
        </Icon>
      </IconStyle>
    </Style>
    <Style id="place_Beach">
      <IconStyle>
        <scale>1.0</scale>
        <heading>0.0</heading>
        <Icon>
          <href>https://ss1.4sqi.net/img/categories/parks_outdoors/beach.png</href>
          <refreshInterval>0.0</refreshInterval>
          <viewRefreshTime>0.0</viewRefreshTime>
          <viewBoundScale>0.0</viewBoundScale>
        </Icon>
      </IconStyle>
    </Style>
    <Style id="place_Electronics Store">
      <IconStyle>
        <scale>1.0</scale>
        <heading>0.0</heading>
        <Icon>
          <href>https://ss1.4sqi.net/img/categories/shops/technology.png</href>
          <refreshInterval>0.0</refreshInterval>
          <viewRefreshTime>0.0</viewRefreshTime>
          <viewBoundScale>0.0</viewBoundScale>
        </Icon>
      </IconStyle>
    </Style>
    <Style id="place_Warehouse Store">
      <IconStyle>
        <scale>1.0</scale>
        <heading>0.0</heading>
        <Icon>
          <href>https://ss1.4sqi.net/img/categories/shops/default.png</href>
          <refreshInterval>0.0</refreshInterval>
          <viewRefreshTime>0.0</viewRefreshTime>
          <viewBoundScale>0.0</viewBoundScale>
        </Icon>
      </IconStyle>
    </Style>
    <Style id="place_College Technology Building">
      <IconStyle>
        <scale>1.0</scale>
        <heading>0.0</heading>
        <Icon>
          <href>https://ss1.4sqi.net/img/categories/education/default.png</href>
          <refreshInterval>0.0</refreshInterval>
          <viewRefreshTime>0.0</viewRefreshTime>
          <viewBoundScale>0.0</viewBoundScale>
        </Icon>
      </IconStyle>
    </Style>
    <Style id="place_Cemetery">
      <IconStyle>
        <scale>1.0</scale>
        <heading>0.0</heading>
        <Icon>
          <href>https://ss1.4sqi.net/img/categories/parks_outdoors/cemetery.png</href>
          <refreshInterval>0.0</refreshInterval>
          <viewRefreshTime>0.0</viewRefreshTime>
          <viewBoundScale>0.0</viewBoundScale>
        </Icon>
      </IconStyle>
    </Style>
    <Style id="place_Clothing Store">
      <IconStyle>
        <scale>1.0</scale>
        <heading>0.0</heading>
        <Icon>
          <href>https://ss1.4sqi.net/img/categories/shops/apparel.png</href>
          <refreshInterval>0.0</refreshInterval>
          <viewRefreshTime>0.0</viewRefreshTime>
          <viewBoundScale>0.0</viewBoundScale>
        </Icon>
      </IconStyle>
    </Style>
    <Style id="place_Coffee Shop">
      <IconStyle>
        <scale>1.0</scale>
        <heading>0.0</heading>
        <Icon>
          <href>https://ss1.4sqi.net/img/categories/food/coffeeshop.png</href>
          <refreshInterval>0.0</refreshInterval>
          <viewRefreshTime>0.0</viewRefreshTime>
          <viewBoundScale>0.0</viewBoundScale>
        </Icon>
      </IconStyle>
    </Style>
    <Style id="place_Chinese Restaurant">
      <IconStyle>
        <scale>1.0</scale>
        <heading>0.0</heading>
        <Icon>
          <href>https://ss1.4sqi.net/img/categories/food/chinese.png</href>
          <refreshInterval>0.0</refreshInterval>
          <viewRefreshTime>0.0</viewRefreshTime>
          <viewBoundScale>0.0</viewBoundScale>
        </Icon>
      </IconStyle>
    </Style>
    <Style id="place_American Restaurant">
      <IconStyle>
        <scale>1.0</scale>
        <heading>0.0</heading>
        <Icon>
          <href>https://ss1.4sqi.net/img/categories/food/default.png</href>
          <refreshInterval>0.0</refreshInterval>
          <viewRefreshTime>0.0</viewRefreshTime>
          <viewBoundScale>0.0</viewBoundScale>
        </Icon>
      </IconStyle>
    </Style>
    <Style id="place_College Administrative Building">
      <IconStyle>
        <scale>1.0</scale>
        <heading>0.0</heading>
        <Icon>
          <href>https://ss1.4sqi.net/img/categories/education/default.png</href>
          <refreshInterval>0.0</refreshInterval>
          <viewRefreshTime>0.0</viewRefreshTime>
          <viewBoundScale>0.0</viewBoundScale>
        </Icon>
      </IconStyle>
    </Style>
    <Style id="place_Women's Store">
      <IconStyle>
        <scale>1.0</scale>
        <heading>0.0</heading>
        <Icon>
          <href>https://ss1.4sqi.net/img/categories/shops/apparel_women.png</href>
          <refreshInterval>0.0</refreshInterval>
          <viewRefreshTime>0.0</viewRefreshTime>
          <viewBoundScale>0.0</viewBoundScale>
        </Icon>
      </IconStyle>
    </Style>
    <Style id="place_Neighborhood">
      <IconStyle>
        <scale>1.0</scale>
        <heading>0.0</heading>
        <Icon>
          <href>https://ss1.4sqi.net/img/categories/parks_outdoors/default.png</href>
          <refreshInterval>0.0</refreshInterval>
          <viewRefreshTime>0.0</viewRefreshTime>
          <viewBoundScale>0.0</viewBoundScale>
        </Icon>
      </IconStyle>
    </Style>
    <Style id="place_work">
      <IconStyle>
        <scale>1.0</scale>
        <heading>0.0</heading>
        <Icon>
          <href>http://ss1.4sqi.net/img/categories/building/default.png</href>
          <refreshInterval>0.0</refreshInterval>
          <viewRefreshTime>0.0</viewRefreshTime>
          <viewBoundScale>0.0</viewBoundScale>
        </Icon>
      </IconStyle>
    </Style>
    <Style id="place_Ice Cream Shop">
      <IconStyle>
        <scale>1.0</scale>
        <heading>0.0</heading>
        <Icon>
          <href>https://ss1.4sqi.net/img/categories/food/icecream.png</href>
          <refreshInterval>0.0</refreshInterval>
          <viewRefreshTime>0.0</viewRefreshTime>
          <viewBoundScale>0.0</viewBoundScale>
        </Icon>
      </IconStyle>
    </Style>
    <Style id="place_user">
      <IconStyle>
        <scale>1.0</scale>
        <heading>0.0</heading>
        <Icon>
          <href>http://maps.google.com/mapfiles/marker_white.png</href>
          <refreshInterval>0.0</refreshInterval>
          <viewRefreshTime>0.0</viewRefreshTime>
          <viewBoundScale>0.0</viewBoundScale>
        </Icon>
      </IconStyle>
    </Style>
    <Style id="place_College Cafeteria">
      <IconStyle>
        <scale>1.0</scale>
        <heading>0.0</heading>
        <Icon>
          <href>https://ss1.4sqi.net/img/categories/education/cafeteria.png</href>
          <refreshInterval>0.0</refreshInterval>
          <viewRefreshTime>0.0</viewRefreshTime>
          <viewBoundScale>0.0</viewBoundScale>
        </Icon>
      </IconStyle>
    </Style>
    <Style id="place_Seafood Restaurant">
      <IconStyle>
        <scale>1.0</scale>
        <heading>0.0</heading>
        <Icon>
          <href>https://ss1.4sqi.net/img/categories/food/seafood.png</href>
          <refreshInterval>0.0</refreshInterval>
          <viewRefreshTime>0.0</viewRefreshTime>
          <viewBoundScale>0.0</viewBoundScale>
        </Icon>
      </IconStyle>
    </Style>
    <Style id="place_Gastropub">
      <IconStyle>
        <scale>1.0</scale>
        <heading>0.0</heading>
        <Icon>
          <href>https://ss1.4sqi.net/img/categories/food/default.png</href>
          <refreshInterval>0.0</refreshInterval>
          <viewRefreshTime>0.0</viewRefreshTime>
          <viewBoundScale>0.0</viewBoundScale>
        </Icon>
      </IconStyle>
    </Style>
    <Style id="place_College Academic Building">
      <IconStyle>
        <scale>1.0</scale>
        <heading>0.0</heading>
        <Icon>
          <href>https://ss1.4sqi.net/img/categories/education/default.png</href>
          <refreshInterval>0.0</refreshInterval>
          <viewRefreshTime>0.0</viewRefreshTime>
          <viewBoundScale>0.0</viewBoundScale>
        </Icon>
      </IconStyle>
    </Style>
    <Style id="place_Fish Market">
      <IconStyle>
        <scale>1.0</scale>
        <heading>0.0</heading>
        <Icon>
          <href>https://ss1.4sqi.net/img/categories/shops/fish_market.png</href>
          <refreshInterval>0.0</refreshInterval>
          <viewRefreshTime>0.0</viewRefreshTime>
          <viewBoundScale>0.0</viewBoundScale>
        </Icon>
      </IconStyle>
    </Style>
    <Style id="place_foursquare">
      <IconStyle>
        <scale>1.0</scale>
        <heading>0.0</heading>
        <Icon>
          <href>http://maps.google.com/mapfiles/marker_white.png</href>
          <refreshInterval>0.0</refreshInterval>
          <viewRefreshTime>0.0</viewRefreshTime>
          <viewBoundScale>0.0</viewBoundScale>
        </Icon>
      </IconStyle>
    </Style>
    <Style id="place_Tech Startup">
      <IconStyle>
        <scale>1.0</scale>
        <heading>0.0</heading>
        <Icon>
          <href>https://ss1.4sqi.net/img/categories/shops/technology.png</href>
          <refreshInterval>0.0</refreshInterval>
          <viewRefreshTime>0.0</viewRefreshTime>
          <viewBoundScale>0.0</viewBoundScale>
        </Icon>
      </IconStyle>
    </Style>
    <Style id="place_Pizza Place">
      <IconStyle>
        <scale>1.0</scale>
        <heading>0.0</heading>
        <Icon>
          <href>https://ss1.4sqi.net/img/categories/food/pizza.png</href>
          <refreshInterval>0.0</refreshInterval>
          <viewRefreshTime>0.0</viewRefreshTime>
          <viewBoundScale>0.0</viewBoundScale>
        </Icon>
      </IconStyle>
    </Style>
    <Style id="place_Wine Bar">
      <IconStyle>
        <scale>1.0</scale>
        <heading>0.0</heading>
        <Icon>
          <href>https://ss1.4sqi.net/img/categories/nightlife/wine.png</href>
          <refreshInterval>0.0</refreshInterval>
          <viewRefreshTime>0.0</viewRefreshTime>
          <viewBoundScale>0.0</viewBoundScale>
        </Icon>
      </IconStyle>
    </Style>
    <Style id="place_Post Office">
      <IconStyle>
        <scale>1.0</scale>
        <heading>0.0</heading>
        <Icon>
          <href>https://ss1.4sqi.net/img/categories/building/postoffice.png</href>
          <refreshInterval>0.0</refreshInterval>
          <viewRefreshTime>0.0</viewRefreshTime>
          <viewBoundScale>0.0</viewBoundScale>
        </Icon>
      </IconStyle>
    </Style>
    <Style id="place_Grocery Store">
      <IconStyle>
        <scale>1.0</scale>
        <heading>0.0</heading>
        <Icon>
          <href>https://ss1.4sqi.net/img/categories/shops/food_grocery.png</href>
          <refreshInterval>0.0</refreshInterval>
          <viewRefreshTime>0.0</viewRefreshTime>
          <viewBoundScale>0.0</viewBoundScale>
        </Icon>
      </IconStyle>
    </Style>
    <Style id="place_Hardware Store">
      <IconStyle>
        <scale>1.0</scale>
        <heading>0.0</heading>
        <Icon>
          <href>https://ss1.4sqi.net/img/categories/shops/hardware.png</href>
          <refreshInterval>0.0</refreshInterval>
          <viewRefreshTime>0.0</viewRefreshTime>
          <viewBoundScale>0.0</viewBoundScale>
        </Icon>
      </IconStyle>
    </Style>
    <Style id="place_Bus Line">
      <IconStyle>
        <scale>1.0</scale>
        <heading>0.0</heading>
        <Icon>
          <href>https://ss1.4sqi.net/img/categories/travel/busstation.png</href>
          <refreshInterval>0.0</refreshInterval>
          <viewRefreshTime>0.0</viewRefreshTime>
          <viewBoundScale>0.0</viewBoundScale>
        </Icon>
      </IconStyle>
    </Style>
    <Style id="place_College Quad">
      <IconStyle>
        <scale>1.0</scale>
        <heading>0.0</heading>
        <Icon>
          <href>https://ss1.4sqi.net/img/categories/education/default.png</href>
          <refreshInterval>0.0</refreshInterval>
          <viewRefreshTime>0.0</viewRefreshTime>
          <viewBoundScale>0.0</viewBoundScale>
        </Icon>
      </IconStyle>
    </Style>
    <Style id="place_Coworking Space">
      <IconStyle>
        <scale>1.0</scale>
        <heading>0.0</heading>
        <Icon>
          <href>https://ss1.4sqi.net/img/categories/building/default.png</href>
          <refreshInterval>0.0</refreshInterval>
          <viewRefreshTime>0.0</viewRefreshTime>
          <viewBoundScale>0.0</viewBoundScale>
        </Icon>
      </IconStyle>
    </Style>
    <Style id="place_Café">
      <IconStyle>
        <scale>1.0</scale>
        <heading>0.0</heading>
        <Icon>
          <href>https://ss1.4sqi.net/img/categories/food/cafe.png</href>
          <refreshInterval>0.0</refreshInterval>
          <viewRefreshTime>0.0</viewRefreshTime>
          <viewBoundScale>0.0</viewBoundScale>
        </Icon>
      </IconStyle>
    </Style>
    <Style id="place_unknown">
      <IconStyle>
        <scale>1.0</scale>
        <heading>0.0</heading>
        <Icon>
          <href>http://maps.google.com/mapfiles/marker_white.png</href>
          <refreshInterval>0.0</refreshInterval>
          <viewRefreshTime>0.0</viewRefreshTime>
          <viewBoundScale>0.0</viewBoundScale>
        </Icon>
      </IconStyle>
    </Style>
    <Style id="place_University">
      <IconStyle>
        <scale>1.0</scale>
        <heading>0.0</heading>
        <Icon>
          <href>https://ss1.4sqi.net/img/categories/education/default.png</href>
          <refreshInterval>0.0</refreshInterval>
          <viewRefreshTime>0.0</viewRefreshTime>
          <viewBoundScale>0.0</viewBoundScale>
        </Icon>
      </IconStyle>
    </Style>
    <Style id="place_Airport Terminal">
      <IconStyle>
        <scale>1.0</scale>
        <heading>0.0</heading>
        <Icon>
          <href>https://ss1.4sqi.net/img/categories/travel/airport_terminal.png</href>
          <refreshInterval>0.0</refreshInterval>
          <viewRefreshTime>0.0</viewRefreshTime>
          <viewBoundScale>0.0</viewBoundScale>
        </Icon>
      </IconStyle>
    </Style>
    <Style id="place_Bar">
      <IconStyle>
        <scale>1.0</scale>
        <heading>0.0</heading>
        <Icon>
          <href>https://ss1.4sqi.net/img/categories/nightlife/bar.png</href>
          <refreshInterval>0.0</refreshInterval>
          <viewRefreshTime>0.0</viewRefreshTime>
          <viewBoundScale>0.0</viewBoundScale>
        </Icon>
      </IconStyle>
    </Style>
    <Style id="place_Airport">
      <IconStyle>
        <scale>1.0</scale>
        <heading>0.0</heading>
        <Icon>
          <href>https://ss1.4sqi.net/img/categories/travel/airport.png</href>
          <refreshInterval>0.0</refreshInterval>
          <viewRefreshTime>0.0</viewRefreshTime>
          <viewBoundScale>0.0</viewBoundScale>
        </Icon>
      </IconStyle>
    </Style>
    <Style id="place_College Classroom">
      <IconStyle>
        <scale>1.0</scale>
        <heading>0.0</heading>
        <Icon>
          <href>https://ss1.4sqi.net/img/categories/education/default.png</href>
          <refreshInterval>0.0</refreshInterval>
          <viewRefreshTime>0.0</viewRefreshTime>
          <viewBoundScale>0.0</viewBoundScale>
        </Icon>
      </IconStyle>
    </Style>
    <Style id="place_home">
      <IconStyle>
        <scale>1.0</scale>
        <heading>0.0</heading>
        <Icon>
          <href>http://ss1.4sqi.net/img/categories/building/home.png</href>
          <refreshInterval>0.0</refreshInterval>
          <viewRefreshTime>0.0</viewRefreshTime>
          <viewBoundScale>0.0</viewBoundScale>
        </Icon>
      </IconStyle>
    </Style>
    <Style id="place_Drugstore / Pharmacy">
      <IconStyle>
        <scale>1.0</scale>
        <heading>0.0</heading>
        <Icon>
          <href>https://ss1.4sqi.net/img/categories/shops/drugstore.png</href>
          <refreshInterval>0.0</refreshInterval>
          <viewRefreshTime>0.0</viewRefreshTime>
          <viewBoundScale>0.0</viewBoundScale>
        </Icon>
      </IconStyle>
    </Style>
    <Style id="place_Office">
      <IconStyle>
        <scale>1.0</scale>
        <heading>0.0</heading>
        <Icon>
          <href>https://ss1.4sqi.net/img/categories/building/default.png</href>
          <refreshInterval>0.0</refreshInterval>
          <viewRefreshTime>0.0</viewRefreshTime>
          <viewBoundScale>0.0</viewBoundScale>
        </Icon>
      </IconStyle>
    </Style>
    <Style id="place_New American Restaurant">
      <IconStyle>
        <scale>1.0</scale>
        <heading>0.0</heading>
        <Icon>
          <href>https://ss1.4sqi.net/img/categories/food/default.png</href>
          <refreshInterval>0.0</refreshInterval>
          <viewRefreshTime>0.0</viewRefreshTime>
          <viewBoundScale>0.0</viewBoundScale>
        </Icon>
      </IconStyle>
    </Style>
    <Style id="place_Subway">
      <IconStyle>
        <scale>1.0</scale>
        <heading>0.0</heading>
        <Icon>
          <href>https://ss1.4sqi.net/img/categories/travel/subway.png</href>
          <refreshInterval>0.0</refreshInterval>
          <viewRefreshTime>0.0</viewRefreshTime>
          <viewBoundScale>0.0</viewBoundScale>
        </Icon>
      </IconStyle>
    </Style>
    <Style id="place_Bus Station">
      <IconStyle>
        <scale>1.0</scale>
        <heading>0.0</heading>
        <Icon>
          <href>https://ss1.4sqi.net/img/categories/travel/busstation.png</href>
          <refreshInterval>0.0</refreshInterval>
          <viewRefreshTime>0.0</viewRefreshTime>
          <viewBoundScale>0.0</viewBoundScale>
        </Icon>
      </IconStyle>
    </Style>
    <Style id="place_Student Center">
      <IconStyle>
        <scale>1.0</scale>
        <heading>0.0</heading>
        <Icon>
          <href>https://ss1.4sqi.net/img/categories/education/default.png</href>
          <refreshInterval>0.0</refreshInterval>
          <viewRefreshTime>0.0</viewRefreshTime>
          <viewBoundScale>0.0</viewBoundScale>
        </Icon>
      </IconStyle>
    </Style>
    <Style id="place_Park">
      <IconStyle>
        <scale>1.0</scale>
        <heading>0.0</heading>
        <Icon>
          <href>https://ss1.4sqi.net/img/categories/parks_outdoors/default.png</href>
          <refreshInterval>0.0</refreshInterval>
          <viewRefreshTime>0.0</viewRefreshTime>
          <viewBoundScale>0.0</viewBoundScale>
        </Icon>
      </IconStyle>
    </Style>
    <Folder>
      <name><![CDATA[8/1/14]]></name>
      <Placemark id="1406865600000">
        <name><![CDATA[Laura's Home]]></name>
        <description><![CDATA[<p>8/1/14<br/> 12:00 AM to 10:27 AM<br/> 10:27 hours</p>]]></description>
        <TimeSpan>
          <begin>2014-08-01T00:00:01-04:00</begin>
          <end>2014-08-01T10:27:15-04:00</end>
        </TimeSpan>
        <styleUrl>#place_home</styleUrl>
        <Point>
          <coordinates>-77.0772744833,38.9219057145</coordinates>
        </Point>
      </Placemark>
      <Placemark id="1406903618000">
        <name><![CDATA[WMATA Bus Stop #1001805 (31, 32, 36)]]></name>
        <atom:link href="http://foursquare.com/venue/4e9b7ac54901d3b0b7587b98"/>
        <description><![CDATA[<p>8/1/14<br/> 10:33 AM to 10:41 AM<br/> 7 min</p> <p>Bus Line<br/> <a href="http://foursquare.com/venue/4e9b7ac54901d3b0b7587b98">More details (Foursquare)</a> </p>]]></description>
        <TimeSpan>
          <begin>2014-08-01T10:33:39-04:00</begin>
          <end>2014-08-01T10:41:31-04:00</end>
        </TimeSpan>
        <styleUrl>#place_Bus Line</styleUrl>
        <Point>
          <coordinates>-77.07277336996707,38.92229853987276</coordinates>
        </Point>
      </Placemark>
      <Placemark id="1406905964000">
        <name><![CDATA[Starbucks]]></name>
        <atom:link href="http://foursquare.com/venue/4af5b4c8f964a520a6fb21e3"/>
        <description><![CDATA[<p>8/1/14<br/> 11:12 AM to 12:29 PM<br/> 1:16 hours</p> <p>Coffee Shop<br/> <a href="http://foursquare.com/venue/4af5b4c8f964a520a6fb21e3">More details (Foursquare)</a> </p>]]></description>
        <TimeSpan>
          <begin>2014-08-01T11:12:45-04:00</begin>
          <end>2014-08-01T12:29:22-04:00</end>
        </TimeSpan>
        <styleUrl>#place_Coffee Shop</styleUrl>
        <Point>
          <coordinates>-77.03195312062199,38.89947134437488</coordinates>
        </Point>
      </Placemark>
      <Placemark id="1406911894000">
        <name><![CDATA[Farragut Square]]></name>
        <atom:link href="http://foursquare.com/venue/49e7923cf964a520c6641fe3"/>
        <description><![CDATA[<p>8/1/14<br/> 12:51 PM to 1:53 PM<br/> 1:01 hours</p> <p>Park<br/> <a href="http://foursquare.com/venue/49e7923cf964a520c6641fe3">More details (Foursquare)</a> </p>]]></description>
        <TimeSpan>
          <begin>2014-08-01T12:51:35-04:00</begin>
          <end>2014-08-01T13:53:21-04:00</end>
        </TimeSpan>
        <styleUrl>#place_Park</styleUrl>
        <Point>
          <coordinates>-77.03898668289185,38.90185450592493</coordinates>
        </Point>
      </Placemark>
      <Placemark id="1406916282000">
        <name><![CDATA[NTN24-Washington, DC]]></name>
        <atom:link href="http://foursquare.com/venue/4ec5b5509a52756c53a0be9c"/>
        <description><![CDATA[<p>8/1/14<br/> 2:04 PM to 6:32 PM<br/> 4:27 hours</p> <p>Office<br/> <a href="http://foursquare.com/venue/4ec5b5509a52756c53a0be9c">More details (Foursquare)</a> </p>]]></description>
        <TimeSpan>
          <begin>2014-08-01T14:04:43-04:00</begin>
          <end>2014-08-01T18:32:36-04:00</end>
        </TimeSpan>
        <styleUrl>#place_Office</styleUrl>
        <Point>
          <coordinates>-77.03193625222163,38.900182458396</coordinates>
        </Point>
      </Placemark>
      <Placemark id="1406933368000">
        <name><![CDATA[Chinatown Express]]></name>
        <atom:link href="http://foursquare.com/venue/465b42cdf964a52027471fe3"/>
        <description><![CDATA[<p>8/1/14<br/> 6:49 PM to 7:44 PM<br/> 55 min</p> <p>Chinese Restaurant<br/> <a href="http://foursquare.com/venue/465b42cdf964a52027471fe3">More details (Foursquare)</a> </p>]]></description>
        <TimeSpan>
          <begin>2014-08-01T18:49:29-04:00</begin>
          <end>2014-08-01T19:44:48-04:00</end>
        </TimeSpan>
        <styleUrl>#place_Chinese Restaurant</styleUrl>
        <Point>
          <coordinates>-77.019893,38.899633</coordinates>
        </Point>
      </Placemark>
      <Placemark id="1406938076000">
        <name><![CDATA[WMATA Bus Stop #1001060 (11Y, 32, 36)]]></name>
        <atom:link href="http://foursquare.com/venue/4e7cf2330aafcfb3b125a8aa"/>
        <description><![CDATA[<p>8/1/14<br/> 8:07 PM to 8:23 PM<br/> 15 min</p> <p>Bus Station<br/> <a href="http://foursquare.com/venue/4e7cf2330aafcfb3b125a8aa">More details (Foursquare)</a> </p>]]></description>
        <TimeSpan>
          <begin>2014-08-01T20:07:57-04:00</begin>
          <end>2014-08-01T20:23:13-04:00</end>
        </TimeSpan>
        <styleUrl>#place_Bus Station</styleUrl>
        <Point>
          <coordinates>-77.033571,38.899766</coordinates>
        </Point>
      </Placemark>
      <Placemark id="1406941049000">
        <name><![CDATA[Laura's Home]]></name>
        <description><![CDATA[<p>8/1/14<br/> 8:57 PM to 12:00 AM<br/> 3:02 hours</p>]]></description>
        <TimeSpan>
          <begin>2014-08-01T20:57:30-04:00</begin>
          <end>2014-08-01T23:59:59-04:00</end>
        </TimeSpan>
        <styleUrl>#place_home</styleUrl>
        <Point>
          <coordinates>-77.0772744833,38.9219057145</coordinates>
        </Point>
      </Placemark>
    </Folder>
    <Folder>
      <name><![CDATA[8/2/14]]></name>
      <Placemark id="1406952000000">
        <name><![CDATA[Laura's Home]]></name>
        <description><![CDATA[<p>8/2/14<br/> 12:00 AM to 11:57 AM<br/> 11:57 hours</p>]]></description>
        <TimeSpan>
          <begin>2014-08-02T00:00:01-04:00</begin>
          <end>2014-08-02T11:57:50-04:00</end>
        </TimeSpan>
        <styleUrl>#place_home</styleUrl>
        <Point>
          <coordinates>-77.0772744833,38.9219057145</coordinates>
        </Point>
      </Placemark>
      <Placemark id="1406997898000">
        <name><![CDATA[Mintwood Place]]></name>
        <atom:link href="http://foursquare.com/venue/4f0f0f940039a4c198967f3d"/>
        <description><![CDATA[<p>8/2/14<br/> 12:44 PM to 2:07 PM<br/> 1:22 hours</p> <p>New American Restaurant<br/> <a href="http://foursquare.com/venue/4f0f0f940039a4c198967f3d">More details (Foursquare)</a> </p>]]></description>
        <TimeSpan>
          <begin>2014-08-02T12:44:59-04:00</begin>
          <end>2014-08-02T14:07:01-04:00</end>
        </TimeSpan>
        <styleUrl>#place_New American Restaurant</styleUrl>
        <Point>
          <coordinates>-77.04345256090164,38.9221114952691</coordinates>
        </Point>
      </Placemark>
      <Placemark id="1407005833000">
        <name><![CDATA[Starbucks]]></name>
        <atom:link href="http://foursquare.com/venue/4a9c1b58f964a520fe3520e3"/>
        <description><![CDATA[<p>8/2/14<br/> 2:57 PM to 6:14 PM<br/> 3:17 hours</p> <p>Coffee Shop<br/> <a href="http://foursquare.com/venue/4a9c1b58f964a520fe3520e3">More details (Foursquare)</a> </p>]]></description>
        <TimeSpan>
          <begin>2014-08-02T14:57:14-04:00</begin>
          <end>2014-08-02T18:14:39-04:00</end>
        </TimeSpan>
        <styleUrl>#place_Coffee Shop</styleUrl>
        <Point>
          <coordinates>-77.061918,38.905063</coordinates>
        </Point>
      </Placemark>
      <Placemark id="1407018109000">
        <name><![CDATA[Banana Republic]]></name>
        <atom:link href="http://foursquare.com/venue/4a95b188f964a5202b2420e3"/>
        <description><![CDATA[<p>8/2/14<br/> 6:21 PM to 6:29 PM<br/> 8 min</p> <p>Clothing Store<br/> <a href="http://foursquare.com/venue/4a95b188f964a5202b2420e3">More details (Foursquare)</a> </p>]]></description>
        <TimeSpan>
          <begin>2014-08-02T18:21:50-04:00</begin>
          <end>2014-08-02T18:29:53-04:00</end>
        </TimeSpan>
        <styleUrl>#place_Clothing Store</styleUrl>
        <Point>
          <coordinates>-77.06286331916888,38.90503822184606</coordinates>
        </Point>
      </Placemark>
      <Placemark id="1407018779000">
        <name><![CDATA[Pizzeria Paradiso]]></name>
        <atom:link href="http://foursquare.com/venue/4a25b915f964a5208a7e1fe3"/>
        <description><![CDATA[<p>8/2/14<br/> 6:32 PM to 8:09 PM<br/> 1:36 hours</p> <p>Pizza Place<br/> <a href="http://foursquare.com/venue/4a25b915f964a5208a7e1fe3">More details (Foursquare)</a> </p>]]></description>
        <TimeSpan>
          <begin>2014-08-02T18:33:00-04:00</begin>
          <end>2014-08-02T20:09:00-04:00</end>
        </TimeSpan>
        <styleUrl>#place_Pizza Place</styleUrl>
        <Point>
          <coordinates>-77.06553250551224,38.90502721656731</coordinates>
        </Point>
      </Placemark>
      <Placemark id="1407025100000">
        <name><![CDATA[Laura's Home]]></name>
        <description><![CDATA[<p>8/2/14<br/> 8:18 PM to 12:00 AM<br/> 3:41 hours</p>]]></description>
        <TimeSpan>
          <begin>2014-08-02T20:18:21-04:00</begin>
          <end>2014-08-02T23:59:59-04:00</end>
        </TimeSpan>
        <styleUrl>#place_home</styleUrl>
        <Point>
          <coordinates>-77.0772744833,38.9219057145</coordinates>
        </Point>
      </Placemark>
    </Folder>
    <Folder>
      <name><![CDATA[8/3/14]]></name>
      <Placemark id="1407038400000">
        <name><![CDATA[Laura's Home]]></name>
        <description><![CDATA[<p>8/3/14<br/> 12:00 AM to 12:46 PM<br/> 12:46 hours</p>]]></description>
        <TimeSpan>
          <begin>2014-08-03T00:00:01-04:00</begin>
          <end>2014-08-03T12:46:08-04:00</end>
        </TimeSpan>
        <styleUrl>#place_home</styleUrl>
        <Point>
          <coordinates>-77.0772744833,38.9219057145</coordinates>
        </Point>
      </Placemark>
      <Placemark id="1407085540000">
        <name><![CDATA[Capt. White's Seafood City]]></name>
        <atom:link href="http://foursquare.com/venue/4b6ede00f964a52021ce2ce3"/>
        <description><![CDATA[<p>8/3/14<br/> 1:05 PM to 2:45 PM<br/> 1:39 hours</p> <p>Fish Market<br/> <a href="http://foursquare.com/venue/4b6ede00f964a52021ce2ce3">More details (Foursquare)</a> </p>]]></description>
        <TimeSpan>
          <begin>2014-08-03T13:05:41-04:00</begin>
          <end>2014-08-03T14:45:14-04:00</end>
        </TimeSpan>
        <styleUrl>#place_Fish Market</styleUrl>
        <Point>
          <coordinates>-77.02814080234724,38.881099864596</coordinates>
        </Point>
      </Placemark>
      <Placemark id="1407092540000">
        <name><![CDATA[Place in District of Columbia]]></name>
        <description><![CDATA[<p>8/3/14<br/> 3:02 PM to 3:06 PM<br/> 4 min</p>]]></description>
        <TimeSpan>
          <begin>2014-08-03T15:02:21-04:00</begin>
          <end>2014-08-03T15:06:46-04:00</end>
        </TimeSpan>
        <styleUrl>#place_unknown</styleUrl>
        <Point>
          <coordinates>-77.0256496005,38.8876744642</coordinates>
        </Point>
      </Placemark>
      <Placemark id="1407094766000">
        <name><![CDATA[Masa 14]]></name>
        <atom:link href="http://foursquare.com/venue/4ad7f346f964a520441021e3"/>
        <description><![CDATA[<p>8/3/14<br/> 3:39 PM to 5:12 PM<br/> 1:32 hours</p> <p>Tapas Restaurant<br/> <a href="http://foursquare.com/venue/4ad7f346f964a520441021e3">More details (Foursquare)</a> </p>]]></description>
        <TimeSpan>
          <begin>2014-08-03T15:39:27-04:00</begin>
          <end>2014-08-03T17:12:14-04:00</end>
        </TimeSpan>
        <styleUrl>#place_Tapas Restaurant</styleUrl>
        <Point>
          <coordinates>-77.03177881370483,38.91488952754031</coordinates>
        </Point>
      </Placemark>
      <Placemark id="1407101477000">
        <name><![CDATA[Whole Foods Market]]></name>
        <atom:link href="http://foursquare.com/venue/4aad58b8f964a520d25f20e3"/>
        <description><![CDATA[<p>8/3/14<br/> 5:31 PM to 5:48 PM<br/> 17 min</p> <p>Grocery Store<br/> <a href="http://foursquare.com/venue/4aad58b8f964a520d25f20e3">More details (Foursquare)</a> </p>]]></description>
        <TimeSpan>
          <begin>2014-08-03T17:31:18-04:00</begin>
          <end>2014-08-03T17:48:34-04:00</end>
        </TimeSpan>
        <styleUrl>#place_Grocery Store</styleUrl>
        <Point>
          <coordinates>-77.071804,38.920938</coordinates>
        </Point>
      </Placemark>
      <Placemark id="1407103193000">
        <name><![CDATA[Laura's Home]]></name>
        <description><![CDATA[<p>8/3/14<br/> 5:59 PM to 12:00 AM<br/> 6:00 hours</p>]]></description>
        <TimeSpan>
          <begin>2014-08-03T17:59:54-04:00</begin>
          <end>2014-08-03T23:59:59-04:00</end>
        </TimeSpan>
        <styleUrl>#place_home</styleUrl>
        <Point>
          <coordinates>-77.0772744833,38.9219057145</coordinates>
        </Point>
      </Placemark>
    </Folder>
    <Folder>
      <name><![CDATA[8/4/14]]></name>
      <Placemark id="1407124800000">
        <name><![CDATA[Laura's Home]]></name>
        <description><![CDATA[<p>8/4/14<br/> 12:00 AM to 9:31 AM<br/> 9:31 hours</p>]]></description>
        <TimeSpan>
          <begin>2014-08-04T00:00:01-04:00</begin>
          <end>2014-08-04T09:31:30-04:00</end>
        </TimeSpan>
        <styleUrl>#place_home</styleUrl>
        <Point>
          <coordinates>-77.0772744833,38.9219057145</coordinates>
        </Point>
      </Placemark>
      <Placemark id="1407161136000">
        <name><![CDATA[NTN24-Washington, DC]]></name>
        <atom:link href="http://foursquare.com/venue/4ec5b5509a52756c53a0be9c"/>
        <description><![CDATA[<p>8/4/14<br/> 10:05 AM to 10:15 AM<br/> 10 min</p> <p>Office<br/> <a href="http://foursquare.com/venue/4ec5b5509a52756c53a0be9c">More details (Foursquare)</a> </p>]]></description>
        <TimeSpan>
          <begin>2014-08-04T10:05:37-04:00</begin>
          <end>2014-08-04T10:15:41-04:00</end>
        </TimeSpan>
        <styleUrl>#place_Office</styleUrl>
        <Point>
          <coordinates>-77.03193625222163,38.900182458396</coordinates>
        </Point>
      </Placemark>
      <Placemark id="1407161776000">
        <name><![CDATA[NTN24-Washington, DC]]></name>
        <atom:link href="http://foursquare.com/venue/4ec5b5509a52756c53a0be9c"/>
        <description><![CDATA[<p>8/4/14<br/> 10:16 AM to 10:29 AM<br/> 12 min</p> <p>Office<br/> <a href="http://foursquare.com/venue/4ec5b5509a52756c53a0be9c">More details (Foursquare)</a> </p>]]></description>
        <TimeSpan>
          <begin>2014-08-04T10:16:17-04:00</begin>
          <end>2014-08-04T10:29:03-04:00</end>
        </TimeSpan>
        <styleUrl>#place_Office</styleUrl>
        <Point>
          <coordinates>-77.03193625222163,38.900182458396</coordinates>
        </Point>
      </Placemark>
      <Placemark id="1407164675000">
        <name><![CDATA[NTN24-Washington, DC]]></name>
        <atom:link href="http://foursquare.com/venue/4ec5b5509a52756c53a0be9c"/>
        <description><![CDATA[<p>8/4/14<br/> 11:04 AM to 12:58 PM<br/> 1:53 hours</p> <p>Office<br/> <a href="http://foursquare.com/venue/4ec5b5509a52756c53a0be9c">More details (Foursquare)</a> </p>]]></description>
        <TimeSpan>
          <begin>2014-08-04T11:04:36-04:00</begin>
          <end>2014-08-04T12:58:13-04:00</end>
        </TimeSpan>
        <styleUrl>#place_Office</styleUrl>
        <Point>
          <coordinates>-77.03193625222163,38.900182458396</coordinates>
        </Point>
      </Placemark>
      <Placemark id="1407172802000">
        <name><![CDATA[Northside Social - Coffee & Wine]]></name>
        <atom:link href="http://foursquare.com/venue/4af50336f964a520faf721e3"/>
        <description><![CDATA[<p>8/4/14<br/> 1:20 PM to 2:32 PM<br/> 1:12 hours</p> <p>Wine Bar<br/> <a href="http://foursquare.com/venue/4af50336f964a520faf721e3">More details (Foursquare)</a> </p>]]></description>
        <TimeSpan>
          <begin>2014-08-04T13:20:03-04:00</begin>
          <end>2014-08-04T14:32:35-04:00</end>
        </TimeSpan>
        <styleUrl>#place_Wine Bar</styleUrl>
        <Point>
          <coordinates>-77.09769384837897,38.88556299980174</coordinates>
        </Point>
      </Placemark>
      <Placemark id="1407177345000">
        <name><![CDATA[Place in Clarendon]]></name>
        <description><![CDATA[<p>8/4/14<br/> 2:35 PM to 2:44 PM<br/> 8 min</p>]]></description>
        <TimeSpan>
          <begin>2014-08-04T14:35:46-04:00</begin>
          <end>2014-08-04T14:44:38-04:00</end>
        </TimeSpan>
        <styleUrl>#place_unknown</styleUrl>
        <Point>
          <coordinates>-77.096206315,38.8866989927</coordinates>
        </Point>
      </Placemark>
      <Placemark id="1407178332000">
        <name><![CDATA[Northside Social - Coffee & Wine]]></name>
        <atom:link href="http://foursquare.com/venue/4af50336f964a520faf721e3"/>
        <description><![CDATA[<p>8/4/14<br/> 2:52 PM to 8:32 PM<br/> 5:40 hours</p> <p>Wine Bar<br/> <a href="http://foursquare.com/venue/4af50336f964a520faf721e3">More details (Foursquare)</a> </p>]]></description>
        <TimeSpan>
          <begin>2014-08-04T14:52:13-04:00</begin>
          <end>2014-08-04T20:32:26-04:00</end>
        </TimeSpan>
        <styleUrl>#place_Wine Bar</styleUrl>
        <Point>
          <coordinates>-77.09769384837897,38.88556299980174</coordinates>
        </Point>
      </Placemark>
      <Placemark id="1407201987000">
        <name><![CDATA[Laura's Home]]></name>
        <description><![CDATA[<p>8/4/14<br/> 9:26 PM to 12:00 AM<br/> 2:33 hours</p>]]></description>
        <TimeSpan>
          <begin>2014-08-04T21:26:28-04:00</begin>
          <end>2014-08-04T23:59:59-04:00</end>
        </TimeSpan>
        <styleUrl>#place_home</styleUrl>
        <Point>
          <coordinates>-77.0772744833,38.9219057145</coordinates>
        </Point>
      </Placemark>
    </Folder>
    <Folder>
      <name><![CDATA[8/5/14]]></name>
      <Placemark id="1407211200000">
        <name><![CDATA[Laura's Home]]></name>
        <description><![CDATA[<p>8/5/14<br/> 12:00 AM to 9:22 AM<br/> 9:22 hours</p>]]></description>
        <TimeSpan>
          <begin>2014-08-05T00:00:01-04:00</begin>
          <end>2014-08-05T09:22:16-04:00</end>
        </TimeSpan>
        <styleUrl>#place_home</styleUrl>
        <Point>
          <coordinates>-77.0772744833,38.9219057145</coordinates>
        </Point>
      </Placemark>
      <Placemark id="1407246062000">
        <name><![CDATA[Apple Store]]></name>
        <atom:link href="http://foursquare.com/venue/4bdb67c03904a59377434a9e"/>
        <description><![CDATA[<p>8/5/14<br/> 9:41 AM to 10:09 AM<br/> 28 min</p> <p>Electronics Store<br/> <a href="http://foursquare.com/venue/4bdb67c03904a59377434a9e">More details (Foursquare)</a> </p>]]></description>
        <TimeSpan>
          <begin>2014-08-05T09:41:03-04:00</begin>
          <end>2014-08-05T10:09:52-04:00</end>
        </TimeSpan>
        <styleUrl>#place_Electronics Store</styleUrl>
        <Point>
          <coordinates>-77.0626272217989,38.90590722335151</coordinates>
        </Point>
      </Placemark>
      <Placemark id="1407252781000">
        <name><![CDATA[Busboys and Poets]]></name>
        <atom:link href="http://foursquare.com/venue/44196facf964a52026311fe3"/>
        <description><![CDATA[<p>8/5/14<br/> 11:33 AM to 2:02 PM<br/> 2:29 hours</p> <p>American Restaurant<br/> <a href="http://foursquare.com/venue/44196facf964a52026311fe3">More details (Foursquare)</a> </p>]]></description>
        <TimeSpan>
          <begin>2014-08-05T11:33:02-04:00</begin>
          <end>2014-08-05T14:02:23-04:00</end>
        </TimeSpan>
        <styleUrl>#place_American Restaurant</styleUrl>
        <Point>
          <coordinates>-77.03186315579289,38.91795996865189</coordinates>
        </Point>
      </Placemark>
      <Placemark id="1407262234000">
        <name><![CDATA[Place in Kalorama Triangle]]></name>
        <description><![CDATA[<p>8/5/14<br/> 2:10 PM to 2:17 PM<br/> 6 min</p>]]></description>
        <TimeSpan>
          <begin>2014-08-05T14:10:35-04:00</begin>
          <end>2014-08-05T14:17:22-04:00</end>
        </TimeSpan>
        <styleUrl>#place_unknown</styleUrl>
        <Point>
          <coordinates>-77.0322658816,38.917203946</coordinates>
        </Point>
      </Placemark>
      <Placemark id="1407262643000">
        <name><![CDATA[Busboys and Poets]]></name>
        <atom:link href="http://foursquare.com/venue/44196facf964a52026311fe3"/>
        <description><![CDATA[<p>8/5/14<br/> 2:17 PM to 5:52 PM<br/> 3:35 hours</p> <p>American Restaurant<br/> <a href="http://foursquare.com/venue/44196facf964a52026311fe3">More details (Foursquare)</a> </p>]]></description>
        <TimeSpan>
          <begin>2014-08-05T14:17:24-04:00</begin>
          <end>2014-08-05T17:52:47-04:00</end>
        </TimeSpan>
        <styleUrl>#place_American Restaurant</styleUrl>
        <Point>
          <coordinates>-77.03186315579289,38.91795996865189</coordinates>
        </Point>
      </Placemark>
      <Placemark id="1407276870000">
        <name><![CDATA[WMATA Bus Stop #1001507 (42)]]></name>
        <atom:link href="http://foursquare.com/venue/4c7a8e21a8683704cfef134d"/>
        <description><![CDATA[<p>8/5/14<br/> 6:14 PM to 6:22 PM<br/> 7 min</p> <p>Bus Station<br/> <a href="http://foursquare.com/venue/4c7a8e21a8683704cfef134d">More details (Foursquare)</a> </p>]]></description>
        <TimeSpan>
          <begin>2014-08-05T18:14:31-04:00</begin>
          <end>2014-08-05T18:22:16-04:00</end>
        </TimeSpan>
        <styleUrl>#place_Bus Station</styleUrl>
        <Point>
          <coordinates>-77.04418209160346,38.91099639765825</coordinates>
        </Point>
      </Placemark>
      <Placemark id="1407278637000">
        <name><![CDATA[Laura's Home]]></name>
        <description><![CDATA[<p>8/5/14<br/> 6:43 PM to 12:00 AM<br/> 5:16 hours</p>]]></description>
        <TimeSpan>
          <begin>2014-08-05T18:43:58-04:00</begin>
          <end>2014-08-05T23:59:59-04:00</end>
        </TimeSpan>
        <styleUrl>#place_home</styleUrl>
        <Point>
          <coordinates>-77.0772744833,38.9219057145</coordinates>
        </Point>
      </Placemark>
    </Folder>
    <Folder>
      <name><![CDATA[8/6/14]]></name>
      <Placemark id="1407297600000">
        <name><![CDATA[Laura's Home]]></name>
        <description><![CDATA[<p>8/6/14<br/> 12:00 AM to 7:25 AM<br/> 7:25 hours</p>]]></description>
        <TimeSpan>
          <begin>2014-08-06T00:00:01-04:00</begin>
          <end>2014-08-06T07:25:39-04:00</end>
        </TimeSpan>
        <styleUrl>#place_home</styleUrl>
        <Point>
          <coordinates>-77.0772744833,38.9219057145</coordinates>
        </Point>
      </Placemark>
      <Placemark id="1407324848000">
        <name><![CDATA[Starbucks]]></name>
        <atom:link href="http://foursquare.com/venue/4ae84ab0f964a52085ae21e3"/>
        <description><![CDATA[<p>8/6/14<br/> 7:34 AM to 7:40 AM<br/> 6 min</p> <p>Coffee Shop<br/> <a href="http://foursquare.com/venue/4ae84ab0f964a52085ae21e3">More details (Foursquare)</a> </p>]]></description>
        <TimeSpan>
          <begin>2014-08-06T07:34:09-04:00</begin>
          <end>2014-08-06T07:40:25-04:00</end>
        </TimeSpan>
        <styleUrl>#place_Coffee Shop</styleUrl>
        <Point>
          <coordinates>-77.07147493555041,38.92009508267315</coordinates>
        </Point>
      </Placemark>
      <Placemark id="1407325847000">
        <name><![CDATA[Laura's Home]]></name>
        <description><![CDATA[<p>8/6/14<br/> 7:50 AM to 9:36 AM<br/> 1:45 hours</p>]]></description>
        <TimeSpan>
          <begin>2014-08-06T07:50:48-04:00</begin>
          <end>2014-08-06T09:36:17-04:00</end>
        </TimeSpan>
        <styleUrl>#place_home</styleUrl>
        <Point>
          <coordinates>-77.0772744833,38.9219057145</coordinates>
        </Point>
      </Placemark>
      <Placemark id="1407334566000">
        <name><![CDATA[NTN24-Washington, DC]]></name>
        <atom:link href="http://foursquare.com/venue/4ec5b5509a52756c53a0be9c"/>
        <description><![CDATA[<p>8/6/14<br/> 10:16 AM to 11:25 AM<br/> 1:08 hours</p> <p>Office<br/> <a href="http://foursquare.com/venue/4ec5b5509a52756c53a0be9c">More details (Foursquare)</a> </p>]]></description>
        <TimeSpan>
          <begin>2014-08-06T10:16:07-04:00</begin>
          <end>2014-08-06T11:25:01-04:00</end>
        </TimeSpan>
        <styleUrl>#place_Office</styleUrl>
        <Point>
          <coordinates>-77.03193625222163,38.900182458396</coordinates>
        </Point>
      </Placemark>
      <Placemark id="1407340055000">
        <name><![CDATA[Ronald Reagan Washington National Airport (DCA)]]></name>
        <atom:link href="http://foursquare.com/venue/44d17cecf964a5202b361fe3"/>
        <description><![CDATA[<p>8/6/14<br/> 11:47 AM to 12:36 PM<br/> 49 min</p> <p>Airport<br/> <a href="http://foursquare.com/venue/44d17cecf964a5202b361fe3">More details (Foursquare)</a> </p>]]></description>
        <TimeSpan>
          <begin>2014-08-06T11:47:36-04:00</begin>
          <end>2014-08-06T12:36:43-04:00</end>
        </TimeSpan>
        <styleUrl>#place_Airport</styleUrl>
        <Point>
          <coordinates>-77.04231262207031,38.85304370184257</coordinates>
        </Point>
      </Placemark>
      <Placemark id="1407343525000">
        <name><![CDATA[Terminal A]]></name>
        <atom:link href="http://foursquare.com/venue/4bae6416f964a5201eac3be3"/>
        <description><![CDATA[<p>8/6/14<br/> 12:45 PM to 2:54 PM<br/> 2:09 hours</p> <p>Airport Terminal<br/> <a href="http://foursquare.com/venue/4bae6416f964a5201eac3be3">More details (Foursquare)</a> </p>]]></description>
        <TimeSpan>
          <begin>2014-08-06T12:45:26-04:00</begin>
          <end>2014-08-06T14:54:44-04:00</end>
        </TimeSpan>
        <styleUrl>#place_Airport Terminal</styleUrl>
        <Point>
          <coordinates>-77.04231262207031,38.84858190547411</coordinates>
        </Point>
      </Placemark>
      <Placemark id="1407359701000">
        <name><![CDATA[Broadway Marketplace]]></name>
        <atom:link href="http://foursquare.com/venue/4a661612f964a520ffc71fe3"/>
        <description><![CDATA[<p>8/6/14<br/> 5:15 PM to 5:17 PM<br/> 2 min</p> <p>Grocery Store<br/> <a href="http://foursquare.com/venue/4a661612f964a520ffc71fe3">More details (Foursquare)</a> </p>]]></description>
        <TimeSpan>
          <begin>2014-08-06T17:15:02-04:00</begin>
          <end>2014-08-06T17:17:58-04:00</end>
        </TimeSpan>
        <styleUrl>#place_Grocery Store</styleUrl>
        <Point>
          <coordinates>-71.11300484548056,42.37405171427381</coordinates>
        </Point>
      </Placemark>
      <Placemark id="1407360212000">
        <name><![CDATA[Home]]></name>
        <description><![CDATA[<p>8/6/14<br/> 5:23 PM to 7:12 PM<br/> 1:48 hours</p>]]></description>
        <TimeSpan>
          <begin>2014-08-06T17:23:33-04:00</begin>
          <end>2014-08-06T19:12:01-04:00</end>
        </TimeSpan>
        <styleUrl>#place_home</styleUrl>
        <Point>
          <coordinates>-71.1114458017,42.3754311174</coordinates>
        </Point>
      </Placemark>
      <Placemark id="1407367756000">
        <name><![CDATA[Legal Sea Foods - Charles Square]]></name>
        <atom:link href="http://foursquare.com/venue/4bdcb5fa3904a59331664f9e"/>
        <description><![CDATA[<p>8/6/14<br/> 7:29 PM to 9:09 PM<br/> 1:39 hours</p> <p>Seafood Restaurant<br/> <a href="http://foursquare.com/venue/4bdcb5fa3904a59331664f9e">More details (Foursquare)</a> </p>]]></description>
        <TimeSpan>
          <begin>2014-08-06T19:29:17-04:00</begin>
          <end>2014-08-06T21:09:02-04:00</end>
        </TimeSpan>
        <styleUrl>#place_Seafood Restaurant</styleUrl>
        <Point>
          <coordinates>-71.1230027436908,42.37220351484281</coordinates>
        </Point>
      </Placemark>
      <Placemark id="1407374810000">
        <name><![CDATA[Home]]></name>
        <description><![CDATA[<p>8/6/14<br/> 9:26 PM to 10:33 PM<br/> 1:06 hours</p>]]></description>
        <TimeSpan>
          <begin>2014-08-06T21:26:51-04:00</begin>
          <end>2014-08-06T22:33:10-04:00</end>
        </TimeSpan>
        <styleUrl>#place_home</styleUrl>
        <Point>
          <coordinates>-71.1114458017,42.3754311174</coordinates>
        </Point>
      </Placemark>
      <Placemark id="1407378791000">
        <name><![CDATA[Home]]></name>
        <description><![CDATA[<p>8/6/14<br/> 10:33 PM to 12:00 AM<br/> 1:26 hours</p>]]></description>
        <TimeSpan>
          <begin>2014-08-06T22:33:12-04:00</begin>
          <end>2014-08-06T23:59:59-04:00</end>
        </TimeSpan>
        <styleUrl>#place_home</styleUrl>
        <Point>
          <coordinates>-71.1114458017,42.3754311174</coordinates>
        </Point>
      </Placemark>
    </Folder>
    <Folder>
      <name><![CDATA[8/7/14]]></name>
      <Placemark id="1407384000000">
        <name><![CDATA[Home]]></name>
        <description><![CDATA[<p>8/7/14<br/> 12:00 AM to 8:23 AM<br/> 8:23 hours</p>]]></description>
        <TimeSpan>
          <begin>2014-08-07T00:00:01-04:00</begin>
          <end>2014-08-07T08:23:16-04:00</end>
        </TimeSpan>
        <styleUrl>#place_home</styleUrl>
        <Point>
          <coordinates>-71.1114458017,42.3754311174</coordinates>
        </Point>
      </Placemark>
      <Placemark id="1407414517000">
        <name><![CDATA[Starbucks]]></name>
        <atom:link href="http://foursquare.com/venue/4a5a3eb5f964a520f9b91fe3"/>
        <description><![CDATA[<p>8/7/14<br/> 8:28 AM to 8:36 AM<br/> 7 min</p> <p>Coffee Shop<br/> <a href="http://foursquare.com/venue/4a5a3eb5f964a520f9b91fe3">More details (Foursquare)</a> </p>]]></description>
        <TimeSpan>
          <begin>2014-08-07T08:28:38-04:00</begin>
          <end>2014-08-07T08:36:01-04:00</end>
        </TimeSpan>
        <styleUrl>#place_Coffee Shop</styleUrl>
        <Point>
          <coordinates>-71.11295,42.373886</coordinates>
        </Point>
      </Placemark>
      <Placemark id="1407415911000">
        <name><![CDATA[Proximate]]></name>
        <atom:link href="http://foursquare.com/venue/51c8c0d1498e5d4d09a48362"/>
        <description><![CDATA[<p>8/7/14<br/> 8:51 AM to 9:56 AM<br/> 1:04 hours</p> <p>Tech Startup<br/> <a href="http://foursquare.com/venue/51c8c0d1498e5d4d09a48362">More details (Foursquare)</a> </p>]]></description>
        <TimeSpan>
          <begin>2014-08-07T08:51:52-04:00</begin>
          <end>2014-08-07T09:56:15-04:00</end>
        </TimeSpan>
        <styleUrl>#place_Tech Startup</styleUrl>
        <Point>
          <coordinates>-71.117205,42.378716</coordinates>
        </Point>
      </Placemark>
      <Placemark id="1407420301000">
        <name><![CDATA[Starbucks]]></name>
        <atom:link href="http://foursquare.com/venue/4a467225f964a520dca81fe3"/>
        <description><![CDATA[<p>8/7/14<br/> 10:05 AM to 10:15 AM<br/> 10 min</p> <p>Coffee Shop<br/> <a href="http://foursquare.com/venue/4a467225f964a520dca81fe3">More details (Foursquare)</a> </p>]]></description>
        <TimeSpan>
          <begin>2014-08-07T10:05:02-04:00</begin>
          <end>2014-08-07T10:15:55-04:00</end>
        </TimeSpan>
        <styleUrl>#place_Coffee Shop</styleUrl>
        <Point>
          <coordinates>-71.119934,42.381903</coordinates>
        </Point>
      </Placemark>
      <Placemark id="1407421323000">
        <name><![CDATA[Caspersen Student Center]]></name>
        <atom:link href="http://foursquare.com/venue/4e790134b0fb5d40982b00d0"/>
        <description><![CDATA[<p>8/7/14<br/> 10:22 AM to 12:31 PM<br/> 2:09 hours</p> <p>College Cafeteria<br/> <a href="http://foursquare.com/venue/4e790134b0fb5d40982b00d0">More details (Foursquare)</a> </p>]]></description>
        <TimeSpan>
          <begin>2014-08-07T10:22:04-04:00</begin>
          <end>2014-08-07T12:31:05-04:00</end>
        </TimeSpan>
        <styleUrl>#place_College Cafeteria</styleUrl>
        <Point>
          <coordinates>-71.11866242152347,42.37890166598297</coordinates>
        </Point>
      </Placemark>
      <Placemark id="1407429856000">
        <name><![CDATA[Starbucks]]></name>
        <atom:link href="http://foursquare.com/venue/49cabb79f964a520d8581fe3"/>
        <description><![CDATA[<p>8/7/14<br/> 12:44 PM to 12:47 PM<br/> 3 min</p> <p>Coffee Shop<br/> <a href="http://foursquare.com/venue/49cabb79f964a520d8581fe3">More details (Foursquare)</a> </p>]]></description>
        <TimeSpan>
          <begin>2014-08-07T12:44:17-04:00</begin>
          <end>2014-08-07T12:47:21-04:00</end>
        </TimeSpan>
        <styleUrl>#place_Coffee Shop</styleUrl>
        <Point>
          <coordinates>-71.12017,42.374494</coordinates>
        </Point>
      </Placemark>
      <Placemark id="1407430508000">
        <name><![CDATA[Proximate]]></name>
        <atom:link href="http://foursquare.com/venue/51c8c0d1498e5d4d09a48362"/>
        <description><![CDATA[<p>8/7/14<br/> 12:55 PM to 12:56 PM<br/> 1 min</p> <p>Tech Startup<br/> <a href="http://foursquare.com/venue/51c8c0d1498e5d4d09a48362">More details (Foursquare)</a> </p>]]></description>
        <TimeSpan>
          <begin>2014-08-07T12:55:09-04:00</begin>
          <end>2014-08-07T12:56:10-04:00</end>
        </TimeSpan>
        <styleUrl>#place_Tech Startup</styleUrl>
        <Point>
          <coordinates>-71.117205,42.378716</coordinates>
        </Point>
      </Placemark>
      <Placemark id="1407431334000">
        <name><![CDATA[Border Cafe]]></name>
        <atom:link href="http://foursquare.com/venue/3fd66200f964a520bded1ee3"/>
        <description><![CDATA[<p>8/7/14<br/> 1:08 PM to 1:36 PM<br/> 27 min</p> <p>Mexican Restaurant<br/> <a href="http://foursquare.com/venue/3fd66200f964a520bded1ee3">More details (Foursquare)</a> </p>]]></description>
        <TimeSpan>
          <begin>2014-08-07T13:08:55-04:00</begin>
          <end>2014-08-07T13:36:22-04:00</end>
        </TimeSpan>
        <styleUrl>#place_Mexican Restaurant</styleUrl>
        <Point>
          <coordinates>-71.120141,42.3743468</coordinates>
        </Point>
      </Placemark>
      <Placemark id="1407433592000">
        <name><![CDATA[Proximate]]></name>
        <atom:link href="http://foursquare.com/venue/51c8c0d1498e5d4d09a48362"/>
        <description><![CDATA[<p>8/7/14<br/> 1:46 PM to 5:53 PM<br/> 4:06 hours</p> <p>Tech Startup<br/> <a href="http://foursquare.com/venue/51c8c0d1498e5d4d09a48362">More details (Foursquare)</a> </p>]]></description>
        <TimeSpan>
          <begin>2014-08-07T13:46:33-04:00</begin>
          <end>2014-08-07T17:53:15-04:00</end>
        </TimeSpan>
        <styleUrl>#place_Tech Startup</styleUrl>
        <Point>
          <coordinates>-71.117205,42.378716</coordinates>
        </Point>
      </Placemark>
      <Placemark id="1407449167000">
        <name><![CDATA[Home]]></name>
        <description><![CDATA[<p>8/7/14<br/> 6:06 PM to 6:41 PM<br/> 35 min</p>]]></description>
        <TimeSpan>
          <begin>2014-08-07T18:06:08-04:00</begin>
          <end>2014-08-07T18:41:45-04:00</end>
        </TimeSpan>
        <styleUrl>#place_home</styleUrl>
        <Point>
          <coordinates>-71.1114458017,42.3754311174</coordinates>
        </Point>
      </Placemark>
      <Placemark id="1407452274000">
        <name><![CDATA[Dickson Bros. True Value]]></name>
        <atom:link href="http://foursquare.com/venue/4aad3cf3f964a5202f5f20e3"/>
        <description><![CDATA[<p>8/7/14<br/> 6:57 PM to 8:24 PM<br/> 1:27 hours</p> <p>Hardware Store<br/> <a href="http://foursquare.com/venue/4aad3cf3f964a5202f5f20e3">More details (Foursquare)</a> </p>]]></description>
        <TimeSpan>
          <begin>2014-08-07T18:57:55-04:00</begin>
          <end>2014-08-07T20:24:53-04:00</end>
        </TimeSpan>
        <styleUrl>#place_Hardware Store</styleUrl>
        <Point>
          <coordinates>-71.120418,42.373343</coordinates>
        </Point>
      </Placemark>
      <Placemark id="1407458300000">
        <name><![CDATA[Home]]></name>
        <description><![CDATA[<p>8/7/14<br/> 8:38 PM to 12:00 AM<br/> 3:21 hours</p>]]></description>
        <TimeSpan>
          <begin>2014-08-07T20:38:21-04:00</begin>
          <end>2014-08-07T23:59:59-04:00</end>
        </TimeSpan>
        <styleUrl>#place_home</styleUrl>
        <Point>
          <coordinates>-71.1114458017,42.3754311174</coordinates>
        </Point>
      </Placemark>
    </Folder>
    <Folder>
      <name><![CDATA[8/8/14]]></name>
      <Placemark id="1407470400000">
        <name><![CDATA[Home]]></name>
        <description><![CDATA[<p>8/8/14<br/> 12:00 AM to 8:55 AM<br/> 8:55 hours</p>]]></description>
        <TimeSpan>
          <begin>2014-08-08T00:00:01-04:00</begin>
          <end>2014-08-08T08:55:11-04:00</end>
        </TimeSpan>
        <styleUrl>#place_home</styleUrl>
        <Point>
          <coordinates>-71.1114458017,42.3754311174</coordinates>
        </Point>
      </Placemark>
      <Placemark id="1407503230000">
        <name><![CDATA[Proximate]]></name>
        <atom:link href="http://foursquare.com/venue/51c8c0d1498e5d4d09a48362"/>
        <description><![CDATA[<p>8/8/14<br/> 9:07 AM to 10:52 AM<br/> 1:45 hours</p> <p>Tech Startup<br/> <a href="http://foursquare.com/venue/51c8c0d1498e5d4d09a48362">More details (Foursquare)</a> </p>]]></description>
        <TimeSpan>
          <begin>2014-08-08T09:07:11-04:00</begin>
          <end>2014-08-08T10:52:18-04:00</end>
        </TimeSpan>
        <styleUrl>#place_Tech Startup</styleUrl>
        <Point>
          <coordinates>-71.117205,42.378716</coordinates>
        </Point>
      </Placemark>
      <Placemark id="1407510048000">
        <name><![CDATA[Starbucks]]></name>
        <atom:link href="http://foursquare.com/venue/4a467225f964a520dca81fe3"/>
        <description><![CDATA[<p>8/8/14<br/> 11:00 AM to 11:07 AM<br/> 6 min</p> <p>Coffee Shop<br/> <a href="http://foursquare.com/venue/4a467225f964a520dca81fe3">More details (Foursquare)</a> </p>]]></description>
        <TimeSpan>
          <begin>2014-08-08T11:00:49-04:00</begin>
          <end>2014-08-08T11:07:32-04:00</end>
        </TimeSpan>
        <styleUrl>#place_Coffee Shop</styleUrl>
        <Point>
          <coordinates>-71.119934,42.381903</coordinates>
        </Point>
      </Placemark>
      <Placemark id="1407511431000">
        <name><![CDATA[Proximate]]></name>
        <atom:link href="http://foursquare.com/venue/51c8c0d1498e5d4d09a48362"/>
        <description><![CDATA[<p>8/8/14<br/> 11:23 AM to 1:15 PM<br/> 1:51 hours</p> <p>Tech Startup<br/> <a href="http://foursquare.com/venue/51c8c0d1498e5d4d09a48362">More details (Foursquare)</a> </p>]]></description>
        <TimeSpan>
          <begin>2014-08-08T11:23:52-04:00</begin>
          <end>2014-08-08T13:15:33-04:00</end>
        </TimeSpan>
        <styleUrl>#place_Tech Startup</styleUrl>
        <Point>
          <coordinates>-71.117205,42.378716</coordinates>
        </Point>
      </Placemark>
      <Placemark id="1407518965000">
        <name><![CDATA[Grendel's Den Restaurant & Bar]]></name>
        <atom:link href="http://foursquare.com/venue/3fd66200f964a520bced1ee3"/>
        <description><![CDATA[<p>8/8/14<br/> 1:29 PM to 2:13 PM<br/> 44 min</p> <p>Bar<br/> <a href="http://foursquare.com/venue/3fd66200f964a520bced1ee3">More details (Foursquare)</a> </p>]]></description>
        <TimeSpan>
          <begin>2014-08-08T13:29:26-04:00</begin>
          <end>2014-08-08T14:13:38-04:00</end>
        </TimeSpan>
        <styleUrl>#place_Bar</styleUrl>
        <Point>
          <coordinates>-71.12077832221985,42.37237675230346</coordinates>
        </Point>
      </Placemark>
      <Placemark id="1407522448000">
        <name><![CDATA[Proximate]]></name>
        <atom:link href="http://foursquare.com/venue/51c8c0d1498e5d4d09a48362"/>
        <description><![CDATA[<p>8/8/14<br/> 2:27 PM to 5:21 PM<br/> 2:53 hours</p> <p>Tech Startup<br/> <a href="http://foursquare.com/venue/51c8c0d1498e5d4d09a48362">More details (Foursquare)</a> </p>]]></description>
        <TimeSpan>
          <begin>2014-08-08T14:27:29-04:00</begin>
          <end>2014-08-08T17:20:59-04:00</end>
        </TimeSpan>
        <styleUrl>#place_Tech Startup</styleUrl>
        <Point>
          <coordinates>-71.117205,42.378716</coordinates>
        </Point>
      </Placemark>
      <Placemark id="1407533573000">
        <name><![CDATA[Broadway Marketplace]]></name>
        <atom:link href="http://foursquare.com/venue/4a661612f964a520ffc71fe3"/>
        <description><![CDATA[<p>8/8/14<br/> 5:32 PM to 5:48 PM<br/> 15 min</p> <p>Grocery Store<br/> <a href="http://foursquare.com/venue/4a661612f964a520ffc71fe3">More details (Foursquare)</a> </p>]]></description>
        <TimeSpan>
          <begin>2014-08-08T17:32:54-04:00</begin>
          <end>2014-08-08T17:48:05-04:00</end>
        </TimeSpan>
        <styleUrl>#place_Grocery Store</styleUrl>
        <Point>
          <coordinates>-71.11300484548056,42.37405171427381</coordinates>
        </Point>
      </Placemark>
      <Placemark id="1407534824000">
        <name><![CDATA[Jeff Stanton's Home]]></name>
        <description><![CDATA[<p>8/8/14<br/> 5:53 PM to 10:49 PM<br/> 4:55 hours</p>]]></description>
        <TimeSpan>
          <begin>2014-08-08T17:53:45-04:00</begin>
          <end>2014-08-08T22:49:26-04:00</end>
        </TimeSpan>
        <styleUrl>#place_home</styleUrl>
        <Point>
          <coordinates>-71.096460631,42.3715568972</coordinates>
        </Point>
      </Placemark>
      <Placemark id="1407553477000">
        <name><![CDATA[Harvard Yard]]></name>
        <atom:link href="http://foursquare.com/venue/4abd2012f964a520948820e3"/>
        <description><![CDATA[<p>8/8/14<br/> 11:04 PM to 12:00 AM<br/> 55 min</p> <p>College Quad<br/> <a href="http://foursquare.com/venue/4abd2012f964a520948820e3">More details (Foursquare)</a> </p>]]></description>
        <TimeSpan>
          <begin>2014-08-08T23:04:38-04:00</begin>
          <end>2014-08-08T23:59:59-04:00</end>
        </TimeSpan>
        <styleUrl>#place_College Quad</styleUrl>
        <Point>
          <coordinates>-71.11741499632876,42.37467597125794</coordinates>
        </Point>
      </Placemark>
    </Folder>
    <Folder>
      <name><![CDATA[8/9/14]]></name>
      <Placemark id="1407556800000">
        <name><![CDATA[Harvard Yard]]></name>
        <atom:link href="http://foursquare.com/venue/4abd2012f964a520948820e3"/>
        <description><![CDATA[<p>8/9/14<br/> 12:00 AM to 12:08 AM<br/> 8 min</p> <p>College Quad<br/> <a href="http://foursquare.com/venue/4abd2012f964a520948820e3">More details (Foursquare)</a> </p>]]></description>
        <TimeSpan>
          <begin>2014-08-09T00:00:01-04:00</begin>
          <end>2014-08-09T00:08:55-04:00</end>
        </TimeSpan>
        <styleUrl>#place_College Quad</styleUrl>
        <Point>
          <coordinates>-71.11741499632876,42.37467597125794</coordinates>
        </Point>
      </Placemark>
      <Placemark id="1407557964000">
        <name><![CDATA[Home]]></name>
        <description><![CDATA[<p>8/9/14<br/> 12:19 AM to 9:44 AM<br/> 9:25 hours</p>]]></description>
        <TimeSpan>
          <begin>2014-08-09T00:19:25-04:00</begin>
          <end>2014-08-09T09:44:30-04:00</end>
        </TimeSpan>
        <styleUrl>#place_home</styleUrl>
        <Point>
          <coordinates>-71.1114458017,42.3754311174</coordinates>
        </Point>
      </Placemark>
      <Placemark id="1407592939000">
        <name><![CDATA[Xfund]]></name>
        <atom:link href="http://foursquare.com/venue/525e96dd11d27846ee214ac8"/>
        <description><![CDATA[<p>8/9/14<br/> 10:02 AM to 11:43 AM<br/> 1:41 hours</p> <p>Tech Startup<br/> <a href="http://foursquare.com/venue/525e96dd11d27846ee214ac8">More details (Foursquare)</a> </p>]]></description>
        <TimeSpan>
          <begin>2014-08-09T10:02:20-04:00</begin>
          <end>2014-08-09T11:43:50-04:00</end>
        </TimeSpan>
        <styleUrl>#place_Tech Startup</styleUrl>
        <Point>
          <coordinates>-71.12017109498916,42.37343863629133</coordinates>
        </Point>
      </Placemark>
      <Placemark id="1407599918000">
        <name><![CDATA[Home]]></name>
        <description><![CDATA[<p>8/9/14<br/> 11:58 AM to 12:25 PM<br/> 27 min</p>]]></description>
        <TimeSpan>
          <begin>2014-08-09T11:58:39-04:00</begin>
          <end>2014-08-09T12:25:49-04:00</end>
        </TimeSpan>
        <styleUrl>#place_home</styleUrl>
        <Point>
          <coordinates>-71.1114458017,42.3754311174</coordinates>
        </Point>
      </Placemark>
      <Placemark id="1407602200000">
        <name><![CDATA[Xfund]]></name>
        <atom:link href="http://foursquare.com/venue/525e96dd11d27846ee214ac8"/>
        <description><![CDATA[<p>8/9/14<br/> 12:36 PM to 1:26 PM<br/> 50 min</p> <p>Tech Startup<br/> <a href="http://foursquare.com/venue/525e96dd11d27846ee214ac8">More details (Foursquare)</a> </p>]]></description>
        <TimeSpan>
          <begin>2014-08-09T12:36:41-04:00</begin>
          <end>2014-08-09T13:26:49-04:00</end>
        </TimeSpan>
        <styleUrl>#place_Tech Startup</styleUrl>
        <Point>
          <coordinates>-71.12017109498916,42.37343863629133</coordinates>
        </Point>
      </Placemark>
      <Placemark id="1407605356000">
        <name><![CDATA[The Red House Restaurant]]></name>
        <atom:link href="http://foursquare.com/venue/4409e8acf964a52068301fe3"/>
        <description><![CDATA[<p>8/9/14<br/> 1:29 PM to 2:39 PM<br/> 1:10 hours</p> <p>New American Restaurant<br/> <a href="http://foursquare.com/venue/4409e8acf964a52068301fe3">More details (Foursquare)</a> </p>]]></description>
        <TimeSpan>
          <begin>2014-08-09T13:29:17-04:00</begin>
          <end>2014-08-09T14:39:24-04:00</end>
        </TimeSpan>
        <styleUrl>#place_New American Restaurant</styleUrl>
        <Point>
          <coordinates>-71.121291,42.37249515</coordinates>
        </Point>
      </Placemark>
      <Placemark id="1407609835000">
        <name><![CDATA[Xfund]]></name>
        <atom:link href="http://foursquare.com/venue/525e96dd11d27846ee214ac8"/>
        <description><![CDATA[<p>8/9/14<br/> 2:43 PM to 2:57 PM<br/> 13 min</p> <p>Tech Startup<br/> <a href="http://foursquare.com/venue/525e96dd11d27846ee214ac8">More details (Foursquare)</a> </p>]]></description>
        <TimeSpan>
          <begin>2014-08-09T14:43:56-04:00</begin>
          <end>2014-08-09T14:57:16-04:00</end>
        </TimeSpan>
        <styleUrl>#place_Tech Startup</styleUrl>
        <Point>
          <coordinates>-71.12017109498916,42.37343863629133</coordinates>
        </Point>
      </Placemark>
      <Placemark id="1407611374000">
        <name><![CDATA[Home]]></name>
        <description><![CDATA[<p>8/9/14<br/> 3:09 PM to 5:07 PM<br/> 1:57 hours</p>]]></description>
        <TimeSpan>
          <begin>2014-08-09T15:09:35-04:00</begin>
          <end>2014-08-09T17:07:09-04:00</end>
        </TimeSpan>
        <styleUrl>#place_home</styleUrl>
        <Point>
          <coordinates>-71.1114458017,42.3754311174</coordinates>
        </Point>
      </Placemark>
      <Placemark id="1407619350000">
        <name><![CDATA[Xfund]]></name>
        <atom:link href="http://foursquare.com/venue/525e96dd11d27846ee214ac8"/>
        <description><![CDATA[<p>8/9/14<br/> 5:22 PM to 6:21 PM<br/> 59 min</p> <p>Tech Startup<br/> <a href="http://foursquare.com/venue/525e96dd11d27846ee214ac8">More details (Foursquare)</a> </p>]]></description>
        <TimeSpan>
          <begin>2014-08-09T17:22:31-04:00</begin>
          <end>2014-08-09T18:21:53-04:00</end>
        </TimeSpan>
        <styleUrl>#place_Tech Startup</styleUrl>
        <Point>
          <coordinates>-71.12017109498916,42.37343863629133</coordinates>
        </Point>
      </Placemark>
      <Placemark id="1407637490000">
        <name><![CDATA[Home]]></name>
        <description><![CDATA[<p>8/9/14<br/> 10:24 PM to 12:00 AM<br/> 1:35 hours</p>]]></description>
        <TimeSpan>
          <begin>2014-08-09T22:24:51-04:00</begin>
          <end>2014-08-09T23:59:59-04:00</end>
        </TimeSpan>
        <styleUrl>#place_home</styleUrl>
        <Point>
          <coordinates>-71.1114458017,42.3754311174</coordinates>
        </Point>
      </Placemark>
    </Folder>
    <Folder>
      <name><![CDATA[8/10/14]]></name>
      <Placemark id="1407643200000">
        <name><![CDATA[Home]]></name>
        <description><![CDATA[<p>8/10/14<br/> 12:00 AM to 8:55 AM<br/> 8:55 hours</p>]]></description>
        <TimeSpan>
          <begin>2014-08-10T00:00:01-04:00</begin>
          <end>2014-08-10T08:55:24-04:00</end>
        </TimeSpan>
        <styleUrl>#place_home</styleUrl>
        <Point>
          <coordinates>-71.1114458017,42.3754311174</coordinates>
        </Point>
      </Placemark>
      <Placemark id="1407675560000">
        <name><![CDATA[Broadway Marketplace]]></name>
        <atom:link href="http://foursquare.com/venue/4a661612f964a520ffc71fe3"/>
        <description><![CDATA[<p>8/10/14<br/> 8:59 AM to 9:02 AM<br/> 3 min</p> <p>Grocery Store<br/> <a href="http://foursquare.com/venue/4a661612f964a520ffc71fe3">More details (Foursquare)</a> </p>]]></description>
        <TimeSpan>
          <begin>2014-08-10T08:59:21-04:00</begin>
          <end>2014-08-10T09:02:36-04:00</end>
        </TimeSpan>
        <styleUrl>#place_Grocery Store</styleUrl>
        <Point>
          <coordinates>-71.11300484548056,42.37405171427381</coordinates>
        </Point>
      </Placemark>
      <Placemark id="1407675952000">
        <name><![CDATA[Home]]></name>
        <description><![CDATA[<p>8/10/14<br/> 9:05 AM to 10:35 AM<br/> 1:29 hours</p>]]></description>
        <TimeSpan>
          <begin>2014-08-10T09:05:53-04:00</begin>
          <end>2014-08-10T10:35:34-04:00</end>
        </TimeSpan>
        <styleUrl>#place_home</styleUrl>
        <Point>
          <coordinates>-71.1114458017,42.3754311174</coordinates>
        </Point>
      </Placemark>
      <Placemark id="1407682144000">
        <name><![CDATA[Xfund]]></name>
        <atom:link href="http://foursquare.com/venue/525e96dd11d27846ee214ac8"/>
        <description><![CDATA[<p>8/10/14<br/> 10:49 AM to 11:21 AM<br/> 32 min</p> <p>Tech Startup<br/> <a href="http://foursquare.com/venue/525e96dd11d27846ee214ac8">More details (Foursquare)</a> </p>]]></description>
        <TimeSpan>
          <begin>2014-08-10T10:49:05-04:00</begin>
          <end>2014-08-10T11:21:10-04:00</end>
        </TimeSpan>
        <styleUrl>#place_Tech Startup</styleUrl>
        <Point>
          <coordinates>-71.12017109498916,42.37343863629133</coordinates>
        </Point>
      </Placemark>
      <Placemark id="1407684487000">
        <name><![CDATA[Harvard Yard]]></name>
        <atom:link href="http://foursquare.com/venue/4abd2012f964a520948820e3"/>
        <description><![CDATA[<p>8/10/14<br/> 11:28 AM to 12:28 PM<br/> 1:00 hours</p> <p>College Quad<br/> <a href="http://foursquare.com/venue/4abd2012f964a520948820e3">More details (Foursquare)</a> </p>]]></description>
        <TimeSpan>
          <begin>2014-08-10T11:28:08-04:00</begin>
          <end>2014-08-10T12:28:36-04:00</end>
        </TimeSpan>
        <styleUrl>#place_College Quad</styleUrl>
        <Point>
          <coordinates>-71.11741499632876,42.37467597125794</coordinates>
        </Point>
      </Placemark>
      <Placemark id="1407688651000">
        <name><![CDATA[Broadway Marketplace]]></name>
        <atom:link href="http://foursquare.com/venue/4a661612f964a520ffc71fe3"/>
        <description><![CDATA[<p>8/10/14<br/> 12:37 PM to 12:48 PM<br/> 11 min</p> <p>Grocery Store<br/> <a href="http://foursquare.com/venue/4a661612f964a520ffc71fe3">More details (Foursquare)</a> </p>]]></description>
        <TimeSpan>
          <begin>2014-08-10T12:37:32-04:00</begin>
          <end>2014-08-10T12:48:31-04:00</end>
        </TimeSpan>
        <styleUrl>#place_Grocery Store</styleUrl>
        <Point>
          <coordinates>-71.11300484548056,42.37405171427381</coordinates>
        </Point>
      </Placemark>
      <Placemark id="1407689512000">
        <name><![CDATA[Home]]></name>
        <description><![CDATA[<p>8/10/14<br/> 12:51 PM to 1:15 PM<br/> 23 min</p>]]></description>
        <TimeSpan>
          <begin>2014-08-10T12:51:53-04:00</begin>
          <end>2014-08-10T13:15:37-04:00</end>
        </TimeSpan>
        <styleUrl>#place_home</styleUrl>
        <Point>
          <coordinates>-71.1114458017,42.3754311174</coordinates>
        </Point>
      </Placemark>
      <Placemark id="1407691555000">
        <name><![CDATA[Proximate]]></name>
        <atom:link href="http://foursquare.com/venue/51c8c0d1498e5d4d09a48362"/>
        <description><![CDATA[<p>8/10/14<br/> 1:25 PM to 4:30 PM<br/> 3:04 hours</p> <p>Tech Startup<br/> <a href="http://foursquare.com/venue/51c8c0d1498e5d4d09a48362">More details (Foursquare)</a> </p>]]></description>
        <TimeSpan>
          <begin>2014-08-10T13:25:56-04:00</begin>
          <end>2014-08-10T16:30:17-04:00</end>
        </TimeSpan>
        <styleUrl>#place_Tech Startup</styleUrl>
        <Point>
          <coordinates>-71.117205,42.378716</coordinates>
        </Point>
      </Placemark>
      <Placemark id="1407703301000">
        <name><![CDATA[Broadway Marketplace]]></name>
        <atom:link href="http://foursquare.com/venue/4a661612f964a520ffc71fe3"/>
        <description><![CDATA[<p>8/10/14<br/> 4:41 PM to 4:46 PM<br/> 4 min</p> <p>Grocery Store<br/> <a href="http://foursquare.com/venue/4a661612f964a520ffc71fe3">More details (Foursquare)</a> </p>]]></description>
        <TimeSpan>
          <begin>2014-08-10T16:41:42-04:00</begin>
          <end>2014-08-10T16:46:28-04:00</end>
        </TimeSpan>
        <styleUrl>#place_Grocery Store</styleUrl>
        <Point>
          <coordinates>-71.11300484548056,42.37405171427381</coordinates>
        </Point>
      </Placemark>
      <Placemark id="1407703884000">
        <name><![CDATA[Home]]></name>
        <description><![CDATA[<p>8/10/14<br/> 4:51 PM to 12:00 AM<br/> 7:08 hours</p>]]></description>
        <TimeSpan>
          <begin>2014-08-10T16:51:25-04:00</begin>
          <end>2014-08-10T23:59:59-04:00</end>
        </TimeSpan>
        <styleUrl>#place_home</styleUrl>
        <Point>
          <coordinates>-71.1114458017,42.3754311174</coordinates>
        </Point>
      </Placemark>
    </Folder>
    <Folder>
      <name><![CDATA[8/11/14]]></name>
      <Placemark id="1407729600000">
        <name><![CDATA[Home]]></name>
        <description><![CDATA[<p>8/11/14<br/> 12:00 AM to 8:33 AM<br/> 8:33 hours</p>]]></description>
        <TimeSpan>
          <begin>2014-08-11T00:00:01-04:00</begin>
          <end>2014-08-11T08:33:56-04:00</end>
        </TimeSpan>
        <styleUrl>#place_home</styleUrl>
        <Point>
          <coordinates>-71.1114458017,42.3754311174</coordinates>
        </Point>
      </Placemark>
      <Placemark id="1407761777000">
        <name><![CDATA[Starbucks]]></name>
        <atom:link href="http://foursquare.com/venue/4a467225f964a520dca81fe3"/>
        <description><![CDATA[<p>8/11/14<br/> 8:56 AM to 9:06 AM<br/> 10 min</p> <p>Coffee Shop<br/> <a href="http://foursquare.com/venue/4a467225f964a520dca81fe3">More details (Foursquare)</a> </p>]]></description>
        <TimeSpan>
          <begin>2014-08-11T08:56:18-04:00</begin>
          <end>2014-08-11T09:06:35-04:00</end>
        </TimeSpan>
        <styleUrl>#place_Coffee Shop</styleUrl>
        <Point>
          <coordinates>-71.119934,42.381903</coordinates>
        </Point>
      </Placemark>
      <Placemark id="1407762897000">
        <name><![CDATA[Proximate]]></name>
        <atom:link href="http://foursquare.com/venue/51c8c0d1498e5d4d09a48362"/>
        <description><![CDATA[<p>8/11/14<br/> 9:14 AM to 12:21 PM<br/> 3:06 hours</p> <p>Tech Startup<br/> <a href="http://foursquare.com/venue/51c8c0d1498e5d4d09a48362">More details (Foursquare)</a> </p>]]></description>
        <TimeSpan>
          <begin>2014-08-11T09:14:58-04:00</begin>
          <end>2014-08-11T12:21:09-04:00</end>
        </TimeSpan>
        <styleUrl>#place_Tech Startup</styleUrl>
        <Point>
          <coordinates>-71.117205,42.378716</coordinates>
        </Point>
      </Placemark>
      <Placemark id="1407774811000">
        <name><![CDATA[Home]]></name>
        <description><![CDATA[<p>8/11/14<br/> 12:33 PM to 2:21 PM<br/> 1:47 hours</p>]]></description>
        <TimeSpan>
          <begin>2014-08-11T12:33:32-04:00</begin>
          <end>2014-08-11T14:21:22-04:00</end>
        </TimeSpan>
        <styleUrl>#place_home</styleUrl>
        <Point>
          <coordinates>-71.1114458017,42.3754311174</coordinates>
        </Point>
      </Placemark>
      <Placemark id="1407782304000">
        <name><![CDATA[Proximate]]></name>
        <atom:link href="http://foursquare.com/venue/51c8c0d1498e5d4d09a48362"/>
        <description><![CDATA[<p>8/11/14<br/> 2:38 PM to 4:39 PM<br/> 2:01 hours</p> <p>Tech Startup<br/> <a href="http://foursquare.com/venue/51c8c0d1498e5d4d09a48362">More details (Foursquare)</a> </p>]]></description>
        <TimeSpan>
          <begin>2014-08-11T14:38:25-04:00</begin>
          <end>2014-08-11T16:39:52-04:00</end>
        </TimeSpan>
        <styleUrl>#place_Tech Startup</styleUrl>
        <Point>
          <coordinates>-71.117205,42.378716</coordinates>
        </Point>
      </Placemark>
      <Placemark id="1407791621000">
        <name><![CDATA[Proximate]]></name>
        <atom:link href="http://foursquare.com/venue/51c8c0d1498e5d4d09a48362"/>
        <description><![CDATA[<p>8/11/14<br/> 5:13 PM to 7:35 PM<br/> 2:22 hours</p> <p>Tech Startup<br/> <a href="http://foursquare.com/venue/51c8c0d1498e5d4d09a48362">More details (Foursquare)</a> </p>]]></description>
        <TimeSpan>
          <begin>2014-08-11T17:13:42-04:00</begin>
          <end>2014-08-11T19:35:44-04:00</end>
        </TimeSpan>
        <styleUrl>#place_Tech Startup</styleUrl>
        <Point>
          <coordinates>-71.117205,42.378716</coordinates>
        </Point>
      </Placemark>
      <Placemark id="1407801157000">
        <name><![CDATA[Home]]></name>
        <description><![CDATA[<p>8/11/14<br/> 7:52 PM to 12:00 AM<br/> 4:07 hours</p>]]></description>
        <TimeSpan>
          <begin>2014-08-11T19:52:38-04:00</begin>
          <end>2014-08-11T23:59:59-04:00</end>
        </TimeSpan>
        <styleUrl>#place_home</styleUrl>
        <Point>
          <coordinates>-71.1114458017,42.3754311174</coordinates>
        </Point>
      </Placemark>
    </Folder>
    <Folder>
      <name><![CDATA[8/12/14]]></name>
      <Placemark id="1407816000000">
        <name><![CDATA[Home]]></name>
        <description><![CDATA[<p>8/12/14<br/> 12:00 AM to 7:57 AM<br/> 7:57 hours</p>]]></description>
        <TimeSpan>
          <begin>2014-08-12T00:00:01-04:00</begin>
          <end>2014-08-12T07:57:52-04:00</end>
        </TimeSpan>
        <styleUrl>#place_home</styleUrl>
        <Point>
          <coordinates>-71.1114458017,42.3754311174</coordinates>
        </Point>
      </Placemark>
      <Placemark id="1407845342000">
        <name><![CDATA[CVS/pharmacy]]></name>
        <atom:link href="http://foursquare.com/venue/49df6a3ff964a520c6601fe3"/>
        <description><![CDATA[<p>8/12/14<br/> 8:09 AM to 8:27 AM<br/> 18 min</p> <p>Drugstore / Pharmacy<br/> <a href="http://foursquare.com/venue/49df6a3ff964a520c6601fe3">More details (Foursquare)</a> </p>]]></description>
        <TimeSpan>
          <begin>2014-08-12T08:09:03-04:00</begin>
          <end>2014-08-12T08:27:54-04:00</end>
        </TimeSpan>
        <styleUrl>#place_Drugstore / Pharmacy</styleUrl>
        <Point>
          <coordinates>-71.11899197101593,42.37402935435937</coordinates>
        </Point>
      </Placemark>
      <Placemark id="1407846959000">
        <name><![CDATA[Proximate]]></name>
        <atom:link href="http://foursquare.com/venue/51c8c0d1498e5d4d09a48362"/>
        <description><![CDATA[<p>8/12/14<br/> 8:35 AM to 10:09 AM<br/> 1:33 hours</p> <p>Tech Startup<br/> <a href="http://foursquare.com/venue/51c8c0d1498e5d4d09a48362">More details (Foursquare)</a> </p>]]></description>
        <TimeSpan>
          <begin>2014-08-12T08:36:00-04:00</begin>
          <end>2014-08-12T10:09:12-04:00</end>
        </TimeSpan>
        <styleUrl>#place_Tech Startup</styleUrl>
        <Point>
          <coordinates>-71.117205,42.378716</coordinates>
        </Point>
      </Placemark>
      <Placemark id="1407853018000">
        <name><![CDATA[Starbucks]]></name>
        <atom:link href="http://foursquare.com/venue/4a467225f964a520dca81fe3"/>
        <description><![CDATA[<p>8/12/14<br/> 10:16 AM to 10:22 AM<br/> 5 min</p> <p>Coffee Shop<br/> <a href="http://foursquare.com/venue/4a467225f964a520dca81fe3">More details (Foursquare)</a> </p>]]></description>
        <TimeSpan>
          <begin>2014-08-12T10:16:59-04:00</begin>
          <end>2014-08-12T10:22:48-04:00</end>
        </TimeSpan>
        <styleUrl>#place_Coffee Shop</styleUrl>
        <Point>
          <coordinates>-71.119934,42.381903</coordinates>
        </Point>
      </Placemark>
      <Placemark id="1407853836000">
        <name><![CDATA[Proximate]]></name>
        <atom:link href="http://foursquare.com/venue/51c8c0d1498e5d4d09a48362"/>
        <description><![CDATA[<p>8/12/14<br/> 10:30 AM to 12:57 PM<br/> 2:26 hours</p> <p>Tech Startup<br/> <a href="http://foursquare.com/venue/51c8c0d1498e5d4d09a48362">More details (Foursquare)</a> </p>]]></description>
        <TimeSpan>
          <begin>2014-08-12T10:30:37-04:00</begin>
          <end>2014-08-12T12:57:08-04:00</end>
        </TimeSpan>
        <styleUrl>#place_Tech Startup</styleUrl>
        <Point>
          <coordinates>-71.117205,42.378716</coordinates>
        </Point>
      </Placemark>
      <Placemark id="1407863181000">
        <name><![CDATA[Border Cafe]]></name>
        <atom:link href="http://foursquare.com/venue/3fd66200f964a520bded1ee3"/>
        <description><![CDATA[<p>8/12/14<br/> 1:06 PM to 1:50 PM<br/> 43 min</p> <p>Mexican Restaurant<br/> <a href="http://foursquare.com/venue/3fd66200f964a520bded1ee3">More details (Foursquare)</a> </p>]]></description>
        <TimeSpan>
          <begin>2014-08-12T13:06:22-04:00</begin>
          <end>2014-08-12T13:50:07-04:00</end>
        </TimeSpan>
        <styleUrl>#place_Mexican Restaurant</styleUrl>
        <Point>
          <coordinates>-71.120141,42.3743468</coordinates>
        </Point>
      </Placemark>
      <Placemark id="1407866465000">
        <name><![CDATA[Proximate]]></name>
        <atom:link href="http://foursquare.com/venue/51c8c0d1498e5d4d09a48362"/>
        <description><![CDATA[<p>8/12/14<br/> 2:01 PM to 6:38 PM<br/> 4:37 hours</p> <p>Tech Startup<br/> <a href="http://foursquare.com/venue/51c8c0d1498e5d4d09a48362">More details (Foursquare)</a> </p>]]></description>
        <TimeSpan>
          <begin>2014-08-12T14:01:06-04:00</begin>
          <end>2014-08-12T18:38:54-04:00</end>
        </TimeSpan>
        <styleUrl>#place_Tech Startup</styleUrl>
        <Point>
          <coordinates>-71.117205,42.378716</coordinates>
        </Point>
      </Placemark>
      <Placemark id="1407883808000">
        <name><![CDATA[Broadway Marketplace]]></name>
        <atom:link href="http://foursquare.com/venue/4a661612f964a520ffc71fe3"/>
        <description><![CDATA[<p>8/12/14<br/> 6:50 PM to 6:54 PM<br/> 3 min</p> <p>Grocery Store<br/> <a href="http://foursquare.com/venue/4a661612f964a520ffc71fe3">More details (Foursquare)</a> </p>]]></description>
        <TimeSpan>
          <begin>2014-08-12T18:50:09-04:00</begin>
          <end>2014-08-12T18:54:00-04:00</end>
        </TimeSpan>
        <styleUrl>#place_Grocery Store</styleUrl>
        <Point>
          <coordinates>-71.11300484548056,42.37405171427381</coordinates>
        </Point>
      </Placemark>
      <Placemark id="1407884484000">
        <name><![CDATA[Home]]></name>
        <description><![CDATA[<p>8/12/14<br/> 7:01 PM to 12:00 AM<br/> 4:58 hours</p>]]></description>
        <TimeSpan>
          <begin>2014-08-12T19:01:25-04:00</begin>
          <end>2014-08-12T23:59:59-04:00</end>
        </TimeSpan>
        <styleUrl>#place_home</styleUrl>
        <Point>
          <coordinates>-71.1114458017,42.3754311174</coordinates>
        </Point>
      </Placemark>
    </Folder>
    <Folder>
      <name><![CDATA[8/13/14]]></name>
      <Placemark id="1407902400000">
        <name><![CDATA[Home]]></name>
        <description><![CDATA[<p>8/13/14<br/> 12:00 AM to 10:16 AM<br/> 10:16 hours</p>]]></description>
        <TimeSpan>
          <begin>2014-08-13T00:00:01-04:00</begin>
          <end>2014-08-13T10:15:59-04:00</end>
        </TimeSpan>
        <styleUrl>#place_home</styleUrl>
        <Point>
          <coordinates>-71.1114458017,42.3754311174</coordinates>
        </Point>
      </Placemark>
      <Placemark id="1407940009000">
        <name><![CDATA[Proximate]]></name>
        <atom:link href="http://foursquare.com/venue/51c8c0d1498e5d4d09a48362"/>
        <description><![CDATA[<p>8/13/14<br/> 10:26 AM to 12:25 PM<br/> 1:58 hours</p> <p>Tech Startup<br/> <a href="http://foursquare.com/venue/51c8c0d1498e5d4d09a48362">More details (Foursquare)</a> </p>]]></description>
        <TimeSpan>
          <begin>2014-08-13T10:26:50-04:00</begin>
          <end>2014-08-13T12:25:07-04:00</end>
        </TimeSpan>
        <styleUrl>#place_Tech Startup</styleUrl>
        <Point>
          <coordinates>-71.117205,42.378716</coordinates>
        </Point>
      </Placemark>
      <Placemark id="1407947787000">
        <name><![CDATA[Boston Marriott Cambridge]]></name>
        <atom:link href="http://foursquare.com/venue/4a66a899f964a520cbc81fe3"/>
        <description><![CDATA[<p>8/13/14<br/> 12:36 PM to 1:40 PM<br/> 1:04 hours</p> <p>Hotel<br/> <a href="http://foursquare.com/venue/4a66a899f964a520cbc81fe3">More details (Foursquare)</a> </p>]]></description>
        <TimeSpan>
          <begin>2014-08-13T12:36:28-04:00</begin>
          <end>2014-08-13T13:40:38-04:00</end>
        </TimeSpan>
        <styleUrl>#place_Hotel</styleUrl>
        <Point>
          <coordinates>-71.08609199523926,42.36253950179547</coordinates>
        </Point>
      </Placemark>
      <Placemark id="1407952135000">
        <name><![CDATA[101 Main St (CIC)]]></name>
        <atom:link href="http://foursquare.com/venue/51311256e4b0a7dd5b86d01b"/>
        <description><![CDATA[<p>8/13/14<br/> 1:48 PM to 2:29 PM<br/> 40 min</p> <p>Coworking Space<br/> <a href="http://foursquare.com/venue/51311256e4b0a7dd5b86d01b">More details (Foursquare)</a> </p>]]></description>
        <TimeSpan>
          <begin>2014-08-13T13:48:56-04:00</begin>
          <end>2014-08-13T14:29:51-04:00</end>
        </TimeSpan>
        <styleUrl>#place_Coworking Space</styleUrl>
        <Point>
          <coordinates>-71.08162851792984,42.36239871356099</coordinates>
        </Point>
      </Placemark>
      <Placemark id="1407956487000">
        <name><![CDATA[Harvard Alumni Association]]></name>
        <atom:link href="http://foursquare.com/venue/4b5dc68df964a520026b29e3"/>
        <description><![CDATA[<p>8/13/14<br/> 3:01 PM to 4:15 PM<br/> 1:13 hours</p> <p>University<br/> <a href="http://foursquare.com/venue/4b5dc68df964a520026b29e3">More details (Foursquare)</a> </p>]]></description>
        <TimeSpan>
          <begin>2014-08-13T15:01:28-04:00</begin>
          <end>2014-08-13T16:15:09-04:00</end>
        </TimeSpan>
        <styleUrl>#place_University</styleUrl>
        <Point>
          <coordinates>-71.12325225275964,42.37317592010315</coordinates>
        </Point>
      </Placemark>
      <Placemark id="1407961199000">
        <name><![CDATA[Starbucks]]></name>
        <atom:link href="http://foursquare.com/venue/49cabb79f964a520d8581fe3"/>
        <description><![CDATA[<p>8/13/14<br/> 4:19 PM to 4:24 PM<br/> 4 min</p> <p>Coffee Shop<br/> <a href="http://foursquare.com/venue/49cabb79f964a520d8581fe3">More details (Foursquare)</a> </p>]]></description>
        <TimeSpan>
          <begin>2014-08-13T16:20:00-04:00</begin>
          <end>2014-08-13T16:24:20-04:00</end>
        </TimeSpan>
        <styleUrl>#place_Coffee Shop</styleUrl>
        <Point>
          <coordinates>-71.12017,42.374494</coordinates>
        </Point>
      </Placemark>
      <Placemark id="1407962013000">
        <name><![CDATA[Proximate]]></name>
        <atom:link href="http://foursquare.com/venue/51c8c0d1498e5d4d09a48362"/>
        <description><![CDATA[<p>8/13/14<br/> 4:33 PM to 4:42 PM<br/> 8 min</p> <p>Tech Startup<br/> <a href="http://foursquare.com/venue/51c8c0d1498e5d4d09a48362">More details (Foursquare)</a> </p>]]></description>
        <TimeSpan>
          <begin>2014-08-13T16:33:34-04:00</begin>
          <end>2014-08-13T16:42:22-04:00</end>
        </TimeSpan>
        <styleUrl>#place_Tech Startup</styleUrl>
        <Point>
          <coordinates>-71.117205,42.378716</coordinates>
        </Point>
      </Placemark>
      <Placemark id="1407963120000">
        <name><![CDATA[Home]]></name>
        <description><![CDATA[<p>8/13/14<br/> 4:52 PM to 12:00 AM<br/> 7:08 hours</p>]]></description>
        <TimeSpan>
          <begin>2014-08-13T16:52:01-04:00</begin>
          <end>2014-08-13T23:59:59-04:00</end>
        </TimeSpan>
        <styleUrl>#place_home</styleUrl>
        <Point>
          <coordinates>-71.1114458017,42.3754311174</coordinates>
        </Point>
      </Placemark>
    </Folder>
    <Folder>
      <name><![CDATA[8/14/14]]></name>
      <Placemark id="1407988800000">
        <name><![CDATA[Home]]></name>
        <description><![CDATA[<p>8/14/14<br/> 12:00 AM to 9:11 AM<br/> 9:11 hours</p>]]></description>
        <TimeSpan>
          <begin>2014-08-14T00:00:01-04:00</begin>
          <end>2014-08-14T09:11:03-04:00</end>
        </TimeSpan>
        <styleUrl>#place_home</styleUrl>
        <Point>
          <coordinates>-71.1114458017,42.3754311174</coordinates>
        </Point>
      </Placemark>
      <Placemark id="1408022516000">
        <name><![CDATA[Proximate]]></name>
        <atom:link href="http://foursquare.com/venue/51c8c0d1498e5d4d09a48362"/>
        <description><![CDATA[<p>8/14/14<br/> 9:21 AM to 9:43 AM<br/> 21 min</p> <p>Tech Startup<br/> <a href="http://foursquare.com/venue/51c8c0d1498e5d4d09a48362">More details (Foursquare)</a> </p>]]></description>
        <TimeSpan>
          <begin>2014-08-14T09:21:57-04:00</begin>
          <end>2014-08-14T09:43:30-04:00</end>
        </TimeSpan>
        <styleUrl>#place_Tech Startup</styleUrl>
        <Point>
          <coordinates>-71.117205,42.378716</coordinates>
        </Point>
      </Placemark>
      <Placemark id="1408024589000">
        <name><![CDATA[Harvard Alumni Association]]></name>
        <atom:link href="http://foursquare.com/venue/4b5dc68df964a520026b29e3"/>
        <description><![CDATA[<p>8/14/14<br/> 9:56 AM to 11:04 AM<br/> 1:07 hours</p> <p>University<br/> <a href="http://foursquare.com/venue/4b5dc68df964a520026b29e3">More details (Foursquare)</a> </p>]]></description>
        <TimeSpan>
          <begin>2014-08-14T09:56:30-04:00</begin>
          <end>2014-08-14T11:04:08-04:00</end>
        </TimeSpan>
        <styleUrl>#place_University</styleUrl>
        <Point>
          <coordinates>-71.12325225275964,42.37317592010315</coordinates>
        </Point>
      </Placemark>
      <Placemark id="1408028810000">
        <name><![CDATA[MBTA Harvard Station]]></name>
        <atom:link href="http://foursquare.com/venue/4a2715d0f964a52057911fe3"/>
        <description><![CDATA[<p>8/14/14<br/> 11:06 AM to 12:28 PM<br/> 1:21 hours</p> <p>Subway<br/> <a href="http://foursquare.com/venue/4a2715d0f964a52057911fe3">More details (Foursquare)</a> </p>]]></description>
        <TimeSpan>
          <begin>2014-08-14T11:06:51-04:00</begin>
          <end>2014-08-14T12:28:18-04:00</end>
        </TimeSpan>
        <styleUrl>#place_Subway</styleUrl>
        <Point>
          <coordinates>-71.11896514892578,42.37331996935519</coordinates>
        </Point>
      </Placemark>
      <Placemark id="1408034016000">
        <name><![CDATA[Grendel's Den Restaurant & Bar]]></name>
        <atom:link href="http://foursquare.com/venue/3fd66200f964a520bced1ee3"/>
        <description><![CDATA[<p>8/14/14<br/> 12:33 PM to 1:41 PM<br/> 1:08 hours</p> <p>Bar<br/> <a href="http://foursquare.com/venue/3fd66200f964a520bced1ee3">More details (Foursquare)</a> </p>]]></description>
        <TimeSpan>
          <begin>2014-08-14T12:33:37-04:00</begin>
          <end>2014-08-14T13:41:54-04:00</end>
        </TimeSpan>
        <styleUrl>#place_Bar</styleUrl>
        <Point>
          <coordinates>-71.12077832221985,42.37237675230346</coordinates>
        </Point>
      </Placemark>
      <Placemark id="1408039677000">
        <name><![CDATA[Home]]></name>
        <description><![CDATA[<p>8/14/14<br/> 2:07 PM to 7:23 PM<br/> 5:15 hours</p>]]></description>
        <TimeSpan>
          <begin>2014-08-14T14:07:58-04:00</begin>
          <end>2014-08-14T19:23:14-04:00</end>
        </TimeSpan>
        <styleUrl>#place_home</styleUrl>
        <Point>
          <coordinates>-71.1114458017,42.3754311174</coordinates>
        </Point>
      </Placemark>
      <Placemark id="1408059564000">
        <name><![CDATA[Proximate]]></name>
        <atom:link href="http://foursquare.com/venue/51c8c0d1498e5d4d09a48362"/>
        <description><![CDATA[<p>8/14/14<br/> 7:39 PM to 7:42 PM<br/> 3 min</p> <p>Tech Startup<br/> <a href="http://foursquare.com/venue/51c8c0d1498e5d4d09a48362">More details (Foursquare)</a> </p>]]></description>
        <TimeSpan>
          <begin>2014-08-14T19:39:25-04:00</begin>
          <end>2014-08-14T19:42:53-04:00</end>
        </TimeSpan>
        <styleUrl>#place_Tech Startup</styleUrl>
        <Point>
          <coordinates>-71.117205,42.378716</coordinates>
        </Point>
      </Placemark>
      <Placemark id="1408060589000">
        <name><![CDATA[Park]]></name>
        <atom:link href="http://foursquare.com/venue/4f7c8902e4b032c26c6798db"/>
        <description><![CDATA[<p>8/14/14<br/> 7:56 PM to 9:36 PM<br/> 1:40 hours</p> <p>Gastropub<br/> <a href="http://foursquare.com/venue/4f7c8902e4b032c26c6798db">More details (Foursquare)</a> </p>]]></description>
        <TimeSpan>
          <begin>2014-08-14T19:56:30-04:00</begin>
          <end>2014-08-14T21:36:29-04:00</end>
        </TimeSpan>
        <styleUrl>#place_Gastropub</styleUrl>
        <Point>
          <coordinates>-71.12097185013617,42.37169409933257</coordinates>
        </Point>
      </Placemark>
      <Placemark id="1408067554000">
        <name><![CDATA[Home]]></name>
        <description><![CDATA[<p>8/14/14<br/> 9:52 PM to 12:00 AM<br/> 2:07 hours</p>]]></description>
        <TimeSpan>
          <begin>2014-08-14T21:52:35-04:00</begin>
          <end>2014-08-14T23:59:59-04:00</end>
        </TimeSpan>
        <styleUrl>#place_home</styleUrl>
        <Point>
          <coordinates>-71.1114458017,42.3754311174</coordinates>
        </Point>
      </Placemark>
    </Folder>
    <Folder>
      <name><![CDATA[8/15/14]]></name>
      <Placemark id="1408075200000">
        <name><![CDATA[Home]]></name>
        <description><![CDATA[<p>8/15/14<br/> 12:00 AM to 10:05 AM<br/> 10:05 hours</p>]]></description>
        <TimeSpan>
          <begin>2014-08-15T00:00:01-04:00</begin>
          <end>2014-08-15T10:05:21-04:00</end>
        </TimeSpan>
        <styleUrl>#place_home</styleUrl>
        <Point>
          <coordinates>-71.1114458017,42.3754311174</coordinates>
        </Point>
      </Placemark>
      <Placemark id="1408114211000">
        <name><![CDATA[Impact Hub Boston]]></name>
        <atom:link href="http://foursquare.com/venue/535ef432498eb46f6389ecf5"/>
        <description><![CDATA[<p>8/15/14<br/> 10:50 AM to 11:52 AM<br/> 1:02 hours</p> <p>Community Center<br/> <a href="http://foursquare.com/venue/535ef432498eb46f6389ecf5">More details (Foursquare)</a> </p>]]></description>
        <TimeSpan>
          <begin>2014-08-15T10:50:12-04:00</begin>
          <end>2014-08-15T11:52:39-04:00</end>
        </TimeSpan>
        <styleUrl>#place_Community Center</styleUrl>
        <Point>
          <coordinates>-71.05773051318191,42.3568123867606</coordinates>
        </Point>
      </Placemark>
      <Placemark id="1408119878000">
        <name><![CDATA[Proximate]]></name>
        <atom:link href="http://foursquare.com/venue/51c8c0d1498e5d4d09a48362"/>
        <description><![CDATA[<p>8/15/14<br/> 12:24 PM to 12:43 PM<br/> 19 min</p> <p>Tech Startup<br/> <a href="http://foursquare.com/venue/51c8c0d1498e5d4d09a48362">More details (Foursquare)</a> </p>]]></description>
        <TimeSpan>
          <begin>2014-08-15T12:24:39-04:00</begin>
          <end>2014-08-15T12:43:43-04:00</end>
        </TimeSpan>
        <styleUrl>#place_Tech Startup</styleUrl>
        <Point>
          <coordinates>-71.117205,42.378716</coordinates>
        </Point>
      </Placemark>
      <Placemark id="1408121611000">
        <name><![CDATA[Starbucks]]></name>
        <atom:link href="http://foursquare.com/venue/49cabb79f964a520d8581fe3"/>
        <description><![CDATA[<p>8/15/14<br/> 12:53 PM to 1:41 PM<br/> 47 min</p> <p>Coffee Shop<br/> <a href="http://foursquare.com/venue/49cabb79f964a520d8581fe3">More details (Foursquare)</a> </p>]]></description>
        <TimeSpan>
          <begin>2014-08-15T12:53:32-04:00</begin>
          <end>2014-08-15T13:41:23-04:00</end>
        </TimeSpan>
        <styleUrl>#place_Coffee Shop</styleUrl>
        <Point>
          <coordinates>-71.12017,42.374494</coordinates>
        </Point>
      </Placemark>
      <Placemark id="1408125735000">
        <name><![CDATA[Place in Old Cambridge]]></name>
        <description><![CDATA[<p>8/15/14<br/> 2:02 PM to 2:04 PM<br/> 2 min</p>]]></description>
        <TimeSpan>
          <begin>2014-08-15T14:02:16-04:00</begin>
          <end>2014-08-15T14:04:14-04:00</end>
        </TimeSpan>
        <styleUrl>#place_unknown</styleUrl>
        <Point>
          <coordinates>-71.1213492043,42.3756232629</coordinates>
        </Point>
      </Placemark>
      <Placemark id="1408126211000">
        <name><![CDATA[CVS/pharmacy]]></name>
