<?xml version="1.0" encoding="UTF-8"?><kml xmlns="http://www.opengis.net/kml/2.2" xmlns:gx="http://www.google.com/kml/ext/2.2" xmlns:atom="http://www.w3.org/2005/Atom" xmlns:xal="urn:oasis:names:tc:ciq:xsdschema:xAL:2.0" xmlns:xsi="http://www.w3.org/2001/XMLSchema-instance">
  <Document>
    <atom:link href="http://www.moves-app.com"/>
    <description><![CDATA[<p align="center"><a href="http://www.moves-app.com"> <img src="http://www.moves-app.com/assets/moves.png"/> </a></p> <p align="center">Moves Storyline</p>]]></description>
    <Style id="place_Sushi Restaurant">
      <IconStyle>
        <scale>1.0</scale>
        <heading>0.0</heading>
        <Icon>
          <href>https://ss1.4sqi.net/img/categories/food/sushi.png</href>
          <refreshInterval>0.0</refreshInterval>
          <viewRefreshTime>0.0</viewRefreshTime>
          <viewBoundScale>0.0</viewBoundScale>
        </Icon>
      </IconStyle>
    </Style>
    <Style id="place_Furniture / Home Store">
      <IconStyle>
        <scale>1.0</scale>
        <heading>0.0</heading>
        <Icon>
          <href>https://ss1.4sqi.net/img/categories/shops/furniture.png</href>
          <refreshInterval>0.0</refreshInterval>
          <viewRefreshTime>0.0</viewRefreshTime>
          <viewBoundScale>0.0</viewBoundScale>
        </Icon>
      </IconStyle>
    </Style>
    <Style id="place_Home (private)">
      <IconStyle>
        <scale>1.0</scale>
        <heading>0.0</heading>
        <Icon>
          <href>https://ss1.4sqi.net/img/categories/building/home.png</href>
          <refreshInterval>0.0</refreshInterval>
          <viewRefreshTime>0.0</viewRefreshTime>
          <viewBoundScale>0.0</viewBoundScale>
        </Icon>
      </IconStyle>
    </Style>
    <Style id="place_French Restaurant">
      <IconStyle>
        <scale>1.0</scale>
        <heading>0.0</heading>
        <Icon>
          <href>https://ss1.4sqi.net/img/categories/food/french.png</href>
          <refreshInterval>0.0</refreshInterval>
          <viewRefreshTime>0.0</viewRefreshTime>
          <viewBoundScale>0.0</viewBoundScale>
        </Icon>
      </IconStyle>
    </Style>
    <Style id="place_Moving Target">
      <IconStyle>
        <scale>1.0</scale>
        <heading>0.0</heading>
        <Icon>
          <href>https://ss1.4sqi.net/img/categories/travel/default.png</href>
          <refreshInterval>0.0</refreshInterval>
          <viewRefreshTime>0.0</viewRefreshTime>
          <viewBoundScale>0.0</viewBoundScale>
        </Icon>
      </IconStyle>
    </Style>
    <Style id="place_Liquor Store">
      <IconStyle>
        <scale>1.0</scale>
        <heading>0.0</heading>
        <Icon>
          <href>https://ss1.4sqi.net/img/categories/shops/default.png</href>
          <refreshInterval>0.0</refreshInterval>
          <viewRefreshTime>0.0</viewRefreshTime>
          <viewBoundScale>0.0</viewBoundScale>
        </Icon>
      </IconStyle>
    </Style>
    <Style id="place_Food Court">
      <IconStyle>
        <scale>1.0</scale>
        <heading>0.0</heading>
        <Icon>
          <href>https://ss1.4sqi.net/img/categories/shops/food_foodcourt.png</href>
          <refreshInterval>0.0</refreshInterval>
          <viewRefreshTime>0.0</viewRefreshTime>
          <viewBoundScale>0.0</viewBoundScale>
        </Icon>
      </IconStyle>
    </Style>
    <Style id="place_Tapas Restaurant">
      <IconStyle>
        <scale>1.0</scale>
        <heading>0.0</heading>
        <Icon>
          <href>https://ss1.4sqi.net/img/categories/food/default.png</href>
          <refreshInterval>0.0</refreshInterval>
          <viewRefreshTime>0.0</viewRefreshTime>
          <viewBoundScale>0.0</viewBoundScale>
        </Icon>
      </IconStyle>
    </Style>
    <Style id="place_Mexican Restaurant">
      <IconStyle>
        <scale>1.0</scale>
        <heading>0.0</heading>
        <Icon>
          <href>https://ss1.4sqi.net/img/categories/food/mexican.png</href>
          <refreshInterval>0.0</refreshInterval>
          <viewRefreshTime>0.0</viewRefreshTime>
          <viewBoundScale>0.0</viewBoundScale>
        </Icon>
      </IconStyle>
    </Style>
    <Style id="place_Resort">
      <IconStyle>
        <scale>1.0</scale>
        <heading>0.0</heading>
        <Icon>
          <href>https://ss1.4sqi.net/img/categories/travel/resort.png</href>
          <refreshInterval>0.0</refreshInterval>
          <viewRefreshTime>0.0</viewRefreshTime>
          <viewBoundScale>0.0</viewBoundScale>
        </Icon>
      </IconStyle>
    </Style>
    <Style id="place_Paper / Office Supplies Store">
      <IconStyle>
        <scale>1.0</scale>
        <heading>0.0</heading>
        <Icon>
          <href>https://ss1.4sqi.net/img/categories/shops/papergoods.png</href>
          <refreshInterval>0.0</refreshInterval>
          <viewRefreshTime>0.0</viewRefreshTime>
          <viewBoundScale>0.0</viewBoundScale>
        </Icon>
      </IconStyle>
    </Style>
    <Style id="place_Spiritual Center">
      <IconStyle>
        <scale>1.0</scale>
        <heading>0.0</heading>
        <Icon>
          <href>https://ss1.4sqi.net/img/categories/building/religious.png</href>
          <refreshInterval>0.0</refreshInterval>
          <viewRefreshTime>0.0</viewRefreshTime>
          <viewBoundScale>0.0</viewBoundScale>
        </Icon>
      </IconStyle>
    </Style>
    <Style id="place_Building">
      <IconStyle>
        <scale>1.0</scale>
        <heading>0.0</heading>
        <Icon>
          <href>https://ss1.4sqi.net/img/categories/building/default.png</href>
          <refreshInterval>0.0</refreshInterval>
          <viewRefreshTime>0.0</viewRefreshTime>
          <viewBoundScale>0.0</viewBoundScale>
        </Icon>
      </IconStyle>
    </Style>
    <Style id="place_Hotel">
      <IconStyle>
        <scale>1.0</scale>
        <heading>0.0</heading>
        <Icon>
          <href>https://ss1.4sqi.net/img/categories/travel/hotel.png</href>
          <refreshInterval>0.0</refreshInterval>
          <viewRefreshTime>0.0</viewRefreshTime>
          <viewBoundScale>0.0</viewBoundScale>
        </Icon>
      </IconStyle>
    </Style>
    <Style id="place_College Residence Hall">
      <IconStyle>
        <scale>1.0</scale>
        <heading>0.0</heading>
        <Icon>
          <href>https://ss1.4sqi.net/img/categories/education/default.png</href>
          <refreshInterval>0.0</refreshInterval>
          <viewRefreshTime>0.0</viewRefreshTime>
          <viewBoundScale>0.0</viewBoundScale>
        </Icon>
      </IconStyle>
    </Style>
    <Style id="place_Garden">
      <IconStyle>
        <scale>1.0</scale>
        <heading>0.0</heading>
        <Icon>
          <href>https://ss1.4sqi.net/img/categories/parks_outdoors/garden.png</href>
          <refreshInterval>0.0</refreshInterval>
          <viewRefreshTime>0.0</viewRefreshTime>
          <viewBoundScale>0.0</viewBoundScale>
        </Icon>
      </IconStyle>
    </Style>
    <Style id="place_school">
      <IconStyle>
        <scale>1.0</scale>
        <heading>0.0</heading>
        <Icon>
          <href>http://ss1.4sqi.net/img/categories/building/school.png</href>
          <refreshInterval>0.0</refreshInterval>
          <viewRefreshTime>0.0</viewRefreshTime>
          <viewBoundScale>0.0</viewBoundScale>
        </Icon>
      </IconStyle>
    </Style>
    <Style id="place_Arepa Restaurant">
      <IconStyle>
        <scale>1.0</scale>
        <heading>0.0</heading>
        <Icon>
          <href>https://ss1.4sqi.net/img/categories/food/default.png</href>
          <refreshInterval>0.0</refreshInterval>
          <viewRefreshTime>0.0</viewRefreshTime>
          <viewBoundScale>0.0</viewBoundScale>
        </Icon>
      </IconStyle>
    </Style>
    <Style id="place_Electronics Store">
      <IconStyle>
        <scale>1.0</scale>
        <heading>0.0</heading>
        <Icon>
          <href>https://ss1.4sqi.net/img/categories/shops/technology.png</href>
          <refreshInterval>0.0</refreshInterval>
          <viewRefreshTime>0.0</viewRefreshTime>
          <viewBoundScale>0.0</viewBoundScale>
        </Icon>
      </IconStyle>
    </Style>
    <Style id="place_Warehouse Store">
      <IconStyle>
        <scale>1.0</scale>
        <heading>0.0</heading>
        <Icon>
          <href>https://ss1.4sqi.net/img/categories/shops/default.png</href>
          <refreshInterval>0.0</refreshInterval>
          <viewRefreshTime>0.0</viewRefreshTime>
          <viewBoundScale>0.0</viewBoundScale>
        </Icon>
      </IconStyle>
    </Style>
    <Style id="place_Monument / Landmark">
      <IconStyle>
        <scale>1.0</scale>
        <heading>0.0</heading>
        <Icon>
          <href>https://ss1.4sqi.net/img/categories/building/default.png</href>
          <refreshInterval>0.0</refreshInterval>
          <viewRefreshTime>0.0</viewRefreshTime>
          <viewBoundScale>0.0</viewBoundScale>
        </Icon>
      </IconStyle>
    </Style>
    <Style id="place_College Technology Building">
      <IconStyle>
        <scale>1.0</scale>
        <heading>0.0</heading>
        <Icon>
          <href>https://ss1.4sqi.net/img/categories/education/default.png</href>
          <refreshInterval>0.0</refreshInterval>
          <viewRefreshTime>0.0</viewRefreshTime>
          <viewBoundScale>0.0</viewBoundScale>
        </Icon>
      </IconStyle>
    </Style>
    <Style id="place_Plaza">
      <IconStyle>
        <scale>1.0</scale>
        <heading>0.0</heading>
        <Icon>
          <href>https://ss1.4sqi.net/img/categories/parks_outdoors/default.png</href>
          <refreshInterval>0.0</refreshInterval>
          <viewRefreshTime>0.0</viewRefreshTime>
          <viewBoundScale>0.0</viewBoundScale>
        </Icon>
      </IconStyle>
    </Style>
    <Style id="place_Harbor / Marina">
      <IconStyle>
        <scale>1.0</scale>
        <heading>0.0</heading>
        <Icon>
          <href>https://ss1.4sqi.net/img/categories/parks_outdoors/harbor.png</href>
          <refreshInterval>0.0</refreshInterval>
          <viewRefreshTime>0.0</viewRefreshTime>
          <viewBoundScale>0.0</viewBoundScale>
        </Icon>
      </IconStyle>
    </Style>
    <Style id="place_Supermarket">
      <IconStyle>
        <scale>1.0</scale>
        <heading>0.0</heading>
        <Icon>
          <href>https://ss1.4sqi.net/img/categories/shops/food_grocery.png</href>
          <refreshInterval>0.0</refreshInterval>
          <viewRefreshTime>0.0</viewRefreshTime>
          <viewBoundScale>0.0</viewBoundScale>
        </Icon>
      </IconStyle>
    </Style>
    <Style id="place_Pub">
      <IconStyle>
        <scale>1.0</scale>
        <heading>0.0</heading>
        <Icon>
          <href>https://ss1.4sqi.net/img/categories/nightlife/pub.png</href>
          <refreshInterval>0.0</refreshInterval>
          <viewRefreshTime>0.0</viewRefreshTime>
          <viewBoundScale>0.0</viewBoundScale>
        </Icon>
      </IconStyle>
    </Style>
    <Style id="place_Diner">
      <IconStyle>
        <scale>1.0</scale>
        <heading>0.0</heading>
        <Icon>
          <href>https://ss1.4sqi.net/img/categories/food/default.png</href>
          <refreshInterval>0.0</refreshInterval>
          <viewRefreshTime>0.0</viewRefreshTime>
          <viewBoundScale>0.0</viewBoundScale>
        </Icon>
      </IconStyle>
    </Style>
    <Style id="place_Clothing Store">
      <IconStyle>
        <scale>1.0</scale>
        <heading>0.0</heading>
        <Icon>
          <href>https://ss1.4sqi.net/img/categories/shops/apparel.png</href>
          <refreshInterval>0.0</refreshInterval>
          <viewRefreshTime>0.0</viewRefreshTime>
          <viewBoundScale>0.0</viewBoundScale>
        </Icon>
      </IconStyle>
    </Style>
    <Style id="place_Latin American Restaurant">
      <IconStyle>
        <scale>1.0</scale>
        <heading>0.0</heading>
        <Icon>
          <href>https://ss1.4sqi.net/img/categories/food/default.png</href>
          <refreshInterval>0.0</refreshInterval>
          <viewRefreshTime>0.0</viewRefreshTime>
          <viewBoundScale>0.0</viewBoundScale>
        </Icon>
      </IconStyle>
    </Style>
    <Style id="place_Coffee Shop">
      <IconStyle>
        <scale>1.0</scale>
        <heading>0.0</heading>
        <Icon>
          <href>https://ss1.4sqi.net/img/categories/food/coffeeshop.png</href>
          <refreshInterval>0.0</refreshInterval>
          <viewRefreshTime>0.0</viewRefreshTime>
          <viewBoundScale>0.0</viewBoundScale>
        </Icon>
      </IconStyle>
    </Style>
    <Style id="place_Historic Site">
      <IconStyle>
        <scale>1.0</scale>
        <heading>0.0</heading>
        <Icon>
          <href>https://ss1.4sqi.net/img/categories/arts_entertainment/museum.png</href>
          <refreshInterval>0.0</refreshInterval>
          <viewRefreshTime>0.0</viewRefreshTime>
          <viewBoundScale>0.0</viewBoundScale>
        </Icon>
      </IconStyle>
    </Style>
    <Style id="place_Gas Station / Garage">
      <IconStyle>
        <scale>1.0</scale>
        <heading>0.0</heading>
        <Icon>
          <href>https://ss1.4sqi.net/img/categories/shops/gas.png</href>
          <refreshInterval>0.0</refreshInterval>
          <viewRefreshTime>0.0</viewRefreshTime>
          <viewBoundScale>0.0</viewBoundScale>
        </Icon>
      </IconStyle>
    </Style>
    <Style id="place_Performing Arts Venue">
      <IconStyle>
        <scale>1.0</scale>
        <heading>0.0</heading>
        <Icon>
          <href>https://ss1.4sqi.net/img/categories/arts_entertainment/default.png</href>
          <refreshInterval>0.0</refreshInterval>
          <viewRefreshTime>0.0</viewRefreshTime>
          <viewBoundScale>0.0</viewBoundScale>
        </Icon>
      </IconStyle>
    </Style>
    <Style id="place_Winery">
      <IconStyle>
        <scale>1.0</scale>
        <heading>0.0</heading>
        <Icon>
          <href>https://ss1.4sqi.net/img/categories/food/winery.png</href>
          <refreshInterval>0.0</refreshInterval>
          <viewRefreshTime>0.0</viewRefreshTime>
          <viewBoundScale>0.0</viewBoundScale>
        </Icon>
      </IconStyle>
    </Style>
    <Style id="place_Train Station">
      <IconStyle>
        <scale>1.0</scale>
        <heading>0.0</heading>
        <Icon>
          <href>https://ss1.4sqi.net/img/categories/travel/trainstation.png</href>
          <refreshInterval>0.0</refreshInterval>
          <viewRefreshTime>0.0</viewRefreshTime>
          <viewBoundScale>0.0</viewBoundScale>
        </Icon>
      </IconStyle>
    </Style>
    <Style id="place_Mediterranean Restaurant">
      <IconStyle>
        <scale>1.0</scale>
        <heading>0.0</heading>
        <Icon>
          <href>https://ss1.4sqi.net/img/categories/food/default.png</href>
          <refreshInterval>0.0</refreshInterval>
          <viewRefreshTime>0.0</viewRefreshTime>
          <viewBoundScale>0.0</viewBoundScale>
        </Icon>
      </IconStyle>
    </Style>
    <Style id="place_American Restaurant">
      <IconStyle>
        <scale>1.0</scale>
        <heading>0.0</heading>
        <Icon>
          <href>https://ss1.4sqi.net/img/categories/food/default.png</href>
          <refreshInterval>0.0</refreshInterval>
          <viewRefreshTime>0.0</viewRefreshTime>
          <viewBoundScale>0.0</viewBoundScale>
        </Icon>
      </IconStyle>
    </Style>
    <Style id="place_Mall">
      <IconStyle>
        <scale>1.0</scale>
        <heading>0.0</heading>
        <Icon>
          <href>https://ss1.4sqi.net/img/categories/shops/default.png</href>
          <refreshInterval>0.0</refreshInterval>
          <viewRefreshTime>0.0</viewRefreshTime>
          <viewBoundScale>0.0</viewBoundScale>
        </Icon>
      </IconStyle>
    </Style>
    <Style id="place_Sandwich Place">
      <IconStyle>
        <scale>1.0</scale>
        <heading>0.0</heading>
        <Icon>
          <href>https://ss1.4sqi.net/img/categories/food/sandwiches.png</href>
          <refreshInterval>0.0</refreshInterval>
          <viewRefreshTime>0.0</viewRefreshTime>
          <viewBoundScale>0.0</viewBoundScale>
        </Icon>
      </IconStyle>
    </Style>
    <Style id="place_College Administrative Building">
      <IconStyle>
        <scale>1.0</scale>
        <heading>0.0</heading>
        <Icon>
          <href>https://ss1.4sqi.net/img/categories/education/default.png</href>
          <refreshInterval>0.0</refreshInterval>
          <viewRefreshTime>0.0</viewRefreshTime>
          <viewBoundScale>0.0</viewBoundScale>
        </Icon>
      </IconStyle>
    </Style>
    <Style id="place_Bank">
      <IconStyle>
        <scale>1.0</scale>
        <heading>0.0</heading>
        <Icon>
          <href>https://ss1.4sqi.net/img/categories/shops/financial.png</href>
          <refreshInterval>0.0</refreshInterval>
          <viewRefreshTime>0.0</viewRefreshTime>
          <viewBoundScale>0.0</viewBoundScale>
        </Icon>
      </IconStyle>
    </Style>
    <Style id="place_Women's Store">
      <IconStyle>
        <scale>1.0</scale>
        <heading>0.0</heading>
        <Icon>
          <href>https://ss1.4sqi.net/img/categories/shops/apparel_women.png</href>
          <refreshInterval>0.0</refreshInterval>
          <viewRefreshTime>0.0</viewRefreshTime>
          <viewBoundScale>0.0</viewBoundScale>
        </Icon>
      </IconStyle>
    </Style>
    <Style id="place_work">
      <IconStyle>
        <scale>1.0</scale>
        <heading>0.0</heading>
        <Icon>
          <href>http://ss1.4sqi.net/img/categories/building/default.png</href>
          <refreshInterval>0.0</refreshInterval>
          <viewRefreshTime>0.0</viewRefreshTime>
          <viewBoundScale>0.0</viewBoundScale>
        </Icon>
      </IconStyle>
    </Style>
    <Style id="place_Library">
      <IconStyle>
        <scale>1.0</scale>
        <heading>0.0</heading>
        <Icon>
          <href>https://ss1.4sqi.net/img/categories/building/library.png</href>
          <refreshInterval>0.0</refreshInterval>
          <viewRefreshTime>0.0</viewRefreshTime>
          <viewBoundScale>0.0</viewBoundScale>
        </Icon>
      </IconStyle>
    </Style>
    <Style id="place_Ice Cream Shop">
      <IconStyle>
        <scale>1.0</scale>
        <heading>0.0</heading>
        <Icon>
          <href>https://ss1.4sqi.net/img/categories/food/icecream.png</href>
          <refreshInterval>0.0</refreshInterval>
          <viewRefreshTime>0.0</viewRefreshTime>
          <viewBoundScale>0.0</viewBoundScale>
        </Icon>
      </IconStyle>
    </Style>
    <Style id="place_History Museum">
      <IconStyle>
        <scale>1.0</scale>
        <heading>0.0</heading>
        <Icon>
          <href>https://ss1.4sqi.net/img/categories/arts_entertainment/museum.png</href>
          <refreshInterval>0.0</refreshInterval>
          <viewRefreshTime>0.0</viewRefreshTime>
          <viewBoundScale>0.0</viewBoundScale>
        </Icon>
      </IconStyle>
    </Style>
    <Style id="place_user">
      <IconStyle>
        <scale>1.0</scale>
        <heading>0.0</heading>
        <Icon>
          <href>http://maps.google.com/mapfiles/marker_white.png</href>
          <refreshInterval>0.0</refreshInterval>
          <viewRefreshTime>0.0</viewRefreshTime>
          <viewBoundScale>0.0</viewBoundScale>
        </Icon>
      </IconStyle>
    </Style>
    <Style id="place_College Cafeteria">
      <IconStyle>
        <scale>1.0</scale>
        <heading>0.0</heading>
        <Icon>
          <href>https://ss1.4sqi.net/img/categories/education/cafeteria.png</href>
          <refreshInterval>0.0</refreshInterval>
          <viewRefreshTime>0.0</viewRefreshTime>
          <viewBoundScale>0.0</viewBoundScale>
        </Icon>
      </IconStyle>
    </Style>
    <Style id="place_Seafood Restaurant">
      <IconStyle>
        <scale>1.0</scale>
        <heading>0.0</heading>
        <Icon>
          <href>https://ss1.4sqi.net/img/categories/food/seafood.png</href>
          <refreshInterval>0.0</refreshInterval>
          <viewRefreshTime>0.0</viewRefreshTime>
          <viewBoundScale>0.0</viewBoundScale>
        </Icon>
      </IconStyle>
    </Style>
    <Style id="place_Brazilian Restaurant">
      <IconStyle>
        <scale>1.0</scale>
        <heading>0.0</heading>
        <Icon>
          <href>https://ss1.4sqi.net/img/categories/food/brazilian.png</href>
          <refreshInterval>0.0</refreshInterval>
          <viewRefreshTime>0.0</viewRefreshTime>
          <viewBoundScale>0.0</viewBoundScale>
        </Icon>
      </IconStyle>
    </Style>
    <Style id="place_Deli / Bodega">
      <IconStyle>
        <scale>1.0</scale>
        <heading>0.0</heading>
        <Icon>
          <href>https://ss1.4sqi.net/img/categories/food/deli.png</href>
          <refreshInterval>0.0</refreshInterval>
          <viewRefreshTime>0.0</viewRefreshTime>
          <viewBoundScale>0.0</viewBoundScale>
        </Icon>
      </IconStyle>
    </Style>
    <Style id="place_High School">
      <IconStyle>
        <scale>1.0</scale>
        <heading>0.0</heading>
        <Icon>
          <href>https://ss1.4sqi.net/img/categories/building/school.png</href>
          <refreshInterval>0.0</refreshInterval>
          <viewRefreshTime>0.0</viewRefreshTime>
          <viewBoundScale>0.0</viewBoundScale>
        </Icon>
      </IconStyle>
    </Style>
    <Style id="place_Gastropub">
      <IconStyle>
        <scale>1.0</scale>
        <heading>0.0</heading>
        <Icon>
          <href>https://ss1.4sqi.net/img/categories/food/default.png</href>
          <refreshInterval>0.0</refreshInterval>
          <viewRefreshTime>0.0</viewRefreshTime>
          <viewBoundScale>0.0</viewBoundScale>
        </Icon>
      </IconStyle>
    </Style>
    <Style id="place_Hot Dog Joint">
      <IconStyle>
        <scale>1.0</scale>
        <heading>0.0</heading>
        <Icon>
          <href>https://ss1.4sqi.net/img/categories/food/hotdog.png</href>
          <refreshInterval>0.0</refreshInterval>
          <viewRefreshTime>0.0</viewRefreshTime>
          <viewBoundScale>0.0</viewBoundScale>
        </Icon>
      </IconStyle>
    </Style>
    <Style id="place_Taco Place">
      <IconStyle>
        <scale>1.0</scale>
        <heading>0.0</heading>
        <Icon>
          <href>https://ss1.4sqi.net/img/categories/food/tacos.png</href>
          <refreshInterval>0.0</refreshInterval>
          <viewRefreshTime>0.0</viewRefreshTime>
          <viewBoundScale>0.0</viewBoundScale>
        </Icon>
      </IconStyle>
    </Style>
    <Style id="place_Caribbean Restaurant">
      <IconStyle>
        <scale>1.0</scale>
        <heading>0.0</heading>
        <Icon>
          <href>https://ss1.4sqi.net/img/categories/food/default.png</href>
          <refreshInterval>0.0</refreshInterval>
          <viewRefreshTime>0.0</viewRefreshTime>
          <viewBoundScale>0.0</viewBoundScale>
        </Icon>
      </IconStyle>
    </Style>
    <Style id="place_College Academic Building">
      <IconStyle>
        <scale>1.0</scale>
        <heading>0.0</heading>
        <Icon>
          <href>https://ss1.4sqi.net/img/categories/education/default.png</href>
          <refreshInterval>0.0</refreshInterval>
          <viewRefreshTime>0.0</viewRefreshTime>
          <viewBoundScale>0.0</viewBoundScale>
        </Icon>
      </IconStyle>
    </Style>
    <Style id="place_Italian Restaurant">
      <IconStyle>
        <scale>1.0</scale>
        <heading>0.0</heading>
        <Icon>
          <href>https://ss1.4sqi.net/img/categories/food/italian.png</href>
          <refreshInterval>0.0</refreshInterval>
          <viewRefreshTime>0.0</viewRefreshTime>
          <viewBoundScale>0.0</viewBoundScale>
        </Icon>
      </IconStyle>
    </Style>
    <Style id="place_Breakfast Spot">
      <IconStyle>
        <scale>1.0</scale>
        <heading>0.0</heading>
        <Icon>
          <href>https://ss1.4sqi.net/img/categories/food/default.png</href>
          <refreshInterval>0.0</refreshInterval>
          <viewRefreshTime>0.0</viewRefreshTime>
          <viewBoundScale>0.0</viewBoundScale>
        </Icon>
      </IconStyle>
    </Style>
    <Style id="place_Platform">
      <IconStyle>
        <scale>1.0</scale>
        <heading>0.0</heading>
        <Icon>
          <href>https://ss1.4sqi.net/img/categories/travel/trainstation.png</href>
          <refreshInterval>0.0</refreshInterval>
          <viewRefreshTime>0.0</viewRefreshTime>
          <viewBoundScale>0.0</viewBoundScale>
        </Icon>
      </IconStyle>
    </Style>
    <Style id="place_Salon / Barbershop">
      <IconStyle>
        <scale>1.0</scale>
        <heading>0.0</heading>
        <Icon>
          <href>https://ss1.4sqi.net/img/categories/shops/salon_barber.png</href>
          <refreshInterval>0.0</refreshInterval>
          <viewRefreshTime>0.0</viewRefreshTime>
          <viewBoundScale>0.0</viewBoundScale>
        </Icon>
      </IconStyle>
    </Style>
    <Style id="place_Flea Market">
      <IconStyle>
        <scale>1.0</scale>
        <heading>0.0</heading>
        <Icon>
          <href>https://ss1.4sqi.net/img/categories/shops/default.png</href>
          <refreshInterval>0.0</refreshInterval>
          <viewRefreshTime>0.0</viewRefreshTime>
          <viewBoundScale>0.0</viewBoundScale>
        </Icon>
      </IconStyle>
    </Style>
    <Style id="place_foursquare">
      <IconStyle>
        <scale>1.0</scale>
        <heading>0.0</heading>
        <Icon>
          <href>http://maps.google.com/mapfiles/marker_white.png</href>
          <refreshInterval>0.0</refreshInterval>
          <viewRefreshTime>0.0</viewRefreshTime>
          <viewBoundScale>0.0</viewBoundScale>
        </Icon>
      </IconStyle>
    </Style>
    <Style id="place_Airport Gate">
      <IconStyle>
        <scale>1.0</scale>
        <heading>0.0</heading>
        <Icon>
          <href>https://ss1.4sqi.net/img/categories/travel/airport_gate.png</href>
          <refreshInterval>0.0</refreshInterval>
          <viewRefreshTime>0.0</viewRefreshTime>
          <viewBoundScale>0.0</viewBoundScale>
        </Icon>
      </IconStyle>
    </Style>
    <Style id="place_Dumpling Restaurant">
      <IconStyle>
        <scale>1.0</scale>
        <heading>0.0</heading>
        <Icon>
          <href>https://ss1.4sqi.net/img/categories/food/dumplings.png</href>
          <refreshInterval>0.0</refreshInterval>
          <viewRefreshTime>0.0</viewRefreshTime>
          <viewBoundScale>0.0</viewBoundScale>
        </Icon>
      </IconStyle>
    </Style>
    <Style id="place_Tech Startup">
      <IconStyle>
        <scale>1.0</scale>
        <heading>0.0</heading>
        <Icon>
          <href>https://ss1.4sqi.net/img/categories/shops/technology.png</href>
          <refreshInterval>0.0</refreshInterval>
          <viewRefreshTime>0.0</viewRefreshTime>
          <viewBoundScale>0.0</viewBoundScale>
        </Icon>
      </IconStyle>
    </Style>
    <Style id="place_Pizza Place">
      <IconStyle>
        <scale>1.0</scale>
        <heading>0.0</heading>
        <Icon>
          <href>https://ss1.4sqi.net/img/categories/food/pizza.png</href>
          <refreshInterval>0.0</refreshInterval>
          <viewRefreshTime>0.0</viewRefreshTime>
          <viewBoundScale>0.0</viewBoundScale>
        </Icon>
      </IconStyle>
    </Style>
    <Style id="place_Wine Bar">
      <IconStyle>
        <scale>1.0</scale>
        <heading>0.0</heading>
        <Icon>
          <href>https://ss1.4sqi.net/img/categories/nightlife/wine.png</href>
          <refreshInterval>0.0</refreshInterval>
          <viewRefreshTime>0.0</viewRefreshTime>
          <viewBoundScale>0.0</viewBoundScale>
        </Icon>
      </IconStyle>
    </Style>
    <Style id="place_Grocery Store">
      <IconStyle>
        <scale>1.0</scale>
        <heading>0.0</heading>
        <Icon>
          <href>https://ss1.4sqi.net/img/categories/shops/food_grocery.png</href>
          <refreshInterval>0.0</refreshInterval>
          <viewRefreshTime>0.0</viewRefreshTime>
          <viewBoundScale>0.0</viewBoundScale>
        </Icon>
      </IconStyle>
    </Style>
    <Style id="place_Hardware Store">
      <IconStyle>
        <scale>1.0</scale>
        <heading>0.0</heading>
        <Icon>
          <href>https://ss1.4sqi.net/img/categories/shops/hardware.png</href>
          <refreshInterval>0.0</refreshInterval>
          <viewRefreshTime>0.0</viewRefreshTime>
          <viewBoundScale>0.0</viewBoundScale>
        </Icon>
      </IconStyle>
    </Style>
    <Style id="place_Bus Line">
      <IconStyle>
        <scale>1.0</scale>
        <heading>0.0</heading>
        <Icon>
          <href>https://ss1.4sqi.net/img/categories/travel/busstation.png</href>
          <refreshInterval>0.0</refreshInterval>
          <viewRefreshTime>0.0</viewRefreshTime>
          <viewBoundScale>0.0</viewBoundScale>
        </Icon>
      </IconStyle>
    </Style>
    <Style id="place_Dessert Shop">
      <IconStyle>
        <scale>1.0</scale>
        <heading>0.0</heading>
        <Icon>
          <href>https://ss1.4sqi.net/img/categories/food/dessert.png</href>
          <refreshInterval>0.0</refreshInterval>
          <viewRefreshTime>0.0</viewRefreshTime>
          <viewBoundScale>0.0</viewBoundScale>
        </Icon>
      </IconStyle>
    </Style>
    <Style id="place_Fried Chicken Joint">
      <IconStyle>
        <scale>1.0</scale>
        <heading>0.0</heading>
        <Icon>
          <href>https://ss1.4sqi.net/img/categories/food/friedchicken.png</href>
          <refreshInterval>0.0</refreshInterval>
          <viewRefreshTime>0.0</viewRefreshTime>
          <viewBoundScale>0.0</viewBoundScale>
        </Icon>
      </IconStyle>
    </Style>
    <Style id="place_Arts &amp; Crafts Store">
      <IconStyle>
        <scale>1.0</scale>
        <heading>0.0</heading>
        <Icon>
          <href>https://ss1.4sqi.net/img/categories/shops/artstore.png</href>
          <refreshInterval>0.0</refreshInterval>
          <viewRefreshTime>0.0</viewRefreshTime>
          <viewBoundScale>0.0</viewBoundScale>
        </Icon>
      </IconStyle>
    </Style>
    <Style id="place_BBQ Joint">
      <IconStyle>
        <scale>1.0</scale>
        <heading>0.0</heading>
        <Icon>
          <href>https://ss1.4sqi.net/img/categories/food/bbq.png</href>
          <refreshInterval>0.0</refreshInterval>
          <viewRefreshTime>0.0</viewRefreshTime>
          <viewBoundScale>0.0</viewBoundScale>
        </Icon>
      </IconStyle>
    </Style>
    <Style id="place_College Quad">
      <IconStyle>
        <scale>1.0</scale>
        <heading>0.0</heading>
        <Icon>
          <href>https://ss1.4sqi.net/img/categories/education/default.png</href>
          <refreshInterval>0.0</refreshInterval>
          <viewRefreshTime>0.0</viewRefreshTime>
          <viewBoundScale>0.0</viewBoundScale>
        </Icon>
      </IconStyle>
    </Style>
    <Style id="place_Café">
      <IconStyle>
        <scale>1.0</scale>
        <heading>0.0</heading>
        <Icon>
          <href>https://ss1.4sqi.net/img/categories/food/cafe.png</href>
          <refreshInterval>0.0</refreshInterval>
          <viewRefreshTime>0.0</viewRefreshTime>
          <viewBoundScale>0.0</viewBoundScale>
        </Icon>
      </IconStyle>
    </Style>
    <Style id="place_Coworking Space">
      <IconStyle>
        <scale>1.0</scale>
        <heading>0.0</heading>
        <Icon>
          <href>https://ss1.4sqi.net/img/categories/building/default.png</href>
          <refreshInterval>0.0</refreshInterval>
          <viewRefreshTime>0.0</viewRefreshTime>
          <viewBoundScale>0.0</viewBoundScale>
        </Icon>
      </IconStyle>
    </Style>
    <Style id="place_Department Store">
      <IconStyle>
        <scale>1.0</scale>
        <heading>0.0</heading>
        <Icon>
          <href>https://ss1.4sqi.net/img/categories/shops/default.png</href>
          <refreshInterval>0.0</refreshInterval>
          <viewRefreshTime>0.0</viewRefreshTime>
          <viewBoundScale>0.0</viewBoundScale>
        </Icon>
      </IconStyle>
    </Style>
    <Style id="place_Portuguese Restaurant">
      <IconStyle>
        <scale>1.0</scale>
        <heading>0.0</heading>
        <Icon>
          <href>https://ss1.4sqi.net/img/categories/food/default.png</href>
          <refreshInterval>0.0</refreshInterval>
          <viewRefreshTime>0.0</viewRefreshTime>
          <viewBoundScale>0.0</viewBoundScale>
        </Icon>
      </IconStyle>
    </Style>
    <Style id="place_unknown">
      <IconStyle>
        <scale>1.0</scale>
        <heading>0.0</heading>
        <Icon>
          <href>http://maps.google.com/mapfiles/marker_white.png</href>
          <refreshInterval>0.0</refreshInterval>
          <viewRefreshTime>0.0</viewRefreshTime>
          <viewBoundScale>0.0</viewBoundScale>
        </Icon>
      </IconStyle>
    </Style>
    <Style id="place_University">
      <IconStyle>
        <scale>1.0</scale>
        <heading>0.0</heading>
        <Icon>
          <href>https://ss1.4sqi.net/img/categories/education/default.png</href>
          <refreshInterval>0.0</refreshInterval>
          <viewRefreshTime>0.0</viewRefreshTime>
          <viewBoundScale>0.0</viewBoundScale>
        </Icon>
      </IconStyle>
    </Style>
    <Style id="place_Ramen / Noodle House">
      <IconStyle>
        <scale>1.0</scale>
        <heading>0.0</heading>
        <Icon>
          <href>https://ss1.4sqi.net/img/categories/food/ramen.png</href>
          <refreshInterval>0.0</refreshInterval>
          <viewRefreshTime>0.0</viewRefreshTime>
          <viewBoundScale>0.0</viewBoundScale>
        </Icon>
      </IconStyle>
    </Style>
    <Style id="place_Castle">
      <IconStyle>
        <scale>1.0</scale>
        <heading>0.0</heading>
        <Icon>
          <href>https://ss1.4sqi.net/img/categories/parks_outdoors/default.png</href>
          <refreshInterval>0.0</refreshInterval>
          <viewRefreshTime>0.0</viewRefreshTime>
          <viewBoundScale>0.0</viewBoundScale>
        </Icon>
      </IconStyle>
    </Style>
    <Style id="place_Airport Terminal">
      <IconStyle>
        <scale>1.0</scale>
        <heading>0.0</heading>
        <Icon>
          <href>https://ss1.4sqi.net/img/categories/travel/airport_terminal.png</href>
          <refreshInterval>0.0</refreshInterval>
          <viewRefreshTime>0.0</viewRefreshTime>
          <viewBoundScale>0.0</viewBoundScale>
        </Icon>
      </IconStyle>
    </Style>
    <Style id="place_Shoe Store">
      <IconStyle>
        <scale>1.0</scale>
        <heading>0.0</heading>
        <Icon>
          <href>https://ss1.4sqi.net/img/categories/shops/apparel_shoestore.png</href>
          <refreshInterval>0.0</refreshInterval>
          <viewRefreshTime>0.0</viewRefreshTime>
          <viewBoundScale>0.0</viewBoundScale>
        </Icon>
      </IconStyle>
    </Style>
    <Style id="place_Bowling Alley">
      <IconStyle>
        <scale>1.0</scale>
        <heading>0.0</heading>
        <Icon>
          <href>https://ss1.4sqi.net/img/categories/arts_entertainment/bowling.png</href>
          <refreshInterval>0.0</refreshInterval>
          <viewRefreshTime>0.0</viewRefreshTime>
          <viewBoundScale>0.0</viewBoundScale>
        </Icon>
      </IconStyle>
    </Style>
    <Style id="place_Bar">
      <IconStyle>
        <scale>1.0</scale>
        <heading>0.0</heading>
        <Icon>
          <href>https://ss1.4sqi.net/img/categories/nightlife/bar.png</href>
          <refreshInterval>0.0</refreshInterval>
          <viewRefreshTime>0.0</viewRefreshTime>
          <viewBoundScale>0.0</viewBoundScale>
        </Icon>
      </IconStyle>
    </Style>
    <Style id="place_Tea Room">
      <IconStyle>
        <scale>1.0</scale>
        <heading>0.0</heading>
        <Icon>
          <href>https://ss1.4sqi.net/img/categories/food/tearoom.png</href>
          <refreshInterval>0.0</refreshInterval>
          <viewRefreshTime>0.0</viewRefreshTime>
          <viewBoundScale>0.0</viewBoundScale>
        </Icon>
      </IconStyle>
    </Style>
    <Style id="place_Airport">
      <IconStyle>
        <scale>1.0</scale>
        <heading>0.0</heading>
        <Icon>
          <href>https://ss1.4sqi.net/img/categories/travel/airport.png</href>
          <refreshInterval>0.0</refreshInterval>
          <viewRefreshTime>0.0</viewRefreshTime>
          <viewBoundScale>0.0</viewBoundScale>
        </Icon>
      </IconStyle>
    </Style>
    <Style id="place_Bakery">
      <IconStyle>
        <scale>1.0</scale>
        <heading>0.0</heading>
        <Icon>
          <href>https://ss1.4sqi.net/img/categories/food/bakery.png</href>
          <refreshInterval>0.0</refreshInterval>
          <viewRefreshTime>0.0</viewRefreshTime>
          <viewBoundScale>0.0</viewBoundScale>
        </Icon>
      </IconStyle>
    </Style>
    <Style id="place_Asian Restaurant">
      <IconStyle>
        <scale>1.0</scale>
        <heading>0.0</heading>
        <Icon>
          <href>https://ss1.4sqi.net/img/categories/food/asian.png</href>
          <refreshInterval>0.0</refreshInterval>
          <viewRefreshTime>0.0</viewRefreshTime>
          <viewBoundScale>0.0</viewBoundScale>
        </Icon>
      </IconStyle>
    </Style>
    <Style id="place_home">
      <IconStyle>
        <scale>1.0</scale>
        <heading>0.0</heading>
        <Icon>
          <href>http://ss1.4sqi.net/img/categories/building/home.png</href>
          <refreshInterval>0.0</refreshInterval>
          <viewRefreshTime>0.0</viewRefreshTime>
          <viewBoundScale>0.0</viewBoundScale>
        </Icon>
      </IconStyle>
    </Style>
    <Style id="place_Baseball Stadium">
      <IconStyle>
        <scale>1.0</scale>
        <heading>0.0</heading>
        <Icon>
          <href>https://ss1.4sqi.net/img/categories/arts_entertainment/stadium_baseball.png</href>
          <refreshInterval>0.0</refreshInterval>
          <viewRefreshTime>0.0</viewRefreshTime>
          <viewBoundScale>0.0</viewBoundScale>
        </Icon>
      </IconStyle>
    </Style>
    <Style id="place_Drugstore / Pharmacy">
      <IconStyle>
        <scale>1.0</scale>
        <heading>0.0</heading>
        <Icon>
          <href>https://ss1.4sqi.net/img/categories/shops/drugstore.png</href>
          <refreshInterval>0.0</refreshInterval>
          <viewRefreshTime>0.0</viewRefreshTime>
          <viewBoundScale>0.0</viewBoundScale>
        </Icon>
      </IconStyle>
    </Style>
    <Style id="place_Office">
      <IconStyle>
        <scale>1.0</scale>
        <heading>0.0</heading>
        <Icon>
          <href>https://ss1.4sqi.net/img/categories/building/default.png</href>
          <refreshInterval>0.0</refreshInterval>
          <viewRefreshTime>0.0</viewRefreshTime>
          <viewBoundScale>0.0</viewBoundScale>
        </Icon>
      </IconStyle>
    </Style>
    <Style id="place_New American Restaurant">
      <IconStyle>
        <scale>1.0</scale>
        <heading>0.0</heading>
        <Icon>
          <href>https://ss1.4sqi.net/img/categories/food/default.png</href>
          <refreshInterval>0.0</refreshInterval>
          <viewRefreshTime>0.0</viewRefreshTime>
          <viewBoundScale>0.0</viewBoundScale>
        </Icon>
      </IconStyle>
    </Style>
    <Style id="place_Subway">
      <IconStyle>
        <scale>1.0</scale>
        <heading>0.0</heading>
        <Icon>
          <href>https://ss1.4sqi.net/img/categories/travel/subway.png</href>
          <refreshInterval>0.0</refreshInterval>
          <viewRefreshTime>0.0</viewRefreshTime>
          <viewBoundScale>0.0</viewBoundScale>
        </Icon>
      </IconStyle>
    </Style>
    <Style id="place_Lounge">
      <IconStyle>
        <scale>1.0</scale>
        <heading>0.0</heading>
        <Icon>
          <href>https://ss1.4sqi.net/img/categories/nightlife/lounge.png</href>
          <refreshInterval>0.0</refreshInterval>
          <viewRefreshTime>0.0</viewRefreshTime>
          <viewBoundScale>0.0</viewBoundScale>
        </Icon>
      </IconStyle>
    </Style>
    <Style id="place_Bus Station">
      <IconStyle>
        <scale>1.0</scale>
        <heading>0.0</heading>
        <Icon>
          <href>https://ss1.4sqi.net/img/categories/travel/busstation.png</href>
          <refreshInterval>0.0</refreshInterval>
          <viewRefreshTime>0.0</viewRefreshTime>
          <viewBoundScale>0.0</viewBoundScale>
        </Icon>
      </IconStyle>
    </Style>
    <Style id="place_Student Center">
      <IconStyle>
        <scale>1.0</scale>
        <heading>0.0</heading>
        <Icon>
          <href>https://ss1.4sqi.net/img/categories/education/default.png</href>
          <refreshInterval>0.0</refreshInterval>
          <viewRefreshTime>0.0</viewRefreshTime>
          <viewBoundScale>0.0</viewBoundScale>
        </Icon>
      </IconStyle>
    </Style>
    <Style id="place_Bagel Shop">
      <IconStyle>
        <scale>1.0</scale>
        <heading>0.0</heading>
        <Icon>
          <href>https://ss1.4sqi.net/img/categories/food/bagels.png</href>
          <refreshInterval>0.0</refreshInterval>
          <viewRefreshTime>0.0</viewRefreshTime>
          <viewBoundScale>0.0</viewBoundScale>
        </Icon>
      </IconStyle>
    </Style>
    <Style id="place_Print Shop">
      <IconStyle>
        <scale>1.0</scale>
        <heading>0.0</heading>
        <Icon>
          <href>https://ss1.4sqi.net/img/categories/shops/default.png</href>
          <refreshInterval>0.0</refreshInterval>
          <viewRefreshTime>0.0</viewRefreshTime>
          <viewBoundScale>0.0</viewBoundScale>
        </Icon>
      </IconStyle>
    </Style>
    <Style id="place_Park">
      <IconStyle>
        <scale>1.0</scale>
        <heading>0.0</heading>
        <Icon>
          <href>https://ss1.4sqi.net/img/categories/parks_outdoors/default.png</href>
          <refreshInterval>0.0</refreshInterval>
          <viewRefreshTime>0.0</viewRefreshTime>
          <viewBoundScale>0.0</viewBoundScale>
        </Icon>
      </IconStyle>
    </Style>
    <Style id="place_Burger Joint">
      <IconStyle>
        <scale>1.0</scale>
        <heading>0.0</heading>
        <Icon>
          <href>https://ss1.4sqi.net/img/categories/food/burger.png</href>
          <refreshInterval>0.0</refreshInterval>
          <viewRefreshTime>0.0</viewRefreshTime>
          <viewBoundScale>0.0</viewBoundScale>
        </Icon>
      </IconStyle>
    </Style>
    <Folder>
      <name><![CDATA[12/1/13]]></name>
      <Placemark id="1385918964000">
        <name><![CDATA[945 S Batavia Ave]]></name>
        <atom:link href="http://foursquare.com/venue/4f629428e4b075c7117d49d3"/>
        <description><![CDATA[<p>12/1/13<br/> 12:29 PM to 1:02 PM<br/> 33 min</p> <p> <a href="http://foursquare.com/venue/4f629428e4b075c7117d49d3">More details (Foursquare)</a> </p>]]></description>
        <TimeSpan>
          <begin>2013-12-01T12:29:25-05:00</begin>
          <end>2013-12-01T13:02:34-05:00</end>
        </TimeSpan>
        <styleUrl>#place_foursquare</styleUrl>
        <Point>
          <coordinates>-88.30935165928999,41.87250621617115</coordinates>
        </Point>
      </Placemark>
      <Placemark id="1385921605000">
        <name><![CDATA[Wildwood]]></name>
        <atom:link href="http://foursquare.com/venue/4af254bcf964a52071e721e3"/>
        <description><![CDATA[<p>12/1/13<br/> 1:13 PM to 2:20 PM<br/> 1:06 hours</p> <p>American Restaurant<br/> <a href="http://foursquare.com/venue/4af254bcf964a52071e721e3">More details (Foursquare)</a> </p>]]></description>
        <TimeSpan>
          <begin>2013-12-01T13:13:26-05:00</begin>
          <end>2013-12-01T14:20:00-05:00</end>
        </TimeSpan>
        <styleUrl>#place_American Restaurant</styleUrl>
        <Point>
          <coordinates>-88.30879211425781,41.88296963158768</coordinates>
        </Point>
      </Placemark>
      <Placemark id="1385926328000">
        <name><![CDATA[945 S Batavia Ave]]></name>
        <atom:link href="http://foursquare.com/venue/4f629428e4b075c7117d49d3"/>
        <description><![CDATA[<p>12/1/13<br/> 2:32 PM to 2:43 PM<br/> 11 min</p> <p> <a href="http://foursquare.com/venue/4f629428e4b075c7117d49d3">More details (Foursquare)</a> </p>]]></description>
        <TimeSpan>
          <begin>2013-12-01T14:32:09-05:00</begin>
          <end>2013-12-01T14:43:26-05:00</end>
        </TimeSpan>
        <styleUrl>#place_foursquare</styleUrl>
        <Point>
          <coordinates>-88.30935165928999,41.87250621617115</coordinates>
        </Point>
      </Placemark>
      <Placemark id="1385927507000">
        <name><![CDATA[Walmart]]></name>
        <atom:link href="http://foursquare.com/venue/4b672d70f964a5209d3f2be3"/>
        <description><![CDATA[<p>12/1/13<br/> 2:51 PM to 3:36 PM<br/> 44 min</p> <p> <a href="http://foursquare.com/venue/4b672d70f964a5209d3f2be3">More details (Foursquare)</a> </p>]]></description>
        <TimeSpan>
          <begin>2013-12-01T14:51:48-05:00</begin>
          <end>2013-12-01T15:36:01-05:00</end>
        </TimeSpan>
        <styleUrl>#place_foursquare</styleUrl>
        <Point>
          <coordinates>-88.34608554840088,41.86278545510927</coordinates>
        </Point>
      </Placemark>
      <Placemark id="1385930671000">
        <name><![CDATA[945 S Batavia Ave]]></name>
        <atom:link href="http://foursquare.com/venue/4f629428e4b075c7117d49d3"/>
        <description><![CDATA[<p>12/1/13<br/> 3:44 PM to 5:27 PM<br/> 1:43 hours</p> <p> <a href="http://foursquare.com/venue/4f629428e4b075c7117d49d3">More details (Foursquare)</a> </p>]]></description>
        <TimeSpan>
          <begin>2013-12-01T15:44:32-05:00</begin>
          <end>2013-12-01T17:27:53-05:00</end>
        </TimeSpan>
        <styleUrl>#place_foursquare</styleUrl>
        <Point>
          <coordinates>-88.30935165928999,41.87250621617115</coordinates>
        </Point>
      </Placemark>
      <Placemark id="1385936991000">
        <name><![CDATA[Metra - Geneva Station]]></name>
        <atom:link href="http://foursquare.com/venue/4b33b685f964a5208c1d25e3"/>
        <description><![CDATA[<p>12/1/13<br/> 5:29 PM to 5:40 PM<br/> 11 min</p> <p> <a href="http://foursquare.com/venue/4b33b685f964a5208c1d25e3">More details (Foursquare)</a> </p>]]></description>
        <TimeSpan>
          <begin>2013-12-01T17:29:52-05:00</begin>
          <end>2013-12-01T17:40:52-05:00</end>
        </TimeSpan>
        <styleUrl>#place_foursquare</styleUrl>
        <Point>
          <coordinates>-88.30999374389648,41.8816436553268</coordinates>
        </Point>
      </Placemark>
      <Placemark id="1385943002000">
        <name><![CDATA[Chicago Union Station]]></name>
        <atom:link href="http://foursquare.com/venue/45840daef964a520923f1fe3"/>
        <description><![CDATA[<p>12/1/13<br/> 7:10 PM to 7:13 PM<br/> 3 min</p> <p> <a href="http://foursquare.com/venue/45840daef964a520923f1fe3">More details (Foursquare)</a> </p>]]></description>
        <TimeSpan>
          <begin>2013-12-01T19:10:03-05:00</begin>
          <end>2013-12-01T19:13:35-05:00</end>
        </TimeSpan>
        <styleUrl>#place_foursquare</styleUrl>
        <Point>
          <coordinates>-87.63901233673096,41.87860419025647</coordinates>
        </Point>
      </Placemark>
      <Placemark id="1385944223000">
        <name><![CDATA[Ogilvie Transportation Center]]></name>
        <atom:link href="http://foursquare.com/venue/4a730e62f964a5207cdb1fe3"/>
        <description><![CDATA[<p>12/1/13<br/> 7:30 PM to 7:39 PM<br/> 9 min</p> <p> <a href="http://foursquare.com/venue/4a730e62f964a5207cdb1fe3">More details (Foursquare)</a> </p>]]></description>
        <TimeSpan>
          <begin>2013-12-01T19:30:24-05:00</begin>
          <end>2013-12-01T19:39:35-05:00</end>
        </TimeSpan>
        <styleUrl>#place_foursquare</styleUrl>
        <Point>
          <coordinates>-87.64051973819733,41.88384028778092</coordinates>
        </Point>
      </Placemark>
      <Placemark id="1385950032000">
        <name><![CDATA[945 S Batavia Ave]]></name>
        <atom:link href="http://foursquare.com/venue/4f629428e4b075c7117d49d3"/>
        <description><![CDATA[<p>12/1/13<br/> 9:07 PM to 12:00 AM<br/> 2:52 hours</p> <p> <a href="http://foursquare.com/venue/4f629428e4b075c7117d49d3">More details (Foursquare)</a> </p>]]></description>
        <TimeSpan>
          <begin>2013-12-01T21:07:13-05:00</begin>
          <end>2013-12-01T23:59:59-05:00</end>
        </TimeSpan>
        <styleUrl>#place_foursquare</styleUrl>
        <Point>
          <coordinates>-88.30935165928999,41.87250621617115</coordinates>
        </Point>
      </Placemark>
    </Folder>
    <Folder>
      <name><![CDATA[12/2/13]]></name>
      <Placemark id="1385960400000">
        <name><![CDATA[945 S Batavia Ave]]></name>
        <atom:link href="http://foursquare.com/venue/4f629428e4b075c7117d49d3"/>
        <description><![CDATA[<p>12/2/13<br/> 12:00 AM to 12:00 AM<br/> 24:00 hours</p> <p> <a href="http://foursquare.com/venue/4f629428e4b075c7117d49d3">More details (Foursquare)</a> </p>]]></description>
        <TimeSpan>
          <begin>2013-12-02T00:00:01-05:00</begin>
          <end>2013-12-02T23:59:59-05:00</end>
        </TimeSpan>
        <styleUrl>#place_foursquare</styleUrl>
        <Point>
          <coordinates>-88.30935165928999,41.87250621617115</coordinates>
        </Point>
      </Placemark>
    </Folder>
    <Folder>
      <name><![CDATA[12/3/13]]></name>
      <Placemark id="1386046800000">
        <name><![CDATA[945 S Batavia Ave]]></name>
        <atom:link href="http://foursquare.com/venue/4f629428e4b075c7117d49d3"/>
        <description><![CDATA[<p>12/3/13<br/> 12:00 AM to 1:56 PM<br/> 13:56 hours</p> <p> <a href="http://foursquare.com/venue/4f629428e4b075c7117d49d3">More details (Foursquare)</a> </p>]]></description>
        <TimeSpan>
          <begin>2013-12-03T00:00:01-05:00</begin>
          <end>2013-12-03T13:56:02-05:00</end>
        </TimeSpan>
        <styleUrl>#place_foursquare</styleUrl>
        <Point>
          <coordinates>-88.30935165928999,41.87250621617115</coordinates>
        </Point>
      </Placemark>
      <Placemark id="1386097519000">
        <name><![CDATA[945 S Batavia Ave]]></name>
        <atom:link href="http://foursquare.com/venue/4f629428e4b075c7117d49d3"/>
        <description><![CDATA[<p>12/3/13<br/> 2:05 PM to 2:26 PM<br/> 21 min</p> <p> <a href="http://foursquare.com/venue/4f629428e4b075c7117d49d3">More details (Foursquare)</a> </p>]]></description>
        <TimeSpan>
          <begin>2013-12-03T14:05:20-05:00</begin>
          <end>2013-12-03T14:26:29-05:00</end>
        </TimeSpan>
        <styleUrl>#place_foursquare</styleUrl>
        <Point>
          <coordinates>-88.30935165928999,41.87250621617115</coordinates>
        </Point>
      </Placemark>
      <Placemark id="1386098920000">
        <name><![CDATA[All Chocolate Kitchen]]></name>
        <atom:link href="http://foursquare.com/venue/4e0101b8ae609fa8ede130bd"/>
        <description><![CDATA[<p>12/3/13<br/> 2:28 PM to 3:01 PM<br/> 32 min</p> <p> <a href="http://foursquare.com/venue/4e0101b8ae609fa8ede130bd">More details (Foursquare)</a> </p>]]></description>
        <TimeSpan>
          <begin>2013-12-03T14:28:41-05:00</begin>
          <end>2013-12-03T15:01:34-05:00</end>
        </TimeSpan>
        <styleUrl>#place_foursquare</styleUrl>
        <Point>
          <coordinates>-88.30787845,41.88701828333333</coordinates>
        </Point>
      </Placemark>
      <Placemark id="1386101024000">
        <name><![CDATA[945 S Batavia Ave]]></name>
        <atom:link href="http://foursquare.com/venue/4f629428e4b075c7117d49d3"/>
        <description><![CDATA[<p>12/3/13<br/> 3:03 PM to 8:42 PM<br/> 5:38 hours</p> <p> <a href="http://foursquare.com/venue/4f629428e4b075c7117d49d3">More details (Foursquare)</a> </p>]]></description>
        <TimeSpan>
          <begin>2013-12-03T15:03:45-05:00</begin>
          <end>2013-12-03T20:42:19-05:00</end>
        </TimeSpan>
        <styleUrl>#place_foursquare</styleUrl>
        <Point>
          <coordinates>-88.30935165928999,41.87250621617115</coordinates>
        </Point>
      </Placemark>
      <Placemark id="1386121868000">
        <name><![CDATA[945 S Batavia Ave]]></name>
        <atom:link href="http://foursquare.com/venue/4f629428e4b075c7117d49d3"/>
        <description><![CDATA[<p>12/3/13<br/> 8:51 PM to 12:00 AM<br/> 3:08 hours</p> <p> <a href="http://foursquare.com/venue/4f629428e4b075c7117d49d3">More details (Foursquare)</a> </p>]]></description>
        <TimeSpan>
          <begin>2013-12-03T20:51:09-05:00</begin>
          <end>2013-12-03T23:59:59-05:00</end>
        </TimeSpan>
        <styleUrl>#place_foursquare</styleUrl>
        <Point>
          <coordinates>-88.30935165928999,41.87250621617115</coordinates>
        </Point>
      </Placemark>
    </Folder>
    <Folder>
      <name><![CDATA[12/4/13]]></name>
      <Placemark id="1386133200000">
        <name><![CDATA[945 S Batavia Ave]]></name>
        <atom:link href="http://foursquare.com/venue/4f629428e4b075c7117d49d3"/>
        <description><![CDATA[<p>12/4/13<br/> 12:00 AM to 12:48 PM<br/> 12:48 hours</p> <p> <a href="http://foursquare.com/venue/4f629428e4b075c7117d49d3">More details (Foursquare)</a> </p>]]></description>
        <TimeSpan>
          <begin>2013-12-04T00:00:01-05:00</begin>
          <end>2013-12-04T12:48:12-05:00</end>
        </TimeSpan>
        <styleUrl>#place_foursquare</styleUrl>
        <Point>
          <coordinates>-88.30935165928999,41.87250621617115</coordinates>
        </Point>
      </Placemark>
      <Placemark id="1386182302000">
        <name><![CDATA[Place in O'Hare International Airport]]></name>
        <description><![CDATA[<p>12/4/13<br/> 1:38 PM to 1:47 PM<br/> 8 min</p>]]></description>
        <TimeSpan>
          <begin>2013-12-04T13:38:23-05:00</begin>
          <end>2013-12-04T13:47:17-05:00</end>
        </TimeSpan>
        <styleUrl>#place_unknown</styleUrl>
        <Point>
          <coordinates>-87.899172412,41.9772196045</coordinates>
        </Point>
      </Placemark>
      <Placemark id="1386182994000">
        <name><![CDATA[Chicago O'Hare International Airport (ORD)]]></name>
        <atom:link href="http://foursquare.com/venue/4a5a77a4f964a52062ba1fe3"/>
        <description><![CDATA[<p>12/4/13<br/> 1:49 PM to 3:26 PM<br/> 1:36 hours</p> <p> <a href="http://foursquare.com/venue/4a5a77a4f964a52062ba1fe3">More details (Foursquare)</a> </p>]]></description>
        <TimeSpan>
          <begin>2013-12-04T13:49:55-05:00</begin>
          <end>2013-12-04T15:26:38-05:00</end>
        </TimeSpan>
        <styleUrl>#place_foursquare</styleUrl>
        <Point>
          <coordinates>-87.90440082550049,41.97727092004163</coordinates>
        </Point>
      </Placemark>
      <Placemark id="1386195184000">
        <name><![CDATA[Boston Logan International Airport (BOS)]]></name>
        <atom:link href="http://foursquare.com/venue/452113b6f964a520bc3a1fe3"/>
        <description><![CDATA[<p>12/4/13<br/> 5:13 PM to 5:39 PM<br/> 26 min</p> <p>Airport<br/> <a href="http://foursquare.com/venue/452113b6f964a520bc3a1fe3">More details (Foursquare)</a> </p>]]></description>
        <TimeSpan>
          <begin>2013-12-04T17:13:05-05:00</begin>
          <end>2013-12-04T17:39:32-05:00</end>
        </TimeSpan>
        <styleUrl>#place_Airport</styleUrl>
        <Point>
          <coordinates>-71.01667642593384,42.36650312404415</coordinates>
        </Point>
      </Placemark>
      <Placemark id="1386199344000">
        <name><![CDATA[Broadway Marketplace]]></name>
        <atom:link href="http://foursquare.com/venue/4a661612f964a520ffc71fe3"/>
        <description><![CDATA[<p>12/4/13<br/> 6:22 PM to 6:26 PM<br/> 4 min</p> <p>Grocery Store<br/> <a href="http://foursquare.com/venue/4a661612f964a520ffc71fe3">More details (Foursquare)</a> </p>]]></description>
        <TimeSpan>
          <begin>2013-12-04T18:22:25-05:00</begin>
          <end>2013-12-04T18:26:43-05:00</end>
        </TimeSpan>
        <styleUrl>#place_Grocery Store</styleUrl>
        <Point>
          <coordinates>-71.11300484548056,42.37405171427381</coordinates>
        </Point>
      </Placemark>
      <Placemark id="1386200040000">
        <name><![CDATA[Home]]></name>
        <description><![CDATA[<p>12/4/13<br/> 6:34 PM to 12:00 AM<br/> 5:26 hours</p>]]></description>
        <TimeSpan>
          <begin>2013-12-04T18:34:01-05:00</begin>
          <end>2013-12-04T23:59:59-05:00</end>
        </TimeSpan>
        <styleUrl>#place_home</styleUrl>
        <Point>
          <coordinates>-71.1114458017,42.3754311174</coordinates>
        </Point>
      </Placemark>
    </Folder>
    <Folder>
      <name><![CDATA[12/5/13]]></name>
      <Placemark id="1386219600000">
        <name><![CDATA[Home]]></name>
        <description><![CDATA[<p>12/5/13<br/> 12:00 AM to 9:51 AM<br/> 9:51 hours</p>]]></description>
        <TimeSpan>
          <begin>2013-12-05T00:00:01-05:00</begin>
          <end>2013-12-05T09:51:02-05:00</end>
        </TimeSpan>
        <styleUrl>#place_home</styleUrl>
        <Point>
          <coordinates>-71.1114458017,42.3754311174</coordinates>
        </Point>
      </Placemark>
      <Placemark id="1386255828000">
        <name><![CDATA[Proximate]]></name>
        <atom:link href="http://foursquare.com/venue/51c8c0d1498e5d4d09a48362"/>
        <description><![CDATA[<p>12/5/13<br/> 10:03 AM to 10:38 AM<br/> 34 min</p> <p>Tech Startup<br/> <a href="http://foursquare.com/venue/51c8c0d1498e5d4d09a48362">More details (Foursquare)</a> </p>]]></description>
        <TimeSpan>
          <begin>2013-12-05T10:03:49-05:00</begin>
          <end>2013-12-05T10:38:00-05:00</end>
        </TimeSpan>
        <styleUrl>#place_Tech Startup</styleUrl>
        <Point>
          <coordinates>-71.117205,42.378716</coordinates>
        </Point>
      </Placemark>
      <Placemark id="1386258715000">
        <name><![CDATA[Harvard Alumni Association]]></name>
        <atom:link href="http://foursquare.com/venue/4b5dc68df964a520026b29e3"/>
        <description><![CDATA[<p>12/5/13<br/> 10:51 AM to 11:45 AM<br/> 53 min</p> <p>University<br/> <a href="http://foursquare.com/venue/4b5dc68df964a520026b29e3">More details (Foursquare)</a> </p>]]></description>
        <TimeSpan>
          <begin>2013-12-05T10:51:56-05:00</begin>
          <end>2013-12-05T11:45:44-05:00</end>
        </TimeSpan>
        <styleUrl>#place_University</styleUrl>
        <Point>
          <coordinates>-71.12325225275964,42.37317592010315</coordinates>
        </Point>
      </Placemark>
      <Placemark id="1386262293000">
        <name><![CDATA[Border Cafe]]></name>
        <atom:link href="http://foursquare.com/venue/3fd66200f964a520bded1ee3"/>
        <description><![CDATA[<p>12/5/13<br/> 11:51 AM to 12:38 PM<br/> 46 min</p> <p>Mexican Restaurant<br/> <a href="http://foursquare.com/venue/3fd66200f964a520bded1ee3">More details (Foursquare)</a> </p>]]></description>
        <TimeSpan>
          <begin>2013-12-05T11:51:34-05:00</begin>
          <end>2013-12-05T12:38:05-05:00</end>
        </TimeSpan>
        <styleUrl>#place_Mexican Restaurant</styleUrl>
        <Point>
          <coordinates>-71.120141,42.3743468</coordinates>
        </Point>
      </Placemark>
      <Placemark id="1386265635000">
        <name><![CDATA[Proximate]]></name>
        <atom:link href="http://foursquare.com/venue/51c8c0d1498e5d4d09a48362"/>
        <description><![CDATA[<p>12/5/13<br/> 12:47 PM to 4:12 PM<br/> 3:25 hours</p> <p>Tech Startup<br/> <a href="http://foursquare.com/venue/51c8c0d1498e5d4d09a48362">More details (Foursquare)</a> </p>]]></description>
        <TimeSpan>
          <begin>2013-12-05T12:47:16-05:00</begin>
          <end>2013-12-05T16:12:29-05:00</end>
        </TimeSpan>
        <styleUrl>#place_Tech Startup</styleUrl>
        <Point>
          <coordinates>-71.117205,42.378716</coordinates>
        </Point>
      </Placemark>
      <Placemark id="1386279187000">
        <name><![CDATA[Spangler Center]]></name>
        <atom:link href="http://foursquare.com/venue/4aeee0b0f964a52081d421e3"/>
        <description><![CDATA[<p>12/5/13<br/> 4:33 PM to 5:02 PM<br/> 29 min</p> <p>Student Center<br/> <a href="http://foursquare.com/venue/4aeee0b0f964a52081d421e3">More details (Foursquare)</a> </p>]]></description>
        <TimeSpan>
          <begin>2013-12-05T16:33:08-05:00</begin>
          <end>2013-12-05T17:02:42-05:00</end>
        </TimeSpan>
        <styleUrl>#place_Student Center</styleUrl>
        <Point>
          <coordinates>-71.12218458495514,42.36522543920124</coordinates>
        </Point>
      </Placemark>
      <Placemark id="1386281810000">
        <name><![CDATA[Experiment Fund]]></name>
        <description><![CDATA[<p>12/5/13<br/> 5:16 PM to 8:30 PM<br/> 3:13 hours</p>]]></description>
        <TimeSpan>
          <begin>2013-12-05T17:16:51-05:00</begin>
          <end>2013-12-05T20:30:18-05:00</end>
        </TimeSpan>
        <styleUrl>#place_work</styleUrl>
        <Point>
          <coordinates>-71.11951231956482,42.37313766800413</coordinates>
        </Point>
      </Placemark>
      <Placemark id="1386293419000">
        <name><![CDATA[Finale Desserterie & Bakery]]></name>
        <atom:link href="http://foursquare.com/venue/4ac67e58f964a520a7b420e3"/>
        <description><![CDATA[<p>12/5/13<br/> 8:30 PM to 8:54 PM<br/> 23 min</p> <p>Dessert Shop<br/> <a href="http://foursquare.com/venue/4ac67e58f964a520a7b420e3">More details (Foursquare)</a> </p>]]></description>
        <TimeSpan>
          <begin>2013-12-05T20:30:20-05:00</begin>
          <end>2013-12-05T20:54:09-05:00</end>
        </TimeSpan>
        <styleUrl>#place_Dessert Shop</styleUrl>
        <Point>
          <coordinates>-71.119179,42.37233336999999</coordinates>
        </Point>
      </Placemark>
      <Placemark id="1386295515000">
        <name><![CDATA[Home]]></name>
        <description><![CDATA[<p>12/5/13<br/> 9:05 PM to 12:00 AM<br/> 2:54 hours</p>]]></description>
        <TimeSpan>
          <begin>2013-12-05T21:05:16-05:00</begin>
          <end>2013-12-05T23:59:59-05:00</end>
        </TimeSpan>
        <styleUrl>#place_home</styleUrl>
        <Point>
          <coordinates>-71.1114458017,42.3754311174</coordinates>
        </Point>
      </Placemark>
    </Folder>
    <Folder>
      <name><![CDATA[12/6/13]]></name>
      <Placemark id="1386306000000">
        <name><![CDATA[Home]]></name>
        <description><![CDATA[<p>12/6/13<br/> 12:00 AM to 9:24 AM<br/> 9:24 hours</p>]]></description>
        <TimeSpan>
          <begin>2013-12-06T00:00:01-05:00</begin>
          <end>2013-12-06T09:24:20-05:00</end>
        </TimeSpan>
        <styleUrl>#place_home</styleUrl>
        <Point>
          <coordinates>-71.1114458017,42.3754311174</coordinates>
        </Point>
      </Placemark>
      <Placemark id="1386341222000">
        <name><![CDATA[Darwin's Ltd.]]></name>
        <atom:link href="http://foursquare.com/venue/4a1c900cf964a520507b1fe3"/>
        <description><![CDATA[<p>12/6/13<br/> 9:47 AM to 10:34 AM<br/> 47 min</p> <p>Sandwich Place<br/> <a href="http://foursquare.com/venue/4a1c900cf964a520507b1fe3">More details (Foursquare)</a> </p>]]></description>
        <TimeSpan>
          <begin>2013-12-06T09:47:03-05:00</begin>
          <end>2013-12-06T10:34:53-05:00</end>
        </TimeSpan>
        <styleUrl>#place_Sandwich Place</styleUrl>
        <Point>
          <coordinates>-71.109389,42.37488104</coordinates>
        </Point>
      </Placemark>
      <Placemark id="1386346036000">
        <name><![CDATA[IDG Enterprise]]></name>
        <atom:link href="http://foursquare.com/venue/4c0d2be17189c928dd97d6b6"/>
        <description><![CDATA[<p>12/6/13<br/> 11:07 AM to 12:20 PM<br/> 1:12 hours</p> <p>Coworking Space<br/> <a href="http://foursquare.com/venue/4c0d2be17189c928dd97d6b6">More details (Foursquare)</a> </p>]]></description>
        <TimeSpan>
          <begin>2013-12-06T11:07:17-05:00</begin>
          <end>2013-12-06T12:20:11-05:00</end>
        </TimeSpan>
        <styleUrl>#place_Coworking Space</styleUrl>
        <Point>
          <coordinates>-71.39173529779059,42.31326824876494</coordinates>
        </Point>
      </Placemark>
      <Placemark id="1386353145000">
        <name><![CDATA[Home]]></name>
        <description><![CDATA[<p>12/6/13<br/> 1:05 PM to 6:16 PM<br/> 5:11 hours</p>]]></description>
        <TimeSpan>
          <begin>2013-12-06T13:05:46-05:00</begin>
          <end>2013-12-06T18:16:51-05:00</end>
        </TimeSpan>
        <styleUrl>#place_home</styleUrl>
        <Point>
          <coordinates>-71.1114458017,42.3754311174</coordinates>
        </Point>
      </Placemark>
      <Placemark id="1386372904000">
        <name><![CDATA[Place in East Cambridge]]></name>
        <description><![CDATA[<p>12/6/13<br/> 6:35 PM to 6:41 PM<br/> 6 min</p>]]></description>
        <TimeSpan>
          <begin>2013-12-06T18:35:05-05:00</begin>
          <end>2013-12-06T18:41:33-05:00</end>
        </TimeSpan>
        <styleUrl>#place_unknown</styleUrl>
        <Point>
          <coordinates>-71.084956498,42.3625140448</coordinates>
        </Point>
      </Placemark>
      <Placemark id="1386373989000">
        <name><![CDATA[Za Restaurant]]></name>
        <atom:link href="http://foursquare.com/venue/4b9181fff964a520b2c133e3"/>
        <description><![CDATA[<p>12/6/13<br/> 6:53 PM to 7:33 PM<br/> 40 min</p> <p> <a href="http://foursquare.com/venue/4b9181fff964a520b2c133e3">More details (Foursquare)</a> </p>]]></description>
        <TimeSpan>
          <begin>2013-12-06T18:53:10-05:00</begin>
          <end>2013-12-06T19:33:55-05:00</end>
        </TimeSpan>
        <styleUrl>#place_foursquare</styleUrl>
        <Point>
          <coordinates>-71.08354935061818,42.36330473140007</coordinates>
        </Point>
      </Placemark>
      <Placemark id="1386377662000">
        <name><![CDATA[Home]]></name>
        <description><![CDATA[<p>12/6/13<br/> 7:54 PM to 12:00 AM<br/> 4:05 hours</p>]]></description>
        <TimeSpan>
          <begin>2013-12-06T19:54:23-05:00</begin>
          <end>2013-12-06T23:59:59-05:00</end>
        </TimeSpan>
        <styleUrl>#place_home</styleUrl>
        <Point>
          <coordinates>-71.1114458017,42.3754311174</coordinates>
        </Point>
      </Placemark>
    </Folder>
    <Folder>
      <name><![CDATA[12/7/13]]></name>
      <Placemark id="1386392400000">
        <name><![CDATA[Home]]></name>
        <description><![CDATA[<p>12/7/13<br/> 12:00 AM to 10:27 AM<br/> 10:27 hours</p>]]></description>
        <TimeSpan>
          <begin>2013-12-07T00:00:01-05:00</begin>
          <end>2013-12-07T10:27:37-05:00</end>
        </TimeSpan>
        <styleUrl>#place_home</styleUrl>
        <Point>
          <coordinates>-71.1114458017,42.3754311174</coordinates>
        </Point>
      </Placemark>
      <Placemark id="1386430881000">
        <name><![CDATA[Experiment Fund]]></name>
        <description><![CDATA[<p>12/7/13<br/> 10:41 AM to 12:26 PM<br/> 1:45 hours</p>]]></description>
        <TimeSpan>
          <begin>2013-12-07T10:41:22-05:00</begin>
          <end>2013-12-07T12:26:23-05:00</end>
        </TimeSpan>
        <styleUrl>#place_work</styleUrl>
        <Point>
          <coordinates>-71.11951231956482,42.37313766800413</coordinates>
        </Point>
      </Placemark>
      <Placemark id="1386438061000">
        <name><![CDATA[Home]]></name>
        <description><![CDATA[<p>12/7/13<br/> 12:41 PM to 2:37 PM<br/> 1:56 hours</p>]]></description>
        <TimeSpan>
          <begin>2013-12-07T12:41:02-05:00</begin>
          <end>2013-12-07T14:37:17-05:00</end>
        </TimeSpan>
        <styleUrl>#place_home</styleUrl>
        <Point>
          <coordinates>-71.1114458017,42.3754311174</coordinates>
        </Point>
      </Placemark>
      <Placemark id="1386446121000">
        <name><![CDATA[Floyd's 99 Barbershop]]></name>
        <atom:link href="http://foursquare.com/venue/4a9d711ff964a520443820e3"/>
        <description><![CDATA[<p>12/7/13<br/> 2:55 PM to 3:34 PM<br/> 39 min</p> <p>Salon / Barbershop<br/> <a href="http://foursquare.com/venue/4a9d711ff964a520443820e3">More details (Foursquare)</a> </p>]]></description>
        <TimeSpan>
          <begin>2013-12-07T14:55:22-05:00</begin>
          <end>2013-12-07T15:34:56-05:00</end>
        </TimeSpan>
        <styleUrl>#place_Salon / Barbershop</styleUrl>
        <Point>
          <coordinates>-71.11979826,42.38213717937469</coordinates>
        </Point>
      </Placemark>
      <Placemark id="1386449865000">
        <name><![CDATA[Home]]></name>
        <description><![CDATA[<p>12/7/13<br/> 3:57 PM to 12:00 AM<br/> 8:02 hours</p>]]></description>
        <TimeSpan>
          <begin>2013-12-07T15:57:46-05:00</begin>
          <end>2013-12-07T23:59:59-05:00</end>
        </TimeSpan>
        <styleUrl>#place_home</styleUrl>
        <Point>
          <coordinates>-71.1114458017,42.3754311174</coordinates>
        </Point>
      </Placemark>
    </Folder>
    <Folder>
      <name><![CDATA[12/8/13]]></name>
      <Placemark id="1386478800000">
        <name><![CDATA[Home]]></name>
        <description><![CDATA[<p>12/8/13<br/> 12:00 AM to 11:27 AM<br/> 11:27 hours</p>]]></description>
        <TimeSpan>
          <begin>2013-12-08T00:00:01-05:00</begin>
          <end>2013-12-08T11:27:00-05:00</end>
        </TimeSpan>
        <styleUrl>#place_home</styleUrl>
        <Point>
          <coordinates>-71.1114458017,42.3754311174</coordinates>
        </Point>
      </Placemark>
      <Placemark id="1386520602000">
        <name><![CDATA[Place in Cambridge]]></name>
        <description><![CDATA[<p>12/8/13<br/> 11:36 AM to 12:27 PM<br/> 51 min</p>]]></description>
        <TimeSpan>
          <begin>2013-12-08T11:36:43-05:00</begin>
          <end>2013-12-08T12:27:48-05:00</end>
        </TimeSpan>
        <styleUrl>#place_unknown</styleUrl>
        <Point>
          <coordinates>-71.1043402003,42.3704831417</coordinates>
        </Point>
      </Placemark>
      <Placemark id="1386524911000">
        <name><![CDATA[Home]]></name>
        <description><![CDATA[<p>12/8/13<br/> 12:48 PM to 1:06 PM<br/> 18 min</p>]]></description>
        <TimeSpan>
          <begin>2013-12-08T12:48:32-05:00</begin>
          <end>2013-12-08T13:06:35-05:00</end>
        </TimeSpan>
        <styleUrl>#place_home</styleUrl>
        <Point>
          <coordinates>-71.1114458017,42.3754311174</coordinates>
        </Point>
      </Placemark>
      <Placemark id="1386526528000">
        <name><![CDATA[Home]]></name>
        <description><![CDATA[<p>12/8/13<br/> 1:15 PM to 12:00 AM<br/> 10:44 hours</p>]]></description>
        <TimeSpan>
          <begin>2013-12-08T13:15:29-05:00</begin>
          <end>2013-12-08T23:59:59-05:00</end>
        </TimeSpan>
        <styleUrl>#place_home</styleUrl>
        <Point>
          <coordinates>-71.1114458017,42.3754311174</coordinates>
        </Point>
      </Placemark>
    </Folder>
    <Folder>
      <name><![CDATA[12/9/13]]></name>
      <Placemark id="1386565200000">
        <name><![CDATA[Home]]></name>
        <description><![CDATA[<p>12/9/13<br/> 12:00 AM to 7:57 AM<br/> 7:57 hours</p>]]></description>
        <TimeSpan>
          <begin>2013-12-09T00:00:01-05:00</begin>
          <end>2013-12-09T07:57:14-05:00</end>
        </TimeSpan>
        <styleUrl>#place_home</styleUrl>
        <Point>
          <coordinates>-71.1114458017,42.3754311174</coordinates>
        </Point>
      </Placemark>
      <Placemark id="1386595582000">
        <name><![CDATA[Microsoft New England Research & Development Center]]></name>
        <atom:link href="http://foursquare.com/venue/4aba1dd3f964a520658020e3"/>
        <description><![CDATA[<p>12/9/13<br/> 8:26 AM to 10:14 AM<br/> 1:47 hours</p> <p> <a href="http://foursquare.com/venue/4aba1dd3f964a520658020e3">More details (Foursquare)</a> </p>]]></description>
        <TimeSpan>
          <begin>2013-12-09T08:26:23-05:00</begin>
          <end>2013-12-09T10:14:20-05:00</end>
        </TimeSpan>
        <styleUrl>#place_foursquare</styleUrl>
        <Point>
          <coordinates>-71.08101918844292,42.36139978759076</coordinates>
        </Point>
      </Placemark>
      <Placemark id="1386603605000">
        <name><![CDATA[Harvard Alumni Association]]></name>
        <atom:link href="http://foursquare.com/venue/4b5dc68df964a520026b29e3"/>
        <description><![CDATA[<p>12/9/13<br/> 10:40 AM to 11:40 AM<br/> 1:00 hours</p> <p>University<br/> <a href="http://foursquare.com/venue/4b5dc68df964a520026b29e3">More details (Foursquare)</a> </p>]]></description>
        <TimeSpan>
          <begin>2013-12-09T10:40:06-05:00</begin>
          <end>2013-12-09T11:40:58-05:00</end>
        </TimeSpan>
        <styleUrl>#place_University</styleUrl>
        <Point>
          <coordinates>-71.12325225275964,42.37317592010315</coordinates>
        </Point>
      </Placemark>
      <Placemark id="1386608262000">
        <name><![CDATA[Home]]></name>
        <description><![CDATA[<p>12/9/13<br/> 11:57 AM to 11:58 AM<br/> 1 min</p>]]></description>
        <TimeSpan>
          <begin>2013-12-09T11:57:43-05:00</begin>
          <end>2013-12-09T11:58:21-05:00</end>
        </TimeSpan>
        <styleUrl>#place_home</styleUrl>
        <Point>
          <coordinates>-71.1114458017,42.3754311174</coordinates>
        </Point>
      </Placemark>
      <Placemark id="1386623076000">
        <name><![CDATA[Experiment Fund]]></name>
        <description><![CDATA[<p>12/9/13<br/> 4:04 PM to 5:23 PM<br/> 1:18 hours</p>]]></description>
        <TimeSpan>
          <begin>2013-12-09T16:04:37-05:00</begin>
          <end>2013-12-09T17:23:02-05:00</end>
        </TimeSpan>
        <styleUrl>#place_work</styleUrl>
        <Point>
          <coordinates>-71.11951231956482,42.37313766800413</coordinates>
        </Point>
      </Placemark>
      <Placemark id="1386628671000">
        <name><![CDATA[Harvard Innovation Lab]]></name>
        <atom:link href="http://foursquare.com/venue/4e5d4676ae60839ea2e29e64"/>
        <description><![CDATA[<p>12/9/13<br/> 5:37 PM to 7:25 PM<br/> 1:47 hours</p> <p>College Technology Building<br/> <a href="http://foursquare.com/venue/4e5d4676ae60839ea2e29e64">More details (Foursquare)</a> </p>]]></description>
        <TimeSpan>
          <begin>2013-12-09T17:37:52-05:00</begin>
          <end>2013-12-09T19:25:06-05:00</end>
        </TimeSpan>
        <styleUrl>#place_College Technology Building</styleUrl>
        <Point>
          <coordinates>-71.12407621183526,42.36403242532342</coordinates>
        </Point>
      </Placemark>
      <Placemark id="1386635529000">
        <name><![CDATA[Experiment Fund]]></name>
        <description><![CDATA[<p>12/9/13<br/> 7:32 PM to 7:35 PM<br/> 2 min</p>]]></description>
        <TimeSpan>
          <begin>2013-12-09T19:32:10-05:00</begin>
          <end>2013-12-09T19:35:06-05:00</end>
        </TimeSpan>
        <styleUrl>#place_work</styleUrl>
        <Point>
          <coordinates>-71.11951231956482,42.37313766800413</coordinates>
        </Point>
      </Placemark>
      <Placemark id="1386636369000">
        <name><![CDATA[Home]]></name>
        <description><![CDATA[<p>12/9/13<br/> 7:46 PM to 9:38 PM<br/> 1:52 hours</p>]]></description>
        <TimeSpan>
          <begin>2013-12-09T19:46:10-05:00</begin>
          <end>2013-12-09T21:38:22-05:00</end>
        </TimeSpan>
        <styleUrl>#place_home</styleUrl>
        <Point>
          <coordinates>-71.1114458017,42.3754311174</coordinates>
        </Point>
      </Placemark>
      <Placemark id="1386644152000">
        <name><![CDATA[Back Bay Social Club]]></name>
        <atom:link href="http://foursquare.com/venue/4c4e2095fb742d7f9bcace2d"/>
        <description><![CDATA[<p>12/9/13<br/> 9:55 PM to 12:00 AM<br/> 2:04 hours</p> <p>American Restaurant<br/> <a href="http://foursquare.com/venue/4c4e2095fb742d7f9bcace2d">More details (Foursquare)</a> </p>]]></description>
        <TimeSpan>
          <begin>2013-12-09T21:55:53-05:00</begin>
          <end>2013-12-09T23:59:59-05:00</end>
        </TimeSpan>
        <styleUrl>#place_American Restaurant</styleUrl>
        <Point>
          <coordinates>-71.08320116409787,42.34839803194278</coordinates>
        </Point>
      </Placemark>
    </Folder>
    <Folder>
      <name><![CDATA[12/10/13]]></name>
      <Placemark id="1386651600000">
        <name><![CDATA[Back Bay Social Club]]></name>
        <atom:link href="http://foursquare.com/venue/4c4e2095fb742d7f9bcace2d"/>
        <description><![CDATA[<p>12/10/13<br/> 12:00 AM to 12:03 AM<br/> 3 min</p> <p>American Restaurant<br/> <a href="http://foursquare.com/venue/4c4e2095fb742d7f9bcace2d">More details (Foursquare)</a> </p>]]></description>
        <TimeSpan>
          <begin>2013-12-10T00:00:01-05:00</begin>
          <end>2013-12-10T00:03:06-05:00</end>
        </TimeSpan>
        <styleUrl>#place_American Restaurant</styleUrl>
        <Point>
          <coordinates>-71.08320116409787,42.34839803194278</coordinates>
        </Point>
      </Placemark>
      <Placemark id="1386652894000">
        <name><![CDATA[Home]]></name>
        <description><![CDATA[<p>12/10/13<br/> 12:21 AM to 7:56 PM<br/> 19:34 hours</p>]]></description>
        <TimeSpan>
          <begin>2013-12-10T00:21:35-05:00</begin>
          <end>2013-12-10T19:56:14-05:00</end>
        </TimeSpan>
        <styleUrl>#place_home</styleUrl>
        <Point>
          <coordinates>-71.1114458017,42.3754311174</coordinates>
        </Point>
      </Placemark>
      <Placemark id="1386723721000">
        <name><![CDATA[Broadway Marketplace]]></name>
        <atom:link href="http://foursquare.com/venue/4a661612f964a520ffc71fe3"/>
        <description><![CDATA[<p>12/10/13<br/> 8:02 PM to 8:15 PM<br/> 13 min</p> <p>Grocery Store<br/> <a href="http://foursquare.com/venue/4a661612f964a520ffc71fe3">More details (Foursquare)</a> </p>]]></description>
        <TimeSpan>
          <begin>2013-12-10T20:02:02-05:00</begin>
          <end>2013-12-10T20:15:23-05:00</end>
        </TimeSpan>
        <styleUrl>#place_Grocery Store</styleUrl>
        <Point>
          <coordinates>-71.11300484548056,42.37405171427381</coordinates>
        </Point>
      </Placemark>
      <Placemark id="1386724970000">
        <name><![CDATA[Home]]></name>
        <description><![CDATA[<p>12/10/13<br/> 8:22 PM to 11:23 PM<br/> 3:00 hours</p>]]></description>
        <TimeSpan>
          <begin>2013-12-10T20:22:51-05:00</begin>
          <end>2013-12-10T23:23:41-05:00</end>
        </TimeSpan>
        <styleUrl>#place_home</styleUrl>
        <Point>
          <coordinates>-71.1114458017,42.3754311174</coordinates>
        </Point>
      </Placemark>
    </Folder>
    <Folder>
      <name><![CDATA[12/11/13]]></name>
      <Placemark id="1386777859000">
        <name><![CDATA[Border Cafe]]></name>
        <atom:link href="http://foursquare.com/venue/3fd66200f964a520bded1ee3"/>
        <description><![CDATA[<p>12/11/13<br/> 11:04 AM to 12:31 PM<br/> 1:27 hours</p> <p>Mexican Restaurant<br/> <a href="http://foursquare.com/venue/3fd66200f964a520bded1ee3">More details (Foursquare)</a> </p>]]></description>
        <TimeSpan>
          <begin>2013-12-11T11:04:20-05:00</begin>
          <end>2013-12-11T12:31:32-05:00</end>
        </TimeSpan>
        <styleUrl>#place_Mexican Restaurant</styleUrl>
        <Point>
          <coordinates>-71.120141,42.3743468</coordinates>
        </Point>
      </Placemark>
      <Placemark id="1386783620000">
        <name><![CDATA[Proximate]]></name>
        <atom:link href="http://foursquare.com/venue/51c8c0d1498e5d4d09a48362"/>
        <description><![CDATA[<p>12/11/13<br/> 12:40 PM to 12:58 PM<br/> 18 min</p> <p>Tech Startup<br/> <a href="http://foursquare.com/venue/51c8c0d1498e5d4d09a48362">More details (Foursquare)</a> </p>]]></description>
        <TimeSpan>
          <begin>2013-12-11T12:40:21-05:00</begin>
          <end>2013-12-11T12:58:37-05:00</end>
        </TimeSpan>
        <styleUrl>#place_Tech Startup</styleUrl>
        <Point>
          <coordinates>-71.117205,42.378716</coordinates>
        </Point>
      </Placemark>
      <Placemark id="1386785399000">
        <name><![CDATA[Home]]></name>
        <description><![CDATA[<p>12/11/13<br/> 1:09 PM to 1:32 PM<br/> 22 min</p>]]></description>
        <TimeSpan>
          <begin>2013-12-11T13:10:00-05:00</begin>
          <end>2013-12-11T13:32:10-05:00</end>
        </TimeSpan>
        <styleUrl>#place_home</styleUrl>
        <Point>
          <coordinates>-71.1114458017,42.3754311174</coordinates>
        </Point>
      </Placemark>
      <Placemark id="1386788759000">
        <name><![CDATA[Shaw's]]></name>
        <atom:link href="http://foursquare.com/venue/4aac2d1cf964a520ac5c20e3"/>
        <description><![CDATA[<p>12/11/13<br/> 2:05 PM to 2:35 PM<br/> 29 min</p> <p>Supermarket<br/> <a href="http://foursquare.com/venue/4aac2d1cf964a520ac5c20e3">More details (Foursquare)</a> </p>]]></description>
        <TimeSpan>
          <begin>2013-12-11T14:06:00-05:00</begin>
          <end>2013-12-11T14:35:27-05:00</end>
        </TimeSpan>
        <styleUrl>#place_Supermarket</styleUrl>
        <Point>
          <coordinates>-71.079717,42.347009</coordinates>
        </Point>
      </Placemark>
      <Placemark id="1386792072000">
        <name><![CDATA[Proximate]]></name>
        <atom:link href="http://foursquare.com/venue/51c8c0d1498e5d4d09a48362"/>
        <description><![CDATA[<p>12/11/13<br/> 3:01 PM to 5:34 PM<br/> 2:33 hours</p> <p>Tech Startup<br/> <a href="http://foursquare.com/venue/51c8c0d1498e5d4d09a48362">More details (Foursquare)</a> </p>]]></description>
        <TimeSpan>
          <begin>2013-12-11T15:01:13-05:00</begin>
          <end>2013-12-11T17:34:33-05:00</end>
        </TimeSpan>
        <styleUrl>#place_Tech Startup</styleUrl>
        <Point>
          <coordinates>-71.117205,42.378716</coordinates>
        </Point>
      </Placemark>
      <Placemark id="1386801865000">
        <name><![CDATA[Home]]></name>
        <description><![CDATA[<p>12/11/13<br/> 5:44 PM to 8:16 PM<br/> 2:31 hours</p>]]></description>
        <TimeSpan>
          <begin>2013-12-11T17:44:26-05:00</begin>
          <end>2013-12-11T20:16:01-05:00</end>
        </TimeSpan>
        <styleUrl>#place_home</styleUrl>
        <Point>
          <coordinates>-71.1114458017,42.3754311174</coordinates>
        </Point>
      </Placemark>
      <Placemark id="1386823345000">
        <name><![CDATA[Home]]></name>
        <description><![CDATA[<p>12/11/13<br/> 11:42 PM to 12:00 AM<br/> 17 min</p>]]></description>
        <TimeSpan>
          <begin>2013-12-11T23:42:26-05:00</begin>
          <end>2013-12-11T23:59:59-05:00</end>
        </TimeSpan>
        <styleUrl>#place_home</styleUrl>
        <Point>
          <coordinates>-71.1114458017,42.3754311174</coordinates>
        </Point>
      </Placemark>
    </Folder>
    <Folder>
      <name><![CDATA[12/12/13]]></name>
      <Placemark id="1386824400000">
        <name><![CDATA[Home]]></name>
        <description><![CDATA[<p>12/12/13<br/> 12:00 AM to 9:40 AM<br/> 9:40 hours</p>]]></description>
        <TimeSpan>
          <begin>2013-12-12T00:00:01-05:00</begin>
          <end>2013-12-12T09:40:45-05:00</end>
        </TimeSpan>
        <styleUrl>#place_home</styleUrl>
        <Point>
          <coordinates>-71.1114458017,42.3754311174</coordinates>
        </Point>
      </Placemark>
      <Placemark id="1386860109000">
        <name><![CDATA[Finale Desserterie & Bakery]]></name>
        <atom:link href="http://foursquare.com/venue/4ac67e58f964a520a7b420e3"/>
        <description><![CDATA[<p>12/12/13<br/> 9:55 AM to 10:57 AM<br/> 1:02 hours</p> <p>Dessert Shop<br/> <a href="http://foursquare.com/venue/4ac67e58f964a520a7b420e3">More details (Foursquare)</a> </p>]]></description>
        <TimeSpan>
          <begin>2013-12-12T09:55:10-05:00</begin>
          <end>2013-12-12T10:57:52-05:00</end>
        </TimeSpan>
        <styleUrl>#place_Dessert Shop</styleUrl>
        <Point>
          <coordinates>-71.119179,42.37233336999999</coordinates>
        </Point>
      </Placemark>
      <Placemark id="1386864784000">
        <name><![CDATA[Proximate]]></name>
        <atom:link href="http://foursquare.com/venue/51c8c0d1498e5d4d09a48362"/>
        <description><![CDATA[<p>12/12/13<br/> 11:13 AM to 12:04 PM<br/> 51 min</p> <p>Tech Startup<br/> <a href="http://foursquare.com/venue/51c8c0d1498e5d4d09a48362">More details (Foursquare)</a> </p>]]></description>
        <TimeSpan>
          <begin>2013-12-12T11:13:05-05:00</begin>
          <end>2013-12-12T12:04:34-05:00</end>
        </TimeSpan>
        <styleUrl>#place_Tech Startup</styleUrl>
        <Point>
          <coordinates>-71.117205,42.378716</coordinates>
        </Point>
      </Placemark>
      <Placemark id="1386868401000">
        <name><![CDATA[Finale Desserterie & Bakery]]></name>
        <atom:link href="http://foursquare.com/venue/4ac67e58f964a520a7b420e3"/>
        <description><![CDATA[<p>12/12/13<br/> 12:13 PM to 1:40 PM<br/> 1:27 hours</p> <p>Dessert Shop<br/> <a href="http://foursquare.com/venue/4ac67e58f964a520a7b420e3">More details (Foursquare)</a> </p>]]></description>
        <TimeSpan>
          <begin>2013-12-12T12:13:22-05:00</begin>
          <end>2013-12-12T13:40:23-05:00</end>
        </TimeSpan>
        <styleUrl>#place_Dessert Shop</styleUrl>
        <Point>
          <coordinates>-71.119179,42.37233336999999</coordinates>
        </Point>
      </Placemark>
      <Placemark id="1386874416000">
        <name><![CDATA[Proximate]]></name>
        <atom:link href="http://foursquare.com/venue/51c8c0d1498e5d4d09a48362"/>
        <description><![CDATA[<p>12/12/13<br/> 1:53 PM to 6:28 PM<br/> 4:34 hours</p> <p>Tech Startup<br/> <a href="http://foursquare.com/venue/51c8c0d1498e5d4d09a48362">More details (Foursquare)</a> </p>]]></description>
        <TimeSpan>
          <begin>2013-12-12T13:53:37-05:00</begin>
          <end>2013-12-12T18:28:05-05:00</end>
        </TimeSpan>
        <styleUrl>#place_Tech Startup</styleUrl>
        <Point>
          <coordinates>-71.117205,42.378716</coordinates>
        </Point>
      </Placemark>
      <Placemark id="1386891763000">
        <name><![CDATA[Legal Sea Foods - Charles Square]]></name>
        <atom:link href="http://foursquare.com/venue/4bdcb5fa3904a59331664f9e"/>
        <description><![CDATA[<p>12/12/13<br/> 6:42 PM to 8:45 PM<br/> 2:02 hours</p> <p>Seafood Restaurant<br/> <a href="http://foursquare.com/venue/4bdcb5fa3904a59331664f9e">More details (Foursquare)</a> </p>]]></description>
        <TimeSpan>
          <begin>2013-12-12T18:42:44-05:00</begin>
          <end>2013-12-12T20:45:09-05:00</end>
        </TimeSpan>
        <styleUrl>#place_Seafood Restaurant</styleUrl>
        <Point>
          <coordinates>-71.1230027436908,42.37220351484281</coordinates>
        </Point>
      </Placemark>
      <Placemark id="1386900079000">
        <name><![CDATA[Home]]></name>
        <description><![CDATA[<p>12/12/13<br/> 9:01 PM to 12:00 AM<br/> 2:58 hours</p>]]></description>
        <TimeSpan>
          <begin>2013-12-12T21:01:20-05:00</begin>
          <end>2013-12-12T23:59:59-05:00</end>
        </TimeSpan>
        <styleUrl>#place_home</styleUrl>
        <Point>
          <coordinates>-71.1114458017,42.3754311174</coordinates>
        </Point>
      </Placemark>
    </Folder>
    <Folder>
      <name><![CDATA[12/13/13]]></name>
      <Placemark id="1386910800000">
        <name><![CDATA[Home]]></name>
        <description><![CDATA[<p>12/13/13<br/> 12:00 AM to 8:57 AM<br/> 8:57 hours</p>]]></description>
        <TimeSpan>
          <begin>2013-12-13T00:00:01-05:00</begin>
          <end>2013-12-13T08:57:56-05:00</end>
        </TimeSpan>
        <styleUrl>#place_home</styleUrl>
        <Point>
          <coordinates>-71.1114458017,42.3754311174</coordinates>
        </Point>
      </Placemark>
      <Placemark id="1386943739000">
        <name><![CDATA[Voltage Coffee & Art]]></name>
        <atom:link href="http://foursquare.com/venue/4cd1a0b17f56a1434795d5a6"/>
        <description><![CDATA[<p>12/13/13<br/> 9:08 AM to 11:17 AM<br/> 2:08 hours</p> <p> <a href="http://foursquare.com/venue/4cd1a0b17f56a1434795d5a6">More details (Foursquare)</a> </p>]]></description>
        <TimeSpan>
          <begin>2013-12-13T09:09:00-05:00</begin>
          <end>2013-12-13T11:17:20-05:00</end>
        </TimeSpan>
        <styleUrl>#place_foursquare</styleUrl>
        <Point>
          <coordinates>-71.08298063278198,42.36415668987275</coordinates>
        </Point>
      </Placemark>
      <Placemark id="1386952922000">
        <name><![CDATA[Proximate]]></name>
        <atom:link href="http://foursquare.com/venue/51c8c0d1498e5d4d09a48362"/>
        <description><![CDATA[<p>12/13/13<br/> 11:42 AM to 11:48 AM<br/> 6 min</p> <p>Tech Startup<br/> <a href="http://foursquare.com/venue/51c8c0d1498e5d4d09a48362">More details (Foursquare)</a> </p>]]></description>
        <TimeSpan>
          <begin>2013-12-13T11:42:03-05:00</begin>
          <end>2013-12-13T11:48:17-05:00</end>
        </TimeSpan>
        <styleUrl>#place_Tech Startup</styleUrl>
        <Point>
          <coordinates>-71.117205,42.378716</coordinates>
        </Point>
      </Placemark>
      <Placemark id="1386953934000">
        <name><![CDATA[Home]]></name>
        <description><![CDATA[<p>12/13/13<br/> 11:58 AM to 1:23 PM<br/> 1:24 hours</p>]]></description>
        <TimeSpan>
          <begin>2013-12-13T11:58:55-05:00</begin>
          <end>2013-12-13T13:23:01-05:00</end>
        </TimeSpan>
        <styleUrl>#place_home</styleUrl>
        <Point>
          <coordinates>-71.1114458017,42.3754311174</coordinates>
        </Point>
      </Placemark>
      <Placemark id="1386962875000">
        <name><![CDATA[Charlton Service Plaza (Westbound)]]></name>
        <atom:link href="http://foursquare.com/venue/4b84021af964a520e01a31e3"/>
        <description><![CDATA[<p>12/13/13<br/> 2:27 PM to 2:56 PM<br/> 28 min</p> <p> <a href="http://foursquare.com/venue/4b84021af964a520e01a31e3">More details (Foursquare)</a> </p>]]></description>
        <TimeSpan>
          <begin>2013-12-13T14:27:56-05:00</begin>
          <end>2013-12-13T14:56:38-05:00</end>
        </TimeSpan>
        <styleUrl>#place_foursquare</styleUrl>
        <Point>
          <coordinates>-71.96396827697754,42.15621389012551</coordinates>
        </Point>
      </Placemark>
      <Placemark id="1386983675000">
        <name><![CDATA[Place in Cranbury Township]]></name>
        <description><![CDATA[<p>12/13/13<br/> 8:14 PM to 8:32 PM<br/> 18 min</p>]]></description>
        <TimeSpan>
          <begin>2013-12-13T20:14:36-05:00</begin>
          <end>2013-12-13T20:32:43-05:00</end>
        </TimeSpan>
        <styleUrl>#place_unknown</styleUrl>
        <Point>
          <coordinates>-74.4880883933,40.3211761993</coordinates>
        </Point>
      </Placemark>
      <Placemark id="1386995958000">
        <name><![CDATA[Place in Cathedral Heights]]></name>
        <description><![CDATA[<p>12/13/13<br/> 11:39 PM to 11:42 PM<br/> 3 min</p>]]></description>
        <TimeSpan>
          <begin>2013-12-13T23:39:19-05:00</begin>
          <end>2013-12-13T23:42:46-05:00</end>
        </TimeSpan>
        <styleUrl>#place_unknown</styleUrl>
        <Point>
          <coordinates>-77.0717496898,38.9304963125</coordinates>
        </Point>
      </Placemark>
      <Placemark id="1386996604000">
        <name><![CDATA[2440 39th Street NW]]></name>
        <atom:link href="http://foursquare.com/venue/520fad54498e47affbce37d4"/>
        <description><![CDATA[<p>12/13/13<br/> 11:50 PM to 12:00 AM<br/> 9 min</p> <p>Home (private)<br/> <a href="http://foursquare.com/venue/520fad54498e47affbce37d4">More details (Foursquare)</a> </p>]]></description>
        <TimeSpan>
          <begin>2013-12-13T23:50:05-05:00</begin>
          <end>2013-12-13T23:59:59-05:00</end>
        </TimeSpan>
        <styleUrl>#place_Home (private)</styleUrl>
        <Point>
          <coordinates>-77.07371486668141,38.92592014653639</coordinates>
        </Point>
      </Placemark>
    </Folder>
    <Folder>
      <name><![CDATA[12/14/13]]></name>
      <Placemark id="1386997200000">
        <name><![CDATA[2440 39th Street NW]]></name>
        <atom:link href="http://foursquare.com/venue/520fad54498e47affbce37d4"/>
        <description><![CDATA[<p>12/14/13<br/> 12:00 AM to 10:50 AM<br/> 10:50 hours</p> <p>Home (private)<br/> <a href="http://foursquare.com/venue/520fad54498e47affbce37d4">More details (Foursquare)</a> </p>]]></description>
        <TimeSpan>
          <begin>2013-12-14T00:00:01-05:00</begin>
          <end>2013-12-14T10:50:10-05:00</end>
        </TimeSpan>
        <styleUrl>#place_Home (private)</styleUrl>
        <Point>
          <coordinates>-77.07371486668141,38.92592014653639</coordinates>
        </Point>
      </Placemark>
      <Placemark id="1387038151000">
        <name><![CDATA[2440 39th St NW]]></name>
        <atom:link href="http://foursquare.com/venue/520fad0811d2245250b13cd1"/>
        <description><![CDATA[<p>12/14/13<br/> 11:22 AM to 1:02 PM<br/> 1:40 hours</p> <p> <a href="http://foursquare.com/venue/520fad0811d2245250b13cd1">More details (Foursquare)</a> </p>]]></description>
        <TimeSpan>
          <begin>2013-12-14T11:22:32-05:00</begin>
          <end>2013-12-14T13:02:46-05:00</end>
        </TimeSpan>
        <styleUrl>#place_foursquare</styleUrl>
        <Point>
          <coordinates>-77.07371486668141,38.92592014653639</coordinates>
        </Point>
      </Placemark>
      <Placemark id="1387045430000">
        <name><![CDATA[National Museum of Natural History]]></name>
        <atom:link href="http://foursquare.com/venue/4a4a33bff964a52094ab1fe3"/>
        <description><![CDATA[<p>12/14/13<br/> 1:23 PM to 1:35 PM<br/> 11 min</p> <p> <a href="http://foursquare.com/venue/4a4a33bff964a52094ab1fe3">More details (Foursquare)</a> </p>]]></description>
        <TimeSpan>
          <begin>2013-12-14T13:23:51-05:00</begin>
          <end>2013-12-14T13:35:39-05:00</end>
        </TimeSpan>
        <styleUrl>#place_foursquare</styleUrl>
        <Point>
          <coordinates>-77.02609062194823,38.89124159361884</coordinates>
        </Point>
      </Placemark>
      <Placemark id="1387046141000">
        <name><![CDATA[National Museum of Natural History]]></name>
        <atom:link href="http://foursquare.com/venue/4a4a33bff964a52094ab1fe3"/>
        <description><![CDATA[<p>12/14/13<br/> 1:35 PM to 2:23 PM<br/> 47 min</p> <p> <a href="http://foursquare.com/venue/4a4a33bff964a52094ab1fe3">More details (Foursquare)</a> </p>]]></description>
        <TimeSpan>
          <begin>2013-12-14T13:35:42-05:00</begin>
          <end>2013-12-14T14:23:07-05:00</end>
        </TimeSpan>
        <styleUrl>#place_foursquare</styleUrl>
        <Point>
          <coordinates>-77.02609062194823,38.89124159361884</coordinates>
        </Point>
      </Placemark>
      <Placemark id="1387049405000">
        <name><![CDATA[Place in Chinatown]]></name>
        <description><![CDATA[<p>12/14/13<br/> 2:30 PM to 3:18 PM<br/> 48 min</p>]]></description>
        <TimeSpan>
          <begin>2013-12-14T14:30:06-05:00</begin>
          <end>2013-12-14T15:18:09-05:00</end>
        </TimeSpan>
        <styleUrl>#place_unknown</styleUrl>
        <Point>
          <coordinates>-77.0211071848,38.8912914184</coordinates>
        </Point>
      </Placemark>
      <Placemark id="1387053199000">
        <name><![CDATA[Nando's Peri-Peri]]></name>
        <atom:link href="http://foursquare.com/venue/4a4eb693f964a520f4ae1fe3"/>
        <description><![CDATA[<p>12/14/13<br/> 3:33 PM to 5:14 PM<br/> 1:41 hours</p> <p>Portuguese Restaurant<br/> <a href="http://foursquare.com/venue/4a4eb693f964a520f4ae1fe3">More details (Foursquare)</a> </p>]]></description>
        <TimeSpan>
          <begin>2013-12-14T15:33:20-05:00</begin>
          <end>2013-12-14T17:14:32-05:00</end>
        </TimeSpan>
        <styleUrl>#place_Portuguese Restaurant</styleUrl>
        <Point>
          <coordinates>-77.02192725344514,38.90041686668396</coordinates>
        </Point>
      </Placemark>
      <Placemark id="1387062001000">
        <name><![CDATA[2440 39th Street NW]]></name>
        <atom:link href="http://foursquare.com/venue/520fad54498e47affbce37d4"/>
        <description><![CDATA[<p>12/14/13<br/> 6:00 PM to 12:00 AM<br/> 5:59 hours</p> <p> <a href="http://foursquare.com/venue/520fad54498e47affbce37d4">More details (Foursquare)</a> </p>]]></description>
        <TimeSpan>
          <begin>2013-12-14T18:00:02-05:00</begin>
          <end>2013-12-14T23:59:59-05:00</end>
        </TimeSpan>
        <styleUrl>#place_foursquare</styleUrl>
        <Point>
          <coordinates>-77.07371486668141,38.92592014653639</coordinates>
        </Point>
      </Placemark>
    </Folder>
    <Folder>
      <name><![CDATA[12/15/13]]></name>
      <Placemark id="1387083600000">
        <name><![CDATA[2440 39th Street NW]]></name>
        <atom:link href="http://foursquare.com/venue/520fad54498e47affbce37d4"/>
        <description><![CDATA[<p>12/15/13<br/> 12:00 AM to 2:25 PM<br/> 14:25 hours</p> <p> <a href="http://foursquare.com/venue/520fad54498e47affbce37d4">More details (Foursquare)</a> </p>]]></description>
        <TimeSpan>
          <begin>2013-12-15T00:00:01-05:00</begin>
          <end>2013-12-15T14:25:43-05:00</end>
        </TimeSpan>
        <styleUrl>#place_foursquare</styleUrl>
        <Point>
          <coordinates>-77.07371486668141,38.92592014653639</coordinates>
        </Point>
      </Placemark>
      <Placemark id="1387136614000">
        <name><![CDATA[Whole Foods Market]]></name>
        <atom:link href="http://foursquare.com/venue/4aad58b8f964a520d25f20e3"/>
        <description><![CDATA[<p>12/15/13<br/> 2:43 PM to 3:03 PM<br/> 19 min</p> <p>Grocery Store<br/> <a href="http://foursquare.com/venue/4aad58b8f964a520d25f20e3">More details (Foursquare)</a> </p>]]></description>
        <TimeSpan>
          <begin>2013-12-15T14:43:35-05:00</begin>
          <end>2013-12-15T15:03:23-05:00</end>
        </TimeSpan>
        <styleUrl>#place_Grocery Store</styleUrl>
        <Point>
          <coordinates>-77.071804,38.920938</coordinates>
        </Point>
      </Placemark>
      <Placemark id="1387138357000">
        <name><![CDATA[2440 39th Street NW]]></name>
        <atom:link href="http://foursquare.com/venue/520fad54498e47affbce37d4"/>
        <description><![CDATA[<p>12/15/13<br/> 3:12 PM to 12:00 AM<br/> 8:47 hours</p> <p>Home (private)<br/> <a href="http://foursquare.com/venue/520fad54498e47affbce37d4">More details (Foursquare)</a> </p>]]></description>
        <TimeSpan>
          <begin>2013-12-15T15:12:38-05:00</begin>
          <end>2013-12-15T23:59:59-05:00</end>
        </TimeSpan>
        <styleUrl>#place_Home (private)</styleUrl>
        <Point>
          <coordinates>-77.07371486668141,38.92592014653639</coordinates>
        </Point>
      </Placemark>
    </Folder>
    <Folder>
      <name><![CDATA[12/16/13]]></name>
      <Placemark id="1387170000000">
        <name><![CDATA[2440 39th Street NW]]></name>
        <atom:link href="http://foursquare.com/venue/520fad54498e47affbce37d4"/>
        <description><![CDATA[<p>12/16/13<br/> 12:00 AM to 7:06 PM<br/> 19:06 hours</p> <p>Home (private)<br/> <a href="http://foursquare.com/venue/520fad54498e47affbce37d4">More details (Foursquare)</a> </p>]]></description>
        <TimeSpan>
          <begin>2013-12-16T00:00:01-05:00</begin>
          <end>2013-12-16T19:06:06-05:00</end>
        </TimeSpan>
