Date,Name,Start,End,Duration,Latitude,Longitude,Category,Link
12/1/13,945 S Batavia Ave,2013-12-01T12:29:24-05:00,2013-12-01T13:02:35-05:00,1991,41.87250621617115,-88.30935165928999,,http://foursquare.com/venue/4f629428e4b075c7117d49d3
12/1/13,Wildwood,2013-12-01T13:13:25-05:00,2013-12-01T14:20:01-05:00,3996,41.88296963158768,-88.30879211425781,American Restaurant,http://foursquare.com/venue/4af254bcf964a52071e721e3
12/1/13,945 S Batavia Ave,2013-12-01T14:32:08-05:00,2013-12-01T14:43:27-05:00,679,41.87250621617115,-88.30935165928999,,http://foursquare.com/venue/4f629428e4b075c7117d49d3
12/1/13,Walmart,2013-12-01T14:51:47-05:00,2013-12-01T15:36:02-05:00,2655,41.86278545510927,-88.34608554840088,,http://foursquare.com/venue/4b672d70f964a5209d3f2be3
12/1/13,945 S Batavia Ave,2013-12-01T15:44:31-05:00,2013-12-01T17:27:54-05:00,6203,41.87250621617115,-88.30935165928999,,http://foursquare.com/venue/4f629428e4b075c7117d49d3
12/1/13,Metra - Geneva Station,2013-12-01T17:29:51-05:00,2013-12-01T17:40:53-05:00,662,41.8816436553268,-88.30999374389648,,http://foursquare.com/venue/4b33b685f964a5208c1d25e3
12/1/13,Chicago Union Station,2013-12-01T19:10:02-05:00,2013-12-01T19:13:36-05:00,214,41.87860419025647,-87.63901233673096,,http://foursquare.com/venue/45840daef964a520923f1fe3
12/1/13,Ogilvie Transportation Center,2013-12-01T19:30:23-05:00,2013-12-01T19:39:36-05:00,553,41.88384028778092,-87.64051973819733,,http://foursquare.com/venue/4a730e62f964a5207cdb1fe3
12/1/13,945 S Batavia Ave,2013-12-01T21:07:12-05:00,2013-12-02T00:00:00-05:00,10368,41.87250621617115,-88.30935165928999,,http://foursquare.com/venue/4f629428e4b075c7117d49d3
12/2/13,945 S Batavia Ave,2013-12-02T00:00:00-05:00,2013-12-03T00:00:00-05:00,86400,41.87250621617115,-88.30935165928999,,http://foursquare.com/venue/4f629428e4b075c7117d49d3
12/3/13,945 S Batavia Ave,2013-12-03T00:00:00-05:00,2013-12-03T13:56:03-05:00,50163,41.87250621617115,-88.30935165928999,,http://foursquare.com/venue/4f629428e4b075c7117d49d3
12/3/13,945 S Batavia Ave,2013-12-03T14:05:19-05:00,2013-12-03T14:26:30-05:00,1271,41.87250621617115,-88.30935165928999,,http://foursquare.com/venue/4f629428e4b075c7117d49d3
12/3/13,All Chocolate Kitchen,2013-12-03T14:28:40-05:00,2013-12-03T15:01:35-05:00,1975,41.88701828333333,-88.30787845,,http://foursquare.com/venue/4e0101b8ae609fa8ede130bd
12/3/13,945 S Batavia Ave,2013-12-03T15:03:44-05:00,2013-12-03T20:42:20-05:00,20316,41.87250621617115,-88.30935165928999,,http://foursquare.com/venue/4f629428e4b075c7117d49d3
12/3/13,945 S Batavia Ave,2013-12-03T20:51:08-05:00,2013-12-04T00:00:00-05:00,11332,41.87250621617115,-88.30935165928999,,http://foursquare.com/venue/4f629428e4b075c7117d49d3
12/4/13,945 S Batavia Ave,2013-12-04T00:00:00-05:00,2013-12-04T12:48:13-05:00,46093,41.87250621617115,-88.30935165928999,,http://foursquare.com/venue/4f629428e4b075c7117d49d3
12/4/13,Place in O'Hare International Airport,2013-12-04T13:38:22-05:00,2013-12-04T13:47:18-05:00,536,41.9772196045,-87.899172412,,
12/4/13,Chicago O'Hare International Airport (ORD),2013-12-04T13:49:54-05:00,2013-12-04T15:26:39-05:00,5805,41.97727092004163,-87.90440082550049,,http://foursquare.com/venue/4a5a77a4f964a52062ba1fe3
12/4/13,Boston Logan International Airport (BOS),2013-12-04T17:13:04-05:00,2013-12-04T17:39:33-05:00,1589,42.36650312404415,-71.01667642593384,Airport,http://foursquare.com/venue/452113b6f964a520bc3a1fe3
12/4/13,Broadway Marketplace,2013-12-04T18:22:24-05:00,2013-12-04T18:26:44-05:00,260,42.37405171427381,-71.11300484548056,Grocery Store,http://foursquare.com/venue/4a661612f964a520ffc71fe3
12/4/13,Home,2013-12-04T18:34:00-05:00,2013-12-05T00:00:00-05:00,19560,42.3754311174,-71.1114458017,Home,
12/5/13,Home,2013-12-05T00:00:00-05:00,2013-12-05T09:51:03-05:00,35463,42.3754311174,-71.1114458017,Home,
12/5/13,Proximate,2013-12-05T10:03:48-05:00,2013-12-05T10:38:01-05:00,2053,42.378716,-71.117205,Tech Startup,http://foursquare.com/venue/51c8c0d1498e5d4d09a48362
12/5/13,Harvard Alumni Association,2013-12-05T10:51:55-05:00,2013-12-05T11:45:45-05:00,3230,42.37317592010315,-71.12325225275964,University,http://foursquare.com/venue/4b5dc68df964a520026b29e3
12/5/13,Border Cafe,2013-12-05T11:51:33-05:00,2013-12-05T12:38:06-05:00,2793,42.3743468,-71.120141,Mexican Restaurant,http://foursquare.com/venue/3fd66200f964a520bded1ee3
12/5/13,Proximate,2013-12-05T12:47:15-05:00,2013-12-05T16:12:30-05:00,12315,42.378716,-71.117205,Tech Startup,http://foursquare.com/venue/51c8c0d1498e5d4d09a48362
12/5/13,Spangler Center,2013-12-05T16:33:07-05:00,2013-12-05T17:02:43-05:00,1776,42.36522543920124,-71.12218458495514,Student Center,http://foursquare.com/venue/4aeee0b0f964a52081d421e3
12/5/13,Experiment Fund,2013-12-05T17:16:50-05:00,2013-12-05T20:30:19-05:00,11609,42.37313766800413,-71.11951231956482,Work,
12/5/13,Finale Desserterie & Bakery,2013-12-05T20:30:19-05:00,2013-12-05T20:54:10-05:00,1431,42.37233336999999,-71.119179,Dessert Shop,http://foursquare.com/venue/4ac67e58f964a520a7b420e3
12/5/13,Home,2013-12-05T21:05:15-05:00,2013-12-06T00:00:00-05:00,10485,42.3754311174,-71.1114458017,Home,
12/6/13,Home,2013-12-06T00:00:00-05:00,2013-12-06T09:24:21-05:00,33861,42.3754311174,-71.1114458017,Home,
12/6/13,Darwin's Ltd.,2013-12-06T09:47:02-05:00,2013-12-06T10:34:54-05:00,2872,42.37488104,-71.109389,Sandwich Place,http://foursquare.com/venue/4a1c900cf964a520507b1fe3
12/6/13,IDG Enterprise,2013-12-06T11:07:16-05:00,2013-12-06T12:20:12-05:00,4376,42.31326824876494,-71.39173529779059,Coworking Space,http://foursquare.com/venue/4c0d2be17189c928dd97d6b6
12/6/13,Home,2013-12-06T13:05:45-05:00,2013-12-06T18:16:52-05:00,18667,42.3754311174,-71.1114458017,Home,
12/6/13,Place in East Cambridge,2013-12-06T18:35:04-05:00,2013-12-06T18:41:34-05:00,390,42.3625140448,-71.084956498,,
12/6/13,Za Restaurant,2013-12-06T18:53:09-05:00,2013-12-06T19:33:56-05:00,2447,42.36330473140007,-71.08354935061818,,http://foursquare.com/venue/4b9181fff964a520b2c133e3
12/6/13,Home,2013-12-06T19:54:22-05:00,2013-12-07T00:00:00-05:00,14738,42.3754311174,-71.1114458017,Home,
12/7/13,Home,2013-12-07T00:00:00-05:00,2013-12-07T10:27:38-05:00,37658,42.3754311174,-71.1114458017,Home,
12/7/13,Experiment Fund,2013-12-07T10:41:21-05:00,2013-12-07T12:26:24-05:00,6303,42.37313766800413,-71.11951231956482,Work,
12/7/13,Home,2013-12-07T12:41:01-05:00,2013-12-07T14:37:18-05:00,6977,42.3754311174,-71.1114458017,Home,
12/7/13,Floyd's 99 Barbershop,2013-12-07T14:55:21-05:00,2013-12-07T15:34:57-05:00,2376,42.38213717937469,-71.11979826,Salon / Barbershop,http://foursquare.com/venue/4a9d711ff964a520443820e3
12/7/13,Home,2013-12-07T15:57:45-05:00,2013-12-08T00:00:00-05:00,28935,42.3754311174,-71.1114458017,Home,
12/8/13,Home,2013-12-08T00:00:00-05:00,2013-12-08T11:27:01-05:00,41221,42.3754311174,-71.1114458017,Home,
12/8/13,Place in Cambridge,2013-12-08T11:36:42-05:00,2013-12-08T12:27:49-05:00,3067,42.3704831417,-71.1043402003,,
12/8/13,Home,2013-12-08T12:48:31-05:00,2013-12-08T13:06:36-05:00,1085,42.3754311174,-71.1114458017,Home,
12/8/13,Home,2013-12-08T13:15:28-05:00,2013-12-09T00:00:00-05:00,38672,42.3754311174,-71.1114458017,Home,
12/9/13,Home,2013-12-09T00:00:00-05:00,2013-12-09T07:57:15-05:00,28635,42.3754311174,-71.1114458017,Home,
12/9/13,Microsoft New England Research & Development Center,2013-12-09T08:26:22-05:00,2013-12-09T10:14:21-05:00,6479,42.36139978759076,-71.08101918844292,,http://foursquare.com/venue/4aba1dd3f964a520658020e3
12/9/13,Harvard Alumni Association,2013-12-09T10:40:05-05:00,2013-12-09T11:40:59-05:00,3654,42.37317592010315,-71.12325225275964,University,http://foursquare.com/venue/4b5dc68df964a520026b29e3
12/9/13,Home,2013-12-09T11:57:42-05:00,2013-12-09T11:58:22-05:00,40,42.3754311174,-71.1114458017,Home,
12/9/13,Experiment Fund,2013-12-09T16:04:36-05:00,2013-12-09T17:23:03-05:00,4707,42.37313766800413,-71.11951231956482,Work,
12/9/13,Harvard Innovation Lab,2013-12-09T17:37:51-05:00,2013-12-09T19:25:07-05:00,6436,42.36403242532342,-71.12407621183526,College Technology Building,http://foursquare.com/venue/4e5d4676ae60839ea2e29e64
12/9/13,Experiment Fund,2013-12-09T19:32:09-05:00,2013-12-09T19:35:07-05:00,178,42.37313766800413,-71.11951231956482,Work,
12/9/13,Home,2013-12-09T19:46:09-05:00,2013-12-09T21:38:23-05:00,6734,42.3754311174,-71.1114458017,Home,
12/9/13,Back Bay Social Club,2013-12-09T21:55:52-05:00,2013-12-10T00:00:00-05:00,7448,42.34839803194278,-71.08320116409787,American Restaurant,http://foursquare.com/venue/4c4e2095fb742d7f9bcace2d
12/10/13,Back Bay Social Club,2013-12-10T00:00:00-05:00,2013-12-10T00:03:07-05:00,187,42.34839803194278,-71.08320116409787,American Restaurant,http://foursquare.com/venue/4c4e2095fb742d7f9bcace2d
12/10/13,Home,2013-12-10T00:21:34-05:00,2013-12-10T19:56:15-05:00,70481,42.3754311174,-71.1114458017,Home,
12/10/13,Broadway Marketplace,2013-12-10T20:02:01-05:00,2013-12-10T20:15:24-05:00,803,42.37405171427381,-71.11300484548056,Grocery Store,http://foursquare.com/venue/4a661612f964a520ffc71fe3
12/10/13,Home,2013-12-10T20:22:50-05:00,2013-12-10T23:23:42-05:00,10852,42.3754311174,-71.1114458017,Home,
12/11/13,Border Cafe,2013-12-11T11:04:19-05:00,2013-12-11T12:31:33-05:00,5234,42.3743468,-71.120141,Mexican Restaurant,http://foursquare.com/venue/3fd66200f964a520bded1ee3
12/11/13,Proximate,2013-12-11T12:40:20-05:00,2013-12-11T12:58:38-05:00,1098,42.378716,-71.117205,Tech Startup,http://foursquare.com/venue/51c8c0d1498e5d4d09a48362
12/11/13,Home,2013-12-11T13:09:59-05:00,2013-12-11T13:32:11-05:00,1332,42.3754311174,-71.1114458017,Home,
12/11/13,Shaw's,2013-12-11T14:05:59-05:00,2013-12-11T14:35:28-05:00,1769,42.347009,-71.079717,Supermarket,http://foursquare.com/venue/4aac2d1cf964a520ac5c20e3
12/11/13,Proximate,2013-12-11T15:01:12-05:00,2013-12-11T17:34:34-05:00,9202,42.378716,-71.117205,Tech Startup,http://foursquare.com/venue/51c8c0d1498e5d4d09a48362
12/11/13,Home,2013-12-11T17:44:25-05:00,2013-12-11T20:16:02-05:00,9097,42.3754311174,-71.1114458017,Home,
12/11/13,Home,2013-12-11T23:42:25-05:00,2013-12-12T00:00:00-05:00,1055,42.3754311174,-71.1114458017,Home,
12/12/13,Home,2013-12-12T00:00:00-05:00,2013-12-12T09:40:46-05:00,34846,42.3754311174,-71.1114458017,Home,
12/12/13,Finale Desserterie & Bakery,2013-12-12T09:55:09-05:00,2013-12-12T10:57:53-05:00,3764,42.37233336999999,-71.119179,Dessert Shop,http://foursquare.com/venue/4ac67e58f964a520a7b420e3
12/12/13,Proximate,2013-12-12T11:13:04-05:00,2013-12-12T12:04:35-05:00,3091,42.378716,-71.117205,Tech Startup,http://foursquare.com/venue/51c8c0d1498e5d4d09a48362
12/12/13,Finale Desserterie & Bakery,2013-12-12T12:13:21-05:00,2013-12-12T13:40:24-05:00,5223,42.37233336999999,-71.119179,Dessert Shop,http://foursquare.com/venue/4ac67e58f964a520a7b420e3
12/12/13,Proximate,2013-12-12T13:53:36-05:00,2013-12-12T18:28:06-05:00,16470,42.378716,-71.117205,Tech Startup,http://foursquare.com/venue/51c8c0d1498e5d4d09a48362
12/12/13,Legal Sea Foods - Charles Square,2013-12-12T18:42:43-05:00,2013-12-12T20:45:10-05:00,7347,42.37220351484281,-71.1230027436908,Seafood Restaurant,http://foursquare.com/venue/4bdcb5fa3904a59331664f9e
12/12/13,Home,2013-12-12T21:01:19-05:00,2013-12-13T00:00:00-05:00,10721,42.3754311174,-71.1114458017,Home,
12/13/13,Home,2013-12-13T00:00:00-05:00,2013-12-13T08:57:57-05:00,32277,42.3754311174,-71.1114458017,Home,
12/13/13,Voltage Coffee & Art,2013-12-13T09:08:59-05:00,2013-12-13T11:17:21-05:00,7702,42.36415668987275,-71.08298063278198,,http://foursquare.com/venue/4cd1a0b17f56a1434795d5a6
12/13/13,Proximate,2013-12-13T11:42:02-05:00,2013-12-13T11:48:18-05:00,376,42.378716,-71.117205,Tech Startup,http://foursquare.com/venue/51c8c0d1498e5d4d09a48362
12/13/13,Home,2013-12-13T11:58:54-05:00,2013-12-13T13:23:02-05:00,5048,42.3754311174,-71.1114458017,Home,
12/13/13,Charlton Service Plaza (Westbound),2013-12-13T14:27:55-05:00,2013-12-13T14:56:39-05:00,1724,42.15621389012551,-71.96396827697754,,http://foursquare.com/venue/4b84021af964a520e01a31e3
12/13/13,Place in Cranbury Township,2013-12-13T20:14:35-05:00,2013-12-13T20:32:44-05:00,1089,40.3211761993,-74.4880883933,,
12/13/13,Place in Cathedral Heights,2013-12-13T23:39:18-05:00,2013-12-13T23:42:47-05:00,209,38.9304963125,-77.0717496898,,
12/13/13,2440 39th Street NW,2013-12-13T23:50:04-05:00,2013-12-14T00:00:00-05:00,596,38.92592014653639,-77.07371486668141,Home (private),http://foursquare.com/venue/520fad54498e47affbce37d4
12/14/13,2440 39th Street NW,2013-12-14T00:00:00-05:00,2013-12-14T10:50:11-05:00,39011,38.92592014653639,-77.07371486668141,Home (private),http://foursquare.com/venue/520fad54498e47affbce37d4
12/14/13,2440 39th St NW,2013-12-14T11:22:31-05:00,2013-12-14T13:02:47-05:00,6016,38.92592014653639,-77.07371486668141,,http://foursquare.com/venue/520fad0811d2245250b13cd1
12/14/13,National Museum of Natural History,2013-12-14T13:23:50-05:00,2013-12-14T13:35:40-05:00,710,38.89124159361884,-77.02609062194823,,http://foursquare.com/venue/4a4a33bff964a52094ab1fe3
12/14/13,National Museum of Natural History,2013-12-14T13:35:41-05:00,2013-12-14T14:23:08-05:00,2847,38.89124159361884,-77.02609062194823,,http://foursquare.com/venue/4a4a33bff964a52094ab1fe3
12/14/13,Place in Chinatown,2013-12-14T14:30:05-05:00,2013-12-14T15:18:10-05:00,2885,38.8912914184,-77.0211071848,,
12/14/13,Nando's Peri-Peri,2013-12-14T15:33:19-05:00,2013-12-14T17:14:33-05:00,6074,38.90041686668396,-77.02192725344514,Portuguese Restaurant,http://foursquare.com/venue/4a4eb693f964a520f4ae1fe3
12/14/13,2440 39th Street NW,2013-12-14T18:00:01-05:00,2013-12-15T00:00:00-05:00,21599,38.92592014653639,-77.07371486668141,,http://foursquare.com/venue/520fad54498e47affbce37d4
12/15/13,2440 39th Street NW,2013-12-15T00:00:00-05:00,2013-12-15T14:25:44-05:00,51944,38.92592014653639,-77.07371486668141,,http://foursquare.com/venue/520fad54498e47affbce37d4
12/15/13,Whole Foods Market,2013-12-15T14:43:34-05:00,2013-12-15T15:03:24-05:00,1190,38.920938,-77.071804,Grocery Store,http://foursquare.com/venue/4aad58b8f964a520d25f20e3
12/15/13,2440 39th Street NW,2013-12-15T15:12:37-05:00,2013-12-16T00:00:00-05:00,31643,38.92592014653639,-77.07371486668141,Home (private),http://foursquare.com/venue/520fad54498e47affbce37d4
12/16/13,2440 39th Street NW,2013-12-16T00:00:00-05:00,2013-12-16T19:06:07-05:00,68767,38.92592014653639,-77.07371486668141,Home (private),http://foursquare.com/venue/520fad54498e47affbce37d4
12/16/13,5000 River Hill Road,2013-12-16T19:42:28-05:00,2013-12-16T22:36:59-05:00,10471,38.9552236441,-77.1272547737,Home,
12/16/13,2440 39th Street NW,2013-12-16T23:06:24-05:00,2013-12-16T23:45:42-05:00,2358,38.92592014653639,-77.07371486668141,,http://foursquare.com/venue/520fad54498e47affbce37d4
12/18/13,"WMATA Bus Stop #1001805 (31, 32, 36)",2013-12-18T18:27:17-05:00,2013-12-18T18:41:46-05:00,869,38.92229853987276,-77.07277336996707,Bus Line,http://foursquare.com/venue/4e9b7ac54901d3b0b7587b98
12/18/13,Nando's Peri-Peri,2013-12-18T19:25:49-05:00,2013-12-18T21:09:55-05:00,6246,38.90041686668396,-77.02192725344514,Portuguese Restaurant,http://foursquare.com/venue/4a4eb693f964a520f4ae1fe3
12/18/13,2440 39th Street NW,2013-12-18T21:59:16-05:00,2013-12-19T00:00:00-05:00,7244,38.92592014653639,-77.07371486668141,,http://foursquare.com/venue/520fad54498e47affbce37d4
12/19/13,2440 39th Street NW,2013-12-19T00:00:00-05:00,2013-12-19T19:26:25-05:00,69985,38.92592014653639,-77.07371486668141,,http://foursquare.com/venue/520fad54498e47affbce37d4
12/19/13,Whole Foods Market,2013-12-19T19:37:59-05:00,2013-12-19T19:56:23-05:00,1104,38.920938,-77.071804,Grocery Store,http://foursquare.com/venue/4aad58b8f964a520d25f20e3
12/19/13,2440 39th Street NW,2013-12-19T20:07:17-05:00,2013-12-20T00:00:00-05:00,13963,38.92592014653639,-77.07371486668141,,http://foursquare.com/venue/520fad54498e47affbce37d4
12/20/13,2440 39th Street NW,2013-12-20T00:00:00-05:00,2013-12-20T15:02:25-05:00,54145,38.92592014653639,-77.07371486668141,,http://foursquare.com/venue/520fad54498e47affbce37d4
12/20/13,Place in East End,2013-12-20T15:33:49-05:00,2013-12-20T15:42:55-05:00,546,38.8967316187,-77.0059959584,,
12/20/13,Union Center Plaza,2013-12-20T15:52:27-05:00,2013-12-20T16:06:07-05:00,820,38.9015038292055,-77.00652122497559,,http://foursquare.com/venue/4bb14f20f964a520538b3ce3
12/20/13,Place in Berkeley County,2013-12-20T17:48:00-05:00,2013-12-20T17:56:25-05:00,505,39.4690896884,-77.9646171709,,
12/20/13,Place in Rockwood Station,2013-12-20T20:56:09-05:00,2013-12-20T21:09:50-05:00,821,39.9136827889,-79.1580155109,,
12/20/13,Place in North Manor,2013-12-20T22:15:50-05:00,2013-12-20T22:18:04-05:00,134,40.0210989938,-79.5941533526,,
12/20/13,Place in Uptown,2013-12-20T23:57:02-05:00,2013-12-21T00:00:00-05:00,178,40.445576427,-79.9905408882,,
12/21/13,Place in Uptown,2013-12-21T00:00:00-05:00,2013-12-21T00:12:43-05:00,763,40.445576427,-79.9905408882,,
12/21/13,Place in Macedonia,2013-12-21T02:27:07-05:00,2013-12-21T02:40:42-05:00,815,41.293405976,-81.4938037011,,
12/21/13,Place in Cleveland,2013-12-21T03:10:35-05:00,2013-12-21T03:18:35-05:00,480,41.5031261642,-81.7011237976,,
12/21/13,Place in Elkhart,2013-12-21T07:29:47-05:00,2013-12-21T07:36:46-05:00,419,41.6790340067,-85.9753982822,,
12/21/13,Chicago Union Station,2013-12-21T10:22:18-05:00,2013-12-21T10:36:57-05:00,879,41.87860419025647,-87.63901233673096,,http://foursquare.com/venue/45840daef964a520923f1fe3
12/21/13,999 S Batavia Ave,2013-12-21T11:47:08-05:00,2013-12-21T12:50:42-05:00,3814,41.8771046037,-88.3111773419,Home,
12/21/13,945 S Batavia Ave,2013-12-21T12:59:30-05:00,2013-12-21T14:13:37-05:00,4447,41.87250621617115,-88.30935165928999,,http://foursquare.com/venue/4f629428e4b075c7117d49d3
12/21/13,Goody's,2013-12-21T14:22:12-05:00,2013-12-21T14:58:17-05:00,2165,41.89998623,-88.33660727,,http://foursquare.com/venue/4be05fe32aed2d7f3924c86f
12/21/13,945 S Batavia Ave,2013-12-21T15:08:12-05:00,2013-12-21T15:28:33-05:00,1221,41.87250621617115,-88.30935165928999,,http://foursquare.com/venue/4f629428e4b075c7117d49d3
12/21/13,945 S Batavia Ave,2013-12-21T15:37:27-05:00,2013-12-22T00:00:00-05:00,30153,41.87250621617115,-88.30935165928999,,http://foursquare.com/venue/4f629428e4b075c7117d49d3
12/22/13,945 S Batavia Ave,2013-12-22T00:00:00-05:00,2013-12-22T14:28:15-05:00,52095,41.87250621617115,-88.30935165928999,,http://foursquare.com/venue/4f629428e4b075c7117d49d3
12/22/13,Wildwood,2013-12-22T14:29:48-05:00,2013-12-22T15:14:38-05:00,2690,41.88296963158768,-88.30879211425781,American Restaurant,http://foursquare.com/venue/4af254bcf964a52071e721e3
12/22/13,Place in Geneva,2013-12-22T15:14:39-05:00,2013-12-22T15:24:47-05:00,608,41.8823704219,-88.3081619655,,
12/22/13,Geneva Public Library District,2013-12-22T15:41:02-05:00,2013-12-22T15:47:57-05:00,415,41.88680463333333,-88.30626010894775,,http://foursquare.com/venue/4b71c982f964a520635c2de3
12/22/13,Walmart,2013-12-22T16:03:32-05:00,2013-12-22T16:45:29-05:00,2517,41.86278545510927,-88.34608554840088,,http://foursquare.com/venue/4b672d70f964a5209d3f2be3
12/22/13,945 S Batavia Ave,2013-12-22T16:56:44-05:00,2013-12-22T21:57:29-05:00,18045,41.87250621617115,-88.30935165928999,,http://foursquare.com/venue/4f629428e4b075c7117d49d3
12/22/13,945 S Batavia Ave,2013-12-22T22:45:59-05:00,2013-12-23T00:00:00-05:00,4441,41.87250621617115,-88.30935165928999,,http://foursquare.com/venue/4f629428e4b075c7117d49d3
12/23/13,945 S Batavia Ave,2013-12-23T00:00:00-05:00,2013-12-23T14:42:04-05:00,52924,41.87250621617115,-88.30935165928999,,http://foursquare.com/venue/4f629428e4b075c7117d49d3
12/23/13,Portillo's Hot Dogs,2013-12-23T14:53:42-05:00,2013-12-23T15:27:10-05:00,2008,41.86083671184147,-88.34142002116754,,http://foursquare.com/venue/4aac39aaf964a520005d20e3
12/23/13,945 S Batavia Ave,2013-12-23T15:39:41-05:00,2013-12-23T16:14:55-05:00,2114,41.87250621617115,-88.30935165928999,,http://foursquare.com/venue/4f629428e4b075c7117d49d3
12/23/13,Sam's Club,2013-12-23T16:22:57-05:00,2013-12-23T17:06:18-05:00,2601,41.8598144603221,-88.34321289020829,Warehouse Store,http://foursquare.com/venue/4b5b6c86f964a520f5fc28e3
12/23/13,945 S Batavia Ave,2013-12-23T17:22:57-05:00,2013-12-24T00:00:00-05:00,23823,41.87250621617115,-88.30935165928999,,http://foursquare.com/venue/4f629428e4b075c7117d49d3
12/24/13,945 S Batavia Ave,2013-12-24T00:00:00-05:00,2013-12-24T14:04:46-05:00,50686,41.87250621617115,-88.30935165928999,,http://foursquare.com/venue/4f629428e4b075c7117d49d3
12/24/13,Marshalls,2013-12-24T14:12:20-05:00,2013-12-24T14:30:53-05:00,1113,41.87135042798499,-88.34226608276367,,http://foursquare.com/venue/4c0ada0e7e3fc928f464f482
12/24/13,Walmart,2013-12-24T14:43:43-05:00,2013-12-24T15:41:58-05:00,3495,41.86278545510927,-88.34608554840088,,http://foursquare.com/venue/4b672d70f964a5209d3f2be3
12/24/13,945 S Batavia Ave,2013-12-24T15:46:40-05:00,2013-12-25T00:00:00-05:00,29600,41.87250621617115,-88.30935165928999,,http://foursquare.com/venue/4f629428e4b075c7117d49d3
12/25/13,945 S Batavia Ave,2013-12-25T00:00:00-05:00,2013-12-26T00:00:00-05:00,86400,41.87250621617115,-88.30935165928999,,http://foursquare.com/venue/4f629428e4b075c7117d49d3
12/26/13,945 S Batavia Ave,2013-12-26T00:00:00-05:00,2013-12-26T09:07:33-05:00,32853,41.87250621617115,-88.30935165928999,,http://foursquare.com/venue/4f629428e4b075c7117d49d3
12/26/13,Metra - Geneva Station,2013-12-26T09:12:48-05:00,2013-12-26T09:18:02-05:00,314,41.8816436553268,-88.30999374389648,,http://foursquare.com/venue/4b33b685f964a5208c1d25e3
12/26/13,"Minsky, McCormick, and Hallagan P.C.",2013-12-26T10:56:39-05:00,2013-12-26T11:52:20-05:00,3341,41.8785516855,-87.6305833365,Work,
12/26/13,The Berghoff Restaurant,2013-12-26T12:02:50-05:00,2013-12-26T13:01:38-05:00,3528,41.87931335789547,-87.62865689358061,,http://foursquare.com/venue/4b2bedd4f964a520e6bd24e3
12/26/13,Walgreens,2013-12-26T13:10:08-05:00,2013-12-26T13:21:04-05:00,656,41.881706,-87.633972,,http://foursquare.com/venue/4b7f10f4f964a5200f1430e3
12/26/13,945 S Batavia Ave,2013-12-26T15:03:06-05:00,2013-12-27T00:00:00-05:00,32214,41.87250621617115,-88.30935165928999,,http://foursquare.com/venue/4f629428e4b075c7117d49d3
12/27/13,945 S Batavia Ave,2013-12-27T00:00:00-05:00,2013-12-27T14:36:52-05:00,52612,41.87250621617115,-88.30935165928999,,http://foursquare.com/venue/4f629428e4b075c7117d49d3
12/27/13,Nosh,2013-12-27T14:40:10-05:00,2013-12-27T15:24:10-05:00,2640,41.88694340165634,-88.30746173858643,,http://foursquare.com/venue/4b5c8db0f964a5203b3629e3
12/27/13,CVS/pharmacy,2013-12-27T15:28:23-05:00,2013-12-27T15:47:44-05:00,1161,41.88771017105127,-88.29025268554688,,http://foursquare.com/venue/4c214ee69085d13a26a184cc
12/27/13,945 S Batavia Ave,2013-12-27T15:53:10-05:00,2013-12-27T16:53:36-05:00,3626,41.87250621617115,-88.30935165928999,,http://foursquare.com/venue/4f629428e4b075c7117d49d3
12/27/13,Place in Batavia,2013-12-27T17:00:33-05:00,2013-12-27T17:10:29-05:00,596,41.8573026086,-88.3400673248,,
12/27/13,Chicago O'Hare International Airport (ORD),2013-12-27T18:19:21-05:00,2013-12-27T19:42:00-05:00,4959,41.97727092004163,-87.90440082550049,,http://foursquare.com/venue/4a5a77a4f964a52062ba1fe3
12/27/13,Aliano's Ristorante,2013-12-27T20:38:12-05:00,2013-12-27T23:03:17-05:00,8705,41.85094038076139,-88.30867525665128,,http://foursquare.com/venue/4eea9b640aaf9592fea4348c
12/27/13,945 S Batavia Ave,2013-12-27T23:11:25-05:00,2013-12-27T23:16:57-05:00,332,41.87250621617115,-88.30935165928999,,http://foursquare.com/venue/4f629428e4b075c7117d49d3
12/27/13,945 S Batavia Ave,2013-12-27T23:54:47-05:00,2013-12-28T00:00:00-05:00,313,41.87250621617115,-88.30935165928999,,http://foursquare.com/venue/4f629428e4b075c7117d49d3
12/28/13,945 S Batavia Ave,2013-12-28T00:00:00-05:00,2013-12-29T00:00:00-05:00,86400,41.87250621617115,-88.30935165928999,,http://foursquare.com/venue/4f629428e4b075c7117d49d3
12/29/13,945 S Batavia Ave,2013-12-29T00:00:00-05:00,2013-12-29T13:29:39-05:00,48579,41.87250621617115,-88.30935165928999,,http://foursquare.com/venue/4f629428e4b075c7117d49d3
12/29/13,Wildwood,2013-12-29T13:32:00-05:00,2013-12-29T14:51:56-05:00,4796,41.88296963158768,-88.30879211425781,American Restaurant,http://foursquare.com/venue/4af254bcf964a52071e721e3
12/29/13,999 S Batavia Ave,2013-12-29T14:55:04-05:00,2013-12-30T00:00:00-05:00,32696,41.8771046037,-88.3111773419,Home,
12/30/13,999 S Batavia Ave,2013-12-30T00:00:00-05:00,2013-12-30T12:53:16-05:00,46396,41.8771046037,-88.3111773419,Home,
12/30/13,Egg Harbor Cafe,2013-12-30T13:01:18-05:00,2013-12-30T14:32:23-05:00,5465,41.883009,-88.3081539,Breakfast Spot,http://foursquare.com/venue/4b6d65e3f964a520d3742ce3
12/30/13,999 S Batavia Ave,2013-12-30T14:34:57-05:00,2013-12-31T00:00:00-05:00,33903,41.8771046037,-88.3111773419,Home,
12/31/13,999 S Batavia Ave,2013-12-31T00:00:00-05:00,2013-12-31T11:56:49-05:00,43009,41.8771046037,-88.3111773419,Home,
12/31/13,Next Generation Development,2013-12-31T12:27:23-05:00,2013-12-31T13:57:51-05:00,5428,41.844666,-88.092306,,http://foursquare.com/venue/4e17783cb61c015d46f3c5bb
12/31/13,Chipotle Mexican Grill,2013-12-31T14:17:30-05:00,2013-12-31T14:43:54-05:00,1584,41.81374059115461,-88.28019508179067,,http://foursquare.com/venue/4fba9029e4b0c8c40865982c
12/31/13,Lacoste Outlet,2013-12-31T14:52:34-05:00,2013-12-31T15:10:30-05:00,1076,41.80087903210323,-88.27471733093262,,http://foursquare.com/venue/4be89f6ed837c9b6a995a506
12/31/13,Coach Mens Factory,2013-12-31T15:17:57-05:00,2013-12-31T15:54:02-05:00,2165,41.80091858051146,-88.27449015646917,,http://foursquare.com/venue/4fa6c6b6e4b08e1f89d5f3ee
12/31/13,Aldi,2013-12-31T16:22:17-05:00,2013-12-31T16:52:15-05:00,1798,41.8880886238829,-88.2883782767128,,http://foursquare.com/venue/4b83142bf964a52049f630e3
12/31/13,945 S Batavia Ave,2013-12-31T16:58:04-05:00,2013-12-31T18:51:45-05:00,6821,41.87250621617115,-88.30935165928999,,http://foursquare.com/venue/4f629428e4b075c7117d49d3
12/31/13,McKanna Home,2013-12-31T19:08:02-05:00,2013-12-31T22:54:41-05:00,13599,41.82354161276872,-88.35793010648455,,http://foursquare.com/venue/5291522b11d2bcc697a9a9c8
1/1/14,945 S Batavia Ave,2014-01-01T00:10:03-05:00,2014-01-01T13:45:45-05:00,48942,41.87250621617115,-88.30935165928999,,http://foursquare.com/venue/4f629428e4b075c7117d49d3
1/1/14,Egg Harbor Cafe,2014-01-01T13:49:23-05:00,2014-01-01T15:27:29-05:00,5886,41.883009,-88.3081539,Breakfast Spot,http://foursquare.com/venue/4b6d65e3f964a520d3742ce3
1/1/14,945 S Batavia Ave,2014-01-01T15:29:24-05:00,2014-01-02T00:00:00-05:00,30636,41.87250621617115,-88.30935165928999,,http://foursquare.com/venue/4f629428e4b075c7117d49d3
1/2/14,945 S Batavia Ave,2014-01-02T00:00:00-05:00,2014-01-02T14:06:06-05:00,50766,41.87250621617115,-88.30935165928999,,http://foursquare.com/venue/4f629428e4b075c7117d49d3
1/2/14,Portillo's Hot Dogs,2014-01-02T14:17:38-05:00,2014-01-02T14:49:48-05:00,1930,41.86083671184147,-88.34142002116754,,http://foursquare.com/venue/4aac39aaf964a520005d20e3
1/2/14,945 S Batavia Ave,2014-01-02T15:01:37-05:00,2014-01-03T00:00:00-05:00,32303,41.87250621617115,-88.30935165928999,,http://foursquare.com/venue/4f629428e4b075c7117d49d3
1/3/14,945 S Batavia Ave,2014-01-03T00:00:00-05:00,2014-01-03T14:52:06-05:00,53526,41.87250621617115,-88.30935165928999,,http://foursquare.com/venue/4f629428e4b075c7117d49d3
1/3/14,Lindsay Home,2014-01-03T15:01:11-05:00,2014-01-03T15:11:39-05:00,628,41.8707573192,-88.346432006,Home,
1/3/14,Sam's Club,2014-01-03T15:28:19-05:00,2014-01-03T16:10:54-05:00,2555,41.8598144603221,-88.34321289020829,Warehouse Store,http://foursquare.com/venue/4b5b6c86f964a520f5fc28e3
1/3/14,999 S Batavia Ave,2014-01-03T16:25:51-05:00,2014-01-03T18:38:49-05:00,7978,41.8771046037,-88.3111773419,Home,
1/3/14,Place in Naperville,2014-01-03T19:13:51-05:00,2014-01-03T22:52:57-05:00,13146,41.7717542691,-88.1495348228,,
1/3/14,Place in Geneva,2014-01-03T23:24:18-05:00,2014-01-04T00:00:00-05:00,2142,41.877043308,-88.3112280718,,
1/4/14,Place in Geneva,2014-01-04T00:00:00-05:00,2014-01-04T10:38:35-05:00,38315,41.877043308,-88.3112280718,,
1/4/14,Place in Aurora,2014-01-04T10:59:45-05:00,2014-01-04T12:24:33-05:00,5088,41.813005324,-88.2759720689,,
1/4/14,Fitzsimmons Home,2014-01-04T12:43:10-05:00,2014-01-05T00:00:00-05:00,40610,41.8771070061,-88.311048021,Home,
1/5/14,Fitzsimmons Home,2014-01-05T00:00:00-05:00,2014-01-05T17:10:35-05:00,61835,41.8771070061,-88.311048021,Home,
1/5/14,Place in Geneva Commons,2014-01-05T17:28:48-05:00,2014-01-05T17:47:31-05:00,1123,41.896466107,-88.343332162,,
1/5/14,945 S Batavia Ave,2014-01-05T17:59:15-05:00,2014-01-06T00:00:00-05:00,21645,41.87250621617115,-88.30935165928999,,http://foursquare.com/venue/4f629428e4b075c7117d49d3
1/6/14,945 S Batavia Ave,2014-01-06T00:00:00-05:00,2014-01-06T19:35:45-05:00,70545,41.87250621617115,-88.30935165928999,,http://foursquare.com/venue/4f629428e4b075c7117d49d3
1/6/14,Fitzsimmons Home,2014-01-06T22:20:00-05:00,2014-01-07T00:00:00-05:00,6000,41.8771070061,-88.311048021,Home,
1/7/14,Fitzsimmons Home,2014-01-07T00:00:00-05:00,2014-01-07T16:46:16-05:00,60376,41.8771070061,-88.311048021,Home,
1/7/14,Chicago O'Hare International Airport (ORD),2014-01-07T17:39:13-05:00,2014-01-07T17:50:18-05:00,665,41.97727092004163,-87.90440082550049,,http://foursquare.com/venue/4a5a77a4f964a52062ba1fe3
1/7/14,Hilton O'Hare Airport,2014-01-07T18:05:07-05:00,2014-01-07T18:45:58-05:00,2451,41.97769471635802,-87.90411218531342,,http://foursquare.com/venue/52423f7311d2f4536836031a
1/7/14,Chicago O'Hare International Airport (ORD),2014-01-07T18:55:41-05:00,2014-01-07T19:04:35-05:00,534,41.97727092004163,-87.90440082550049,,http://foursquare.com/venue/4a5a77a4f964a52062ba1fe3
1/7/14,Gate L5,2014-01-07T19:09:18-05:00,2014-01-07T20:07:55-05:00,3517,41.977036,-87.897449,Airport Gate,http://foursquare.com/venue/4c9d09fb8afca09334ecf215
1/7/14,Boston Logan International Airport (BOS),2014-01-07T22:32:36-05:00,2014-01-07T22:54:05-05:00,1289,42.36650312404415,-71.01667642593384,Airport,http://foursquare.com/venue/452113b6f964a520bc3a1fe3
1/7/14,Home,2014-01-07T23:14:17-05:00,2014-01-08T00:00:00-05:00,2743,42.3754311174,-71.1114458017,Home,
1/8/14,Home,2014-01-08T00:00:00-05:00,2014-01-08T09:14:06-05:00,33246,42.3754311174,-71.1114458017,Home,
1/8/14,Henrietta's Table,2014-01-08T09:30:38-05:00,2014-01-08T11:40:48-05:00,7810,42.37210143005068,-71.12299694115246,American Restaurant,http://foursquare.com/venue/4a51523bf964a520edb01fe3
1/8/14,Bank Of America,2014-01-08T11:45:50-05:00,2014-01-08T11:48:49-05:00,179,42.37360433115195,-71.11902218263484,Bank,http://foursquare.com/venue/4ab24fd3f964a520ea6a20e3
1/8/14,Broadway Marketplace,2014-01-08T11:55:21-05:00,2014-01-08T11:58:18-05:00,177,42.37405171427381,-71.11300484548056,Grocery Store,http://foursquare.com/venue/4a661612f964a520ffc71fe3
1/8/14,Home,2014-01-08T12:02:21-05:00,2014-01-08T20:08:03-05:00,29142,42.3754311174,-71.1114458017,Home,
1/8/14,CVS/pharmacy,2014-01-08T20:18:02-05:00,2014-01-08T20:24:02-05:00,360,42.37402935435937,-71.11899197101593,Drugstore / Pharmacy,http://foursquare.com/venue/49df6a3ff964a520c6601fe3
1/8/14,Home,2014-01-08T20:34:48-05:00,2014-01-09T00:00:00-05:00,12312,42.3754311174,-71.1114458017,Home,
1/9/14,Home,2014-01-09T00:00:00-05:00,2014-01-09T10:14:58-05:00,36898,42.3754311174,-71.1114458017,Home,
1/9/14,Proximate,2014-01-09T10:28:38-05:00,2014-01-09T12:59:06-05:00,9028,42.378716,-71.117205,Tech Startup,http://foursquare.com/venue/51c8c0d1498e5d4d09a48362
1/9/14,Border Cafe,2014-01-09T13:08:40-05:00,2014-01-09T14:08:14-05:00,3574,42.3743468,-71.120141,Mexican Restaurant,http://foursquare.com/venue/3fd66200f964a520bded1ee3
1/9/14,Place in Old Cambridge,2014-01-09T14:15:36-05:00,2014-01-09T14:21:17-05:00,341,42.37215804,-71.1205674544,,
1/9/14,Proximate,2014-01-09T14:38:34-05:00,2014-01-09T19:38:28-05:00,17994,42.378716,-71.117205,Tech Startup,http://foursquare.com/venue/51c8c0d1498e5d4d09a48362
1/9/14,Broadway Marketplace,2014-01-09T19:49:59-05:00,2014-01-09T19:54:52-05:00,293,42.37405171427381,-71.11300484548056,Grocery Store,http://foursquare.com/venue/4a661612f964a520ffc71fe3
1/9/14,Home,2014-01-09T20:00:37-05:00,2014-01-10T00:00:00-05:00,14363,42.3754311174,-71.1114458017,Home,
1/10/14,Home,2014-01-10T00:00:00-05:00,2014-01-10T09:48:13-05:00,35293,42.3754311174,-71.1114458017,Home,
1/10/14,Proximate,2014-01-10T10:03:52-05:00,2014-01-10T13:48:46-05:00,13494,42.378716,-71.117205,Tech Startup,http://foursquare.com/venue/51c8c0d1498e5d4d09a48362
1/10/14,Shake Shack,2014-01-10T14:01:17-05:00,2014-01-10T14:36:14-05:00,2097,42.37224129812891,-71.12084999619532,Burger Joint,http://foursquare.com/venue/52b9c0cb498eaffe14f7e162
1/10/14,Proximate,2014-01-10T14:52:36-05:00,2014-01-10T19:26:15-05:00,16419,42.378716,-71.117205,Tech Startup,http://foursquare.com/venue/51c8c0d1498e5d4d09a48362
1/10/14,Broadway Marketplace,2014-01-10T19:35:18-05:00,2014-01-10T19:43:47-05:00,509,42.37405171427381,-71.11300484548056,Grocery Store,http://foursquare.com/venue/4a661612f964a520ffc71fe3
1/10/14,Home,2014-01-10T19:49:21-05:00,2014-01-11T00:00:00-05:00,15039,42.3754311174,-71.1114458017,Home,
1/11/14,Home,2014-01-11T00:00:00-05:00,2014-01-11T13:05:27-05:00,47127,42.3754311174,-71.1114458017,Home,
1/11/14,Dickson Bros. True Value,2014-01-11T13:17:20-05:00,2014-01-11T13:42:18-05:00,1498,42.373343,-71.120418,Hardware Store,http://foursquare.com/venue/4aad3cf3f964a5202f5f20e3
1/11/14,Home,2014-01-11T13:55:05-05:00,2014-01-12T00:00:00-05:00,36295,42.3754311174,-71.1114458017,Home,
1/12/14,Home,2014-01-12T00:00:00-05:00,2014-01-13T00:00:00-05:00,86400,42.3754311174,-71.1114458017,Home,
1/13/14,Home,2014-01-13T00:00:00-05:00,2014-01-13T09:56:57-05:00,35817,42.3754311174,-71.1114458017,Home,
1/13/14,Proximate,2014-01-13T10:05:41-05:00,2014-01-13T13:09:04-05:00,11003,42.378716,-71.117205,Tech Startup,http://foursquare.com/venue/51c8c0d1498e5d4d09a48362
1/13/14,Grendel's Den Restaurant & Bar,2014-01-13T13:21:45-05:00,2014-01-13T14:14:44-05:00,3179,42.37237675230346,-71.12077832221985,Bar,http://foursquare.com/venue/3fd66200f964a520bced1ee3
1/13/14,Proximate,2014-01-13T14:29:16-05:00,2014-01-13T17:03:29-05:00,9253,42.378716,-71.117205,Tech Startup,http://foursquare.com/venue/51c8c0d1498e5d4d09a48362
1/13/14,Harvard Club of Boston,2014-01-13T17:44:45-05:00,2014-01-13T19:16:15-05:00,5490,42.34856237912367,-71.08902744588494,,http://foursquare.com/venue/4a7dac55f964a52020ef1fe3
1/13/14,Trattoria Newbury,2014-01-13T19:23:46-05:00,2014-01-13T20:43:56-05:00,4810,42.34925,-71.083142,,http://foursquare.com/venue/4ff3467ae4b0956dd37501b7
1/13/14,MBTA Bus Stop | Massachusetts Ave. & Newbury St.,2014-01-13T20:48:57-05:00,2014-01-13T20:58:24-05:00,567,42.34801465325017,-71.08813047409058,Bus Station,http://foursquare.com/venue/4e498e94b61c6886484fde5c
1/13/14,Home,2014-01-13T21:21:58-05:00,2014-01-14T00:00:00-05:00,9482,42.3754311174,-71.1114458017,Home,
1/14/14,Home,2014-01-14T00:00:00-05:00,2014-01-14T09:44:14-05:00,35054,42.3754311174,-71.1114458017,Home,
1/14/14,Proximate,2014-01-14T09:52:48-05:00,2014-01-14T12:30:26-05:00,9458,42.378716,-71.117205,Tech Startup,http://foursquare.com/venue/51c8c0d1498e5d4d09a48362
1/14/14,Dickson Bros. True Value,2014-01-14T12:40:38-05:00,2014-01-14T13:26:39-05:00,2761,42.373343,-71.120418,Hardware Store,http://foursquare.com/venue/4aad3cf3f964a5202f5f20e3
1/14/14,Proximate,2014-01-14T13:38:58-05:00,2014-01-14T16:05:13-05:00,8775,42.378716,-71.117205,Tech Startup,http://foursquare.com/venue/51c8c0d1498e5d4d09a48362
1/14/14,Starbucks,2014-01-14T16:19:08-05:00,2014-01-14T16:32:49-05:00,821,42.374494,-71.12017,Coffee Shop,http://foursquare.com/venue/49cabb79f964a520d8581fe3
1/14/14,Proximate,2014-01-14T16:43:30-05:00,2014-01-14T20:18:03-05:00,12873,42.378716,-71.117205,Tech Startup,http://foursquare.com/venue/51c8c0d1498e5d4d09a48362
1/14/14,Broadway Marketplace,2014-01-14T20:28:38-05:00,2014-01-14T20:40:31-05:00,713,42.37405171427381,-71.11300484548056,Grocery Store,http://foursquare.com/venue/4a661612f964a520ffc71fe3
1/14/14,Home,2014-01-14T20:44:10-05:00,2014-01-15T00:00:00-05:00,11750,42.3754311174,-71.1114458017,Home,
1/15/14,Home,2014-01-15T00:00:00-05:00,2014-01-15T09:47:20-05:00,35240,42.3754311174,-71.1114458017,Home,
1/15/14,Proximate,2014-01-15T09:57:56-05:00,2014-01-15T13:33:50-05:00,12954,42.378716,-71.117205,Tech Startup,http://foursquare.com/venue/51c8c0d1498e5d4d09a48362
1/15/14,Border Cafe,2014-01-15T13:45:04-05:00,2014-01-15T14:30:35-05:00,2731,42.3743468,-71.120141,Mexican Restaurant,http://foursquare.com/venue/3fd66200f964a520bded1ee3
1/15/14,Proximate,2014-01-15T14:41:13-05:00,2014-01-15T21:11:44-05:00,23431,42.378716,-71.117205,Tech Startup,http://foursquare.com/venue/51c8c0d1498e5d4d09a48362
1/15/14,Legal Sea Foods - Charles Square,2014-01-15T21:27:23-05:00,2014-01-15T23:03:57-05:00,5794,42.37220351484281,-71.1230027436908,Seafood Restaurant,http://foursquare.com/venue/4bdcb5fa3904a59331664f9e
1/15/14,Home,2014-01-15T23:22:35-05:00,2014-01-16T00:00:00-05:00,2245,42.3754311174,-71.1114458017,Home,
1/16/14,Home,2014-01-16T00:00:00-05:00,2014-01-16T08:50:50-05:00,31850,42.3754311174,-71.1114458017,Home,
1/16/14,Boston Logan International Airport (BOS),2014-01-16T09:12:53-05:00,2014-01-16T10:15:04-05:00,3731,42.36650312404415,-71.01667642593384,Airport,http://foursquare.com/venue/452113b6f964a520bc3a1fe3
1/16/14,Place in Logan International Airport,2014-01-16T10:16:35-05:00,2014-01-16T10:26:21-05:00,586,42.3649451327,-71.0163293501,,
1/16/14,NTN24,2014-01-16T12:57:33-05:00,2014-01-16T13:12:34-05:00,901,38.901567,-77.032106,Office,http://foursquare.com/venue/4ec5b4b38b81dcfdc16568d3
1/16/14,District Taco,2014-01-16T13:22:01-05:00,2014-01-16T14:18:03-05:00,3362,38.89738402623882,-77.03012569690904,Taco Place,http://foursquare.com/venue/4fa1622fe4b03a1030b13c5b
1/16/14,NTN24,2014-01-16T14:27:17-05:00,2014-01-16T17:10:01-05:00,9764,38.901567,-77.032106,Office,http://foursquare.com/venue/4ec5b4b38b81dcfdc16568d3
1/16/14,Staples,2014-01-16T17:14:06-05:00,2014-01-16T17:21:58-05:00,472,38.89984,-77.0291,Paper / Office Supplies Store,http://foursquare.com/venue/4ac27cc5f964a5205a9920e3
1/16/14,NTN24,2014-01-16T17:27:05-05:00,2014-01-16T21:10:14-05:00,13389,38.901567,-77.032106,Office,http://foursquare.com/venue/4ec5b4b38b81dcfdc16568d3
1/16/14,Whole Foods Market,2014-01-16T21:43:38-05:00,2014-01-16T21:50:02-05:00,384,38.920938,-77.071804,Grocery Store,http://foursquare.com/venue/4aad58b8f964a520d25f20e3
1/16/14,2440 39th St NW,2014-01-16T21:59:34-05:00,2014-01-17T00:00:00-05:00,7226,38.92592014653639,-77.07371486668141,,http://foursquare.com/venue/520fad0811d2245250b13cd1
1/17/14,2440 39th St NW,2014-01-17T00:00:00-05:00,2014-01-17T09:33:40-05:00,34420,38.92592014653639,-77.07371486668141,,http://foursquare.com/venue/520fad0811d2245250b13cd1
1/17/14,"WMATA Bus Stop #1001805 (31, 32, 36)",2014-01-17T09:41:21-05:00,2014-01-17T09:49:00-05:00,459,38.92229853987276,-77.07277336996707,Bus Line,http://foursquare.com/venue/4e9b7ac54901d3b0b7587b98
1/17/14,CVS/pharmacy,2014-01-17T09:52:20-05:00,2014-01-17T10:01:09-05:00,529,38.92005,-77.071487,Drugstore / Pharmacy,http://foursquare.com/venue/4a89f3c7f964a520790920e3
1/17/14,Apple Store,2014-01-17T10:23:52-05:00,2014-01-17T10:36:20-05:00,748,38.90590722335151,-77.0626272217989,Electronics Store,http://foursquare.com/venue/4bdb67c03904a59377434a9e
1/17/14,Safeway,2014-01-17T10:51:25-05:00,2014-01-17T11:00:07-05:00,522,38.91567980755536,-77.06758975982666,Grocery Store,http://foursquare.com/venue/4bb614dc2f70c9b656d68430
1/17/14,2440 39th St NW,2014-01-17T11:19:23-05:00,2014-01-17T16:30:13-05:00,18650,38.92592014653639,-77.07371486668141,,http://foursquare.com/venue/520fad0811d2245250b13cd1
1/17/14,Old Glory,2014-01-17T17:01:17-05:00,2014-01-17T19:39:38-05:00,9501,38.90529562790965,-77.06227307487663,BBQ Joint,http://foursquare.com/venue/40f47780f964a5207c0a1fe3
1/17/14,Safeway,2014-01-17T19:59:55-05:00,2014-01-17T20:10:45-05:00,650,38.91567980755536,-77.06758975982666,Grocery Store,http://foursquare.com/venue/4bb614dc2f70c9b656d68430
1/17/14,2440 39th St NW,2014-01-17T20:29:42-05:00,2014-01-18T00:00:00-05:00,12618,38.92592014653639,-77.07371486668141,,http://foursquare.com/venue/520fad0811d2245250b13cd1
1/18/14,2440 39th St NW,2014-01-18T00:00:00-05:00,2014-01-18T14:02:36-05:00,50556,38.92592014653639,-77.07371486668141,,http://foursquare.com/venue/520fad0811d2245250b13cd1
1/18/14,IKEA,2014-01-18T14:47:06-05:00,2014-01-18T18:29:23-05:00,13337,39.02135091580463,-76.92824363708496,,http://foursquare.com/venue/4b1a8fb7f964a52058ec23e3
1/18/14,2440 39th St NW,2014-01-18T19:05:11-05:00,2014-01-19T00:00:00-05:00,17689,38.92592014653639,-77.07371486668141,,http://foursquare.com/venue/520fad0811d2245250b13cd1
1/19/14,2440 39th St NW,2014-01-19T00:00:00-05:00,2014-01-19T14:18:16-05:00,51496,38.92592014653639,-77.07371486668141,,http://foursquare.com/venue/520fad0811d2245250b13cd1
1/19/14,Surfside,2014-01-19T14:26:18-05:00,2014-01-19T15:22:27-05:00,3369,38.92206976004444,-77.072873711586,Mexican Restaurant,http://foursquare.com/venue/4a02762ef964a52056711fe3
1/19/14,CVS/pharmacy,2014-01-19T15:26:33-05:00,2014-01-19T16:03:32-05:00,2219,38.92005,-77.071487,Drugstore / Pharmacy,http://foursquare.com/venue/4a89f3c7f964a520790920e3
1/19/14,2440 39th St NW,2014-01-19T16:13:24-05:00,2014-01-20T00:00:00-05:00,27996,38.92592014653639,-77.07371486668141,,http://foursquare.com/venue/520fad0811d2245250b13cd1
1/20/14,2440 39th St NW,2014-01-20T00:00:00-05:00,2014-01-20T20:36:32-05:00,74192,38.92592014653639,-77.07371486668141,,http://foursquare.com/venue/520fad0811d2245250b13cd1
1/20/14,2440 39th St NW,2014-01-20T20:45:29-05:00,2014-01-21T00:00:00-05:00,11671,38.92592014653639,-77.07371486668141,,http://foursquare.com/venue/520fad0811d2245250b13cd1
1/21/14,2440 39th St NW,2014-01-21T00:00:00-05:00,2014-01-21T13:12:16-05:00,47536,38.92592014653639,-77.07371486668141,,http://foursquare.com/venue/520fad0811d2245250b13cd1
1/21/14,Whole Foods Market,2014-01-21T13:27:20-05:00,2014-01-21T14:08:52-05:00,2492,38.920938,-77.071804,Grocery Store,http://foursquare.com/venue/4aad58b8f964a520d25f20e3
1/21/14,2440 39th St NW,2014-01-21T14:18:35-05:00,2014-01-22T00:00:00-05:00,34885,38.92592014653639,-77.07371486668141,,http://foursquare.com/venue/520fad0811d2245250b13cd1
1/22/14,2440 39th St NW,2014-01-22T00:00:00-05:00,2014-01-22T16:21:40-05:00,58900,38.92592014653639,-77.07371486668141,,http://foursquare.com/venue/520fad0811d2245250b13cd1
1/22/14,2440 39th St NW,2014-01-22T16:21:40-05:00,2014-01-23T00:00:00-05:00,27500,38.92592014653639,-77.07371486668141,,http://foursquare.com/venue/520fad0811d2245250b13cd1
1/23/14,2440 39th St NW,2014-01-23T00:00:00-05:00,2014-01-23T18:19:51-05:00,65991,38.92592014653639,-77.07371486668141,,http://foursquare.com/venue/520fad0811d2245250b13cd1
1/23/14,CVS/pharmacy,2014-01-23T18:30:38-05:00,2014-01-23T18:58:31-05:00,1673,38.92005,-77.071487,Drugstore / Pharmacy,http://foursquare.com/venue/4a89f3c7f964a520790920e3
1/23/14,2440 39th St NW,2014-01-23T19:10:24-05:00,2014-01-24T00:00:00-05:00,17376,38.92592014653639,-77.07371486668141,,http://foursquare.com/venue/520fad0811d2245250b13cd1
1/24/14,2440 39th St NW,2014-01-24T00:00:00-05:00,2014-01-25T00:00:00-05:00,86400,38.92592014653639,-77.07371486668141,,http://foursquare.com/venue/520fad0811d2245250b13cd1
1/25/14,2440 39th St NW,2014-01-25T00:00:00-05:00,2014-01-25T10:27:55-05:00,37675,38.92592014653639,-77.07371486668141,,http://foursquare.com/venue/520fad0811d2245250b13cd1
1/25/14,CVS/pharmacy,2014-01-25T10:37:15-05:00,2014-01-25T10:41:31-05:00,256,38.92005,-77.071487,Drugstore / Pharmacy,http://foursquare.com/venue/4a89f3c7f964a520790920e3
1/25/14,Place in West End,2014-01-25T11:10:42-05:00,2014-01-25T11:14:52-05:00,250,38.9004406524,-77.0498897402,,
1/25/14,Place in Ronald Reagan Washington National Airport,2014-01-25T11:33:27-05:00,2014-01-25T11:40:58-05:00,451,38.8477633282,-77.0423577698,,
1/25/14,Ronald Reagan Washington National Airport (DCA),2014-01-25T11:40:58-05:00,2014-01-25T12:13:18-05:00,1940,38.85304370184257,-77.04231262207031,Airport,http://foursquare.com/venue/44d17cecf964a5202b361fe3
1/25/14,Boston Logan International Airport (BOS),2014-01-25T13:40:34-05:00,2014-01-25T13:44:25-05:00,231,42.36650312404415,-71.01667642593384,Airport,http://foursquare.com/venue/452113b6f964a520bc3a1fe3
1/25/14,Home,2014-01-25T14:48:48-05:00,2014-01-25T17:59:07-05:00,11419,42.3754311174,-71.1114458017,Home,
1/26/14,Home,2014-01-26T21:41:28-05:00,2014-01-27T00:00:00-05:00,8312,42.3754311174,-71.1114458017,Home,
1/27/14,Home,2014-01-27T00:00:00-05:00,2014-01-27T18:15:33-05:00,65733,42.3754311174,-71.1114458017,Home,
1/27/14,Park,2014-01-27T18:30:55-05:00,2014-01-27T20:02:01-05:00,5466,42.37169409933257,-71.12097185013617,Gastropub,http://foursquare.com/venue/4f7c8902e4b032c26c6798db
1/27/14,Home,2014-01-27T20:18:48-05:00,2014-01-28T00:00:00-05:00,13272,42.3754311174,-71.1114458017,Home,
1/28/14,Home,2014-01-28T00:00:00-05:00,2014-01-28T10:48:12-05:00,38892,42.3754311174,-71.1114458017,Home,
1/28/14,Proximate,2014-01-28T11:03:18-05:00,2014-01-28T12:49:24-05:00,6366,42.378716,-71.117205,Tech Startup,http://foursquare.com/venue/51c8c0d1498e5d4d09a48362
1/28/14,Border Cafe,2014-01-28T12:59:02-05:00,2014-01-28T13:31:19-05:00,1937,42.3743468,-71.120141,Mexican Restaurant,http://foursquare.com/venue/3fd66200f964a520bded1ee3
1/28/14,Proximate,2014-01-28T13:41:32-05:00,2014-01-28T16:03:20-05:00,8508,42.378716,-71.117205,Tech Startup,http://foursquare.com/venue/51c8c0d1498e5d4d09a48362
1/28/14,Proximate,2014-01-28T16:17:57-05:00,2014-01-28T17:50:28-05:00,5551,42.378716,-71.117205,Tech Startup,http://foursquare.com/venue/51c8c0d1498e5d4d09a48362
1/28/14,Park,2014-01-28T18:02:43-05:00,2014-01-28T20:00:04-05:00,7041,42.37169409933257,-71.12097185013617,Gastropub,http://foursquare.com/venue/4f7c8902e4b032c26c6798db
1/28/14,Home,2014-01-28T20:07:39-05:00,2014-01-29T00:00:00-05:00,13941,42.3754311174,-71.1114458017,Home,
1/29/14,Home,2014-01-29T00:00:00-05:00,2014-01-29T09:20:05-05:00,33605,42.3754311174,-71.1114458017,Home,
1/29/14,Harvard Club of Boston,2014-01-29T09:49:15-05:00,2014-01-29T11:41:23-05:00,6728,42.34856237912367,-71.08902744588494,,http://foursquare.com/venue/4a7dac55f964a52020ef1fe3
1/29/14,Grendel's Den Restaurant & Bar,2014-01-29T12:17:45-05:00,2014-01-29T13:35:13-05:00,4648,42.37237675230346,-71.12077832221985,Bar,http://foursquare.com/venue/3fd66200f964a520bced1ee3
1/29/14,Harvard Alumni Association,2014-01-29T13:39:26-05:00,2014-01-29T14:29:50-05:00,3024,42.37317592010315,-71.12325225275964,University,http://foursquare.com/venue/4b5dc68df964a520026b29e3
1/29/14,Proximate,2014-01-29T14:43:09-05:00,2014-01-29T20:12:01-05:00,19732,42.378716,-71.117205,Tech Startup,http://foursquare.com/venue/51c8c0d1498e5d4d09a48362
1/29/14,Home,2014-01-29T20:30:20-05:00,2014-01-30T00:00:00-05:00,12580,42.3754311174,-71.1114458017,Home,
1/30/14,Home,2014-01-30T00:00:00-05:00,2014-01-30T10:48:29-05:00,38909,42.3754311174,-71.1114458017,Home,
1/30/14,Proximate,2014-01-30T10:57:09-05:00,2014-01-30T13:17:41-05:00,8432,42.378716,-71.117205,Tech Startup,http://foursquare.com/venue/51c8c0d1498e5d4d09a48362
1/30/14,Shake Shack,2014-01-30T13:32:33-05:00,2014-01-30T14:48:02-05:00,4529,42.37224129812891,-71.12084999619532,Burger Joint,http://foursquare.com/venue/52b9c0cb498eaffe14f7e162
1/30/14,Proximate,2014-01-30T15:00:06-05:00,2014-01-30T19:12:46-05:00,15160,42.378716,-71.117205,Tech Startup,http://foursquare.com/venue/51c8c0d1498e5d4d09a48362
1/30/14,Home,2014-01-30T19:22:57-05:00,2014-01-30T19:59:40-05:00,2203,42.3754311174,-71.1114458017,Home,
1/30/14,Meadhall,2014-01-30T20:28:17-05:00,2014-01-31T00:00:00-05:00,12703,42.36365726858562,-71.08726143836975,,http://foursquare.com/venue/4db81694f7b15ca52ce24788
1/31/14,Meadhall,2014-01-31T00:00:00-05:00,2014-01-31T00:53:40-05:00,3220,42.36365726858562,-71.08726143836975,,http://foursquare.com/venue/4db81694f7b15ca52ce24788
1/31/14,Home,2014-01-31T00:59:24-05:00,2014-01-31T12:54:37-05:00,42913,42.3754311174,-71.1114458017,Home,
1/31/14,Proximate,2014-01-31T13:02:40-05:00,2014-01-31T15:34:06-05:00,9086,42.378716,-71.117205,Tech Startup,http://foursquare.com/venue/51c8c0d1498e5d4d09a48362
1/31/14,Place in Old Cambridge,2014-01-31T15:55:21-05:00,2014-01-31T17:34:54-05:00,5973,42.3771299622,-71.1241282979,,
1/31/14,Home,2014-01-31T17:53:38-05:00,2014-01-31T18:19:49-05:00,1571,42.3754311174,-71.1114458017,Home,
1/31/14,Place in Old Cambridge,2014-01-31T18:29:22-05:00,2014-01-31T19:47:12-05:00,4670,42.3722049374,-71.1155814053,,
1/31/14,Home,2014-01-31T19:55:47-05:00,2014-02-01T00:00:00-05:00,14653,42.3754311174,-71.1114458017,Home,
2/1/14,Home,2014-02-01T00:00:00-05:00,2014-02-01T12:47:17-05:00,46037,42.3754311174,-71.1114458017,Home,
2/1/14,Proximate,2014-02-01T13:00:36-05:00,2014-02-01T14:41:15-05:00,6039,42.378716,-71.117205,Tech Startup,http://foursquare.com/venue/51c8c0d1498e5d4d09a48362
2/1/14,Dickson Bros. True Value,2014-02-01T14:53:57-05:00,2014-02-01T16:08:15-05:00,4458,42.373343,-71.120418,Hardware Store,http://foursquare.com/venue/4aad3cf3f964a5202f5f20e3
2/1/14,Home,2014-02-01T16:25:22-05:00,2014-02-02T00:00:00-05:00,27278,42.3754311174,-71.1114458017,Home,
2/2/14,Home,2014-02-02T00:00:00-05:00,2014-02-02T14:09:39-05:00,50979,42.3754311174,-71.1114458017,Home,
2/2/14,Floyd's 99 Barbershop,2014-02-02T14:29:27-05:00,2014-02-02T15:17:19-05:00,2872,42.38213717937469,-71.11979826,Salon / Barbershop,http://foursquare.com/venue/4a9d711ff964a520443820e3
2/2/14,Broadway Marketplace,2014-02-02T15:33:29-05:00,2014-02-02T15:50:49-05:00,1040,42.37405171427381,-71.11300484548056,Grocery Store,http://foursquare.com/venue/4a661612f964a520ffc71fe3
2/2/14,Home,2014-02-02T15:55:29-05:00,2014-02-02T18:49:06-05:00,10417,42.3754311174,-71.1114458017,Home,
2/2/14,Place in Coolidge Hill,2014-02-02T19:13:09-05:00,2014-02-02T22:20:35-05:00,11246,42.3742313284,-71.1320735788,,
2/2/14,Home,2014-02-02T22:46:13-05:00,2014-02-03T00:00:00-05:00,4427,42.3754311174,-71.1114458017,Home,
2/3/14,Home,2014-02-03T00:00:00-05:00,2014-02-04T00:00:00-05:00,86400,42.3754311174,-71.1114458017,Home,
2/4/14,Home,2014-02-04T00:00:00-05:00,2014-02-04T09:37:43-05:00,34663,42.3754311174,-71.1114458017,Home,
2/4/14,Proximate,2014-02-04T09:45:27-05:00,2014-02-04T12:37:00-05:00,10293,42.378716,-71.117205,Tech Startup,http://foursquare.com/venue/51c8c0d1498e5d4d09a48362
2/4/14,Border Cafe,2014-02-04T12:47:04-05:00,2014-02-04T14:47:39-05:00,7235,42.3743468,-71.120141,Mexican Restaurant,http://foursquare.com/venue/3fd66200f964a520bded1ee3
2/4/14,Proximate,2014-02-04T14:58:34-05:00,2014-02-04T19:35:29-05:00,16615,42.378716,-71.117205,Tech Startup,http://foursquare.com/venue/51c8c0d1498e5d4d09a48362
2/4/14,Home,2014-02-04T19:53:38-05:00,2014-02-05T00:00:00-05:00,14782,42.3754311174,-71.1114458017,Home,
2/5/14,Home,2014-02-05T00:00:00-05:00,2014-02-05T11:00:32-05:00,39632,42.3754311174,-71.1114458017,Home,
2/5/14,Proximate,2014-02-05T11:11:18-05:00,2014-02-05T13:33:57-05:00,8559,42.378716,-71.117205,Tech Startup,http://foursquare.com/venue/51c8c0d1498e5d4d09a48362
2/5/14,Proximate,2014-02-05T13:47:06-05:00,2014-02-05T20:02:44-05:00,22538,42.378716,-71.117205,Tech Startup,http://foursquare.com/venue/51c8c0d1498e5d4d09a48362
2/5/14,Home,2014-02-05T20:11:28-05:00,2014-02-06T00:00:00-05:00,13712,42.3754311174,-71.1114458017,Home,
2/6/14,Home,2014-02-06T00:00:00-05:00,2014-02-06T09:14:55-05:00,33295,42.3754311174,-71.1114458017,Home,
2/6/14,Place in Old Cambridge,2014-02-06T09:18:51-05:00,2014-02-06T09:22:56-05:00,245,42.3753690939,-71.1114403623,,
2/6/14,Mitchell Dong,2014-02-06T09:34:08-05:00,2014-02-06T11:21:20-05:00,6432,42.3774394608,-71.123998503,Home,
2/6/14,Grendel's Den Restaurant & Bar,2014-02-06T11:37:42-05:00,2014-02-06T12:52:42-05:00,4500,42.37237675230346,-71.12077832221985,Bar,http://foursquare.com/venue/3fd66200f964a520bced1ee3
2/6/14,Proximate,2014-02-06T13:10:25-05:00,2014-02-06T15:46:55-05:00,9390,42.378716,-71.117205,Tech Startup,http://foursquare.com/venue/51c8c0d1498e5d4d09a48362
2/6/14,Home,2014-02-06T16:04:53-05:00,2014-02-06T19:44:57-05:00,13204,42.3754311174,-71.1114458017,Home,
2/6/14,Home,2014-02-06T23:51:14-05:00,2014-02-07T00:00:00-05:00,526,42.3754311174,-71.1114458017,Home,
2/7/14,Home,2014-02-07T00:00:00-05:00,2014-02-07T10:19:26-05:00,37166,42.3754311174,-71.1114458017,Home,
2/7/14,Proximate,2014-02-07T10:30:58-05:00,2014-02-07T11:02:17-05:00,1879,42.378716,-71.117205,Tech Startup,http://foursquare.com/venue/51c8c0d1498e5d4d09a48362
2/7/14,Legal Sea Foods - Charles Square,2014-02-07T11:17:37-05:00,2014-02-07T12:40:29-05:00,4972,42.37220351484281,-71.1230027436908,Seafood Restaurant,http://foursquare.com/venue/4bdcb5fa3904a59331664f9e
2/7/14,Harvard Innovation Lab,2014-02-07T12:57:45-05:00,2014-02-07T16:39:06-05:00,13281,42.36403242532342,-71.12407621183526,College Technology Building,http://foursquare.com/venue/4e5d4676ae60839ea2e29e64
2/7/14,Proximate,2014-02-07T16:59:37-05:00,2014-02-07T17:11:00-05:00,683,42.378716,-71.117205,Tech Startup,http://foursquare.com/venue/51c8c0d1498e5d4d09a48362
2/7/14,Park,2014-02-07T17:22:49-05:00,2014-02-07T19:05:59-05:00,6190,42.37169409933257,-71.12097185013617,Gastropub,http://foursquare.com/venue/4f7c8902e4b032c26c6798db
2/7/14,Home,2014-02-07T19:24:47-05:00,2014-02-08T00:00:00-05:00,16513,42.3754311174,-71.1114458017,Home,
2/8/14,Home,2014-02-08T00:00:00-05:00,2014-02-08T11:04:32-05:00,39872,42.3754311174,-71.1114458017,Home,
2/8/14,Dickson Bros. True Value,2014-02-08T11:16:26-05:00,2014-02-08T12:46:35-05:00,5409,42.373343,-71.120418,Hardware Store,http://foursquare.com/venue/4aad3cf3f964a5202f5f20e3
2/8/14,Starbucks,2014-02-08T12:48:43-05:00,2014-02-08T13:12:08-05:00,1405,42.372485,-71.119452,Caf,http://foursquare.com/venue/49bc4e56f964a52028541fe3
2/8/14,Broadway Marketplace,2014-02-08T13:22:38-05:00,2014-02-08T13:32:00-05:00,562,42.37405171427381,-71.11300484548056,Grocery Store,http://foursquare.com/venue/4a661612f964a520ffc71fe3
2/8/14,Home,2014-02-08T13:35:50-05:00,2014-02-08T13:49:05-05:00,795,42.3754311174,-71.1114458017,Home,
2/8/14,Science Center Plaza,2014-02-08T13:55:18-05:00,2014-02-08T13:59:02-05:00,224,42.37586051920407,-71.11671274278848,Plaza,http://foursquare.com/venue/517c126de4b0db4bc4f91b0a
2/8/14,Boston Tea Stop,2014-02-08T14:06:40-05:00,2014-02-08T14:56:50-05:00,3010,42.37202556731354,-71.12067591907267,Tea Room,http://foursquare.com/venue/49fe1e48f964a520716f1fe3
2/8/14,Home,2014-02-08T15:12:26-05:00,2014-02-09T00:00:00-05:00,31654,42.3754311174,-71.1114458017,Home,
2/9/14,Home,2014-02-09T00:00:00-05:00,2014-02-09T14:45:28-05:00,53128,42.3754311174,-71.1114458017,Home,
2/9/14,The Home Depot,2014-02-09T15:02:18-05:00,2014-02-09T15:54:29-05:00,3131,42.38981956708074,-71.07984114884522,Hardware Store,http://foursquare.com/venue/4b24776ff964a520d76724e3
2/9/14,Home,2014-02-09T16:07:43-05:00,2014-02-09T21:02:34-05:00,17691,42.3754311174,-71.1114458017,Home,
2/9/14,Home,2014-02-09T22:04:01-05:00,2014-02-10T00:00:00-05:00,6959,42.3754311174,-71.1114458017,Home,
2/10/14,Home,2014-02-10T00:00:00-05:00,2014-02-10T16:27:56-05:00,59276,42.3754311174,-71.1114458017,Home,
2/10/14,T3 Innovation Studio,2014-02-10T16:53:27-05:00,2014-02-10T18:17:40-05:00,5053,42.35303956039798,-71.04524705235535,Office,http://foursquare.com/venue/520a556611d28b4a76ec352c
2/10/14,Home,2014-02-10T18:53:12-05:00,2014-02-11T00:00:00-05:00,18408,42.3754311174,-71.1114458017,Home,
2/11/14,Home,2014-02-11T00:00:00-05:00,2014-02-11T09:54:42-05:00,35682,42.3754311174,-71.1114458017,Home,
2/11/14,Place in Old Cambridge,2014-02-11T10:01:13-05:00,2014-02-11T10:09:58-05:00,525,42.3770093257,-71.1168284018,,
2/11/14,Proximate,2014-02-11T10:14:39-05:00,2014-02-11T19:11:16-05:00,32197,42.378716,-71.117205,Tech Startup,http://foursquare.com/venue/51c8c0d1498e5d4d09a48362
2/11/14,Home,2014-02-11T19:20:52-05:00,2014-02-12T00:00:00-05:00,16748,42.3754311174,-71.1114458017,Home,
2/12/14,Home,2014-02-12T00:00:00-05:00,2014-02-12T10:10:21-05:00,36621,42.3754311174,-71.1114458017,Home,
2/12/14,Amtrak South Station,2014-02-12T10:39:40-05:00,2014-02-12T11:04:58-05:00,1518,42.35141860782156,-71.0551073348505,Train Station,http://foursquare.com/venue/52e42895498eb9e24848960b
2/12/14,Place in East End,2014-02-12T19:37:10-05:00,2014-02-12T19:42:59-05:00,349,38.8967316187,-77.0059959584,,
2/12/14,2440 39th Street NW,2014-02-12T20:05:50-05:00,2014-02-12T22:03:24-05:00,7054,38.92592014653639,-77.07371486668141,Home (private),http://foursquare.com/venue/520fad54498e47affbce37d4
2/13/14,2440 39th Street NW,2014-02-13T09:28:32-05:00,2014-02-13T13:26:31-05:00,14279,38.92592014653639,-77.07371486668141,Home (private),http://foursquare.com/venue/520fad54498e47affbce37d4
2/13/14,Whole Foods Market,2014-02-13T13:36:34-05:00,2014-02-13T14:32:53-05:00,3379,38.920938,-77.071804,Grocery Store,http://foursquare.com/venue/4aad58b8f964a520d25f20e3
2/13/14,2440 39th Street NW,2014-02-13T14:45:56-05:00,2014-02-14T00:00:00-05:00,33244,38.92592014653639,-77.07371486668141,Home (private),http://foursquare.com/venue/520fad54498e47affbce37d4
2/14/14,2440 39th Street NW,2014-02-14T00:00:00-05:00,2014-02-15T00:00:00-05:00,86400,38.92592014653639,-77.07371486668141,Home (private),http://foursquare.com/venue/520fad54498e47affbce37d4
2/15/14,2440 39th Street NW,2014-02-15T00:00:00-05:00,2014-02-15T12:27:14-05:00,44834,38.92592014653639,-77.07371486668141,Home (private),http://foursquare.com/venue/520fad54498e47affbce37d4
2/15/14,Surfside,2014-02-15T12:35:06-05:00,2014-02-15T12:44:12-05:00,546,38.92206976004444,-77.072873711586,Mexican Restaurant,http://foursquare.com/venue/4a02762ef964a52056711fe3
2/15/14,Place in Glover Park,2014-02-15T12:52:32-05:00,2014-02-15T16:05:23-05:00,11571,38.9219317032,-77.0772055012,,
2/15/14,Whole Foods Market,2014-02-15T16:13:27-05:00,2014-02-15T17:27:20-05:00,4433,38.920938,-77.071804,Grocery Store,http://foursquare.com/venue/4aad58b8f964a520d25f20e3
2/15/14,2440 39th Street NW,2014-02-15T17:36:24-05:00,2014-02-16T00:00:00-05:00,23016,38.92592014653639,-77.07371486668141,Home (private),http://foursquare.com/venue/520fad54498e47affbce37d4
2/16/14,2440 39th Street NW,2014-02-16T00:00:00-05:00,2014-02-16T14:16:22-05:00,51382,38.92592014653639,-77.07371486668141,Home (private),http://foursquare.com/venue/520fad54498e47affbce37d4
2/16/14,Place in Cloisters,2014-02-16T14:46:09-05:00,2014-02-16T14:49:35-05:00,206,38.9089122568,-77.0641352982,,
2/16/14,Apple Store,2014-02-16T14:54:19-05:00,2014-02-16T15:12:29-05:00,1090,38.90590722335151,-77.0626272217989,Electronics Store,http://foursquare.com/venue/4bdb67c03904a59377434a9e
2/16/14,CB2,2014-02-16T15:16:32-05:00,2014-02-16T16:11:29-05:00,3297,38.90516808750274,-77.06643283017698,Furniture / Home Store,http://foursquare.com/venue/4d2e1c6f79dd6ea8b66786d3
2/16/14,TJ Maxx & HomeGoods,2014-02-16T16:20:09-05:00,2014-02-16T18:25:59-05:00,7550,38.90506846179218,-77.06456095806466,Department Store,http://foursquare.com/venue/522c8c8011d277f9f23b1a0c
2/16/14,H&M,2014-02-16T18:31:38-05:00,2014-02-16T19:06:52-05:00,2114,38.9052623578,-77.0602639566,Work,
2/16/14,Safeway,2014-02-16T19:13:37-05:00,2014-02-16T19:51:01-05:00,2244,38.91567980755536,-77.06758975982666,Grocery Store,http://foursquare.com/venue/4bb614dc2f70c9b656d68430
2/16/14,2440 39th Street NW,2014-02-16T19:57:07-05:00,2014-02-17T00:00:00-05:00,14573,38.92592014653639,-77.07371486668141,Home (private),http://foursquare.com/venue/520fad54498e47affbce37d4
2/17/14,2440 39th Street NW,2014-02-17T00:00:00-05:00,2014-02-17T13:03:35-05:00,47015,38.92592014653639,-77.07371486668141,Home (private),http://foursquare.com/venue/520fad54498e47affbce37d4
2/17/14,Chipotle Mexican Grill,2014-02-17T13:11:05-05:00,2014-02-17T13:27:42-05:00,997,38.92092198295547,-77.07226186717197,Mexican Restaurant,http://foursquare.com/venue/4dd3006345dd45f71925c819
2/17/14,2440 39th Street NW,2014-02-17T13:36:02-05:00,2014-02-18T00:00:00-05:00,37438,38.92592014653639,-77.07371486668141,Home (private),http://foursquare.com/venue/520fad54498e47affbce37d4
2/18/14,2440 39th Street NW,2014-02-18T00:00:00-05:00,2014-02-18T09:41:31-05:00,34891,38.92592014653639,-77.07371486668141,Home (private),http://foursquare.com/venue/520fad54498e47affbce37d4
2/18/14,Place in East End,2014-02-18T10:12:33-05:00,2014-02-18T10:14:53-05:00,140,38.8980210188,-77.005702946,,
2/18/14,Place in Neponset River Reservation,2014-02-18T18:13:33-05:00,2014-02-18T18:17:50-05:00,257,42.2163763896,-71.1442122739,,
2/18/14,Home,2014-02-18T19:05:43-05:00,2014-02-19T00:00:00-05:00,17657,42.3754311174,-71.1114458017,Home,
2/19/14,Home,2014-02-19T00:00:00-05:00,2014-02-19T10:08:26-05:00,36506,42.3754311174,-71.1114458017,Home,
2/19/14,Mitchell Dong,2014-02-19T10:29:08-05:00,2014-02-19T14:38:54-05:00,14986,42.3774394608,-71.123998503,Home,
2/19/14,Border Cafe,2014-02-19T14:49:34-05:00,2014-02-19T16:10:42-05:00,4868,42.3743468,-71.120141,Mexican Restaurant,http://foursquare.com/venue/3fd66200f964a520bded1ee3
2/19/14,Eliot House,2014-02-19T16:20:16-05:00,2014-02-19T18:50:29-05:00,9013,42.37018114178375,-71.12128257751465,College Residence Hall,http://foursquare.com/venue/4b6c63ccf964a52019362ce3
2/19/14,Cafe Gato Rojo,2014-02-19T19:00:12-05:00,2014-02-19T20:26:43-05:00,5191,42.37359441115208,-71.11834019422531,Caf,http://foursquare.com/venue/4b63076ff964a5208c5e2ae3
2/19/14,Home,2014-02-19T20:36:08-05:00,2014-02-20T00:00:00-05:00,12232,42.3754311174,-71.1114458017,Home,
2/20/14,Home,2014-02-20T00:00:00-05:00,2014-02-20T11:11:58-05:00,40318,42.3754311174,-71.1114458017,Home,
2/20/14,Mitchell Dong,2014-02-20T11:26:42-05:00,2014-02-20T14:17:48-05:00,10266,42.3774394608,-71.123998503,Home,
2/20/14,Caspersen Student Center,2014-02-20T14:32:44-05:00,2014-02-20T14:54:55-05:00,1331,42.37890166598297,-71.11866242152347,College Cafeteria,http://foursquare.com/venue/4e790134b0fb5d40982b00d0
2/20/14,Proximate,2014-02-20T14:59:04-05:00,2014-02-20T17:30:43-05:00,9099,42.378716,-71.117205,Tech Startup,http://foursquare.com/venue/51c8c0d1498e5d4d09a48362
2/20/14,Queens Head Pub,2014-02-20T17:38:59-05:00,2014-02-20T19:11:46-05:00,5567,42.375886,-71.115435,Bar,http://foursquare.com/venue/4ad6a980f964a5201a0821e3
2/20/14,Home,2014-02-20T19:18:10-05:00,2014-02-21T00:00:00-05:00,16910,42.3754311174,-71.1114458017,Home,
2/21/14,Home,2014-02-21T00:00:00-05:00,2014-02-21T09:43:54-05:00,35034,42.3754311174,-71.1114458017,Home,
2/21/14,Harvard Alumni Association,2014-02-21T10:01:19-05:00,2014-02-21T10:45:24-05:00,2645,42.37317592010315,-71.12325225275964,University,http://foursquare.com/venue/4b5dc68df964a520026b29e3
2/21/14,Proximate,2014-02-21T11:09:24-05:00,2014-02-21T13:43:42-05:00,9258,42.378716,-71.117205,Tech Startup,http://foursquare.com/venue/51c8c0d1498e5d4d09a48362
2/21/14,Border Cafe,2014-02-21T13:54:03-05:00,2014-02-21T15:20:13-05:00,5170,42.3743468,-71.120141,Mexican Restaurant,http://foursquare.com/venue/3fd66200f964a520bded1ee3
2/21/14,Proximate,2014-02-21T15:32:28-05:00,2014-02-21T16:39:24-05:00,4016,42.378716,-71.117205,Tech Startup,http://foursquare.com/venue/51c8c0d1498e5d4d09a48362
2/21/14,Home,2014-02-21T16:48:26-05:00,2014-02-21T18:10:17-05:00,4911,42.3754311174,-71.1114458017,Home,
2/21/14,Home,2014-02-21T23:56:49-05:00,2014-02-22T00:00:00-05:00,191,42.3754311174,-71.1114458017,Home,
2/22/14,Home,2014-02-22T00:00:00-05:00,2014-02-22T12:23:21-05:00,44601,42.3754311174,-71.1114458017,Home,
2/22/14,Harvest,2014-02-22T12:35:35-05:00,2014-02-22T13:56:56-05:00,4881,42.37360135042072,-71.12188865478788,American Restaurant,http://foursquare.com/venue/49cf65d9f964a520a75a1fe3
2/22/14,Experiment Fund,2014-02-22T14:01:59-05:00,2014-02-22T19:25:07-05:00,19388,42.37313766800413,-71.11951231956482,Work,
2/22/14,Orinoco,2014-02-22T19:28:44-05:00,2014-02-22T21:24:12-05:00,6928,42.37190996862827,-71.12049603929978,Arepa Restaurant,http://foursquare.com/venue/4f106cace4b072565b8bd1b6
2/22/14,Legal Sea Foods - Charles Square,2014-02-22T21:29:33-05:00,2014-02-22T23:11:54-05:00,6141,42.37220351484281,-71.1230027436908,Seafood Restaurant,http://foursquare.com/venue/4bdcb5fa3904a59331664f9e
2/22/14,Home,2014-02-22T23:27:56-05:00,2014-02-23T00:00:00-05:00,1924,42.3754311174,-71.1114458017,Home,
2/23/14,Home,2014-02-23T00:00:00-05:00,2014-02-23T12:23:23-05:00,44603,42.3754311174,-71.1114458017,Home,
2/23/14,Proximate,2014-02-23T12:34:07-05:00,2014-02-23T17:28:42-05:00,17675,42.378716,-71.117205,Tech Startup,http://foursquare.com/venue/51c8c0d1498e5d4d09a48362
2/23/14,Home,2014-02-23T17:41:19-05:00,2014-02-24T00:00:00-05:00,22721,42.3754311174,-71.1114458017,Home,
2/24/14,Home,2014-02-24T00:00:00-05:00,2014-02-24T08:44:57-05:00,31497,42.3754311174,-71.1114458017,Home,
2/24/14,Mitchell Dong,2014-02-24T09:03:15-05:00,2014-02-24T10:27:57-05:00,5082,42.3774394608,-71.123998503,Home,
2/24/14,Caspersen Student Center,2014-02-24T10:36:28-05:00,2014-02-24T10:53:56-05:00,1048,42.37890166598297,-71.11866242152347,College Cafeteria,http://foursquare.com/venue/4e790134b0fb5d40982b00d0
2/24/14,Proximate,2014-02-24T10:57:33-05:00,2014-02-24T12:32:48-05:00,5715,42.378716,-71.117205,Tech Startup,http://foursquare.com/venue/51c8c0d1498e5d4d09a48362
2/24/14,Border Cafe,2014-02-24T12:42:33-05:00,2014-02-24T13:50:59-05:00,4106,42.3743468,-71.120141,Mexican Restaurant,http://foursquare.com/venue/3fd66200f964a520bded1ee3
2/24/14,Proximate,2014-02-24T14:01:35-05:00,2014-02-24T16:08:02-05:00,7587,42.378716,-71.117205,Tech Startup,http://foursquare.com/venue/51c8c0d1498e5d4d09a48362
2/24/14,Starbucks,2014-02-24T16:18:43-05:00,2014-02-24T16:21:04-05:00,141,42.374494,-71.12017,Coffee Shop,http://foursquare.com/venue/49cabb79f964a520d8581fe3
2/24/14,Harvard Alumni Association,2014-02-24T16:25:14-05:00,2014-02-24T17:36:03-05:00,4249,42.37317592010315,-71.12325225275964,University,http://foursquare.com/venue/4b5dc68df964a520026b29e3
2/24/14,Place in Old Cambridge,2014-02-24T17:44:20-05:00,2014-02-24T17:51:07-05:00,407,42.3756232629,-71.1213492043,,
2/24/14,Broadway Marketplace,2014-02-24T18:01:19-05:00,2014-02-24T18:09:43-05:00,504,42.37405171427381,-71.11300484548056,Grocery Store,http://foursquare.com/venue/4a661612f964a520ffc71fe3
2/24/14,Home,2014-02-24T18:14:28-05:00,2014-02-25T00:00:00-05:00,20732,42.3754311174,-71.1114458017,Home,
2/25/14,Home,2014-02-25T00:00:00-05:00,2014-02-25T10:57:59-05:00,39479,42.3754311174,-71.1114458017,Home,
2/25/14,Place in Old Cambridge,2014-02-25T11:02:08-05:00,2014-02-25T11:04:59-05:00,171,42.37582268,-71.1132681841,,
2/25/14,Proximate,2014-02-25T11:16:10-05:00,2014-02-25T12:47:11-05:00,5461,42.378716,-71.117205,Tech Startup,http://foursquare.com/venue/51c8c0d1498e5d4d09a48362
2/25/14,Caspersen Student Center,2014-02-25T12:51:21-05:00,2014-02-25T13:37:01-05:00,2740,42.37890166598297,-71.11866242152347,College Cafeteria,http://foursquare.com/venue/4e790134b0fb5d40982b00d0
2/25/14,Proximate,2014-02-25T13:40:13-05:00,2014-02-25T13:43:30-05:00,197,42.378716,-71.117205,Tech Startup,http://foursquare.com/venue/51c8c0d1498e5d4d09a48362
2/25/14,Home,2014-02-25T13:56:28-05:00,2014-02-26T00:00:00-05:00,36212,42.3754311174,-71.1114458017,Home,
2/26/14,Home,2014-02-26T00:00:00-05:00,2014-02-27T00:00:00-05:00,86400,42.3754311174,-71.1114458017,Home,
2/27/14,Home,2014-02-27T00:00:00-05:00,2014-02-27T08:22:09-05:00,30129,42.3754311174,-71.1114458017,Home,
2/27/14,Amtrak South Station,2014-02-27T09:00:03-05:00,2014-02-27T09:30:58-05:00,1855,42.35141860782156,-71.0551073348505,Train Station,http://foursquare.com/venue/52e42895498eb9e24848960b
2/27/14,Union Station | Gate K,2014-02-27T17:35:44-05:00,2014-02-27T17:48:10-05:00,746,38.89803898801969,-77.00518563613092,Platform,http://foursquare.com/venue/4fa9356ee4b08cc7d9bbddb5
2/27/14,NTN24,2014-02-27T18:03:50-05:00,2014-02-27T23:57:58-05:00,21248,38.901567,-77.032106,Office,http://foursquare.com/venue/4ec5b4b38b81dcfdc16568d3
2/28/14,2440 39th St NW,2014-02-28T00:14:02-05:00,2014-02-28T17:24:10-05:00,61808,38.92592014653639,-77.07371486668141,Home (private),http://foursquare.com/venue/520fad0811d2245250b13cd1
2/28/14,Surfside,2014-02-28T17:32:11-05:00,2014-02-28T17:36:20-05:00,249,38.92206976004444,-77.072873711586,Mexican Restaurant,http://foursquare.com/venue/4a02762ef964a52056711fe3
2/28/14,NTN24,2014-02-28T18:23:05-05:00,2014-02-28T23:17:15-05:00,17650,38.901567,-77.032106,Office,http://foursquare.com/venue/4ec5b4b38b81dcfdc16568d3
2/28/14,2440 39th St NW,2014-02-28T23:42:10-05:00,2014-03-01T00:00:00-05:00,1070,38.92592014653639,-77.07371486668141,Home (private),http://foursquare.com/venue/520fad0811d2245250b13cd1
3/1/14,2440 39th St NW,2014-03-01T00:00:00-05:00,2014-03-01T09:48:55-05:00,35335,38.92592014653639,-77.07371486668141,Home (private),http://foursquare.com/venue/520fad0811d2245250b13cd1
3/1/14,Whole Foods Market,2014-03-01T09:56:43-05:00,2014-03-01T10:43:26-05:00,2803,38.920938,-77.071804,Grocery Store,http://foursquare.com/venue/4aad58b8f964a520d25f20e3
3/1/14,Cosi,2014-03-01T11:11:51-05:00,2014-03-01T22:09:22-05:00,39451,38.90013589417622,-77.03186315579289,Sandwich Place,http://foursquare.com/venue/4b82b43cf964a5206fdf30e3
3/1/14,Place in Glover Park,2014-03-01T22:25:26-05:00,2014-03-02T00:00:00-05:00,5674,38.9219317032,-77.0772055012,,
3/2/14,Place in Glover Park,2014-03-02T00:00:00-05:00,2014-03-02T16:09:08-05:00,58148,38.9219317032,-77.0772055012,,
3/2/14,Safeway,2014-03-02T16:25:48-05:00,2014-03-02T16:49:15-05:00,1407,38.91567980755536,-77.06758975982666,Grocery Store,http://foursquare.com/venue/4bb614dc2f70c9b656d68430
3/4/14,Union Station | Gate K,2014-03-04T09:50:37-05:00,2014-03-04T10:15:30-05:00,1493,38.89803898801969,-77.00518563613092,Platform,http://foursquare.com/venue/4fa9356ee4b08cc7d9bbddb5
3/4/14,Home,2014-03-04T19:07:32-05:00,2014-03-05T00:00:00-05:00,17548,42.3754311174,-71.1114458017,Home,
3/5/14,Home,2014-03-05T00:00:00-05:00,2014-03-05T09:19:35-05:00,33575,42.3754311174,-71.1114458017,Home,
3/5/14,Place in Old Cambridge,2014-03-05T09:19:36-05:00,2014-03-05T09:28:14-05:00,518,42.37582268,-71.1132681841,,
3/5/14,Proximate,2014-03-05T09:42:46-05:00,2014-03-05T12:56:49-05:00,11643,42.378716,-71.117205,Tech Startup,http://foursquare.com/venue/51c8c0d1498e5d4d09a48362
3/5/14,Border Cafe,2014-03-05T13:07:48-05:00,2014-03-05T14:07:31-05:00,3583,42.3743468,-71.120141,Mexican Restaurant,http://foursquare.com/venue/3fd66200f964a520bded1ee3
3/5/14,Dillon House,2014-03-05T14:22:40-05:00,2014-03-05T15:39:37-05:00,4617,42.3665277681994,-71.1218828522334,College Administrative Building,http://foursquare.com/venue/4f451d77e4b093578027fe02
3/5/14,Eliot House,2014-03-05T15:48:29-05:00,2014-03-05T18:39:12-05:00,10243,42.37018114178375,-71.12128257751465,College Residence Hall,http://foursquare.com/venue/4b6c63ccf964a52019362ce3
3/5/14,Broadway Marketplace,2014-03-05T18:56:39-05:00,2014-03-05T19:03:28-05:00,409,42.37405171427381,-71.11300484548056,Grocery Store,http://foursquare.com/venue/4a661612f964a520ffc71fe3
3/5/14,Home,2014-03-05T19:06:32-05:00,2014-03-06T00:00:00-05:00,17608,42.3754311174,-71.1114458017,Home,
3/6/14,Home,2014-03-06T00:00:00-05:00,2014-03-06T09:05:51-05:00,32751,42.3754311174,-71.1114458017,Home,
3/6/14,Proximate,2014-03-06T09:13:51-05:00,2014-03-06T11:15:56-05:00,7325,42.378716,-71.117205,Tech Startup,http://foursquare.com/venue/51c8c0d1498e5d4d09a48362
3/6/14,Wasserstein Hall,2014-03-06T11:22:30-05:00,2014-03-06T13:03:58-05:00,6088,42.37888285158866,-71.11904539301803,College Academic Building,http://foursquare.com/venue/4e3342d8227111ae768cc7dc
3/6/14,Proximate,2014-03-06T13:06:34-05:00,2014-03-06T18:18:20-05:00,18706,42.378716,-71.117205,Tech Startup,http://foursquare.com/venue/51c8c0d1498e5d4d09a48362
3/6/14,Home,2014-03-06T18:30:39-05:00,2014-03-07T00:00:00-05:00,19761,42.3754311174,-71.1114458017,Home,
3/7/14,Home,2014-03-07T00:00:00-05:00,2014-03-07T10:01:44-05:00,36104,42.3754311174,-71.1114458017,Home,
3/7/14,Proximate,2014-03-07T10:15:04-05:00,2014-03-07T13:29:51-05:00,11687,42.378716,-71.117205,Tech Startup,http://foursquare.com/venue/51c8c0d1498e5d4d09a48362
3/7/14,One Broadway,2014-03-07T13:51:38-05:00,2014-03-07T14:03:01-05:00,683,42.36270597896073,-71.08393549919128,Office,http://foursquare.com/venue/4c221dd134faef3bf991586d
3/7/14,101 Main St  (CIC),2014-03-07T14:09:32-05:00,2014-03-07T15:02:14-05:00,3162,42.36239871356099,-71.08162851792984,Coworking Space,http://foursquare.com/venue/51311256e4b0a7dd5b86d01b
3/7/14,Boston Marriott Cambridge,2014-03-07T15:13:21-05:00,2014-03-07T16:02:35-05:00,2954,42.36253950179547,-71.08609199523926,Hotel,http://foursquare.com/venue/4a66a899f964a520cbc81fe3
3/7/14,Proximate,2014-03-07T16:29:33-05:00,2014-03-07T20:11:49-05:00,13336,42.378716,-71.117205,Tech Startup,http://foursquare.com/venue/51c8c0d1498e5d4d09a48362
3/7/14,Home,2014-03-07T20:23:15-05:00,2014-03-08T00:00:00-05:00,13005,42.3754311174,-71.1114458017,Home,
3/8/14,Home,2014-03-08T00:00:00-05:00,2014-03-08T10:50:31-05:00,39031,42.3754311174,-71.1114458017,Home,
3/8/14,Russell House Tavern,2014-03-08T11:04:15-05:00,2014-03-08T12:07:40-05:00,3805,42.37313766800413,-71.11951231956482,Gastropub,http://foursquare.com/venue/4b96aba8f964a520e2dc34e3
3/8/14,Starbucks,2014-03-08T12:11:41-05:00,2014-03-08T12:14:34-05:00,173,42.374494,-71.12017,Coffee Shop,http://foursquare.com/venue/49cabb79f964a520d8581fe3
3/8/14,Proximate,2014-03-08T12:28:17-05:00,2014-03-08T16:03:56-05:00,12939,42.378716,-71.117205,Tech Startup,http://foursquare.com/venue/51c8c0d1498e5d4d09a48362
3/8/14,MBTA Bus 1,2014-03-08T16:11:00-05:00,2014-03-08T16:21:39-05:00,639,42.37482,-71.118701,Moving Target,http://foursquare.com/venue/513e37a4e4b0d3edc7b4dbbe
3/8/14,Experiment Fund,2014-03-08T16:25:09-05:00,2014-03-08T20:56:27-05:00,16278,42.37313766800413,-71.11951231956482,Work,
3/8/14,Home,2014-03-08T21:10:36-05:00,2014-03-09T00:00:00-05:00,10164,42.3754311174,-71.1114458017,Home,
3/9/14,Home,2014-03-09T00:00:00-05:00,2014-03-09T12:12:07-04:00,40327,42.3754311174,-71.1114458017,Home,
3/9/14,Tory Row,2014-03-09T12:23:01-04:00,2014-03-09T14:11:18-04:00,6497,42.373379,-71.119457,American Restaurant,http://foursquare.com/venue/49e79621f964a520cf641fe3
3/9/14,Home,2014-03-09T14:31:22-04:00,2014-03-10T00:00:00-04:00,34118,42.3754311174,-71.1114458017,Home,
3/10/14,Home,2014-03-10T00:00:00-04:00,2014-03-10T12:59:54-04:00,46794,42.3754311174,-71.1114458017,Home,
3/10/14,Border Cafe,2014-03-10T13:12:18-04:00,2014-03-10T14:09:35-04:00,3437,42.3743468,-71.120141,Mexican Restaurant,http://foursquare.com/venue/3fd66200f964a520bded1ee3
3/10/14,Proximate,2014-03-10T14:18:39-04:00,2014-03-10T19:50:54-04:00,19935,42.378716,-71.117205,Tech Startup,http://foursquare.com/venue/51c8c0d1498e5d4d09a48362
3/10/14,Home,2014-03-10T19:59:59-04:00,2014-03-11T00:00:00-04:00,14401,42.3754311174,-71.1114458017,Home,
3/11/14,Home,2014-03-11T00:00:00-04:00,2014-03-11T08:41:26-04:00,31286,42.3754311174,-71.1114458017,Home,
3/11/14,Broadway Marketplace,2014-03-11T08:44:01-04:00,2014-03-11T08:46:25-04:00,144,42.37405171427381,-71.11300484548056,Grocery Store,http://foursquare.com/venue/4a661612f964a520ffc71fe3
3/11/14,Experiment Fund,2014-03-11T08:54:38-04:00,2014-03-11T11:10:08-04:00,8130,42.37313766800413,-71.11951231956482,Work,
3/11/14,Proximate,2014-03-11T11:20:45-04:00,2014-03-11T17:37:05-04:00,22580,42.378716,-71.117205,Tech Startup,http://foursquare.com/venue/51c8c0d1498e5d4d09a48362
3/11/14,Park,2014-03-11T17:49:05-04:00,2014-03-11T18:59:54-04:00,4249,42.37169409933257,-71.12097185013617,Gastropub,http://foursquare.com/venue/4f7c8902e4b032c26c6798db
3/11/14,Home,2014-03-11T19:17:30-04:00,2014-03-12T00:00:00-04:00,16950,42.3754311174,-71.1114458017,Home,
3/12/14,Home,2014-03-12T00:00:00-04:00,2014-03-12T14:07:50-04:00,50870,42.3754311174,-71.1114458017,Home,
3/12/14,Proximate,2014-03-12T14:21:39-04:00,2014-03-12T17:57:10-04:00,12931,42.378716,-71.117205,Tech Startup,http://foursquare.com/venue/51c8c0d1498e5d4d09a48362
3/12/14,Place in Dock Square,2014-03-12T18:34:14-04:00,2014-03-12T18:42:14-04:00,480,42.3553803818,-71.0605316725,,
3/12/14,Hard Rock Cafe Boston,2014-03-12T18:53:18-04:00,2014-03-12T22:10:23-04:00,11825,42.36092623594096,-71.05510711669922,American Restaurant,http://foursquare.com/venue/4bd1e7d7046076b098c57271
3/12/14,Home,2014-03-12T22:35:36-04:00,2014-03-13T00:00:00-04:00,5064,42.3754311174,-71.1114458017,Home,
3/13/14,Home,2014-03-13T00:00:00-04:00,2014-03-13T13:25:21-04:00,48321,42.3754311174,-71.1114458017,Home,
3/13/14,Grendel's Den Restaurant & Bar,2014-03-13T13:38:30-04:00,2014-03-13T14:11:39-04:00,1989,42.37237675230346,-71.12077832221985,Bar,http://foursquare.com/venue/3fd66200f964a520bced1ee3
3/13/14,Proximate,2014-03-13T14:19:44-04:00,2014-03-13T17:31:58-04:00,11534,42.378716,-71.117205,Tech Startup,http://foursquare.com/venue/51c8c0d1498e5d4d09a48362
3/13/14,Broadway Marketplace,2014-03-13T17:44:17-04:00,2014-03-13T17:54:35-04:00,618,42.37405171427381,-71.11300484548056,Grocery Store,http://foursquare.com/venue/4a661612f964a520ffc71fe3
3/13/14,Home,2014-03-13T17:59:44-04:00,2014-03-13T23:25:02-04:00,19518,42.3754311174,-71.1114458017,Home,
3/14/14,Home,2014-03-14T00:38:26-04:00,2014-03-14T11:58:19-04:00,40793,42.3754311174,-71.1114458017,Home,
3/14/14,Proximate,2014-03-14T12:08:23-04:00,2014-03-14T13:20:16-04:00,4313,42.378716,-71.117205,Tech Startup,http://foursquare.com/venue/51c8c0d1498e5d4d09a48362
3/14/14,Grendel's Den Restaurant & Bar,2014-03-14T13:32:00-04:00,2014-03-14T14:06:46-04:00,2086,42.37237675230346,-71.12077832221985,Bar,http://foursquare.com/venue/3fd66200f964a520bced1ee3
3/14/14,Boston Logan International Airport (BOS),2014-03-14T14:57:12-04:00,2014-03-14T16:13:19-04:00,4567,42.36650312404415,-71.01667642593384,Airport,http://foursquare.com/venue/452113b6f964a520bc3a1fe3
3/14/14,Ronald Reagan Washington National Airport (DCA),2014-03-14T17:26:25-04:00,2014-03-14T17:37:33-04:00,668,38.85304370184257,-77.04231262207031,Airport,http://foursquare.com/venue/44d17cecf964a5202b361fe3
3/14/14,Place in Ronald Reagan Washington National Airport,2014-03-14T17:40:01-04:00,2014-03-14T17:48:46-04:00,525,38.8471451109,-77.0422244065,,
3/14/14,Place in Ronald Reagan Washington National Airport,2014-03-14T17:59:49-04:00,2014-03-14T18:08:22-04:00,513,38.8532460254,-77.0437334926,,
3/14/14,NTN24,2014-03-14T18:30:51-04:00,2014-03-14T19:03:21-04:00,1950,38.901567,-77.032106,Office,http://foursquare.com/venue/4ec5b4b38b81dcfdc16568d3
3/14/14,Sushi Go Round,2014-03-14T19:32:09-04:00,2014-03-14T20:49:10-04:00,4621,38.89879791187388,-77.021411,Sushi Restaurant,http://foursquare.com/venue/4a88b897f964a520760720e3
3/14/14,Walgreens,2014-03-14T20:56:31-04:00,2014-03-14T21:14:37-04:00,1086,38.89982547776332,-77.02175293209096,Drugstore / Pharmacy,http://foursquare.com/venue/51491bd0e4b0d146fba0b136
3/14/14,Laura's Home,2014-03-14T21:34:21-04:00,2014-03-15T00:00:00-04:00,8739,38.9219057145,-77.0772744833,Home,
3/15/14,Laura's Home,2014-03-15T00:00:00-04:00,2014-03-15T15:36:52-04:00,56212,38.9219057145,-77.0772744833,Home,
3/15/14,Apple Store,2014-03-15T16:10:37-04:00,2014-03-15T16:17:33-04:00,416,38.90590722335151,-77.0626272217989,Electronics Store,http://foursquare.com/venue/4bdb67c03904a59377434a9e
3/15/14,TJ Maxx & HomeGoods,2014-03-15T16:24:58-04:00,2014-03-15T17:34:23-04:00,4165,38.90506846179218,-77.06456095806466,Department Store,http://foursquare.com/venue/522c8c8011d277f9f23b1a0c
3/15/14,Old Glory,2014-03-15T17:39:12-04:00,2014-03-15T17:49:17-04:00,605,38.90529562790965,-77.06227307487663,BBQ Joint,http://foursquare.com/venue/40f47780f964a5207c0a1fe3
3/15/14,Safeway,2014-03-15T18:03:18-04:00,2014-03-15T18:27:31-04:00,1453,38.91567980755536,-77.06758975982666,Grocery Store,http://foursquare.com/venue/4bb614dc2f70c9b656d68430
3/15/14,Laura's Home,2014-03-15T18:45:46-04:00,2014-03-16T00:00:00-04:00,18854,38.9219057145,-77.0772744833,Home,
3/16/14,Laura's Home,2014-03-16T00:00:00-04:00,2014-03-16T14:44:44-04:00,53084,38.9219057145,-77.0772744833,Home,
3/16/14,Whole Foods Market,2014-03-16T14:54:17-04:00,2014-03-16T16:10:57-04:00,4600,38.920938,-77.071804,Grocery Store,http://foursquare.com/venue/4aad58b8f964a520d25f20e3
3/16/14,Laura's Home,2014-03-16T16:22:18-04:00,2014-03-17T00:00:00-04:00,27462,38.9219057145,-77.0772744833,Home,
3/17/14,Laura's Home,2014-03-17T00:00:00-04:00,2014-03-17T17:47:24-04:00,64044,38.9219057145,-77.0772744833,Home,
3/17/14,Thunder Burger & Bar,2014-03-17T17:56:31-04:00,2014-03-17T19:23:28-04:00,5217,38.90505086314458,-77.06071031888702,Burger Joint,http://foursquare.com/venue/4c141d227f7f2d7f9661e068
3/17/14,Laura's Home,2014-03-17T19:40:56-04:00,2014-03-18T00:00:00-04:00,15544,38.9219057145,-77.0772744833,Home,
3/18/14,Laura's Home,2014-03-18T00:00:00-04:00,2014-03-18T09:26:01-04:00,33961,38.9219057145,-77.0772744833,Home,
3/18/14,Place in Ronald Reagan Washington National Airport,2014-03-18T10:13:16-04:00,2014-03-18T10:18:37-04:00,321,38.8520376928,-77.0422682715,,
3/18/14,Ronald Reagan Washington National Airport (DCA),2014-03-18T10:26:48-04:00,2014-03-18T11:44:35-04:00,4667,38.85304370184257,-77.04231262207031,Airport,http://foursquare.com/venue/44d17cecf964a5202b361fe3
3/18/14,Ronald Reagan Washington National Airport (DCA),2014-03-18T11:47:18-04:00,2014-03-18T12:18:25-04:00,1867,38.85304370184257,-77.04231262207031,Airport,http://foursquare.com/venue/44d17cecf964a5202b361fe3
3/18/14,Boston Logan International Airport (BOS),2014-03-18T13:43:16-04:00,2014-03-18T13:53:54-04:00,638,42.36650312404415,-71.01667642593384,Airport,http://foursquare.com/venue/452113b6f964a520bc3a1fe3
3/18/14,Proximate,2014-03-18T14:40:20-04:00,2014-03-18T14:40:56-04:00,36,42.378716,-71.117205,Tech Startup,http://foursquare.com/venue/51c8c0d1498e5d4d09a48362
3/18/14,Proximate,2014-03-18T16:20:58-04:00,2014-03-18T19:45:18-04:00,12260,42.378716,-71.117205,Tech Startup,http://foursquare.com/venue/51c8c0d1498e5d4d09a48362
3/18/14,Home,2014-03-18T21:08:51-04:00,2014-03-19T00:00:00-04:00,10269,42.3754311174,-71.1114458017,Home,
3/19/14,Home,2014-03-19T00:00:00-04:00,2014-03-19T10:14:31-04:00,36871,42.3754311174,-71.1114458017,Home,
3/19/14,Proximate,2014-03-19T10:23:06-04:00,2014-03-19T13:46:03-04:00,12177,42.378716,-71.117205,Tech Startup,http://foursquare.com/venue/51c8c0d1498e5d4d09a48362
3/19/14,Border Cafe,2014-03-19T13:58:20-04:00,2014-03-19T14:38:31-04:00,2411,42.3743468,-71.120141,Mexican Restaurant,http://foursquare.com/venue/3fd66200f964a520bded1ee3
3/19/14,Proximate,2014-03-19T14:47:36-04:00,2014-03-19T18:32:10-04:00,13474,42.378716,-71.117205,Tech Startup,http://foursquare.com/venue/51c8c0d1498e5d4d09a48362
3/20/14,Home,2014-03-20T04:45:00-04:00,2014-03-20T09:09:17-04:00,15857,42.3754311174,-71.1114458017,Home,
3/20/14,Proximate,2014-03-20T09:21:25-04:00,2014-03-20T13:49:32-04:00,16087,42.378716,-71.117205,Tech Startup,http://foursquare.com/venue/51c8c0d1498e5d4d09a48362
3/20/14,Grendel's Den Restaurant & Bar,2014-03-20T14:03:24-04:00,2014-03-20T15:36:26-04:00,5582,42.37237675230346,-71.12077832221985,Bar,http://foursquare.com/venue/3fd66200f964a520bced1ee3
3/20/14,Proximate,2014-03-20T15:48:35-04:00,2014-03-20T20:41:09-04:00,17554,42.378716,-71.117205,Tech Startup,http://foursquare.com/venue/51c8c0d1498e5d4d09a48362
3/20/14,Home,2014-03-20T20:55:54-04:00,2014-03-20T22:04:36-04:00,4122,42.3754311174,-71.1114458017,Home,
3/20/14,Home,2014-03-20T22:04:36-04:00,2014-03-21T00:00:00-04:00,6924,42.3754311174,-71.1114458017,Home,
3/21/14,Home,2014-03-21T00:00:00-04:00,2014-03-21T09:38:55-04:00,34735,42.3754311174,-71.1114458017,Home,
3/21/14,Darwin's Ltd.,2014-03-21T09:41:25-04:00,2014-03-21T09:57:51-04:00,986,42.37488104,-71.109389,Sandwich Place,http://foursquare.com/venue/4a1c900cf964a520507b1fe3
3/21/14,The Pulse Network,2014-03-21T10:31:22-04:00,2014-03-21T11:52:09-04:00,4847,42.168313,-71.110937,Tech Startup,http://foursquare.com/venue/4c23a07af7ced13aa282216d
3/21/14,IDG Enterprise,2014-03-21T12:26:53-04:00,2014-03-21T14:05:07-04:00,5894,42.31326824876494,-71.39173529779059,Coworking Space,http://foursquare.com/venue/4c0d2be17189c928dd97d6b6
3/21/14,Costco Wholesale,2014-03-21T14:30:41-04:00,2014-03-21T15:21:00-04:00,3019,42.39461025172349,-71.26529585645288,Warehouse Store,http://foursquare.com/venue/4a84248ef964a520c7fb1fe3
3/21/14,Home,2014-03-21T16:08:43-04:00,2014-03-21T16:20:38-04:00,715,42.3754311174,-71.1114458017,Home,
3/21/14,Home,2014-03-21T16:28:03-04:00,2014-03-22T00:00:00-04:00,27117,42.3754311174,-71.1114458017,Home,
3/22/14,Home,2014-03-22T00:00:00-04:00,2014-03-22T13:55:49-04:00,50149,42.3754311174,-71.1114458017,Home,
3/22/14,CVS/pharmacy,2014-03-22T14:07:12-04:00,2014-03-22T14:30:14-04:00,1382,42.37402935435937,-71.11899197101593,Drugstore / Pharmacy,http://foursquare.com/venue/49df6a3ff964a520c6601fe3
3/22/14,Home,2014-03-22T14:42:03-04:00,2014-03-23T00:00:00-04:00,33477,42.3754311174,-71.1114458017,Home,
3/23/14,Home,2014-03-23T00:00:00-04:00,2014-03-23T14:01:16-04:00,50476,42.3754311174,-71.1114458017,Home,
3/23/14,Proximate,2014-03-23T14:11:48-04:00,2014-03-23T18:23:52-04:00,15124,42.378716,-71.117205,Tech Startup,http://foursquare.com/venue/51c8c0d1498e5d4d09a48362
3/23/14,Home,2014-03-23T18:35:03-04:00,2014-03-24T00:00:00-04:00,19497,42.3754311174,-71.1114458017,Home,
3/24/14,Home,2014-03-24T00:00:00-04:00,2014-03-24T09:39:35-04:00,34775,42.3754311174,-71.1114458017,Home,
3/24/14,Proximate,2014-03-24T09:47:04-04:00,2014-03-24T12:52:47-04:00,11143,42.378716,-71.117205,Tech Startup,http://foursquare.com/venue/51c8c0d1498e5d4d09a48362
3/24/14,Border Cafe,2014-03-24T13:01:33-04:00,2014-03-24T14:22:39-04:00,4866,42.3743468,-71.120141,Mexican Restaurant,http://foursquare.com/venue/3fd66200f964a520bded1ee3
3/24/14,Proximate,2014-03-24T14:34:15-04:00,2014-03-24T20:23:49-04:00,20974,42.378716,-71.117205,Tech Startup,http://foursquare.com/venue/51c8c0d1498e5d4d09a48362
3/24/14,Home,2014-03-24T20:33:40-04:00,2014-03-25T00:00:00-04:00,12380,42.3754311174,-71.1114458017,Home,
3/25/14,Home,2014-03-25T00:00:00-04:00,2014-03-25T10:12:57-04:00,36777,42.3754311174,-71.1114458017,Home,
3/25/14,Darwin's Ltd.,2014-03-25T10:17:03-04:00,2014-03-25T11:22:21-04:00,3918,42.37488104,-71.109389,Sandwich Place,http://foursquare.com/venue/4a1c900cf964a520507b1fe3
3/25/14,IDG Enterprise,2014-03-25T11:47:56-04:00,2014-03-25T13:47:00-04:00,7144,42.31326824876494,-71.39173529779059,Coworking Space,http://foursquare.com/venue/4c0d2be17189c928dd97d6b6
3/25/14,Margarita's Mexican Restaurant,2014-03-25T13:53:11-04:00,2014-03-25T14:45:03-04:00,3112,42.30851159250724,-71.38306071431585,Mexican Restaurant,http://foursquare.com/venue/4ce023e0f8a4a143e9aee2bc
3/25/14,Place in Old Cambridge,2014-03-25T15:29:04-04:00,2014-03-25T15:37:59-04:00,535,42.3776955602,-71.1164327854,,
3/25/14,Proximate,2014-03-25T15:37:59-04:00,2014-03-25T20:25:26-04:00,17247,42.378716,-71.117205,Tech Startup,http://foursquare.com/venue/51c8c0d1498e5d4d09a48362
3/25/14,Home,2014-03-25T20:38:18-04:00,2014-03-26T00:00:00-04:00,12102,42.3754311174,-71.1114458017,Home,
3/26/14,Home,2014-03-26T00:00:00-04:00,2014-03-26T08:47:45-04:00,31665,42.3754311174,-71.1114458017,Home,
3/26/14,Amtrak South Station,2014-03-26T09:14:35-04:00,2014-03-26T09:28:09-04:00,814,42.35141860782156,-71.0551073348505,Train Station,http://foursquare.com/venue/52e42895498eb9e24848960b
3/26/14,Place in Connecticut,2014-03-26T12:01:40-04:00,2014-03-26T12:07:19-04:00,339,41.2973873762,-72.9263686365,,
3/26/14,Place in East Village,2014-03-26T14:17:26-04:00,2014-03-26T14:20:15-04:00,169,40.7375943304,-73.9917872252,,
3/26/14,Work-Bench,2014-03-26T14:25:24-04:00,2014-03-26T18:42:43-04:00,15439,40.73749628407822,-73.9927793207247,Tech Startup,http://foursquare.com/venue/513f6f16e4b06c7db17ec368
3/26/14,Google - 9th Ave,2014-03-26T19:01:24-04:00,2014-03-26T21:45:32-04:00,9848,40.7418255687584,-74.00457230213387,Office,http://foursquare.com/venue/51c9896b498e5bcdffad7bbb
3/26/14,Jess Lin's Home,2014-03-26T22:04:26-04:00,2014-03-27T00:00:00-04:00,6934,40.7336195193,-73.9759907849,Home,
3/27/14,Jess Lin's Home,2014-03-27T00:00:00-04:00,2014-03-27T00:19:50-04:00,1190,40.7336195193,-73.9759907849,Home,
3/27/14,John F. Kennedy International Airport (JFK),2014-03-27T00:58:27-04:00,2014-03-27T06:28:12-04:00,19785,40.64508935597635,-73.7845230102539,Airport,http://foursquare.com/venue/43a52546f964a520532c1fe3
3/27/14,John F. Kennedy International Airport (JFK),2014-03-27T06:33:49-04:00,2014-03-27T07:17:10-04:00,2601,40.64508935597635,-73.7845230102539,Airport,http://foursquare.com/venue/43a52546f964a520532c1fe3
3/27/14,Chicago O'Hare International Airport (ORD),2014-03-27T09:54:27-04:00,2014-03-27T09:59:26-04:00,299,41.97727092004163,-87.90440082550049,Airport,http://foursquare.com/venue/4a5a77a4f964a52062ba1fe3
3/27/14,Fitzsimmons Home,2014-03-27T10:59:39-04:00,2014-03-27T13:20:12-04:00,8433,41.8771070061,-88.311048021,Home,
3/27/14,Egg Harbor Cafe,2014-03-27T13:25:04-04:00,2014-03-27T14:05:02-04:00,2398,41.883009,-88.3081539,Breakfast Spot,http://foursquare.com/venue/4b6d65e3f964a520d3742ce3
3/27/14,Fitzsimmons Home,2014-03-27T14:13:59-04:00,2014-03-28T00:00:00-04:00,35161,41.8771070061,-88.311048021,Home,
3/28/14,Fitzsimmons Home,2014-03-28T00:00:00-04:00,2014-03-28T15:13:16-04:00,54796,41.8771070061,-88.311048021,Home,
3/28/14,Place in St. Charles,2014-03-28T15:24:21-04:00,2014-03-28T15:54:01-04:00,1780,41.919983156,-88.3417491588,,
3/28/14,Fitzsimmons Home,2014-03-28T16:10:00-04:00,2014-03-29T00:00:00-04:00,28200,41.8771070061,-88.311048021,Home,
3/29/14,Fitzsimmons Home,2014-03-29T00:00:00-04:00,2014-03-29T16:45:26-04:00,60326,41.8771070061,-88.311048021,Home,
3/29/14,Place in Geneva,2014-03-29T17:04:52-04:00,2014-03-29T17:15:41-04:00,649,41.867891259,-88.3424700055,,
3/29/14,Fitzsimmons Home,2014-03-29T17:24:30-04:00,2014-03-29T19:47:10-04:00,8560,41.8771070061,-88.311048021,Home,
3/29/14,Place in Kane County,2014-03-29T20:01:39-04:00,2014-03-29T22:23:30-04:00,8511,41.8233245071,-88.3554517092,,
3/29/14,Fitzsimmons Home,2014-03-29T22:35:09-04:00,2014-03-30T00:00:00-04:00,5091,41.8771070061,-88.311048021,Home,
3/30/14,Fitzsimmons Home,2014-03-30T00:00:00-04:00,2014-03-30T06:23:54-04:00,23034,41.8771070061,-88.311048021,Home,
3/30/14,Fitzsimmons Home,2014-03-30T06:47:04-04:00,2014-03-30T14:16:55-04:00,26991,41.8771070061,-88.311048021,Home,
3/30/14,Reel Club,2014-03-30T14:50:02-04:00,2014-03-30T15:56:04-04:00,3962,41.84920056968837,-87.95047450931439,Seafood Restaurant,http://foursquare.com/venue/4be5a8e7d4f7c9b685b42520
3/30/14,Anthropologie,2014-03-30T15:58:54-04:00,2014-03-30T16:09:45-04:00,651,41.849592,-87.951447,Women's Store,http://foursquare.com/venue/4be4996dbcef2d7f0ecb02e5
3/30/14,Oakbrook Apple Store v2.0,2014-03-30T16:16:47-04:00,2014-03-30T16:30:42-04:00,835,41.849968,-87.953506,Electronics Store,http://foursquare.com/venue/52d1757111d20fe84ef5cef0
3/30/14,Brookstone,2014-03-30T16:32:58-04:00,2014-03-30T16:48:32-04:00,934,41.84893988314549,-87.9529150615116,Electronics Store,http://foursquare.com/venue/4c2e4545ed37a593f3456503
3/30/14,Fitzsimmons Home,2014-03-30T17:57:04-04:00,2014-03-31T00:00:00-04:00,21776,41.8771070061,-88.311048021,Home,
3/31/14,Fitzsimmons Home,2014-03-31T00:00:00-04:00,2014-03-31T14:24:47-04:00,51887,41.8771070061,-88.311048021,Home,
3/31/14,US Cellular Field,2014-03-31T16:09:37-04:00,2014-03-31T17:44:36-04:00,5699,41.83007999890882,-87.63406902551651,Baseball Stadium,http://foursquare.com/venue/40dcbc80f964a52080011fe3
3/31/14,US Cellular Field,2014-03-31T17:53:28-04:00,2014-03-31T18:34:15-04:00,2447,41.83007999890882,-87.63406902551651,Baseball Stadium,http://foursquare.com/venue/40dcbc80f964a52080011fe3
3/31/14,La Scarola,2014-03-31T19:20:06-04:00,2014-03-31T20:52:14-04:00,5528,41.89120422665134,-87.64677079274206,Italian Restaurant,http://foursquare.com/venue/4adcae6af964a520af2e21e3
3/31/14,Place in Ogilvie Transportation Center,2014-03-31T21:34:38-04:00,2014-03-31T21:39:25-04:00,287,41.8830321351,-87.640851031,,
3/31/14,Fitzsimmons Home,2014-03-31T22:55:20-04:00,2014-04-01T00:00:00-04:00,3880,41.8771070061,-88.311048021,Home,
4/1/14,Fitzsimmons Home,2014-04-01T00:00:00-04:00,2014-04-01T13:21:11-04:00,48071,41.8771070061,-88.311048021,Home,
4/1/14,Chipotle Mexican Grill,2014-04-01T13:32:44-04:00,2014-04-01T14:07:51-04:00,2107,41.92062465060372,-88.26586604118347,Mexican Restaurant,http://foursquare.com/venue/4a8efb58f964a520701320e3
4/1/14,Fitzsimmons Home,2014-04-01T14:20:38-04:00,2014-04-02T00:00:00-04:00,34762,41.8771070061,-88.311048021,Home,
4/2/14,Fitzsimmons Home,2014-04-02T00:00:00-04:00,2014-04-02T13:13:02-04:00,47582,41.8771070061,-88.311048021,Home,
4/2/14,Nosh,2014-04-02T13:18:46-04:00,2014-04-02T13:56:28-04:00,2262,41.88694340165634,-88.30746173858643,,http://foursquare.com/venue/4b5c8db0f964a5203b3629e3
4/2/14,Fitzsimmons Home,2014-04-02T14:00:25-04:00,2014-04-02T14:04:50-04:00,265,41.8771070061,-88.311048021,Home,
4/2/14,Marshalls,2014-04-02T14:11:00-04:00,2014-04-02T14:43:30-04:00,1950,41.87135042798499,-88.34226608276367,,http://foursquare.com/venue/4c0ada0e7e3fc928f464f482
4/2/14,Fitzsimmons Home,2014-04-02T14:49:59-04:00,2014-04-02T20:10:24-04:00,19225,41.8771070061,-88.311048021,Home,
4/2/14,Place in North Aurora,2014-04-02T20:21:41-04:00,2014-04-02T21:51:27-04:00,5386,41.8162845622,-88.3492217249,,
4/2/14,Fitzsimmons Home,2014-04-02T22:06:48-04:00,2014-04-03T00:00:00-04:00,6792,41.8771070061,-88.311048021,Home,
4/3/14,Fitzsimmons Home,2014-04-03T00:00:00-04:00,2014-04-04T00:00:00-04:00,86400,41.8771070061,-88.311048021,Home,
4/4/14,Fitzsimmons Home,2014-04-04T00:00:00-04:00,2014-04-04T15:07:39-04:00,54459,41.8771070061,-88.311048021,Home,
4/4/14,Place in Geneva,2014-04-04T15:28:05-04:00,2014-04-04T15:44:41-04:00,996,41.8740538471,-88.3410287036,,
4/4/14,Fitzsimmons Home,2014-04-04T16:25:06-04:00,2014-04-05T00:00:00-04:00,27294,41.8771070061,-88.311048021,Home,
4/5/14,Fitzsimmons Home,2014-04-05T00:00:00-04:00,2014-04-05T11:52:44-04:00,42764,41.8771070061,-88.311048021,Home,
4/5/14,Jewel-Osco,2014-04-05T12:02:42-04:00,2014-04-05T12:16:04-04:00,802,41.8480793,-88.3401807,Grocery Store,http://foursquare.com/venue/4b3c0676f964a520938025e3
4/5/14,Fitzsimmons Home,2014-04-05T12:27:17-04:00,2014-04-05T14:32:55-04:00,7538,41.8771070061,-88.311048021,Home,
4/5/14,Graham's 318,2014-04-05T14:45:49-04:00,2014-04-05T15:22:58-04:00,2229,41.88416378545351,-88.3092212677002,Coffee Shop,http://foursquare.com/venue/4a997135f964a520582e20e3
4/5/14,Fitzsimmons Home,2014-04-05T15:40:01-04:00,2014-04-05T18:29:06-04:00,10145,41.8771070061,-88.311048021,Home,
4/5/14,Drury Lane Theatre And Conference Center,2014-04-05T19:05:28-04:00,2014-04-06T00:00:00-04:00,17672,41.85944534205429,-87.95306818974508,Performing Arts Venue,http://foursquare.com/venue/4b8a0609f964a520295c32e3
4/6/14,Drury Lane Theatre And Conference Center,2014-04-06T00:00:00-04:00,2014-04-06T01:37:15-04:00,5835,41.85944534205429,-87.95306818974508,Performing Arts Venue,http://foursquare.com/venue/4b8a0609f964a520295c32e3
4/6/14,Place in Oak Brook,2014-04-06T01:42:25-04:00,2014-04-06T01:47:54-04:00,329,41.8476618788,-87.9476928406,,
4/6/14,Place in DuPage County,2014-04-06T02:07:18-04:00,2014-04-06T02:12:52-04:00,334,41.7768409288,-88.1137646466,,
4/6/14,Fitzsimmons Home,2014-04-06T02:39:06-04:00,2014-04-06T13:48:41-04:00,40175,41.8771070061,-88.311048021,Home,
4/6/14,Wildwood,2014-04-06T14:00:18-04:00,2014-04-06T14:49:38-04:00,2960,41.88296963158768,-88.30879211425781,American Restaurant,http://foursquare.com/venue/4af254bcf964a52071e721e3
4/6/14,Fitzsimmons Home,2014-04-06T15:02:00-04:00,2014-04-06T20:48:31-04:00,20791,41.8771070061,-88.311048021,Home,
4/6/14,Marmion Academy & Abbey,2014-04-06T21:03:04-04:00,2014-04-06T21:14:55-04:00,711,41.81505247322077,-88.29395317558735,High School,http://foursquare.com/venue/4be6f5d378e89521ffcd64ce
4/6/14,Fitzsimmons Home,2014-04-06T21:31:37-04:00,2014-04-06T23:31:49-04:00,7212,41.8771070061,-88.311048021,Home,
4/7/14,999 S Batavia Ave,2014-04-07T00:01:25-04:00,2014-04-07T12:27:15-04:00,44750,41.8771046037,-88.3111773419,Home,
4/7/14,Place in Kane County,2014-04-07T12:47:13-04:00,2014-04-07T14:48:28-04:00,7275,41.9629592113,-88.3475596795,,
4/7/14,Fitzsimmons Home,2014-04-07T15:10:59-04:00,2014-04-07T15:23:15-04:00,736,41.8771070061,-88.311048021,Home,
4/7/14,All Chocolate Kitchen,2014-04-07T15:25:30-04:00,2014-04-07T16:06:39-04:00,2469,41.88701828333333,-88.30787845,,http://foursquare.com/venue/4e0101b8ae609fa8ede130bd
4/7/14,CVS/pharmacy,2014-04-07T16:14:52-04:00,2014-04-07T16:42:17-04:00,1645,41.88771017105127,-88.29025268554688,,http://foursquare.com/venue/4c214ee69085d13a26a184cc
4/7/14,Aldi,2014-04-07T16:42:17-04:00,2014-04-07T16:58:41-04:00,984,41.8880886238829,-88.2883782767128,,http://foursquare.com/venue/4b83142bf964a52049f630e3
4/7/14,Fitzsimmons Home,2014-04-07T17:04:09-04:00,2014-04-07T17:37:19-04:00,1990,41.8771070061,-88.311048021,Home,
4/7/14,Fitzsimmons Home,2014-04-07T19:54:51-04:00,2014-04-08T00:00:00-04:00,14709,41.8771070061,-88.311048021,Home,
4/8/14,Fitzsimmons Home,2014-04-08T00:00:00-04:00,2014-04-08T13:46:09-04:00,49569,41.8771070061,-88.311048021,Home,
4/8/14,California Pizza Kitchen,2014-04-08T13:58:29-04:00,2014-04-08T14:49:10-04:00,3041,41.89390402038217,-88.34153167723547,Pizza Place,http://foursquare.com/venue/4b43dd2ff964a52080ec25e3
4/8/14,Fitzsimmons Home,2014-04-08T15:18:07-04:00,2014-04-08T16:57:22-04:00,5955,41.8771070061,-88.311048021,Home,
4/8/14,Foran Funeral Home,2014-04-08T18:01:11-04:00,2014-04-08T19:02:20-04:00,3669,41.79200336823988,-87.80431104573442,Spiritual Center,http://foursquare.com/venue/4c5199c80ef3a59330f6447c
4/8/14,Mon Ami Gabi,2014-04-08T19:36:58-04:00,2014-04-08T22:29:30-04:00,10352,41.85006371388324,-87.95100688934326,French Restaurant,http://foursquare.com/venue/4b4f139df964a520c6f926e3
4/8/14,Fitzsimmons Home,2014-04-08T23:01:16-04:00,2014-04-09T00:00:00-04:00,3524,41.8771070061,-88.311048021,Home,
4/9/14,Fitzsimmons Home,2014-04-09T00:00:00-04:00,2014-04-09T11:51:20-04:00,42680,41.8771070061,-88.311048021,Home,
4/9/14,Gate L5,2014-04-09T12:48:25-04:00,2014-04-09T13:32:25-04:00,2640,41.977036,-87.897449,Airport Gate,http://foursquare.com/venue/4c9d09fb8afca09334ecf215
4/9/14,Place in Logan International Airport,2014-04-09T15:44:06-04:00,2014-04-09T15:51:46-04:00,460,42.3648854193,-71.0149319231,,
4/9/14,Place in Logan International Airport,2014-04-09T15:59:03-04:00,2014-04-09T16:06:21-04:00,438,42.3664825597,-71.018968718,,
4/9/14,Home,2014-04-09T17:04:17-04:00,2014-04-09T18:45:35-04:00,6078,42.3754311174,-71.1114458017,Home,
4/9/14,Place in Cambridge,2014-04-09T19:02:20-04:00,2014-04-09T20:21:07-04:00,4727,42.3729819695,-71.0958597028,,
4/9/14,Home,2014-04-09T20:41:06-04:00,2014-04-10T00:00:00-04:00,11934,42.3754311174,-71.1114458017,Home,
4/10/14,Home,2014-04-10T00:00:00-04:00,2014-04-10T09:09:55-04:00,32995,42.3754311174,-71.1114458017,Home,
4/10/14,The Pulse Network,2014-04-10T10:07:52-04:00,2014-04-10T11:53:14-04:00,6322,42.168313,-71.110937,Tech Startup,http://foursquare.com/venue/4c23a07af7ced13aa282216d
4/10/14,IKEA,2014-04-10T12:10:29-04:00,2014-04-10T13:34:20-04:00,5031,42.1376636656493,-71.0679817199707,Furniture / Home Store,http://foursquare.com/venue/4a27485af964a52071911fe3
4/10/14,Home,2014-04-10T14:16:11-04:00,2014-04-10T14:26:53-04:00,642,42.3754311174,-71.1114458017,Home,
4/10/14,Proximate,2014-04-10T14:40:56-04:00,2014-04-10T15:25:28-04:00,2672,42.378716,-71.117205,Tech Startup,http://foursquare.com/venue/51c8c0d1498e5d4d09a48362
4/10/14,Harvard Alumni Association,2014-04-10T15:36:08-04:00,2014-04-10T17:38:15-04:00,7327,42.37317592010315,-71.12325225275964,University,http://foursquare.com/venue/4b5dc68df964a520026b29e3
4/10/14,Proximate,2014-04-10T17:56:10-04:00,2014-04-10T18:52:29-04:00,3379,42.378716,-71.117205,Tech Startup,http://foursquare.com/venue/51c8c0d1498e5d4d09a48362
4/10/14,Home,2014-04-10T19:03:43-04:00,2014-04-11T00:00:00-04:00,17777,42.3754311174,-71.1114458017,Home,
4/11/14,Home,2014-04-11T00:00:00-04:00,2014-04-11T10:01:29-04:00,36089,42.3754311174,-71.1114458017,Home,
