Date,Type,Name,Start,End,Duration
12/1/13,place,945 S Batavia Ave,2013-12-01T11:29:24-06:00,2013-12-01T12:02:35-06:00,1991
12/1/13,move,walking,2013-12-01T12:02:35-06:00,2013-12-01T12:13:25-06:00,650
12/1/13,place,Wildwood,2013-12-01T12:13:25-06:00,2013-12-01T13:20:01-06:00,3996
12/1/13,move,walking,2013-12-01T13:20:01-06:00,2013-12-01T13:32:08-06:00,727
12/1/13,place,945 S Batavia Ave,2013-12-01T13:32:08-06:00,2013-12-01T13:43:27-06:00,679
12/1/13,move,transport,2013-12-01T13:43:27-06:00,2013-12-01T13:51:47-06:00,500
12/1/13,place,Walmart,2013-12-01T13:51:47-06:00,2013-12-01T14:36:02-06:00,2655
12/1/13,move,walking,2013-12-01T14:36:02-06:00,2013-12-01T14:38:03-06:00,121
12/1/13,move,transport,2013-12-01T14:38:03-06:00,2013-12-01T14:44:30-06:00,387
12/1/13,place,945 S Batavia Ave,2013-12-01T14:44:31-06:00,2013-12-01T16:27:54-06:00,6203
12/1/13,move,transport,2013-12-01T16:27:54-06:00,2013-12-01T16:29:50-06:00,116
12/1/13,place,Metra - Geneva Station,2013-12-01T16:29:51-06:00,2013-12-01T16:40:53-06:00,662
12/1/13,move,transport,2013-12-01T16:40:53-06:00,2013-12-01T17:58:54-06:00,4681
12/1/13,move,walking,2013-12-01T17:58:54-06:00,2013-12-01T18:10:02-06:00,668
12/1/13,place,Chicago Union Station,2013-12-01T18:10:02-06:00,2013-12-01T18:13:36-06:00,214
12/1/13,move,walking,2013-12-01T18:13:36-06:00,2013-12-01T18:30:23-06:00,1007
12/1/13,place,Ogilvie Transportation Center,2013-12-01T18:30:23-06:00,2013-12-01T18:39:36-06:00,553
12/1/13,move,transport,2013-12-01T18:39:36-06:00,2013-12-01T19:06:15-06:00,1599
12/1/13,move,transport,2013-12-01T19:18:56-06:00,2013-12-01T20:01:10-06:00,2534
12/1/13,move,walking,2013-12-01T20:01:09-06:00,2013-12-01T20:03:39-06:00,150
12/1/13,move,running,2013-12-01T20:03:40-06:00,2013-12-01T20:07:12-06:00,212
12/1/13,place,945 S Batavia Ave,2013-12-01T20:07:12-06:00,2013-12-02T00:00:00-06:00,13968
12/2/13,place,945 S Batavia Ave,2013-12-02T00:00:00-06:00,2013-12-03T00:00:00-06:00,86400
12/3/13,place,945 S Batavia Ave,2013-12-03T00:00:00-06:00,2013-12-03T12:56:03-06:00,46563
12/3/13,move,walking,2013-12-03T12:56:03-06:00,2013-12-03T13:05:19-06:00,556
12/3/13,place,945 S Batavia Ave,2013-12-03T13:05:19-06:00,2013-12-03T13:26:30-06:00,1271
12/3/13,move,transport,2013-12-03T13:26:30-06:00,2013-12-03T13:28:40-06:00,130
12/3/13,place,All Chocolate Kitchen,2013-12-03T13:28:40-06:00,2013-12-03T14:01:35-06:00,1975
12/3/13,move,transport,2013-12-03T14:01:35-06:00,2013-12-03T14:03:44-06:00,129
12/3/13,place,945 S Batavia Ave,2013-12-03T14:03:44-06:00,2013-12-03T19:42:20-06:00,20316
12/3/13,move,transport,2013-12-03T19:42:20-06:00,2013-12-03T19:51:08-06:00,528
12/3/13,place,945 S Batavia Ave,2013-12-03T19:51:08-06:00,2013-12-04T00:00:00-06:00,14932
12/4/13,place,945 S Batavia Ave,2013-12-04T00:00:00-06:00,2013-12-04T11:48:13-06:00,42493
12/4/13,move,transport,2013-12-04T11:48:13-06:00,2013-12-04T12:38:23-06:00,3010
12/4/13,place,Place in O'Hare International Airport,2013-12-04T12:38:22-06:00,2013-12-04T12:47:18-06:00,536
12/4/13,move,walking,2013-12-04T12:47:18-06:00,2013-12-04T12:49:54-06:00,156
12/4/13,place,Chicago O'Hare International Airport (ORD),2013-12-04T12:49:54-06:00,2013-12-04T14:26:39-06:00,5805
12/4/13,move,transport,2013-12-04T14:26:39-06:00,2013-12-04T16:13:04-06:00,6385
12/4/13,place,Boston Logan International Airport (BOS),2013-12-04T16:13:04-06:00,2013-12-04T16:39:33-06:00,1589
12/4/13,move,walking,2013-12-04T16:39:33-06:00,2013-12-04T16:47:41-06:00,488
12/4/13,move,transport,2013-12-04T16:47:41-06:00,2013-12-04T17:20:15-06:00,1954
12/4/13,move,walking,2013-12-04T17:20:14-06:00,2013-12-04T17:22:23-06:00,129
12/4/13,place,Broadway Marketplace,2013-12-04T17:22:24-06:00,2013-12-04T17:26:44-06:00,260
12/4/13,move,walking,2013-12-04T17:26:44-06:00,2013-12-04T17:33:59-06:00,435
12/4/13,place,Home,2013-12-04T17:34:00-06:00,2013-12-05T00:00:00-06:00,23160
12/5/13,place,Home,2013-12-05T00:00:00-06:00,2013-12-05T08:51:03-06:00,31863
12/5/13,move,walking,2013-12-05T08:51:03-06:00,2013-12-05T09:03:49-06:00,766
12/5/13,place,Proximate,2013-12-05T09:03:48-06:00,2013-12-05T09:38:01-06:00,2053
12/5/13,move,walking,2013-12-05T09:38:01-06:00,2013-12-05T09:51:55-06:00,834
12/5/13,place,Harvard Alumni Association,2013-12-05T09:51:55-06:00,2013-12-05T10:45:45-06:00,3230
12/5/13,move,walking,2013-12-05T10:45:46-06:00,2013-12-05T10:51:33-06:00,347
12/5/13,place,Border Cafe,2013-12-05T10:51:33-06:00,2013-12-05T11:38:06-06:00,2793
12/5/13,move,walking,2013-12-05T11:38:06-06:00,2013-12-05T11:47:16-06:00,550
12/5/13,place,Proximate,2013-12-05T11:47:15-06:00,2013-12-05T15:12:30-06:00,12315
12/5/13,move,walking,2013-12-05T15:12:30-06:00,2013-12-05T15:33:07-06:00,1237
12/5/13,place,Spangler Center,2013-12-05T15:33:07-06:00,2013-12-05T16:02:43-06:00,1776
12/5/13,move,walking,2013-12-05T16:02:43-06:00,2013-12-05T16:16:50-06:00,847
12/5/13,place,Experiment Fund,2013-12-05T16:16:50-06:00,2013-12-05T19:30:19-06:00,11609
12/5/13,place,Finale Desserterie & Bakery,2013-12-05T19:30:19-06:00,2013-12-05T19:54:10-06:00,1431
12/5/13,move,walking,2013-12-05T19:54:10-06:00,2013-12-05T20:05:15-06:00,665
12/5/13,place,Home,2013-12-05T20:05:15-06:00,2013-12-06T00:00:00-06:00,14085
12/6/13,place,Home,2013-12-06T00:00:00-06:00,2013-12-06T08:24:21-06:00,30261
12/6/13,move,walking,2013-12-06T08:24:21-06:00,2013-12-06T08:47:02-06:00,1361
12/6/13,place,Darwin's Ltd.,2013-12-06T08:47:02-06:00,2013-12-06T09:34:54-06:00,2872
12/6/13,move,walking,2013-12-06T09:34:54-06:00,2013-12-06T09:39:08-06:00,254
12/6/13,move,transport,2013-12-06T09:39:07-06:00,2013-12-06T10:07:16-06:00,1689
12/6/13,place,IDG Enterprise,2013-12-06T10:07:16-06:00,2013-12-06T11:20:12-06:00,4376
12/6/13,move,walking,2013-12-06T11:20:12-06:00,2013-12-06T11:25:31-06:00,319
12/6/13,move,transport,2013-12-06T11:25:30-06:00,2013-12-06T11:59:02-06:00,2012
12/6/13,move,walking,2013-12-06T11:59:02-06:00,2013-12-06T12:05:45-06:00,403
12/6/13,place,Home,2013-12-06T12:05:45-06:00,2013-12-06T17:16:52-06:00,18667
12/6/13,move,walking,2013-12-06T17:16:52-06:00,2013-12-06T17:26:00-06:00,548
12/6/13,move,transport,2013-12-06T17:25:59-06:00,2013-12-06T17:32:34-06:00,395
12/6/13,move,walking,2013-12-06T17:32:34-06:00,2013-12-06T17:35:04-06:00,150
12/6/13,place,Place in East Cambridge,2013-12-06T17:35:04-06:00,2013-12-06T17:41:34-06:00,390
12/6/13,move,walking,2013-12-06T17:41:34-06:00,2013-12-06T17:53:09-06:00,695
12/6/13,place,Za Restaurant,2013-12-06T17:53:09-06:00,2013-12-06T18:33:56-06:00,2447
12/6/13,move,walking,2013-12-06T18:33:56-06:00,2013-12-06T18:37:48-06:00,232
12/6/13,move,transport,2013-12-06T18:37:48-06:00,2013-12-06T18:45:51-06:00,483
12/6/13,move,walking,2013-12-06T18:45:51-06:00,2013-12-06T18:54:22-06:00,511
12/6/13,place,Home,2013-12-06T18:54:22-06:00,2013-12-07T00:00:00-06:00,18338
12/7/13,place,Home,2013-12-07T00:00:00-06:00,2013-12-07T09:27:38-06:00,34058
12/7/13,move,walking,2013-12-07T09:27:39-06:00,2013-12-07T09:41:21-06:00,822
12/7/13,place,Experiment Fund,2013-12-07T09:41:21-06:00,2013-12-07T11:26:24-06:00,6303
12/7/13,move,walking,2013-12-07T11:26:24-06:00,2013-12-07T11:41:01-06:00,877
12/7/13,place,Home,2013-12-07T11:41:01-06:00,2013-12-07T13:37:18-06:00,6977
12/7/13,move,walking,2013-12-07T13:37:18-06:00,2013-12-07T13:55:21-06:00,1083
12/7/13,place,Floyd's 99 Barbershop,2013-12-07T13:55:21-06:00,2013-12-07T14:34:57-06:00,2376
12/7/13,move,walking,2013-12-07T14:34:57-06:00,2013-12-07T14:57:45-06:00,1368
12/7/13,place,Home,2013-12-07T14:57:45-06:00,2013-12-08T00:00:00-06:00,32535
12/8/13,place,Home,2013-12-08T00:00:00-06:00,2013-12-08T10:27:01-06:00,37621
12/8/13,move,walking,2013-12-08T10:27:01-06:00,2013-12-08T10:36:42-06:00,581
12/8/13,place,Place in Cambridge,2013-12-08T10:36:42-06:00,2013-12-08T11:27:49-06:00,3067
12/8/13,move,walking,2013-12-08T11:27:49-06:00,2013-12-08T11:48:32-06:00,1243
12/8/13,place,Home,2013-12-08T11:48:31-06:00,2013-12-08T12:06:36-06:00,1085
12/8/13,move,walking,2013-12-08T12:06:36-06:00,2013-12-08T12:15:28-06:00,532
12/8/13,place,Home,2013-12-08T12:15:28-06:00,2013-12-09T00:00:00-06:00,42272
12/9/13,place,Home,2013-12-09T00:00:00-06:00,2013-12-09T06:57:15-06:00,25035
12/9/13,move,walking,2013-12-09T06:57:15-06:00,2013-12-09T07:07:51-06:00,636
12/9/13,move,transport,2013-12-09T07:07:51-06:00,2013-12-09T07:19:52-06:00,721
12/9/13,move,walking,2013-12-09T07:19:52-06:00,2013-12-09T07:26:23-06:00,391
12/9/13,place,Microsoft New England Research & Development Center,2013-12-09T07:26:22-06:00,2013-12-09T09:14:21-06:00,6479
12/9/13,move,walking,2013-12-09T09:14:21-06:00,2013-12-09T09:22:24-06:00,483
12/9/13,move,transport,2013-12-09T09:22:25-06:00,2013-12-09T09:32:55-06:00,630
12/9/13,move,walking,2013-12-09T09:32:55-06:00,2013-12-09T09:40:04-06:00,429
12/9/13,place,Harvard Alumni Association,2013-12-09T09:40:05-06:00,2013-12-09T10:40:59-06:00,3654
12/9/13,move,walking,2013-12-09T10:40:59-06:00,2013-12-09T10:57:42-06:00,1003
12/9/13,place,Home,2013-12-09T10:57:42-06:00,2013-12-09T10:58:22-06:00,40
12/9/13,move,walking,2013-12-09T14:59:50-06:00,2013-12-09T15:04:37-06:00,287
12/9/13,place,Experiment Fund,2013-12-09T15:04:36-06:00,2013-12-09T16:23:03-06:00,4707
12/9/13,move,walking,2013-12-09T16:23:03-06:00,2013-12-09T16:37:51-06:00,888
12/9/13,place,Harvard Innovation Lab,2013-12-09T16:37:51-06:00,2013-12-09T18:25:07-06:00,6436
12/9/13,move,transport,2013-12-09T18:25:07-06:00,2013-12-09T18:28:38-06:00,211
12/9/13,move,walking,2013-12-09T18:28:37-06:00,2013-12-09T18:32:08-06:00,211
12/9/13,place,Experiment Fund,2013-12-09T18:32:09-06:00,2013-12-09T18:35:07-06:00,178
12/9/13,move,walking,2013-12-09T18:35:07-06:00,2013-12-09T18:46:09-06:00,662
12/9/13,place,Home,2013-12-09T18:46:09-06:00,2013-12-09T20:38:23-06:00,6734
12/9/13,move,transport,2013-12-09T20:38:23-06:00,2013-12-09T20:55:52-06:00,1049
12/9/13,place,Back Bay Social Club,2013-12-09T20:55:52-06:00,2013-12-09T23:03:07-06:00,7635
12/9/13,move,transport,2013-12-09T23:03:07-06:00,2013-12-09T23:13:23-06:00,616
12/9/13,move,walking,2013-12-09T23:13:24-06:00,2013-12-09T23:21:35-06:00,491
12/9/13,place,Home,2013-12-09T23:21:34-06:00,2013-12-10T00:00:00-06:00,2306
12/10/13,place,Home,2013-12-10T00:00:00-06:00,2013-12-10T18:56:15-06:00,68175
12/10/13,move,walking,2013-12-10T18:56:15-06:00,2013-12-10T19:02:02-06:00,347
12/10/13,place,Broadway Marketplace,2013-12-10T19:02:01-06:00,2013-12-10T19:15:24-06:00,803
12/10/13,move,walking,2013-12-10T19:15:24-06:00,2013-12-10T19:22:50-06:00,446
12/10/13,place,Home,2013-12-10T19:22:50-06:00,2013-12-10T22:23:42-06:00,10852
12/11/13,place,Border Cafe,2013-12-11T10:04:19-06:00,2013-12-11T11:31:33-06:00,5234
12/11/13,move,walking,2013-12-11T11:31:33-06:00,2013-12-11T11:40:20-06:00,527
12/11/13,place,Proximate,2013-12-11T11:40:20-06:00,2013-12-11T11:58:38-06:00,1098
12/11/13,move,walking,2013-12-11T11:58:38-06:00,2013-12-11T12:09:59-06:00,681
12/11/13,place,Home,2013-12-11T12:09:59-06:00,2013-12-11T12:32:11-06:00,1332
12/11/13,move,transport,2013-12-11T12:32:11-06:00,2013-12-11T12:49:52-06:00,1061
12/11/13,move,walking,2013-12-11T12:49:52-06:00,2013-12-11T13:05:59-06:00,967
12/11/13,place,Shaw's,2013-12-11T13:05:59-06:00,2013-12-11T13:35:28-06:00,1769
12/11/13,move,transport,2013-12-11T13:35:28-06:00,2013-12-11T13:56:40-06:00,1272
12/11/13,move,walking,2013-12-11T13:56:40-06:00,2013-12-11T14:01:13-06:00,273
12/11/13,place,Proximate,2013-12-11T14:01:12-06:00,2013-12-11T16:34:34-06:00,9202
12/11/13,move,walking,2013-12-11T16:34:34-06:00,2013-12-11T16:44:25-06:00,591
12/11/13,place,Home,2013-12-11T16:44:25-06:00,2013-12-11T19:16:02-06:00,9097
12/11/13,place,Home,2013-12-11T22:42:25-06:00,2013-12-12T00:00:00-06:00,4655
12/12/13,place,Home,2013-12-12T00:00:00-06:00,2013-12-12T08:40:46-06:00,31246
12/12/13,move,walking,2013-12-12T08:40:46-06:00,2013-12-12T08:55:09-06:00,863
12/12/13,place,Finale Desserterie & Bakery,2013-12-12T08:55:09-06:00,2013-12-12T09:57:53-06:00,3764
12/12/13,move,walking,2013-12-12T09:57:53-06:00,2013-12-12T10:13:04-06:00,911
12/12/13,place,Proximate,2013-12-12T10:13:04-06:00,2013-12-12T11:04:35-06:00,3091
12/12/13,move,walking,2013-12-12T11:04:35-06:00,2013-12-12T11:13:21-06:00,526
12/12/13,place,Finale Desserterie & Bakery,2013-12-12T11:13:21-06:00,2013-12-12T12:40:24-06:00,5223
12/12/13,move,walking,2013-12-12T12:40:24-06:00,2013-12-12T12:53:36-06:00,792
12/12/13,place,Proximate,2013-12-12T12:53:36-06:00,2013-12-12T17:28:06-06:00,16470
12/12/13,move,walking,2013-12-12T17:28:06-06:00,2013-12-12T17:42:44-06:00,878
12/12/13,place,Legal Sea Foods - Charles Square,2013-12-12T17:42:43-06:00,2013-12-12T19:45:10-06:00,7347
12/12/13,move,walking,2013-12-12T19:45:10-06:00,2013-12-12T20:01:19-06:00,969
12/12/13,place,Home,2013-12-12T20:01:19-06:00,2013-12-13T00:00:00-06:00,14321
12/13/13,place,Home,2013-12-13T00:00:00-06:00,2013-12-13T07:57:57-06:00,28677
12/13/13,move,transport,2013-12-13T07:57:57-06:00,2013-12-13T08:09:00-06:00,663
12/13/13,place,Voltage Coffee & Art,2013-12-13T08:08:59-06:00,2013-12-13T10:17:21-06:00,7702
12/13/13,move,walking,2013-12-13T10:17:21-06:00,2013-12-13T10:22:51-06:00,330
12/13/13,move,transport,2013-12-13T10:22:52-06:00,2013-12-13T10:34:54-06:00,722
12/13/13,move,walking,2013-12-13T10:34:54-06:00,2013-12-13T10:42:02-06:00,428
12/13/13,place,Proximate,2013-12-13T10:42:02-06:00,2013-12-13T10:48:18-06:00,376
12/13/13,move,walking,2013-12-13T10:48:18-06:00,2013-12-13T10:58:54-06:00,636
12/13/13,place,Home,2013-12-13T10:58:54-06:00,2013-12-13T12:23:02-06:00,5048
12/13/13,move,transport,2013-12-13T12:23:02-06:00,2013-12-13T13:27:55-06:00,3893
12/13/13,place,Charlton Service Plaza (Westbound),2013-12-13T13:27:55-06:00,2013-12-13T13:56:39-06:00,1724
12/13/13,move,transport,2013-12-13T13:56:39-06:00,2013-12-13T19:12:06-06:00,18927
12/13/13,move,walking,2013-12-13T19:12:05-06:00,2013-12-13T19:14:35-06:00,150
12/13/13,place,Place in Cranbury Township,2013-12-13T19:14:35-06:00,2013-12-13T19:32:44-06:00,1089
12/13/13,move,transport,2013-12-13T19:32:44-06:00,2013-12-13T22:39:18-06:00,11194
12/13/13,place,Place in Cathedral Heights,2013-12-13T22:39:18-06:00,2013-12-13T22:42:47-06:00,209
12/13/13,move,walking,2013-12-13T22:42:47-06:00,2013-12-13T22:45:18-06:00,151
12/13/13,move,transport,2013-12-13T22:45:18-06:00,2013-12-13T22:50:04-06:00,286
12/13/13,place,2440 39th Street NW,2013-12-13T22:50:04-06:00,2013-12-14T00:00:00-06:00,4196
12/14/13,place,2440 39th Street NW,2013-12-14T00:00:00-06:00,2013-12-14T09:50:11-06:00,35411
12/14/13,place,2440 39th St NW,2013-12-14T10:22:31-06:00,2013-12-14T12:02:47-06:00,6016
12/14/13,move,transport,2013-12-14T12:02:47-06:00,2013-12-14T12:23:50-06:00,1263
12/14/13,place,National Museum of Natural History,2013-12-14T12:23:50-06:00,2013-12-14T12:35:40-06:00,710
12/14/13,place,National Museum of Natural History,2013-12-14T12:35:41-06:00,2013-12-14T13:23:08-06:00,2847
12/14/13,move,walking,2013-12-14T13:23:08-06:00,2013-12-14T13:30:05-06:00,417
12/14/13,place,Place in Chinatown,2013-12-14T13:30:05-06:00,2013-12-14T14:18:10-06:00,2885
12/14/13,move,walking,2013-12-14T14:18:10-06:00,2013-12-14T14:33:19-06:00,909
12/14/13,place,Nando's Peri-Peri,2013-12-14T14:33:19-06:00,2013-12-14T16:14:33-06:00,6074
12/14/13,move,walking,2013-12-14T16:14:33-06:00,2013-12-14T16:20:41-06:00,368
12/14/13,move,transport,2013-12-14T16:20:41-06:00,2013-12-14T16:28:41-06:00,480
12/14/13,move,running,2013-12-14T16:28:41-06:00,2013-12-14T16:31:11-06:00,150
12/14/13,move,transport,2013-12-14T16:31:11-06:00,2013-12-14T16:40:30-06:00,559
12/14/13,place,2440 39th Street NW,2013-12-14T17:00:01-06:00,2013-12-15T00:00:00-06:00,25199
12/15/13,place,2440 39th Street NW,2013-12-15T00:00:00-06:00,2013-12-15T13:25:44-06:00,48344
12/15/13,move,walking,2013-12-15T13:25:44-06:00,2013-12-15T13:43:33-06:00,1069
12/15/13,place,Whole Foods Market,2013-12-15T13:43:34-06:00,2013-12-15T14:03:24-06:00,1190
12/15/13,move,walking,2013-12-15T14:03:24-06:00,2013-12-15T14:12:37-06:00,553
12/15/13,place,2440 39th Street NW,2013-12-15T14:12:37-06:00,2013-12-16T00:00:00-06:00,35243
12/16/13,place,2440 39th Street NW,2013-12-16T00:00:00-06:00,2013-12-16T18:06:07-06:00,65167
12/16/13,move,transport,2013-12-16T18:06:07-06:00,2013-12-16T18:42:28-06:00,2181
12/16/13,place,5000 River Hill Road,2013-12-16T18:42:28-06:00,2013-12-16T21:36:59-06:00,10471
12/16/13,move,transport,2013-12-16T21:37:00-06:00,2013-12-16T22:06:25-06:00,1765
12/16/13,place,2440 39th Street NW,2013-12-16T22:06:24-06:00,2013-12-16T22:45:42-06:00,2358
12/18/13,place,"WMATA Bus Stop #1001805 (31, 32, 36)",2013-12-18T17:27:17-06:00,2013-12-18T17:41:46-06:00,869
12/18/13,move,transport,2013-12-18T17:41:46-06:00,2013-12-18T18:06:46-06:00,1500
12/18/13,move,walking,2013-12-18T18:06:45-06:00,2013-12-18T18:25:49-06:00,1144
12/18/13,place,Nando's Peri-Peri,2013-12-18T18:25:49-06:00,2013-12-18T20:09:55-06:00,6246
12/18/13,move,walking,2013-12-18T20:09:55-06:00,2013-12-18T20:24:58-06:00,903
12/18/13,move,transport,2013-12-18T20:24:58-06:00,2013-12-18T20:51:43-06:00,1605
12/18/13,move,walking,2013-12-18T20:51:43-06:00,2013-12-18T20:59:15-06:00,452
12/18/13,place,2440 39th Street NW,2013-12-18T20:59:16-06:00,2013-12-19T00:00:00-06:00,10844
12/19/13,place,2440 39th Street NW,2013-12-19T00:00:00-06:00,2013-12-19T18:26:25-06:00,66385
12/19/13,move,walking,2013-12-19T18:26:25-06:00,2013-12-19T18:37:58-06:00,693
12/19/13,place,Whole Foods Market,2013-12-19T18:37:59-06:00,2013-12-19T18:56:23-06:00,1104
12/19/13,move,walking,2013-12-19T18:56:23-06:00,2013-12-19T19:07:18-06:00,655
12/19/13,place,2440 39th Street NW,2013-12-19T19:07:17-06:00,2013-12-20T00:00:00-06:00,17563
12/20/13,place,2440 39th Street NW,2013-12-20T00:00:00-06:00,2013-12-20T14:02:25-06:00,50545
12/20/13,move,transport,2013-12-20T14:02:25-06:00,2013-12-20T14:33:49-06:00,1884
12/20/13,place,Place in East End,2013-12-20T14:33:49-06:00,2013-12-20T14:42:55-06:00,546
12/20/13,move,walking,2013-12-20T14:42:55-06:00,2013-12-20T14:52:27-06:00,572
12/20/13,place,Union Center Plaza,2013-12-20T14:52:27-06:00,2013-12-20T15:06:07-06:00,820
12/20/13,move,transport,2013-12-20T15:06:07-06:00,2013-12-20T16:48:00-06:00,6113
12/20/13,place,Place in Berkeley County,2013-12-20T16:48:00-06:00,2013-12-20T16:56:25-06:00,505
12/20/13,move,transport,2013-12-20T16:56:25-06:00,2013-12-20T19:56:10-06:00,10785
12/20/13,place,Place in Rockwood Station,2013-12-20T19:56:09-06:00,2013-12-20T20:09:50-06:00,821
12/20/13,move,transport,2013-12-20T20:09:50-06:00,2013-12-20T21:15:50-06:00,3960
12/20/13,place,Place in North Manor,2013-12-20T21:15:50-06:00,2013-12-20T21:18:04-06:00,134
12/20/13,move,transport,2013-12-20T21:18:04-06:00,2013-12-20T22:57:03-06:00,5939
12/20/13,place,Place in Uptown,2013-12-20T22:57:02-06:00,2013-12-20T23:12:43-06:00,941
12/20/13,move,transport,2013-12-20T23:12:43-06:00,2013-12-20T23:59:59-06:00,2836
12/21/13,move,transport,2013-12-21T00:00:00-06:00,2013-12-21T01:27:08-06:00,5228
12/21/13,place,Place in Macedonia,2013-12-21T01:27:07-06:00,2013-12-21T01:40:42-06:00,815
12/21/13,move,transport,2013-12-21T01:40:42-06:00,2013-12-21T02:10:36-06:00,1794
12/21/13,place,Place in Cleveland,2013-12-21T02:10:35-06:00,2013-12-21T02:18:35-06:00,480
12/21/13,move,transport,2013-12-21T02:18:35-06:00,2013-12-21T06:29:48-06:00,15073
12/21/13,place,Place in Elkhart,2013-12-21T06:29:47-06:00,2013-12-21T06:36:46-06:00,419
12/21/13,move,transport,2013-12-21T06:36:46-06:00,2013-12-21T09:18:49-06:00,9723
12/21/13,move,walking,2013-12-21T09:18:48-06:00,2013-12-21T09:22:17-06:00,209
12/21/13,place,Chicago Union Station,2013-12-21T09:22:18-06:00,2013-12-21T09:36:57-06:00,879
12/21/13,move,transport,2013-12-21T09:36:57-06:00,2013-12-21T10:44:59-06:00,4082
12/21/13,move,walking,2013-12-21T10:44:58-06:00,2013-12-21T10:47:07-06:00,129
12/21/13,place,999 S Batavia Ave,2013-12-21T10:47:08-06:00,2013-12-21T11:50:42-06:00,3814
12/21/13,move,transport,2013-12-21T11:50:42-06:00,2013-12-21T11:59:30-06:00,528
12/21/13,place,945 S Batavia Ave,2013-12-21T11:59:30-06:00,2013-12-21T13:13:37-06:00,4447
12/21/13,move,transport,2013-12-21T13:13:37-06:00,2013-12-21T13:22:12-06:00,515
12/21/13,place,Goody's,2013-12-21T13:22:12-06:00,2013-12-21T13:58:17-06:00,2165
12/21/13,move,transport,2013-12-21T13:58:17-06:00,2013-12-21T14:08:11-06:00,594
12/21/13,place,945 S Batavia Ave,2013-12-21T14:08:12-06:00,2013-12-21T14:28:33-06:00,1221
12/21/13,move,transport,2013-12-21T14:28:33-06:00,2013-12-21T14:37:26-06:00,533
12/21/13,place,945 S Batavia Ave,2013-12-21T14:37:27-06:00,2013-12-22T00:00:00-06:00,33753
12/22/13,place,945 S Batavia Ave,2013-12-22T00:00:00-06:00,2013-12-22T13:28:15-06:00,48495
12/22/13,move,transport,2013-12-22T13:28:15-06:00,2013-12-22T13:29:48-06:00,93
12/22/13,place,Wildwood,2013-12-22T13:29:48-06:00,2013-12-22T14:14:38-06:00,2690
12/22/13,place,Place in Geneva,2013-12-22T14:14:39-06:00,2013-12-22T14:24:47-06:00,608
12/22/13,move,transport,2013-12-22T14:24:47-06:00,2013-12-22T14:41:02-06:00,975
12/22/13,place,Geneva Public Library District,2013-12-22T14:41:02-06:00,2013-12-22T14:47:57-06:00,415
12/22/13,move,transport,2013-12-22T14:47:57-06:00,2013-12-22T14:57:59-06:00,602
12/22/13,move,walking,2013-12-22T14:58:00-06:00,2013-12-22T15:03:33-06:00,333
12/22/13,place,Walmart,2013-12-22T15:03:32-06:00,2013-12-22T15:45:29-06:00,2517
12/22/13,move,transport,2013-12-22T15:45:29-06:00,2013-12-22T15:56:45-06:00,676
12/22/13,place,945 S Batavia Ave,2013-12-22T15:56:44-06:00,2013-12-22T20:57:29-06:00,18045
12/22/13,place,945 S Batavia Ave,2013-12-22T21:45:59-06:00,2013-12-23T00:00:00-06:00,8041
12/23/13,place,945 S Batavia Ave,2013-12-23T00:00:00-06:00,2013-12-23T13:42:04-06:00,49324
12/23/13,move,transport,2013-12-23T13:42:04-06:00,2013-12-23T13:53:41-06:00,697
12/23/13,place,Portillo's Hot Dogs,2013-12-23T13:53:42-06:00,2013-12-23T14:27:10-06:00,2008
12/23/13,move,transport,2013-12-23T14:27:11-06:00,2013-12-23T14:39:42-06:00,751
12/23/13,place,945 S Batavia Ave,2013-12-23T14:39:41-06:00,2013-12-23T15:14:55-06:00,2114
12/23/13,move,transport,2013-12-23T15:14:55-06:00,2013-12-23T15:22:57-06:00,482
12/23/13,place,Sam's Club,2013-12-23T15:22:57-06:00,2013-12-23T16:06:18-06:00,2601
12/23/13,move,walking,2013-12-23T16:06:18-06:00,2013-12-23T16:08:50-06:00,152
12/23/13,move,transport,2013-12-23T16:08:50-06:00,2013-12-23T16:20:21-06:00,691
12/23/13,move,walking,2013-12-23T16:20:21-06:00,2013-12-23T16:22:57-06:00,156
12/23/13,place,945 S Batavia Ave,2013-12-23T16:22:57-06:00,2013-12-24T00:00:00-06:00,27423
12/24/13,place,945 S Batavia Ave,2013-12-24T00:00:00-06:00,2013-12-24T13:04:46-06:00,47086
12/24/13,move,transport,2013-12-24T13:04:46-06:00,2013-12-24T13:12:20-06:00,454
12/24/13,place,Marshalls,2013-12-24T13:12:20-06:00,2013-12-24T13:30:53-06:00,1113
12/24/13,move,transport,2013-12-24T13:30:53-06:00,2013-12-24T13:43:43-06:00,770
12/24/13,place,Walmart,2013-12-24T13:43:43-06:00,2013-12-24T14:41:58-06:00,3495
12/24/13,move,transport,2013-12-24T14:41:58-06:00,2013-12-24T14:46:40-06:00,282
12/24/13,place,945 S Batavia Ave,2013-12-24T14:46:40-06:00,2013-12-25T00:00:00-06:00,33200
12/25/13,place,945 S Batavia Ave,2013-12-25T00:00:00-06:00,2013-12-26T00:00:00-06:00,86400
12/26/13,place,945 S Batavia Ave,2013-12-26T00:00:00-06:00,2013-12-26T08:07:33-06:00,29253
12/26/13,move,transport,2013-12-26T08:07:33-06:00,2013-12-26T08:12:48-06:00,315
12/26/13,place,Metra - Geneva Station,2013-12-26T08:12:48-06:00,2013-12-26T08:18:02-06:00,314
12/26/13,move,transport,2013-12-26T08:18:02-06:00,2013-12-26T09:33:34-06:00,4532
12/26/13,move,walking,2013-12-26T09:33:33-06:00,2013-12-26T09:35:33-06:00,120
12/26/13,move,transport,2013-12-26T09:35:34-06:00,2013-12-26T09:41:04-06:00,330
12/26/13,move,walking,2013-12-26T09:41:04-06:00,2013-12-26T09:56:39-06:00,935
12/26/13,place,"Minsky, McCormick, and Hallagan P.C.",2013-12-26T09:56:39-06:00,2013-12-26T10:52:20-06:00,3341
12/26/13,move,walking,2013-12-26T10:52:20-06:00,2013-12-26T11:02:51-06:00,631
12/26/13,place,The Berghoff Restaurant,2013-12-26T11:02:50-06:00,2013-12-26T12:01:38-06:00,3528
12/26/13,move,walking,2013-12-26T12:01:38-06:00,2013-12-26T12:10:08-06:00,510
12/26/13,place,Walgreens,2013-12-26T12:10:08-06:00,2013-12-26T12:21:04-06:00,656
12/26/13,move,walking,2013-12-26T12:21:04-06:00,2013-12-26T12:35:53-06:00,889
12/26/13,move,transport,2013-12-26T12:35:52-06:00,2013-12-26T13:53:22-06:00,4650
12/26/13,move,walking,2013-12-26T13:53:21-06:00,2013-12-26T14:03:06-06:00,585
12/26/13,place,945 S Batavia Ave,2013-12-26T14:03:06-06:00,2013-12-27T00:00:00-06:00,35814
12/27/13,place,945 S Batavia Ave,2013-12-27T00:00:00-06:00,2013-12-27T13:36:52-06:00,49012
12/27/13,move,transport,2013-12-27T13:36:52-06:00,2013-12-27T13:40:10-06:00,198
12/27/13,place,Nosh,2013-12-27T13:40:10-06:00,2013-12-27T14:24:10-06:00,2640
12/27/13,move,transport,2013-12-27T14:24:10-06:00,2013-12-27T14:28:23-06:00,253
12/27/13,place,CVS/pharmacy,2013-12-27T14:28:23-06:00,2013-12-27T14:47:44-06:00,1161
12/27/13,move,transport,2013-12-27T14:47:44-06:00,2013-12-27T14:53:10-06:00,326
12/27/13,place,945 S Batavia Ave,2013-12-27T14:53:10-06:00,2013-12-27T15:53:36-06:00,3626
12/27/13,move,transport,2013-12-27T15:53:36-06:00,2013-12-27T16:00:33-06:00,417
12/27/13,place,Place in Batavia,2013-12-27T16:00:33-06:00,2013-12-27T16:10:29-06:00,596
12/27/13,move,transport,2013-12-27T16:10:29-06:00,2013-12-27T17:16:51-06:00,3982
12/27/13,move,walking,2013-12-27T17:16:50-06:00,2013-12-27T17:19:21-06:00,151
12/27/13,place,Chicago O'Hare International Airport (ORD),2013-12-27T17:19:21-06:00,2013-12-27T18:42:00-06:00,4959
12/27/13,move,walking,2013-12-27T18:42:00-06:00,2013-12-27T18:46:44-06:00,284
12/27/13,move,transport,2013-12-27T18:46:44-06:00,2013-12-27T19:38:12-06:00,3088
12/27/13,place,Aliano's Ristorante,2013-12-27T19:38:12-06:00,2013-12-27T22:03:17-06:00,8705
12/27/13,move,transport,2013-12-27T22:03:17-06:00,2013-12-27T22:09:11-06:00,354
12/27/13,move,walking,2013-12-27T22:09:11-06:00,2013-12-27T22:11:24-06:00,133
12/27/13,place,945 S Batavia Ave,2013-12-27T22:11:25-06:00,2013-12-27T22:16:57-06:00,332
12/27/13,place,945 S Batavia Ave,2013-12-27T22:54:47-06:00,2013-12-28T00:00:00-06:00,3913
12/28/13,place,945 S Batavia Ave,2013-12-28T00:00:00-06:00,2013-12-29T00:00:00-06:00,86400
12/29/13,place,945 S Batavia Ave,2013-12-29T00:00:00-06:00,2013-12-29T12:29:39-06:00,44979
12/29/13,move,transport,2013-12-29T12:29:39-06:00,2013-12-29T12:32:00-06:00,141
12/29/13,place,Wildwood,2013-12-29T12:32:00-06:00,2013-12-29T13:51:56-06:00,4796
12/29/13,move,transport,2013-12-29T13:51:56-06:00,2013-12-29T13:55:05-06:00,189
12/29/13,place,999 S Batavia Ave,2013-12-29T13:55:04-06:00,2013-12-30T00:00:00-06:00,36296
12/30/13,place,999 S Batavia Ave,2013-12-30T00:00:00-06:00,2013-12-30T11:53:16-06:00,42796
12/30/13,move,walking,2013-12-30T11:53:16-06:00,2013-12-30T11:55:29-06:00,133
12/30/13,move,transport,2013-12-30T11:55:29-06:00,2013-12-30T12:01:19-06:00,350
12/30/13,place,Egg Harbor Cafe,2013-12-30T12:01:18-06:00,2013-12-30T13:32:23-06:00,5465
12/30/13,move,transport,2013-12-30T13:32:23-06:00,2013-12-30T13:34:57-06:00,154
12/30/13,place,999 S Batavia Ave,2013-12-30T13:34:57-06:00,2013-12-31T00:00:00-06:00,37503
12/31/13,place,999 S Batavia Ave,2013-12-31T00:00:00-06:00,2013-12-31T10:56:49-06:00,39409
12/31/13,move,transport,2013-12-31T10:56:49-06:00,2013-12-31T11:27:23-06:00,1834
12/31/13,place,Next Generation Development,2013-12-31T11:27:23-06:00,2013-12-31T12:57:51-06:00,5428
12/31/13,move,transport,2013-12-31T12:57:51-06:00,2013-12-31T13:17:30-06:00,1179
12/31/13,place,Chipotle Mexican Grill,2013-12-31T13:17:30-06:00,2013-12-31T13:43:54-06:00,1584
12/31/13,move,transport,2013-12-31T13:43:54-06:00,2013-12-31T13:49:59-06:00,365
12/31/13,move,walking,2013-12-31T13:49:58-06:00,2013-12-31T13:52:34-06:00,156
12/31/13,place,Lacoste Outlet,2013-12-31T13:52:34-06:00,2013-12-31T14:10:30-06:00,1076
12/31/13,move,walking,2013-12-31T14:10:30-06:00,2013-12-31T14:17:57-06:00,447
12/31/13,place,Coach Mens Factory,2013-12-31T14:17:57-06:00,2013-12-31T14:54:02-06:00,2165
12/31/13,move,walking,2013-12-31T14:54:02-06:00,2013-12-31T14:57:33-06:00,211
12/31/13,move,transport,2013-12-31T14:57:32-06:00,2013-12-31T15:22:17-06:00,1485
12/31/13,place,Aldi,2013-12-31T15:22:17-06:00,2013-12-31T15:52:15-06:00,1798
12/31/13,move,transport,2013-12-31T15:52:15-06:00,2013-12-31T15:58:04-06:00,349
12/31/13,place,945 S Batavia Ave,2013-12-31T15:58:04-06:00,2013-12-31T17:51:45-06:00,6821
12/31/13,move,transport,2013-12-31T17:51:45-06:00,2013-12-31T18:08:03-06:00,978
12/31/13,place,McKanna Home,2013-12-31T18:08:02-06:00,2013-12-31T21:54:41-06:00,13599
12/31/13,place,945 S Batavia Ave,2013-12-31T23:10:03-06:00,2014-01-01T00:00:00-06:00,2997
1/1/14,place,945 S Batavia Ave,2014-01-01T00:00:00-06:00,2014-01-01T12:45:45-06:00,45945
1/1/14,move,transport,2014-01-01T12:45:45-06:00,2014-01-01T12:49:24-06:00,219
1/1/14,place,Egg Harbor Cafe,2014-01-01T12:49:23-06:00,2014-01-01T14:27:29-06:00,5886
1/1/14,move,transport,2014-01-01T14:27:29-06:00,2014-01-01T14:29:23-06:00,114
1/1/14,place,945 S Batavia Ave,2014-01-01T14:29:24-06:00,2014-01-02T00:00:00-06:00,34236
1/2/14,place,945 S Batavia Ave,2014-01-02T00:00:00-06:00,2014-01-02T13:06:06-06:00,47166
1/2/14,move,walking,2014-01-02T13:06:06-06:00,2014-01-02T13:08:18-06:00,132
1/2/14,move,transport,2014-01-02T13:08:18-06:00,2014-01-02T13:17:38-06:00,560
1/2/14,place,Portillo's Hot Dogs,2014-01-02T13:17:38-06:00,2014-01-02T13:49:48-06:00,1930
1/2/14,move,transport,2014-01-02T13:49:48-06:00,2014-01-02T14:01:37-06:00,709
1/2/14,place,945 S Batavia Ave,2014-01-02T14:01:37-06:00,2014-01-03T00:00:00-06:00,35903
1/3/14,place,945 S Batavia Ave,2014-01-03T00:00:00-06:00,2014-01-03T13:52:06-06:00,49926
1/3/14,move,transport,2014-01-03T13:52:06-06:00,2014-01-03T14:01:12-06:00,546
1/3/14,place,Lindsay Home,2014-01-03T14:01:11-06:00,2014-01-03T14:11:39-06:00,628
1/3/14,move,transport,2014-01-03T14:11:39-06:00,2014-01-03T14:23:47-06:00,728
1/3/14,move,walking,2014-01-03T14:23:47-06:00,2014-01-03T14:28:19-06:00,272
1/3/14,place,Sam's Club,2014-01-03T14:28:19-06:00,2014-01-03T15:10:54-06:00,2555
1/3/14,move,transport,2014-01-03T15:10:54-06:00,2014-01-03T15:25:51-06:00,897
1/3/14,place,999 S Batavia Ave,2014-01-03T15:25:51-06:00,2014-01-03T17:38:49-06:00,7978
1/3/14,move,walking,2014-01-03T17:38:49-06:00,2014-01-03T17:41:43-06:00,174
1/3/14,move,transport,2014-01-03T17:41:43-06:00,2014-01-03T18:13:51-06:00,1928
1/3/14,place,Place in Naperville,2014-01-03T18:13:51-06:00,2014-01-03T21:52:57-06:00,13146
1/3/14,move,transport,2014-01-03T21:52:57-06:00,2014-01-03T22:24:18-06:00,1881
1/3/14,place,Place in Geneva,2014-01-03T22:24:18-06:00,2014-01-04T00:00:00-06:00,5742
1/4/14,place,Place in Geneva,2014-01-04T00:00:00-06:00,2014-01-04T09:38:35-06:00,34715
1/4/14,move,transport,2014-01-04T09:38:35-06:00,2014-01-04T09:59:46-06:00,1271
1/4/14,place,Place in Aurora,2014-01-04T09:59:45-06:00,2014-01-04T11:24:33-06:00,5088
1/4/14,move,transport,2014-01-04T11:24:33-06:00,2014-01-04T11:43:10-06:00,1117
1/4/14,place,Fitzsimmons Home,2014-01-04T11:43:10-06:00,2014-01-05T00:00:00-06:00,44210
1/5/14,place,Fitzsimmons Home,2014-01-05T00:00:00-06:00,2014-01-05T16:10:35-06:00,58235
1/5/14,move,walking,2014-01-05T16:10:35-06:00,2014-01-05T16:12:44-06:00,129
1/5/14,move,transport,2014-01-05T16:12:44-06:00,2014-01-05T16:26:45-06:00,841
1/5/14,move,walking,2014-01-05T16:26:45-06:00,2014-01-05T16:28:48-06:00,123
1/5/14,place,Place in Geneva Commons,2014-01-05T16:28:48-06:00,2014-01-05T16:47:31-06:00,1123
1/5/14,move,transport,2014-01-05T16:47:31-06:00,2014-01-05T16:59:15-06:00,704
1/5/14,place,945 S Batavia Ave,2014-01-05T16:59:15-06:00,2014-01-06T00:00:00-06:00,25245
1/6/14,place,945 S Batavia Ave,2014-01-06T00:00:00-06:00,2014-01-06T18:35:45-06:00,66945
1/6/14,place,Fitzsimmons Home,2014-01-06T21:20:00-06:00,2014-01-07T00:00:00-06:00,9600
1/7/14,place,Fitzsimmons Home,2014-01-07T00:00:00-06:00,2014-01-07T15:46:16-06:00,56776
1/7/14,move,walking,2014-01-07T15:46:16-06:00,2014-01-07T15:49:46-06:00,210
1/7/14,move,transport,2014-01-07T15:49:46-06:00,2014-01-07T16:39:13-06:00,2967
1/7/14,place,Chicago O'Hare International Airport (ORD),2014-01-07T16:39:13-06:00,2014-01-07T16:50:18-06:00,665
1/7/14,move,transport,2014-01-07T16:50:18-06:00,2014-01-07T17:01:47-06:00,689
1/7/14,move,walking,2014-01-07T17:01:47-06:00,2014-01-07T17:05:07-06:00,200
1/7/14,place,Hilton O'Hare Airport,2014-01-07T17:05:07-06:00,2014-01-07T17:45:58-06:00,2451
1/7/14,move,walking,2014-01-07T17:45:58-06:00,2014-01-07T17:55:42-06:00,584
1/7/14,place,Chicago O'Hare International Airport (ORD),2014-01-07T17:55:41-06:00,2014-01-07T18:04:35-06:00,534
1/7/14,move,walking,2014-01-07T18:04:35-06:00,2014-01-07T18:09:19-06:00,284
1/7/14,place,Gate L5,2014-01-07T18:09:18-06:00,2014-01-07T19:07:55-06:00,3517
1/7/14,place,Boston Logan International Airport (BOS),2014-01-07T21:32:36-06:00,2014-01-07T21:54:05-06:00,1289
1/7/14,move,walking,2014-01-07T21:54:06-06:00,2014-01-07T21:56:12-06:00,126
1/7/14,move,transport,2014-01-07T21:56:12-06:00,2014-01-07T22:14:17-06:00,1085
1/7/14,place,Home,2014-01-07T22:14:17-06:00,2014-01-08T00:00:00-06:00,6343
1/8/14,place,Home,2014-01-08T00:00:00-06:00,2014-01-08T08:14:06-06:00,29646
1/8/14,move,walking,2014-01-08T08:14:06-06:00,2014-01-08T08:30:39-06:00,993
1/8/14,place,Henrietta's Table,2014-01-08T08:30:38-06:00,2014-01-08T10:40:48-06:00,7810
1/8/14,move,walking,2014-01-08T10:40:48-06:00,2014-01-08T10:45:50-06:00,302
1/8/14,place,Bank Of America,2014-01-08T10:45:50-06:00,2014-01-08T10:48:49-06:00,179
1/8/14,move,walking,2014-01-08T10:48:49-06:00,2014-01-08T10:55:21-06:00,392
1/8/14,place,Broadway Marketplace,2014-01-08T10:55:21-06:00,2014-01-08T10:58:18-06:00,177
1/8/14,move,walking,2014-01-08T10:58:18-06:00,2014-01-08T11:02:22-06:00,244
1/8/14,place,Home,2014-01-08T11:02:21-06:00,2014-01-08T19:08:03-06:00,29142
1/8/14,move,walking,2014-01-08T19:08:03-06:00,2014-01-08T19:18:02-06:00,599
1/8/14,place,CVS/pharmacy,2014-01-08T19:18:02-06:00,2014-01-08T19:24:02-06:00,360
1/8/14,move,walking,2014-01-08T19:24:02-06:00,2014-01-08T19:34:49-06:00,647
1/8/14,place,Home,2014-01-08T19:34:48-06:00,2014-01-09T00:00:00-06:00,15912
1/9/14,place,Home,2014-01-09T00:00:00-06:00,2014-01-09T09:14:58-06:00,33298
1/9/14,move,walking,2014-01-09T09:14:58-06:00,2014-01-09T09:28:38-06:00,820
1/9/14,place,Proximate,2014-01-09T09:28:38-06:00,2014-01-09T11:59:06-06:00,9028
1/9/14,move,walking,2014-01-09T11:59:06-06:00,2014-01-09T12:08:41-06:00,575
1/9/14,place,Border Cafe,2014-01-09T12:08:40-06:00,2014-01-09T13:08:14-06:00,3574
1/9/14,move,walking,2014-01-09T13:08:14-06:00,2014-01-09T13:15:36-06:00,442
1/9/14,place,Place in Old Cambridge,2014-01-09T13:15:36-06:00,2014-01-09T13:21:17-06:00,341
1/9/14,move,walking,2014-01-09T13:21:17-06:00,2014-01-09T13:38:34-06:00,1037
1/9/14,place,Proximate,2014-01-09T13:38:34-06:00,2014-01-09T18:38:28-06:00,17994
1/9/14,move,walking,2014-01-09T18:38:28-06:00,2014-01-09T18:49:58-06:00,690
1/9/14,place,Broadway Marketplace,2014-01-09T18:49:59-06:00,2014-01-09T18:54:52-06:00,293
1/9/14,move,walking,2014-01-09T18:54:52-06:00,2014-01-09T19:00:38-06:00,346
1/9/14,place,Home,2014-01-09T19:00:37-06:00,2014-01-10T00:00:00-06:00,17963
1/10/14,place,Home,2014-01-10T00:00:00-06:00,2014-01-10T08:48:13-06:00,31693
1/10/14,move,walking,2014-01-10T08:48:14-06:00,2014-01-10T09:03:52-06:00,938
1/10/14,place,Proximate,2014-01-10T09:03:52-06:00,2014-01-10T12:48:46-06:00,13494
1/10/14,move,walking,2014-01-10T12:48:46-06:00,2014-01-10T13:01:17-06:00,751
1/10/14,place,Shake Shack,2014-01-10T13:01:17-06:00,2014-01-10T13:36:14-06:00,2097
1/10/14,move,walking,2014-01-10T13:36:14-06:00,2014-01-10T13:52:36-06:00,982
1/10/14,place,Proximate,2014-01-10T13:52:36-06:00,2014-01-10T18:26:15-06:00,16419
1/10/14,move,walking,2014-01-10T18:26:15-06:00,2014-01-10T18:35:18-06:00,543
1/10/14,place,Broadway Marketplace,2014-01-10T18:35:18-06:00,2014-01-10T18:43:47-06:00,509
1/10/14,move,walking,2014-01-10T18:43:47-06:00,2014-01-10T18:49:21-06:00,334
1/10/14,place,Home,2014-01-10T18:49:21-06:00,2014-01-11T00:00:00-06:00,18639
1/11/14,place,Home,2014-01-11T00:00:00-06:00,2014-01-11T12:05:27-06:00,43527
1/11/14,move,walking,2014-01-11T12:05:27-06:00,2014-01-11T12:17:20-06:00,713
1/11/14,place,Dickson Bros. True Value,2014-01-11T12:17:20-06:00,2014-01-11T12:42:18-06:00,1498
1/11/14,move,walking,2014-01-11T12:42:18-06:00,2014-01-11T12:55:05-06:00,767
1/11/14,place,Home,2014-01-11T12:55:05-06:00,2014-01-12T00:00:00-06:00,39895
1/12/14,place,Home,2014-01-12T00:00:00-06:00,2014-01-13T00:00:00-06:00,86400
1/13/14,place,Home,2014-01-13T00:00:00-06:00,2014-01-13T08:56:57-06:00,32217
1/13/14,move,walking,2014-01-13T08:56:57-06:00,2014-01-13T09:05:42-06:00,525
1/13/14,place,Proximate,2014-01-13T09:05:41-06:00,2014-01-13T12:09:04-06:00,11003
1/13/14,move,walking,2014-01-13T12:09:04-06:00,2014-01-13T12:21:45-06:00,761
1/13/14,place,Grendel's Den Restaurant & Bar,2014-01-13T12:21:45-06:00,2014-01-13T13:14:44-06:00,3179
1/13/14,move,walking,2014-01-13T13:14:44-06:00,2014-01-13T13:29:16-06:00,872
1/13/14,place,Proximate,2014-01-13T13:29:16-06:00,2014-01-13T16:03:29-06:00,9253
1/13/14,move,walking,2014-01-13T16:03:29-06:00,2014-01-13T16:13:31-06:00,602
1/13/14,move,transport,2014-01-13T16:13:30-06:00,2014-01-13T16:41:01-06:00,1651
1/13/14,move,walking,2014-01-13T16:41:02-06:00,2014-01-13T16:44:45-06:00,223
1/13/14,place,Harvard Club of Boston,2014-01-13T16:44:45-06:00,2014-01-13T18:16:15-06:00,5490
1/13/14,move,walking,2014-01-13T18:16:15-06:00,2014-01-13T18:23:47-06:00,452
1/13/14,place,Trattoria Newbury,2014-01-13T18:23:46-06:00,2014-01-13T19:43:56-06:00,4810
1/13/14,move,walking,2014-01-13T19:43:56-06:00,2014-01-13T19:48:57-06:00,301
1/13/14,place,MBTA Bus Stop | Massachusetts Ave. & Newbury St.,2014-01-13T19:48:57-06:00,2014-01-13T19:58:24-06:00,567
1/13/14,move,transport,2014-01-13T19:58:24-06:00,2014-01-13T20:12:58-06:00,874
1/13/14,move,walking,2014-01-13T20:12:57-06:00,2014-01-13T20:21:57-06:00,540
1/13/14,place,Home,2014-01-13T20:21:58-06:00,2014-01-14T00:00:00-06:00,13082
1/14/14,place,Home,2014-01-14T00:00:00-06:00,2014-01-14T08:44:14-06:00,31454
1/14/14,move,walking,2014-01-14T08:44:14-06:00,2014-01-14T08:52:48-06:00,514
1/14/14,place,Proximate,2014-01-14T08:52:48-06:00,2014-01-14T11:30:26-06:00,9458
1/14/14,move,walking,2014-01-14T11:30:26-06:00,2014-01-14T11:40:37-06:00,611
1/14/14,place,Dickson Bros. True Value,2014-01-14T11:40:38-06:00,2014-01-14T12:26:39-06:00,2761
1/14/14,move,walking,2014-01-14T12:26:39-06:00,2014-01-14T12:38:58-06:00,739
1/14/14,place,Proximate,2014-01-14T12:38:58-06:00,2014-01-14T15:05:13-06:00,8775
1/14/14,move,walking,2014-01-14T15:05:13-06:00,2014-01-14T15:19:08-06:00,835
1/14/14,place,Starbucks,2014-01-14T15:19:08-06:00,2014-01-14T15:32:49-06:00,821
1/14/14,move,walking,2014-01-14T15:32:49-06:00,2014-01-14T15:43:30-06:00,641
1/14/14,place,Proximate,2014-01-14T15:43:30-06:00,2014-01-14T19:18:03-06:00,12873
1/14/14,move,walking,2014-01-14T19:18:03-06:00,2014-01-14T19:28:38-06:00,635
1/14/14,place,Broadway Marketplace,2014-01-14T19:28:38-06:00,2014-01-14T19:40:31-06:00,713
1/14/14,move,walking,2014-01-14T19:40:31-06:00,2014-01-14T19:44:10-06:00,219
1/14/14,place,Home,2014-01-14T19:44:10-06:00,2014-01-15T00:00:00-06:00,15350
1/15/14,place,Home,2014-01-15T00:00:00-06:00,2014-01-15T08:47:20-06:00,31640
1/15/14,move,walking,2014-01-15T08:47:20-06:00,2014-01-15T08:57:57-06:00,637
1/15/14,place,Proximate,2014-01-15T08:57:56-06:00,2014-01-15T12:33:50-06:00,12954
1/15/14,move,walking,2014-01-15T12:33:50-06:00,2014-01-15T12:45:04-06:00,674
1/15/14,place,Border Cafe,2014-01-15T12:45:04-06:00,2014-01-15T13:30:35-06:00,2731
1/15/14,move,walking,2014-01-15T13:30:35-06:00,2014-01-15T13:41:13-06:00,638
1/15/14,place,Proximate,2014-01-15T13:41:13-06:00,2014-01-15T20:11:44-06:00,23431
1/15/14,move,walking,2014-01-15T20:11:44-06:00,2014-01-15T20:27:23-06:00,939
1/15/14,place,Legal Sea Foods - Charles Square,2014-01-15T20:27:23-06:00,2014-01-15T22:03:57-06:00,5794
1/15/14,move,walking,2014-01-15T22:03:57-06:00,2014-01-15T22:22:35-06:00,1118
1/15/14,place,Home,2014-01-15T22:22:35-06:00,2014-01-16T00:00:00-06:00,5845
1/16/14,place,Home,2014-01-16T00:00:00-06:00,2014-01-16T07:50:50-06:00,28250
1/16/14,move,transport,2014-01-16T07:50:50-06:00,2014-01-16T08:12:53-06:00,1323
1/16/14,place,Boston Logan International Airport (BOS),2014-01-16T08:12:53-06:00,2014-01-16T09:15:04-06:00,3731
1/16/14,place,Place in Logan International Airport,2014-01-16T09:16:35-06:00,2014-01-16T09:26:21-06:00,586
1/16/14,move,transport,2014-01-16T09:26:21-06:00,2014-01-16T11:11:42-06:00,6321
1/16/14,move,walking,2014-01-16T11:11:41-06:00,2014-01-16T11:17:11-06:00,330
1/16/14,move,transport,2014-01-16T11:17:12-06:00,2014-01-16T11:43:13-06:00,1561
1/16/14,move,walking,2014-01-16T11:43:13-06:00,2014-01-16T11:45:13-06:00,120
1/16/14,move,transport,2014-01-16T11:45:13-06:00,2014-01-16T11:49:13-06:00,240
1/16/14,move,walking,2014-01-16T11:49:13-06:00,2014-01-16T11:57:32-06:00,499
1/16/14,place,NTN24,2014-01-16T11:57:33-06:00,2014-01-16T12:12:34-06:00,901
1/16/14,move,walking,2014-01-16T12:12:34-06:00,2014-01-16T12:22:01-06:00,567
1/16/14,place,District Taco,2014-01-16T12:22:01-06:00,2014-01-16T13:18:03-06:00,3362
1/16/14,move,walking,2014-01-16T13:18:03-06:00,2014-01-16T13:27:17-06:00,554
1/16/14,place,NTN24,2014-01-16T13:27:17-06:00,2014-01-16T16:10:01-06:00,9764
1/16/14,move,walking,2014-01-16T16:10:01-06:00,2014-01-16T16:14:06-06:00,245
1/16/14,place,Staples,2014-01-16T16:14:06-06:00,2014-01-16T16:21:58-06:00,472
1/16/14,move,walking,2014-01-16T16:21:58-06:00,2014-01-16T16:27:06-06:00,308
1/16/14,place,NTN24,2014-01-16T16:27:05-06:00,2014-01-16T20:10:14-06:00,13389
1/16/14,move,transport,2014-01-16T20:10:14-06:00,2014-01-16T20:37:02-06:00,1608
1/16/14,move,walking,2014-01-16T20:37:02-06:00,2014-01-16T20:43:37-06:00,395
1/16/14,place,Whole Foods Market,2014-01-16T20:43:38-06:00,2014-01-16T20:50:02-06:00,384
1/16/14,move,walking,2014-01-16T20:50:02-06:00,2014-01-16T20:59:34-06:00,572
1/16/14,place,2440 39th St NW,2014-01-16T20:59:34-06:00,2014-01-17T00:00:00-06:00,10826
1/17/14,place,2440 39th St NW,2014-01-17T00:00:00-06:00,2014-01-17T08:33:40-06:00,30820
1/17/14,move,walking,2014-01-17T08:33:40-06:00,2014-01-17T08:41:22-06:00,462
1/17/14,place,"WMATA Bus Stop #1001805 (31, 32, 36)",2014-01-17T08:41:21-06:00,2014-01-17T08:49:00-06:00,459
1/17/14,move,walking,2014-01-17T08:49:00-06:00,2014-01-17T08:52:21-06:00,201
1/17/14,place,CVS/pharmacy,2014-01-17T08:52:20-06:00,2014-01-17T09:01:09-06:00,529
1/17/14,move,walking,2014-01-17T09:01:09-06:00,2014-01-17T09:23:53-06:00,1364
1/17/14,place,Apple Store,2014-01-17T09:23:52-06:00,2014-01-17T09:36:20-06:00,748
1/17/14,move,walking,2014-01-17T09:36:20-06:00,2014-01-17T09:51:25-06:00,905
1/17/14,place,Safeway,2014-01-17T09:51:25-06:00,2014-01-17T10:00:07-06:00,522
1/17/14,move,walking,2014-01-17T10:00:07-06:00,2014-01-17T10:19:24-06:00,1157
1/17/14,place,2440 39th St NW,2014-01-17T10:19:23-06:00,2014-01-17T15:30:13-06:00,18650
1/17/14,move,walking,2014-01-17T15:30:13-06:00,2014-01-17T16:01:18-06:00,1865
1/17/14,place,Old Glory,2014-01-17T16:01:17-06:00,2014-01-17T18:39:38-06:00,9501
1/17/14,move,walking,2014-01-17T18:39:38-06:00,2014-01-17T18:59:54-06:00,1216
1/17/14,place,Safeway,2014-01-17T18:59:55-06:00,2014-01-17T19:10:45-06:00,650
1/17/14,move,walking,2014-01-17T19:10:45-06:00,2014-01-17T19:29:42-06:00,1137
1/17/14,place,2440 39th St NW,2014-01-17T19:29:42-06:00,2014-01-18T00:00:00-06:00,16218
1/18/14,place,2440 39th St NW,2014-01-18T00:00:00-06:00,2014-01-18T13:02:36-06:00,46956
1/18/14,move,transport,2014-01-18T13:02:36-06:00,2014-01-18T13:41:25-06:00,2329
1/18/14,move,walking,2014-01-18T13:41:25-06:00,2014-01-18T13:47:06-06:00,341
1/18/14,place,IKEA,2014-01-18T13:47:06-06:00,2014-01-18T17:29:23-06:00,13337
1/18/14,move,transport,2014-01-18T17:29:23-06:00,2014-01-18T18:05:12-06:00,2149
1/18/14,place,2440 39th St NW,2014-01-18T18:05:11-06:00,2014-01-19T00:00:00-06:00,21289
1/19/14,place,2440 39th St NW,2014-01-19T00:00:00-06:00,2014-01-19T13:18:16-06:00,47896
1/19/14,move,walking,2014-01-19T13:18:16-06:00,2014-01-19T13:26:18-06:00,482
1/19/14,place,Surfside,2014-01-19T13:26:18-06:00,2014-01-19T14:22:27-06:00,3369
1/19/14,move,walking,2014-01-19T14:22:27-06:00,2014-01-19T14:26:33-06:00,246
1/19/14,place,CVS/pharmacy,2014-01-19T14:26:33-06:00,2014-01-19T15:03:32-06:00,2219
1/19/14,move,walking,2014-01-19T15:03:32-06:00,2014-01-19T15:13:25-06:00,593
1/19/14,place,2440 39th St NW,2014-01-19T15:13:24-06:00,2014-01-20T00:00:00-06:00,31596
1/20/14,place,2440 39th St NW,2014-01-20T00:00:00-06:00,2014-01-20T19:36:32-06:00,70592
1/20/14,move,transport,2014-01-20T19:36:32-06:00,2014-01-20T19:45:29-06:00,537
1/20/14,place,2440 39th St NW,2014-01-20T19:45:29-06:00,2014-01-21T00:00:00-06:00,15271
1/21/14,place,2440 39th St NW,2014-01-21T00:00:00-06:00,2014-01-21T12:12:16-06:00,43936
1/21/14,move,walking,2014-01-21T12:12:16-06:00,2014-01-21T12:27:20-06:00,904
1/21/14,place,Whole Foods Market,2014-01-21T12:27:20-06:00,2014-01-21T13:08:52-06:00,2492
1/21/14,move,walking,2014-01-21T13:08:52-06:00,2014-01-21T13:18:35-06:00,583
1/21/14,place,2440 39th St NW,2014-01-21T13:18:35-06:00,2014-01-22T00:00:00-06:00,38485
1/22/14,place,2440 39th St NW,2014-01-22T00:00:00-06:00,2014-01-22T15:21:40-06:00,55300
1/22/14,place,2440 39th St NW,2014-01-22T15:21:40-06:00,2014-01-23T00:00:00-06:00,31100
1/23/14,place,2440 39th St NW,2014-01-23T00:00:00-06:00,2014-01-23T17:19:51-06:00,62391
1/23/14,move,walking,2014-01-23T17:19:51-06:00,2014-01-23T17:30:38-06:00,647
1/23/14,place,CVS/pharmacy,2014-01-23T17:30:38-06:00,2014-01-23T17:58:31-06:00,1673
1/23/14,move,walking,2014-01-23T17:58:31-06:00,2014-01-23T18:10:24-06:00,713
1/23/14,place,2440 39th St NW,2014-01-23T18:10:24-06:00,2014-01-24T00:00:00-06:00,20976
1/24/14,place,2440 39th St NW,2014-01-24T00:00:00-06:00,2014-01-25T00:00:00-06:00,86400
1/25/14,place,2440 39th St NW,2014-01-25T00:00:00-06:00,2014-01-25T09:27:55-06:00,34075
1/25/14,move,walking,2014-01-25T09:27:55-06:00,2014-01-25T09:37:15-06:00,560
1/25/14,place,CVS/pharmacy,2014-01-25T09:37:15-06:00,2014-01-25T09:41:31-06:00,256
1/25/14,move,transport,2014-01-25T09:41:31-06:00,2014-01-25T10:00:34-06:00,1143
1/25/14,move,walking,2014-01-25T10:00:34-06:00,2014-01-25T10:10:42-06:00,608
1/25/14,place,Place in West End,2014-01-25T10:10:42-06:00,2014-01-25T10:14:52-06:00,250
1/25/14,move,walking,2014-01-25T10:14:52-06:00,2014-01-25T10:17:35-06:00,163
1/25/14,move,transport,2014-01-25T10:17:35-06:00,2014-01-25T10:30:52-06:00,797
1/25/14,move,walking,2014-01-25T10:30:52-06:00,2014-01-25T10:33:27-06:00,155
1/25/14,place,Place in Ronald Reagan Washington National Airport,2014-01-25T10:33:27-06:00,2014-01-25T10:40:58-06:00,451
1/25/14,place,Ronald Reagan Washington National Airport (DCA),2014-01-25T10:40:58-06:00,2014-01-25T11:13:18-06:00,1940
1/25/14,move,transport,2014-01-25T11:13:18-06:00,2014-01-25T12:40:35-06:00,5237
1/25/14,place,Boston Logan International Airport (BOS),2014-01-25T12:40:34-06:00,2014-01-25T12:44:25-06:00,231
1/25/14,move,walking,2014-01-25T12:44:25-06:00,2014-01-25T12:54:04-06:00,579
1/25/14,move,transport,2014-01-25T12:54:04-06:00,2014-01-25T13:32:13-06:00,2289
1/25/14,move,walking,2014-01-25T13:32:12-06:00,2014-01-25T13:48:48-06:00,996
1/25/14,place,Home,2014-01-25T13:48:48-06:00,2014-01-25T16:59:07-06:00,11419
1/26/14,place,Home,2014-01-26T20:41:28-06:00,2014-01-27T00:00:00-06:00,11912
1/27/14,place,Home,2014-01-27T00:00:00-06:00,2014-01-27T17:15:33-06:00,62133
1/27/14,move,walking,2014-01-27T17:15:33-06:00,2014-01-27T17:30:56-06:00,923
1/27/14,place,Park,2014-01-27T17:30:55-06:00,2014-01-27T19:02:01-06:00,5466
1/27/14,move,walking,2014-01-27T19:02:01-06:00,2014-01-27T19:18:48-06:00,1007
1/27/14,place,Home,2014-01-27T19:18:48-06:00,2014-01-28T00:00:00-06:00,16872
1/28/14,place,Home,2014-01-28T00:00:00-06:00,2014-01-28T09:48:12-06:00,35292
1/28/14,move,walking,2014-01-28T09:48:12-06:00,2014-01-28T10:03:18-06:00,906
1/28/14,place,Proximate,2014-01-28T10:03:18-06:00,2014-01-28T11:49:24-06:00,6366
1/28/14,move,walking,2014-01-28T11:49:24-06:00,2014-01-28T11:59:02-06:00,578
1/28/14,place,Border Cafe,2014-01-28T11:59:02-06:00,2014-01-28T12:31:19-06:00,1937
1/28/14,move,walking,2014-01-28T12:31:19-06:00,2014-01-28T12:41:32-06:00,613
1/28/14,place,Proximate,2014-01-28T12:41:32-06:00,2014-01-28T15:03:20-06:00,8508
1/28/14,move,walking,2014-01-28T15:03:20-06:00,2014-01-28T15:17:57-06:00,877
1/28/14,place,Proximate,2014-01-28T15:17:57-06:00,2014-01-28T16:50:28-06:00,5551
1/28/14,move,walking,2014-01-28T16:50:28-06:00,2014-01-28T17:02:44-06:00,736
1/28/14,place,Park,2014-01-28T17:02:43-06:00,2014-01-28T19:00:04-06:00,7041
1/28/14,move,walking,2014-01-28T19:00:04-06:00,2014-01-28T19:02:05-06:00,121
1/28/14,move,transport,2014-01-28T19:02:05-06:00,2014-01-28T19:05:35-06:00,210
1/28/14,move,walking,2014-01-28T19:05:35-06:00,2014-01-28T19:07:40-06:00,125
1/28/14,place,Home,2014-01-28T19:07:39-06:00,2014-01-29T00:00:00-06:00,17541
1/29/14,place,Home,2014-01-29T00:00:00-06:00,2014-01-29T08:20:05-06:00,30005
1/29/14,move,walking,2014-01-29T08:20:05-06:00,2014-01-29T08:26:35-06:00,390
1/29/14,move,transport,2014-01-29T08:26:35-06:00,2014-01-29T08:44:36-06:00,1081
1/29/14,move,walking,2014-01-29T08:44:36-06:00,2014-01-29T08:49:16-06:00,280
1/29/14,place,Harvard Club of Boston,2014-01-29T08:49:15-06:00,2014-01-29T10:41:23-06:00,6728
1/29/14,move,walking,2014-01-29T10:41:23-06:00,2014-01-29T10:47:04-06:00,341
1/29/14,move,transport,2014-01-29T10:47:04-06:00,2014-01-29T11:11:41-06:00,1477
1/29/14,move,walking,2014-01-29T11:11:41-06:00,2014-01-29T11:17:45-06:00,364
1/29/14,place,Grendel's Den Restaurant & Bar,2014-01-29T11:17:45-06:00,2014-01-29T12:35:13-06:00,4648
1/29/14,move,walking,2014-01-29T12:35:13-06:00,2014-01-29T12:39:26-06:00,253
1/29/14,place,Harvard Alumni Association,2014-01-29T12:39:26-06:00,2014-01-29T13:29:50-06:00,3024
1/29/14,move,walking,2014-01-29T13:29:50-06:00,2014-01-29T13:43:09-06:00,799
1/29/14,place,Proximate,2014-01-29T13:43:09-06:00,2014-01-29T19:12:01-06:00,19732
1/29/14,move,walking,2014-01-29T19:12:01-06:00,2014-01-29T19:30:20-06:00,1099
1/29/14,place,Home,2014-01-29T19:30:20-06:00,2014-01-30T00:00:00-06:00,16180
1/30/14,place,Home,2014-01-30T00:00:00-06:00,2014-01-30T09:48:29-06:00,35309
1/30/14,move,walking,2014-01-30T09:48:29-06:00,2014-01-30T09:57:10-06:00,521
1/30/14,place,Proximate,2014-01-30T09:57:09-06:00,2014-01-30T12:17:41-06:00,8432
1/30/14,move,walking,2014-01-30T12:17:41-06:00,2014-01-30T12:32:33-06:00,892
1/30/14,place,Shake Shack,2014-01-30T12:32:33-06:00,2014-01-30T13:48:02-06:00,4529
1/30/14,move,walking,2014-01-30T13:48:02-06:00,2014-01-30T14:00:06-06:00,724
1/30/14,place,Proximate,2014-01-30T14:00:06-06:00,2014-01-30T18:12:46-06:00,15160
1/30/14,move,walking,2014-01-30T18:12:46-06:00,2014-01-30T18:22:58-06:00,612
1/30/14,place,Home,2014-01-30T18:22:57-06:00,2014-01-30T18:59:40-06:00,2203
1/30/14,move,walking,2014-01-30T18:59:40-06:00,2014-01-30T19:02:12-06:00,152
1/30/14,move,transport,2014-01-30T19:02:11-06:00,2014-01-30T19:13:13-06:00,662
1/30/14,move,walking,2014-01-30T19:13:13-06:00,2014-01-30T19:28:18-06:00,905
1/30/14,place,Meadhall,2014-01-30T19:28:17-06:00,2014-01-30T23:53:40-06:00,15923
1/30/14,move,transport,2014-01-30T23:53:40-06:00,2014-01-30T23:59:23-06:00,343
1/30/14,place,Home,2014-01-30T23:59:24-06:00,2014-01-31T00:00:00-06:00,36
1/31/14,place,Home,2014-01-31T00:00:00-06:00,2014-01-31T11:54:37-06:00,42877
1/31/14,move,walking,2014-01-31T11:54:37-06:00,2014-01-31T12:02:40-06:00,483
1/31/14,place,Proximate,2014-01-31T12:02:40-06:00,2014-01-31T14:34:06-06:00,9086
1/31/14,move,walking,2014-01-31T14:34:06-06:00,2014-01-31T14:55:21-06:00,1275
1/31/14,place,Place in Old Cambridge,2014-01-31T14:55:21-06:00,2014-01-31T16:34:54-06:00,5973
1/31/14,move,walking,2014-01-31T16:34:54-06:00,2014-01-31T16:53:38-06:00,1124
1/31/14,place,Home,2014-01-31T16:53:38-06:00,2014-01-31T17:19:49-06:00,1571
1/31/14,move,walking,2014-01-31T17:19:49-06:00,2014-01-31T17:29:22-06:00,573
1/31/14,place,Hong Kong,2014-01-31T17:29:22-06:00,2014-01-31T18:47:12-06:00,4670
1/31/14,move,walking,2014-01-31T18:47:12-06:00,2014-01-31T18:55:47-06:00,515
1/31/14,place,Home,2014-01-31T18:55:47-06:00,2014-02-01T00:00:00-06:00,18253
2/1/14,place,Home,2014-02-01T00:00:00-06:00,2014-02-01T11:47:17-06:00,42437
2/1/14,move,walking,2014-02-01T11:47:17-06:00,2014-02-01T12:00:36-06:00,799
2/1/14,place,Proximate,2014-02-01T12:00:36-06:00,2014-02-01T13:41:15-06:00,6039
2/1/14,move,walking,2014-02-01T13:41:15-06:00,2014-02-01T13:53:57-06:00,762
2/1/14,place,Dickson Bros. True Value,2014-02-01T13:53:57-06:00,2014-02-01T15:08:15-06:00,4458
2/1/14,move,walking,2014-02-01T15:08:15-06:00,2014-02-01T15:25:22-06:00,1027
2/1/14,place,Home,2014-02-01T15:25:22-06:00,2014-02-02T00:00:00-06:00,30878
2/2/14,place,Home,2014-02-02T00:00:00-06:00,2014-02-02T13:09:39-06:00,47379
2/2/14,move,walking,2014-02-02T13:09:39-06:00,2014-02-02T13:29:27-06:00,1188
2/2/14,place,Floyd's 99 Barbershop,2014-02-02T13:29:27-06:00,2014-02-02T14:17:19-06:00,2872
2/2/14,move,walking,2014-02-02T14:17:19-06:00,2014-02-02T14:33:29-06:00,970
2/2/14,place,Broadway Marketplace,2014-02-02T14:33:29-06:00,2014-02-02T14:50:49-06:00,1040
2/2/14,move,walking,2014-02-02T14:50:49-06:00,2014-02-02T14:55:29-06:00,280
2/2/14,place,Home,2014-02-02T14:55:29-06:00,2014-02-02T17:49:06-06:00,10417
2/2/14,move,walking,2014-02-02T17:49:06-06:00,2014-02-02T18:13:09-06:00,1443
2/2/14,place,Place in Coolidge Hill,2014-02-02T18:13:09-06:00,2014-02-02T21:20:35-06:00,11246
2/2/14,move,walking,2014-02-02T21:20:35-06:00,2014-02-02T21:46:13-06:00,1538
2/2/14,place,Home,2014-02-02T21:46:13-06:00,2014-02-03T00:00:00-06:00,8027
2/3/14,place,Home,2014-02-03T00:00:00-06:00,2014-02-04T00:00:00-06:00,86400
2/4/14,place,Home,2014-02-04T00:00:00-06:00,2014-02-04T08:37:43-06:00,31063
2/4/14,move,walking,2014-02-04T08:37:43-06:00,2014-02-04T08:45:27-06:00,464
2/4/14,place,Proximate,2014-02-04T08:45:27-06:00,2014-02-04T11:37:00-06:00,10293
2/4/14,move,walking,2014-02-04T11:37:00-06:00,2014-02-04T11:47:04-06:00,604
2/4/14,place,Border Cafe,2014-02-04T11:47:04-06:00,2014-02-04T13:47:39-06:00,7235
2/4/14,move,walking,2014-02-04T13:47:39-06:00,2014-02-04T13:58:34-06:00,655
2/4/14,place,Proximate,2014-02-04T13:58:34-06:00,2014-02-04T18:35:29-06:00,16615
2/4/14,move,walking,2014-02-04T18:35:29-06:00,2014-02-04T18:53:38-06:00,1089
2/4/14,place,Home,2014-02-04T18:53:38-06:00,2014-02-05T00:00:00-06:00,18382
2/5/14,place,Home,2014-02-05T00:00:00-06:00,2014-02-05T10:00:32-06:00,36032
2/5/14,move,walking,2014-02-05T10:00:32-06:00,2014-02-05T10:11:18-06:00,646
2/5/14,place,Proximate,2014-02-05T10:11:18-06:00,2014-02-05T12:33:57-06:00,8559
2/5/14,move,walking,2014-02-05T12:33:57-06:00,2014-02-05T12:47:07-06:00,790
2/5/14,place,Proximate,2014-02-05T12:47:06-06:00,2014-02-05T19:02:44-06:00,22538
2/5/14,move,walking,2014-02-05T19:02:45-06:00,2014-02-05T19:11:28-06:00,523
2/5/14,place,Home,2014-02-05T19:11:28-06:00,2014-02-06T00:00:00-06:00,17312
2/6/14,place,Home,2014-02-06T00:00:00-06:00,2014-02-06T08:14:55-06:00,29695
2/6/14,move,walking,2014-02-06T08:14:55-06:00,2014-02-06T08:18:50-06:00,235
2/6/14,place,Place in Old Cambridge,2014-02-06T08:18:51-06:00,2014-02-06T08:22:56-06:00,245
2/6/14,move,walking,2014-02-06T08:22:56-06:00,2014-02-06T08:34:08-06:00,672
2/6/14,place,Mitchell Dong,2014-02-06T08:34:08-06:00,2014-02-06T10:21:20-06:00,6432
2/6/14,move,walking,2014-02-06T10:21:20-06:00,2014-02-06T10:37:41-06:00,981
2/6/14,place,Grendel's Den Restaurant & Bar,2014-02-06T10:37:42-06:00,2014-02-06T11:52:42-06:00,4500
2/6/14,move,walking,2014-02-06T11:52:42-06:00,2014-02-06T12:10:26-06:00,1064
2/6/14,place,Proximate,2014-02-06T12:10:25-06:00,2014-02-06T14:46:55-06:00,9390
2/6/14,move,walking,2014-02-06T14:46:55-06:00,2014-02-06T15:04:54-06:00,1079
2/6/14,place,Home,2014-02-06T15:04:53-06:00,2014-02-06T18:44:57-06:00,13204
2/6/14,place,Home,2014-02-06T22:51:14-06:00,2014-02-07T00:00:00-06:00,4126
2/7/14,place,Home,2014-02-07T00:00:00-06:00,2014-02-07T09:19:26-06:00,33566
2/7/14,move,walking,2014-02-07T09:19:26-06:00,2014-02-07T09:30:58-06:00,692
2/7/14,place,Proximate,2014-02-07T09:30:58-06:00,2014-02-07T10:02:17-06:00,1879
2/7/14,move,walking,2014-02-07T10:02:17-06:00,2014-02-07T10:17:37-06:00,920
2/7/14,place,Legal Sea Foods - Charles Square,2014-02-07T10:17:37-06:00,2014-02-07T11:40:29-06:00,4972
2/7/14,move,walking,2014-02-07T11:40:29-06:00,2014-02-07T11:57:45-06:00,1036
2/7/14,place,Harvard Innovation Lab,2014-02-07T11:57:45-06:00,2014-02-07T15:39:06-06:00,13281
2/7/14,move,transport,2014-02-07T15:39:06-06:00,2014-02-07T15:57:04-06:00,1078
2/7/14,move,walking,2014-02-07T15:57:04-06:00,2014-02-07T15:59:37-06:00,153
2/7/14,place,Proximate,2014-02-07T15:59:37-06:00,2014-02-07T16:11:00-06:00,683
2/7/14,move,walking,2014-02-07T16:11:00-06:00,2014-02-07T16:22:49-06:00,709
2/7/14,place,Park,2014-02-07T16:22:49-06:00,2014-02-07T18:05:59-06:00,6190
2/7/14,move,walking,2014-02-07T18:05:59-06:00,2014-02-07T18:24:46-06:00,1127
2/7/14,place,Home,2014-02-07T18:24:47-06:00,2014-02-08T00:00:00-06:00,20113
2/8/14,place,Home,2014-02-08T00:00:00-06:00,2014-02-08T10:04:32-06:00,36272
2/8/14,move,walking,2014-02-08T10:04:32-06:00,2014-02-08T10:16:25-06:00,713
2/8/14,place,Dickson Bros. True Value,2014-02-08T10:16:26-06:00,2014-02-08T11:46:35-06:00,5409
2/8/14,move,walking,2014-02-08T11:46:35-06:00,2014-02-08T11:48:44-06:00,129
2/8/14,place,Starbucks,2014-02-08T11:48:43-06:00,2014-02-08T12:12:08-06:00,1405
2/8/14,move,walking,2014-02-08T12:12:08-06:00,2014-02-08T12:22:38-06:00,630
2/8/14,place,Broadway Marketplace,2014-02-08T12:22:38-06:00,2014-02-08T12:32:00-06:00,562
2/8/14,move,walking,2014-02-08T12:32:00-06:00,2014-02-08T12:35:50-06:00,230
2/8/14,place,Home,2014-02-08T12:35:50-06:00,2014-02-08T12:49:05-06:00,795
2/8/14,move,walking,2014-02-08T12:49:05-06:00,2014-02-08T12:55:18-06:00,373
2/8/14,place,Science Center Plaza,2014-02-08T12:55:18-06:00,2014-02-08T12:59:02-06:00,224
2/8/14,move,walking,2014-02-08T12:59:02-06:00,2014-02-08T13:06:40-06:00,458
2/8/14,place,Boston Tea Stop,2014-02-08T13:06:40-06:00,2014-02-08T13:56:50-06:00,3010
2/8/14,move,walking,2014-02-08T13:56:50-06:00,2014-02-08T14:12:27-06:00,937
2/8/14,place,Home,2014-02-08T14:12:26-06:00,2014-02-09T00:00:00-06:00,35254
2/9/14,place,Home,2014-02-09T00:00:00-06:00,2014-02-09T13:45:28-06:00,49528
2/9/14,move,transport,2014-02-09T13:45:28-06:00,2014-02-09T13:58:44-06:00,796
2/9/14,move,walking,2014-02-09T13:58:45-06:00,2014-02-09T14:02:18-06:00,213
2/9/14,place,The Home Depot,2014-02-09T14:02:18-06:00,2014-02-09T14:54:29-06:00,3131
2/9/14,move,transport,2014-02-09T14:54:29-06:00,2014-02-09T15:07:44-06:00,795
2/9/14,place,Home,2014-02-09T15:07:43-06:00,2014-02-09T20:02:34-06:00,17691
2/9/14,place,Home,2014-02-09T21:04:01-06:00,2014-02-10T00:00:00-06:00,10559
2/10/14,place,Home,2014-02-10T00:00:00-06:00,2014-02-10T15:27:56-06:00,55676
2/10/14,move,transport,2014-02-10T15:27:56-06:00,2014-02-10T15:51:27-06:00,1411
2/10/14,move,walking,2014-02-10T15:51:27-06:00,2014-02-10T15:53:27-06:00,120
2/10/14,place,T3 Innovation Studio,2014-02-10T15:53:27-06:00,2014-02-10T17:17:40-06:00,5053
2/10/14,move,transport,2014-02-10T17:17:40-06:00,2014-02-10T17:53:12-06:00,2132
2/10/14,place,Home,2014-02-10T17:53:12-06:00,2014-02-11T00:00:00-06:00,22008
2/11/14,place,Home,2014-02-11T00:00:00-06:00,2014-02-11T08:54:42-06:00,32082
2/11/14,move,walking,2014-02-11T08:54:42-06:00,2014-02-11T09:01:14-06:00,392
2/11/14,place,Place in Old Cambridge,2014-02-11T09:01:13-06:00,2014-02-11T09:09:58-06:00,525
2/11/14,move,walking,2014-02-11T09:09:58-06:00,2014-02-11T09:14:39-06:00,281
2/11/14,place,Proximate,2014-02-11T09:14:39-06:00,2014-02-11T18:11:16-06:00,32197
2/11/14,move,walking,2014-02-11T18:11:16-06:00,2014-02-11T18:20:52-06:00,576
2/11/14,place,Home,2014-02-11T18:20:52-06:00,2014-02-12T00:00:00-06:00,20348
2/12/14,place,Home,2014-02-12T00:00:00-06:00,2014-02-12T09:10:21-06:00,33021
2/12/14,move,walking,2014-02-12T09:10:21-06:00,2014-02-12T09:24:26-06:00,845
2/12/14,move,transport,2014-02-12T09:24:26-06:00,2014-02-12T09:39:40-06:00,914
2/12/14,place,Amtrak South Station,2014-02-12T09:39:40-06:00,2014-02-12T10:04:58-06:00,1518
2/12/14,move,transport,2014-02-12T10:04:58-06:00,2014-02-12T10:57:50-06:00,3172
2/12/14,move,transport,2014-02-12T11:24:38-06:00,2014-02-12T12:06:28-06:00,2510
2/12/14,move,transport,2014-02-12T17:41:48-06:00,2014-02-12T18:32:01-06:00,3013
2/12/14,move,walking,2014-02-12T18:32:01-06:00,2014-02-12T18:37:11-06:00,310
2/12/14,place,Place in East End,2014-02-12T18:37:10-06:00,2014-02-12T18:42:59-06:00,349
2/12/14,move,transport,2014-02-12T18:42:59-06:00,2014-02-12T19:05:50-06:00,1371
2/12/14,place,2440 39th Street NW,2014-02-12T19:05:50-06:00,2014-02-12T21:03:24-06:00,7054
2/13/14,place,2440 39th Street NW,2014-02-13T08:28:32-06:00,2014-02-13T12:26:31-06:00,14279
2/13/14,move,walking,2014-02-13T12:26:31-06:00,2014-02-13T12:36:34-06:00,603
2/13/14,place,Whole Foods Market,2014-02-13T12:36:34-06:00,2014-02-13T13:32:53-06:00,3379
2/13/14,move,walking,2014-02-13T13:32:53-06:00,2014-02-13T13:45:56-06:00,783
2/13/14,place,2440 39th Street NW,2014-02-13T13:45:56-06:00,2014-02-14T00:00:00-06:00,36844
2/14/14,place,2440 39th Street NW,2014-02-14T00:00:00-06:00,2014-02-15T00:00:00-06:00,86400
2/15/14,place,2440 39th Street NW,2014-02-15T00:00:00-06:00,2014-02-15T11:27:14-06:00,41234
2/15/14,move,walking,2014-02-15T11:27:14-06:00,2014-02-15T11:35:05-06:00,471
2/15/14,place,Surfside,2014-02-15T11:35:06-06:00,2014-02-15T11:44:12-06:00,546
2/15/14,move,walking,2014-02-15T11:49:31-06:00,2014-02-15T11:52:31-06:00,180
2/15/14,place,Place in Glover Park,2014-02-15T11:52:32-06:00,2014-02-15T15:05:23-06:00,11571
2/15/14,move,walking,2014-02-15T15:05:23-06:00,2014-02-15T15:13:27-06:00,484
2/15/14,place,Whole Foods Market,2014-02-15T15:13:27-06:00,2014-02-15T16:27:20-06:00,4433
2/15/14,move,walking,2014-02-15T16:27:20-06:00,2014-02-15T16:36:24-06:00,544
2/15/14,place,2440 39th Street NW,2014-02-15T16:36:24-06:00,2014-02-16T00:00:00-06:00,26616
2/16/14,place,2440 39th Street NW,2014-02-16T00:00:00-06:00,2014-02-16T13:16:22-06:00,47782
2/16/14,move,walking,2014-02-16T13:16:22-06:00,2014-02-16T13:46:09-06:00,1787
2/16/14,place,Place in Cloisters,2014-02-16T13:46:09-06:00,2014-02-16T13:49:35-06:00,206
2/16/14,move,walking,2014-02-16T13:49:35-06:00,2014-02-16T13:54:19-06:00,284
2/16/14,place,Apple Store,2014-02-16T13:54:19-06:00,2014-02-16T14:12:29-06:00,1090
2/16/14,move,walking,2014-02-16T14:12:29-06:00,2014-02-16T14:16:32-06:00,243
2/16/14,place,CB2,2014-02-16T14:16:32-06:00,2014-02-16T15:11:29-06:00,3297
2/16/14,move,walking,2014-02-16T15:11:29-06:00,2014-02-16T15:20:10-06:00,521
2/16/14,place,TJ Maxx & HomeGoods,2014-02-16T15:20:09-06:00,2014-02-16T17:25:59-06:00,7550
2/16/14,move,walking,2014-02-16T17:25:59-06:00,2014-02-16T17:31:38-06:00,339
2/16/14,place,H&M,2014-02-16T17:31:38-06:00,2014-02-16T18:06:52-06:00,2114
2/16/14,move,transport,2014-02-16T18:06:52-06:00,2014-02-16T18:13:37-06:00,405
2/16/14,place,Safeway,2014-02-16T18:13:37-06:00,2014-02-16T18:51:01-06:00,2244
2/16/14,move,transport,2014-02-16T18:51:01-06:00,2014-02-16T18:56:02-06:00,301
2/16/14,place,2440 39th Street NW,2014-02-16T18:57:07-06:00,2014-02-17T00:00:00-06:00,18173
2/17/14,place,2440 39th Street NW,2014-02-17T00:00:00-06:00,2014-02-17T12:03:35-06:00,43415
2/17/14,move,walking,2014-02-17T12:03:35-06:00,2014-02-17T12:11:05-06:00,450
2/17/14,place,Chipotle Mexican Grill,2014-02-17T12:11:05-06:00,2014-02-17T12:27:42-06:00,997
2/17/14,move,walking,2014-02-17T12:27:42-06:00,2014-02-17T12:36:02-06:00,500
2/17/14,place,2440 39th Street NW,2014-02-17T12:36:02-06:00,2014-02-18T00:00:00-06:00,41038
2/18/14,place,2440 39th Street NW,2014-02-18T00:00:00-06:00,2014-02-18T08:41:31-06:00,31291
2/18/14,move,transport,2014-02-18T08:41:31-06:00,2014-02-18T09:07:59-06:00,1588
2/18/14,move,walking,2014-02-18T09:07:59-06:00,2014-02-18T09:12:33-06:00,274
2/18/14,place,Place in East End,2014-02-18T09:12:33-06:00,2014-02-18T09:14:53-06:00,140
2/18/14,move,walking,2014-02-18T09:14:53-06:00,2014-02-18T09:19:59-06:00,306
2/18/14,move,transport,2014-02-18T09:20:00-06:00,2014-02-18T17:13:33-06:00,28413
2/18/14,place,Place in Neponset River Reservation,2014-02-18T17:13:33-06:00,2014-02-18T17:17:50-06:00,257
2/18/14,move,transport,2014-02-18T17:17:50-06:00,2014-02-18T17:35:22-06:00,1052
2/18/14,move,walking,2014-02-18T17:35:21-06:00,2014-02-18T17:41:51-06:00,390
2/18/14,move,transport,2014-02-18T17:41:52-06:00,2014-02-18T17:55:25-06:00,813
2/18/14,move,walking,2014-02-18T17:55:24-06:00,2014-02-18T18:05:44-06:00,620
2/18/14,place,Home,2014-02-18T18:05:43-06:00,2014-02-19T00:00:00-06:00,21257
2/19/14,place,Home,2014-02-19T00:00:00-06:00,2014-02-19T09:08:26-06:00,32906
2/19/14,move,walking,2014-02-19T09:08:26-06:00,2014-02-19T09:29:08-06:00,1242
2/19/14,place,Mitchell Dong,2014-02-19T09:29:08-06:00,2014-02-19T13:38:54-06:00,14986
2/19/14,move,walking,2014-02-19T13:38:54-06:00,2014-02-19T13:49:34-06:00,640
2/19/14,place,Border Cafe,2014-02-19T13:49:34-06:00,2014-02-19T15:10:42-06:00,4868
2/19/14,move,walking,2014-02-19T15:10:42-06:00,2014-02-19T15:20:16-06:00,574
2/19/14,place,Eliot House,2014-02-19T15:20:16-06:00,2014-02-19T17:50:29-06:00,9013
2/19/14,move,walking,2014-02-19T17:50:29-06:00,2014-02-19T18:00:12-06:00,583
2/19/14,place,Cafe Gato Rojo,2014-02-19T18:00:12-06:00,2014-02-19T19:26:43-06:00,5191
2/19/14,move,walking,2014-02-19T19:26:43-06:00,2014-02-19T19:36:07-06:00,564
2/19/14,place,Home,2014-02-19T19:36:08-06:00,2014-02-20T00:00:00-06:00,15832
2/20/14,place,Home,2014-02-20T00:00:00-06:00,2014-02-20T10:11:58-06:00,36718
2/20/14,move,walking,2014-02-20T10:11:58-06:00,2014-02-20T10:26:42-06:00,884
2/20/14,place,Mitchell Dong,2014-02-20T10:26:42-06:00,2014-02-20T13:17:48-06:00,10266
2/20/14,move,walking,2014-02-20T13:17:48-06:00,2014-02-20T13:32:44-06:00,896
2/20/14,place,Caspersen Student Center,2014-02-20T13:32:44-06:00,2014-02-20T13:54:55-06:00,1331
2/20/14,move,walking,2014-02-20T13:54:55-06:00,2014-02-20T13:59:04-06:00,249
2/20/14,place,Proximate,2014-02-20T13:59:04-06:00,2014-02-20T16:30:43-06:00,9099
2/20/14,move,walking,2014-02-20T16:30:43-06:00,2014-02-20T16:38:59-06:00,496
2/20/14,place,Queens Head Pub,2014-02-20T16:38:59-06:00,2014-02-20T18:11:46-06:00,5567
2/20/14,move,walking,2014-02-20T18:11:46-06:00,2014-02-20T18:18:10-06:00,384
2/20/14,place,Home,2014-02-20T18:18:10-06:00,2014-02-21T00:00:00-06:00,20510
2/21/14,place,Home,2014-02-21T00:00:00-06:00,2014-02-21T08:43:54-06:00,31434
2/21/14,move,walking,2014-02-21T08:43:54-06:00,2014-02-21T09:01:19-06:00,1045
2/21/14,place,Harvard Alumni Association,2014-02-21T09:01:19-06:00,2014-02-21T09:45:24-06:00,2645
2/21/14,move,walking,2014-02-21T09:45:24-06:00,2014-02-21T10:09:25-06:00,1441
2/21/14,place,Proximate,2014-02-21T10:09:24-06:00,2014-02-21T12:43:42-06:00,9258
2/21/14,move,walking,2014-02-21T12:43:42-06:00,2014-02-21T12:54:03-06:00,621
2/21/14,place,Border Cafe,2014-02-21T12:54:03-06:00,2014-02-21T14:20:13-06:00,5170
2/21/14,move,walking,2014-02-21T14:20:13-06:00,2014-02-21T14:32:28-06:00,735
2/21/14,place,Proximate,2014-02-21T14:32:28-06:00,2014-02-21T15:39:24-06:00,4016
2/21/14,move,walking,2014-02-21T15:39:24-06:00,2014-02-21T15:48:27-06:00,543
2/21/14,place,Home,2014-02-21T15:48:26-06:00,2014-02-21T17:10:17-06:00,4911
2/21/14,place,Home,2014-02-21T22:56:49-06:00,2014-02-22T00:00:00-06:00,3791
2/22/14,place,Home,2014-02-22T00:00:00-06:00,2014-02-22T11:23:21-06:00,41001
2/22/14,move,walking,2014-02-22T11:23:21-06:00,2014-02-22T11:35:35-06:00,734
2/22/14,place,Harvest,2014-02-22T11:35:35-06:00,2014-02-22T12:56:56-06:00,4881
2/22/14,move,walking,2014-02-22T12:56:56-06:00,2014-02-22T13:01:59-06:00,303
2/22/14,place,Experiment Fund,2014-02-22T13:01:59-06:00,2014-02-22T18:25:07-06:00,19388
2/22/14,move,walking,2014-02-22T18:25:07-06:00,2014-02-22T18:28:45-06:00,218
2/22/14,place,Orinoco,2014-02-22T18:28:44-06:00,2014-02-22T20:24:12-06:00,6928
2/22/14,move,walking,2014-02-22T20:24:12-06:00,2014-02-22T20:29:34-06:00,322
2/22/14,place,Legal Sea Foods - Charles Square,2014-02-22T20:29:33-06:00,2014-02-22T22:11:54-06:00,6141
2/22/14,move,walking,2014-02-22T22:11:54-06:00,2014-02-22T22:27:56-06:00,962
2/22/14,place,Home,2014-02-22T22:27:56-06:00,2014-02-23T00:00:00-06:00,5524
2/23/14,place,Home,2014-02-23T00:00:00-06:00,2014-02-23T11:23:23-06:00,41003
2/23/14,move,walking,2014-02-23T11:23:23-06:00,2014-02-23T11:34:07-06:00,644
2/23/14,place,Proximate,2014-02-23T11:34:07-06:00,2014-02-23T16:28:42-06:00,17675
2/23/14,move,walking,2014-02-23T16:28:42-06:00,2014-02-23T16:41:19-06:00,757
2/23/14,place,Home,2014-02-23T16:41:19-06:00,2014-02-24T00:00:00-06:00,26321
2/24/14,place,Home,2014-02-24T00:00:00-06:00,2014-02-24T07:44:57-06:00,27897
2/24/14,move,walking,2014-02-24T07:44:57-06:00,2014-02-24T08:03:15-06:00,1098
2/24/14,place,Mitchell Dong,2014-02-24T08:03:15-06:00,2014-02-24T09:27:57-06:00,5082
2/24/14,move,walking,2014-02-24T09:27:57-06:00,2014-02-24T09:36:28-06:00,511
2/24/14,place,Caspersen Student Center,2014-02-24T09:36:28-06:00,2014-02-24T09:53:56-06:00,1048
2/24/14,move,walking,2014-02-24T09:53:56-06:00,2014-02-24T09:57:33-06:00,217
2/24/14,place,Proximate,2014-02-24T09:57:33-06:00,2014-02-24T11:32:48-06:00,5715
2/24/14,move,walking,2014-02-24T11:32:48-06:00,2014-02-24T11:42:33-06:00,585
2/24/14,place,Border Cafe,2014-02-24T11:42:33-06:00,2014-02-24T12:50:59-06:00,4106
2/24/14,move,walking,2014-02-24T12:50:59-06:00,2014-02-24T13:01:36-06:00,637
2/24/14,place,Proximate,2014-02-24T13:01:35-06:00,2014-02-24T15:08:02-06:00,7587
2/24/14,move,walking,2014-02-24T15:08:02-06:00,2014-02-24T15:18:43-06:00,641
2/24/14,place,Starbucks,2014-02-24T15:18:43-06:00,2014-02-24T15:21:04-06:00,141
2/24/14,move,walking,2014-02-24T15:21:04-06:00,2014-02-24T15:25:14-06:00,250
2/24/14,place,Harvard Alumni Association,2014-02-24T15:25:14-06:00,2014-02-24T16:36:03-06:00,4249
2/24/14,move,walking,2014-02-24T16:36:03-06:00,2014-02-24T16:44:20-06:00,497
2/24/14,place,Place in Old Cambridge,2014-02-24T16:44:20-06:00,2014-02-24T16:51:07-06:00,407
2/24/14,move,walking,2014-02-24T16:51:08-06:00,2014-02-24T17:01:20-06:00,612
2/24/14,place,Broadway Marketplace,2014-02-24T17:01:19-06:00,2014-02-24T17:09:43-06:00,504
2/24/14,move,walking,2014-02-24T17:09:43-06:00,2014-02-24T17:14:27-06:00,284
2/24/14,place,Home,2014-02-24T17:14:28-06:00,2014-02-25T00:00:00-06:00,24332
2/25/14,place,Home,2014-02-25T00:00:00-06:00,2014-02-25T09:57:59-06:00,35879
2/25/14,move,walking,2014-02-25T09:57:59-06:00,2014-02-25T10:02:08-06:00,249
2/25/14,place,Place in Old Cambridge,2014-02-25T10:02:08-06:00,2014-02-25T10:04:59-06:00,171
2/25/14,move,walking,2014-02-25T10:04:59-06:00,2014-02-25T10:16:10-06:00,671
2/25/14,place,Proximate,2014-02-25T10:16:10-06:00,2014-02-25T11:47:11-06:00,5461
2/25/14,move,walking,2014-02-25T11:47:11-06:00,2014-02-25T11:51:21-06:00,250
2/25/14,place,Caspersen Student Center,2014-02-25T11:51:21-06:00,2014-02-25T12:37:01-06:00,2740
2/25/14,move,walking,2014-02-25T12:37:01-06:00,2014-02-25T12:40:13-06:00,192
2/25/14,place,Proximate,2014-02-25T12:40:13-06:00,2014-02-25T12:43:30-06:00,197
2/25/14,move,walking,2014-02-25T12:43:30-06:00,2014-02-25T12:56:28-06:00,778
2/25/14,place,Home,2014-02-25T12:56:28-06:00,2014-02-26T00:00:00-06:00,39812
2/26/14,place,Home,2014-02-26T00:00:00-06:00,2014-02-27T00:00:00-06:00,86400
2/27/14,place,Home,2014-02-27T00:00:00-06:00,2014-02-27T07:22:09-06:00,26529
2/27/14,move,walking,2014-02-27T07:22:09-06:00,2014-02-27T07:37:54-06:00,945
2/27/14,move,transport,2014-02-27T07:37:55-06:00,2014-02-27T07:57:26-06:00,1171
2/27/14,move,walking,2014-02-27T07:57:26-06:00,2014-02-27T08:00:04-06:00,158
2/27/14,place,Amtrak South Station,2014-02-27T08:00:03-06:00,2014-02-27T08:30:58-06:00,1855
2/27/14,move,transport,2014-02-27T08:30:58-06:00,2014-02-27T16:29:12-06:00,28694
2/27/14,move,walking,2014-02-27T16:29:11-06:00,2014-02-27T16:35:44-06:00,393
2/27/14,place,Union Station | Gate K,2014-02-27T16:35:44-06:00,2014-02-27T16:48:10-06:00,746
2/27/14,move,transport,2014-02-27T16:48:10-06:00,2014-02-27T16:58:10-06:00,600
2/27/14,move,walking,2014-02-27T16:58:10-06:00,2014-02-27T17:03:51-06:00,341
2/27/14,place,NTN24,2014-02-27T17:03:50-06:00,2014-02-27T22:57:58-06:00,21248
2/27/14,move,transport,2014-02-27T22:57:58-06:00,2014-02-27T23:14:02-06:00,964
2/27/14,place,2440 39th St NW,2014-02-27T23:14:02-06:00,2014-02-28T00:00:00-06:00,2758
2/28/14,place,2440 39th St NW,2014-02-28T00:00:00-06:00,2014-02-28T16:24:10-06:00,59050
2/28/14,move,walking,2014-02-28T16:24:10-06:00,2014-02-28T16:32:11-06:00,481
2/28/14,place,Surfside,2014-02-28T16:32:11-06:00,2014-02-28T16:36:20-06:00,249
2/28/14,move,walking,2014-02-28T16:36:20-06:00,2014-02-28T16:38:30-06:00,130
2/28/14,move,transport,2014-02-28T16:38:29-06:00,2014-02-28T16:58:18-06:00,1189
2/28/14,move,walking,2014-02-28T17:19:36-06:00,2014-02-28T17:23:05-06:00,209
2/28/14,place,NTN24,2014-02-28T17:23:05-06:00,2014-02-28T22:17:15-06:00,17650
2/28/14,move,transport,2014-02-28T22:17:15-06:00,2014-02-28T22:42:10-06:00,1495
2/28/14,place,2440 39th St NW,2014-02-28T22:42:10-06:00,2014-03-01T00:00:00-06:00,4670
3/1/14,place,2440 39th St NW,2014-03-01T00:00:00-06:00,2014-03-01T08:48:55-06:00,31735
3/1/14,move,walking,2014-03-01T08:48:55-06:00,2014-03-01T08:56:43-06:00,468
3/1/14,place,Whole Foods Market,2014-03-01T08:56:43-06:00,2014-03-01T09:43:26-06:00,2803
3/1/14,move,transport,2014-03-01T09:43:26-06:00,2014-03-01T10:05:15-06:00,1309
3/1/14,move,walking,2014-03-01T10:05:14-06:00,2014-03-01T10:11:50-06:00,396
3/1/14,place,Cosi,2014-03-01T10:11:51-06:00,2014-03-01T21:09:22-06:00,39451
3/1/14,move,transport,2014-03-01T21:09:22-06:00,2014-03-01T21:25:26-06:00,964
3/1/14,place,Place in Glover Park,2014-03-01T21:25:26-06:00,2014-03-02T00:00:00-06:00,9274
3/2/14,place,Place in Glover Park,2014-03-02T00:00:00-06:00,2014-03-02T15:09:08-06:00,54548
3/2/14,move,transport,2014-03-02T15:09:08-06:00,2014-03-02T15:25:48-06:00,1000
3/2/14,place,Safeway,2014-03-02T15:25:48-06:00,2014-03-02T15:49:15-06:00,1407
3/2/14,move,transport,2014-03-02T15:49:15-06:00,2014-03-02T15:55:24-06:00,369
3/2/14,move,walking,2014-03-02T15:55:25-06:00,2014-03-02T16:01:19-06:00,354
3/4/14,move,bus,2014-03-04T08:19:58-06:00,2014-03-04T08:24:42-06:00,284
3/4/14,move,walking,2014-03-04T08:24:42-06:00,2014-03-04T08:28:42-06:00,240
3/4/14,move,underground,2014-03-04T08:28:42-06:00,2014-03-04T08:46:13-06:00,1051
3/4/14,move,walking,2014-03-04T08:46:13-06:00,2014-03-04T08:50:36-06:00,263
3/4/14,place,Union Station | Gate K,2014-03-04T08:50:37-06:00,2014-03-04T09:15:30-06:00,1493
3/4/14,move,train,2014-03-04T09:33:51-06:00,2014-03-04T14:49:42-06:00,18951
3/4/14,move,train,2014-03-04T15:29:14-06:00,2014-03-04T17:35:29-06:00,7575
3/4/14,move,walking,2014-03-04T17:35:29-06:00,2014-03-04T17:39:59-06:00,270
3/4/14,move,underground,2014-03-04T17:39:59-06:00,2014-03-04T17:58:00-06:00,1081
3/4/14,move,walking,2014-03-04T17:58:00-06:00,2014-03-04T18:07:32-06:00,572
3/4/14,place,Home,2014-03-04T18:07:32-06:00,2014-03-05T00:00:00-06:00,21148
3/5/14,place,Home,2014-03-05T00:00:00-06:00,2014-03-05T08:19:35-06:00,29975
3/5/14,place,Place in Old Cambridge,2014-03-05T08:19:36-06:00,2014-03-05T08:28:14-06:00,518
3/5/14,move,walking,2014-03-05T08:28:14-06:00,2014-03-05T08:42:46-06:00,872
3/5/14,place,Proximate,2014-03-05T08:42:46-06:00,2014-03-05T11:56:49-06:00,11643
3/5/14,move,walking,2014-03-05T11:56:49-06:00,2014-03-05T12:07:49-06:00,660
3/5/14,place,Border Cafe,2014-03-05T12:07:48-06:00,2014-03-05T13:07:31-06:00,3583
3/5/14,move,walking,2014-03-05T13:07:31-06:00,2014-03-05T13:22:40-06:00,909
3/5/14,place,Dillon House,2014-03-05T13:22:40-06:00,2014-03-05T14:39:37-06:00,4617
3/5/14,move,walking,2014-03-05T14:39:37-06:00,2014-03-05T14:48:28-06:00,531
3/5/14,place,Eliot House,2014-03-05T14:48:29-06:00,2014-03-05T17:39:12-06:00,10243
3/5/14,move,walking,2014-03-05T17:39:12-06:00,2014-03-05T17:56:39-06:00,1047
3/5/14,place,Broadway Marketplace,2014-03-05T17:56:39-06:00,2014-03-05T18:03:28-06:00,409
3/5/14,move,walking,2014-03-05T18:03:28-06:00,2014-03-05T18:06:32-06:00,184
3/5/14,place,Home,2014-03-05T18:06:32-06:00,2014-03-06T00:00:00-06:00,21208
3/6/14,place,Home,2014-03-06T00:00:00-06:00,2014-03-06T08:05:51-06:00,29151
3/6/14,move,walking,2014-03-06T08:05:51-06:00,2014-03-06T08:13:52-06:00,481
3/6/14,place,Proximate,2014-03-06T08:13:51-06:00,2014-03-06T10:15:56-06:00,7325
3/6/14,move,walking,2014-03-06T10:15:56-06:00,2014-03-06T10:22:30-06:00,394
3/6/14,place,Wasserstein Hall,2014-03-06T10:22:30-06:00,2014-03-06T12:03:58-06:00,6088
3/6/14,move,walking,2014-03-06T12:03:58-06:00,2014-03-06T12:06:35-06:00,157
3/6/14,place,Proximate,2014-03-06T12:06:34-06:00,2014-03-06T17:18:20-06:00,18706
3/6/14,move,walking,2014-03-06T17:18:20-06:00,2014-03-06T17:30:38-06:00,738
3/6/14,place,Home,2014-03-06T17:30:39-06:00,2014-03-07T00:00:00-06:00,23361
3/7/14,place,Home,2014-03-07T00:00:00-06:00,2014-03-07T09:01:44-06:00,32504
3/7/14,move,walking,2014-03-07T09:01:44-06:00,2014-03-07T09:15:04-06:00,800
3/7/14,place,Proximate,2014-03-07T09:15:04-06:00,2014-03-07T12:29:51-06:00,11687
3/7/14,move,walking,2014-03-07T12:29:51-06:00,2014-03-07T12:40:30-06:00,639
3/7/14,move,underground,2014-03-07T12:40:30-06:00,2014-03-07T12:48:00-06:00,450
3/7/14,move,walking,2014-03-07T12:48:01-06:00,2014-03-07T12:51:38-06:00,217
3/7/14,place,One Broadway,2014-03-07T12:51:38-06:00,2014-03-07T13:03:01-06:00,683
3/7/14,move,walking,2014-03-07T13:03:01-06:00,2014-03-07T13:09:32-06:00,391
3/7/14,place,101 Main St  (CIC),2014-03-07T13:09:32-06:00,2014-03-07T14:02:14-06:00,3162
3/7/14,move,walking,2014-03-07T14:02:14-06:00,2014-03-07T14:13:21-06:00,667
3/7/14,place,Boston Marriott Cambridge,2014-03-07T14:13:21-06:00,2014-03-07T15:02:35-06:00,2954
3/7/14,move,walking,2014-03-07T15:02:35-06:00,2014-03-07T15:07:00-06:00,265
3/7/14,move,underground,2014-03-07T15:07:00-06:00,2014-03-07T15:13:30-06:00,390
3/7/14,move,walking,2014-03-07T15:13:30-06:00,2014-03-07T15:29:33-06:00,963
3/7/14,place,Proximate,2014-03-07T15:29:33-06:00,2014-03-07T19:11:49-06:00,13336
3/7/14,move,walking,2014-03-07T19:11:49-06:00,2014-03-07T19:23:15-06:00,686
3/7/14,place,Home,2014-03-07T19:23:15-06:00,2014-03-08T00:00:00-06:00,16605
3/8/14,place,Home,2014-03-08T00:00:00-06:00,2014-03-08T09:50:31-06:00,35431
3/8/14,move,walking,2014-03-08T09:50:31-06:00,2014-03-08T10:04:16-06:00,825
3/8/14,place,Russell House Tavern,2014-03-08T10:04:15-06:00,2014-03-08T11:07:40-06:00,3805
3/8/14,move,walking,2014-03-08T11:07:40-06:00,2014-03-08T11:11:41-06:00,241
3/8/14,place,Starbucks,2014-03-08T11:11:41-06:00,2014-03-08T11:14:34-06:00,173
3/8/14,move,walking,2014-03-08T11:14:34-06:00,2014-03-08T11:28:17-06:00,823
3/8/14,place,Proximate,2014-03-08T11:28:17-06:00,2014-03-08T15:03:56-06:00,12939
3/8/14,move,walking,2014-03-08T15:03:56-06:00,2014-03-08T15:11:00-06:00,424
3/8/14,place,MBTA Bus 1,2014-03-08T15:11:00-06:00,2014-03-08T15:21:39-06:00,639
3/8/14,move,walking,2014-03-08T15:21:39-06:00,2014-03-08T15:25:08-06:00,209
3/8/14,place,Experiment Fund,2014-03-08T15:25:09-06:00,2014-03-08T19:56:27-06:00,16278
3/8/14,move,walking,2014-03-08T19:56:27-06:00,2014-03-08T20:10:36-06:00,849
3/8/14,place,Home,2014-03-08T20:10:36-06:00,2014-03-09T00:00:00-06:00,13764
3/9/14,place,Home,2014-03-09T00:00:00-06:00,2014-03-09T11:12:07-05:00,36727
3/9/14,move,walking,2014-03-09T11:12:07-05:00,2014-03-09T11:23:01-05:00,654
3/9/14,place,Tory Row,2014-03-09T11:23:01-05:00,2014-03-09T13:11:18-05:00,6497
3/9/14,move,walking,2014-03-09T13:11:18-05:00,2014-03-09T13:31:22-05:00,1204
3/9/14,place,Home,2014-03-09T13:31:22-05:00,2014-03-10T00:00:00-05:00,37718
3/10/14,place,Home,2014-03-10T00:00:00-05:00,2014-03-10T11:59:54-05:00,43194
3/10/14,move,walking,2014-03-10T11:59:54-05:00,2014-03-10T12:12:19-05:00,745
3/10/14,place,Border Cafe,2014-03-10T12:12:18-05:00,2014-03-10T13:09:35-05:00,3437
3/10/14,move,walking,2014-03-10T13:09:35-05:00,2014-03-10T13:18:39-05:00,544
3/10/14,place,Proximate,2014-03-10T13:18:39-05:00,2014-03-10T18:50:54-05:00,19935
3/10/14,move,walking,2014-03-10T18:50:54-05:00,2014-03-10T18:59:59-05:00,545
3/10/14,place,Home,2014-03-10T18:59:59-05:00,2014-03-11T00:00:00-05:00,18001
3/11/14,place,Home,2014-03-11T00:00:00-05:00,2014-03-11T07:41:26-05:00,27686
3/11/14,move,walking,2014-03-11T07:41:26-05:00,2014-03-11T07:44:01-05:00,155
3/11/14,place,Broadway Marketplace,2014-03-11T07:44:01-05:00,2014-03-11T07:46:25-05:00,144
3/11/14,move,walking,2014-03-11T07:46:25-05:00,2014-03-11T07:54:38-05:00,493
3/11/14,place,Experiment Fund,2014-03-11T07:54:38-05:00,2014-03-11T10:10:08-05:00,8130
3/11/14,move,walking,2014-03-11T10:10:08-05:00,2014-03-11T10:20:45-05:00,637
3/11/14,place,Proximate,2014-03-11T10:20:45-05:00,2014-03-11T16:37:05-05:00,22580
3/11/14,move,walking,2014-03-11T16:37:05-05:00,2014-03-11T16:49:05-05:00,720
3/11/14,place,Park,2014-03-11T16:49:05-05:00,2014-03-11T17:59:54-05:00,4249
3/11/14,move,walking,2014-03-11T17:59:54-05:00,2014-03-11T18:17:31-05:00,1057
3/11/14,place,Home,2014-03-11T18:17:30-05:00,2014-03-12T00:00:00-05:00,20550
3/12/14,place,Home,2014-03-12T00:00:00-05:00,2014-03-12T13:07:50-05:00,47270
3/12/14,move,walking,2014-03-12T13:07:50-05:00,2014-03-12T13:21:38-05:00,828
3/12/14,place,Proximate,2014-03-12T13:21:39-05:00,2014-03-12T16:57:10-05:00,12931
3/12/14,move,walking,2014-03-12T16:57:10-05:00,2014-03-12T17:04:13-05:00,423
3/12/14,move,transport,2014-03-12T17:04:12-05:00,2014-03-12T17:19:43-05:00,931
3/12/14,move,walking,2014-03-12T17:19:43-05:00,2014-03-12T17:34:14-05:00,871
3/12/14,place,Place in Dock Square,2014-03-12T17:34:14-05:00,2014-03-12T17:42:14-05:00,480
3/12/14,move,walking,2014-03-12T17:42:14-05:00,2014-03-12T17:53:18-05:00,664
3/12/14,place,Hard Rock Cafe Boston,2014-03-12T17:53:18-05:00,2014-03-12T21:10:23-05:00,11825
3/12/14,move,walking,2014-03-12T21:10:23-05:00,2014-03-12T21:14:47-05:00,264
3/12/14,move,transport,2014-03-12T21:14:48-05:00,2014-03-12T21:35:36-05:00,1248
3/12/14,place,Home,2014-03-12T21:35:36-05:00,2014-03-13T00:00:00-05:00,8664
3/13/14,place,Home,2014-03-13T00:00:00-05:00,2014-03-13T12:25:21-05:00,44721
3/13/14,move,walking,2014-03-13T12:25:21-05:00,2014-03-13T12:38:31-05:00,790
3/13/14,place,Grendel's Den Restaurant & Bar,2014-03-13T12:38:30-05:00,2014-03-13T13:11:39-05:00,1989
3/13/14,move,walking,2014-03-13T13:11:39-05:00,2014-03-13T13:19:44-05:00,485
3/13/14,place,Proximate,2014-03-13T13:19:44-05:00,2014-03-13T16:31:58-05:00,11534
3/13/14,move,walking,2014-03-13T16:31:58-05:00,2014-03-13T16:44:17-05:00,739
3/13/14,place,Broadway Marketplace,2014-03-13T16:44:17-05:00,2014-03-13T16:54:35-05:00,618
3/13/14,move,walking,2014-03-13T16:54:35-05:00,2014-03-13T16:59:44-05:00,309
3/13/14,place,Home,2014-03-13T16:59:44-05:00,2014-03-13T22:25:02-05:00,19518
3/13/14,place,Home,2014-03-13T23:38:26-05:00,2014-03-14T00:00:00-05:00,1294
3/14/14,place,Home,2014-03-14T00:00:00-05:00,2014-03-14T10:58:19-05:00,39499
3/14/14,move,walking,2014-03-14T10:58:19-05:00,2014-03-14T11:08:23-05:00,604
3/14/14,place,Proximate,2014-03-14T11:08:23-05:00,2014-03-14T12:20:16-05:00,4313
3/14/14,move,walking,2014-03-14T12:20:16-05:00,2014-03-14T12:32:00-05:00,704
3/14/14,place,Grendel's Den Restaurant & Bar,2014-03-14T12:32:00-05:00,2014-03-14T13:06:46-05:00,2086
3/14/14,move,walking,2014-03-14T13:06:46-05:00,2014-03-14T13:10:48-05:00,242
3/14/14,move,underground,2014-03-14T13:10:47-05:00,2014-03-14T13:53:09-05:00,2542
3/14/14,move,walking,2014-03-14T13:53:09-05:00,2014-03-14T13:57:12-05:00,243
3/14/14,place,Boston Logan International Airport (BOS),2014-03-14T13:57:12-05:00,2014-03-14T15:13:19-05:00,4567
3/14/14,move,airplane,2014-03-14T15:13:19-05:00,2014-03-14T16:26:25-05:00,4386
3/14/14,place,Ronald Reagan Washington National Airport (DCA),2014-03-14T16:26:25-05:00,2014-03-14T16:37:33-05:00,668
3/14/14,move,transport,2014-03-14T16:37:33-05:00,2014-03-14T16:40:01-05:00,148
3/14/14,place,Place in Ronald Reagan Washington National Airport,2014-03-14T16:40:01-05:00,2014-03-14T16:48:46-05:00,525
3/14/14,move,walking,2014-03-14T16:48:46-05:00,2014-03-14T16:59:49-05:00,663
3/14/14,place,Place in Ronald Reagan Washington National Airport,2014-03-14T16:59:49-05:00,2014-03-14T17:08:22-05:00,513
3/14/14,move,underground,2014-03-14T17:08:22-05:00,2014-03-14T17:22:50-05:00,868
3/14/14,move,walking,2014-03-14T17:22:50-05:00,2014-03-14T17:30:51-05:00,481
3/14/14,place,NTN24,2014-03-14T17:30:51-05:00,2014-03-14T18:03:21-05:00,1950
3/14/14,move,walking,2014-03-14T18:03:21-05:00,2014-03-14T18:32:08-05:00,1727
3/14/14,place,Sushi Go Round,2014-03-14T18:32:09-05:00,2014-03-14T19:49:10-05:00,4621
3/14/14,move,walking,2014-03-14T19:49:10-05:00,2014-03-14T19:56:31-05:00,441
3/14/14,place,Walgreens,2014-03-14T19:56:31-05:00,2014-03-14T20:14:37-05:00,1086
3/14/14,move,car,2014-03-14T20:14:37-05:00,2014-03-14T20:34:21-05:00,1184
3/14/14,place,Laura's Home,2014-03-14T20:34:21-05:00,2014-03-15T00:00:00-05:00,12339
3/15/14,place,Laura's Home,2014-03-15T00:00:00-05:00,2014-03-15T14:36:52-05:00,52612
3/15/14,move,walking,2014-03-15T14:36:52-05:00,2014-03-15T15:10:38-05:00,2026
3/15/14,place,Apple Store,2014-03-15T15:10:37-05:00,2014-03-15T15:17:33-05:00,416
3/15/14,move,walking,2014-03-15T15:17:33-05:00,2014-03-15T15:24:58-05:00,445
3/15/14,place,TJ Maxx & HomeGoods,2014-03-15T15:24:58-05:00,2014-03-15T16:34:23-05:00,4165
3/15/14,move,walking,2014-03-15T16:34:23-05:00,2014-03-15T16:39:12-05:00,289
3/15/14,place,Old Glory,2014-03-15T16:39:12-05:00,2014-03-15T16:49:17-05:00,605
3/15/14,move,transport,2014-03-15T16:49:17-05:00,2014-03-15T17:01:17-05:00,720
3/15/14,move,walking,2014-03-15T17:01:16-05:00,2014-03-15T17:03:18-05:00,122
3/15/14,place,Safeway,2014-03-15T17:03:18-05:00,2014-03-15T17:27:31-05:00,1453
3/15/14,move,walking,2014-03-15T17:27:31-05:00,2014-03-15T17:45:46-05:00,1095
3/15/14,place,Laura's Home,2014-03-15T17:45:46-05:00,2014-03-16T00:00:00-05:00,22454
3/16/14,place,Laura's Home,2014-03-16T00:00:00-05:00,2014-03-16T13:44:44-05:00,49484
3/16/14,move,walking,2014-03-16T13:44:44-05:00,2014-03-16T13:54:18-05:00,574
3/16/14,place,Whole Foods Market,2014-03-16T13:54:17-05:00,2014-03-16T15:10:57-05:00,4600
3/16/14,move,walking,2014-03-16T15:10:57-05:00,2014-03-16T15:22:18-05:00,681
3/16/14,place,Laura's Home,2014-03-16T15:22:18-05:00,2014-03-17T00:00:00-05:00,31062
3/17/14,place,Laura's Home,2014-03-17T00:00:00-05:00,2014-03-17T16:47:24-05:00,60444
3/17/14,move,car,2014-03-17T16:47:24-05:00,2014-03-17T16:56:30-05:00,546
3/17/14,place,Thunder Burger & Bar,2014-03-17T16:56:31-05:00,2014-03-17T18:23:28-05:00,5217
3/17/14,move,bus,2014-03-17T18:23:28-05:00,2014-03-17T18:33:44-05:00,616
3/17/14,move,walking,2014-03-17T18:33:45-05:00,2014-03-17T18:40:56-05:00,431
3/17/14,place,Laura's Home,2014-03-17T18:40:56-05:00,2014-03-18T00:00:00-05:00,19144
3/18/14,place,Laura's Home,2014-03-18T00:00:00-05:00,2014-03-18T08:26:01-05:00,30361
3/18/14,move,walking,2014-03-18T08:26:01-05:00,2014-03-18T08:31:36-05:00,335
3/18/14,move,bus,2014-03-18T08:31:36-05:00,2014-03-18T08:49:07-05:00,1051
3/18/14,move,walking,2014-03-18T08:49:07-05:00,2014-03-18T08:51:07-05:00,120
3/18/14,move,underground,2014-03-18T08:51:07-05:00,2014-03-18T09:08:45-05:00,1058
3/18/14,move,walking,2014-03-18T09:08:45-05:00,2014-03-18T09:13:17-05:00,272
3/18/14,place,Place in Ronald Reagan Washington National Airport,2014-03-18T09:13:16-05:00,2014-03-18T09:18:37-05:00,321
3/18/14,move,walking,2014-03-18T09:18:37-05:00,2014-03-18T09:26:48-05:00,491
3/18/14,place,Ronald Reagan Washington National Airport (DCA),2014-03-18T09:26:48-05:00,2014-03-18T10:44:35-05:00,4667
3/18/14,move,walking,2014-03-18T10:44:35-05:00,2014-03-18T10:47:18-05:00,163
3/18/14,place,Ronald Reagan Washington National Airport (DCA),2014-03-18T10:47:18-05:00,2014-03-18T11:18:25-05:00,1867
3/18/14,move,airplane,2014-03-18T11:18:25-05:00,2014-03-18T12:36:38-05:00,4693
3/18/14,move,walking,2014-03-18T12:36:38-05:00,2014-03-18T12:43:17-05:00,399
3/18/14,place,Boston Logan International Airport (BOS),2014-03-18T12:43:16-05:00,2014-03-18T12:53:54-05:00,638
3/18/14,move,underground,2014-03-18T12:53:54-05:00,2014-03-18T13:28:10-05:00,2056
3/18/14,move,walking,2014-03-18T13:28:09-05:00,2014-03-18T13:40:20-05:00,731
3/18/14,place,Proximate,2014-03-18T13:40:20-05:00,2014-03-18T13:40:56-05:00,36
3/18/14,place,Proximate,2014-03-18T15:20:58-05:00,2014-03-18T18:45:18-05:00,12260
3/18/14,move,walking,2014-03-18T20:01:35-05:00,2014-03-18T20:08:51-05:00,436
3/18/14,place,Home,2014-03-18T20:08:51-05:00,2014-03-19T00:00:00-05:00,13869
3/19/14,place,Home,2014-03-19T00:00:00-05:00,2014-03-19T09:14:31-05:00,33271
3/19/14,move,walking,2014-03-19T09:14:31-05:00,2014-03-19T09:23:06-05:00,515
3/19/14,place,Proximate,2014-03-19T09:23:06-05:00,2014-03-19T12:46:03-05:00,12177
3/19/14,move,walking,2014-03-19T12:46:03-05:00,2014-03-19T12:58:21-05:00,738
3/19/14,place,Border Cafe,2014-03-19T12:58:20-05:00,2014-03-19T13:38:31-05:00,2411
3/19/14,move,walking,2014-03-19T13:38:31-05:00,2014-03-19T13:47:35-05:00,544
3/19/14,place,Proximate,2014-03-19T13:47:36-05:00,2014-03-19T17:32:10-05:00,13474
3/19/14,move,walking,2014-03-19T17:32:10-05:00,2014-03-19T17:42:18-05:00,608
3/20/14,place,Home,2014-03-20T03:45:00-05:00,2014-03-20T08:09:17-05:00,15857
3/20/14,move,walking,2014-03-20T08:09:17-05:00,2014-03-20T08:21:26-05:00,729
3/20/14,place,Proximate,2014-03-20T08:21:25-05:00,2014-03-20T12:49:32-05:00,16087
3/20/14,move,walking,2014-03-20T12:49:32-05:00,2014-03-20T13:03:25-05:00,833
3/20/14,place,Grendel's Den Restaurant & Bar,2014-03-20T13:03:24-05:00,2014-03-20T14:36:26-05:00,5582
3/20/14,move,walking,2014-03-20T14:36:26-05:00,2014-03-20T14:48:35-05:00,729
3/20/14,place,Proximate,2014-03-20T14:48:35-05:00,2014-03-20T19:41:09-05:00,17554
3/20/14,move,walking,2014-03-20T19:41:09-05:00,2014-03-20T19:55:54-05:00,885
3/20/14,place,Home,2014-03-20T19:55:54-05:00,2014-03-20T21:04:36-05:00,4122
3/20/14,place,Home,2014-03-20T21:04:36-05:00,2014-03-21T00:00:00-05:00,10524
3/21/14,place,Home,2014-03-21T00:00:00-05:00,2014-03-21T08:38:55-05:00,31135
3/21/14,move,walking,2014-03-21T08:38:55-05:00,2014-03-21T08:41:26-05:00,151
3/21/14,place,Darwin's Ltd.,2014-03-21T08:41:25-05:00,2014-03-21T08:57:51-05:00,986
3/21/14,move,transport,2014-03-21T08:57:51-05:00,2014-03-21T09:31:22-05:00,2011
3/21/14,place,The Pulse Network,2014-03-21T09:31:22-05:00,2014-03-21T10:52:09-05:00,4847
3/21/14,move,transport,2014-03-21T10:52:09-05:00,2014-03-21T11:23:18-05:00,1869
3/21/14,move,walking,2014-03-21T11:23:18-05:00,2014-03-21T11:26:53-05:00,215
3/21/14,place,IDG Enterprise,2014-03-21T11:26:53-05:00,2014-03-21T13:05:07-05:00,5894
3/21/14,move,transport,2014-03-21T13:05:07-05:00,2014-03-21T13:30:42-05:00,1535
3/21/14,place,Costco Wholesale,2014-03-21T13:30:41-05:00,2014-03-21T14:21:00-05:00,3019
3/21/14,move,transport,2014-03-21T14:21:00-05:00,2014-03-21T15:08:43-05:00,2863
3/21/14,place,Home,2014-03-21T15:08:43-05:00,2014-03-21T15:20:38-05:00,715
3/21/14,move,walking,2014-03-21T15:20:38-05:00,2014-03-21T15:28:03-05:00,445
3/21/14,place,Home,2014-03-21T15:28:03-05:00,2014-03-22T00:00:00-05:00,30717
3/22/14,place,Home,2014-03-22T00:00:00-05:00,2014-03-22T12:55:49-05:00,46549
3/22/14,move,walking,2014-03-22T12:55:49-05:00,2014-03-22T13:07:12-05:00,683
3/22/14,place,CVS/pharmacy,2014-03-22T13:07:12-05:00,2014-03-22T13:30:14-05:00,1382
3/22/14,move,walking,2014-03-22T13:30:14-05:00,2014-03-22T13:42:04-05:00,710
3/22/14,place,Home,2014-03-22T13:42:03-05:00,2014-03-23T00:00:00-05:00,37077
3/23/14,place,Home,2014-03-23T00:00:00-05:00,2014-03-23T13:01:16-05:00,46876
3/23/14,move,walking,2014-03-23T13:01:16-05:00,2014-03-23T13:11:48-05:00,632
3/23/14,place,Proximate,2014-03-23T13:11:48-05:00,2014-03-23T17:23:52-05:00,15124
3/23/14,move,walking,2014-03-23T17:23:52-05:00,2014-03-23T17:35:03-05:00,671
3/23/14,place,Home,2014-03-23T17:35:03-05:00,2014-03-24T00:00:00-05:00,23097
3/24/14,place,Home,2014-03-24T00:00:00-05:00,2014-03-24T08:39:35-05:00,31175
3/24/14,move,walking,2014-03-24T08:39:35-05:00,2014-03-24T08:47:04-05:00,449
3/24/14,place,Proximate,2014-03-24T08:47:04-05:00,2014-03-24T11:52:47-05:00,11143
3/24/14,move,walking,2014-03-24T11:52:47-05:00,2014-03-24T12:01:33-05:00,526
3/24/14,place,Border Cafe,2014-03-24T12:01:33-05:00,2014-03-24T13:22:39-05:00,4866
3/24/14,move,walking,2014-03-24T13:22:39-05:00,2014-03-24T13:34:15-05:00,696
3/24/14,place,Proximate,2014-03-24T13:34:15-05:00,2014-03-24T19:23:49-05:00,20974
3/24/14,move,walking,2014-03-24T19:23:49-05:00,2014-03-24T19:33:40-05:00,591
3/24/14,place,Home,2014-03-24T19:33:40-05:00,2014-03-25T00:00:00-05:00,15980
3/25/14,place,Home,2014-03-25T00:00:00-05:00,2014-03-25T09:12:57-05:00,33177
3/25/14,move,walking,2014-03-25T09:12:57-05:00,2014-03-25T09:17:04-05:00,247
3/25/14,place,Darwin's Ltd.,2014-03-25T09:17:03-05:00,2014-03-25T10:22:21-05:00,3918
3/25/14,move,transport,2014-03-25T10:22:22-05:00,2014-03-25T10:47:57-05:00,1535
3/25/14,place,IDG Enterprise,2014-03-25T10:47:56-05:00,2014-03-25T12:47:00-05:00,7144
3/25/14,move,walking,2014-03-25T12:47:00-05:00,2014-03-25T12:49:04-05:00,124
3/25/14,move,transport,2014-03-25T12:49:04-05:00,2014-03-25T12:53:12-05:00,248
3/25/14,place,Margarita's Mexican Restaurant,2014-03-25T12:53:11-05:00,2014-03-25T13:45:03-05:00,3112
3/25/14,move,walking,2014-03-25T13:45:03-05:00,2014-03-25T13:48:31-05:00,208
3/25/14,move,transport,2014-03-25T13:48:31-05:00,2014-03-25T14:14:33-05:00,1562
3/25/14,move,walking,2014-03-25T14:14:32-05:00,2014-03-25T14:29:04-05:00,872
3/25/14,place,Place in Old Cambridge,2014-03-25T14:29:04-05:00,2014-03-25T14:37:59-05:00,535
3/25/14,place,Proximate,2014-03-25T14:37:59-05:00,2014-03-25T19:25:26-05:00,17247
3/25/14,move,walking,2014-03-25T19:25:26-05:00,2014-03-25T19:38:18-05:00,772
3/25/14,place,Home,2014-03-25T19:38:18-05:00,2014-03-26T00:00:00-05:00,15702
3/26/14,place,Home,2014-03-26T00:00:00-05:00,2014-03-26T07:47:45-05:00,28065
3/26/14,move,walking,2014-03-26T07:47:45-05:00,2014-03-26T07:56:33-05:00,528
3/26/14,move,transport,2014-03-26T07:56:33-05:00,2014-03-26T08:12:04-05:00,931
3/26/14,move,walking,2014-03-26T08:12:03-05:00,2014-03-26T08:14:35-05:00,152
3/26/14,place,Amtrak South Station,2014-03-26T08:14:35-05:00,2014-03-26T08:28:09-05:00,814
3/26/14,move,transport,2014-03-26T08:28:09-05:00,2014-03-26T11:01:40-05:00,9211
3/26/14,place,Place in Connecticut,2014-03-26T11:01:40-05:00,2014-03-26T11:07:19-05:00,339
3/26/14,move,transport,2014-03-26T11:07:19-05:00,2014-03-26T12:43:51-05:00,5792
3/26/14,move,walking,2014-03-26T12:43:51-05:00,2014-03-26T12:48:51-05:00,300
3/26/14,move,transport,2014-03-26T12:48:51-05:00,2014-03-26T13:00:52-05:00,721
3/26/14,move,walking,2014-03-26T13:00:51-05:00,2014-03-26T13:17:26-05:00,995
3/26/14,place,Place in East Village,2014-03-26T13:17:26-05:00,2014-03-26T13:20:15-05:00,169
3/26/14,move,walking,2014-03-26T13:20:15-05:00,2014-03-26T13:25:24-05:00,309
3/26/14,place,Work-Bench,2014-03-26T13:25:24-05:00,2014-03-26T17:42:43-05:00,15439
3/26/14,move,walking,2014-03-26T17:42:43-05:00,2014-03-26T18:01:25-05:00,1122
3/26/14,place,Google - 9th Ave,2014-03-26T18:01:24-05:00,2014-03-26T20:45:32-05:00,9848
3/26/14,move,walking,2014-03-26T20:45:32-05:00,2014-03-26T20:50:25-05:00,293
3/26/14,move,transport,2014-03-26T20:50:25-05:00,2014-03-26T21:01:26-05:00,661
3/26/14,move,walking,2014-03-26T21:01:26-05:00,2014-03-26T21:04:27-05:00,181
3/26/14,place,Jess Lin's Home,2014-03-26T21:04:26-05:00,2014-03-26T23:19:50-05:00,8124
3/26/14,move,walking,2014-03-26T23:19:50-05:00,2014-03-26T23:22:21-05:00,151
3/26/14,move,transport,2014-03-26T23:22:21-05:00,2014-03-26T23:55:23-05:00,1982
3/26/14,move,walking,2014-03-26T23:55:23-05:00,2014-03-26T23:58:27-05:00,184
3/26/14,place,John F. Kennedy International Airport (JFK),2014-03-26T23:58:27-05:00,2014-03-27T00:00:00-05:00,93
3/27/14,place,John F. Kennedy International Airport (JFK),2014-03-27T00:00:00-05:00,2014-03-27T05:28:12-05:00,19692
3/27/14,move,walking,2014-03-27T05:28:12-05:00,2014-03-27T05:33:48-05:00,336
3/27/14,place,John F. Kennedy International Airport (JFK),2014-03-27T05:33:49-05:00,2014-03-27T06:17:10-05:00,2601
3/27/14,move,transport,2014-03-27T06:17:10-05:00,2014-03-27T08:54:27-05:00,9437
3/27/14,place,Chicago O'Hare International Airport (ORD),2014-03-27T08:54:27-05:00,2014-03-27T08:59:26-05:00,299
3/27/14,move,walking,2014-03-27T08:59:26-05:00,2014-03-27T09:07:26-05:00,480
3/27/14,move,transport,2014-03-27T09:07:25-05:00,2014-03-27T09:59:38-05:00,3133
3/27/14,place,Fitzsimmons Home,2014-03-27T09:59:39-05:00,2014-03-27T12:20:12-05:00,8433
3/27/14,move,transport,2014-03-27T12:20:12-05:00,2014-03-27T12:25:04-05:00,292
3/27/14,place,Egg Harbor Cafe,2014-03-27T12:25:04-05:00,2014-03-27T13:05:02-05:00,2398
3/27/14,move,walking,2014-03-27T13:05:02-05:00,2014-03-27T13:08:19-05:00,197
3/27/14,move,transport,2014-03-27T13:08:20-05:00,2014-03-27T13:13:59-05:00,339
3/27/14,place,Fitzsimmons Home,2014-03-27T13:13:59-05:00,2014-03-28T00:00:00-05:00,38761
3/28/14,place,Fitzsimmons Home,2014-03-28T00:00:00-05:00,2014-03-28T14:13:16-05:00,51196
3/28/14,move,transport,2014-03-28T14:13:16-05:00,2014-03-28T14:24:21-05:00,665
3/28/14,place,Place in St. Charles,2014-03-28T14:24:21-05:00,2014-03-28T14:54:01-05:00,1780
3/28/14,move,transport,2014-03-28T14:54:01-05:00,2014-03-28T15:10:00-05:00,959
3/28/14,place,Fitzsimmons Home,2014-03-28T15:10:00-05:00,2014-03-29T00:00:00-05:00,31800
3/29/14,place,Fitzsimmons Home,2014-03-29T00:00:00-05:00,2014-03-29T15:45:26-05:00,56726
3/29/14,move,transport,2014-03-29T15:45:26-05:00,2014-03-29T16:04:53-05:00,1167
3/29/14,place,Place in Geneva,2014-03-29T16:04:52-05:00,2014-03-29T16:15:41-05:00,649
3/29/14,move,transport,2014-03-29T16:15:41-05:00,2014-03-29T16:24:29-05:00,528
3/29/14,place,Fitzsimmons Home,2014-03-29T16:24:30-05:00,2014-03-29T18:47:10-05:00,8560
3/29/14,move,transport,2014-03-29T18:47:10-05:00,2014-03-29T19:01:40-05:00,870
3/29/14,place,Place in Kane County,2014-03-29T19:01:39-05:00,2014-03-29T21:23:30-05:00,8511
3/29/14,move,transport,2014-03-29T21:23:30-05:00,2014-03-29T21:35:09-05:00,699
3/29/14,place,Fitzsimmons Home,2014-03-29T21:35:09-05:00,2014-03-30T00:00:00-05:00,8691
3/30/14,place,Fitzsimmons Home,2014-03-30T00:00:00-05:00,2014-03-30T05:23:54-05:00,19434
3/30/14,place,Fitzsimmons Home,2014-03-30T05:47:04-05:00,2014-03-30T13:16:55-05:00,26991
3/30/14,move,transport,2014-03-30T13:16:55-05:00,2014-03-30T13:50:02-05:00,1987
3/30/14,place,Reel Club,2014-03-30T13:50:02-05:00,2014-03-30T14:56:04-05:00,3962
3/30/14,move,walking,2014-03-30T14:56:04-05:00,2014-03-30T14:58:54-05:00,170
3/30/14,place,Anthropologie,2014-03-30T14:58:54-05:00,2014-03-30T15:09:45-05:00,651
3/30/14,move,walking,2014-03-30T15:09:45-05:00,2014-03-30T15:16:46-05:00,421
3/30/14,place,Oakbrook Apple Store v2.0,2014-03-30T15:16:47-05:00,2014-03-30T15:30:42-05:00,835
3/30/14,move,walking,2014-03-30T15:30:42-05:00,2014-03-30T15:32:58-05:00,136
3/30/14,place,Brookstone,2014-03-30T15:32:58-05:00,2014-03-30T15:48:32-05:00,934
3/30/14,move,walking,2014-03-30T15:48:32-05:00,2014-03-30T15:52:54-05:00,262
3/30/14,move,transport,2014-03-30T15:52:54-05:00,2014-03-30T16:39:01-05:00,2767
3/30/14,move,walking,2014-03-30T16:39:01-05:00,2014-03-30T16:41:02-05:00,121
3/30/14,move,transport,2014-03-30T16:41:01-05:00,2014-03-30T16:57:04-05:00,963
3/30/14,place,Fitzsimmons Home,2014-03-30T16:57:04-05:00,2014-03-31T00:00:00-05:00,25376
3/31/14,place,Fitzsimmons Home,2014-03-31T00:00:00-05:00,2014-03-31T13:24:47-05:00,48287
3/31/14,move,walking,2014-03-31T13:24:47-05:00,2014-03-31T13:28:31-05:00,224
3/31/14,move,transport,2014-03-31T13:28:31-05:00,2014-03-31T14:48:05-05:00,4774
3/31/14,move,walking,2014-03-31T14:48:04-05:00,2014-03-31T14:52:34-05:00,270
3/31/14,move,transport,2014-03-31T14:52:34-05:00,2014-03-31T15:04:05-05:00,691
3/31/14,move,walking,2014-03-31T15:04:05-05:00,2014-03-31T15:09:37-05:00,332
3/31/14,place,US Cellular Field,2014-03-31T15:09:37-05:00,2014-03-31T16:44:36-05:00,5699
3/31/14,move,walking,2014-03-31T16:44:36-05:00,2014-03-31T16:53:28-05:00,532
3/31/14,place,US Cellular Field,2014-03-31T16:53:28-05:00,2014-03-31T17:34:15-05:00,2447
