<?xml version="1.0" encoding="UTF-8"?>
<gpx 
creator="Moves" version="1.1" xmlns="http://www.topografix.com/GPX/1/1" xmlns:tns="http://www.topografix.com/GPX/1/1" xmlns:xs="http://www.w3.org/2001/XMLSchema" xmlns:xsi="http://www.w3.org/2001/XMLSchema-instance">
  <metadata>
    <desc>Moves Storyline</desc>
    <link href="http://www.moves-app.com"/>
    <time>2014-07-03T22:24:44.094Z</time>
  </metadata>
  <wpt lon="-88.311048021" lat="41.8771070061">
    <name>Fitzsimmons Home</name>
    <type>Home</type>
  </wpt>
  <wpt lon="-88.26586604118347" lat="41.92062465060372">
    <name>Chipotle Mexican Grill</name>
    <link href="http://foursquare.com/venue/4a8efb58f964a520701320e3"/>
    <type>Mexican Restaurant</type>
  </wpt>
  <wpt lon="-88.30746173858643" lat="41.88694340165634">
    <name>Nosh</name>
    <link href="http://foursquare.com/venue/4b5c8db0f964a5203b3629e3"/>
  </wpt>
  <wpt lon="-88.34226608276367" lat="41.87135042798499">
    <name>Marshalls</name>
    <link href="http://foursquare.com/venue/4c0ada0e7e3fc928f464f482"/>
  </wpt>
  <wpt lon="-88.3492217249" lat="41.8162845622">
    <name>Place in North Aurora</name>
  </wpt>
  <wpt lon="-88.3410287036" lat="41.8740538471">
    <name>Place in Geneva</name>
  </wpt>
  <wpt lon="-88.3401807" lat="41.8480793">
    <name>Jewel-Osco</name>
    <link href="http://foursquare.com/venue/4b3c0676f964a520938025e3"/>
    <type>Grocery Store</type>
  </wpt>
  <wpt lon="-88.3092212677002" lat="41.88416378545351">
    <name>Graham's 318</name>
    <link href="http://foursquare.com/venue/4a997135f964a520582e20e3"/>
    <type>Coffee Shop</type>
  </wpt>
  <wpt lon="-87.95306818974508" lat="41.85944534205429">
    <name>Drury Lane Theatre And Conference Center</name>
    <link href="http://foursquare.com/venue/4b8a0609f964a520295c32e3"/>
    <type>Performing Arts Venue</type>
  </wpt>
  <wpt lon="-87.9476928406" lat="41.8476618788">
    <name>Place in Oak Brook</name>
  </wpt>
  <wpt lon="-88.1137646466" lat="41.7768409288">
    <name>Place in DuPage County</name>
  </wpt>
  <wpt lon="-88.30879211425781" lat="41.88296963158768">
    <name>Wildwood</name>
    <link href="http://foursquare.com/venue/4af254bcf964a52071e721e3"/>
    <type>American Restaurant</type>
  </wpt>
  <wpt lon="-88.29395317558735" lat="41.81505247322077">
    <name>Marmion Academy &amp; Abbey</name>
    <link href="http://foursquare.com/venue/4be6f5d378e89521ffcd64ce"/>
    <type>High School</type>
  </wpt>
  <wpt lon="-88.3111773419" lat="41.8771046037">
    <name>999 S Batavia Ave</name>
    <type>Home</type>
  </wpt>
  <wpt lon="-88.3475596795" lat="41.9629592113">
    <name>Place in Kane County</name>
  </wpt>
  <wpt lon="-88.30787845" lat="41.88701828333333">
    <name>All Chocolate Kitchen</name>
    <link href="http://foursquare.com/venue/4e0101b8ae609fa8ede130bd"/>
  </wpt>
  <wpt lon="-88.29025268554688" lat="41.88771017105127">
    <name>CVS/pharmacy</name>
    <link href="http://foursquare.com/venue/4c214ee69085d13a26a184cc"/>
  </wpt>
  <wpt lon="-88.2883782767128" lat="41.8880886238829">
    <name>Aldi</name>
    <link href="http://foursquare.com/venue/4b83142bf964a52049f630e3"/>
  </wpt>
  <wpt lon="-88.34153167723547" lat="41.89390402038217">
    <name>California Pizza Kitchen</name>
    <link href="http://foursquare.com/venue/4b43dd2ff964a52080ec25e3"/>
    <type>Pizza Place</type>
  </wpt>
  <wpt lon="-87.80431104573442" lat="41.79200336823988">
    <name>Foran Funeral Home</name>
    <link href="http://foursquare.com/venue/4c5199c80ef3a59330f6447c"/>
    <type>Spiritual Center</type>
  </wpt>
  <wpt lon="-87.95100688934326" lat="41.85006371388324">
    <name>Mon Ami Gabi</name>
    <link href="http://foursquare.com/venue/4b4f139df964a520c6f926e3"/>
    <type>French Restaurant</type>
  </wpt>
  <wpt lon="-87.897449" lat="41.977036">
    <name>Gate L5</name>
    <link href="http://foursquare.com/venue/4c9d09fb8afca09334ecf215"/>
    <type>Airport Gate</type>
  </wpt>
  <wpt lon="-71.0149319231" lat="42.3648854193">
    <name>Place in Logan International Airport</name>
  </wpt>
  <wpt lon="-71.018968718" lat="42.3664825597">
    <name>Place in Logan International Airport</name>
  </wpt>
  <wpt lon="-71.1114458017" lat="42.3754311174">
    <name>Home</name>
    <type>Home</type>
  </wpt>
  <wpt lon="-71.0958597028" lat="42.3729819695">
    <name>Place in Cambridge</name>
  </wpt>
  <wpt lon="-71.110937" lat="42.168313">
    <name>The Pulse Network</name>
    <link href="http://foursquare.com/venue/4c23a07af7ced13aa282216d"/>
    <type>Tech Startup</type>
  </wpt>
  <wpt lon="-71.0679817199707" lat="42.1376636656493">
    <name>IKEA</name>
    <link href="http://foursquare.com/venue/4a27485af964a52071911fe3"/>
    <type>Furniture / Home Store</type>
  </wpt>
  <wpt lon="-71.117205" lat="42.378716">
    <name>Proximate</name>
    <link href="http://foursquare.com/venue/51c8c0d1498e5d4d09a48362"/>
    <type>Tech Startup</type>
  </wpt>
  <wpt lon="-71.12325225275964" lat="42.37317592010315">
    <name>Harvard Alumni Association</name>
    <link href="http://foursquare.com/venue/4b5dc68df964a520026b29e3"/>
    <type>University</type>
  </wpt>
  <wpt lon="-71.07440355241107" lat="42.35041149056912">
    <name>Flybridge Capital</name>
    <link href="http://foursquare.com/venue/4b282b6cf964a5202d9024e3"/>
    <type>Office</type>
  </wpt>
  <wpt lon="-71.079717" lat="42.347009">
    <name>Shaw's</name>
    <link href="http://foursquare.com/venue/4aac2d1cf964a520ac5c20e3"/>
    <type>Supermarket</type>
  </wpt>
  <wpt lon="-71.07497692108154" lat="42.34747545670305">
    <name>Back Bay Station (BBY)</name>
    <link href="http://foursquare.com/venue/49ff6be8f964a52020701fe3"/>
    <type>Subway</type>
  </wpt>
  <wpt lon="-73.9984220304" lat="40.7522053258">
    <name>Place in Penn Station South</name>
  </wpt>
  <wpt lon="-77.0061671733856" lat="38.89756277173564">
    <name>Union Station</name>
    <link href="http://foursquare.com/venue/430a6700f964a52036271fe3"/>
    <type>Train Station</type>
  </wpt>
  <wpt lon="-77.0772744833" lat="38.9219057145">
    <name>Laura's Home</name>
    <type>Home</type>
  </wpt>
  <wpt lon="-77.032106" lat="38.901567">
    <name>NTN24</name>
    <link href="http://foursquare.com/venue/4ec5b4b38b81dcfdc16568d3"/>
    <type>Office</type>
  </wpt>
  <wpt lon="-77.0291" lat="38.89984">
    <name>Staples</name>
    <link href="http://foursquare.com/venue/4ac27cc5f964a5205a9920e3"/>
    <type>Paper / Office Supplies Store</type>
  </wpt>
  <wpt lon="-77.026264132" lat="38.8945515566">
    <name>Place in Chinatown</name>
  </wpt>
  <wpt lon="-77.0286502924" lat="38.895197195">
    <name>Place in Franklin McPherson Square</name>
  </wpt>
  <wpt lon="-77.0229747639" lat="38.895790703">
    <name>Place in Chinatown</name>
  </wpt>
  <wpt lon="-77.01967477798462" lat="38.89881525015088">
    <name>Daikaya</name>
    <link href="http://foursquare.com/venue/50905502d63e87c2d3448e35"/>
    <type>Ramen / Noodle House</type>
  </wpt>
  <wpt lon="-77.02192725344514" lat="38.90041686668396">
    <name>Nando's Peri-Peri</name>
    <link href="http://foursquare.com/venue/4a4eb693f964a520f4ae1fe3"/>
    <type>Portuguese Restaurant</type>
  </wpt>
  <wpt lon="-77.0217510694" lat="38.8962978193">
    <name>Place in Chinatown</name>
  </wpt>
  <wpt lon="-77.0229107716" lat="38.8991835671">
    <name>Place in Chinatown</name>
  </wpt>
  <wpt lon="-77.07219441609172" lat="38.92117412899746">
    <name>Arcuri</name>
    <link href="http://foursquare.com/venue/519c4adb498e0774090adff7"/>
    <type>Italian Restaurant</type>
  </wpt>
  <wpt lon="-77.026047706604" lat="38.88882820813984">
    <name>Smithsonian Institution Building (The Castle)</name>
    <link href="http://foursquare.com/venue/4a6dfd55f964a52085d31fe3"/>
    <type>History Museum</type>
  </wpt>
  <wpt lon="-77.03567147254944" lat="38.88604728513778">
    <name>Cherry Blossoms</name>
    <link href="http://foursquare.com/venue/4d91f1bc939e54811bd2d79e"/>
    <type>Garden</type>
  </wpt>
  <wpt lon="-77.03641176223755" lat="38.88136206056594">
    <name>Thomas Jefferson Memorial</name>
    <link href="http://foursquare.com/venue/4a106621f964a520ba761fe3"/>
    <type>Monument / Landmark</type>
  </wpt>
  <wpt lon="-77.04257011413574" lat="38.88301570451763">
    <name>Franklin Delano Roosevelt Memorial</name>
    <link href="http://foursquare.com/venue/4a10649df964a520b7761fe3"/>
    <type>Monument / Landmark</type>
  </wpt>
  <wpt lon="-77.0465612411499" lat="38.898128">
    <name>Tonic Restaurant</name>
    <link href="http://foursquare.com/venue/49d1b87af964a520955b1fe3"/>
    <type>American Restaurant</type>
  </wpt>
  <wpt lon="-77.04408288002014" lat="38.91108002120524">
    <name>Raku</name>
    <link href="http://foursquare.com/venue/418ac280f964a520f51d1fe3"/>
    <type>Asian Restaurant</type>
  </wpt>
  <wpt lon="-77.031603" lat="38.908492">
    <name>ChurchKey</name>
    <link href="http://foursquare.com/venue/4adf1a1ff964a520957721e3"/>
    <type>Gastropub</type>
  </wpt>
  <wpt lon="-77.044607106" lat="38.9096994771">
    <name>Place in West End</name>
  </wpt>
  <wpt lon="-77.0259120873" lat="38.8988141904">
    <name>National Association of Manufacturers</name>
    <type>Work</type>
  </wpt>
  <wpt lon="-77.03193062942098" lat="38.89833630275513">
    <name>Ceiba</name>
    <link href="http://foursquare.com/venue/4a00a24cf964a5209e701fe3"/>
    <type>Latin American Restaurant</type>
  </wpt>
  <wpt lon="-77.05326165317148" lat="38.90410567190644">
    <name>Trader Joe's</name>
    <link href="http://foursquare.com/venue/4a04a703f964a52016721fe3"/>
    <type>Grocery Store</type>
  </wpt>
  <wpt lon="-77.0721173286438" lat="38.92081351829113">
    <name>Bruegger's Bagels</name>
    <link href="http://foursquare.com/venue/4c139886a1010f47e3d34a18"/>
    <type>Bagel Shop</type>
  </wpt>
  <wpt lon="-77.03282833099365" lat="38.90220518091243">
    <name>A-1 Wines &amp; Liquors</name>
    <link href="http://foursquare.com/venue/4b7b1b41f964a520b7512fe3"/>
    <type>Liquor Store</type>
  </wpt>
  <wpt lon="-77.0303438061" lat="38.9050908726">
    <name>Place in Thomas Circle</name>
  </wpt>
  <wpt lon="-77.02214777469635" lat="38.89588441602569">
    <name>Jaleo</name>
    <link href="http://foursquare.com/venue/4a6e4e04f964a52074d41fe3"/>
    <type>Tapas Restaurant</type>
  </wpt>
  <wpt lon="-77.0675233368569" lat="38.91509131242815">
    <name>Starbucks</name>
    <link href="http://foursquare.com/venue/4a7f23a8f964a520f9f21fe3"/>
    <type>Coffee Shop</type>
  </wpt>
  <wpt lon="-77.06553250551224" lat="38.90502721656731">
    <name>Pizzeria Paradiso</name>
    <link href="http://foursquare.com/venue/4a25b915f964a5208a7e1fe3"/>
    <type>Pizza Place</type>
  </wpt>
  <wpt lon="-77.06318935763366" lat="38.90446093107843">
    <name>Pinstripes</name>
    <link href="http://foursquare.com/venue/52f3dc0411d20d6aa7cb6474"/>
    <type>Bowling Alley</type>
  </wpt>
  <wpt lon="-77.060355" lat="38.90536">
    <name>Old Stone House</name>
    <link href="http://foursquare.com/venue/4a9c3191f964a5205c3620e3"/>
    <type>Historic Site</type>
  </wpt>
  <wpt lon="-77.06227307487663" lat="38.90529562790965">
    <name>Old Glory</name>
    <link href="http://foursquare.com/venue/40f47780f964a5207c0a1fe3"/>
    <type>BBQ Joint</type>
  </wpt>
  <wpt lon="-77.06379646138976" lat="38.9085947611904">
    <name>CVS/pharmacy</name>
    <link href="http://foursquare.com/venue/4a89f2f3f964a520770920e3"/>
    <type>Drugstore / Pharmacy</type>
  </wpt>
  <wpt lon="-77.0649548316" lat="38.9107293958">
    <name>Place in Cloisters</name>
  </wpt>
  <wpt lon="-77.06624170943276" lat="38.91343030545362">
    <name>DC Public Library - Georgetown</name>
    <link href="http://foursquare.com/venue/4cd07bc106b54688da43db94"/>
    <type>Library</type>
  </wpt>
  <wpt lon="-77.06758975982666" lat="38.91567980755536">
    <name>Safeway</name>
    <link href="http://foursquare.com/venue/4bb614dc2f70c9b656d68430"/>
    <type>Grocery Store</type>
  </wpt>
  <wpt lon="-77.0422030501043" lat="38.92124831604843">
    <name>La Fourchette</name>
    <link href="http://foursquare.com/venue/4a6a72fbf964a5207bcd1fe3"/>
    <type>French Restaurant</type>
  </wpt>
  <wpt lon="-77.04085350036621" lat="38.91754968991449">
    <name>Pleasant Pops Farmhouse Market &amp; Cafe</name>
    <link href="http://foursquare.com/venue/4ff88836e4b02ca33cc6d2b3"/>
    <type>Ice Cream Shop</type>
  </wpt>
  <wpt lon="-77.06002449871039" lat="38.90138513466971">
    <name>Farmers Fishers Bakers</name>
    <link href="http://foursquare.com/venue/4f7a3deee4b0747c653b4a52"/>
    <type>American Restaurant</type>
  </wpt>
  <wpt lon="-77.0421389873" lat="38.848302902">
    <name>Place in Ronald Reagan Washington National Airport</name>
  </wpt>
  <wpt lon="-77.0423622654" lat="38.8468362848">
    <name>Place in Ronald Reagan Washington National Airport</name>
  </wpt>
  <wpt lon="-71.12017" lat="42.374494">
    <name>Starbucks</name>
    <link href="http://foursquare.com/venue/49cabb79f964a520d8581fe3"/>
    <type>Coffee Shop</type>
  </wpt>
  <wpt lon="-71.12299694115246" lat="42.37210143005068">
    <name>Henrietta's Table</name>
    <link href="http://foursquare.com/venue/4a51523bf964a520edb01fe3"/>
    <type>American Restaurant</type>
  </wpt>
  <wpt lon="-71.12097185013617" lat="42.37169409933257">
    <name>Park</name>
    <link href="http://foursquare.com/venue/4f7c8902e4b032c26c6798db"/>
    <type>Gastropub</type>
  </wpt>
  <wpt lon="-71.1194879958" lat="42.3735409474">
    <name>Place in Old Cambridge</name>
  </wpt>
  <wpt lon="-71.1239003393" lat="42.3681939793">
    <name>Place in Allston</name>
  </wpt>
  <wpt lon="-71.11702028202814" lat="42.36972025201748">
    <name>Leverett House</name>
    <link href="http://foursquare.com/venue/4b5b9c2ef964a520cb0a29e3"/>
    <type>College Residence Hall</type>
  </wpt>
  <wpt lon="-71.1132681841" lat="42.37582268">
    <name>Place in Old Cambridge</name>
  </wpt>
  <wpt lon="-71.120141" lat="42.3743468">
    <name>Border Cafe</name>
    <link href="http://foursquare.com/venue/3fd66200f964a520bded1ee3"/>
    <type>Mexican Restaurant</type>
  </wpt>
  <wpt lon="-71.1168444121" lat="42.3760442772">
    <name>Place in Old Cambridge</name>
  </wpt>
  <wpt lon="-71.11979826" lat="42.38213717937469">
    <name>Floyd's 99 Barbershop</name>
    <link href="http://foursquare.com/venue/4a9d711ff964a520443820e3"/>
    <type>Salon / Barbershop</type>
  </wpt>
  <wpt lon="-71.1196048125" lat="42.3810235564">
    <name>Place in Old Cambridge</name>
  </wpt>
  <wpt lon="-71.119043" lat="42.373776">
    <name>Staples</name>
    <link href="http://foursquare.com/venue/4b1e88eaf964a520321b24e3"/>
    <type>Paper / Office Supplies Store</type>
  </wpt>
  <wpt lon="-71.11951231956482" lat="42.37313766800413">
    <name>Experiment Fund</name>
    <type>Work</type>
  </wpt>
  <wpt lon="-71.115435" lat="42.375886">
    <name>Queens Head Pub</name>
    <link href="http://foursquare.com/venue/4ad6a980f964a5201a0821e3"/>
    <type>Bar</type>
  </wpt>
  <wpt lon="-71.06745121566072" lat="42.34099437360112">
    <name>Gaslight Brasserie du Coin</name>
    <link href="http://foursquare.com/venue/49fef9eaf964a520c06f1fe3"/>
    <type>French Restaurant</type>
  </wpt>
  <wpt lon="-71.11902218263484" lat="42.37360433115195">
    <name>Bank Of America</name>
    <link href="http://foursquare.com/venue/4ab24fd3f964a520ea6a20e3"/>
    <type>Bank</type>
  </wpt>
  <wpt lon="-71.021521119" lat="42.3645749042">
    <name>Place in Logan International Airport</name>
  </wpt>
  <wpt lon="-71.0244723755" lat="42.3629856017">
    <name>Place in Jeffries Point</name>
  </wpt>
  <wpt lon="-71.01667642593384" lat="42.36650312404415">
    <name>Boston Logan International Airport (BOS)</name>
    <link href="http://foursquare.com/venue/452113b6f964a520bc3a1fe3"/>
    <type>Airport</type>
  </wpt>
  <wpt lon="-71.01667642593384" lat="42.36650312404415">
    <name>Boston Logan International Airport (BOS)</name>
    <link href="http://foursquare.com/venue/452113b6f964a520bc3a1fe3"/>
    <type>Airport</type>
  </wpt>
  <wpt lon="-73.7906573509" lat="40.639871097">
    <name>Place in John F. Kennedy International Airport</name>
  </wpt>
  <wpt lon="-73.7845230102539" lat="40.64508935597635">
    <name>John F. Kennedy International Airport (JFK)</name>
    <link href="http://foursquare.com/venue/43a52546f964a520532c1fe3"/>
    <type>Airport</type>
  </wpt>
  <wpt lon="-73.7845230102539" lat="40.64508935597635">
    <name>John F. Kennedy International Airport (JFK)</name>
    <link href="http://foursquare.com/venue/43a52546f964a520532c1fe3"/>
    <type>Airport</type>
  </wpt>
  <wpt lon="-122.3862791061401" lat="37.61642405271961">
    <name>San Francisco International Airport (SFO)</name>
    <link href="http://foursquare.com/venue/41059b00f964a520850b1fe3"/>
    <type>Airport</type>
  </wpt>
  <wpt lon="-122.3862791061401" lat="37.61642405271961">
    <name>San Francisco International Airport (SFO)</name>
    <link href="http://foursquare.com/venue/41059b00f964a520850b1fe3"/>
    <type>Airport</type>
  </wpt>
  <wpt lon="-122.0274591675424" lat="37.39623913829737">
    <name>Vagabond Inn Sunnyvale</name>
    <link href="http://foursquare.com/venue/4ad96f51f964a520251a21e3"/>
    <type>Hotel</type>
  </wpt>
  <wpt lon="-122.0299594399" lat="37.3923919234">
    <name>Place in Sunnyvale</name>
  </wpt>
  <wpt lon="-122.0278810342598" lat="37.39608699705354">
    <name>Denny's</name>
    <link href="http://foursquare.com/venue/4b4f1820f964a52027fa26e3"/>
    <type>Diner</type>
  </wpt>
  <wpt lon="-122.1698141098022" lat="37.42893313778773">
    <name>Stanford University</name>
    <link href="http://foursquare.com/venue/4a983497f964a520f02a20e3"/>
    <type>University</type>
  </wpt>
  <wpt lon="-122.170826355" lat="37.4241936853">
    <name>Place in Stanford</name>
  </wpt>
  <wpt lon="-122.3915585347" lat="37.7890276868">
    <name>Christina and Thompson Nguyen's House</name>
    <type>Home</type>
  </wpt>
  <wpt lon="-122.3936283588409" lat="37.795427908882">
    <name>Ferry Building</name>
    <link href="http://foursquare.com/venue/43067280f964a52023271fe3"/>
    <type>Monument / Landmark</type>
  </wpt>
  <wpt lon="-122.5155428051949" lat="37.89656642953388">
    <name>In-N-Out Burger</name>
    <link href="http://foursquare.com/venue/43fed5a9f964a52004301fe3"/>
    <type>Burger Joint</type>
  </wpt>
  <wpt lon="-122.3900020122528" lat="38.42254548224498">
    <name>Folie à Deux Winery</name>
    <link href="http://foursquare.com/venue/4bca11fd68f976b0738e5e83"/>
    <type>Winery</type>
  </wpt>
  <wpt lon="-122.469388101944" lat="38.50460958286393">
    <name>Orin Swift Cellars</name>
    <link href="http://foursquare.com/venue/4b6ca6d5f964a5208c492ce3"/>
    <type>Winery</type>
  </wpt>
  <wpt lon="-122.030288" lat="37.388271">
    <name>Starbucks</name>
    <link href="http://foursquare.com/venue/49ed472df964a520db671fe3"/>
    <type>Coffee Shop</type>
  </wpt>
  <wpt lon="-122.0678794384003" lat="37.38667126850424">
    <name>Y Combinator</name>
    <link href="http://foursquare.com/venue/4a442dc7f964a52046a71fe3"/>
    <type>Tech Startup</type>
  </wpt>
  <wpt lon="-122.072889260147" lat="37.391611183987">
    <name>La Fiesta Restaurant</name>
    <link href="http://foursquare.com/venue/4596ba31f964a52070401fe3"/>
    <type>Mexican Restaurant</type>
  </wpt>
  <wpt lon="-122.0575904846191" lat="37.37479547689328">
    <name>BevMo!</name>
    <link href="http://foursquare.com/venue/49fa568df964a520ef6d1fe3"/>
    <type>Liquor Store</type>
  </wpt>
  <wpt lon="-122.1608367164" lat="37.4431194221">
    <name>AB InBev Beer Garage</name>
    <type>Work</type>
  </wpt>
  <wpt lon="-122.1627038223" lat="37.4450805938">
    <name>Place in Downtown North</name>
  </wpt>
  <wpt lon="-122.161212663" lat="37.4463045405">
    <name>Place in University South</name>
  </wpt>
  <wpt lon="-122.1617297912859" lat="37.44437571796183">
    <name>The Rose &amp; Crown Pub</name>
    <link href="http://foursquare.com/venue/429cfa80f964a520b2241fe3"/>
    <type>Pub</type>
  </wpt>
  <wpt lon="-122.0830371213933" lat="37.38802208328161">
    <name>Quora HQ</name>
    <link href="http://foursquare.com/venue/50db6e80e4b09888a687f043"/>
    <type>Office</type>
  </wpt>
  <wpt lon="-122.1621108055115" lat="37.44563018608518">
    <name>Oren's Hummus Shop</name>
    <link href="http://foursquare.com/venue/4df7ce8315205e0e3f6b06a4"/>
    <type>Mediterranean Restaurant</type>
  </wpt>
  <wpt lon="-122.383277" lat="37.60122">
    <name>Chevron</name>
    <link href="http://foursquare.com/venue/4ba084a8f964a520ae7037e3"/>
    <type>Gas Station / Garage</type>
  </wpt>
  <wpt lon="-122.3862791061401" lat="37.61642405271961">
    <name>San Francisco International Airport (SFO)</name>
    <link href="http://foursquare.com/venue/41059b00f964a520850b1fe3"/>
    <type>Airport</type>
  </wpt>
  <wpt lon="-122.3862791061401" lat="37.61642405271961">
    <name>San Francisco International Airport (SFO)</name>
    <link href="http://foursquare.com/venue/41059b00f964a520850b1fe3"/>
    <type>Airport</type>
  </wpt>
  <wpt lon="-122.3862791061401" lat="37.61642405271961">
    <name>San Francisco International Airport (SFO)</name>
    <link href="http://foursquare.com/venue/41059b00f964a520850b1fe3"/>
    <type>Airport</type>
  </wpt>
  <wpt lon="-122.3921618318497" lat="37.77676600917484">
    <name>Dropbox HQ</name>
    <link href="http://foursquare.com/venue/4f3970aee4b08f009b927739"/>
    <type>Tech Startup</type>
  </wpt>
  <wpt lon="-122.3956690746249" lat="37.77671275752899">
    <name>Marlowe</name>
    <link href="http://foursquare.com/venue/4b71ed7af964a520b3642de3"/>
    <type>New American Restaurant</type>
  </wpt>
  <wpt lon="-122.3894011974335" lat="37.77833858778822">
    <name>AT&amp;T Park</name>
    <link href="http://foursquare.com/venue/4bd2177d046076b055357371"/>
    <type>Baseball Stadium</type>
  </wpt>
  <wpt lon="-122.3891887752" lat="37.614805956">
    <name>Place in AirTrain Red Line</name>
  </wpt>
  <wpt lon="-122.3887845733" lat="37.6139776002">
    <name>Place in San Francisco International Airport</name>
  </wpt>
  <wpt lon="-122.3862791061401" lat="37.61642405271961">
    <name>San Francisco International Airport (SFO)</name>
    <link href="http://foursquare.com/venue/41059b00f964a520850b1fe3"/>
    <type>Airport</type>
  </wpt>
  <wpt lon="-71.01667642593384" lat="42.36650312404415">
    <name>Boston Logan International Airport (BOS)</name>
    <link href="http://foursquare.com/venue/452113b6f964a520bc3a1fe3"/>
    <type>Airport</type>
  </wpt>
  <wpt lon="-71.01667642593384" lat="42.36650312404415">
    <name>Boston Logan International Airport (BOS)</name>
    <link href="http://foursquare.com/venue/452113b6f964a520bc3a1fe3"/>
    <type>Airport</type>
  </wpt>
  <wpt lon="-71.12077832221985" lat="42.37237675230346">
    <name>Grendel's Den Restaurant &amp; Bar</name>
    <link href="http://foursquare.com/venue/3fd66200f964a520bced1ee3"/>
    <type>Bar</type>
  </wpt>
  <trk>
    <name>4/1/14</name>
    <trkseg>
      <trkpt lon="-88.311048021" lat="41.8771070061">
        <time>2014-04-01T00:00:00.000-05:00</time>
        <type>place</type>
      </trkpt>
      <trkpt lon="-88.311048021" lat="41.8771070061">
        <time>2014-04-01T12:21:11.000-05:00</time>
        <type>place</type>
      </trkpt>
    </trkseg>
    <trkseg>
      <trkpt lon="-88.26586604118347" lat="41.92062465060372">
        <time>2014-04-01T12:32:44.000-05:00</time>
        <type>place</type>
      </trkpt>
      <trkpt lon="-88.26586604118347" lat="41.92062465060372">
        <time>2014-04-01T13:07:51.000-05:00</time>
        <type>place</type>
      </trkpt>
    </trkseg>
    <trkseg>
      <trkpt lon="-88.311048021" lat="41.8771070061">
        <time>2014-04-01T13:20:38.000-05:00</time>
        <type>place</type>
      </trkpt>
      <trkpt lon="-88.311048021" lat="41.8771070061">
        <time>2014-04-02T00:00:00.000-05:00</time>
        <type>place</type>
      </trkpt>
    </trkseg>
  </trk>
  <trk>
    <name>4/2/14</name>
    <trkseg>
      <trkpt lon="-88.311048021" lat="41.8771070061">
        <time>2014-04-02T00:00:00.000-05:00</time>
        <type>place</type>
      </trkpt>
      <trkpt lon="-88.311048021" lat="41.8771070061">
        <time>2014-04-02T12:13:02.000-05:00</time>
        <type>place</type>
      </trkpt>
    </trkseg>
    <trkseg>
      <trkpt lon="-88.30746173858643" lat="41.88694340165634">
        <time>2014-04-02T12:18:46.000-05:00</time>
        <type>place</type>
      </trkpt>
      <trkpt lon="-88.30746173858643" lat="41.88694340165634">
        <time>2014-04-02T12:56:28.000-05:00</time>
        <type>place</type>
      </trkpt>
    </trkseg>
    <trkseg>
      <trkpt lon="-88.311048021" lat="41.8771070061">
        <time>2014-04-02T13:00:25.000-05:00</time>
        <type>place</type>
      </trkpt>
      <trkpt lon="-88.311048021" lat="41.8771070061">
        <time>2014-04-02T13:04:50.000-05:00</time>
        <type>place</type>
      </trkpt>
    </trkseg>
    <trkseg>
      <trkpt lon="-88.34226608276367" lat="41.87135042798499">
        <time>2014-04-02T13:11:00.000-05:00</time>
        <type>place</type>
      </trkpt>
      <trkpt lon="-88.34226608276367" lat="41.87135042798499">
        <time>2014-04-02T13:43:30.000-05:00</time>
        <type>place</type>
      </trkpt>
    </trkseg>
    <trkseg>
      <trkpt lon="-88.311048021" lat="41.8771070061">
        <time>2014-04-02T13:49:59.000-05:00</time>
        <type>place</type>
      </trkpt>
      <trkpt lon="-88.311048021" lat="41.8771070061">
        <time>2014-04-02T19:10:24.000-05:00</time>
        <type>place</type>
      </trkpt>
    </trkseg>
    <trkseg>
      <trkpt lon="-88.3492217249" lat="41.8162845622">
        <time>2014-04-02T19:21:41.000-05:00</time>
        <type>place</type>
      </trkpt>
      <trkpt lon="-88.3492217249" lat="41.8162845622">
        <time>2014-04-02T20:51:27.000-05:00</time>
        <type>place</type>
      </trkpt>
    </trkseg>
    <trkseg>
      <trkpt lon="-88.311048021" lat="41.8771070061">
        <time>2014-04-02T21:06:48.000-05:00</time>
        <type>place</type>
      </trkpt>
      <trkpt lon="-88.311048021" lat="41.8771070061">
        <time>2014-04-03T00:00:00.000-05:00</time>
        <type>place</type>
      </trkpt>
    </trkseg>
  </trk>
  <trk>
    <name>4/3/14</name>
    <trkseg>
      <trkpt lon="-88.311048021" lat="41.8771070061">
        <time>2014-04-03T00:00:00.000-05:00</time>
        <type>place</type>
      </trkpt>
      <trkpt lon="-88.311048021" lat="41.8771070061">
        <time>2014-04-04T00:00:00.000-05:00</time>
        <type>place</type>
      </trkpt>
    </trkseg>
  </trk>
  <trk>
    <name>4/4/14</name>
    <trkseg>
      <trkpt lon="-88.311048021" lat="41.8771070061">
        <time>2014-04-04T00:00:00.000-05:00</time>
        <type>place</type>
      </trkpt>
      <trkpt lon="-88.311048021" lat="41.8771070061">
        <time>2014-04-04T14:07:39.000-05:00</time>
        <type>place</type>
      </trkpt>
    </trkseg>
    <trkseg>
      <trkpt lon="-88.3410287036" lat="41.8740538471">
        <time>2014-04-04T14:28:05.000-05:00</time>
        <type>place</type>
      </trkpt>
      <trkpt lon="-88.3410287036" lat="41.8740538471">
        <time>2014-04-04T14:44:41.000-05:00</time>
        <type>place</type>
      </trkpt>
    </trkseg>
    <trkseg>
      <trkpt lon="-88.311048021" lat="41.8771070061">
        <time>2014-04-04T15:25:06.000-05:00</time>
        <type>place</type>
      </trkpt>
      <trkpt lon="-88.311048021" lat="41.8771070061">
        <time>2014-04-05T00:00:00.000-05:00</time>
        <type>place</type>
      </trkpt>
    </trkseg>
  </trk>
  <trk>
    <name>4/5/14</name>
    <trkseg>
      <trkpt lon="-88.311048021" lat="41.8771070061">
        <time>2014-04-05T00:00:00.000-05:00</time>
        <type>place</type>
      </trkpt>
      <trkpt lon="-88.311048021" lat="41.8771070061">
        <time>2014-04-05T10:52:44.000-05:00</time>
        <type>place</type>
      </trkpt>
    </trkseg>
    <trkseg>
      <trkpt lon="-88.3401807" lat="41.8480793">
        <time>2014-04-05T11:02:42.000-05:00</time>
        <type>place</type>
      </trkpt>
      <trkpt lon="-88.3401807" lat="41.8480793">
        <time>2014-04-05T11:16:04.000-05:00</time>
        <type>place</type>
      </trkpt>
    </trkseg>
    <trkseg>
      <trkpt lon="-88.311048021" lat="41.8771070061">
        <time>2014-04-05T11:27:17.000-05:00</time>
        <type>place</type>
      </trkpt>
      <trkpt lon="-88.311048021" lat="41.8771070061">
        <time>2014-04-05T13:32:55.000-05:00</time>
        <type>place</type>
      </trkpt>
    </trkseg>
    <trkseg>
      <trkpt lon="-88.3092212677002" lat="41.88416378545351">
        <time>2014-04-05T13:45:49.000-05:00</time>
        <type>place</type>
      </trkpt>
      <trkpt lon="-88.3092212677002" lat="41.88416378545351">
        <time>2014-04-05T14:22:58.000-05:00</time>
        <type>place</type>
      </trkpt>
    </trkseg>
    <trkseg>
      <trkpt lon="-88.311048021" lat="41.8771070061">
        <time>2014-04-05T14:40:01.000-05:00</time>
        <type>place</type>
      </trkpt>
      <trkpt lon="-88.311048021" lat="41.8771070061">
        <time>2014-04-05T17:29:06.000-05:00</time>
        <type>place</type>
      </trkpt>
    </trkseg>
    <trkseg>
      <trkpt lon="-87.95306818974508" lat="41.85944534205429">
        <time>2014-04-05T18:05:28.000-05:00</time>
        <type>place</type>
      </trkpt>
      <trkpt lon="-87.95306818974508" lat="41.85944534205429">
        <time>2014-04-06T00:00:00.000-05:00</time>
        <type>place</type>
      </trkpt>
    </trkseg>
  </trk>
  <trk>
    <name>4/6/14</name>
    <trkseg>
      <trkpt lon="-87.95306818974508" lat="41.85944534205429">
        <time>2014-04-06T00:00:00.000-05:00</time>
        <type>place</type>
      </trkpt>
      <trkpt lon="-87.95306818974508" lat="41.85944534205429">
        <time>2014-04-06T00:37:15.000-05:00</time>
        <type>place</type>
      </trkpt>
    </trkseg>
    <trkseg>
      <trkpt lon="-87.9476928406" lat="41.8476618788">
        <time>2014-04-06T00:42:25.000-05:00</time>
        <type>place</type>
      </trkpt>
      <trkpt lon="-87.9476928406" lat="41.8476618788">
        <time>2014-04-06T00:47:54.000-05:00</time>
        <type>place</type>
      </trkpt>
    </trkseg>
    <trkseg>
      <trkpt lon="-88.1137646466" lat="41.7768409288">
        <time>2014-04-06T01:07:18.000-05:00</time>
        <type>place</type>
      </trkpt>
      <trkpt lon="-88.1137646466" lat="41.7768409288">
        <time>2014-04-06T01:12:52.000-05:00</time>
        <type>place</type>
      </trkpt>
    </trkseg>
    <trkseg>
      <trkpt lon="-88.311048021" lat="41.8771070061">
        <time>2014-04-06T01:39:06.000-05:00</time>
        <type>place</type>
      </trkpt>
      <trkpt lon="-88.311048021" lat="41.8771070061">
        <time>2014-04-06T12:48:41.000-05:00</time>
        <type>place</type>
      </trkpt>
    </trkseg>
    <trkseg>
      <trkpt lon="-88.30879211425781" lat="41.88296963158768">
        <time>2014-04-06T13:00:18.000-05:00</time>
        <type>place</type>
      </trkpt>
      <trkpt lon="-88.30879211425781" lat="41.88296963158768">
        <time>2014-04-06T13:49:38.000-05:00</time>
        <type>place</type>
      </trkpt>
    </trkseg>
    <trkseg>
      <trkpt lon="-88.311048021" lat="41.8771070061">
        <time>2014-04-06T14:02:00.000-05:00</time>
        <type>place</type>
      </trkpt>
      <trkpt lon="-88.311048021" lat="41.8771070061">
        <time>2014-04-06T19:48:31.000-05:00</time>
        <type>place</type>
      </trkpt>
    </trkseg>
    <trkseg>
      <trkpt lon="-88.29395317558735" lat="41.81505247322077">
        <time>2014-04-06T20:03:04.000-05:00</time>
        <type>place</type>
      </trkpt>
      <trkpt lon="-88.29395317558735" lat="41.81505247322077">
        <time>2014-04-06T20:14:55.000-05:00</time>
        <type>place</type>
      </trkpt>
    </trkseg>
    <trkseg>
      <trkpt lon="-88.311048021" lat="41.8771070061">
        <time>2014-04-06T20:31:37.000-05:00</time>
        <type>place</type>
      </trkpt>
      <trkpt lon="-88.311048021" lat="41.8771070061">
        <time>2014-04-06T22:31:49.000-05:00</time>
        <type>place</type>
      </trkpt>
    </trkseg>
    <trkseg>
      <trkpt lon="-88.3111773419" lat="41.8771046037">
        <time>2014-04-06T23:01:25.000-05:00</time>
        <type>place</type>
      </trkpt>
      <trkpt lon="-88.3111773419" lat="41.8771046037">
        <time>2014-04-07T00:00:00.000-05:00</time>
        <type>place</type>
      </trkpt>
    </trkseg>
  </trk>
  <trk>
    <name>4/7/14</name>
    <trkseg>
      <trkpt lon="-88.3111773419" lat="41.8771046037">
        <time>2014-04-07T00:00:00.000-05:00</time>
        <type>place</type>
      </trkpt>
      <trkpt lon="-88.3111773419" lat="41.8771046037">
        <time>2014-04-07T11:27:15.000-05:00</time>
        <type>place</type>
      </trkpt>
    </trkseg>
    <trkseg>
      <trkpt lon="-88.3475596795" lat="41.9629592113">
        <time>2014-04-07T11:47:13.000-05:00</time>
        <type>place</type>
      </trkpt>
      <trkpt lon="-88.3475596795" lat="41.9629592113">
        <time>2014-04-07T13:48:28.000-05:00</time>
        <type>place</type>
      </trkpt>
    </trkseg>
    <trkseg>
      <trkpt lon="-88.311048021" lat="41.8771070061">
        <time>2014-04-07T14:10:59.000-05:00</time>
        <type>place</type>
      </trkpt>
      <trkpt lon="-88.311048021" lat="41.8771070061">
        <time>2014-04-07T14:23:15.000-05:00</time>
        <type>place</type>
      </trkpt>
    </trkseg>
    <trkseg>
      <trkpt lon="-88.30787845" lat="41.88701828333333">
        <time>2014-04-07T14:25:30.000-05:00</time>
        <type>place</type>
      </trkpt>
      <trkpt lon="-88.30787845" lat="41.88701828333333">
        <time>2014-04-07T15:06:39.000-05:00</time>
        <type>place</type>
      </trkpt>
    </trkseg>
    <trkseg>
      <trkpt lon="-88.29025268554688" lat="41.88771017105127">
        <time>2014-04-07T15:14:52.000-05:00</time>
        <type>place</type>
      </trkpt>
      <trkpt lon="-88.29025268554688" lat="41.88771017105127">
        <time>2014-04-07T15:42:17.000-05:00</time>
        <type>place</type>
      </trkpt>
    </trkseg>
    <trkseg>
      <trkpt lon="-88.2883782767128" lat="41.8880886238829">
        <time>2014-04-07T15:42:17.000-05:00</time>
        <type>place</type>
      </trkpt>
      <trkpt lon="-88.2883782767128" lat="41.8880886238829">
        <time>2014-04-07T15:58:41.000-05:00</time>
        <type>place</type>
      </trkpt>
    </trkseg>
    <trkseg>
      <trkpt lon="-88.311048021" lat="41.8771070061">
        <time>2014-04-07T16:04:09.000-05:00</time>
        <type>place</type>
      </trkpt>
      <trkpt lon="-88.311048021" lat="41.8771070061">
        <time>2014-04-07T16:37:19.000-05:00</time>
        <type>place</type>
      </trkpt>
    </trkseg>
    <trkseg>
      <trkpt lon="-88.311048021" lat="41.8771070061">
        <time>2014-04-07T18:54:51.000-05:00</time>
        <type>place</type>
      </trkpt>
      <trkpt lon="-88.311048021" lat="41.8771070061">
        <time>2014-04-08T00:00:00.000-05:00</time>
        <type>place</type>
      </trkpt>
    </trkseg>
  </trk>
  <trk>
    <name>4/8/14</name>
    <trkseg>
      <trkpt lon="-88.311048021" lat="41.8771070061">
        <time>2014-04-08T00:00:00.000-05:00</time>
        <type>place</type>
      </trkpt>
      <trkpt lon="-88.311048021" lat="41.8771070061">
        <time>2014-04-08T12:46:09.000-05:00</time>
        <type>place</type>
      </trkpt>
    </trkseg>
    <trkseg>
      <trkpt lon="-88.34153167723547" lat="41.89390402038217">
        <time>2014-04-08T12:58:29.000-05:00</time>
        <type>place</type>
      </trkpt>
      <trkpt lon="-88.34153167723547" lat="41.89390402038217">
        <time>2014-04-08T13:49:10.000-05:00</time>
        <type>place</type>
      </trkpt>
    </trkseg>
    <trkseg>
      <trkpt lon="-88.311048021" lat="41.8771070061">
        <time>2014-04-08T14:18:07.000-05:00</time>
        <type>place</type>
      </trkpt>
      <trkpt lon="-88.311048021" lat="41.8771070061">
        <time>2014-04-08T15:57:22.000-05:00</time>
        <type>place</type>
      </trkpt>
    </trkseg>
    <trkseg>
      <trkpt lon="-87.80431104573442" lat="41.79200336823988">
        <time>2014-04-08T17:01:11.000-05:00</time>
        <type>place</type>
      </trkpt>
      <trkpt lon="-87.80431104573442" lat="41.79200336823988">
        <time>2014-04-08T18:02:20.000-05:00</time>
        <type>place</type>
      </trkpt>
    </trkseg>
    <trkseg>
      <trkpt lon="-87.95100688934326" lat="41.85006371388324">
        <time>2014-04-08T18:36:58.000-05:00</time>
        <type>place</type>
      </trkpt>
      <trkpt lon="-87.95100688934326" lat="41.85006371388324">
        <time>2014-04-08T21:29:30.000-05:00</time>
        <type>place</type>
      </trkpt>
    </trkseg>
    <trkseg>
      <trkpt lon="-88.311048021" lat="41.8771070061">
        <time>2014-04-08T22:01:16.000-05:00</time>
        <type>place</type>
      </trkpt>
      <trkpt lon="-88.311048021" lat="41.8771070061">
        <time>2014-04-09T00:00:00.000-05:00</time>
        <type>place</type>
      </trkpt>
    </trkseg>
  </trk>
  <trk>
    <name>4/9/14</name>
    <trkseg>
      <trkpt lon="-88.311048021" lat="41.8771070061">
        <time>2014-04-09T00:00:00.000-05:00</time>
        <type>place</type>
      </trkpt>
      <trkpt lon="-88.311048021" lat="41.8771070061">
        <time>2014-04-09T10:51:20.000-05:00</time>
        <type>place</type>
      </trkpt>
    </trkseg>
    <trkseg>
      <trkpt lon="-87.897449" lat="41.977036">
        <time>2014-04-09T11:48:25.000-05:00</time>
        <type>place</type>
      </trkpt>
      <trkpt lon="-87.897449" lat="41.977036">
        <time>2014-04-09T12:32:25.000-05:00</time>
        <type>place</type>
      </trkpt>
    </trkseg>
    <trkseg>
      <trkpt lon="-71.0149319231" lat="42.3648854193">
        <time>2014-04-09T14:44:06.000-05:00</time>
        <type>place</type>
      </trkpt>
      <trkpt lon="-71.0149319231" lat="42.3648854193">
        <time>2014-04-09T14:51:46.000-05:00</time>
        <type>place</type>
      </trkpt>
    </trkseg>
    <trkseg>
      <trkpt lon="-71.018968718" lat="42.3664825597">
        <time>2014-04-09T14:59:03.000-05:00</time>
        <type>place</type>
      </trkpt>
      <trkpt lon="-71.018968718" lat="42.3664825597">
        <time>2014-04-09T15:06:21.000-05:00</time>
        <type>place</type>
      </trkpt>
    </trkseg>
    <trkseg>
      <trkpt lon="-71.1114458017" lat="42.3754311174">
        <time>2014-04-09T16:04:17.000-05:00</time>
        <type>place</type>
      </trkpt>
      <trkpt lon="-71.1114458017" lat="42.3754311174">
        <time>2014-04-09T17:45:35.000-05:00</time>
        <type>place</type>
      </trkpt>
    </trkseg>
    <trkseg>
      <trkpt lon="-71.0958597028" lat="42.3729819695">
        <time>2014-04-09T18:02:20.000-05:00</time>
        <type>place</type>
      </trkpt>
      <trkpt lon="-71.0958597028" lat="42.3729819695">
        <time>2014-04-09T19:21:07.000-05:00</time>
        <type>place</type>
      </trkpt>
    </trkseg>
    <trkseg>
      <trkpt lon="-71.1114458017" lat="42.3754311174">
        <time>2014-04-09T19:41:06.000-05:00</time>
        <type>place</type>
      </trkpt>
      <trkpt lon="-71.1114458017" lat="42.3754311174">
        <time>2014-04-10T00:00:00.000-05:00</time>
        <type>place</type>
      </trkpt>
    </trkseg>
  </trk>
  <trk>
    <name>4/10/14</name>
    <trkseg>
      <trkpt lon="-71.1114458017" lat="42.3754311174">
        <time>2014-04-10T00:00:00.000-05:00</time>
        <type>place</type>
      </trkpt>
      <trkpt lon="-71.1114458017" lat="42.3754311174">
        <time>2014-04-10T08:09:55.000-05:00</time>
        <type>place</type>
      </trkpt>
    </trkseg>
    <trkseg>
      <trkpt lon="-71.110937" lat="42.168313">
        <time>2014-04-10T09:07:52.000-05:00</time>
        <type>place</type>
      </trkpt>
      <trkpt lon="-71.110937" lat="42.168313">
        <time>2014-04-10T10:53:14.000-05:00</time>
        <type>place</type>
      </trkpt>
    </trkseg>
    <trkseg>
      <trkpt lon="-71.0679817199707" lat="42.1376636656493">
        <time>2014-04-10T11:10:29.000-05:00</time>
        <type>place</type>
      </trkpt>
      <trkpt lon="-71.0679817199707" lat="42.1376636656493">
        <time>2014-04-10T12:34:20.000-05:00</time>
        <type>place</type>
      </trkpt>
    </trkseg>
    <trkseg>
      <trkpt lon="-71.1114458017" lat="42.3754311174">
        <time>2014-04-10T13:16:11.000-05:00</time>
        <type>place</type>
      </trkpt>
      <trkpt lon="-71.1114458017" lat="42.3754311174">
        <time>2014-04-10T13:26:53.000-05:00</time>
        <type>place</type>
      </trkpt>
    </trkseg>
    <trkseg>
      <trkpt lon="-71.117205" lat="42.378716">
        <time>2014-04-10T13:40:56.000-05:00</time>
        <type>place</type>
      </trkpt>
      <trkpt lon="-71.117205" lat="42.378716">
        <time>2014-04-10T14:25:28.000-05:00</time>
        <type>place</type>
      </trkpt>
    </trkseg>
    <trkseg>
      <trkpt lon="-71.12325225275964" lat="42.37317592010315">
        <time>2014-04-10T14:36:08.000-05:00</time>
        <type>place</type>
      </trkpt>
      <trkpt lon="-71.12325225275964" lat="42.37317592010315">
        <time>2014-04-10T16:38:15.000-05:00</time>
        <type>place</type>
      </trkpt>
    </trkseg>
    <trkseg>
      <trkpt lon="-71.117205" lat="42.378716">
        <time>2014-04-10T16:56:10.000-05:00</time>
        <type>place</type>
      </trkpt>
      <trkpt lon="-71.117205" lat="42.378716">
        <time>2014-04-10T17:52:29.000-05:00</time>
        <type>place</type>
      </trkpt>
    </trkseg>
    <trkseg>
      <trkpt lon="-71.1114458017" lat="42.3754311174">
        <time>2014-04-10T18:03:43.000-05:00</time>
        <type>place</type>
      </trkpt>
      <trkpt lon="-71.1114458017" lat="42.3754311174">
        <time>2014-04-11T00:00:00.000-05:00</time>
        <type>place</type>
      </trkpt>
    </trkseg>
  </trk>
  <trk>
    <name>4/11/14</name>
    <trkseg>
      <trkpt lon="-71.1114458017" lat="42.3754311174">
        <time>2014-04-11T00:00:00.000-05:00</time>
        <type>place</type>
      </trkpt>
      <trkpt lon="-71.1114458017" lat="42.3754311174">
        <time>2014-04-11T09:01:29.000-05:00</time>
        <type>place</type>
      </trkpt>
    </trkseg>
    <trkseg>
      <trkpt lon="-71.07440355241107" lat="42.35041149056912">
        <time>2014-04-11T09:24:35.000-05:00</time>
        <type>place</type>
      </trkpt>
      <trkpt lon="-71.07440355241107" lat="42.35041149056912">
        <time>2014-04-11T10:50:19.000-05:00</time>
        <type>place</type>
      </trkpt>
    </trkseg>
    <trkseg>
      <trkpt lon="-71.079717" lat="42.347009">
        <time>2014-04-11T11:03:37.000-05:00</time>
        <type>place</type>
      </trkpt>
      <trkpt lon="-71.079717" lat="42.347009">
        <time>2014-04-11T11:59:07.000-05:00</time>
        <type>place</type>
      </trkpt>
    </trkseg>
    <trkseg>
      <trkpt lon="-71.07497692108154" lat="42.34747545670305">
        <time>2014-04-11T12:08:50.000-05:00</time>
        <type>place</type>
      </trkpt>
      <trkpt lon="-71.07497692108154" lat="42.34747545670305">
        <time>2014-04-11T12:20:45.000-05:00</time>
        <type>place</type>
      </trkpt>
    </trkseg>
    <trkseg>
      <trkpt lon="-73.9984220304" lat="40.7522053258">
        <time>2014-04-11T15:51:52.000-05:00</time>
        <type>place</type>
      </trkpt>
      <trkpt lon="-73.9984220304" lat="40.7522053258">
        <time>2014-04-11T16:04:48.000-05:00</time>
        <type>place</type>
      </trkpt>
    </trkseg>
    <trkseg>
      <trkpt lon="-77.0061671733856" lat="38.89756277173564">
        <time>2014-04-11T18:49:26.000-05:00</time>
        <type>place</type>
      </trkpt>
      <trkpt lon="-77.0061671733856" lat="38.89756277173564">
        <time>2014-04-11T19:06:37.000-05:00</time>
        <type>place</type>
      </trkpt>
    </trkseg>
    <trkseg>
      <trkpt lon="-77.0772744833" lat="38.9219057145">
        <time>2014-04-11T19:35:05.000-05:00</time>
        <type>place</type>
      </trkpt>
      <trkpt lon="-77.0772744833" lat="38.9219057145">
        <time>2014-04-12T00:00:00.000-05:00</time>
        <type>place</type>
      </trkpt>
    </trkseg>
  </trk>
  <trk>
    <name>4/12/14</name>
    <trkseg>
      <trkpt lon="-77.0772744833" lat="38.9219057145">
        <time>2014-04-12T00:00:00.000-05:00</time>
        <type>place</type>
      </trkpt>
      <trkpt lon="-77.0772744833" lat="38.9219057145">
        <time>2014-04-12T14:02:15.000-05:00</time>
        <type>place</type>
      </trkpt>
    </trkseg>
    <trkseg>
      <trkpt lon="-77.032106" lat="38.901567">
        <time>2014-04-12T14:57:28.000-05:00</time>
        <type>place</type>
      </trkpt>
      <trkpt lon="-77.032106" lat="38.901567">
        <time>2014-04-12T15:08:24.000-05:00</time>
        <type>place</type>
      </trkpt>
    </trkseg>
    <trkseg>
      <trkpt lon="-77.0291" lat="38.89984">
        <time>2014-04-12T15:11:33.000-05:00</time>
        <type>place</type>
      </trkpt>
      <trkpt lon="-77.0291" lat="38.89984">
        <time>2014-04-12T15:16:23.000-05:00</time>
        <type>place</type>
      </trkpt>
    </trkseg>
    <trkseg>
      <trkpt lon="-77.026264132" lat="38.8945515566">
        <time>2014-04-12T15:34:04.000-05:00</time>
        <type>place</type>
      </trkpt>
      <trkpt lon="-77.026264132" lat="38.8945515566">
        <time>2014-04-12T16:00:58.000-05:00</time>
        <type>place</type>
      </trkpt>
    </trkseg>
    <trkseg>
      <trkpt lon="-77.0286502924" lat="38.895197195">
        <time>2014-04-12T16:03:03.000-05:00</time>
        <type>place</type>
      </trkpt>
      <trkpt lon="-77.0286502924" lat="38.895197195">
        <time>2014-04-12T16:23:20.000-05:00</time>
        <type>place</type>
      </trkpt>
    </trkseg>
    <trkseg>
      <trkpt lon="-77.0229747639" lat="38.895790703">
        <time>2014-04-12T16:39:10.000-05:00</time>
        <type>place</type>
      </trkpt>
      <trkpt lon="-77.0229747639" lat="38.895790703">
        <time>2014-04-12T16:47:07.000-05:00</time>
        <type>place</type>
      </trkpt>
    </trkseg>
    <trkseg>
      <trkpt lon="-77.01967477798462" lat="38.89881525015088">
        <time>2014-04-12T16:55:20.000-05:00</time>
        <type>place</type>
      </trkpt>
      <trkpt lon="-77.01967477798462" lat="38.89881525015088">
        <time>2014-04-12T17:09:38.000-05:00</time>
        <type>place</type>
      </trkpt>
    </trkseg>
    <trkseg>
      <trkpt lon="-77.02192725344514" lat="38.90041686668396">
        <time>2014-04-12T17:16:53.000-05:00</time>
        <type>place</type>
      </trkpt>
      <trkpt lon="-77.02192725344514" lat="38.90041686668396">
        <time>2014-04-12T20:13:50.000-05:00</time>
        <type>place</type>
      </trkpt>
    </trkseg>
    <trkseg>
      <trkpt lon="-77.0217510694" lat="38.8962978193">
        <time>2014-04-12T20:22:04.000-05:00</time>
        <type>place</type>
      </trkpt>
      <trkpt lon="-77.0217510694" lat="38.8962978193">
        <time>2014-04-12T20:24:53.000-05:00</time>
        <type>place</type>
      </trkpt>
    </trkseg>
    <trkseg>
      <trkpt lon="-77.0229107716" lat="38.8991835671">
        <time>2014-04-12T20:29:59.000-05:00</time>
        <type>place</type>
      </trkpt>
      <trkpt lon="-77.0229107716" lat="38.8991835671">
        <time>2014-04-12T20:48:59.000-05:00</time>
        <type>place</type>
      </trkpt>
    </trkseg>
    <trkseg>
      <trkpt lon="-77.0772744833" lat="38.9219057145">
        <time>2014-04-12T21:27:31.000-05:00</time>
        <type>place</type>
      </trkpt>
      <trkpt lon="-77.0772744833" lat="38.9219057145">
        <time>2014-04-13T00:00:00.000-05:00</time>
        <type>place</type>
      </trkpt>
    </trkseg>
  </trk>
  <trk>
    <name>4/13/14</name>
    <trkseg>
      <trkpt lon="-77.0772744833" lat="38.9219057145">
        <time>2014-04-13T00:00:00.000-05:00</time>
        <type>place</type>
      </trkpt>
      <trkpt lon="-77.0772744833" lat="38.9219057145">
        <time>2014-04-13T09:40:43.000-05:00</time>
        <type>place</type>
      </trkpt>
    </trkseg>
    <trkseg>
      <trkpt lon="-77.07219441609172" lat="38.92117412899746">
        <time>2014-04-13T09:52:44.000-05:00</time>
        <type>place</type>
      </trkpt>
      <trkpt lon="-77.07219441609172" lat="38.92117412899746">
        <time>2014-04-13T11:02:05.000-05:00</time>
        <type>place</type>
      </trkpt>
    </trkseg>
    <trkseg>
      <trkpt lon="-77.026047706604" lat="38.88882820813984">
        <time>2014-04-13T11:45:53.000-05:00</time>
        <type>place</type>
      </trkpt>
      <trkpt lon="-77.026047706604" lat="38.88882820813984">
        <time>2014-04-13T12:17:07.000-05:00</time>
        <type>place</type>
      </trkpt>
    </trkseg>
    <trkseg>
      <trkpt lon="-77.03567147254944" lat="38.88604728513778">
        <time>2014-04-13T12:36:52.000-05:00</time>
        <type>place</type>
      </trkpt>
      <trkpt lon="-77.03567147254944" lat="38.88604728513778">
        <time>2014-04-13T12:52:27.000-05:00</time>
        <type>place</type>
      </trkpt>
    </trkseg>
    <trkseg>
      <trkpt lon="-77.03641176223755" lat="38.88136206056594">
        <time>2014-04-13T13:07:52.000-05:00</time>
        <type>place</type>
      </trkpt>
      <trkpt lon="-77.03641176223755" lat="38.88136206056594">
        <time>2014-04-13T13:24:01.000-05:00</time>
        <type>place</type>
      </trkpt>
    </trkseg>
    <trkseg>
      <trkpt lon="-77.04257011413574" lat="38.88301570451763">
        <time>2014-04-13T13:41:23.000-05:00</time>
        <type>place</type>
      </trkpt>
      <trkpt lon="-77.04257011413574" lat="38.88301570451763">
        <time>2014-04-13T13:50:18.000-05:00</time>
        <type>place</type>
      </trkpt>
    </trkseg>
    <trkseg>
      <trkpt lon="-77.0465612411499" lat="38.898128">
        <time>2014-04-13T14:34:39.000-05:00</time>
        <type>place</type>
      </trkpt>
      <trkpt lon="-77.0465612411499" lat="38.898128">
        <time>2014-04-13T15:42:25.000-05:00</time>
        <type>place</type>
      </trkpt>
    </trkseg>
    <trkseg>
      <trkpt lon="-77.04408288002014" lat="38.91108002120524">
        <time>2014-04-13T16:09:38.000-05:00</time>
        <type>place</type>
      </trkpt>
      <trkpt lon="-77.04408288002014" lat="38.91108002120524">
        <time>2014-04-13T17:13:06.000-05:00</time>
        <type>place</type>
      </trkpt>
    </trkseg>
    <trkseg>
      <trkpt lon="-77.031603" lat="38.908492">
        <time>2014-04-13T17:36:42.000-05:00</time>
        <type>place</type>
      </trkpt>
      <trkpt lon="-77.031603" lat="38.908492">
        <time>2014-04-13T18:53:25.000-05:00</time>
        <type>place</type>
      </trkpt>
    </trkseg>
    <trkseg>
      <trkpt lon="-77.044607106" lat="38.9096994771">
        <time>2014-04-13T19:13:03.000-05:00</time>
        <type>place</type>
      </trkpt>
      <trkpt lon="-77.044607106" lat="38.9096994771">
        <time>2014-04-13T19:21:46.000-05:00</time>
        <type>place</type>
      </trkpt>
    </trkseg>
    <trkseg>
      <trkpt lon="-77.0772744833" lat="38.9219057145">
        <time>2014-04-13T19:37:47.000-05:00</time>
        <type>place</type>
      </trkpt>
      <trkpt lon="-77.0772744833" lat="38.9219057145">
        <time>2014-04-14T00:00:00.000-05:00</time>
        <type>place</type>
      </trkpt>
    </trkseg>
  </trk>
  <trk>
    <name>4/14/14</name>
    <trkseg>
      <trkpt lon="-77.0772744833" lat="38.9219057145">
        <time>2014-04-14T00:00:00.000-05:00</time>
        <type>place</type>
      </trkpt>
      <trkpt lon="-77.0772744833" lat="38.9219057145">
        <time>2014-04-14T10:32:49.000-05:00</time>
        <type>place</type>
      </trkpt>
    </trkseg>
    <trkseg>
      <trkpt lon="-77.0259120873" lat="38.8988141904">
        <time>2014-04-14T10:55:14.000-05:00</time>
        <type>place</type>
      </trkpt>
      <trkpt lon="-77.0259120873" lat="38.8988141904">
        <time>2014-04-14T11:22:15.000-05:00</time>
        <type>place</type>
      </trkpt>
    </trkseg>
    <trkseg>
      <trkpt lon="-77.03193062942098" lat="38.89833630275513">
        <time>2014-04-14T11:37:28.000-05:00</time>
        <type>place</type>
      </trkpt>
      <trkpt lon="-77.03193062942098" lat="38.89833630275513">
        <time>2014-04-14T12:52:09.000-05:00</time>
        <type>place</type>
      </trkpt>
    </trkseg>
    <trkseg>
      <trkpt lon="-77.032106" lat="38.901567">
        <time>2014-04-14T12:58:59.000-05:00</time>
        <type>place</type>
      </trkpt>
      <trkpt lon="-77.032106" lat="38.901567">
        <time>2014-04-14T16:23:19.000-05:00</time>
        <type>place</type>
      </trkpt>
    </trkseg>
    <trkseg>
      <trkpt lon="-77.03193062942098" lat="38.89833630275513">
        <time>2014-04-14T16:25:57.000-05:00</time>
        <type>place</type>
      </trkpt>
      <trkpt lon="-77.03193062942098" lat="38.89833630275513">
        <time>2014-04-14T17:15:44.000-05:00</time>
        <type>place</type>
      </trkpt>
    </trkseg>
    <trkseg>
      <trkpt lon="-77.05326165317148" lat="38.90410567190644">
        <time>2014-04-14T17:49:30.000-05:00</time>
        <type>place</type>
      </trkpt>
      <trkpt lon="-77.05326165317148" lat="38.90410567190644">
        <time>2014-04-14T18:17:39.000-05:00</time>
        <type>place</type>
      </trkpt>
    </trkseg>
    <trkseg>
      <trkpt lon="-77.0772744833" lat="38.9219057145">
        <time>2014-04-14T18:43:57.000-05:00</time>
        <type>place</type>
      </trkpt>
      <trkpt lon="-77.0772744833" lat="38.9219057145">
        <time>2014-04-15T00:00:00.000-05:00</time>
        <type>place</type>
      </trkpt>
    </trkseg>
  </trk>
  <trk>
    <name>4/15/14</name>
    <trkseg>
      <trkpt lon="-77.0772744833" lat="38.9219057145">
        <time>2014-04-15T00:00:00.000-05:00</time>
        <type>place</type>
      </trkpt>
      <trkpt lon="-77.0772744833" lat="38.9219057145">
        <time>2014-04-15T10:22:32.000-05:00</time>
        <type>place</type>
      </trkpt>
    </trkseg>
    <trkseg>
      <trkpt lon="-77.07219441609172" lat="38.92117412899746">
        <time>2014-04-15T10:30:34.000-05:00</time>
        <type>place</type>
      </trkpt>
      <trkpt lon="-77.07219441609172" lat="38.92117412899746">
        <time>2014-04-15T10:56:31.000-05:00</time>
        <type>place</type>
      </trkpt>
    </trkseg>
    <trkseg>
      <trkpt lon="-77.0772744833" lat="38.9219057145">
        <time>2014-04-15T11:07:43.000-05:00</time>
        <type>place</type>
      </trkpt>
      <trkpt lon="-77.0772744833" lat="38.9219057145">
        <time>2014-04-15T20:27:53.000-05:00</time>
        <type>place</type>
      </trkpt>
    </trkseg>
  </trk>
  <trk>
    <name>4/17/14</name>
    <trkseg>
      <trkpt lon="-77.0721173286438" lat="38.92081351829113">
        <time>2014-04-17T08:40:11.000-05:00</time>
        <type>place</type>
      </trkpt>
      <trkpt lon="-77.0721173286438" lat="38.92081351829113">
        <time>2014-04-17T09:02:32.000-05:00</time>
        <type>place</type>
      </trkpt>
    </trkseg>
    <trkseg>
      <trkpt lon="-77.0772744833" lat="38.9219057145">
        <time>2014-04-17T09:12:14.000-05:00</time>
        <type>place</type>
      </trkpt>
      <trkpt lon="-77.0772744833" lat="38.9219057145">
        <time>2014-04-17T17:43:28.000-05:00</time>
        <type>place</type>
      </trkpt>
    </trkseg>
    <trkseg>
      <trkpt lon="-77.03282833099365" lat="38.90220518091243">
        <time>2014-04-17T18:28:34.000-05:00</time>
        <type>place</type>
      </trkpt>
      <trkpt lon="-77.03282833099365" lat="38.90220518091243">
        <time>2014-04-17T18:31:56.000-05:00</time>
        <type>place</type>
      </trkpt>
    </trkseg>
    <trkseg>
      <trkpt lon="-77.032106" lat="38.901567">
        <time>2014-04-17T18:38:43.000-05:00</time>
        <type>place</type>
      </trkpt>
      <trkpt lon="-77.032106" lat="38.901567">
        <time>2014-04-17T22:18:59.000-05:00</time>
        <type>place</type>
      </trkpt>
    </trkseg>
    <trkseg>
      <trkpt lon="-77.0303438061" lat="38.9050908726">
        <time>2014-04-17T22:26:28.000-05:00</time>
        <type>place</type>
      </trkpt>
      <trkpt lon="-77.0303438061" lat="38.9050908726">
        <time>2014-04-17T22:31:29.000-05:00</time>
        <type>place</type>
      </trkpt>
    </trkseg>
    <trkseg>
      <trkpt lon="-77.0772744833" lat="38.9219057145">
        <time>2014-04-17T22:45:11.000-05:00</time>
        <type>place</type>
      </trkpt>
      <trkpt lon="-77.0772744833" lat="38.9219057145">
        <time>2014-04-18T00:00:00.000-05:00</time>
        <type>place</type>
      </trkpt>
    </trkseg>
  </trk>
  <trk>
    <name>4/18/14</name>
    <trkseg>
      <trkpt lon="-77.0772744833" lat="38.9219057145">
        <time>2014-04-18T00:00:00.000-05:00</time>
        <type>place</type>
      </trkpt>
      <trkpt lon="-77.0772744833" lat="38.9219057145">
        <time>2014-04-18T18:47:47.000-05:00</time>
        <type>place</type>
      </trkpt>
    </trkseg>
    <trkseg>
      <trkpt lon="-77.02214777469635" lat="38.89588441602569">
        <time>2014-04-18T19:05:38.000-05:00</time>
        <type>place</type>
      </trkpt>
      <trkpt lon="-77.02214777469635" lat="38.89588441602569">
        <time>2014-04-18T21:31:35.000-05:00</time>
        <type>place</type>
      </trkpt>
    </trkseg>
    <trkseg>
      <trkpt lon="-77.0772744833" lat="38.9219057145">
        <time>2014-04-18T22:08:47.000-05:00</time>
        <type>place</type>
      </trkpt>
      <trkpt lon="-77.0772744833" lat="38.9219057145">
        <time>2014-04-19T00:00:00.000-05:00</time>
        <type>place</type>
      </trkpt>
    </trkseg>
  </trk>
  <trk>
    <name>4/19/14</name>
    <trkseg>
      <trkpt lon="-77.0772744833" lat="38.9219057145">
        <time>2014-04-19T00:00:00.000-05:00</time>
        <type>place</type>
      </trkpt>
      <trkpt lon="-77.0772744833" lat="38.9219057145">
        <time>2014-04-19T11:25:20.000-05:00</time>
        <type>place</type>
      </trkpt>
    </trkseg>
    <trkseg>
      <trkpt lon="-77.0675233368569" lat="38.91509131242815">
        <time>2014-04-19T11:44:52.000-05:00</time>
        <type>place</type>
      </trkpt>
      <trkpt lon="-77.0675233368569" lat="38.91509131242815">
        <time>2014-04-19T11:48:32.000-05:00</time>
        <type>place</type>
      </trkpt>
    </trkseg>
    <trkseg>
      <trkpt lon="-77.06553250551224" lat="38.90502721656731">
        <time>2014-04-19T12:12:54.000-05:00</time>
        <type>place</type>
      </trkpt>
      <trkpt lon="-77.06553250551224" lat="38.90502721656731">
        <time>2014-04-19T13:57:08.000-05:00</time>
        <type>place</type>
      </trkpt>
    </trkseg>
    <trkseg>
      <trkpt lon="-77.06318935763366" lat="38.90446093107843">
        <time>2014-04-19T13:57:42.000-05:00</time>
        <type>place</type>
      </trkpt>
      <trkpt lon="-77.06318935763366" lat="38.90446093107843">
        <time>2014-04-19T14:16:32.000-05:00</time>
        <type>place</type>
      </trkpt>
    </trkseg>
    <trkseg>
      <trkpt lon="-77.060355" lat="38.90536">
        <time>2014-04-19T14:39:35.000-05:00</time>
        <type>place</type>
      </trkpt>
      <trkpt lon="-77.060355" lat="38.90536">
        <time>2014-04-19T14:57:19.000-05:00</time>
        <type>place</type>
      </trkpt>
    </trkseg>
    <trkseg>
      <trkpt lon="-77.06227307487663" lat="38.90529562790965">
        <time>2014-04-19T15:01:05.000-05:00</time>
        <type>place</type>
      </trkpt>
      <trkpt lon="-77.06227307487663" lat="38.90529562790965">
        <time>2014-04-19T15:58:29.000-05:00</time>
        <type>place</type>
      </trkpt>
    </trkseg>
    <trkseg>
      <trkpt lon="-77.06379646138976" lat="38.9085947611904">
        <time>2014-04-19T16:04:03.000-05:00</time>
        <type>place</type>
      </trkpt>
      <trkpt lon="-77.06379646138976" lat="38.9085947611904">
        <time>2014-04-19T16:11:32.000-05:00</time>
        <type>place</type>
      </trkpt>
    </trkseg>
    <trkseg>
      <trkpt lon="-77.0649548316" lat="38.9107293958">
        <time>2014-04-19T16:15:33.000-05:00</time>
        <type>place</type>
      </trkpt>
      <trkpt lon="-77.0649548316" lat="38.9107293958">
        <time>2014-04-19T16:19:28.000-05:00</time>
        <type>place</type>
      </trkpt>
    </trkseg>
    <trkseg>
      <trkpt lon="-77.06624170943276" lat="38.91343030545362">
        <time>2014-04-19T16:26:10.000-05:00</time>
        <type>place</type>
      </trkpt>
      <trkpt lon="-77.06624170943276" lat="38.91343030545362">
        <time>2014-04-19T16:32:49.000-05:00</time>
        <type>place</type>
      </trkpt>
    </trkseg>
    <trkseg>
      <trkpt lon="-77.06758975982666" lat="38.91567980755536">
        <time>2014-04-19T16:38:38.000-05:00</time>
        <type>place</type>
      </trkpt>
      <trkpt lon="-77.06758975982666" lat="38.91567980755536">
        <time>2014-04-19T17:12:04.000-05:00</time>
        <type>place</type>
      </trkpt>
    </trkseg>
    <trkseg>
      <trkpt lon="-77.0772744833" lat="38.9219057145">
        <time>2014-04-19T17:31:15.000-05:00</time>
        <type>place</type>
      </trkpt>
      <trkpt lon="-77.0772744833" lat="38.9219057145">
        <time>2014-04-20T00:00:00.000-05:00</time>
        <type>place</type>
      </trkpt>
    </trkseg>
  </trk>
  <trk>
    <name>4/20/14</name>
    <trkseg>
      <trkpt lon="-77.0772744833" lat="38.9219057145">
        <time>2014-04-20T00:00:00.000-05:00</time>
        <type>place</type>
      </trkpt>
      <trkpt lon="-77.0772744833" lat="38.9219057145">
        <time>2014-04-20T10:33:24.000-05:00</time>
        <type>place</type>
      </trkpt>
    </trkseg>
    <trkseg>
      <trkpt lon="-77.0422030501043" lat="38.92124831604843">
        <time>2014-04-20T10:54:30.000-05:00</time>
        <type>place</type>
      </trkpt>
      <trkpt lon="-77.0422030501043" lat="38.92124831604843">
        <time>2014-04-20T12:41:59.000-05:00</time>
        <type>place</type>
      </trkpt>
    </trkseg>
    <trkseg>
      <trkpt lon="-77.04085350036621" lat="38.91754968991449">
        <time>2014-04-20T12:51:46.000-05:00</time>
        <type>place</type>
      </trkpt>
      <trkpt lon="-77.04085350036621" lat="38.91754968991449">
        <time>2014-04-20T13:32:03.000-05:00</time>
        <type>place</type>
      </trkpt>
    </trkseg>
    <trkseg>
      <trkpt lon="-77.06318935763366" lat="38.90446093107843">
        <time>2014-04-20T14:44:48.000-05:00</time>
        <type>place</type>
      </trkpt>
      <trkpt lon="-77.06318935763366" lat="38.90446093107843">
        <time>2014-04-20T14:50:35.000-05:00</time>
        <type>place</type>
      </trkpt>
    </trkseg>
    <trkseg>
      <trkpt lon="-77.06002449871039" lat="38.90138513466971">
        <time>2014-04-20T15:06:20.000-05:00</time>
        <type>place</type>
      </trkpt>
      <trkpt lon="-77.06002449871039" lat="38.90138513466971">
        <time>2014-04-20T18:54:08.000-05:00</time>
        <type>place</type>
      </trkpt>
    </trkseg>
    <trkseg>
      <trkpt lon="-77.0772744833" lat="38.9219057145">
        <time>2014-04-20T19:20:52.000-05:00</time>
        <type>place</type>
      </trkpt>
      <trkpt lon="-77.0772744833" lat="38.9219057145">
        <time>2014-04-21T00:00:00.000-05:00</time>
        <type>place</type>
      </trkpt>
    </trkseg>
  </trk>
  <trk>
    <name>4/21/14</name>
    <trkseg>
      <trkpt lon="-77.0772744833" lat="38.9219057145">
        <time>2014-04-21T00:00:00.000-05:00</time>
        <type>place</type>
      </trkpt>
      <trkpt lon="-77.0772744833" lat="38.9219057145">
        <time>2014-04-21T08:04:50.000-05:00</time>
        <type>place</type>
      </trkpt>
    </trkseg>
    <trkseg>
      <trkpt lon="-77.0421389873" lat="38.848302902">
        <time>2014-04-21T08:26:09.000-05:00</time>
        <type>place</type>
      </trkpt>
      <trkpt lon="-77.0421389873" lat="38.848302902">
        <time>2014-04-21T09:22:51.000-05:00</time>
        <type>place</type>
      </trkpt>
    </trkseg>
    <trkseg>
      <trkpt lon="-77.0423622654" lat="38.8468362848">
        <time>2014-04-21T09:25:02.000-05:00</time>
        <type>place</type>
      </trkpt>
      <trkpt lon="-77.0423622654" lat="38.8468362848">
        <time>2014-04-21T10:37:46.000-05:00</time>
        <type>place</type>
      </trkpt>
    </trkseg>
    <trkseg>
      <trkpt lon="-71.12017" lat="42.374494">
        <time>2014-04-21T12:46:16.000-05:00</time>
        <type>place</type>
      </trkpt>
      <trkpt lon="-71.12017" lat="42.374494">
        <time>2014-04-21T13:32:13.000-05:00</time>
        <type>place</type>
      </trkpt>
    </trkseg>
    <trkseg>
      <trkpt lon="-71.117205" lat="42.378716">
        <time>2014-04-21T13:45:55.000-05:00</time>
        <type>place</type>
      </trkpt>
      <trkpt lon="-71.117205" lat="42.378716">
        <time>2014-04-21T18:51:45.000-05:00</time>
        <type>place</type>
      </trkpt>
    </trkseg>
    <trkseg>
      <trkpt lon="-71.1114458017" lat="42.3754311174">
        <time>2014-04-21T19:03:52.000-05:00</time>
        <type>place</type>
      </trkpt>
      <trkpt lon="-71.1114458017" lat="42.3754311174">
        <time>2014-04-22T00:00:00.000-05:00</time>
        <type>place</type>
      </trkpt>
    </trkseg>
  </trk>
  <trk>
    <name>4/22/14</name>
    <trkseg>
      <trkpt lon="-71.1114458017" lat="42.3754311174">
        <time>2014-04-22T00:00:00.000-05:00</time>
        <type>place</type>
      </trkpt>
      <trkpt lon="-71.1114458017" lat="42.3754311174">
        <time>2014-04-22T07:58:36.000-05:00</time>
        <type>place</type>
      </trkpt>
    </trkseg>
    <trkseg>
      <trkpt lon="-71.117205" lat="42.378716">
        <time>2014-04-22T08:14:56.000-05:00</time>
        <type>place</type>
      </trkpt>
      <trkpt lon="-71.117205" lat="42.378716">
        <time>2014-04-22T11:13:20.000-05:00</time>
        <type>place</type>
      </trkpt>
    </trkseg>
    <trkseg>
      <trkpt lon="-71.12299694115246" lat="42.37210143005068">
        <time>2014-04-22T11:30:33.000-05:00</time>
        <type>place</type>
      </trkpt>
      <trkpt lon="-71.12299694115246" lat="42.37210143005068">
        <time>2014-04-22T13:00:00.000-05:00</time>
        <type>place</type>
      </trkpt>
    </trkseg>
    <trkseg>
      <trkpt lon="-71.12017" lat="42.374494">
        <time>2014-04-22T13:07:56.000-05:00</time>
        <type>place</type>
      </trkpt>
      <trkpt lon="-71.12017" lat="42.374494">
        <time>2014-04-22T13:10:49.000-05:00</time>
        <type>place</type>
      </trkpt>
    </trkseg>
    <trkseg>
      <trkpt lon="-71.117205" lat="42.378716">
        <time>2014-04-22T13:20:56.000-05:00</time>
        <type>place</type>
      </trkpt>
      <trkpt lon="-71.117205" lat="42.378716">
        <time>2014-04-22T13:45:25.000-05:00</time>
        <type>place</type>
      </trkpt>
    </trkseg>
    <trkseg>
      <trkpt lon="-71.117205" lat="42.378716">
        <time>2014-04-22T13:55:37.000-05:00</time>
        <type>place</type>
      </trkpt>
      <trkpt lon="-71.117205" lat="42.378716">
        <time>2014-04-22T17:47:18.000-05:00</time>
        <type>place</type>
      </trkpt>
    </trkseg>
    <trkseg>
      <trkpt lon="-71.12097185013617" lat="42.37169409933257">
        <time>2014-04-22T17:59:23.000-05:00</time>
        <type>place</type>
      </trkpt>
      <trkpt lon="-71.12097185013617" lat="42.37169409933257">
        <time>2014-04-22T20:21:41.000-05:00</time>
        <type>place</type>
      </trkpt>
    </trkseg>
    <trkseg>
      <trkpt lon="-71.1194879958" lat="42.3735409474">
        <time>2014-04-22T20:27:31.000-05:00</time>
        <type>place</type>
      </trkpt>
      <trkpt lon="-71.1194879958" lat="42.3735409474">
        <time>2014-04-22T20:33:49.000-05:00</time>
        <type>place</type>
      </trkpt>
    </trkseg>
    <trkseg>
      <trkpt lon="-71.1239003393" lat="42.3681939793">
        <time>2014-04-22T20:40:56.000-05:00</time>
        <type>place</type>
      </trkpt>
      <trkpt lon="-71.1239003393" lat="42.3681939793">
        <time>2014-04-22T20:50:40.000-05:00</time>
        <type>place</type>
      </trkpt>
    </trkseg>
    <trkseg>
      <trkpt lon="-71.11702028202814" lat="42.36972025201748">
        <time>2014-04-22T21:00:23.000-05:00</time>
        <type>place</type>
      </trkpt>
      <trkpt lon="-71.11702028202814" lat="42.36972025201748">
        <time>2014-04-22T22:15:03.000-05:00</time>
        <type>place</type>
      </trkpt>
    </trkseg>
    <trkseg>
      <trkpt lon="-71.1114458017" lat="42.3754311174">
        <time>2014-04-22T22:29:43.000-05:00</time>
        <type>place</type>
      </trkpt>
      <trkpt lon="-71.1114458017" lat="42.3754311174">
        <time>2014-04-23T00:00:00.000-05:00</time>
        <type>place</type>
      </trkpt>
    </trkseg>
  </trk>
  <trk>
    <name>4/23/14</name>
    <trkseg>
      <trkpt lon="-71.1114458017" lat="42.3754311174">
        <time>2014-04-23T00:00:00.000-05:00</time>
        <type>place</type>
      </trkpt>
      <trkpt lon="-71.1114458017" lat="42.3754311174">
        <time>2014-04-23T07:59:22.000-05:00</time>
        <type>place</type>
      </trkpt>
    </trkseg>
    <trkseg>
      <trkpt lon="-71.1132681841" lat="42.37582268">
        <time>2014-04-23T08:02:20.000-05:00</time>
        <type>place</type>
      </trkpt>
      <trkpt lon="-71.1132681841" lat="42.37582268">
        <time>2014-04-23T08:12:27.000-05:00</time>
        <type>place</type>
      </trkpt>
    </trkseg>
    <trkseg>
      <trkpt lon="-71.117205" lat="42.378716">
        <time>2014-04-23T08:23:41.000-05:00</time>
        <type>place</type>
      </trkpt>
      <trkpt lon="-71.117205" lat="42.378716">
        <time>2014-04-23T08:59:11.000-05:00</time>
        <type>place</type>
      </trkpt>
    </trkseg>
    <trkseg>
      <trkpt lon="-71.117205" lat="42.378716">
        <time>2014-04-23T09:04:26.000-05:00</time>
        <type>place</type>
      </trkpt>
      <trkpt lon="-71.117205" lat="42.378716">
        <time>2014-04-23T11:19:46.000-05:00</time>
        <type>place</type>
      </trkpt>
    </trkseg>
    <trkseg>
      <trkpt lon="-71.120141" lat="42.3743468">
        <time>2014-04-23T11:31:01.000-05:00</time>
        <type>place</type>
      </trkpt>
      <trkpt lon="-71.120141" lat="42.3743468">
        <time>2014-04-23T12:18:48.000-05:00</time>
        <type>place</type>
      </trkpt>
    </trkseg>
    <trkseg>
      <trkpt lon="-71.1168444121" lat="42.3760442772">
        <time>2014-04-23T12:25:30.000-05:00</time>
        <type>place</type>
      </trkpt>
      <trkpt lon="-71.1168444121" lat="42.3760442772">
        <time>2014-04-23T13:15:33.000-05:00</time>
        <type>place</type>
      </trkpt>
    </trkseg>
    <trkseg>
      <trkpt lon="-71.117205" lat="42.378716">
        <time>2014-04-23T13:23:41.000-05:00</time>
        <type>place</type>
      </trkpt>
      <trkpt lon="-71.117205" lat="42.378716">
        <time>2014-04-23T20:19:52.000-05:00</time>
        <type>place</type>
      </trkpt>
    </trkseg>
    <trkseg>
      <trkpt lon="-71.1114458017" lat="42.3754311174">
        <time>2014-04-23T20:33:42.000-05:00</time>
        <type>place</type>
      </trkpt>
      <trkpt lon="-71.1114458017" lat="42.3754311174">
        <time>2014-04-24T00:00:00.000-05:00</time>
        <type>place</type>
      </trkpt>
    </trkseg>
  </trk>
  <trk>
    <name>4/24/14</name>
    <trkseg>
      <trkpt lon="-71.1114458017" lat="42.3754311174">
        <time>2014-04-24T00:00:00.000-05:00</time>
        <type>place</type>
      </trkpt>
      <trkpt lon="-71.1114458017" lat="42.3754311174">
        <time>2014-04-24T09:35:16.000-05:00</time>
        <type>place</type>
      </trkpt>
    </trkseg>
    <trkseg>
      <trkpt lon="-71.117205" lat="42.378716">
        <time>2014-04-24T09:52:21.000-05:00</time>
        <type>place</type>
      </trkpt>
      <trkpt lon="-71.117205" lat="42.378716">
        <time>2014-04-24T12:58:41.000-05:00</time>
        <type>place</type>
      </trkpt>
    </trkseg>
    <trkseg>
      <trkpt lon="-71.11979826" lat="42.38213717937469">
        <time>2014-04-24T13:08:35.000-05:00</time>
        <type>place</type>
      </trkpt>
      <trkpt lon="-71.11979826" lat="42.38213717937469">
        <time>2014-04-24T14:16:10.000-05:00</time>
        <type>place</type>
      </trkpt>
    </trkseg>
    <trkseg>
      <trkpt lon="-71.1196048125" lat="42.3810235564">
        <time>2014-04-24T14:19:07.000-05:00</time>
        <type>place</type>
      </trkpt>
      <trkpt lon="-71.1196048125" lat="42.3810235564">
        <time>2014-04-24T14:21:10.000-05:00</time>
        <type>place</type>
      </trkpt>
    </trkseg>
    <trkseg>
      <trkpt lon="-71.117205" lat="42.378716">
        <time>2014-04-24T14:27:43.000-05:00</time>
        <type>place</type>
      </trkpt>
      <trkpt lon="-71.117205" lat="42.378716">
        <time>2014-04-24T17:34:41.000-05:00</time>
        <type>place</type>
      </trkpt>
    </trkseg>
    <trkseg>
      <trkpt lon="-71.1114458017" lat="42.3754311174">
        <time>2014-04-24T17:46:44.000-05:00</time>
        <type>place</type>
      </trkpt>
      <trkpt lon="-71.1114458017" lat="42.3754311174">
        <time>2014-04-25T00:00:00.000-05:00</time>
        <type>place</type>
      </trkpt>
    </trkseg>
  </trk>
  <trk>
    <name>4/25/14</name>
    <trkseg>
      <trkpt lon="-71.1114458017" lat="42.3754311174">
        <time>2014-04-25T00:00:00.000-05:00</time>
        <type>place</type>
      </trkpt>
      <trkpt lon="-71.1114458017" lat="42.3754311174">
        <time>2014-04-25T08:38:48.000-05:00</time>
        <type>place</type>
      </trkpt>
    </trkseg>
    <trkseg>
      <trkpt lon="-71.117205" lat="42.378716">
        <time>2014-04-25T08:54:35.000-05:00</time>
        <type>place</type>
      </trkpt>
      <trkpt lon="-71.117205" lat="42.378716">
        <time>2014-04-25T11:04:04.000-05:00</time>
        <type>place</type>
      </trkpt>
    </trkseg>
    <trkseg>
      <trkpt lon="-71.119043" lat="42.373776">
        <time>2014-04-25T11:18:41.000-05:00</time>
        <type>place</type>
      </trkpt>
      <trkpt lon="-71.119043" lat="42.373776">
        <time>2014-04-25T11:25:05.000-05:00</time>
        <type>place</type>
      </trkpt>
    </trkseg>
    <trkseg>
      <trkpt lon="-71.12325225275964" lat="42.37317592010315">
        <time>2014-04-25T11:27:45.000-05:00</time>
        <type>place</type>
      </trkpt>
      <trkpt lon="-71.12325225275964" lat="42.37317592010315">
        <time>2014-04-25T13:16:51.000-05:00</time>
        <type>place</type>
      </trkpt>
    </trkseg>
    <trkseg>
      <trkpt lon="-71.11951231956482" lat="42.37313766800413">
        <time>2014-04-25T13:18:22.000-05:00</time>
        <type>place</type>
      </trkpt>
      <trkpt lon="-71.11951231956482" lat="42.37313766800413">
        <time>2014-04-25T14:42:40.000-05:00</time>
        <type>place</type>
      </trkpt>
    </trkseg>
    <trkseg>
      <trkpt lon="-71.115435" lat="42.375886">
        <time>2014-04-25T15:03:42.000-05:00</time>
        <type>place</type>
      </trkpt>
      <trkpt lon="-71.115435" lat="42.375886">
        <time>2014-04-25T15:16:05.000-05:00</time>
        <type>place</type>
      </trkpt>
    </trkseg>
    <trkseg>
      <trkpt lon="-71.1114458017" lat="42.3754311174">
        <time>2014-04-25T15:22:17.000-05:00</time>
        <type>place</type>
      </trkpt>
      <trkpt lon="-71.1114458017" lat="42.3754311174">
        <time>2014-04-25T19:13:54.000-05:00</time>
        <type>place</type>
      </trkpt>
    </trkseg>
    <trkseg>
      <trkpt lon="-71.06745121566072" lat="42.34099437360112">
        <time>2014-04-25T20:00:34.000-05:00</time>
        <type>place</type>
      </trkpt>
      <trkpt lon="-71.06745121566072" lat="42.34099437360112">
        <time>2014-04-25T22:45:40.000-05:00</time>
        <type>place</type>
      </trkpt>
    </trkseg>
    <trkseg>
      <trkpt lon="-71.11902218263484" lat="42.37360433115195">
        <time>2014-04-25T23:34:30.000-05:00</time>
        <type>place</type>
      </trkpt>
      <trkpt lon="-71.11902218263484" lat="42.37360433115195">
        <time>2014-04-25T23:37:45.000-05:00</time>
        <type>place</type>
      </trkpt>
    </trkseg>
    <trkseg>
      <trkpt lon="-71.1114458017" lat="42.3754311174">
        <time>2014-04-25T23:59:24.000-05:00</time>
        <type>place</type>
      </trkpt>
      <trkpt lon="-71.1114458017" lat="42.3754311174">
        <time>2014-04-26T00:00:00.000-05:00</time>
        <type>place</type>
      </trkpt>
    </trkseg>
  </trk>
  <trk>
    <name>4/26/14</name>
    <trkseg>
      <trkpt lon="-71.1114458017" lat="42.3754311174">
        <time>2014-04-26T00:00:00.000-05:00</time>
        <type>place</type>
      </trkpt>
      <trkpt lon="-71.1114458017" lat="42.3754311174">
        <time>2014-04-26T11:02:59.000-05:00</time>
        <type>place</type>
      </trkpt>
    </trkseg>
    <trkseg>
      <trkpt lon="-71.021521119" lat="42.3645749042">
        <time>2014-04-26T11:54:39.000-05:00</time>
        <type>place</type>
      </trkpt>
      <trkpt lon="-71.021521119" lat="42.3645749042">
        <time>2014-04-26T12:03:05.000-05:00</time>
        <type>place</type>
      </trkpt>
    </trkseg>
    <trkseg>
      <trkpt lon="-71.0244723755" lat="42.3629856017">
        <time>2014-04-26T12:04:31.000-05:00</time>
        <type>place</type>
      </trkpt>
      <trkpt lon="-71.0244723755" lat="42.3629856017">
        <time>2014-04-26T12:10:02.000-05:00</time>
        <type>place</type>
      </trkpt>
    </trkseg>
    <trkseg>
      <trkpt lon="-71.01667642593384" lat="42.36650312404415">
        <time>2014-04-26T12:13:15.000-05:00</time>
        <type>place</type>
      </trkpt>
      <trkpt lon="-71.01667642593384" lat="42.36650312404415">
        <time>2014-04-26T12:32:55.000-05:00</time>
        <type>place</type>
      </trkpt>
    </trkseg>
    <trkseg>
      <trkpt lon="-71.01667642593384" lat="42.36650312404415">
        <time>2014-04-26T12:34:31.000-05:00</time>
        <type>place</type>
      </trkpt>
      <trkpt lon="-71.01667642593384" lat="42.36650312404415">
        <time>2014-04-26T13:36:23.000-05:00</time>
        <type>place</type>
      </trkpt>
    </trkseg>
    <trkseg>
      <trkpt lon="-73.7906573509" lat="40.639871097">
        <time>2014-04-26T13:49:15.000-05:00</time>
        <type>place</type>
      </trkpt>
      <trkpt lon="-73.7906573509" lat="40.639871097">
        <time>2014-04-26T13:53:56.000-05:00</time>
        <type>place</type>
      </trkpt>
    </trkseg>
    <trkseg>
      <trkpt lon="-73.7845230102539" lat="40.64508935597635">
        <time>2014-04-26T14:20:01.000-05:00</time>
        <type>place</type>
      </trkpt>
      <trkpt lon="-73.7845230102539" lat="40.64508935597635">
        <time>2014-04-26T15:10:25.000-05:00</time>
        <type>place</type>
      </trkpt>
    </trkseg>
    <trkseg>
      <trkpt lon="-73.7845230102539" lat="40.64508935597635">
        <time>2014-04-26T15:10:25.000-05:00</time>
        <type>place</type>
      </trkpt>
      <trkpt lon="-73.7845230102539" lat="40.64508935597635">
        <time>2014-04-26T15:22:47.000-05:00</time>
        <type>place</type>
      </trkpt>
    </trkseg>
    <trkseg>
      <trkpt lon="-122.3862791061401" lat="37.61642405271961">
        <time>2014-04-26T22:38:11.000-05:00</time>
        <type>place</type>
      </trkpt>
      <trkpt lon="-122.3862791061401" lat="37.61642405271961">
        <time>2014-04-26T22:56:15.000-05:00</time>
        <type>place</type>
      </trkpt>
    </trkseg>
    <trkseg>
      <trkpt lon="-122.3862791061401" lat="37.61642405271961">
        <time>2014-04-26T23:10:01.000-05:00</time>
        <type>place</type>
      </trkpt>
      <trkpt lon="-122.3862791061401" lat="37.61642405271961">
        <time>2014-04-26T23:26:53.000-05:00</time>
        <type>place</type>
      </trkpt>
    </trkseg>
  </trk>
  <trk>
    <name>4/27/14</name>
    <trkseg>
      <trkpt lon="-122.0274591675424" lat="37.39623913829737">
        <time>2014-04-27T00:08:22.000-05:00</time>
        <type>place</type>
      </trkpt>
      <trkpt lon="-122.0274591675424" lat="37.39623913829737">
        <time>2014-04-27T10:04:33.000-05:00</time>
        <type>place</type>
      </trkpt>
    </trkseg>
    <trkseg>
      <trkpt lon="-122.0299594399" lat="37.3923919234">
        <time>2014-04-27T10:13:06.000-05:00</time>
        <type>place</type>
      </trkpt>
      <trkpt lon="-122.0299594399" lat="37.3923919234">
        <time>2014-04-27T10:18:58.000-05:00</time>
        <type>place</type>
      </trkpt>
    </trkseg>
    <trkseg>
      <trkpt lon="-122.0278810342598" lat="37.39608699705354">
        <time>2014-04-27T10:28:13.000-05:00</time>
        <type>place</type>
      </trkpt>
      <trkpt lon="-122.0278810342598" lat="37.39608699705354">
        <time>2014-04-27T11:39:50.000-05:00</time>
        <type>place</type>
      </trkpt>
    </trkseg>
    <trkseg>
      <trkpt lon="-122.1698141098022" lat="37.42893313778773">
        <time>2014-04-27T12:18:59.000-05:00</time>
        <type>place</type>
      </trkpt>
      <trkpt lon="-122.1698141098022" lat="37.42893313778773">
        <time>2014-04-27T12:29:55.000-05:00</time>
        <type>place</type>
      </trkpt>
    </trkseg>
    <trkseg>
      <trkpt lon="-122.170826355" lat="37.4241936853">
        <time>2014-04-27T12:55:47.000-05:00</time>
        <type>place</type>
      </trkpt>
      <trkpt lon="-122.170826355" lat="37.4241936853">
        <time>2014-04-27T12:59:18.000-05:00</time>
        <type>place</type>
      </trkpt>
    </trkseg>
    <trkseg>
      <trkpt lon="-122.3915585347" lat="37.7890276868">
        <time>2014-04-27T14:22:28.000-05:00</time>
        <type>place</type>
      </trkpt>
      <trkpt lon="-122.3915585347" lat="37.7890276868">
        <time>2014-04-27T14:44:04.000-05:00</time>
        <type>place</type>
      </trkpt>
    </trkseg>
    <trkseg>
      <trkpt lon="-122.3936283588409" lat="37.795427908882">
        <time>2014-04-27T14:56:43.000-05:00</time>
        <type>place</type>
      </trkpt>
      <trkpt lon="-122.3936283588409" lat="37.795427908882">
        <time>2014-04-27T15:13:17.000-05:00</time>
        <type>place</type>
      </trkpt>
    </trkseg>
    <trkseg>
      <trkpt lon="-122.5155428051949" lat="37.89656642953388">
        <time>2014-04-27T16:09:12.000-05:00</time>
        <type>place</type>
      </trkpt>
      <trkpt lon="-122.5155428051949" lat="37.89656642953388">
        <time>2014-04-27T16:38:48.000-05:00</time>
        <type>place</type>
      </trkpt>
    </trkseg>
    <trkseg>
      <trkpt lon="-122.3900020122528" lat="38.42254548224498">
        <time>2014-04-27T17:38:39.000-05:00</time>
        <type>place</type>
      </trkpt>
      <trkpt lon="-122.3900020122528" lat="38.42254548224498">
        <time>2014-04-27T19:15:14.000-05:00</time>
        <type>place</type>
      </trkpt>
    </trkseg>
    <trkseg>
      <trkpt lon="-122.469388101944" lat="38.50460958286393">
        <time>2014-04-27T19:40:46.000-05:00</time>
        <type>place</type>
      </trkpt>
      <trkpt lon="-122.469388101944" lat="38.50460958286393">
        <time>2014-04-27T20:10:34.000-05:00</time>
        <type>place</type>
      </trkpt>
    </trkseg>
    <trkseg>
      <trkpt lon="-122.0274591675424" lat="37.39623913829737">
        <time>2014-04-27T22:26:44.000-05:00</time>
        <type>place</type>
      </trkpt>
      <trkpt lon="-122.0274591675424" lat="37.39623913829737">
        <time>2014-04-28T00:00:00.000-05:00</time>
        <type>place</type>
      </trkpt>
    </trkseg>
  </trk>
  <trk>
    <name>4/28/14</name>
    <trkseg>
      <trkpt lon="-122.0274591675424" lat="37.39623913829737">
        <time>2014-04-28T00:00:00.000-05:00</time>
        <type>place</type>
      </trkpt>
      <trkpt lon="-122.0274591675424" lat="37.39623913829737">
        <time>2014-04-28T10:33:51.000-05:00</time>
        <type>place</type>
      </trkpt>
    </trkseg>
    <trkseg>
      <trkpt lon="-122.030288" lat="37.388271">
        <time>2014-04-28T10:46:55.000-05:00</time>
        <type>place</type>
      </trkpt>
      <trkpt lon="-122.030288" lat="37.388271">
        <time>2014-04-28T11:15:20.000-05:00</time>
        <type>place</type>
      </trkpt>
    </trkseg>
    <trkseg>
      <trkpt lon="-122.0274591675424" lat="37.39623913829737">
        <time>2014-04-28T11:18:29.000-05:00</time>
        <type>place</type>
      </trkpt>
      <trkpt lon="-122.0274591675424" lat="37.39623913829737">
        <time>2014-04-28T12:06:46.000-05:00</time>
        <type>place</type>
      </trkpt>
    </trkseg>
    <trkseg>
      <trkpt lon="-122.0678794384003" lat="37.38667126850424">
        <time>2014-04-28T12:30:35.000-05:00</time>
        <type>place</type>
      </trkpt>
      <trkpt lon="-122.0678794384003" lat="37.38667126850424">
        <time>2014-04-28T13:33:53.000-05:00</time>
        <type>place</type>
      </trkpt>
    </trkseg>
    <trkseg>
      <trkpt lon="-122.072889260147" lat="37.391611183987">
        <time>2014-04-28T13:45:41.000-05:00</time>
        <type>place</type>
      </trkpt>
      <trkpt lon="-122.072889260147" lat="37.391611183987">
        <time>2014-04-28T14:42:38.000-05:00</time>
        <type>place</type>
      </trkpt>
    </trkseg>
    <trkseg>
      <trkpt lon="-122.0274591675424" lat="37.39623913829737">
        <time>2014-04-28T14:49:03.000-05:00</time>
        <type>place</type>
      </trkpt>
      <trkpt lon="-122.0274591675424" lat="37.39623913829737">
        <time>2014-04-28T17:10:42.000-05:00</time>
        <type>place</type>
      </trkpt>
    </trkseg>
    <trkseg>
      <trkpt lon="-122.0575904846191" lat="37.37479547689328">
        <time>2014-04-28T17:20:22.000-05:00</time>
        <type>place</type>
      </trkpt>
      <trkpt lon="-122.0575904846191" lat="37.37479547689328">
        <time>2014-04-28T17:33:24.000-05:00</time>
        <type>place</type>
      </trkpt>
    </trkseg>
    <trkseg>
      <trkpt lon="-122.0274591675424" lat="37.39623913829737">
        <time>2014-04-28T17:43:26.000-05:00</time>
        <type>place</type>
      </trkpt>
      <trkpt lon="-122.0274591675424" lat="37.39623913829737">
        <time>2014-04-28T18:40:16.000-05:00</time>
        <type>place</type>
      </trkpt>
    </trkseg>
    <trkseg>
      <trkpt lon="-122.1608367164" lat="37.4431194221">
        <time>2014-04-28T18:58:55.000-05:00</time>
        <type>place</type>
      </trkpt>
      <trkpt lon="-122.1608367164" lat="37.4431194221">
        <time>2014-04-28T20:33:03.000-05:00</time>
        <type>place</type>
      </trkpt>
    </trkseg>
    <trkseg>
      <trkpt lon="-122.1627038223" lat="37.4450805938">
        <time>2014-04-28T20:42:12.000-05:00</time>
        <type>place</type>
      </trkpt>
      <trkpt lon="-122.1627038223" lat="37.4450805938">
        <time>2014-04-28T20:48:39.000-05:00</time>
        <type>place</type>
      </trkpt>
    </trkseg>
    <trkseg>
      <trkpt lon="-122.161212663" lat="37.4463045405">
        <time>2014-04-28T20:51:41.000-05:00</time>
        <type>place</type>
      </trkpt>
      <trkpt lon="-122.161212663" lat="37.4463045405">
        <time>2014-04-28T20:54:52.000-05:00</time>
        <type>place</type>
      </trkpt>
    </trkseg>
    <trkseg>
      <trkpt lon="-122.1617297912859" lat="37.44437571796183">
        <time>2014-04-28T21:08:49.000-05:00</time>
        <type>place</type>
      </trkpt>
      <trkpt lon="-122.1617297912859" lat="37.44437571796183">
        <time>2014-04-28T21:19:11.000-05:00</time>
        <type>place</type>
      </trkpt>
    </trkseg>
    <trkseg>
      <trkpt lon="-122.161212663" lat="37.4463045405">
        <time>2014-04-28T21:24:57.000-05:00</time>
        <type>place</type>
      </trkpt>
      <trkpt lon="-122.161212663" lat="37.4463045405">
        <time>2014-04-28T21:29:30.000-05:00</time>
        <type>place</type>
      </trkpt>
    </trkseg>
    <trkseg>
      <trkpt lon="-122.1617297912859" lat="37.44437571796183">
        <time>2014-04-28T21:34:28.000-05:00</time>
        <type>place</type>
      </trkpt>
      <trkpt lon="-122.1617297912859" lat="37.44437571796183">
        <time>2014-04-28T22:40:59.000-05:00</time>
        <type>place</type>
      </trkpt>
    </trkseg>
    <trkseg>
      <trkpt lon="-122.3862791061401" lat="37.61642405271961">
        <time>2014-04-28T23:19:11.000-05:00</time>
        <type>place</type>
      </trkpt>
      <trkpt lon="-122.3862791061401" lat="37.61642405271961">
        <time>2014-04-28T23:31:32.000-05:00</time>
        <type>place</type>
      </trkpt>
    </trkseg>
  </trk>
  <trk>
    <name>4/29/14</name>
    <trkseg>
      <trkpt lon="-122.0274591675424" lat="37.39623913829737">
        <time>2014-04-29T00:10:42.000-05:00</time>
        <type>place</type>
      </trkpt>
      <trkpt lon="-122.0274591675424" lat="37.39623913829737">
        <time>2014-04-29T11:19:53.000-05:00</time>
        <type>place</type>
      </trkpt>
    </trkseg>
    <trkseg>
      <trkpt lon="-122.0830371213933" lat="37.38802208328161">
        <time>2014-04-29T11:33:42.000-05:00</time>
        <type>place</type>
      </trkpt>
      <trkpt lon="-122.0830371213933" lat="37.38802208328161">
        <time>2014-04-29T12:45:48.000-05:00</time>
        <type>place</type>
      </trkpt>
    </trkseg>
    <trkseg>
      <trkpt lon="-122.0274591675424" lat="37.39623913829737">
        <time>2014-04-29T12:57:24.000-05:00</time>
        <type>place</type>
      </trkpt>
      <trkpt lon="-122.0274591675424" lat="37.39623913829737">
        <time>2014-04-29T15:12:19.000-05:00</time>
        <type>place</type>
      </trkpt>
    </trkseg>
    <trkseg>
      <trkpt lon="-122.1621108055115" lat="37.44563018608518">
        <time>2014-04-29T15:33:33.000-05:00</time>
        <type>place</type>
      </trkpt>
      <trkpt lon="-122.1621108055115" lat="37.44563018608518">
        <time>2014-04-29T17:04:33.000-05:00</time>
        <type>place</type>
      </trkpt>
    </trkseg>
    <trkseg>
      <trkpt lon="-122.383277" lat="37.60122">
        <time>2014-04-29T17:52:11.000-05:00</time>
        <type>place</type>
      </trkpt>
      <trkpt lon="-122.383277" lat="37.60122">
        <time>2014-04-29T18:06:03.000-05:00</time>
        <type>place</type>
      </trkpt>
    </trkseg>
    <trkseg>
      <trkpt lon="-122.3862791061401" lat="37.61642405271961">
        <time>2014-04-29T18:16:58.000-05:00</time>
        <type>place</type>
      </trkpt>
      <trkpt lon="-122.3862791061401" lat="37.61642405271961">
        <time>2014-04-29T18:33:38.000-05:00</time>
        <type>place</type>
      </trkpt>
    </trkseg>
    <trkseg>
      <trkpt lon="-122.3862791061401" lat="37.61642405271961">
        <time>2014-04-29T18:43:24.000-05:00</time>
        <type>place</type>
      </trkpt>
      <trkpt lon="-122.3862791061401" lat="37.61642405271961">
        <time>2014-04-29T19:56:53.000-05:00</time>
        <type>place</type>
      </trkpt>
    </trkseg>
    <trkseg>
      <trkpt lon="-122.3862791061401" lat="37.61642405271961">
        <time>2014-04-29T20:00:26.000-05:00</time>
        <type>place</type>
      </trkpt>
      <trkpt lon="-122.3862791061401" lat="37.61642405271961">
        <time>2014-04-29T20:11:36.000-05:00</time>
        <type>place</type>
      </trkpt>
    </trkseg>
    <trkseg>
      <trkpt lon="-122.3921618318497" lat="37.77676600917484">
        <time>2014-04-29T20:35:22.000-05:00</time>
        <type>place</type>
      </trkpt>
      <trkpt lon="-122.3921618318497" lat="37.77676600917484">
        <time>2014-04-29T20:42:23.000-05:00</time>
        <type>place</type>
      </trkpt>
    </trkseg>
    <trkseg>
      <trkpt lon="-122.3956690746249" lat="37.77671275752899">
        <time>2014-04-29T20:48:27.000-05:00</time>
        <type>place</type>
      </trkpt>
      <trkpt lon="-122.3956690746249" lat="37.77671275752899">
        <time>2014-04-29T21:50:50.000-05:00</time>
        <type>place</type>
      </trkpt>
    </trkseg>
    <trkseg>
      <trkpt lon="-122.3894011974335" lat="37.77833858778822">
        <time>2014-04-29T22:04:03.000-05:00</time>
        <type>place</type>
      </trkpt>
      <trkpt lon="-122.3894011974335" lat="37.77833858778822">
        <time>2014-04-29T22:10:52.000-05:00</time>
        <type>place</type>
      </trkpt>
    </trkseg>
    <trkseg>
      <trkpt lon="-122.3891887752" lat="37.614805956">
        <time>2014-04-29T22:36:45.000-05:00</time>
        <type>place</type>
      </trkpt>
      <trkpt lon="-122.3891887752" lat="37.614805956">
        <time>2014-04-29T22:46:36.000-05:00</time>
        <type>place</type>
      </trkpt>
    </trkseg>
    <trkseg>
      <trkpt lon="-122.3887845733" lat="37.6139776002">
        <time>2014-04-29T22:46:36.000-05:00</time>
        <type>place</type>
      </trkpt>
      <trkpt lon="-122.3887845733" lat="37.6139776002">
        <time>2014-04-29T22:54:40.000-05:00</time>
        <type>place</type>
      </trkpt>
    </trkseg>
    <trkseg>
      <trkpt lon="-122.3862791061401" lat="37.61642405271961">
        <time>2014-04-29T23:00:45.000-05:00</time>
        <type>place</type>
      </trkpt>
      <trkpt lon="-122.3862791061401" lat="37.61642405271961">
        <time>2014-04-30T00:00:00.000-05:00</time>
        <type>place</type>
      </trkpt>
    </trkseg>
  </trk>
  <trk>
    <name>4/30/14</name>
    <trkseg>
      <trkpt lon="-122.3862791061401" lat="37.61642405271961">
        <time>2014-04-30T00:00:00.000-05:00</time>
        <type>place</type>
      </trkpt>
      <trkpt lon="-122.3862791061401" lat="37.61642405271961">
        <time>2014-04-30T00:03:09.000-05:00</time>
        <type>place</type>
      </trkpt>
    </trkseg>
    <trkseg>
      <trkpt lon="-71.01667642593384" lat="42.36650312404415">
        <time>2014-04-30T05:34:43.000-05:00</time>
        <type>place</type>
      </trkpt>
      <trkpt lon="-71.01667642593384" lat="42.36650312404415">
        <time>2014-04-30T05:47:27.000-05:00</time>
        <type>place</type>
      </trkpt>
    </trkseg>
    <trkseg>
      <trkpt lon="-71.01667642593384" lat="42.36650312404415">
        <time>2014-04-30T05:53:17.000-05:00</time>
        <type>place</type>
      </trkpt>
      <trkpt lon="-71.01667642593384" lat="42.36650312404415">
        <time>2014-04-30T06:05:45.000-05:00</time>
        <type>place</type>
      </trkpt>
    </trkseg>
    <trkseg>
      <trkpt lon="-71.1114458017" lat="42.3754311174">
        <time>2014-04-30T06:44:15.000-05:00</time>
        <type>place</type>
      </trkpt>
      <trkpt lon="-71.1114458017" lat="42.3754311174">
        <time>2014-04-30T12:40:19.000-05:00</time>
        <type>place</type>
      </trkpt>
    </trkseg>
    <trkseg>
      <trkpt lon="-71.12077832221985" lat="42.37237675230346">
        <time>2014-04-30T12:56:00.000-05:00</time>
        <type>place</type>
      </trkpt>
      <trkpt lon="-71.12077832221985" lat="42.37237675230346">
        <time>2014-04-30T13:42:16.000-05:00</time>
        <type>place</type>
      </trkpt>
    </trkseg>
    <trkseg>
      <trkpt lon="-71.1114458017" lat="42.3754311174">
        <time>2014-04-30T13:57:49.000-05:00</time>
        <type>place</type>
      </trkpt>
      <trkpt lon="-71.1114458017" lat="42.3754311174">
        <time>2014-04-30T14:07:17.000-05:00</time>
        <type>place</type>
      </trkpt>
    </trkseg>
    <trkseg>
      <trkpt lon="-71.117205" lat="42.378716">
        <time>2014-04-30T14:19:50.000-05:00</time>
        <type>place</type>
      </trkpt>
      <trkpt lon="-71.117205" lat="42.378716">
        <time>2014-04-30T18:44:31.000-05:00</time>
        <type>place</type>
      </trkpt>
    </trkseg>
    <trkseg>
      <trkpt lon="-71.1114458017" lat="42.3754311174">
        <time>2014-04-30T18:53:07.000-05:00</time>
        <type>place</type>
      </trkpt>
      <trkpt lon="-71.1114458017" lat="42.3754311174">
        <time>2014-05-01T00:00:00.000-05:00</time>
        <type>place</type>
      </trkpt>
    </trkseg>
  </trk>
</gpx>
