<?xml version="1.0" encoding="UTF-8"?>
<gpx 
creator="Moves" version="1.1" xmlns="http://www.topografix.com/GPX/1/1" xmlns:tns="http://www.topografix.com/GPX/1/1" xmlns:xs="http://www.w3.org/2001/XMLSchema" xmlns:xsi="http://www.w3.org/2001/XMLSchema-instance">
  <metadata>
    <desc>Moves Storyline</desc>
    <link href="http://www.moves-app.com"/>
    <time>2014-11-13T21:34:32.423Z</time>
  </metadata>
  <wpt lon="-77.0772744833" lat="38.9219057145">
    <name>Laura's Home</name>
    <type>Home</type>
  </wpt>
  <wpt lon="-77.07277336996707" lat="38.92229853987276">
    <name>WMATA Bus Stop #1001805 (31, 32, 36)</name>
    <link href="http://foursquare.com/venue/4e9b7ac54901d3b0b7587b98"/>
    <type>Bus Line</type>
  </wpt>
  <wpt lon="-77.03195312062199" lat="38.89947134437488">
    <name>Starbucks</name>
    <link href="http://foursquare.com/venue/4af5b4c8f964a520a6fb21e3"/>
    <type>Coffee Shop</type>
  </wpt>
  <wpt lon="-77.03898668289185" lat="38.90185450592493">
    <name>Farragut Square</name>
    <link href="http://foursquare.com/venue/49e7923cf964a520c6641fe3"/>
    <type>Park</type>
  </wpt>
  <wpt lon="-77.03193625222163" lat="38.900182458396">
    <name>NTN24-Washington, DC</name>
    <link href="http://foursquare.com/venue/4ec5b5509a52756c53a0be9c"/>
    <type>Office</type>
  </wpt>
  <wpt lon="-77.019893" lat="38.899633">
    <name>Chinatown Express</name>
    <link href="http://foursquare.com/venue/465b42cdf964a52027471fe3"/>
    <type>Chinese Restaurant</type>
  </wpt>
  <wpt lon="-77.033571" lat="38.899766">
    <name>WMATA Bus Stop #1001060 (11Y, 32, 36)</name>
    <link href="http://foursquare.com/venue/4e7cf2330aafcfb3b125a8aa"/>
    <type>Bus Station</type>
  </wpt>
  <wpt lon="-77.04345256090164" lat="38.9221114952691">
    <name>Mintwood Place</name>
    <link href="http://foursquare.com/venue/4f0f0f940039a4c198967f3d"/>
    <type>New American Restaurant</type>
  </wpt>
  <wpt lon="-77.061918" lat="38.905063">
    <name>Starbucks</name>
    <link href="http://foursquare.com/venue/4a9c1b58f964a520fe3520e3"/>
    <type>Coffee Shop</type>
  </wpt>
  <wpt lon="-77.06286331916888" lat="38.90503822184606">
    <name>Banana Republic</name>
    <link href="http://foursquare.com/venue/4a95b188f964a5202b2420e3"/>
    <type>Clothing Store</type>
  </wpt>
  <wpt lon="-77.06553250551224" lat="38.90502721656731">
    <name>Pizzeria Paradiso</name>
    <link href="http://foursquare.com/venue/4a25b915f964a5208a7e1fe3"/>
    <type>Pizza Place</type>
  </wpt>
  <wpt lon="-77.02814080234724" lat="38.881099864596">
    <name>Capt. White's Seafood City</name>
    <link href="http://foursquare.com/venue/4b6ede00f964a52021ce2ce3"/>
    <type>Fish Market</type>
  </wpt>
  <wpt lon="-77.0256496005" lat="38.8876744642">
    <name>Place in District of Columbia</name>
  </wpt>
  <wpt lon="-77.03177881370483" lat="38.91488952754031">
    <name>Masa 14</name>
    <link href="http://foursquare.com/venue/4ad7f346f964a520441021e3"/>
    <type>Tapas Restaurant</type>
  </wpt>
  <wpt lon="-77.071804" lat="38.920938">
    <name>Whole Foods Market</name>
    <link href="http://foursquare.com/venue/4aad58b8f964a520d25f20e3"/>
    <type>Grocery Store</type>
  </wpt>
  <wpt lon="-77.03193625222163" lat="38.900182458396">
    <name>NTN24-Washington, DC</name>
    <link href="http://foursquare.com/venue/4ec5b5509a52756c53a0be9c"/>
    <type>Office</type>
  </wpt>
  <wpt lon="-77.09769384837897" lat="38.88556299980174">
    <name>Northside Social - Coffee &amp; Wine</name>
    <link href="http://foursquare.com/venue/4af50336f964a520faf721e3"/>
    <type>Wine Bar</type>
  </wpt>
  <wpt lon="-77.096206315" lat="38.8866989927">
    <name>Place in Clarendon</name>
  </wpt>
  <wpt lon="-77.0626272217989" lat="38.90590722335151">
    <name>Apple Store</name>
    <link href="http://foursquare.com/venue/4bdb67c03904a59377434a9e"/>
    <type>Electronics Store</type>
  </wpt>
  <wpt lon="-77.03186315579289" lat="38.91795996865189">
    <name>Busboys and Poets</name>
    <link href="http://foursquare.com/venue/44196facf964a52026311fe3"/>
    <type>American Restaurant</type>
  </wpt>
  <wpt lon="-77.0322658816" lat="38.917203946">
    <name>Place in Kalorama Triangle</name>
  </wpt>
  <wpt lon="-77.04418209160346" lat="38.91099639765825">
    <name>WMATA Bus Stop #1001507 (42)</name>
    <link href="http://foursquare.com/venue/4c7a8e21a8683704cfef134d"/>
    <type>Bus Station</type>
  </wpt>
  <wpt lon="-77.07147493555041" lat="38.92009508267315">
    <name>Starbucks</name>
    <link href="http://foursquare.com/venue/4ae84ab0f964a52085ae21e3"/>
    <type>Coffee Shop</type>
  </wpt>
  <wpt lon="-77.04231262207031" lat="38.85304370184257">
    <name>Ronald Reagan Washington National Airport (DCA)</name>
    <link href="http://foursquare.com/venue/44d17cecf964a5202b361fe3"/>
    <type>Airport</type>
  </wpt>
  <wpt lon="-77.04231262207031" lat="38.84858190547411">
    <name>Terminal A</name>
    <link href="http://foursquare.com/venue/4bae6416f964a5201eac3be3"/>
    <type>Airport Terminal</type>
  </wpt>
  <wpt lon="-71.11300484548056" lat="42.37405171427381">
    <name>Broadway Marketplace</name>
    <link href="http://foursquare.com/venue/4a661612f964a520ffc71fe3"/>
    <type>Grocery Store</type>
  </wpt>
  <wpt lon="-71.1114458017" lat="42.3754311174">
    <name>Home</name>
    <type>Home</type>
  </wpt>
  <wpt lon="-71.1230027436908" lat="42.37220351484281">
    <name>Legal Sea Foods - Charles Square</name>
    <link href="http://foursquare.com/venue/4bdcb5fa3904a59331664f9e"/>
    <type>Seafood Restaurant</type>
  </wpt>
  <wpt lon="-71.11295" lat="42.373886">
    <name>Starbucks</name>
    <link href="http://foursquare.com/venue/4a5a3eb5f964a520f9b91fe3"/>
    <type>Coffee Shop</type>
  </wpt>
  <wpt lon="-71.117205" lat="42.378716">
    <name>Proximate</name>
    <link href="http://foursquare.com/venue/51c8c0d1498e5d4d09a48362"/>
    <type>Tech Startup</type>
  </wpt>
  <wpt lon="-71.119934" lat="42.381903">
    <name>Starbucks</name>
    <link href="http://foursquare.com/venue/4a467225f964a520dca81fe3"/>
    <type>Coffee Shop</type>
  </wpt>
  <wpt lon="-71.11866242152347" lat="42.37890166598297">
    <name>Caspersen Student Center</name>
    <link href="http://foursquare.com/venue/4e790134b0fb5d40982b00d0"/>
    <type>College Cafeteria</type>
  </wpt>
  <wpt lon="-71.12017" lat="42.374494">
    <name>Starbucks</name>
    <link href="http://foursquare.com/venue/49cabb79f964a520d8581fe3"/>
    <type>Coffee Shop</type>
  </wpt>
  <wpt lon="-71.120141" lat="42.3743468">
    <name>Border Cafe</name>
    <link href="http://foursquare.com/venue/3fd66200f964a520bded1ee3"/>
    <type>Mexican Restaurant</type>
  </wpt>
  <wpt lon="-71.120418" lat="42.373343">
    <name>Dickson Bros. True Value</name>
    <link href="http://foursquare.com/venue/4aad3cf3f964a5202f5f20e3"/>
    <type>Hardware Store</type>
  </wpt>
  <wpt lon="-71.12077832221985" lat="42.37237675230346">
    <name>Grendel's Den Restaurant &amp; Bar</name>
    <link href="http://foursquare.com/venue/3fd66200f964a520bced1ee3"/>
    <type>Bar</type>
  </wpt>
  <wpt lon="-71.096460631" lat="42.3715568972">
    <name>Jeff Stanton's Home</name>
    <type>Home</type>
  </wpt>
  <wpt lon="-71.11741499632876" lat="42.37467597125794">
    <name>Harvard Yard</name>
    <link href="http://foursquare.com/venue/4abd2012f964a520948820e3"/>
    <type>College Quad</type>
  </wpt>
  <wpt lon="-71.12017109498916" lat="42.37343863629133">
    <name>Xfund</name>
    <link href="http://foursquare.com/venue/525e96dd11d27846ee214ac8"/>
    <type>Tech Startup</type>
  </wpt>
  <wpt lon="-71.121291" lat="42.37249515">
    <name>The Red House Restaurant</name>
    <link href="http://foursquare.com/venue/4409e8acf964a52068301fe3"/>
    <type>New American Restaurant</type>
  </wpt>
  <wpt lon="-71.11899197101593" lat="42.37402935435937">
    <name>CVS/pharmacy</name>
    <link href="http://foursquare.com/venue/49df6a3ff964a520c6601fe3"/>
    <type>Drugstore / Pharmacy</type>
  </wpt>
  <wpt lon="-71.08609199523926" lat="42.36253950179547">
    <name>Boston Marriott Cambridge</name>
    <link href="http://foursquare.com/venue/4a66a899f964a520cbc81fe3"/>
    <type>Hotel</type>
  </wpt>
  <wpt lon="-71.08162851792984" lat="42.36239871356099">
    <name>101 Main St (CIC)</name>
    <link href="http://foursquare.com/venue/51311256e4b0a7dd5b86d01b"/>
    <type>Coworking Space</type>
  </wpt>
  <wpt lon="-71.12325225275964" lat="42.37317592010315">
    <name>Harvard Alumni Association</name>
    <link href="http://foursquare.com/venue/4b5dc68df964a520026b29e3"/>
    <type>University</type>
  </wpt>
  <wpt lon="-71.11896514892578" lat="42.37331996935519">
    <name>MBTA Harvard Station</name>
    <link href="http://foursquare.com/venue/4a2715d0f964a52057911fe3"/>
    <type>Subway</type>
  </wpt>
  <wpt lon="-71.12097185013617" lat="42.37169409933257">
    <name>Park</name>
    <link href="http://foursquare.com/venue/4f7c8902e4b032c26c6798db"/>
    <type>Gastropub</type>
  </wpt>
  <wpt lon="-71.05773051318191" lat="42.3568123867606">
    <name>Impact Hub Boston</name>
    <link href="http://foursquare.com/venue/535ef432498eb46f6389ecf5"/>
    <type>Community Center</type>
  </wpt>
  <wpt lon="-71.1213492043" lat="42.3756232629">
    <name>Place in Old Cambridge</name>
  </wpt>
  <wpt lon="-71.12294" lat="42.373417">
    <name>US Post Office</name>
    <link href="http://foursquare.com/venue/49cd318af964a520cc591fe3"/>
    <type>Post Office</type>
  </wpt>
  <wpt lon="-71.1102186498" lat="42.3749912448">
    <name>Place in Old Cambridge</name>
  </wpt>
  <wpt lon="-71.11353635787964" lat="42.36892873750989">
    <name>Petsi Pies</name>
    <link href="http://foursquare.com/venue/49f9f896f964a5209f6d1fe3"/>
    <type>Coffee Shop</type>
  </wpt>
  <wpt lon="-71.12218458495514" lat="42.36522543920124">
    <name>Spangler Center</name>
    <link href="http://foursquare.com/venue/4aeee0b0f964a52081d421e3"/>
    <type>Student Center</type>
  </wpt>
  <wpt lon="-71.1117795529" lat="42.3703280547">
    <name>Ellen Chisa Home</name>
    <type>Home</type>
  </wpt>
  <wpt lon="-71.12407621183526" lat="42.36403242532342">
    <name>Harvard Innovation Lab</name>
    <link href="http://foursquare.com/venue/4e5d4676ae60839ea2e29e64"/>
    <type>College Technology Building</type>
  </wpt>
  <wpt lon="-71.12210915179602" lat="42.36578780710847">
    <name>Aldrich Hall</name>
    <link href="http://foursquare.com/venue/4ac64359f964a5206eb320e3"/>
    <type>College Academic Building</type>
  </wpt>
  <wpt lon="-71.1161356011" lat="42.3644780953">
    <name>Place in Charles River Reservation</name>
  </wpt>
  <wpt lon="-71.1139945613" lat="42.3645380273">
    <name>Place in Cambridgeport</name>
  </wpt>
  <wpt lon="-71.12248051490364" lat="42.36595739324783">
    <name>Aldrich 007</name>
    <link href="http://foursquare.com/venue/4f26a4c1e4b0717a6a95ebb2"/>
    <type>College Classroom</type>
  </wpt>
  <wpt lon="-71.1154986639" lat="42.3677504203">
    <name>Place in Harvard University</name>
  </wpt>
  <wpt lon="-71.11859279030334" lat="42.37272429096316">
    <name>Richard A. &amp; Susan F. Smith Campus Center (fka Holyoke Center)</name>
    <link href="http://foursquare.com/venue/4b01556af964a5201e4222e3"/>
    <type>College Administrative Building</type>
  </wpt>
  <wpt lon="-71.02003455162048" lat="42.36947567662487">
    <name>Terminal E</name>
    <link href="http://foursquare.com/venue/4b1d7a4df964a520141124e3"/>
    <type>Airport Terminal</type>
  </wpt>
  <wpt lon="-71.11618638038635" lat="42.379328">
    <name>Conant Hall</name>
    <link href="http://foursquare.com/venue/4b9da731f964a5205cb836e3"/>
    <type>College Residence Hall</type>
  </wpt>
  <wpt lon="-71.119457" lat="42.373379">
    <name>Tory Row</name>
    <link href="http://foursquare.com/venue/49e79621f964a520cf641fe3"/>
    <type>American Restaurant</type>
  </wpt>
  <wpt lon="-71.1209586691" lat="42.3654244908">
    <name>Place in Allston</name>
  </wpt>
  <wpt lon="-71.119452" lat="42.372485">
    <name>Starbucks</name>
    <link href="http://foursquare.com/venue/49bc4e56f964a52028541fe3"/>
    <type>Café</type>
  </wpt>
  <wpt lon="-71.11747288651797" lat="42.37302773792176">
    <name>J.P. Licks Harvard Square</name>
    <link href="http://foursquare.com/venue/49cd30d4f964a520ca591fe3"/>
    <type>Ice Cream Shop</type>
  </wpt>
  <wpt lon="-71.12299694115246" lat="42.37210143005068">
    <name>Henrietta's Table</name>
    <link href="http://foursquare.com/venue/4a51523bf964a520edb01fe3"/>
    <type>American Restaurant</type>
  </wpt>
  <wpt lon="-71.1178786196" lat="42.3777682252">
    <name>Place in Old Cambridge</name>
  </wpt>
  <wpt lon="-71.1206353010665" lat="42.3723066357318">
    <name>Yogurtland</name>
    <link href="http://foursquare.com/venue/51bcdf28498e5042ba6ac12c"/>
    <type>Frozen Yogurt</type>
  </wpt>
  <wpt lon="-71.12402979165076" lat="42.36427488545988">
    <name>Harvard Innovation Lab</name>
    <link href="http://foursquare.com/venue/4e5d4676ae60839ea2e29e64"/>
    <type>College Technology Building</type>
  </wpt>
  <wpt lon="-71.12295627593994" lat="42.3724718672702">
    <name>The Charles Hotel</name>
    <link href="http://foursquare.com/venue/4a3eb3f3f964a5204fa31fe3"/>
    <type>Hotel</type>
  </wpt>
  <wpt lon="-70.962171" lat="42.45143936666667">
    <name>Lynnway Liquors</name>
    <link href="http://foursquare.com/venue/4bd0c73b77b29c7435758b82"/>
    <type>Liquor Store</type>
  </wpt>
  <wpt lon="-70.8747906199" lat="42.4818089224">
    <name>Trevor Frankel's Beach House</name>
    <type>Home</type>
  </wpt>
  <wpt lon="-70.88747425990753" lat="42.47262693478186">
    <name>Philips Beach</name>
    <link href="http://foursquare.com/venue/4a884001f964a5208a0520e3"/>
    <type>Beach</type>
  </wpt>
  <wpt lon="-70.8962213542" lat="42.5230790961">
    <name>Place in North Salem</name>
  </wpt>
  <wpt lon="-70.89399413092349" lat="42.52148195917415">
    <name>Downtown Salem</name>
    <link href="http://foursquare.com/venue/531525f5e4b0e72a36f8177d"/>
    <type>Neighborhood</type>
  </wpt>
  <wpt lon="-70.89215951986917" lat="42.5207695305214">
    <name>The Burying Point</name>
    <link href="http://foursquare.com/venue/4ad344aff964a52092e320e3"/>
    <type>Cemetery</type>
  </wpt>
  <wpt lon="-70.89609579615087" lat="42.5212082774136">
    <name>Naumkeag Ordinary</name>
    <link href="http://foursquare.com/venue/5162e836e4b0e6bf9764f99d"/>
    <type>American Restaurant</type>
  </wpt>
  <wpt lon="-71.12136840820312" lat="42.37358945733965">
    <name>Alden &amp; Harlow</name>
    <link href="http://foursquare.com/venue/51d99a09ccdad19fde937088"/>
    <type>American Restaurant</type>
  </wpt>
  <wpt lon="-71.26529585645288" lat="42.39461025172349">
    <name>Costco Wholesale</name>
    <link href="http://foursquare.com/venue/4a84248ef964a520c7fb1fe3"/>
    <type>Warehouse Store</type>
  </wpt>
  <wpt lon="-71.35373028504658" lat="42.03958441119426">
    <name>Ann Taylor Loft</name>
    <link href="http://foursquare.com/venue/4c682f09f984a593d03149f4"/>
    <type>Women's Store</type>
  </wpt>
  <wpt lon="-71.3536117654" lat="42.0398615822">
    <name>Sunglass Hut</name>
    <type>Work</type>
  </wpt>
  <trk>
    <name>8/1/14</name>
    <trkseg>
      <trkpt lon="-77.0772744833" lat="38.9219057145">
        <time>2014-08-01T00:00:00.000-04:00</time>
        <type>place</type>
      </trkpt>
      <trkpt lon="-77.0772744833" lat="38.9219057145">
        <time>2014-08-01T10:27:16.000-04:00</time>
        <type>place</type>
      </trkpt>
    </trkseg>
    <trkseg>
      <trkpt lon="-77.07277336996707" lat="38.92229853987276">
        <time>2014-08-01T10:33:38.000-04:00</time>
        <type>place</type>
      </trkpt>
      <trkpt lon="-77.07277336996707" lat="38.92229853987276">
        <time>2014-08-01T10:41:32.000-04:00</time>
        <type>place</type>
      </trkpt>
    </trkseg>
    <trkseg>
      <trkpt lon="-77.03195312062199" lat="38.89947134437488">
        <time>2014-08-01T11:12:44.000-04:00</time>
        <type>place</type>
      </trkpt>
      <trkpt lon="-77.03195312062199" lat="38.89947134437488">
        <time>2014-08-01T12:29:23.000-04:00</time>
        <type>place</type>
      </trkpt>
    </trkseg>
    <trkseg>
      <trkpt lon="-77.03898668289185" lat="38.90185450592493">
        <time>2014-08-01T12:51:34.000-04:00</time>
        <type>place</type>
      </trkpt>
      <trkpt lon="-77.03898668289185" lat="38.90185450592493">
        <time>2014-08-01T13:53:22.000-04:00</time>
        <type>place</type>
      </trkpt>
    </trkseg>
    <trkseg>
      <trkpt lon="-77.03193625222163" lat="38.900182458396">
        <time>2014-08-01T14:04:42.000-04:00</time>
        <type>place</type>
      </trkpt>
      <trkpt lon="-77.03193625222163" lat="38.900182458396">
        <time>2014-08-01T18:32:37.000-04:00</time>
        <type>place</type>
      </trkpt>
    </trkseg>
    <trkseg>
      <trkpt lon="-77.019893" lat="38.899633">
        <time>2014-08-01T18:49:28.000-04:00</time>
        <type>place</type>
      </trkpt>
      <trkpt lon="-77.019893" lat="38.899633">
        <time>2014-08-01T19:44:49.000-04:00</time>
        <type>place</type>
      </trkpt>
    </trkseg>
    <trkseg>
      <trkpt lon="-77.033571" lat="38.899766">
        <time>2014-08-01T20:07:56.000-04:00</time>
        <type>place</type>
      </trkpt>
      <trkpt lon="-77.033571" lat="38.899766">
        <time>2014-08-01T20:23:14.000-04:00</time>
        <type>place</type>
      </trkpt>
    </trkseg>
    <trkseg>
      <trkpt lon="-77.0772744833" lat="38.9219057145">
        <time>2014-08-01T20:57:29.000-04:00</time>
        <type>place</type>
      </trkpt>
      <trkpt lon="-77.0772744833" lat="38.9219057145">
        <time>2014-08-02T00:00:00.000-04:00</time>
        <type>place</type>
      </trkpt>
    </trkseg>
  </trk>
  <trk>
    <name>8/2/14</name>
    <trkseg>
      <trkpt lon="-77.0772744833" lat="38.9219057145">
        <time>2014-08-02T00:00:00.000-04:00</time>
        <type>place</type>
      </trkpt>
      <trkpt lon="-77.0772744833" lat="38.9219057145">
        <time>2014-08-02T11:57:51.000-04:00</time>
        <type>place</type>
      </trkpt>
    </trkseg>
    <trkseg>
      <trkpt lon="-77.04345256090164" lat="38.9221114952691">
        <time>2014-08-02T12:44:58.000-04:00</time>
        <type>place</type>
      </trkpt>
      <trkpt lon="-77.04345256090164" lat="38.9221114952691">
        <time>2014-08-02T14:07:02.000-04:00</time>
        <type>place</type>
      </trkpt>
    </trkseg>
    <trkseg>
      <trkpt lon="-77.061918" lat="38.905063">
        <time>2014-08-02T14:57:13.000-04:00</time>
        <type>place</type>
      </trkpt>
      <trkpt lon="-77.061918" lat="38.905063">
        <time>2014-08-02T18:14:40.000-04:00</time>
        <type>place</type>
      </trkpt>
    </trkseg>
    <trkseg>
      <trkpt lon="-77.06286331916888" lat="38.90503822184606">
        <time>2014-08-02T18:21:49.000-04:00</time>
        <type>place</type>
      </trkpt>
      <trkpt lon="-77.06286331916888" lat="38.90503822184606">
        <time>2014-08-02T18:29:54.000-04:00</time>
        <type>place</type>
      </trkpt>
    </trkseg>
    <trkseg>
      <trkpt lon="-77.06553250551224" lat="38.90502721656731">
        <time>2014-08-02T18:32:59.000-04:00</time>
        <type>place</type>
      </trkpt>
      <trkpt lon="-77.06553250551224" lat="38.90502721656731">
        <time>2014-08-02T20:09:01.000-04:00</time>
        <type>place</type>
      </trkpt>
    </trkseg>
    <trkseg>
      <trkpt lon="-77.0772744833" lat="38.9219057145">
        <time>2014-08-02T20:18:20.000-04:00</time>
        <type>place</type>
      </trkpt>
      <trkpt lon="-77.0772744833" lat="38.9219057145">
        <time>2014-08-03T00:00:00.000-04:00</time>
        <type>place</type>
      </trkpt>
    </trkseg>
  </trk>
  <trk>
    <name>8/3/14</name>
    <trkseg>
      <trkpt lon="-77.0772744833" lat="38.9219057145">
        <time>2014-08-03T00:00:00.000-04:00</time>
        <type>place</type>
      </trkpt>
      <trkpt lon="-77.0772744833" lat="38.9219057145">
        <time>2014-08-03T12:46:09.000-04:00</time>
        <type>place</type>
      </trkpt>
    </trkseg>
    <trkseg>
      <trkpt lon="-77.02814080234724" lat="38.881099864596">
        <time>2014-08-03T13:05:40.000-04:00</time>
        <type>place</type>
      </trkpt>
      <trkpt lon="-77.02814080234724" lat="38.881099864596">
        <time>2014-08-03T14:45:15.000-04:00</time>
        <type>place</type>
      </trkpt>
    </trkseg>
    <trkseg>
      <trkpt lon="-77.0256496005" lat="38.8876744642">
        <time>2014-08-03T15:02:20.000-04:00</time>
        <type>place</type>
      </trkpt>
      <trkpt lon="-77.0256496005" lat="38.8876744642">
        <time>2014-08-03T15:06:47.000-04:00</time>
        <type>place</type>
      </trkpt>
    </trkseg>
    <trkseg>
      <trkpt lon="-77.03177881370483" lat="38.91488952754031">
        <time>2014-08-03T15:39:26.000-04:00</time>
        <type>place</type>
      </trkpt>
      <trkpt lon="-77.03177881370483" lat="38.91488952754031">
        <time>2014-08-03T17:12:15.000-04:00</time>
        <type>place</type>
      </trkpt>
    </trkseg>
    <trkseg>
      <trkpt lon="-77.071804" lat="38.920938">
        <time>2014-08-03T17:31:17.000-04:00</time>
        <type>place</type>
      </trkpt>
      <trkpt lon="-77.071804" lat="38.920938">
        <time>2014-08-03T17:48:35.000-04:00</time>
        <type>place</type>
      </trkpt>
    </trkseg>
    <trkseg>
      <trkpt lon="-77.0772744833" lat="38.9219057145">
        <time>2014-08-03T17:59:53.000-04:00</time>
        <type>place</type>
      </trkpt>
      <trkpt lon="-77.0772744833" lat="38.9219057145">
        <time>2014-08-04T00:00:00.000-04:00</time>
        <type>place</type>
      </trkpt>
    </trkseg>
  </trk>
  <trk>
    <name>8/4/14</name>
    <trkseg>
      <trkpt lon="-77.0772744833" lat="38.9219057145">
        <time>2014-08-04T00:00:00.000-04:00</time>
        <type>place</type>
      </trkpt>
      <trkpt lon="-77.0772744833" lat="38.9219057145">
        <time>2014-08-04T09:31:31.000-04:00</time>
        <type>place</type>
      </trkpt>
    </trkseg>
    <trkseg>
      <trkpt lon="-77.03193625222163" lat="38.900182458396">
        <time>2014-08-04T10:05:36.000-04:00</time>
        <type>place</type>
      </trkpt>
      <trkpt lon="-77.03193625222163" lat="38.900182458396">
        <time>2014-08-04T10:15:42.000-04:00</time>
        <type>place</type>
      </trkpt>
    </trkseg>
    <trkseg>
      <trkpt lon="-77.03193625222163" lat="38.900182458396">
        <time>2014-08-04T10:16:16.000-04:00</time>
        <type>place</type>
      </trkpt>
      <trkpt lon="-77.03193625222163" lat="38.900182458396">
        <time>2014-08-04T10:29:04.000-04:00</time>
        <type>place</type>
      </trkpt>
    </trkseg>
    <trkseg>
      <trkpt lon="-77.03193625222163" lat="38.900182458396">
        <time>2014-08-04T11:04:35.000-04:00</time>
        <type>place</type>
      </trkpt>
      <trkpt lon="-77.03193625222163" lat="38.900182458396">
        <time>2014-08-04T12:58:14.000-04:00</time>
        <type>place</type>
      </trkpt>
    </trkseg>
    <trkseg>
      <trkpt lon="-77.09769384837897" lat="38.88556299980174">
        <time>2014-08-04T13:20:02.000-04:00</time>
        <type>place</type>
      </trkpt>
      <trkpt lon="-77.09769384837897" lat="38.88556299980174">
        <time>2014-08-04T14:32:36.000-04:00</time>
        <type>place</type>
      </trkpt>
    </trkseg>
    <trkseg>
      <trkpt lon="-77.096206315" lat="38.8866989927">
        <time>2014-08-04T14:35:45.000-04:00</time>
        <type>place</type>
      </trkpt>
      <trkpt lon="-77.096206315" lat="38.8866989927">
        <time>2014-08-04T14:44:39.000-04:00</time>
        <type>place</type>
      </trkpt>
    </trkseg>
    <trkseg>
      <trkpt lon="-77.09769384837897" lat="38.88556299980174">
        <time>2014-08-04T14:52:12.000-04:00</time>
        <type>place</type>
      </trkpt>
      <trkpt lon="-77.09769384837897" lat="38.88556299980174">
        <time>2014-08-04T20:32:27.000-04:00</time>
        <type>place</type>
      </trkpt>
    </trkseg>
    <trkseg>
      <trkpt lon="-77.0772744833" lat="38.9219057145">
        <time>2014-08-04T21:26:27.000-04:00</time>
        <type>place</type>
      </trkpt>
      <trkpt lon="-77.0772744833" lat="38.9219057145">
        <time>2014-08-05T00:00:00.000-04:00</time>
        <type>place</type>
      </trkpt>
    </trkseg>
  </trk>
  <trk>
    <name>8/5/14</name>
    <trkseg>
      <trkpt lon="-77.0772744833" lat="38.9219057145">
        <time>2014-08-05T00:00:00.000-04:00</time>
        <type>place</type>
      </trkpt>
      <trkpt lon="-77.0772744833" lat="38.9219057145">
        <time>2014-08-05T09:22:17.000-04:00</time>
        <type>place</type>
      </trkpt>
    </trkseg>
    <trkseg>
      <trkpt lon="-77.0626272217989" lat="38.90590722335151">
        <time>2014-08-05T09:41:02.000-04:00</time>
        <type>place</type>
      </trkpt>
      <trkpt lon="-77.0626272217989" lat="38.90590722335151">
        <time>2014-08-05T10:09:53.000-04:00</time>
        <type>place</type>
      </trkpt>
    </trkseg>
    <trkseg>
      <trkpt lon="-77.03186315579289" lat="38.91795996865189">
        <time>2014-08-05T11:33:01.000-04:00</time>
        <type>place</type>
      </trkpt>
      <trkpt lon="-77.03186315579289" lat="38.91795996865189">
        <time>2014-08-05T14:02:24.000-04:00</time>
        <type>place</type>
      </trkpt>
    </trkseg>
    <trkseg>
      <trkpt lon="-77.0322658816" lat="38.917203946">
        <time>2014-08-05T14:10:34.000-04:00</time>
        <type>place</type>
      </trkpt>
      <trkpt lon="-77.0322658816" lat="38.917203946">
        <time>2014-08-05T14:17:23.000-04:00</time>
        <type>place</type>
      </trkpt>
    </trkseg>
    <trkseg>
      <trkpt lon="-77.03186315579289" lat="38.91795996865189">
        <time>2014-08-05T14:17:23.000-04:00</time>
        <type>place</type>
      </trkpt>
      <trkpt lon="-77.03186315579289" lat="38.91795996865189">
        <time>2014-08-05T17:52:48.000-04:00</time>
        <type>place</type>
      </trkpt>
    </trkseg>
    <trkseg>
      <trkpt lon="-77.04418209160346" lat="38.91099639765825">
        <time>2014-08-05T18:14:30.000-04:00</time>
        <type>place</type>
      </trkpt>
      <trkpt lon="-77.04418209160346" lat="38.91099639765825">
        <time>2014-08-05T18:22:17.000-04:00</time>
        <type>place</type>
      </trkpt>
    </trkseg>
    <trkseg>
      <trkpt lon="-77.0772744833" lat="38.9219057145">
        <time>2014-08-05T18:43:57.000-04:00</time>
        <type>place</type>
      </trkpt>
      <trkpt lon="-77.0772744833" lat="38.9219057145">
        <time>2014-08-06T00:00:00.000-04:00</time>
        <type>place</type>
      </trkpt>
    </trkseg>
  </trk>
  <trk>
    <name>8/6/14</name>
    <trkseg>
      <trkpt lon="-77.0772744833" lat="38.9219057145">
        <time>2014-08-06T00:00:00.000-04:00</time>
        <type>place</type>
      </trkpt>
      <trkpt lon="-77.0772744833" lat="38.9219057145">
        <time>2014-08-06T07:25:40.000-04:00</time>
        <type>place</type>
      </trkpt>
    </trkseg>
    <trkseg>
      <trkpt lon="-77.07147493555041" lat="38.92009508267315">
        <time>2014-08-06T07:34:08.000-04:00</time>
        <type>place</type>
      </trkpt>
      <trkpt lon="-77.07147493555041" lat="38.92009508267315">
        <time>2014-08-06T07:40:26.000-04:00</time>
        <type>place</type>
      </trkpt>
    </trkseg>
    <trkseg>
      <trkpt lon="-77.0772744833" lat="38.9219057145">
        <time>2014-08-06T07:50:47.000-04:00</time>
        <type>place</type>
      </trkpt>
      <trkpt lon="-77.0772744833" lat="38.9219057145">
        <time>2014-08-06T09:36:18.000-04:00</time>
        <type>place</type>
      </trkpt>
    </trkseg>
    <trkseg>
      <trkpt lon="-77.03193625222163" lat="38.900182458396">
        <time>2014-08-06T10:16:06.000-04:00</time>
        <type>place</type>
      </trkpt>
      <trkpt lon="-77.03193625222163" lat="38.900182458396">
        <time>2014-08-06T11:25:02.000-04:00</time>
        <type>place</type>
      </trkpt>
    </trkseg>
    <trkseg>
      <trkpt lon="-77.04231262207031" lat="38.85304370184257">
        <time>2014-08-06T11:47:35.000-04:00</time>
        <type>place</type>
      </trkpt>
      <trkpt lon="-77.04231262207031" lat="38.85304370184257">
        <time>2014-08-06T12:36:44.000-04:00</time>
        <type>place</type>
      </trkpt>
    </trkseg>
    <trkseg>
      <trkpt lon="-77.04231262207031" lat="38.84858190547411">
        <time>2014-08-06T12:45:25.000-04:00</time>
        <type>place</type>
      </trkpt>
      <trkpt lon="-77.04231262207031" lat="38.84858190547411">
        <time>2014-08-06T14:54:45.000-04:00</time>
        <type>place</type>
      </trkpt>
    </trkseg>
    <trkseg>
      <trkpt lon="-71.11300484548056" lat="42.37405171427381">
        <time>2014-08-06T17:15:01.000-04:00</time>
        <type>place</type>
      </trkpt>
      <trkpt lon="-71.11300484548056" lat="42.37405171427381">
        <time>2014-08-06T17:17:59.000-04:00</time>
        <type>place</type>
      </trkpt>
    </trkseg>
    <trkseg>
      <trkpt lon="-71.1114458017" lat="42.3754311174">
        <time>2014-08-06T17:23:32.000-04:00</time>
        <type>place</type>
      </trkpt>
      <trkpt lon="-71.1114458017" lat="42.3754311174">
        <time>2014-08-06T19:12:02.000-04:00</time>
        <type>place</type>
      </trkpt>
    </trkseg>
    <trkseg>
      <trkpt lon="-71.1230027436908" lat="42.37220351484281">
        <time>2014-08-06T19:29:16.000-04:00</time>
        <type>place</type>
      </trkpt>
      <trkpt lon="-71.1230027436908" lat="42.37220351484281">
        <time>2014-08-06T21:09:03.000-04:00</time>
        <type>place</type>
      </trkpt>
    </trkseg>
    <trkseg>
      <trkpt lon="-71.1114458017" lat="42.3754311174">
        <time>2014-08-06T21:26:50.000-04:00</time>
        <type>place</type>
      </trkpt>
      <trkpt lon="-71.1114458017" lat="42.3754311174">
        <time>2014-08-06T22:33:11.000-04:00</time>
        <type>place</type>
      </trkpt>
    </trkseg>
    <trkseg>
      <trkpt lon="-71.1114458017" lat="42.3754311174">
        <time>2014-08-06T22:33:11.000-04:00</time>
        <type>place</type>
      </trkpt>
      <trkpt lon="-71.1114458017" lat="42.3754311174">
        <time>2014-08-07T00:00:00.000-04:00</time>
        <type>place</type>
      </trkpt>
    </trkseg>
  </trk>
  <trk>
    <name>8/7/14</name>
    <trkseg>
      <trkpt lon="-71.1114458017" lat="42.3754311174">
        <time>2014-08-07T00:00:00.000-04:00</time>
        <type>place</type>
      </trkpt>
      <trkpt lon="-71.1114458017" lat="42.3754311174">
        <time>2014-08-07T08:23:17.000-04:00</time>
        <type>place</type>
      </trkpt>
    </trkseg>
    <trkseg>
      <trkpt lon="-71.11295" lat="42.373886">
        <time>2014-08-07T08:28:37.000-04:00</time>
        <type>place</type>
      </trkpt>
      <trkpt lon="-71.11295" lat="42.373886">
        <time>2014-08-07T08:36:02.000-04:00</time>
        <type>place</type>
      </trkpt>
    </trkseg>
    <trkseg>
      <trkpt lon="-71.117205" lat="42.378716">
        <time>2014-08-07T08:51:51.000-04:00</time>
        <type>place</type>
      </trkpt>
      <trkpt lon="-71.117205" lat="42.378716">
        <time>2014-08-07T09:56:16.000-04:00</time>
        <type>place</type>
      </trkpt>
    </trkseg>
    <trkseg>
      <trkpt lon="-71.119934" lat="42.381903">
        <time>2014-08-07T10:05:01.000-04:00</time>
        <type>place</type>
      </trkpt>
      <trkpt lon="-71.119934" lat="42.381903">
        <time>2014-08-07T10:15:56.000-04:00</time>
        <type>place</type>
      </trkpt>
    </trkseg>
    <trkseg>
      <trkpt lon="-71.11866242152347" lat="42.37890166598297">
        <time>2014-08-07T10:22:03.000-04:00</time>
        <type>place</type>
      </trkpt>
      <trkpt lon="-71.11866242152347" lat="42.37890166598297">
        <time>2014-08-07T12:31:06.000-04:00</time>
        <type>place</type>
      </trkpt>
    </trkseg>
    <trkseg>
      <trkpt lon="-71.12017" lat="42.374494">
        <time>2014-08-07T12:44:16.000-04:00</time>
        <type>place</type>
      </trkpt>
      <trkpt lon="-71.12017" lat="42.374494">
        <time>2014-08-07T12:47:22.000-04:00</time>
        <type>place</type>
      </trkpt>
    </trkseg>
    <trkseg>
      <trkpt lon="-71.117205" lat="42.378716">
        <time>2014-08-07T12:55:08.000-04:00</time>
        <type>place</type>
      </trkpt>
      <trkpt lon="-71.117205" lat="42.378716">
        <time>2014-08-07T12:56:11.000-04:00</time>
        <type>place</type>
      </trkpt>
    </trkseg>
    <trkseg>
      <trkpt lon="-71.120141" lat="42.3743468">
        <time>2014-08-07T13:08:54.000-04:00</time>
        <type>place</type>
      </trkpt>
      <trkpt lon="-71.120141" lat="42.3743468">
        <time>2014-08-07T13:36:23.000-04:00</time>
        <type>place</type>
      </trkpt>
    </trkseg>
    <trkseg>
      <trkpt lon="-71.117205" lat="42.378716">
        <time>2014-08-07T13:46:32.000-04:00</time>
        <type>place</type>
      </trkpt>
      <trkpt lon="-71.117205" lat="42.378716">
        <time>2014-08-07T17:53:16.000-04:00</time>
        <type>place</type>
      </trkpt>
    </trkseg>
    <trkseg>
      <trkpt lon="-71.1114458017" lat="42.3754311174">
        <time>2014-08-07T18:06:07.000-04:00</time>
        <type>place</type>
      </trkpt>
      <trkpt lon="-71.1114458017" lat="42.3754311174">
        <time>2014-08-07T18:41:46.000-04:00</time>
        <type>place</type>
      </trkpt>
    </trkseg>
    <trkseg>
      <trkpt lon="-71.120418" lat="42.373343">
        <time>2014-08-07T18:57:54.000-04:00</time>
        <type>place</type>
      </trkpt>
      <trkpt lon="-71.120418" lat="42.373343">
        <time>2014-08-07T20:24:54.000-04:00</time>
        <type>place</type>
      </trkpt>
    </trkseg>
    <trkseg>
      <trkpt lon="-71.1114458017" lat="42.3754311174">
        <time>2014-08-07T20:38:20.000-04:00</time>
        <type>place</type>
      </trkpt>
      <trkpt lon="-71.1114458017" lat="42.3754311174">
        <time>2014-08-08T00:00:00.000-04:00</time>
        <type>place</type>
      </trkpt>
    </trkseg>
  </trk>
  <trk>
    <name>8/8/14</name>
    <trkseg>
      <trkpt lon="-71.1114458017" lat="42.3754311174">
        <time>2014-08-08T00:00:00.000-04:00</time>
        <type>place</type>
      </trkpt>
      <trkpt lon="-71.1114458017" lat="42.3754311174">
        <time>2014-08-08T08:55:12.000-04:00</time>
        <type>place</type>
      </trkpt>
    </trkseg>
    <trkseg>
      <trkpt lon="-71.117205" lat="42.378716">
        <time>2014-08-08T09:07:10.000-04:00</time>
        <type>place</type>
      </trkpt>
      <trkpt lon="-71.117205" lat="42.378716">
        <time>2014-08-08T10:52:19.000-04:00</time>
        <type>place</type>
      </trkpt>
    </trkseg>
    <trkseg>
      <trkpt lon="-71.119934" lat="42.381903">
        <time>2014-08-08T11:00:48.000-04:00</time>
        <type>place</type>
      </trkpt>
      <trkpt lon="-71.119934" lat="42.381903">
        <time>2014-08-08T11:07:33.000-04:00</time>
        <type>place</type>
      </trkpt>
    </trkseg>
    <trkseg>
      <trkpt lon="-71.117205" lat="42.378716">
        <time>2014-08-08T11:23:51.000-04:00</time>
        <type>place</type>
      </trkpt>
      <trkpt lon="-71.117205" lat="42.378716">
        <time>2014-08-08T13:15:34.000-04:00</time>
        <type>place</type>
      </trkpt>
    </trkseg>
    <trkseg>
      <trkpt lon="-71.12077832221985" lat="42.37237675230346">
        <time>2014-08-08T13:29:25.000-04:00</time>
        <type>place</type>
      </trkpt>
      <trkpt lon="-71.12077832221985" lat="42.37237675230346">
        <time>2014-08-08T14:13:39.000-04:00</time>
        <type>place</type>
      </trkpt>
    </trkseg>
    <trkseg>
      <trkpt lon="-71.117205" lat="42.378716">
        <time>2014-08-08T14:27:28.000-04:00</time>
        <type>place</type>
      </trkpt>
      <trkpt lon="-71.117205" lat="42.378716">
        <time>2014-08-08T17:21:00.000-04:00</time>
        <type>place</type>
      </trkpt>
    </trkseg>
    <trkseg>
      <trkpt lon="-71.11300484548056" lat="42.37405171427381">
        <time>2014-08-08T17:32:53.000-04:00</time>
        <type>place</type>
      </trkpt>
      <trkpt lon="-71.11300484548056" lat="42.37405171427381">
        <time>2014-08-08T17:48:06.000-04:00</time>
        <type>place</type>
      </trkpt>
    </trkseg>
    <trkseg>
      <trkpt lon="-71.096460631" lat="42.3715568972">
        <time>2014-08-08T17:53:44.000-04:00</time>
        <type>place</type>
      </trkpt>
      <trkpt lon="-71.096460631" lat="42.3715568972">
        <time>2014-08-08T22:49:27.000-04:00</time>
        <type>place</type>
      </trkpt>
    </trkseg>
    <trkseg>
      <trkpt lon="-71.11741499632876" lat="42.37467597125794">
        <time>2014-08-08T23:04:37.000-04:00</time>
        <type>place</type>
      </trkpt>
      <trkpt lon="-71.11741499632876" lat="42.37467597125794">
        <time>2014-08-09T00:00:00.000-04:00</time>
        <type>place</type>
      </trkpt>
    </trkseg>
  </trk>
  <trk>
    <name>8/9/14</name>
    <trkseg>
      <trkpt lon="-71.11741499632876" lat="42.37467597125794">
        <time>2014-08-09T00:00:00.000-04:00</time>
        <type>place</type>
      </trkpt>
      <trkpt lon="-71.11741499632876" lat="42.37467597125794">
        <time>2014-08-09T00:08:56.000-04:00</time>
        <type>place</type>
      </trkpt>
    </trkseg>
    <trkseg>
      <trkpt lon="-71.1114458017" lat="42.3754311174">
        <time>2014-08-09T00:19:24.000-04:00</time>
        <type>place</type>
      </trkpt>
      <trkpt lon="-71.1114458017" lat="42.3754311174">
        <time>2014-08-09T09:44:31.000-04:00</time>
        <type>place</type>
      </trkpt>
    </trkseg>
    <trkseg>
      <trkpt lon="-71.12017109498916" lat="42.37343863629133">
        <time>2014-08-09T10:02:19.000-04:00</time>
        <type>place</type>
      </trkpt>
      <trkpt lon="-71.12017109498916" lat="42.37343863629133">
        <time>2014-08-09T11:43:51.000-04:00</time>
        <type>place</type>
      </trkpt>
    </trkseg>
    <trkseg>
      <trkpt lon="-71.1114458017" lat="42.3754311174">
        <time>2014-08-09T11:58:38.000-04:00</time>
        <type>place</type>
      </trkpt>
      <trkpt lon="-71.1114458017" lat="42.3754311174">
        <time>2014-08-09T12:25:50.000-04:00</time>
        <type>place</type>
      </trkpt>
    </trkseg>
    <trkseg>
      <trkpt lon="-71.12017109498916" lat="42.37343863629133">
        <time>2014-08-09T12:36:40.000-04:00</time>
        <type>place</type>
      </trkpt>
      <trkpt lon="-71.12017109498916" lat="42.37343863629133">
        <time>2014-08-09T13:26:50.000-04:00</time>
        <type>place</type>
      </trkpt>
    </trkseg>
    <trkseg>
      <trkpt lon="-71.121291" lat="42.37249515">
        <time>2014-08-09T13:29:16.000-04:00</time>
        <type>place</type>
      </trkpt>
      <trkpt lon="-71.121291" lat="42.37249515">
        <time>2014-08-09T14:39:25.000-04:00</time>
        <type>place</type>
      </trkpt>
    </trkseg>
    <trkseg>
      <trkpt lon="-71.12017109498916" lat="42.37343863629133">
        <time>2014-08-09T14:43:55.000-04:00</time>
        <type>place</type>
      </trkpt>
      <trkpt lon="-71.12017109498916" lat="42.37343863629133">
        <time>2014-08-09T14:57:17.000-04:00</time>
        <type>place</type>
      </trkpt>
    </trkseg>
    <trkseg>
      <trkpt lon="-71.1114458017" lat="42.3754311174">
        <time>2014-08-09T15:09:34.000-04:00</time>
        <type>place</type>
      </trkpt>
      <trkpt lon="-71.1114458017" lat="42.3754311174">
        <time>2014-08-09T17:07:10.000-04:00</time>
        <type>place</type>
      </trkpt>
    </trkseg>
    <trkseg>
      <trkpt lon="-71.12017109498916" lat="42.37343863629133">
        <time>2014-08-09T17:22:30.000-04:00</time>
        <type>place</type>
      </trkpt>
      <trkpt lon="-71.12017109498916" lat="42.37343863629133">
        <time>2014-08-09T18:21:54.000-04:00</time>
        <type>place</type>
      </trkpt>
    </trkseg>
    <trkseg>
      <trkpt lon="-71.1114458017" lat="42.3754311174">
        <time>2014-08-09T22:24:50.000-04:00</time>
        <type>place</type>
      </trkpt>
      <trkpt lon="-71.1114458017" lat="42.3754311174">
        <time>2014-08-10T00:00:00.000-04:00</time>
        <type>place</type>
      </trkpt>
    </trkseg>
  </trk>
  <trk>
    <name>8/10/14</name>
    <trkseg>
      <trkpt lon="-71.1114458017" lat="42.3754311174">
        <time>2014-08-10T00:00:00.000-04:00</time>
        <type>place</type>
      </trkpt>
      <trkpt lon="-71.1114458017" lat="42.3754311174">
        <time>2014-08-10T08:55:25.000-04:00</time>
        <type>place</type>
      </trkpt>
    </trkseg>
    <trkseg>
      <trkpt lon="-71.11300484548056" lat="42.37405171427381">
        <time>2014-08-10T08:59:20.000-04:00</time>
        <type>place</type>
      </trkpt>
      <trkpt lon="-71.11300484548056" lat="42.37405171427381">
        <time>2014-08-10T09:02:37.000-04:00</time>
        <type>place</type>
      </trkpt>
    </trkseg>
    <trkseg>
      <trkpt lon="-71.1114458017" lat="42.3754311174">
        <time>2014-08-10T09:05:52.000-04:00</time>
        <type>place</type>
      </trkpt>
      <trkpt lon="-71.1114458017" lat="42.3754311174">
        <time>2014-08-10T10:35:35.000-04:00</time>
        <type>place</type>
      </trkpt>
    </trkseg>
    <trkseg>
      <trkpt lon="-71.12017109498916" lat="42.37343863629133">
        <time>2014-08-10T10:49:04.000-04:00</time>
        <type>place</type>
      </trkpt>
      <trkpt lon="-71.12017109498916" lat="42.37343863629133">
        <time>2014-08-10T11:21:11.000-04:00</time>
        <type>place</type>
      </trkpt>
    </trkseg>
    <trkseg>
      <trkpt lon="-71.11741499632876" lat="42.37467597125794">
        <time>2014-08-10T11:28:07.000-04:00</time>
        <type>place</type>
      </trkpt>
      <trkpt lon="-71.11741499632876" lat="42.37467597125794">
        <time>2014-08-10T12:28:37.000-04:00</time>
        <type>place</type>
      </trkpt>
    </trkseg>
    <trkseg>
      <trkpt lon="-71.11300484548056" lat="42.37405171427381">
        <time>2014-08-10T12:37:31.000-04:00</time>
        <type>place</type>
      </trkpt>
      <trkpt lon="-71.11300484548056" lat="42.37405171427381">
        <time>2014-08-10T12:48:32.000-04:00</time>
        <type>place</type>
      </trkpt>
    </trkseg>
    <trkseg>
      <trkpt lon="-71.1114458017" lat="42.3754311174">
        <time>2014-08-10T12:51:52.000-04:00</time>
        <type>place</type>
      </trkpt>
      <trkpt lon="-71.1114458017" lat="42.3754311174">
        <time>2014-08-10T13:15:38.000-04:00</time>
        <type>place</type>
      </trkpt>
    </trkseg>
    <trkseg>
      <trkpt lon="-71.117205" lat="42.378716">
        <time>2014-08-10T13:25:55.000-04:00</time>
        <type>place</type>
      </trkpt>
      <trkpt lon="-71.117205" lat="42.378716">
        <time>2014-08-10T16:30:18.000-04:00</time>
        <type>place</type>
      </trkpt>
    </trkseg>
    <trkseg>
      <trkpt lon="-71.11300484548056" lat="42.37405171427381">
        <time>2014-08-10T16:41:41.000-04:00</time>
        <type>place</type>
      </trkpt>
      <trkpt lon="-71.11300484548056" lat="42.37405171427381">
        <time>2014-08-10T16:46:29.000-04:00</time>
        <type>place</type>
      </trkpt>
    </trkseg>
    <trkseg>
      <trkpt lon="-71.1114458017" lat="42.3754311174">
        <time>2014-08-10T16:51:24.000-04:00</time>
        <type>place</type>
      </trkpt>
      <trkpt lon="-71.1114458017" lat="42.3754311174">
        <time>2014-08-11T00:00:00.000-04:00</time>
        <type>place</type>
      </trkpt>
    </trkseg>
  </trk>
  <trk>
    <name>8/11/14</name>
    <trkseg>
      <trkpt lon="-71.1114458017" lat="42.3754311174">
        <time>2014-08-11T00:00:00.000-04:00</time>
        <type>place</type>
      </trkpt>
      <trkpt lon="-71.1114458017" lat="42.3754311174">
        <time>2014-08-11T08:33:57.000-04:00</time>
        <type>place</type>
      </trkpt>
    </trkseg>
    <trkseg>
      <trkpt lon="-71.119934" lat="42.381903">
        <time>2014-08-11T08:56:17.000-04:00</time>
        <type>place</type>
      </trkpt>
      <trkpt lon="-71.119934" lat="42.381903">
        <time>2014-08-11T09:06:36.000-04:00</time>
        <type>place</type>
      </trkpt>
    </trkseg>
    <trkseg>
      <trkpt lon="-71.117205" lat="42.378716">
        <time>2014-08-11T09:14:57.000-04:00</time>
        <type>place</type>
      </trkpt>
      <trkpt lon="-71.117205" lat="42.378716">
        <time>2014-08-11T12:21:10.000-04:00</time>
        <type>place</type>
      </trkpt>
    </trkseg>
    <trkseg>
      <trkpt lon="-71.1114458017" lat="42.3754311174">
        <time>2014-08-11T12:33:31.000-04:00</time>
        <type>place</type>
      </trkpt>
      <trkpt lon="-71.1114458017" lat="42.3754311174">
        <time>2014-08-11T14:21:23.000-04:00</time>
        <type>place</type>
      </trkpt>
    </trkseg>
    <trkseg>
      <trkpt lon="-71.117205" lat="42.378716">
        <time>2014-08-11T14:38:24.000-04:00</time>
        <type>place</type>
      </trkpt>
      <trkpt lon="-71.117205" lat="42.378716">
        <time>2014-08-11T16:39:53.000-04:00</time>
        <type>place</type>
      </trkpt>
    </trkseg>
    <trkseg>
      <trkpt lon="-71.117205" lat="42.378716">
        <time>2014-08-11T17:13:41.000-04:00</time>
        <type>place</type>
      </trkpt>
      <trkpt lon="-71.117205" lat="42.378716">
        <time>2014-08-11T19:35:45.000-04:00</time>
        <type>place</type>
      </trkpt>
    </trkseg>
    <trkseg>
      <trkpt lon="-71.1114458017" lat="42.3754311174">
        <time>2014-08-11T19:52:37.000-04:00</time>
        <type>place</type>
      </trkpt>
      <trkpt lon="-71.1114458017" lat="42.3754311174">
        <time>2014-08-12T00:00:00.000-04:00</time>
        <type>place</type>
      </trkpt>
    </trkseg>
  </trk>
  <trk>
    <name>8/12/14</name>
    <trkseg>
      <trkpt lon="-71.1114458017" lat="42.3754311174">
        <time>2014-08-12T00:00:00.000-04:00</time>
        <type>place</type>
      </trkpt>
      <trkpt lon="-71.1114458017" lat="42.3754311174">
        <time>2014-08-12T07:57:53.000-04:00</time>
        <type>place</type>
      </trkpt>
    </trkseg>
    <trkseg>
      <trkpt lon="-71.11899197101593" lat="42.37402935435937">
        <time>2014-08-12T08:09:02.000-04:00</time>
        <type>place</type>
      </trkpt>
      <trkpt lon="-71.11899197101593" lat="42.37402935435937">
        <time>2014-08-12T08:27:55.000-04:00</time>
        <type>place</type>
      </trkpt>
    </trkseg>
    <trkseg>
      <trkpt lon="-71.117205" lat="42.378716">
        <time>2014-08-12T08:35:59.000-04:00</time>
        <type>place</type>
      </trkpt>
      <trkpt lon="-71.117205" lat="42.378716">
        <time>2014-08-12T10:09:13.000-04:00</time>
        <type>place</type>
      </trkpt>
    </trkseg>
    <trkseg>
      <trkpt lon="-71.119934" lat="42.381903">
        <time>2014-08-12T10:16:58.000-04:00</time>
        <type>place</type>
      </trkpt>
      <trkpt lon="-71.119934" lat="42.381903">
        <time>2014-08-12T10:22:49.000-04:00</time>
        <type>place</type>
      </trkpt>
    </trkseg>
    <trkseg>
      <trkpt lon="-71.117205" lat="42.378716">
        <time>2014-08-12T10:30:36.000-04:00</time>
        <type>place</type>
      </trkpt>
      <trkpt lon="-71.117205" lat="42.378716">
        <time>2014-08-12T12:57:09.000-04:00</time>
        <type>place</type>
      </trkpt>
    </trkseg>
    <trkseg>
      <trkpt lon="-71.120141" lat="42.3743468">
        <time>2014-08-12T13:06:21.000-04:00</time>
        <type>place</type>
      </trkpt>
      <trkpt lon="-71.120141" lat="42.3743468">
        <time>2014-08-12T13:50:08.000-04:00</time>
        <type>place</type>
      </trkpt>
    </trkseg>
    <trkseg>
      <trkpt lon="-71.117205" lat="42.378716">
        <time>2014-08-12T14:01:05.000-04:00</time>
        <type>place</type>
      </trkpt>
      <trkpt lon="-71.117205" lat="42.378716">
        <time>2014-08-12T18:38:55.000-04:00</time>
        <type>place</type>
      </trkpt>
    </trkseg>
    <trkseg>
      <trkpt lon="-71.11300484548056" lat="42.37405171427381">
        <time>2014-08-12T18:50:08.000-04:00</time>
        <type>place</type>
      </trkpt>
      <trkpt lon="-71.11300484548056" lat="42.37405171427381">
        <time>2014-08-12T18:54:01.000-04:00</time>
        <type>place</type>
      </trkpt>
    </trkseg>
    <trkseg>
      <trkpt lon="-71.1114458017" lat="42.3754311174">
        <time>2014-08-12T19:01:24.000-04:00</time>
        <type>place</type>
      </trkpt>
      <trkpt lon="-71.1114458017" lat="42.3754311174">
        <time>2014-08-13T00:00:00.000-04:00</time>
        <type>place</type>
      </trkpt>
    </trkseg>
  </trk>
  <trk>
    <name>8/13/14</name>
    <trkseg>
      <trkpt lon="-71.1114458017" lat="42.3754311174">
        <time>2014-08-13T00:00:00.000-04:00</time>
        <type>place</type>
      </trkpt>
      <trkpt lon="-71.1114458017" lat="42.3754311174">
        <time>2014-08-13T10:16:00.000-04:00</time>
        <type>place</type>
      </trkpt>
    </trkseg>
    <trkseg>
      <trkpt lon="-71.117205" lat="42.378716">
        <time>2014-08-13T10:26:49.000-04:00</time>
        <type>place</type>
      </trkpt>
      <trkpt lon="-71.117205" lat="42.378716">
        <time>2014-08-13T12:25:08.000-04:00</time>
        <type>place</type>
      </trkpt>
    </trkseg>
    <trkseg>
      <trkpt lon="-71.08609199523926" lat="42.36253950179547">
        <time>2014-08-13T12:36:27.000-04:00</time>
        <type>place</type>
      </trkpt>
      <trkpt lon="-71.08609199523926" lat="42.36253950179547">
        <time>2014-08-13T13:40:39.000-04:00</time>
        <type>place</type>
      </trkpt>
    </trkseg>
    <trkseg>
      <trkpt lon="-71.08162851792984" lat="42.36239871356099">
        <time>2014-08-13T13:48:55.000-04:00</time>
        <type>place</type>
      </trkpt>
      <trkpt lon="-71.08162851792984" lat="42.36239871356099">
        <time>2014-08-13T14:29:52.000-04:00</time>
        <type>place</type>
      </trkpt>
    </trkseg>
    <trkseg>
      <trkpt lon="-71.12325225275964" lat="42.37317592010315">
        <time>2014-08-13T15:01:27.000-04:00</time>
        <type>place</type>
      </trkpt>
      <trkpt lon="-71.12325225275964" lat="42.37317592010315">
        <time>2014-08-13T16:15:10.000-04:00</time>
        <type>place</type>
      </trkpt>
    </trkseg>
    <trkseg>
      <trkpt lon="-71.12017" lat="42.374494">
        <time>2014-08-13T16:19:59.000-04:00</time>
        <type>place</type>
      </trkpt>
      <trkpt lon="-71.12017" lat="42.374494">
        <time>2014-08-13T16:24:21.000-04:00</time>
        <type>place</type>
      </trkpt>
    </trkseg>
    <trkseg>
      <trkpt lon="-71.117205" lat="42.378716">
        <time>2014-08-13T16:33:33.000-04:00</time>
        <type>place</type>
      </trkpt>
      <trkpt lon="-71.117205" lat="42.378716">
        <time>2014-08-13T16:42:23.000-04:00</time>
        <type>place</type>
      </trkpt>
    </trkseg>
    <trkseg>
      <trkpt lon="-71.1114458017" lat="42.3754311174">
        <time>2014-08-13T16:52:00.000-04:00</time>
        <type>place</type>
      </trkpt>
      <trkpt lon="-71.1114458017" lat="42.3754311174">
        <time>2014-08-14T00:00:00.000-04:00</time>
        <type>place</type>
      </trkpt>
    </trkseg>
  </trk>
  <trk>
    <name>8/14/14</name>
    <trkseg>
      <trkpt lon="-71.1114458017" lat="42.3754311174">
        <time>2014-08-14T00:00:00.000-04:00</time>
        <type>place</type>
      </trkpt>
      <trkpt lon="-71.1114458017" lat="42.3754311174">
        <time>2014-08-14T09:11:04.000-04:00</time>
        <type>place</type>
      </trkpt>
    </trkseg>
    <trkseg>
      <trkpt lon="-71.117205" lat="42.378716">
        <time>2014-08-14T09:21:56.000-04:00</time>
        <type>place</type>
      </trkpt>
      <trkpt lon="-71.117205" lat="42.378716">
        <time>2014-08-14T09:43:31.000-04:00</time>
        <type>place</type>
      </trkpt>
    </trkseg>
    <trkseg>
      <trkpt lon="-71.12325225275964" lat="42.37317592010315">
        <time>2014-08-14T09:56:29.000-04:00</time>
        <type>place</type>
      </trkpt>
      <trkpt lon="-71.12325225275964" lat="42.37317592010315">
        <time>2014-08-14T11:04:09.000-04:00</time>
        <type>place</type>
      </trkpt>
    </trkseg>
    <trkseg>
      <trkpt lon="-71.11896514892578" lat="42.37331996935519">
        <time>2014-08-14T11:06:50.000-04:00</time>
        <type>place</type>
      </trkpt>
      <trkpt lon="-71.11896514892578" lat="42.37331996935519">
        <time>2014-08-14T12:28:19.000-04:00</time>
        <type>place</type>
      </trkpt>
    </trkseg>
    <trkseg>
      <trkpt lon="-71.12077832221985" lat="42.37237675230346">
        <time>2014-08-14T12:33:36.000-04:00</time>
        <type>place</type>
      </trkpt>
      <trkpt lon="-71.12077832221985" lat="42.37237675230346">
        <time>2014-08-14T13:41:55.000-04:00</time>
        <type>place</type>
      </trkpt>
    </trkseg>
    <trkseg>
      <trkpt lon="-71.1114458017" lat="42.3754311174">
        <time>2014-08-14T14:07:57.000-04:00</time>
        <type>place</type>
      </trkpt>
      <trkpt lon="-71.1114458017" lat="42.3754311174">
        <time>2014-08-14T19:23:15.000-04:00</time>
        <type>place</type>
      </trkpt>
    </trkseg>
    <trkseg>
      <trkpt lon="-71.117205" lat="42.378716">
        <time>2014-08-14T19:39:24.000-04:00</time>
        <type>place</type>
      </trkpt>
      <trkpt lon="-71.117205" lat="42.378716">
        <time>2014-08-14T19:42:54.000-04:00</time>
        <type>place</type>
      </trkpt>
    </trkseg>
    <trkseg>
      <trkpt lon="-71.12097185013617" lat="42.37169409933257">
        <time>2014-08-14T19:56:29.000-04:00</time>
        <type>place</type>
      </trkpt>
      <trkpt lon="-71.12097185013617" lat="42.37169409933257">
        <time>2014-08-14T21:36:30.000-04:00</time>
        <type>place</type>
      </trkpt>
    </trkseg>
    <trkseg>
      <trkpt lon="-71.1114458017" lat="42.3754311174">
        <time>2014-08-14T21:52:34.000-04:00</time>
        <type>place</type>
      </trkpt>
      <trkpt lon="-71.1114458017" lat="42.3754311174">
        <time>2014-08-15T00:00:00.000-04:00</time>
        <type>place</type>
      </trkpt>
    </trkseg>
  </trk>
  <trk>
    <name>8/15/14</name>
    <trkseg>
      <trkpt lon="-71.1114458017" lat="42.3754311174">
        <time>2014-08-15T00:00:00.000-04:00</time>
        <type>place</type>
      </trkpt>
      <trkpt lon="-71.1114458017" lat="42.3754311174">
        <time>2014-08-15T10:05:22.000-04:00</time>
        <type>place</type>
      </trkpt>
    </trkseg>
    <trkseg>
      <trkpt lon="-71.05773051318191" lat="42.3568123867606">
        <time>2014-08-15T10:50:11.000-04:00</time>
        <type>place</type>
      </trkpt>
      <trkpt lon="-71.05773051318191" lat="42.3568123867606">
        <time>2014-08-15T11:52:40.000-04:00</time>
        <type>place</type>
      </trkpt>
    </trkseg>
    <trkseg>
      <trkpt lon="-71.117205" lat="42.378716">
        <time>2014-08-15T12:24:38.000-04:00</time>
        <type>place</type>
      </trkpt>
      <trkpt lon="-71.117205" lat="42.378716">
        <time>2014-08-15T12:43:44.000-04:00</time>
        <type>place</type>
      </trkpt>
    </trkseg>
    <trkseg>
      <trkpt lon="-71.12017" lat="42.374494">
        <time>2014-08-15T12:53:31.000-04:00</time>
        <type>place</type>
      </trkpt>
      <trkpt lon="-71.12017" lat="42.374494">
        <time>2014-08-15T13:41:24.000-04:00</time>
        <type>place</type>
      </trkpt>
    </trkseg>
    <trkseg>
      <trkpt lon="-71.1213492043" lat="42.3756232629">
        <time>2014-08-15T14:02:15.000-04:00</time>
        <type>place</type>
      </trkpt>
      <trkpt lon="-71.1213492043" lat="42.3756232629">
        <time>2014-08-15T14:04:15.000-04:00</time>
        <type>place</type>
      </trkpt>
    </trkseg>
    <trkseg>
      <trkpt lon="-71.11899197101593" lat="42.37402935435937">
        <time>2014-08-15T14:10:11.000-04:00</time>
        <type>place</type>
      </trkpt>
      <trkpt lon="-71.11899197101593" lat="42.37402935435937">
        <time>2014-08-15T14:19:16.000-04:00</time>
        <type>place</type>
      </trkpt>
    </trkseg>
    <trkseg>
      <trkpt lon="-71.12325225275964" lat="42.37317592010315">
        <time>2014-08-15T14:26:39.000-04:00</time>
        <type>place</type>
      </trkpt>
      <trkpt lon="-71.12325225275964" lat="42.37317592010315">
        <time>2014-08-15T15:15:12.000-04:00</time>
        <type>place</type>
      </trkpt>
    </trkseg>
    <trkseg>
      <trkpt lon="-71.1114458017" lat="42.3754311174">
        <time>2014-08-15T15:35:42.000-04:00</time>
        <type>place</type>
      </trkpt>
      <trkpt lon="-71.1114458017" lat="42.3754311174">
        <time>2014-08-16T00:00:00.000-04:00</time>
        <type>place</type>
      </trkpt>
    </trkseg>
  </trk>
  <trk>
    <name>8/16/14</name>
    <trkseg>
      <trkpt lon="-71.1114458017" lat="42.3754311174">
        <time>2014-08-16T00:00:00.000-04:00</time>
        <type>place</type>
      </trkpt>
      <trkpt lon="-71.1114458017" lat="42.3754311174">
        <time>2014-08-16T11:06:55.000-04:00</time>
        <type>place</type>
      </trkpt>
    </trkseg>
    <trkseg>
      <trkpt lon="-71.12294" lat="42.373417">
        <time>2014-08-16T11:27:21.000-04:00</time>
        <type>place</type>
      </trkpt>
      <trkpt lon="-71.12294" lat="42.373417">
        <time>2014-08-16T11:42:02.000-04:00</time>
        <type>place</type>
      </trkpt>
    </trkseg>
    <trkseg>
      <trkpt lon="-71.117205" lat="42.378716">
        <time>2014-08-16T11:53:31.000-04:00</time>
        <type>place</type>
      </trkpt>
      <trkpt lon="-71.117205" lat="42.378716">
        <time>2014-08-16T13:54:19.000-04:00</time>
        <type>place</type>
      </trkpt>
    </trkseg>
    <trkseg>
      <trkpt lon="-71.1114458017" lat="42.3754311174">
        <time>2014-08-16T14:04:03.000-04:00</time>
        <type>place</type>
      </trkpt>
      <trkpt lon="-71.1114458017" lat="42.3754311174">
        <time>2014-08-16T14:36:16.000-04:00</time>
        <type>place</type>
      </trkpt>
    </trkseg>
    <trkseg>
      <trkpt lon="-71.1114458017" lat="42.3754311174">
        <time>2014-08-16T15:02:46.000-04:00</time>
        <type>place</type>
      </trkpt>
      <trkpt lon="-71.1114458017" lat="42.3754311174">
        <time>2014-08-16T20:38:25.000-04:00</time>
        <type>place</type>
      </trkpt>
    </trkseg>
    <trkseg>
      <trkpt lon="-71.1114458017" lat="42.3754311174">
        <time>2014-08-16T21:32:48.000-04:00</time>
        <type>place</type>
      </trkpt>
      <trkpt lon="-71.1114458017" lat="42.3754311174">
        <time>2014-08-17T00:00:00.000-04:00</time>
        <type>place</type>
      </trkpt>
    </trkseg>
  </trk>
  <trk>
    <name>8/17/14</name>
    <trkseg>
      <trkpt lon="-71.1114458017" lat="42.3754311174">
        <time>2014-08-17T00:00:00.000-04:00</time>
        <type>place</type>
      </trkpt>
      <trkpt lon="-71.1114458017" lat="42.3754311174">
        <time>2014-08-17T08:03:00.000-04:00</time>
        <type>place</type>
      </trkpt>
    </trkseg>
    <trkseg>
      <trkpt lon="-71.1102186498" lat="42.3749912448">
        <time>2014-08-17T08:03:01.000-04:00</time>
        <type>place</type>
      </trkpt>
      <trkpt lon="-71.1102186498" lat="42.3749912448">
        <time>2014-08-17T08:12:58.000-04:00</time>
        <type>place</type>
      </trkpt>
    </trkseg>
    <trkseg>
      <trkpt lon="-71.1114458017" lat="42.3754311174">
        <time>2014-08-17T08:12:58.000-04:00</time>
        <type>place</type>
      </trkpt>
      <trkpt lon="-71.1114458017" lat="42.3754311174">
        <time>2014-08-17T11:27:54.000-04:00</time>
        <type>place</type>
      </trkpt>
    </trkseg>
    <trkseg>
      <trkpt lon="-71.11353635787964" lat="42.36892873750989">
        <time>2014-08-17T11:46:41.000-04:00</time>
        <type>place</type>
      </trkpt>
      <trkpt lon="-71.11353635787964" lat="42.36892873750989">
        <time>2014-08-17T12:13:39.000-04:00</time>
        <type>place</type>
      </trkpt>
    </trkseg>
    <trkseg>
      <trkpt lon="-71.12218458495514" lat="42.36522543920124">
        <time>2014-08-17T12:37:26.000-04:00</time>
        <type>place</type>
      </trkpt>
      <trkpt lon="-71.12218458495514" lat="42.36522543920124">
        <time>2014-08-17T16:02:55.000-04:00</time>
        <type>place</type>
      </trkpt>
    </trkseg>
    <trkseg>
      <trkpt lon="-71.1117795529" lat="42.3703280547">
        <time>2014-08-17T16:29:30.000-04:00</time>
        <type>place</type>
      </trkpt>
      <trkpt lon="-71.1117795529" lat="42.3703280547">
        <time>2014-08-17T18:12:03.000-04:00</time>
        <type>place</type>
      </trkpt>
    </trkseg>
    <trkseg>
      <trkpt lon="-71.12218458495514" lat="42.36522543920124">
        <time>2014-08-17T18:34:50.000-04:00</time>
        <type>place</type>
      </trkpt>
      <trkpt lon="-71.12218458495514" lat="42.36522543920124">
        <time>2014-08-17T20:49:05.000-04:00</time>
        <type>place</type>
      </trkpt>
    </trkseg>
    <trkseg>
      <trkpt lon="-71.12407621183526" lat="42.36403242532342">
        <time>2014-08-17T20:56:24.000-04:00</time>
        <type>place</type>
      </trkpt>
      <trkpt lon="-71.12407621183526" lat="42.36403242532342">
        <time>2014-08-17T22:51:24.000-04:00</time>
        <type>place</type>
      </trkpt>
    </trkseg>
    <trkseg>
      <trkpt lon="-71.11899197101593" lat="42.37402935435937">
        <time>2014-08-17T23:20:44.000-04:00</time>
        <type>place</type>
      </trkpt>
      <trkpt lon="-71.11899197101593" lat="42.37402935435937">
        <time>2014-08-17T23:25:27.000-04:00</time>
        <type>place</type>
      </trkpt>
    </trkseg>
    <trkseg>
      <trkpt lon="-71.1114458017" lat="42.3754311174">
        <time>2014-08-17T23:36:31.000-04:00</time>
        <type>place</type>
      </trkpt>
      <trkpt lon="-71.1114458017" lat="42.3754311174">
        <time>2014-08-18T00:00:00.000-04:00</time>
        <type>place</type>
      </trkpt>
    </trkseg>
  </trk>
  <trk>
    <name>8/18/14</name>
    <trkseg>
      <trkpt lon="-71.1114458017" lat="42.3754311174">
        <time>2014-08-18T00:00:00.000-04:00</time>
        <type>place</type>
      </trkpt>
      <trkpt lon="-71.1114458017" lat="42.3754311174">
        <time>2014-08-18T07:30:37.000-04:00</time>
        <type>place</type>
      </trkpt>
    </trkseg>
    <trkseg>
      <trkpt lon="-71.11295" lat="42.373886">
        <time>2014-08-18T07:34:23.000-04:00</time>
        <type>place</type>
      </trkpt>
      <trkpt lon="-71.11295" lat="42.373886">
        <time>2014-08-18T07:37:38.000-04:00</time>
        <type>place</type>
      </trkpt>
    </trkseg>
    <trkseg>
      <trkpt lon="-71.12210915179602" lat="42.36578780710847">
        <time>2014-08-18T08:13:08.000-04:00</time>
        <type>place</type>
      </trkpt>
      <trkpt lon="-71.12210915179602" lat="42.36578780710847">
        <time>2014-08-18T11:49:32.000-04:00</time>
        <type>place</type>
      </trkpt>
    </trkseg>
    <trkseg>
      <trkpt lon="-71.12017109498916" lat="42.37343863629133">
        <time>2014-08-18T12:04:34.000-04:00</time>
        <type>place</type>
      </trkpt>
      <trkpt lon="-71.12017109498916" lat="42.37343863629133">
        <time>2014-08-18T14:55:11.000-04:00</time>
        <type>place</type>
      </trkpt>
    </trkseg>
    <trkseg>
      <trkpt lon="-71.1114458017" lat="42.3754311174">
        <time>2014-08-18T15:16:20.000-04:00</time>
        <type>place</type>
      </trkpt>
      <trkpt lon="-71.1114458017" lat="42.3754311174">
        <time>2014-08-18T20:00:46.000-04:00</time>
        <type>place</type>
      </trkpt>
    </trkseg>
    <trkseg>
      <trkpt lon="-71.12218458495514" lat="42.36522543920124">
        <time>2014-08-18T20:23:27.000-04:00</time>
        <type>place</type>
      </trkpt>
      <trkpt lon="-71.12218458495514" lat="42.36522543920124">
        <time>2014-08-18T21:22:18.000-04:00</time>
        <type>place</type>
      </trkpt>
    </trkseg>
    <trkseg>
      <trkpt lon="-71.12407621183526" lat="42.36403242532342">
        <time>2014-08-18T21:28:37.000-04:00</time>
        <type>place</type>
      </trkpt>
      <trkpt lon="-71.12407621183526" lat="42.36403242532342">
        <time>2014-08-18T23:11:08.000-04:00</time>
        <type>place</type>
      </trkpt>
    </trkseg>
    <trkseg>
      <trkpt lon="-71.1114458017" lat="42.3754311174">
        <time>2014-08-18T23:39:30.000-04:00</time>
        <type>place</type>
      </trkpt>
      <trkpt lon="-71.1114458017" lat="42.3754311174">
        <time>2014-08-19T00:00:00.000-04:00</time>
        <type>place</type>
      </trkpt>
    </trkseg>
  </trk>
  <trk>
    <name>8/19/14</name>
    <trkseg>
      <trkpt lon="-71.1114458017" lat="42.3754311174">
        <time>2014-08-19T00:00:00.000-04:00</time>
        <type>place</type>
      </trkpt>
      <trkpt lon="-71.1114458017" lat="42.3754311174">
        <time>2014-08-19T06:55:40.000-04:00</time>
        <type>place</type>
      </trkpt>
    </trkseg>
    <trkseg>
      <trkpt lon="-71.12210915179602" lat="42.36578780710847">
        <time>2014-08-19T07:26:19.000-04:00</time>
        <type>place</type>
      </trkpt>
      <trkpt lon="-71.12210915179602" lat="42.36578780710847">
        <time>2014-08-19T11:52:39.000-04:00</time>
        <type>place</type>
      </trkpt>
    </trkseg>
    <trkseg>
      <trkpt lon="-71.1114458017" lat="42.3754311174">
        <time>2014-08-19T12:21:10.000-04:00</time>
        <type>place</type>
      </trkpt>
      <trkpt lon="-71.1114458017" lat="42.3754311174">
        <time>2014-08-19T14:27:53.000-04:00</time>
        <type>place</type>
      </trkpt>
    </trkseg>
    <trkseg>
      <trkpt lon="-71.12218458495514" lat="42.36522543920124">
        <time>2014-08-19T14:55:35.000-04:00</time>
        <type>place</type>
      </trkpt>
      <trkpt lon="-71.12218458495514" lat="42.36522543920124">
        <time>2014-08-19T21:29:23.000-04:00</time>
        <type>place</type>
      </trkpt>
    </trkseg>
    <trkseg>
      <trkpt lon="-71.12407621183526" lat="42.36403242532342">
        <time>2014-08-19T21:35:07.000-04:00</time>
        <type>place</type>
      </trkpt>
      <trkpt lon="-71.12407621183526" lat="42.36403242532342">
        <time>2014-08-19T22:59:52.000-04:00</time>
        <type>place</type>
      </trkpt>
    </trkseg>
    <trkseg>
      <trkpt lon="-71.1161356011" lat="42.3644780953">
        <time>2014-08-19T23:10:46.000-04:00</time>
        <type>place</type>
      </trkpt>
      <trkpt lon="-71.1161356011" lat="42.3644780953">
        <time>2014-08-19T23:13:02.000-04:00</time>
        <type>place</type>
      </trkpt>
    </trkseg>
    <trkseg>
      <trkpt lon="-71.1139945613" lat="42.3645380273">
        <time>2014-08-19T23:15:39.000-04:00</time>
        <type>place</type>
      </trkpt>
      <trkpt lon="-71.1139945613" lat="42.3645380273">
        <time>2014-08-19T23:24:34.000-04:00</time>
        <type>place</type>
      </trkpt>
    </trkseg>
    <trkseg>
      <trkpt lon="-71.1114458017" lat="42.3754311174">
        <time>2014-08-19T23:41:46.000-04:00</time>
        <type>place</type>
      </trkpt>
      <trkpt lon="-71.1114458017" lat="42.3754311174">
        <time>2014-08-20T00:00:00.000-04:00</time>
        <type>place</type>
      </trkpt>
    </trkseg>
  </trk>
  <trk>
    <name>8/20/14</name>
    <trkseg>
      <trkpt lon="-71.1114458017" lat="42.3754311174">
        <time>2014-08-20T00:00:00.000-04:00</time>
        <type>place</type>
      </trkpt>
      <trkpt lon="-71.1114458017" lat="42.3754311174">
        <time>2014-08-20T07:51:58.000-04:00</time>
        <type>place</type>
      </trkpt>
    </trkseg>
    <trkseg>
      <trkpt lon="-71.12210915179602" lat="42.36578780710847">
        <time>2014-08-20T08:23:34.000-04:00</time>
        <type>place</type>
      </trkpt>
      <trkpt lon="-71.12210915179602" lat="42.36578780710847">
        <time>2014-08-20T11:43:23.000-04:00</time>
        <type>place</type>
      </trkpt>
    </trkseg>
    <trkseg>
      <trkpt lon="-71.1114458017" lat="42.3754311174">
        <time>2014-08-20T12:07:30.000-04:00</time>
        <type>place</type>
      </trkpt>
      <trkpt lon="-71.1114458017" lat="42.3754311174">
        <time>2014-08-20T15:42:21.000-04:00</time>
        <type>place</type>
      </trkpt>
    </trkseg>
    <trkseg>
      <trkpt lon="-71.12210915179602" lat="42.36578780710847">
        <time>2014-08-20T16:10:20.000-04:00</time>
        <type>place</type>
      </trkpt>
      <trkpt lon="-71.12210915179602" lat="42.36578780710847">
        <time>2014-08-20T23:02:52.000-04:00</time>
        <type>place</type>
      </trkpt>
    </trkseg>
    <trkseg>
      <trkpt lon="-71.1114458017" lat="42.3754311174">
        <time>2014-08-20T23:29:31.000-04:00</time>
        <type>place</type>
      </trkpt>
      <trkpt lon="-71.1114458017" lat="42.3754311174">
        <time>2014-08-21T00:00:00.000-04:00</time>
        <type>place</type>
      </trkpt>
    </trkseg>
  </trk>
  <trk>
    <name>8/21/14</name>
    <trkseg>
      <trkpt lon="-71.1114458017" lat="42.3754311174">
        <time>2014-08-21T00:00:00.000-04:00</time>
        <type>place</type>
      </trkpt>
      <trkpt lon="-71.1114458017" lat="42.3754311174">
        <time>2014-08-21T07:52:09.000-04:00</time>
        <type>place</type>
      </trkpt>
    </trkseg>
    <trkseg>
      <trkpt lon="-71.12248051490364" lat="42.36595739324783">
        <time>2014-08-21T08:14:51.000-04:00</time>
        <type>place</type>
      </trkpt>
      <trkpt lon="-71.12248051490364" lat="42.36595739324783">
        <time>2014-08-21T12:01:27.000-04:00</time>
        <type>place</type>
      </trkpt>
    </trkseg>
    <trkseg>
      <trkpt lon="-71.1114458017" lat="42.3754311174">
        <time>2014-08-21T12:28:35.000-04:00</time>
        <type>place</type>
      </trkpt>
      <trkpt lon="-71.1114458017" lat="42.3754311174">
        <time>2014-08-21T16:15:35.000-04:00</time>
        <type>place</type>
      </trkpt>
    </trkseg>
    <trkseg>
      <trkpt lon="-71.11353635787964" lat="42.36892873750989">
        <time>2014-08-21T16:22:58.000-04:00</time>
        <type>place</type>
      </trkpt>
      <trkpt lon="-71.11353635787964" lat="42.36892873750989">
        <time>2014-08-21T16:25:29.000-04:00</time>
        <type>place</type>
      </trkpt>
    </trkseg>
    <trkseg>
      <trkpt lon="-71.1154986639" lat="42.3677504203">
        <time>2014-08-21T16:28:40.000-04:00</time>
        <type>place</type>
      </trkpt>
      <trkpt lon="-71.1154986639" lat="42.3677504203">
        <time>2014-08-21T16:31:02.000-04:00</time>
        <type>place</type>
      </trkpt>
    </trkseg>
    <trkseg>
      <trkpt lon="-71.12218458495514" lat="42.36522543920124">
        <time>2014-08-21T16:42:37.000-04:00</time>
        <type>place</type>
      </trkpt>
      <trkpt lon="-71.12218458495514" lat="42.36522543920124">
        <time>2014-08-21T21:20:16.000-04:00</time>
        <type>place</type>
      </trkpt>
    </trkseg>
    <trkseg>
      <trkpt lon="-71.12407621183526" lat="42.36403242532342">
        <time>2014-08-21T21:26:30.000-04:00</time>
        <type>place</type>
      </trkpt>
      <trkpt lon="-71.12407621183526" lat="42.36403242532342">
        <time>2014-08-21T22:45:52.000-04:00</time>
        <type>place</type>
      </trkpt>
    </trkseg>
    <trkseg>
      <trkpt lon="-71.1114458017" lat="42.3754311174">
        <time>2014-08-21T23:15:48.000-04:00</time>
        <type>place</type>
      </trkpt>
      <trkpt lon="-71.1114458017" lat="42.3754311174">
        <time>2014-08-22T00:00:00.000-04:00</time>
        <type>place</type>
      </trkpt>
    </trkseg>
  </trk>
  <trk>
    <name>8/22/14</name>
    <trkseg>
      <trkpt lon="-71.1114458017" lat="42.3754311174">
        <time>2014-08-22T00:00:00.000-04:00</time>
        <type>place</type>
      </trkpt>
      <trkpt lon="-71.1114458017" lat="42.3754311174">
        <time>2014-08-22T07:52:46.000-04:00</time>
        <type>place</type>
      </trkpt>
    </trkseg>
    <trkseg>
      <trkpt lon="-71.12248051490364" lat="42.36595739324783">
        <time>2014-08-22T08:20:11.000-04:00</time>
        <type>place</type>
      </trkpt>
      <trkpt lon="-71.12248051490364" lat="42.36595739324783">
        <time>2014-08-22T13:31:02.000-04:00</time>
        <type>place</type>
      </trkpt>
    </trkseg>
    <trkseg>
      <trkpt lon="-71.11859279030334" lat="42.37272429096316">
        <time>2014-08-22T13:55:07.000-04:00</time>
        <type>place</type>
      </trkpt>
      <trkpt lon="-71.11859279030334" lat="42.37272429096316">
        <time>2014-08-22T14:04:35.000-04:00</time>
        <type>place</type>
      </trkpt>
    </trkseg>
    <trkseg>
      <trkpt lon="-71.1114458017" lat="42.3754311174">
        <time>2014-08-22T14:18:43.000-04:00</time>
        <type>place</type>
      </trkpt>
      <trkpt lon="-71.1114458017" lat="42.3754311174">
        <time>2014-08-22T14:43:05.000-04:00</time>
        <type>place</type>
      </trkpt>
    </trkseg>
    <trkseg>
      <trkpt lon="-71.117205" lat="42.378716">
        <time>2014-08-22T14:58:46.000-04:00</time>
        <type>place</type>
      </trkpt>
      <trkpt lon="-71.117205" lat="42.378716">
        <time>2014-08-22T21:21:02.000-04:00</time>
        <type>place</type>
      </trkpt>
    </trkseg>
    <trkseg>
      <trkpt lon="-71.1114458017" lat="42.3754311174">
        <time>2014-08-22T21:32:57.000-04:00</time>
        <type>place</type>
      </trkpt>
      <trkpt lon="-71.1114458017" lat="42.3754311174">
        <time>2014-08-23T00:00:00.000-04:00</time>
        <type>place</type>
      </trkpt>
    </trkseg>
  </trk>
  <trk>
    <name>8/23/14</name>
    <trkseg>
      <trkpt lon="-71.1114458017" lat="42.3754311174">
        <time>2014-08-23T00:00:00.000-04:00</time>
        <type>place</type>
      </trkpt>
      <trkpt lon="-71.1114458017" lat="42.3754311174">
        <time>2014-08-23T15:03:47.000-04:00</time>
        <type>place</type>
      </trkpt>
    </trkseg>
    <trkseg>
      <trkpt lon="-71.11295" lat="42.373886">
        <time>2014-08-23T15:11:46.000-04:00</time>
        <type>place</type>
      </trkpt>
      <trkpt lon="-71.11295" lat="42.373886">
        <time>2014-08-23T15:28:03.000-04:00</time>
        <type>place</type>
      </trkpt>
    </trkseg>
    <trkseg>
      <trkpt lon="-71.1114458017" lat="42.3754311174">
        <time>2014-08-23T15:34:53.000-04:00</time>
        <type>place</type>
      </trkpt>
      <trkpt lon="-71.1114458017" lat="42.3754311174">
        <time>2014-08-23T17:34:56.000-04:00</time>
        <type>place</type>
      </trkpt>
    </trkseg>
    <trkseg>
      <trkpt lon="-71.11896514892578" lat="42.37331996935519">
        <time>2014-08-23T17:45:21.000-04:00</time>
        <type>place</type>
      </trkpt>
      <trkpt lon="-71.11896514892578" lat="42.37331996935519">
        <time>2014-08-23T17:52:11.000-04:00</time>
        <type>place</type>
      </trkpt>
    </trkseg>
    <trkseg>
      <trkpt lon="-71.02003455162048" lat="42.36947567662487">
        <time>2014-08-23T18:44:01.000-04:00</time>
        <type>place</type>
      </trkpt>
      <trkpt lon="-71.02003455162048" lat="42.36947567662487">
        <time>2014-08-23T20:09:11.000-04:00</time>
        <type>place</type>
      </trkpt>
    </trkseg>
    <trkseg>
      <trkpt lon="-71.1114458017" lat="42.3754311174">
        <time>2014-08-23T20:32:34.000-04:00</time>
        <type>place</type>
      </trkpt>
      <trkpt lon="-71.1114458017" lat="42.3754311174">
        <time>2014-08-23T21:41:37.000-04:00</time>
        <type>place</type>
      </trkpt>
    </trkseg>
    <trkseg>
      <trkpt lon="-71.11618638038635" lat="42.379328">
        <time>2014-08-23T21:57:39.000-04:00</time>
        <type>place</type>
      </trkpt>
      <trkpt lon="-71.11618638038635" lat="42.379328">
        <time>2014-08-23T22:10:47.000-04:00</time>
        <type>place</type>
      </trkpt>
    </trkseg>
    <trkseg>
      <trkpt lon="-71.1114458017" lat="42.3754311174">
        <time>2014-08-23T22:24:07.000-04:00</time>
        <type>place</type>
      </trkpt>
      <trkpt lon="-71.1114458017" lat="42.3754311174">
        <time>2014-08-24T00:00:00.000-04:00</time>
        <type>place</type>
      </trkpt>
    </trkseg>
  </trk>
  <trk>
    <name>8/24/14</name>
    <trkseg>
      <trkpt lon="-71.1114458017" lat="42.3754311174">
        <time>2014-08-24T00:00:00.000-04:00</time>
        <type>place</type>
      </trkpt>
      <trkpt lon="-71.1114458017" lat="42.3754311174">
        <time>2014-08-24T13:46:02.000-04:00</time>
        <type>place</type>
      </trkpt>
    </trkseg>
    <trkseg>
      <trkpt lon="-71.11300484548056" lat="42.37405171427381">
        <time>2014-08-24T13:54:21.000-04:00</time>
        <type>place</type>
      </trkpt>
      <trkpt lon="-71.11300484548056" lat="42.37405171427381">
        <time>2014-08-24T13:56:14.000-04:00</time>
        <type>place</type>
      </trkpt>
    </trkseg>
    <trkseg>
      <trkpt lon="-71.1114458017" lat="42.3754311174">
        <time>2014-08-24T14:01:33.000-04:00</time>
        <type>place</type>
      </trkpt>
      <trkpt lon="-71.1114458017" lat="42.3754311174">
        <time>2014-08-25T00:00:00.000-04:00</time>
        <type>place</type>
      </trkpt>
    </trkseg>
  </trk>
  <trk>
    <name>8/25/14</name>
    <trkseg>
      <trkpt lon="-71.1114458017" lat="42.3754311174">
        <time>2014-08-25T00:00:00.000-04:00</time>
        <type>place</type>
      </trkpt>
      <trkpt lon="-71.1114458017" lat="42.3754311174">
        <time>2014-08-25T07:45:49.000-04:00</time>
        <type>place</type>
      </trkpt>
    </trkseg>
    <trkseg>
      <trkpt lon="-71.119457" lat="42.373379">
        <time>2014-08-25T07:57:16.000-04:00</time>
        <type>place</type>
      </trkpt>
      <trkpt lon="-71.119457" lat="42.373379">
        <time>2014-08-25T08:00:03.000-04:00</time>
        <type>place</type>
      </trkpt>
    </trkseg>
    <trkseg>
      <trkpt lon="-71.12210915179602" lat="42.36578780710847">
        <time>2014-08-25T08:18:38.000-04:00</time>
        <type>place</type>
      </trkpt>
      <trkpt lon="-71.12210915179602" lat="42.36578780710847">
        <time>2014-08-25T14:47:00.000-04:00</time>
        <type>place</type>
      </trkpt>
    </trkseg>
    <trkseg>
      <trkpt lon="-71.12407621183526" lat="42.36403242532342">
        <time>2014-08-25T14:54:49.000-04:00</time>
        <type>place</type>
      </trkpt>
      <trkpt lon="-71.12407621183526" lat="42.36403242532342">
        <time>2014-08-25T16:03:54.000-04:00</time>
        <type>place</type>
      </trkpt>
    </trkseg>
    <trkseg>
      <trkpt lon="-71.1209586691" lat="42.3654244908">
        <time>2014-08-25T16:12:16.000-04:00</time>
        <type>place</type>
      </trkpt>
      <trkpt lon="-71.1209586691" lat="42.3654244908">
        <time>2014-08-25T18:01:47.000-04:00</time>
        <type>place</type>
      </trkpt>
    </trkseg>
    <trkseg>
      <trkpt lon="-71.1114458017" lat="42.3754311174">
        <time>2014-08-25T18:21:36.000-04:00</time>
        <type>place</type>
      </trkpt>
      <trkpt lon="-71.1114458017" lat="42.3754311174">
        <time>2014-08-25T19:37:30.000-04:00</time>
        <type>place</type>
      </trkpt>
    </trkseg>
    <trkseg>
      <trkpt lon="-71.12407621183526" lat="42.36403242532342">
        <time>2014-08-25T20:02:56.000-04:00</time>
        <type>place</type>
      </trkpt>
      <trkpt lon="-71.12407621183526" lat="42.36403242532342">
        <time>2014-08-25T21:30:31.000-04:00</time>
        <type>place</type>
      </trkpt>
    </trkseg>
    <trkseg>
      <trkpt lon="-71.1114458017" lat="42.3754311174">
        <time>2014-08-25T21:58:18.000-04:00</time>
        <type>place</type>
      </trkpt>
      <trkpt lon="-71.1114458017" lat="42.3754311174">
        <time>2014-08-26T00:00:00.000-04:00</time>
        <type>place</type>
      </trkpt>
    </trkseg>
  </trk>
  <trk>
    <name>8/26/14</name>
    <trkseg>
      <trkpt lon="-71.1114458017" lat="42.3754311174">
        <time>2014-08-26T00:00:00.000-04:00</time>
        <type>place</type>
      </trkpt>
      <trkpt lon="-71.1114458017" lat="42.3754311174">
        <time>2014-08-26T08:04:23.000-04:00</time>
        <type>place</type>
      </trkpt>
    </trkseg>
    <trkseg>
      <trkpt lon="-71.119452" lat="42.372485">
        <time>2014-08-26T08:17:50.000-04:00</time>
        <type>place</type>
      </trkpt>
      <trkpt lon="-71.119452" lat="42.372485">
        <time>2014-08-26T08:24:54.000-04:00</time>
        <type>place</type>
      </trkpt>
    </trkseg>
    <trkseg>
      <trkpt lon="-71.12210915179602" lat="42.36578780710847">
        <time>2014-08-26T08:43:24.000-04:00</time>
        <type>place</type>
      </trkpt>
      <trkpt lon="-71.12210915179602" lat="42.36578780710847">
        <time>2014-08-26T10:33:14.000-04:00</time>
        <type>place</type>
      </trkpt>
    </trkseg>
    <trkseg>
      <trkpt lon="-71.12218458495514" lat="42.36522543920124">
        <time>2014-08-26T10:33:14.000-04:00</time>
        <type>place</type>
      </trkpt>
      <trkpt lon="-71.12218458495514" lat="42.36522543920124">
        <time>2014-08-26T10:40:57.000-04:00</time>
        <type>place</type>
      </trkpt>
    </trkseg>
    <trkseg>
      <trkpt lon="-71.12218458495514" lat="42.36522543920124">
        <time>2014-08-26T10:45:54.000-04:00</time>
        <type>place</type>
      </trkpt>
      <trkpt lon="-71.12218458495514" lat="42.36522543920124">
        <time>2014-08-26T13:01:56.000-04:00</time>
        <type>place</type>
      </trkpt>
    </trkseg>
    <trkseg>
      <trkpt lon="-71.12407621183526" lat="42.36403242532342">
        <time>2014-08-26T13:04:43.000-04:00</time>
        <type>place</type>
      </trkpt>
      <trkpt lon="-71.12407621183526" lat="42.36403242532342">
        <time>2014-08-26T14:06:59.000-04:00</time>
        <type>place</type>
      </trkpt>
    </trkseg>
    <trkseg>
      <trkpt lon="-71.12325225275964" lat="42.37317592010315">
        <time>2014-08-26T14:22:58.000-04:00</time>
        <type>place</type>
      </trkpt>
      <trkpt lon="-71.12325225275964" lat="42.37317592010315">
        <time>2014-08-26T16:08:27.000-04:00</time>
        <type>place</type>
      </trkpt>
    </trkseg>
    <trkseg>
      <trkpt lon="-71.12017109498916" lat="42.37343863629133">
        <time>2014-08-26T16:13:42.000-04:00</time>
        <type>place</type>
      </trkpt>
      <trkpt lon="-71.12017109498916" lat="42.37343863629133">
        <time>2014-08-26T16:19:58.000-04:00</time>
        <type>place</type>
      </trkpt>
    </trkseg>
    <trkseg>
      <trkpt lon="-71.11747288651797" lat="42.37302773792176">
        <time>2014-08-26T16:24:11.000-04:00</time>
        <type>place</type>
      </trkpt>
      <trkpt lon="-71.11747288651797" lat="42.37302773792176">
        <time>2014-08-26T16:43:00.000-04:00</time>
        <type>place</type>
      </trkpt>
    </trkseg>
    <trkseg>
      <trkpt lon="-71.12017109498916" lat="42.37343863629133">
        <time>2014-08-26T16:47:21.000-04:00</time>
        <type>place</type>
      </trkpt>
      <trkpt lon="-71.12017109498916" lat="42.37343863629133">
        <time>2014-08-26T18:42:07.000-04:00</time>
        <type>place</type>
      </trkpt>
    </trkseg>
    <trkseg>
      <trkpt lon="-71.12299694115246" lat="42.37210143005068">
        <time>2014-08-26T18:46:58.000-04:00</time>
        <type>place</type>
      </trkpt>
      <trkpt lon="-71.12299694115246" lat="42.37210143005068">
        <time>2014-08-26T22:03:13.000-04:00</time>
        <type>place</type>
      </trkpt>
    </trkseg>
    <trkseg>
      <trkpt lon="-71.1114458017" lat="42.3754311174">
        <time>2014-08-26T22:29:19.000-04:00</time>
        <type>place</type>
      </trkpt>
      <trkpt lon="-71.1114458017" lat="42.3754311174">
        <time>2014-08-27T00:00:00.000-04:00</time>
        <type>place</type>
      </trkpt>
    </trkseg>
  </trk>
  <trk>
    <name>8/27/14</name>
    <trkseg>
      <trkpt lon="-71.1114458017" lat="42.3754311174">
        <time>2014-08-27T00:00:00.000-04:00</time>
        <type>place</type>
      </trkpt>
      <trkpt lon="-71.1114458017" lat="42.3754311174">
        <time>2014-08-27T09:48:31.000-04:00</time>
        <type>place</type>
      </trkpt>
    </trkseg>
    <trkseg>
      <trkpt lon="-71.117205" lat="42.378716">
        <time>2014-08-27T10:00:04.000-04:00</time>
        <type>place</type>
      </trkpt>
      <trkpt lon="-71.117205" lat="42.378716">
        <time>2014-08-27T13:04:37.000-04:00</time>
        <type>place</type>
      </trkpt>
    </trkseg>
    <trkseg>
      <trkpt lon="-71.1114458017" lat="42.3754311174">
        <time>2014-08-27T13:15:31.000-04:00</time>
        <type>place</type>
      </trkpt>
      <trkpt lon="-71.1114458017" lat="42.3754311174">
        <time>2014-08-27T14:00:04.000-04:00</time>
        <type>place</type>
      </trkpt>
    </trkseg>
    <trkseg>
      <trkpt lon="-71.117205" lat="42.378716">
        <time>2014-08-27T14:10:41.000-04:00</time>
        <type>place</type>
      </trkpt>
      <trkpt lon="-71.117205" lat="42.378716">
        <time>2014-08-27T15:04:43.000-04:00</time>
        <type>place</type>
      </trkpt>
    </trkseg>
    <trkseg>
      <trkpt lon="-71.1178786196" lat="42.3777682252">
        <time>2014-08-27T15:14:16.000-04:00</time>
        <type>place</type>
      </trkpt>
      <trkpt lon="-71.1178786196" lat="42.3777682252">
        <time>2014-08-27T15:19:52.000-04:00</time>
        <type>place</type>
      </trkpt>
    </trkseg>
    <trkseg>
      <trkpt lon="-71.117205" lat="42.378716">
        <time>2014-08-27T15:22:14.000-04:00</time>
        <type>place</type>
      </trkpt>
      <trkpt lon="-71.117205" lat="42.378716">
        <time>2014-08-27T15:37:04.000-04:00</time>
        <type>place</type>
      </trkpt>
    </trkseg>
    <trkseg>
      <trkpt lon="-71.1206353010665" lat="42.3723066357318">
        <time>2014-08-27T15:49:32.000-04:00</time>
        <type>place</type>
      </trkpt>
      <trkpt lon="-71.1206353010665" lat="42.3723066357318">
        <time>2014-08-27T16:24:36.000-04:00</time>
        <type>place</type>
      </trkpt>
    </trkseg>
    <trkseg>
      <trkpt lon="-71.12407621183526" lat="42.36403242532342">
        <time>2014-08-27T16:41:19.000-04:00</time>
        <type>place</type>
      </trkpt>
      <trkpt lon="-71.12407621183526" lat="42.36403242532342">
        <time>2014-08-27T17:10:55.000-04:00</time>
        <type>place</type>
      </trkpt>
    </trkseg>
    <trkseg>
      <trkpt lon="-71.1114458017" lat="42.3754311174">
        <time>2014-08-27T17:38:30.000-04:00</time>
        <type>place</type>
      </trkpt>
      <trkpt lon="-71.1114458017" lat="42.3754311174">
        <time>2014-08-28T00:00:00.000-04:00</time>
        <type>place</type>
      </trkpt>
    </trkseg>
  </trk>
  <trk>
    <name>8/28/14</name>
    <trkseg>
      <trkpt lon="-71.1114458017" lat="42.3754311174">
        <time>2014-08-28T00:00:00.000-04:00</time>
        <type>place</type>
      </trkpt>
      <trkpt lon="-71.1114458017" lat="42.3754311174">
        <time>2014-08-28T07:00:49.000-04:00</time>
        <type>place</type>
      </trkpt>
    </trkseg>
    <trkseg>
      <trkpt lon="-71.119452" lat="42.372485">
        <time>2014-08-28T07:15:17.000-04:00</time>
        <type>place</type>
      </trkpt>
      <trkpt lon="-71.119452" lat="42.372485">
        <time>2014-08-28T07:17:36.000-04:00</time>
        <type>place</type>
      </trkpt>
    </trkseg>
    <trkseg>
      <trkpt lon="-71.12402979165076" lat="42.36427488545988">
        <time>2014-08-28T07:35:47.000-04:00</time>
        <type>place</type>
      </trkpt>
      <trkpt lon="-71.12402979165076" lat="42.36427488545988">
        <time>2014-08-28T08:56:47.000-04:00</time>
        <type>place</type>
      </trkpt>
    </trkseg>
    <trkseg>
      <trkpt lon="-71.12210915179602" lat="42.36578780710847">
        <time>2014-08-28T09:01:39.000-04:00</time>
        <type>place</type>
      </trkpt>
      <trkpt lon="-71.12210915179602" lat="42.36578780710847">
        <time>2014-08-28T12:29:32.000-04:00</time>
        <type>place</type>
      </trkpt>
    </trkseg>
    <trkseg>
      <trkpt lon="-71.12407621183526" lat="42.36403242532342">
        <time>2014-08-28T12:29:32.000-04:00</time>
        <type>place</type>
      </trkpt>
      <trkpt lon="-71.12407621183526" lat="42.36403242532342">
        <time>2014-08-28T13:15:03.000-04:00</time>
        <type>place</type>
      </trkpt>
    </trkseg>
    <trkseg>
      <trkpt lon="-71.12210915179602" lat="42.36578780710847">
        <time>2014-08-28T13:20:55.000-04:00</time>
        <type>place</type>
      </trkpt>
      <trkpt lon="-71.12210915179602" lat="42.36578780710847">
        <time>2014-08-28T14:54:50.000-04:00</time>
        <type>place</type>
      </trkpt>
    </trkseg>
    <trkseg>
      <trkpt lon="-71.1114458017" lat="42.3754311174">
        <time>2014-08-28T15:20:29.000-04:00</time>
        <type>place</type>
      </trkpt>
      <trkpt lon="-71.1114458017" lat="42.3754311174">
        <time>2014-08-28T18:32:58.000-04:00</time>
        <type>place</type>
      </trkpt>
    </trkseg>
    <trkseg>
      <trkpt lon="-71.12017109498916" lat="42.37343863629133">
        <time>2014-08-28T18:46:57.000-04:00</time>
        <type>place</type>
      </trkpt>
      <trkpt lon="-71.12017109498916" lat="42.37343863629133">
        <time>2014-08-28T19:12:37.000-04:00</time>
        <type>place</type>
      </trkpt>
    </trkseg>
    <trkseg>
      <trkpt lon="-71.1230027436908" lat="42.37220351484281">
        <time>2014-08-28T19:17:40.000-04:00</time>
        <type>place</type>
      </trkpt>
      <trkpt lon="-71.1230027436908" lat="42.37220351484281">
        <time>2014-08-28T20:06:19.000-04:00</time>
        <type>place</type>
      </trkpt>
    </trkseg>
    <trkseg>
      <trkpt lon="-71.1114458017" lat="42.3754311174">
        <time>2014-08-28T20:23:27.000-04:00</time>
        <type>place</type>
      </trkpt>
      <trkpt lon="-71.1114458017" lat="42.3754311174">
        <time>2014-08-29T00:00:00.000-04:00</time>
        <type>place</type>
      </trkpt>
    </trkseg>
  </trk>
  <trk>
    <name>8/29/14</name>
    <trkseg>
      <trkpt lon="-71.1114458017" lat="42.3754311174">
        <time>2014-08-29T00:00:00.000-04:00</time>
        <type>place</type>
      </trkpt>
      <trkpt lon="-71.1114458017" lat="42.3754311174">
        <time>2014-08-29T07:19:37.000-04:00</time>
        <type>place</type>
      </trkpt>
    </trkseg>
    <trkseg>
      <trkpt lon="-71.11295" lat="42.373886">
        <time>2014-08-29T07:23:53.000-04:00</time>
        <type>place</type>
      </trkpt>
      <trkpt lon="-71.11295" lat="42.373886">
        <time>2014-08-29T07:26:45.000-04:00</time>
        <type>place</type>
      </trkpt>
    </trkseg>
    <trkseg>
      <trkpt lon="-71.12407621183526" lat="42.36403242532342">
        <time>2014-08-29T07:52:21.000-04:00</time>
        <type>place</type>
      </trkpt>
      <trkpt lon="-71.12407621183526" lat="42.36403242532342">
        <time>2014-08-29T08:51:06.000-04:00</time>
        <type>place</type>
      </trkpt>
    </trkseg>
    <trkseg>
      <trkpt lon="-71.12210915179602" lat="42.36578780710847">
        <time>2014-08-29T09:01:54.000-04:00</time>
        <type>place</type>
      </trkpt>
      <trkpt lon="-71.12210915179602" lat="42.36578780710847">
        <time>2014-08-29T12:20:52.000-04:00</time>
        <type>place</type>
      </trkpt>
    </trkseg>
    <trkseg>
      <trkpt lon="-71.12407621183526" lat="42.36403242532342">
        <time>2014-08-29T12:25:34.000-04:00</time>
        <type>place</type>
      </trkpt>
      <trkpt lon="-71.12407621183526" lat="42.36403242532342">
        <time>2014-08-29T13:02:34.000-04:00</time>
        <type>place</type>
      </trkpt>
    </trkseg>
    <trkseg>
      <trkpt lon="-71.12210915179602" lat="42.36578780710847">
        <time>2014-08-29T13:07:58.000-04:00</time>
        <type>place</type>
      </trkpt>
      <trkpt lon="-71.12210915179602" lat="42.36578780710847">
        <time>2014-08-29T15:23:12.000-04:00</time>
        <type>place</type>
      </trkpt>
    </trkseg>
    <trkseg>
      <trkpt lon="-71.1114458017" lat="42.3754311174">
        <time>2014-08-29T15:47:54.000-04:00</time>
        <type>place</type>
      </trkpt>
      <trkpt lon="-71.1114458017" lat="42.3754311174">
        <time>2014-08-30T00:00:00.000-04:00</time>
        <type>place</type>
      </trkpt>
    </trkseg>
  </trk>
  <trk>
    <name>8/30/14</name>
    <trkseg>
      <trkpt lon="-71.1114458017" lat="42.3754311174">
        <time>2014-08-30T00:00:00.000-04:00</time>
        <type>place</type>
      </trkpt>
      <trkpt lon="-71.1114458017" lat="42.3754311174">
        <time>2014-08-30T12:52:42.000-04:00</time>
        <type>place</type>
      </trkpt>
    </trkseg>
    <trkseg>
      <trkpt lon="-71.12295627593994" lat="42.3724718672702">
        <time>2014-08-30T13:07:50.000-04:00</time>
        <type>place</type>
      </trkpt>
      <trkpt lon="-71.12295627593994" lat="42.3724718672702">
        <time>2014-08-30T13:21:38.000-04:00</time>
        <type>place</type>
      </trkpt>
    </trkseg>
    <trkseg>
      <trkpt lon="-70.962171" lat="42.45143936666667">
        <time>2014-08-30T14:06:13.000-04:00</time>
        <type>place</type>
      </trkpt>
      <trkpt lon="-70.962171" lat="42.45143936666667">
        <time>2014-08-30T14:19:02.000-04:00</time>
        <type>place</type>
      </trkpt>
    </trkseg>
    <trkseg>
      <trkpt lon="-70.8747906199" lat="42.4818089224">
        <time>2014-08-30T14:33:40.000-04:00</time>
        <type>place</type>
      </trkpt>
      <trkpt lon="-70.8747906199" lat="42.4818089224">
        <time>2014-08-30T16:12:49.000-04:00</time>
        <type>place</type>
      </trkpt>
    </trkseg>
    <trkseg>
      <trkpt lon="-70.88747425990753" lat="42.47262693478186">
        <time>2014-08-30T16:39:20.000-04:00</time>
        <type>place</type>
      </trkpt>
      <trkpt lon="-70.88747425990753" lat="42.47262693478186">
        <time>2014-08-30T17:24:07.000-04:00</time>
        <type>place</type>
      </trkpt>
    </trkseg>
    <trkseg>
      <trkpt lon="-70.8747906199" lat="42.4818089224">
        <time>2014-08-30T17:49:19.000-04:00</time>
        <type>place</type>
      </trkpt>
      <trkpt lon="-70.8747906199" lat="42.4818089224">
        <time>2014-08-30T18:02:11.000-04:00</time>
        <type>place</type>
      </trkpt>
    </trkseg>
    <trkseg>
      <trkpt lon="-70.8962213542" lat="42.5230790961">
        <time>2014-08-30T18:20:31.000-04:00</time>
        <type>place</type>
      </trkpt>
      <trkpt lon="-70.8962213542" lat="42.5230790961">
        <time>2014-08-30T18:25:10.000-04:00</time>
        <type>place</type>
      </trkpt>
    </trkseg>
    <trkseg>
      <trkpt lon="-70.89399413092349" lat="42.52148195917415">
        <time>2014-08-30T18:31:14.000-04:00</time>
        <type>place</type>
      </trkpt>
      <trkpt lon="-70.89399413092349" lat="42.52148195917415">
        <time>2014-08-30T19:11:48.000-04:00</time>
        <type>place</type>
      </trkpt>
    </trkseg>
    <trkseg>
      <trkpt lon="-70.89215951986917" lat="42.5207695305214">
        <time>2014-08-30T19:15:01.000-04:00</time>
        <type>place</type>
      </trkpt>
      <trkpt lon="-70.89215951986917" lat="42.5207695305214">
        <time>2014-08-30T19:34:26.000-04:00</time>
        <type>place</type>
      </trkpt>
    </trkseg>
    <trkseg>
      <trkpt lon="-70.89609579615087" lat="42.5212082774136">
        <time>2014-08-30T19:41:08.000-04:00</time>
        <type>place</type>
      </trkpt>
      <trkpt lon="-70.89609579615087" lat="42.5212082774136">
        <time>2014-08-30T19:45:05.000-04:00</time>
        <type>place</type>
      </trkpt>
    </trkseg>
    <trkseg>
      <trkpt lon="-70.89609579615087" lat="42.5212082774136">
        <time>2014-08-30T20:31:27.000-04:00</time>
        <type>place</type>
      </trkpt>
      <trkpt lon="-70.89609579615087" lat="42.5212082774136">
        <time>2014-08-30T21:10:49.000-04:00</time>
        <type>place</type>
      </trkpt>
    </trkseg>
    <trkseg>
      <trkpt lon="-71.1114458017" lat="42.3754311174">
        <time>2014-08-30T21:55:07.000-04:00</time>
        <type>place</type>
      </trkpt>
      <trkpt lon="-71.1114458017" lat="42.3754311174">
        <time>2014-08-30T22:07:04.000-04:00</time>
        <type>place</type>
      </trkpt>
    </trkseg>
  </trk>
  <trk>
    <name>8/31/14</name>
    <trkseg>
      <trkpt lon="-71.11747288651797" lat="42.37302773792176">
        <time>2014-08-31T09:58:50.000-04:00</time>
        <type>place</type>
      </trkpt>
      <trkpt lon="-71.11747288651797" lat="42.37302773792176">
        <time>2014-08-31T10:09:20.000-04:00</time>
        <type>place</type>
      </trkpt>
    </trkseg>
    <trkseg>
      <trkpt lon="-71.1114458017" lat="42.3754311174">
        <time>2014-08-31T10:18:56.000-04:00</time>
        <type>place</type>
      </trkpt>
      <trkpt lon="-71.1114458017" lat="42.3754311174">
        <time>2014-08-31T11:25:10.000-04:00</time>
        <type>place</type>
      </trkpt>
    </trkseg>
    <trkseg>
      <trkpt lon="-71.12136840820312" lat="42.37358945733965">
        <time>2014-08-31T11:36:30.000-04:00</time>
        <type>place</type>
      </trkpt>
      <trkpt lon="-71.12136840820312" lat="42.37358945733965">
        <time>2014-08-31T13:20:24.000-04:00</time>
        <type>place</type>
      </trkpt>
    </trkseg>
    <trkseg>
      <trkpt lon="-71.1114458017" lat="42.3754311174">
        <time>2014-08-31T13:38:03.000-04:00</time>
        <type>place</type>
      </trkpt>
      <trkpt lon="-71.1114458017" lat="42.3754311174">
        <time>2014-08-31T14:24:59.000-04:00</time>
        <type>place</type>
      </trkpt>
    </trkseg>
    <trkseg>
      <trkpt lon="-71.26529585645288" lat="42.39461025172349">
        <time>2014-08-31T14:52:36.000-04:00</time>
        <type>place</type>
      </trkpt>
      <trkpt lon="-71.26529585645288" lat="42.39461025172349">
        <time>2014-08-31T15:49:18.000-04:00</time>
        <type>place</type>
      </trkpt>
    </trkseg>
    <trkseg>
      <trkpt lon="-71.35373028504658" lat="42.03958441119426">
        <time>2014-08-31T16:39:43.000-04:00</time>
        <type>place</type>
      </trkpt>
      <trkpt lon="-71.35373028504658" lat="42.03958441119426">
        <time>2014-08-31T17:33:10.000-04:00</time>
        <type>place</type>
      </trkpt>
    </trkseg>
    <trkseg>
      <trkpt lon="-71.3536117654" lat="42.0398615822">
        <time>2014-08-31T17:38:21.000-04:00</time>
        <type>place</type>
      </trkpt>
      <trkpt lon="-71.3536117654" lat="42.0398615822">
        <time>2014-08-31T18:46:01.000-04:00</time>
        <type>place</type>
      </trkpt>
    </trkseg>
    <trkseg>
      <trkpt lon="-71.1114458017" lat="42.3754311174">
        <time>2014-08-31T19:40:13.000-04:00</time>
        <type>place</type>
