<?xml version="1.0" encoding="UTF-8"?><kml xmlns="http://www.opengis.net/kml/2.2" xmlns:gx="http://www.google.com/kml/ext/2.2" xmlns:atom="http://www.w3.org/2005/Atom" xmlns:xal="urn:oasis:names:tc:ciq:xsdschema:xAL:2.0" xmlns:xsi="http://www.w3.org/2001/XMLSchema-instance">
  <Document>
    <atom:link href="http://www.moves-app.com"/>
    <description><![CDATA[<p align="center"><a href="http://www.moves-app.com"> <img src="http://www.moves-app.com/assets/moves.png"/> </a></p> <p align="center">Moves Storyline</p>]]></description>
    <Style id="place_Liquor Store">
      <IconStyle>
        <scale>1.0</scale>
        <heading>0.0</heading>
        <Icon>
          <href>https://ss1.4sqi.net/img/categories/shops/default.png</href>
          <refreshInterval>0.0</refreshInterval>
          <viewRefreshTime>0.0</viewRefreshTime>
          <viewBoundScale>0.0</viewBoundScale>
        </Icon>
      </IconStyle>
    </Style>
    <Style id="place_Gym">
      <IconStyle>
        <scale>1.0</scale>
        <heading>0.0</heading>
        <Icon>
          <href>https://ss1.4sqi.net/img/categories/building/gym.png</href>
          <refreshInterval>0.0</refreshInterval>
          <viewRefreshTime>0.0</viewRefreshTime>
          <viewBoundScale>0.0</viewBoundScale>
        </Icon>
      </IconStyle>
    </Style>
    <Style id="place_Mexican Restaurant">
      <IconStyle>
        <scale>1.0</scale>
        <heading>0.0</heading>
        <Icon>
          <href>https://ss1.4sqi.net/img/categories/food/mexican.png</href>
          <refreshInterval>0.0</refreshInterval>
          <viewRefreshTime>0.0</viewRefreshTime>
          <viewBoundScale>0.0</viewBoundScale>
        </Icon>
      </IconStyle>
    </Style>
    <Style id="place_Paper / Office Supplies Store">
      <IconStyle>
        <scale>1.0</scale>
        <heading>0.0</heading>
        <Icon>
          <href>https://ss1.4sqi.net/img/categories/shops/papergoods.png</href>
          <refreshInterval>0.0</refreshInterval>
          <viewRefreshTime>0.0</viewRefreshTime>
          <viewBoundScale>0.0</viewBoundScale>
        </Icon>
      </IconStyle>
    </Style>
    <Style id="place_Hotel">
      <IconStyle>
        <scale>1.0</scale>
        <heading>0.0</heading>
        <Icon>
          <href>https://ss1.4sqi.net/img/categories/travel/hotel.png</href>
          <refreshInterval>0.0</refreshInterval>
          <viewRefreshTime>0.0</viewRefreshTime>
          <viewBoundScale>0.0</viewBoundScale>
        </Icon>
      </IconStyle>
    </Style>
    <Style id="place_College Residence Hall">
      <IconStyle>
        <scale>1.0</scale>
        <heading>0.0</heading>
        <Icon>
          <href>https://ss1.4sqi.net/img/categories/education/default.png</href>
          <refreshInterval>0.0</refreshInterval>
          <viewRefreshTime>0.0</viewRefreshTime>
          <viewBoundScale>0.0</viewBoundScale>
        </Icon>
      </IconStyle>
    </Style>
    <Style id="place_school">
      <IconStyle>
        <scale>1.0</scale>
        <heading>0.0</heading>
        <Icon>
          <href>http://ss1.4sqi.net/img/categories/building/school.png</href>
          <refreshInterval>0.0</refreshInterval>
          <viewRefreshTime>0.0</viewRefreshTime>
          <viewBoundScale>0.0</viewBoundScale>
        </Icon>
      </IconStyle>
    </Style>
    <Style id="place_Arepa Restaurant">
      <IconStyle>
        <scale>1.0</scale>
        <heading>0.0</heading>
        <Icon>
          <href>https://ss1.4sqi.net/img/categories/food/default.png</href>
          <refreshInterval>0.0</refreshInterval>
          <viewRefreshTime>0.0</viewRefreshTime>
          <viewBoundScale>0.0</viewBoundScale>
        </Icon>
      </IconStyle>
    </Style>
    <Style id="place_Electronics Store">
      <IconStyle>
        <scale>1.0</scale>
        <heading>0.0</heading>
        <Icon>
          <href>https://ss1.4sqi.net/img/categories/shops/technology.png</href>
          <refreshInterval>0.0</refreshInterval>
          <viewRefreshTime>0.0</viewRefreshTime>
          <viewBoundScale>0.0</viewBoundScale>
        </Icon>
      </IconStyle>
    </Style>
    <Style id="place_College Technology Building">
      <IconStyle>
        <scale>1.0</scale>
        <heading>0.0</heading>
        <Icon>
          <href>https://ss1.4sqi.net/img/categories/education/default.png</href>
          <refreshInterval>0.0</refreshInterval>
          <viewRefreshTime>0.0</viewRefreshTime>
          <viewBoundScale>0.0</viewBoundScale>
        </Icon>
      </IconStyle>
    </Style>
    <Style id="place_Supermarket">
      <IconStyle>
        <scale>1.0</scale>
        <heading>0.0</heading>
        <Icon>
          <href>https://ss1.4sqi.net/img/categories/shops/food_grocery.png</href>
          <refreshInterval>0.0</refreshInterval>
          <viewRefreshTime>0.0</viewRefreshTime>
          <viewBoundScale>0.0</viewBoundScale>
        </Icon>
      </IconStyle>
    </Style>
    <Style id="place_Pub">
      <IconStyle>
        <scale>1.0</scale>
        <heading>0.0</heading>
        <Icon>
          <href>https://ss1.4sqi.net/img/categories/nightlife/pub.png</href>
          <refreshInterval>0.0</refreshInterval>
          <viewRefreshTime>0.0</viewRefreshTime>
          <viewBoundScale>0.0</viewBoundScale>
        </Icon>
      </IconStyle>
    </Style>
    <Style id="place_Coffee Shop">
      <IconStyle>
        <scale>1.0</scale>
        <heading>0.0</heading>
        <Icon>
          <href>https://ss1.4sqi.net/img/categories/food/coffeeshop.png</href>
          <refreshInterval>0.0</refreshInterval>
          <viewRefreshTime>0.0</viewRefreshTime>
          <viewBoundScale>0.0</viewBoundScale>
        </Icon>
      </IconStyle>
    </Style>
    <Style id="place_American Restaurant">
      <IconStyle>
        <scale>1.0</scale>
        <heading>0.0</heading>
        <Icon>
          <href>https://ss1.4sqi.net/img/categories/food/default.png</href>
          <refreshInterval>0.0</refreshInterval>
          <viewRefreshTime>0.0</viewRefreshTime>
          <viewBoundScale>0.0</viewBoundScale>
        </Icon>
      </IconStyle>
    </Style>
    <Style id="place_College Administrative Building">
      <IconStyle>
        <scale>1.0</scale>
        <heading>0.0</heading>
        <Icon>
          <href>https://ss1.4sqi.net/img/categories/education/default.png</href>
          <refreshInterval>0.0</refreshInterval>
          <viewRefreshTime>0.0</viewRefreshTime>
          <viewBoundScale>0.0</viewBoundScale>
        </Icon>
      </IconStyle>
    </Style>
    <Style id="place_work">
      <IconStyle>
        <scale>1.0</scale>
        <heading>0.0</heading>
        <Icon>
          <href>http://ss1.4sqi.net/img/categories/building/default.png</href>
          <refreshInterval>0.0</refreshInterval>
          <viewRefreshTime>0.0</viewRefreshTime>
          <viewBoundScale>0.0</viewBoundScale>
        </Icon>
      </IconStyle>
    </Style>
    <Style id="place_user">
      <IconStyle>
        <scale>1.0</scale>
        <heading>0.0</heading>
        <Icon>
          <href>http://maps.google.com/mapfiles/marker_white.png</href>
          <refreshInterval>0.0</refreshInterval>
          <viewRefreshTime>0.0</viewRefreshTime>
          <viewBoundScale>0.0</viewBoundScale>
        </Icon>
      </IconStyle>
    </Style>
    <Style id="place_Rental Car Location">
      <IconStyle>
        <scale>1.0</scale>
        <heading>0.0</heading>
        <Icon>
          <href>https://ss1.4sqi.net/img/categories/travel/airport_rentalcar.png</href>
          <refreshInterval>0.0</refreshInterval>
          <viewRefreshTime>0.0</viewRefreshTime>
          <viewBoundScale>0.0</viewBoundScale>
        </Icon>
      </IconStyle>
    </Style>
    <Style id="place_Nightclub">
      <IconStyle>
        <scale>1.0</scale>
        <heading>0.0</heading>
        <Icon>
          <href>https://ss1.4sqi.net/img/categories/nightlife/danceparty.png</href>
          <refreshInterval>0.0</refreshInterval>
          <viewRefreshTime>0.0</viewRefreshTime>
          <viewBoundScale>0.0</viewBoundScale>
        </Icon>
      </IconStyle>
    </Style>
    <Style id="place_Gastropub">
      <IconStyle>
        <scale>1.0</scale>
        <heading>0.0</heading>
        <Icon>
          <href>https://ss1.4sqi.net/img/categories/food/default.png</href>
          <refreshInterval>0.0</refreshInterval>
          <viewRefreshTime>0.0</viewRefreshTime>
          <viewBoundScale>0.0</viewBoundScale>
        </Icon>
      </IconStyle>
    </Style>
    <Style id="place_College Academic Building">
      <IconStyle>
        <scale>1.0</scale>
        <heading>0.0</heading>
        <Icon>
          <href>https://ss1.4sqi.net/img/categories/education/default.png</href>
          <refreshInterval>0.0</refreshInterval>
          <viewRefreshTime>0.0</viewRefreshTime>
          <viewBoundScale>0.0</viewBoundScale>
        </Icon>
      </IconStyle>
    </Style>
    <Style id="place_Salon / Barbershop">
      <IconStyle>
        <scale>1.0</scale>
        <heading>0.0</heading>
        <Icon>
          <href>https://ss1.4sqi.net/img/categories/shops/salon_barber.png</href>
          <refreshInterval>0.0</refreshInterval>
          <viewRefreshTime>0.0</viewRefreshTime>
          <viewBoundScale>0.0</viewBoundScale>
        </Icon>
      </IconStyle>
    </Style>
    <Style id="place_College Gym">
      <IconStyle>
        <scale>1.0</scale>
        <heading>0.0</heading>
        <Icon>
          <href>https://ss1.4sqi.net/img/categories/education/gym.png</href>
          <refreshInterval>0.0</refreshInterval>
          <viewRefreshTime>0.0</viewRefreshTime>
          <viewBoundScale>0.0</viewBoundScale>
        </Icon>
      </IconStyle>
    </Style>
    <Style id="place_foursquare">
      <IconStyle>
        <scale>1.0</scale>
        <heading>0.0</heading>
        <Icon>
          <href>http://maps.google.com/mapfiles/marker_white.png</href>
          <refreshInterval>0.0</refreshInterval>
          <viewRefreshTime>0.0</viewRefreshTime>
          <viewBoundScale>0.0</viewBoundScale>
        </Icon>
      </IconStyle>
    </Style>
    <Style id="place_Jazz Club">
      <IconStyle>
        <scale>1.0</scale>
        <heading>0.0</heading>
        <Icon>
          <href>https://ss1.4sqi.net/img/categories/arts_entertainment/musicvenue.png</href>
          <refreshInterval>0.0</refreshInterval>
          <viewRefreshTime>0.0</viewRefreshTime>
          <viewBoundScale>0.0</viewBoundScale>
        </Icon>
      </IconStyle>
    </Style>
    <Style id="place_Tech Startup">
      <IconStyle>
        <scale>1.0</scale>
        <heading>0.0</heading>
        <Icon>
          <href>https://ss1.4sqi.net/img/categories/shops/technology.png</href>
          <refreshInterval>0.0</refreshInterval>
          <viewRefreshTime>0.0</viewRefreshTime>
          <viewBoundScale>0.0</viewBoundScale>
        </Icon>
      </IconStyle>
    </Style>
    <Style id="place_Post Office">
      <IconStyle>
        <scale>1.0</scale>
        <heading>0.0</heading>
        <Icon>
          <href>https://ss1.4sqi.net/img/categories/building/postoffice.png</href>
          <refreshInterval>0.0</refreshInterval>
          <viewRefreshTime>0.0</viewRefreshTime>
          <viewBoundScale>0.0</viewBoundScale>
        </Icon>
      </IconStyle>
    </Style>
    <Style id="place_Grocery Store">
      <IconStyle>
        <scale>1.0</scale>
        <heading>0.0</heading>
        <Icon>
          <href>https://ss1.4sqi.net/img/categories/shops/food_grocery.png</href>
          <refreshInterval>0.0</refreshInterval>
          <viewRefreshTime>0.0</viewRefreshTime>
          <viewBoundScale>0.0</viewBoundScale>
        </Icon>
      </IconStyle>
    </Style>
    <Style id="place_Bus Line">
      <IconStyle>
        <scale>1.0</scale>
        <heading>0.0</heading>
        <Icon>
          <href>https://ss1.4sqi.net/img/categories/travel/busstation.png</href>
          <refreshInterval>0.0</refreshInterval>
          <viewRefreshTime>0.0</viewRefreshTime>
          <viewBoundScale>0.0</viewBoundScale>
        </Icon>
      </IconStyle>
    </Style>
    <Style id="place_Department Store">
      <IconStyle>
        <scale>1.0</scale>
        <heading>0.0</heading>
        <Icon>
          <href>https://ss1.4sqi.net/img/categories/shops/default.png</href>
          <refreshInterval>0.0</refreshInterval>
          <viewRefreshTime>0.0</viewRefreshTime>
          <viewBoundScale>0.0</viewBoundScale>
        </Icon>
      </IconStyle>
    </Style>
    <Style id="place_Café">
      <IconStyle>
        <scale>1.0</scale>
        <heading>0.0</heading>
        <Icon>
          <href>https://ss1.4sqi.net/img/categories/food/cafe.png</href>
          <refreshInterval>0.0</refreshInterval>
          <viewRefreshTime>0.0</viewRefreshTime>
          <viewBoundScale>0.0</viewBoundScale>
        </Icon>
      </IconStyle>
    </Style>
    <Style id="place_unknown">
      <IconStyle>
        <scale>1.0</scale>
        <heading>0.0</heading>
        <Icon>
          <href>http://maps.google.com/mapfiles/marker_white.png</href>
          <refreshInterval>0.0</refreshInterval>
          <viewRefreshTime>0.0</viewRefreshTime>
          <viewBoundScale>0.0</viewBoundScale>
        </Icon>
      </IconStyle>
    </Style>
    <Style id="place_Ramen / Noodle House">
      <IconStyle>
        <scale>1.0</scale>
        <heading>0.0</heading>
        <Icon>
          <href>https://ss1.4sqi.net/img/categories/food/ramen.png</href>
          <refreshInterval>0.0</refreshInterval>
          <viewRefreshTime>0.0</viewRefreshTime>
          <viewBoundScale>0.0</viewBoundScale>
        </Icon>
      </IconStyle>
    </Style>
    <Style id="place_Southern / Soul Food Restaurant">
      <IconStyle>
        <scale>1.0</scale>
        <heading>0.0</heading>
        <Icon>
          <href>https://ss1.4sqi.net/img/categories/food/southern.png</href>
          <refreshInterval>0.0</refreshInterval>
          <viewRefreshTime>0.0</viewRefreshTime>
          <viewBoundScale>0.0</viewBoundScale>
        </Icon>
      </IconStyle>
    </Style>
    <Style id="place_Airport">
      <IconStyle>
        <scale>1.0</scale>
        <heading>0.0</heading>
        <Icon>
          <href>https://ss1.4sqi.net/img/categories/travel/airport.png</href>
          <refreshInterval>0.0</refreshInterval>
          <viewRefreshTime>0.0</viewRefreshTime>
          <viewBoundScale>0.0</viewBoundScale>
        </Icon>
      </IconStyle>
    </Style>
    <Style id="place_Drugstore / Pharmacy">
      <IconStyle>
        <scale>1.0</scale>
        <heading>0.0</heading>
        <Icon>
          <href>https://ss1.4sqi.net/img/categories/shops/drugstore.png</href>
          <refreshInterval>0.0</refreshInterval>
          <viewRefreshTime>0.0</viewRefreshTime>
          <viewBoundScale>0.0</viewBoundScale>
        </Icon>
      </IconStyle>
    </Style>
    <Style id="place_home">
      <IconStyle>
        <scale>1.0</scale>
        <heading>0.0</heading>
        <Icon>
          <href>http://ss1.4sqi.net/img/categories/building/home.png</href>
          <refreshInterval>0.0</refreshInterval>
          <viewRefreshTime>0.0</viewRefreshTime>
          <viewBoundScale>0.0</viewBoundScale>
        </Icon>
      </IconStyle>
    </Style>
    <Style id="place_Office">
      <IconStyle>
        <scale>1.0</scale>
        <heading>0.0</heading>
        <Icon>
          <href>https://ss1.4sqi.net/img/categories/building/default.png</href>
          <refreshInterval>0.0</refreshInterval>
          <viewRefreshTime>0.0</viewRefreshTime>
          <viewBoundScale>0.0</viewBoundScale>
        </Icon>
      </IconStyle>
    </Style>
    <Style id="place_New American Restaurant">
      <IconStyle>
        <scale>1.0</scale>
        <heading>0.0</heading>
        <Icon>
          <href>https://ss1.4sqi.net/img/categories/food/default.png</href>
          <refreshInterval>0.0</refreshInterval>
          <viewRefreshTime>0.0</viewRefreshTime>
          <viewBoundScale>0.0</viewBoundScale>
        </Icon>
      </IconStyle>
    </Style>
    <Style id="place_Subway">
      <IconStyle>
        <scale>1.0</scale>
        <heading>0.0</heading>
        <Icon>
          <href>https://ss1.4sqi.net/img/categories/travel/subway.png</href>
          <refreshInterval>0.0</refreshInterval>
          <viewRefreshTime>0.0</viewRefreshTime>
          <viewBoundScale>0.0</viewBoundScale>
        </Icon>
      </IconStyle>
    </Style>
    <Style id="place_Bus Station">
      <IconStyle>
        <scale>1.0</scale>
        <heading>0.0</heading>
        <Icon>
          <href>https://ss1.4sqi.net/img/categories/travel/busstation.png</href>
          <refreshInterval>0.0</refreshInterval>
          <viewRefreshTime>0.0</viewRefreshTime>
          <viewBoundScale>0.0</viewBoundScale>
        </Icon>
      </IconStyle>
    </Style>
    <Style id="place_Student Center">
      <IconStyle>
        <scale>1.0</scale>
        <heading>0.0</heading>
        <Icon>
          <href>https://ss1.4sqi.net/img/categories/education/default.png</href>
          <refreshInterval>0.0</refreshInterval>
          <viewRefreshTime>0.0</viewRefreshTime>
          <viewBoundScale>0.0</viewBoundScale>
        </Icon>
      </IconStyle>
    </Style>
    <Folder>
      <name><![CDATA[9/1/14]]></name>
      <Placemark id="1409547600000">
        <name><![CDATA[Home]]></name>
        <description><![CDATA[<p>9/1/14<br/> 12:00 AM to 2:04 PM<br/> 14:04 hours</p>]]></description>
        <TimeSpan>
          <begin>2014-09-01T00:00:01-05:00</begin>
          <end>2014-09-01T14:04:32-05:00</end>
        </TimeSpan>
        <styleUrl>#place_home</styleUrl>
        <Point>
          <coordinates>-71.1114458017,42.3754311174</coordinates>
        </Point>
      </Placemark>
      <Placemark id="1409601024000">
        <name><![CDATA[Whole Foods Market]]></name>
        <atom:link href="http://foursquare.com/venue/4a5498d4f964a52026b31fe3"/>
        <description><![CDATA[<p>9/1/14<br/> 2:50 PM to 3:46 PM<br/> 56 min</p> <p>Supermarket<br/> <a href="http://foursquare.com/venue/4a5498d4f964a52026b31fe3">More details (Foursquare)</a> </p>]]></description>
        <TimeSpan>
          <begin>2014-09-01T14:50:25-05:00</begin>
          <end>2014-09-01T15:46:32-05:00</end>
        </TimeSpan>
        <styleUrl>#place_Supermarket</styleUrl>
        <Point>
          <coordinates>-71.114178,42.36137</coordinates>
        </Point>
      </Placemark>
      <Placemark id="1409605703000">
        <name><![CDATA[Home]]></name>
        <description><![CDATA[<p>9/1/14<br/> 4:08 PM to 6:03 PM<br/> 1:55 hours</p>]]></description>
        <TimeSpan>
          <begin>2014-09-01T16:08:24-05:00</begin>
          <end>2014-09-01T18:03:44-05:00</end>
        </TimeSpan>
        <styleUrl>#place_home</styleUrl>
        <Point>
          <coordinates>-71.1114458017,42.3754311174</coordinates>
        </Point>
      </Placemark>
      <Placemark id="1409613309000">
        <name><![CDATA[CVS/pharmacy]]></name>
        <atom:link href="http://foursquare.com/venue/49df6a3ff964a520c6601fe3"/>
        <description><![CDATA[<p>9/1/14<br/> 6:15 PM to 6:19 PM<br/> 4 min</p> <p>Drugstore / Pharmacy<br/> <a href="http://foursquare.com/venue/49df6a3ff964a520c6601fe3">More details (Foursquare)</a> </p>]]></description>
        <TimeSpan>
          <begin>2014-09-01T18:15:10-05:00</begin>
          <end>2014-09-01T18:19:56-05:00</end>
        </TimeSpan>
        <styleUrl>#place_Drugstore / Pharmacy</styleUrl>
        <Point>
          <coordinates>-71.11899197101593,42.37402935435937</coordinates>
        </Point>
      </Placemark>
      <Placemark id="1409614179000">
        <name><![CDATA[Home]]></name>
        <description><![CDATA[<p>9/1/14<br/> 6:29 PM to 12:00 AM<br/> 5:30 hours</p>]]></description>
        <TimeSpan>
          <begin>2014-09-01T18:29:40-05:00</begin>
          <end>2014-09-01T23:59:59-05:00</end>
        </TimeSpan>
        <styleUrl>#place_home</styleUrl>
        <Point>
          <coordinates>-71.1114458017,42.3754311174</coordinates>
        </Point>
      </Placemark>
    </Folder>
    <Folder>
      <name><![CDATA[9/2/14]]></name>
      <Placemark id="1409634000000">
        <name><![CDATA[Home]]></name>
        <description><![CDATA[<p>9/2/14<br/> 12:00 AM to 6:32 AM<br/> 6:32 hours</p>]]></description>
        <TimeSpan>
          <begin>2014-09-02T00:00:01-05:00</begin>
          <end>2014-09-02T06:32:31-05:00</end>
        </TimeSpan>
        <styleUrl>#place_home</styleUrl>
        <Point>
          <coordinates>-71.1114458017,42.3754311174</coordinates>
        </Point>
      </Placemark>
      <Placemark id="1409659129000">
        <name><![CDATA[Harvard Innovation Lab]]></name>
        <atom:link href="http://foursquare.com/venue/4e5d4676ae60839ea2e29e64"/>
        <description><![CDATA[<p>9/2/14<br/> 6:58 AM to 7:55 AM<br/> 57 min</p> <p>College Technology Building<br/> <a href="http://foursquare.com/venue/4e5d4676ae60839ea2e29e64">More details (Foursquare)</a> </p>]]></description>
        <TimeSpan>
          <begin>2014-09-02T06:58:50-05:00</begin>
          <end>2014-09-02T07:55:54-05:00</end>
        </TimeSpan>
        <styleUrl>#place_College Technology Building</styleUrl>
        <Point>
          <coordinates>-71.12407621183526,42.36403242532342</coordinates>
        </Point>
      </Placemark>
      <Placemark id="1409663020000">
        <name><![CDATA[Aldrich Hall]]></name>
        <atom:link href="http://foursquare.com/venue/4ac64359f964a5206eb320e3"/>
        <description><![CDATA[<p>9/2/14<br/> 8:03 AM to 11:19 AM<br/> 3:16 hours</p> <p>College Academic Building<br/> <a href="http://foursquare.com/venue/4ac64359f964a5206eb320e3">More details (Foursquare)</a> </p>]]></description>
        <TimeSpan>
          <begin>2014-09-02T08:03:41-05:00</begin>
          <end>2014-09-02T11:19:51-05:00</end>
        </TimeSpan>
        <styleUrl>#place_College Academic Building</styleUrl>
        <Point>
          <coordinates>-71.12210915179602,42.36578780710847</coordinates>
        </Point>
      </Placemark>
      <Placemark id="1409675625000">
        <name><![CDATA[Orinoco]]></name>
        <atom:link href="http://foursquare.com/venue/4f106cace4b072565b8bd1b6"/>
        <description><![CDATA[<p>9/2/14<br/> 11:33 AM to 12:13 PM<br/> 39 min</p> <p>Arepa Restaurant<br/> <a href="http://foursquare.com/venue/4f106cace4b072565b8bd1b6">More details (Foursquare)</a> </p>]]></description>
        <TimeSpan>
          <begin>2014-09-02T11:33:46-05:00</begin>
          <end>2014-09-02T12:13:15-05:00</end>
        </TimeSpan>
        <styleUrl>#place_Arepa Restaurant</styleUrl>
        <Point>
          <coordinates>-71.12049603929978,42.37190996862827</coordinates>
        </Point>
      </Placemark>
      <Placemark id="1409678513000">
        <name><![CDATA[Place in Old Cambridge]]></name>
        <description><![CDATA[<p>9/2/14<br/> 12:21 PM to 12:24 PM<br/> 2 min</p>]]></description>
        <TimeSpan>
          <begin>2014-09-02T12:21:54-05:00</begin>
          <end>2014-09-02T12:24:11-05:00</end>
        </TimeSpan>
        <styleUrl>#place_unknown</styleUrl>
        <Point>
          <coordinates>-71.1146043361,42.3711849193</coordinates>
        </Point>
      </Placemark>
      <Placemark id="1409679337000">
        <name><![CDATA[Home]]></name>
        <description><![CDATA[<p>9/2/14<br/> 12:35 PM to 5:51 PM<br/> 5:15 hours</p>]]></description>
        <TimeSpan>
          <begin>2014-09-02T12:35:38-05:00</begin>
          <end>2014-09-02T17:51:14-05:00</end>
        </TimeSpan>
        <styleUrl>#place_home</styleUrl>
        <Point>
          <coordinates>-71.1114458017,42.3754311174</coordinates>
        </Point>
      </Placemark>
      <Placemark id="1409699314000">
        <name><![CDATA[First Printer]]></name>
        <atom:link href="http://foursquare.com/venue/4f249887e4b006e5c25df9a2"/>
        <description><![CDATA[<p>9/2/14<br/> 6:08 PM to 7:17 PM<br/> 1:08 hours</p> <p>Southern / Soul Food Restaurant<br/> <a href="http://foursquare.com/venue/4f249887e4b006e5c25df9a2">More details (Foursquare)</a> </p>]]></description>
        <TimeSpan>
          <begin>2014-09-02T18:08:35-05:00</begin>
          <end>2014-09-02T19:16:59-05:00</end>
        </TimeSpan>
        <styleUrl>#place_Southern / Soul Food Restaurant</styleUrl>
        <Point>
          <coordinates>-71.11881909172456,42.37291150229456</coordinates>
        </Point>
      </Placemark>
      <Placemark id="1409703654000">
        <name><![CDATA[Orinoco]]></name>
        <atom:link href="http://foursquare.com/venue/4f106cace4b072565b8bd1b6"/>
        <description><![CDATA[<p>9/2/14<br/> 7:20 PM to 8:17 PM<br/> 56 min</p> <p>Arepa Restaurant<br/> <a href="http://foursquare.com/venue/4f106cace4b072565b8bd1b6">More details (Foursquare)</a> </p>]]></description>
        <TimeSpan>
          <begin>2014-09-02T19:20:55-05:00</begin>
          <end>2014-09-02T20:17:31-05:00</end>
        </TimeSpan>
        <styleUrl>#place_Arepa Restaurant</styleUrl>
        <Point>
          <coordinates>-71.12049603929978,42.37190996862827</coordinates>
        </Point>
      </Placemark>
      <Placemark id="1409708217000">
        <name><![CDATA[Home]]></name>
        <description><![CDATA[<p>9/2/14<br/> 8:36 PM to 12:00 AM<br/> 3:23 hours</p>]]></description>
        <TimeSpan>
          <begin>2014-09-02T20:36:58-05:00</begin>
          <end>2014-09-02T23:59:59-05:00</end>
        </TimeSpan>
        <styleUrl>#place_home</styleUrl>
        <Point>
          <coordinates>-71.1114458017,42.3754311174</coordinates>
        </Point>
      </Placemark>
    </Folder>
    <Folder>
      <name><![CDATA[9/3/14]]></name>
      <Placemark id="1409720400000">
        <name><![CDATA[Home]]></name>
        <description><![CDATA[<p>9/3/14<br/> 12:00 AM to 6:31 AM<br/> 6:31 hours</p>]]></description>
        <TimeSpan>
          <begin>2014-09-03T00:00:01-05:00</begin>
          <end>2014-09-03T06:31:03-05:00</end>
        </TimeSpan>
        <styleUrl>#place_home</styleUrl>
        <Point>
          <coordinates>-71.1114458017,42.3754311174</coordinates>
        </Point>
      </Placemark>
      <Placemark id="1409745217000">
        <name><![CDATA[Harvard Innovation Lab]]></name>
        <atom:link href="http://foursquare.com/venue/4e5d4676ae60839ea2e29e64"/>
        <description><![CDATA[<p>9/3/14<br/> 6:53 AM to 7:47 AM<br/> 54 min</p> <p>College Technology Building<br/> <a href="http://foursquare.com/venue/4e5d4676ae60839ea2e29e64">More details (Foursquare)</a> </p>]]></description>
        <TimeSpan>
          <begin>2014-09-03T06:53:38-05:00</begin>
          <end>2014-09-03T07:47:56-05:00</end>
        </TimeSpan>
        <styleUrl>#place_College Technology Building</styleUrl>
        <Point>
          <coordinates>-71.12407621183526,42.36403242532342</coordinates>
        </Point>
      </Placemark>
      <Placemark id="1409748781000">
        <name><![CDATA[Aldrich Hall]]></name>
        <atom:link href="http://foursquare.com/venue/4ac64359f964a5206eb320e3"/>
        <description><![CDATA[<p>9/3/14<br/> 7:53 AM to 11:19 AM<br/> 3:26 hours</p> <p>College Academic Building<br/> <a href="http://foursquare.com/venue/4ac64359f964a5206eb320e3">More details (Foursquare)</a> </p>]]></description>
        <TimeSpan>
          <begin>2014-09-03T07:53:02-05:00</begin>
          <end>2014-09-03T11:19:37-05:00</end>
        </TimeSpan>
        <styleUrl>#place_College Academic Building</styleUrl>
        <Point>
          <coordinates>-71.12210915179602,42.36578780710847</coordinates>
        </Point>
      </Placemark>
      <Placemark id="1409762398000">
        <name><![CDATA[Home]]></name>
        <description><![CDATA[<p>9/3/14<br/> 11:39 AM to 1:16 PM<br/> 1:36 hours</p>]]></description>
        <TimeSpan>
          <begin>2014-09-03T11:39:59-05:00</begin>
          <end>2014-09-03T13:16:20-05:00</end>
        </TimeSpan>
        <styleUrl>#place_home</styleUrl>
        <Point>
          <coordinates>-71.1114458017,42.3754311174</coordinates>
        </Point>
      </Placemark>
      <Placemark id="1409769197000">
        <name><![CDATA[Floyd's 99 Barbershop]]></name>
        <atom:link href="http://foursquare.com/venue/4a9d711ff964a520443820e3"/>
        <description><![CDATA[<p>9/3/14<br/> 1:33 PM to 1:59 PM<br/> 26 min</p> <p>Salon / Barbershop<br/> <a href="http://foursquare.com/venue/4a9d711ff964a520443820e3">More details (Foursquare)</a> </p>]]></description>
        <TimeSpan>
          <begin>2014-09-03T13:33:18-05:00</begin>
          <end>2014-09-03T13:59:28-05:00</end>
        </TimeSpan>
        <styleUrl>#place_Salon / Barbershop</styleUrl>
        <Point>
          <coordinates>-71.11979826,42.38213717937469</coordinates>
        </Point>
      </Placemark>
      <Placemark id="1409772780000">
        <name><![CDATA[Aldrich Hall]]></name>
        <atom:link href="http://foursquare.com/venue/4ac64359f964a5206eb320e3"/>
        <description><![CDATA[<p>9/3/14<br/> 2:33 PM to 4:15 PM<br/> 1:42 hours</p> <p>College Academic Building<br/> <a href="http://foursquare.com/venue/4ac64359f964a5206eb320e3">More details (Foursquare)</a> </p>]]></description>
        <TimeSpan>
          <begin>2014-09-03T14:33:01-05:00</begin>
          <end>2014-09-03T16:15:12-05:00</end>
        </TimeSpan>
        <styleUrl>#place_College Academic Building</styleUrl>
        <Point>
          <coordinates>-71.12210915179602,42.36578780710847</coordinates>
        </Point>
      </Placemark>
      <Placemark id="1409779517000">
        <name><![CDATA[Wagamama]]></name>
        <atom:link href="http://foursquare.com/venue/49e00a10f964a5203b611fe3"/>
        <description><![CDATA[<p>9/3/14<br/> 4:25 PM to 6:03 PM<br/> 1:37 hours</p> <p>Ramen / Noodle House<br/> <a href="http://foursquare.com/venue/49e00a10f964a5203b611fe3">More details (Foursquare)</a> </p>]]></description>
        <TimeSpan>
          <begin>2014-09-03T16:25:18-05:00</begin>
          <end>2014-09-03T18:03:14-05:00</end>
        </TimeSpan>
        <styleUrl>#place_Ramen / Noodle House</styleUrl>
        <Point>
          <coordinates>-71.1207515001297,42.37189721215247</coordinates>
        </Point>
      </Placemark>
      <Placemark id="1409786443000">
        <name><![CDATA[Home]]></name>
        <description><![CDATA[<p>9/3/14<br/> 6:20 PM to 12:00 AM<br/> 5:39 hours</p>]]></description>
        <TimeSpan>
          <begin>2014-09-03T18:20:44-05:00</begin>
          <end>2014-09-03T23:59:59-05:00</end>
        </TimeSpan>
        <styleUrl>#place_home</styleUrl>
        <Point>
          <coordinates>-71.1114458017,42.3754311174</coordinates>
        </Point>
      </Placemark>
    </Folder>
    <Folder>
      <name><![CDATA[9/4/14]]></name>
      <Placemark id="1409806800000">
        <name><![CDATA[Home]]></name>
        <description><![CDATA[<p>9/4/14<br/> 12:00 AM to 6:26 AM<br/> 6:26 hours</p>]]></description>
        <TimeSpan>
          <begin>2014-09-04T00:00:01-05:00</begin>
          <end>2014-09-04T06:26:38-05:00</end>
        </TimeSpan>
        <styleUrl>#place_home</styleUrl>
        <Point>
          <coordinates>-71.1114458017,42.3754311174</coordinates>
        </Point>
      </Placemark>
      <Placemark id="1409831316000">
        <name><![CDATA[Harvard Innovation Lab]]></name>
        <atom:link href="http://foursquare.com/venue/4e5d4676ae60839ea2e29e64"/>
        <description><![CDATA[<p>9/4/14<br/> 6:48 AM to 7:56 AM<br/> 1:08 hours</p> <p>College Technology Building<br/> <a href="http://foursquare.com/venue/4e5d4676ae60839ea2e29e64">More details (Foursquare)</a> </p>]]></description>
        <TimeSpan>
          <begin>2014-09-04T06:48:37-05:00</begin>
          <end>2014-09-04T07:56:54-05:00</end>
        </TimeSpan>
        <styleUrl>#place_College Technology Building</styleUrl>
        <Point>
          <coordinates>-71.12407621183526,42.36403242532342</coordinates>
        </Point>
      </Placemark>
      <Placemark id="1409835801000">
        <name><![CDATA[Aldrich Hall]]></name>
        <atom:link href="http://foursquare.com/venue/4ac64359f964a5206eb320e3"/>
        <description><![CDATA[<p>9/4/14<br/> 8:03 AM to 12:04 PM<br/> 4:01 hours</p> <p>College Academic Building<br/> <a href="http://foursquare.com/venue/4ac64359f964a5206eb320e3">More details (Foursquare)</a> </p>]]></description>
        <TimeSpan>
          <begin>2014-09-04T08:03:22-05:00</begin>
          <end>2014-09-04T12:04:42-05:00</end>
        </TimeSpan>
        <styleUrl>#place_College Academic Building</styleUrl>
        <Point>
          <coordinates>-71.12210915179602,42.36578780710847</coordinates>
        </Point>
      </Placemark>
      <Placemark id="1409850720000">
        <name><![CDATA[Harvard Innovation Lab]]></name>
        <atom:link href="http://foursquare.com/venue/4e5d4676ae60839ea2e29e64"/>
        <description><![CDATA[<p>9/4/14<br/> 12:12 PM to 1:50 PM<br/> 1:38 hours</p> <p>College Technology Building<br/> <a href="http://foursquare.com/venue/4e5d4676ae60839ea2e29e64">More details (Foursquare)</a> </p>]]></description>
        <TimeSpan>
          <begin>2014-09-04T12:12:01-05:00</begin>
          <end>2014-09-04T13:50:01-05:00</end>
        </TimeSpan>
        <styleUrl>#place_College Technology Building</styleUrl>
        <Point>
          <coordinates>-71.12402979165076,42.36427488545988</coordinates>
        </Point>
      </Placemark>
      <Placemark id="1409857944000">
        <name><![CDATA[CVS/pharmacy]]></name>
        <atom:link href="http://foursquare.com/venue/49df6a3ff964a520c6601fe3"/>
        <description><![CDATA[<p>9/4/14<br/> 2:12 PM to 2:15 PM<br/> 3 min</p> <p>Drugstore / Pharmacy<br/> <a href="http://foursquare.com/venue/49df6a3ff964a520c6601fe3">More details (Foursquare)</a> </p>]]></description>
        <TimeSpan>
          <begin>2014-09-04T14:12:25-05:00</begin>
          <end>2014-09-04T14:15:52-05:00</end>
        </TimeSpan>
        <styleUrl>#place_Drugstore / Pharmacy</styleUrl>
        <Point>
          <coordinates>-71.11899197101593,42.37402935435937</coordinates>
        </Point>
      </Placemark>
      <Placemark id="1409858821000">
        <name><![CDATA[Home]]></name>
        <description><![CDATA[<p>9/4/14<br/> 2:27 PM to 4:00 PM<br/> 1:33 hours</p>]]></description>
        <TimeSpan>
          <begin>2014-09-04T14:27:02-05:00</begin>
          <end>2014-09-04T16:00:16-05:00</end>
        </TimeSpan>
        <styleUrl>#place_home</styleUrl>
        <Point>
          <coordinates>-71.1114458017,42.3754311174</coordinates>
        </Point>
      </Placemark>
      <Placemark id="1409866885000">
        <name><![CDATA[Home]]></name>
        <description><![CDATA[<p>9/4/14<br/> 4:41 PM to 12:00 AM<br/> 7:18 hours</p>]]></description>
        <TimeSpan>
          <begin>2014-09-04T16:41:26-05:00</begin>
          <end>2014-09-04T23:59:59-05:00</end>
        </TimeSpan>
        <styleUrl>#place_home</styleUrl>
        <Point>
          <coordinates>-71.1114458017,42.3754311174</coordinates>
        </Point>
      </Placemark>
    </Folder>
    <Folder>
      <name><![CDATA[9/5/14]]></name>
      <Placemark id="1409893200000">
        <name><![CDATA[Home]]></name>
        <description><![CDATA[<p>9/5/14<br/> 12:00 AM to 6:29 AM<br/> 6:29 hours</p>]]></description>
        <TimeSpan>
          <begin>2014-09-05T00:00:01-05:00</begin>
          <end>2014-09-05T06:29:12-05:00</end>
        </TimeSpan>
        <styleUrl>#place_home</styleUrl>
        <Point>
          <coordinates>-71.1114458017,42.3754311174</coordinates>
        </Point>
      </Placemark>
      <Placemark id="1409917894000">
        <name><![CDATA[Harvard Innovation Lab]]></name>
        <atom:link href="http://foursquare.com/venue/4e5d4676ae60839ea2e29e64"/>
        <description><![CDATA[<p>9/5/14<br/> 6:51 AM to 7:55 AM<br/> 1:03 hours</p> <p>College Technology Building<br/> <a href="http://foursquare.com/venue/4e5d4676ae60839ea2e29e64">More details (Foursquare)</a> </p>]]></description>
        <TimeSpan>
          <begin>2014-09-05T06:51:35-05:00</begin>
          <end>2014-09-05T07:55:30-05:00</end>
        </TimeSpan>
        <styleUrl>#place_College Technology Building</styleUrl>
        <Point>
          <coordinates>-71.12402979165076,42.36427488545988</coordinates>
        </Point>
      </Placemark>
      <Placemark id="1409922154000">
        <name><![CDATA[Aldrich Hall]]></name>
        <atom:link href="http://foursquare.com/venue/4ac64359f964a5206eb320e3"/>
        <description><![CDATA[<p>9/5/14<br/> 8:02 AM to 12:34 PM<br/> 4:32 hours</p> <p>College Academic Building<br/> <a href="http://foursquare.com/venue/4ac64359f964a5206eb320e3">More details (Foursquare)</a> </p>]]></description>
        <TimeSpan>
          <begin>2014-09-05T08:02:35-05:00</begin>
          <end>2014-09-05T12:34:56-05:00</end>
        </TimeSpan>
        <styleUrl>#place_College Academic Building</styleUrl>
        <Point>
          <coordinates>-71.12210915179602,42.36578780710847</coordinates>
        </Point>
      </Placemark>
      <Placemark id="1409940276000">
        <name><![CDATA[Home]]></name>
        <description><![CDATA[<p>9/5/14<br/> 1:04 PM to 1:42 PM<br/> 38 min</p>]]></description>
        <TimeSpan>
          <begin>2014-09-05T13:04:37-05:00</begin>
          <end>2014-09-05T13:42:52-05:00</end>
        </TimeSpan>
        <styleUrl>#place_home</styleUrl>
        <Point>
          <coordinates>-71.1114458017,42.3754311174</coordinates>
        </Point>
      </Placemark>
      <Placemark id="1409943480000">
        <name><![CDATA[US Post Office]]></name>
        <atom:link href="http://foursquare.com/venue/49cd318af964a520cc591fe3"/>
        <description><![CDATA[<p>9/5/14<br/> 1:58 PM to 2:06 PM<br/> 8 min</p> <p>Post Office<br/> <a href="http://foursquare.com/venue/49cd318af964a520cc591fe3">More details (Foursquare)</a> </p>]]></description>
        <TimeSpan>
          <begin>2014-09-05T13:58:01-05:00</begin>
          <end>2014-09-05T14:06:38-05:00</end>
        </TimeSpan>
        <styleUrl>#place_Post Office</styleUrl>
        <Point>
          <coordinates>-71.12294,42.373417</coordinates>
        </Point>
      </Placemark>
      <Placemark id="1409944909000">
        <name><![CDATA[Spangler Center]]></name>
        <atom:link href="http://foursquare.com/venue/4aeee0b0f964a52081d421e3"/>
        <description><![CDATA[<p>9/5/14<br/> 2:21 PM to 4:43 PM<br/> 2:21 hours</p> <p>Student Center<br/> <a href="http://foursquare.com/venue/4aeee0b0f964a52081d421e3">More details (Foursquare)</a> </p>]]></description>
        <TimeSpan>
          <begin>2014-09-05T14:21:50-05:00</begin>
          <end>2014-09-05T16:43:18-05:00</end>
        </TimeSpan>
        <styleUrl>#place_Student Center</styleUrl>
        <Point>
          <coordinates>-71.12218458495514,42.36522543920124</coordinates>
        </Point>
      </Placemark>
      <Placemark id="1409954484000">
        <name><![CDATA[Beat Hotel]]></name>
        <atom:link href="http://foursquare.com/venue/51f29465498edf6fd54a0373"/>
        <description><![CDATA[<p>9/5/14<br/> 5:01 PM to 7:11 PM<br/> 2:10 hours</p> <p>Jazz Club<br/> <a href="http://foursquare.com/venue/51f29465498edf6fd54a0373">More details (Foursquare)</a> </p>]]></description>
        <TimeSpan>
          <begin>2014-09-05T17:01:25-05:00</begin>
          <end>2014-09-05T19:11:47-05:00</end>
        </TimeSpan>
        <styleUrl>#place_Jazz Club</styleUrl>
        <Point>
          <coordinates>-71.12040319809506,42.37339550830445</coordinates>
        </Point>
      </Placemark>
      <Placemark id="1409962620000">
        <name><![CDATA[Orinoco]]></name>
        <atom:link href="http://foursquare.com/venue/4f106cace4b072565b8bd1b6"/>
        <description><![CDATA[<p>9/5/14<br/> 7:17 PM to 7:27 PM<br/> 10 min</p> <p>Arepa Restaurant<br/> <a href="http://foursquare.com/venue/4f106cace4b072565b8bd1b6">More details (Foursquare)</a> </p>]]></description>
        <TimeSpan>
          <begin>2014-09-05T19:17:01-05:00</begin>
          <end>2014-09-05T19:27:42-05:00</end>
        </TimeSpan>
        <styleUrl>#place_Arepa Restaurant</styleUrl>
        <Point>
          <coordinates>-71.12049603929978,42.37190996862827</coordinates>
        </Point>
      </Placemark>
      <Placemark id="1409973180000">
        <name><![CDATA[Home]]></name>
        <description><![CDATA[<p>9/5/14<br/> 10:13 PM to 12:00 AM<br/> 1:47 hours</p>]]></description>
        <TimeSpan>
          <begin>2014-09-05T22:13:01-05:00</begin>
          <end>2014-09-05T23:59:59-05:00</end>
        </TimeSpan>
        <styleUrl>#place_home</styleUrl>
        <Point>
          <coordinates>-71.1114458017,42.3754311174</coordinates>
        </Point>
      </Placemark>
    </Folder>
    <Folder>
      <name><![CDATA[9/6/14]]></name>
      <Placemark id="1409979600000">
        <name><![CDATA[Home]]></name>
        <description><![CDATA[<p>9/6/14<br/> 12:00 AM to 7:48 AM<br/> 7:48 hours</p>]]></description>
        <TimeSpan>
          <begin>2014-09-06T00:00:01-05:00</begin>
          <end>2014-09-06T07:48:43-05:00</end>
        </TimeSpan>
        <styleUrl>#place_home</styleUrl>
        <Point>
          <coordinates>-71.1114458017,42.3754311174</coordinates>
        </Point>
      </Placemark>
      <Placemark id="1410009172000">
        <name><![CDATA[Aldrich Hall]]></name>
        <atom:link href="http://foursquare.com/venue/4ac64359f964a5206eb320e3"/>
        <description><![CDATA[<p>9/6/14<br/> 8:12 AM to 11:36 AM<br/> 3:24 hours</p> <p>College Academic Building<br/> <a href="http://foursquare.com/venue/4ac64359f964a5206eb320e3">More details (Foursquare)</a> </p>]]></description>
        <TimeSpan>
          <begin>2014-09-06T08:12:53-05:00</begin>
          <end>2014-09-06T11:36:51-05:00</end>
        </TimeSpan>
        <styleUrl>#place_College Academic Building</styleUrl>
        <Point>
          <coordinates>-71.12210915179602,42.36578780710847</coordinates>
        </Point>
      </Placemark>
      <Placemark id="1410023363000">
        <name><![CDATA[Broadway Marketplace]]></name>
        <atom:link href="http://foursquare.com/venue/4a661612f964a520ffc71fe3"/>
        <description><![CDATA[<p>9/6/14<br/> 12:09 PM to 12:13 PM<br/> 4 min</p> <p>Grocery Store<br/> <a href="http://foursquare.com/venue/4a661612f964a520ffc71fe3">More details (Foursquare)</a> </p>]]></description>
        <TimeSpan>
          <begin>2014-09-06T12:09:24-05:00</begin>
          <end>2014-09-06T12:13:38-05:00</end>
        </TimeSpan>
        <styleUrl>#place_Grocery Store</styleUrl>
        <Point>
          <coordinates>-71.11300484548056,42.37405171427381</coordinates>
        </Point>
      </Placemark>
      <Placemark id="1410023806000">
        <name><![CDATA[Home]]></name>
        <description><![CDATA[<p>9/6/14<br/> 12:16 PM to 6:32 PM<br/> 6:15 hours</p>]]></description>
        <TimeSpan>
          <begin>2014-09-06T12:16:47-05:00</begin>
          <end>2014-09-06T18:32:13-05:00</end>
        </TimeSpan>
        <styleUrl>#place_home</styleUrl>
        <Point>
          <coordinates>-71.1114458017,42.3754311174</coordinates>
        </Point>
      </Placemark>
      <Placemark id="1410046672000">
        <name><![CDATA[Broadway Marketplace]]></name>
        <atom:link href="http://foursquare.com/venue/4a661612f964a520ffc71fe3"/>
        <description><![CDATA[<p>9/6/14<br/> 6:37 PM to 6:52 PM<br/> 14 min</p> <p>Grocery Store<br/> <a href="http://foursquare.com/venue/4a661612f964a520ffc71fe3">More details (Foursquare)</a> </p>]]></description>
        <TimeSpan>
          <begin>2014-09-06T18:37:53-05:00</begin>
          <end>2014-09-06T18:52:49-05:00</end>
        </TimeSpan>
        <styleUrl>#place_Grocery Store</styleUrl>
        <Point>
          <coordinates>-71.11300484548056,42.37405171427381</coordinates>
        </Point>
      </Placemark>
      <Placemark id="1410047849000">
        <name><![CDATA[Home]]></name>
        <description><![CDATA[<p>9/6/14<br/> 6:57 PM to 8:01 PM<br/> 1:04 hours</p>]]></description>
        <TimeSpan>
          <begin>2014-09-06T18:57:30-05:00</begin>
          <end>2014-09-06T20:01:40-05:00</end>
        </TimeSpan>
        <styleUrl>#place_home</styleUrl>
        <Point>
          <coordinates>-71.1114458017,42.3754311174</coordinates>
        </Point>
      </Placemark>
      <Placemark id="1410052583000">
        <name><![CDATA[Home]]></name>
        <description><![CDATA[<p>9/6/14<br/> 8:16 PM to 12:00 AM<br/> 3:43 hours</p>]]></description>
        <TimeSpan>
          <begin>2014-09-06T20:16:24-05:00</begin>
          <end>2014-09-06T23:59:59-05:00</end>
        </TimeSpan>
        <styleUrl>#place_home</styleUrl>
        <Point>
          <coordinates>-71.1114458017,42.3754311174</coordinates>
        </Point>
      </Placemark>
    </Folder>
    <Folder>
      <name><![CDATA[9/7/14]]></name>
      <Placemark id="1410066000000">
        <name><![CDATA[Home]]></name>
        <description><![CDATA[<p>9/7/14<br/> 12:00 AM to 3:38 PM<br/> 15:38 hours</p>]]></description>
        <TimeSpan>
          <begin>2014-09-07T00:00:01-05:00</begin>
          <end>2014-09-07T15:38:50-05:00</end>
        </TimeSpan>
        <styleUrl>#place_home</styleUrl>
        <Point>
          <coordinates>-71.1114458017,42.3754311174</coordinates>
        </Point>
      </Placemark>
      <Placemark id="1410123192000">
        <name><![CDATA[Hemenway Gym]]></name>
        <atom:link href="http://foursquare.com/venue/4a9d3432f964a520ed3720e3"/>
        <description><![CDATA[<p>9/7/14<br/> 3:53 PM to 4:50 PM<br/> 56 min</p> <p>Gym<br/> <a href="http://foursquare.com/venue/4a9d3432f964a520ed3720e3">More details (Foursquare)</a> </p>]]></description>
        <TimeSpan>
          <begin>2014-09-07T15:53:13-05:00</begin>
          <end>2014-09-07T16:50:07-05:00</end>
        </TimeSpan>
        <styleUrl>#place_Gym</styleUrl>
        <Point>
          <coordinates>-71.11979972974,42.37697342388555</coordinates>
        </Point>
      </Placemark>
      <Placemark id="1410127761000">
        <name><![CDATA[Home]]></name>
        <description><![CDATA[<p>9/7/14<br/> 5:09 PM to 12:00 AM<br/> 6:50 hours</p>]]></description>
        <TimeSpan>
          <begin>2014-09-07T17:09:22-05:00</begin>
          <end>2014-09-07T23:59:59-05:00</end>
        </TimeSpan>
        <styleUrl>#place_home</styleUrl>
        <Point>
          <coordinates>-71.1114458017,42.3754311174</coordinates>
        </Point>
      </Placemark>
    </Folder>
    <Folder>
      <name><![CDATA[9/8/14]]></name>
      <Placemark id="1410152400000">
        <name><![CDATA[Home]]></name>
        <description><![CDATA[<p>9/8/14<br/> 12:00 AM to 6:17 AM<br/> 6:17 hours</p>]]></description>
        <TimeSpan>
          <begin>2014-09-08T00:00:01-05:00</begin>
          <end>2014-09-08T06:17:26-05:00</end>
        </TimeSpan>
        <styleUrl>#place_home</styleUrl>
        <Point>
          <coordinates>-71.1114458017,42.3754311174</coordinates>
        </Point>
      </Placemark>
      <Placemark id="1410176667000">
        <name><![CDATA[Harvard Innovation Lab]]></name>
        <atom:link href="http://foursquare.com/venue/4e5d4676ae60839ea2e29e64"/>
        <description><![CDATA[<p>9/8/14<br/> 6:44 AM to 7:56 AM<br/> 1:11 hours</p> <p>College Technology Building<br/> <a href="http://foursquare.com/venue/4e5d4676ae60839ea2e29e64">More details (Foursquare)</a> </p>]]></description>
        <TimeSpan>
          <begin>2014-09-08T06:44:28-05:00</begin>
          <end>2014-09-08T07:56:25-05:00</end>
        </TimeSpan>
        <styleUrl>#place_College Technology Building</styleUrl>
        <Point>
          <coordinates>-71.12402979165076,42.36427488545988</coordinates>
        </Point>
      </Placemark>
      <Placemark id="1410181027000">
        <name><![CDATA[Aldrich Hall]]></name>
        <atom:link href="http://foursquare.com/venue/4ac64359f964a5206eb320e3"/>
        <description><![CDATA[<p>9/8/14<br/> 7:57 AM to 3:09 PM<br/> 7:12 hours</p> <p>College Academic Building<br/> <a href="http://foursquare.com/venue/4ac64359f964a5206eb320e3">More details (Foursquare)</a> </p>]]></description>
        <TimeSpan>
          <begin>2014-09-08T07:57:08-05:00</begin>
          <end>2014-09-08T15:09:27-05:00</end>
        </TimeSpan>
        <styleUrl>#place_College Academic Building</styleUrl>
        <Point>
          <coordinates>-71.12210915179602,42.36578780710847</coordinates>
        </Point>
      </Placemark>
      <Placemark id="1410207705000">
        <name><![CDATA[Leverett House]]></name>
        <atom:link href="http://foursquare.com/venue/4b5b9c2ef964a520cb0a29e3"/>
        <description><![CDATA[<p>9/8/14<br/> 3:21 PM to 3:23 PM<br/> 2 min</p> <p>College Residence Hall<br/> <a href="http://foursquare.com/venue/4b5b9c2ef964a520cb0a29e3">More details (Foursquare)</a> </p>]]></description>
        <TimeSpan>
          <begin>2014-09-08T15:21:46-05:00</begin>
          <end>2014-09-08T15:23:54-05:00</end>
        </TimeSpan>
        <styleUrl>#place_College Residence Hall</styleUrl>
        <Point>
          <coordinates>-71.11702028202814,42.36972025201748</coordinates>
        </Point>
      </Placemark>
      <Placemark id="1410208238000">
        <name><![CDATA[Broadway Marketplace]]></name>
        <atom:link href="http://foursquare.com/venue/4a661612f964a520ffc71fe3"/>
        <description><![CDATA[<p>9/8/14<br/> 3:30 PM to 3:36 PM<br/> 5 min</p> <p>Grocery Store<br/> <a href="http://foursquare.com/venue/4a661612f964a520ffc71fe3">More details (Foursquare)</a> </p>]]></description>
        <TimeSpan>
          <begin>2014-09-08T15:30:39-05:00</begin>
          <end>2014-09-08T15:36:13-05:00</end>
        </TimeSpan>
        <styleUrl>#place_Grocery Store</styleUrl>
        <Point>
          <coordinates>-71.11300484548056,42.37405171427381</coordinates>
        </Point>
      </Placemark>
      <Placemark id="1410208859000">
        <name><![CDATA[Home]]></name>
        <description><![CDATA[<p>9/8/14<br/> 3:40 PM to 6:11 PM<br/> 2:30 hours</p>]]></description>
        <TimeSpan>
          <begin>2014-09-08T15:41:00-05:00</begin>
          <end>2014-09-08T18:11:42-05:00</end>
        </TimeSpan>
        <styleUrl>#place_home</styleUrl>
        <Point>
          <coordinates>-71.1114458017,42.3754311174</coordinates>
        </Point>
      </Placemark>
      <Placemark id="1410218522000">
        <name><![CDATA[Border Cafe]]></name>
        <atom:link href="http://foursquare.com/venue/3fd66200f964a520bded1ee3"/>
        <description><![CDATA[<p>9/8/14<br/> 6:22 PM to 8:10 PM<br/> 1:48 hours</p> <p>Mexican Restaurant<br/> <a href="http://foursquare.com/venue/3fd66200f964a520bded1ee3">More details (Foursquare)</a> </p>]]></description>
        <TimeSpan>
          <begin>2014-09-08T18:22:03-05:00</begin>
          <end>2014-09-08T20:10:48-05:00</end>
        </TimeSpan>
        <styleUrl>#place_Mexican Restaurant</styleUrl>
        <Point>
          <coordinates>-71.120141,42.3743468</coordinates>
        </Point>
      </Placemark>
      <Placemark id="1410225834000">
        <name><![CDATA[Home]]></name>
        <description><![CDATA[<p>9/8/14<br/> 8:23 PM to 12:00 AM<br/> 3:36 hours</p>]]></description>
        <TimeSpan>
          <begin>2014-09-08T20:23:55-05:00</begin>
          <end>2014-09-08T23:59:59-05:00</end>
        </TimeSpan>
        <styleUrl>#place_home</styleUrl>
        <Point>
          <coordinates>-71.1114458017,42.3754311174</coordinates>
        </Point>
      </Placemark>
    </Folder>
    <Folder>
      <name><![CDATA[9/9/14]]></name>
      <Placemark id="1410238800000">
        <name><![CDATA[Home]]></name>
        <description><![CDATA[<p>9/9/14<br/> 12:00 AM to 5:55 AM<br/> 5:55 hours</p>]]></description>
        <TimeSpan>
          <begin>2014-09-09T00:00:01-05:00</begin>
          <end>2014-09-09T05:55:35-05:00</end>
        </TimeSpan>
        <styleUrl>#place_home</styleUrl>
        <Point>
          <coordinates>-71.1114458017,42.3754311174</coordinates>
        </Point>
      </Placemark>
      <Placemark id="1410261729000">
        <name><![CDATA[Harvard Innovation Lab]]></name>
        <atom:link href="http://foursquare.com/venue/4e5d4676ae60839ea2e29e64"/>
        <description><![CDATA[<p>9/9/14<br/> 6:22 AM to 7:57 AM<br/> 1:35 hours</p> <p>College Technology Building<br/> <a href="http://foursquare.com/venue/4e5d4676ae60839ea2e29e64">More details (Foursquare)</a> </p>]]></description>
        <TimeSpan>
          <begin>2014-09-09T06:22:10-05:00</begin>
          <end>2014-09-09T07:57:24-05:00</end>
        </TimeSpan>
        <styleUrl>#place_College Technology Building</styleUrl>
        <Point>
          <coordinates>-71.12407621183526,42.36403242532342</coordinates>
        </Point>
      </Placemark>
      <Placemark id="1410267889000">
        <name><![CDATA[Aldrich Hall]]></name>
        <atom:link href="http://foursquare.com/venue/4ac64359f964a5206eb320e3"/>
        <description><![CDATA[<p>9/9/14<br/> 8:04 AM to 1:50 PM<br/> 5:45 hours</p> <p>College Academic Building<br/> <a href="http://foursquare.com/venue/4ac64359f964a5206eb320e3">More details (Foursquare)</a> </p>]]></description>
        <TimeSpan>
          <begin>2014-09-09T08:04:50-05:00</begin>
          <end>2014-09-09T13:50:18-05:00</end>
        </TimeSpan>
        <styleUrl>#place_College Academic Building</styleUrl>
        <Point>
          <coordinates>-71.12210915179602,42.36578780710847</coordinates>
        </Point>
      </Placemark>
      <Placemark id="1410290120000">
        <name><![CDATA[Home]]></name>
        <description><![CDATA[<p>9/9/14<br/> 2:15 PM to 5:30 PM<br/> 3:15 hours</p>]]></description>
        <TimeSpan>
          <begin>2014-09-09T14:15:21-05:00</begin>
          <end>2014-09-09T17:30:53-05:00</end>
        </TimeSpan>
        <styleUrl>#place_home</styleUrl>
        <Point>
          <coordinates>-71.1114458017,42.3754311174</coordinates>
        </Point>
      </Placemark>
      <Placemark id="1410302110000">
        <name><![CDATA[Broadway Marketplace]]></name>
        <atom:link href="http://foursquare.com/venue/4a661612f964a520ffc71fe3"/>
        <description><![CDATA[<p>9/9/14<br/> 5:35 PM to 5:38 PM<br/> 3 min</p> <p>Grocery Store<br/> <a href="http://foursquare.com/venue/4a661612f964a520ffc71fe3">More details (Foursquare)</a> </p>]]></description>
        <TimeSpan>
          <begin>2014-09-09T17:35:11-05:00</begin>
          <end>2014-09-09T17:38:27-05:00</end>
        </TimeSpan>
        <styleUrl>#place_Grocery Store</styleUrl>
        <Point>
          <coordinates>-71.11300484548056,42.37405171427381</coordinates>
        </Point>
      </Placemark>
      <Placemark id="1410302535000">
        <name><![CDATA[Home]]></name>
        <description><![CDATA[<p>9/9/14<br/> 5:42 PM to 12:00 AM<br/> 6:17 hours</p>]]></description>
        <TimeSpan>
          <begin>2014-09-09T17:42:16-05:00</begin>
          <end>2014-09-09T23:59:59-05:00</end>
        </TimeSpan>
        <styleUrl>#place_home</styleUrl>
        <Point>
          <coordinates>-71.1114458017,42.3754311174</coordinates>
        </Point>
      </Placemark>
    </Folder>
    <Folder>
      <name><![CDATA[9/10/14]]></name>
      <Placemark id="1410325200000">
        <name><![CDATA[Home]]></name>
        <description><![CDATA[<p>9/10/14<br/> 12:00 AM to 8:56 AM<br/> 8:56 hours</p>]]></description>
        <TimeSpan>
          <begin>2014-09-10T00:00:01-05:00</begin>
          <end>2014-09-10T08:56:17-05:00</end>
        </TimeSpan>
        <styleUrl>#place_home</styleUrl>
        <Point>
          <coordinates>-71.1114458017,42.3754311174</coordinates>
        </Point>
      </Placemark>
      <Placemark id="1410358794000">
        <name><![CDATA[Spangler Center]]></name>
        <atom:link href="http://foursquare.com/venue/4aeee0b0f964a52081d421e3"/>
        <description><![CDATA[<p>9/10/14<br/> 9:19 AM to 4:16 PM<br/> 6:56 hours</p> <p>Student Center<br/> <a href="http://foursquare.com/venue/4aeee0b0f964a52081d421e3">More details (Foursquare)</a> </p>]]></description>
        <TimeSpan>
          <begin>2014-09-10T09:19:55-05:00</begin>
          <end>2014-09-10T16:16:18-05:00</end>
        </TimeSpan>
        <styleUrl>#place_Student Center</styleUrl>
        <Point>
          <coordinates>-71.12218458495514,42.36522543920124</coordinates>
        </Point>
      </Placemark>
      <Placemark id="1410385245000">
        <name><![CDATA[Home]]></name>
        <description><![CDATA[<p>9/10/14<br/> 4:40 PM to 8:59 PM<br/> 4:18 hours</p>]]></description>
        <TimeSpan>
          <begin>2014-09-10T16:40:46-05:00</begin>
          <end>2014-09-10T20:59:12-05:00</end>
        </TimeSpan>
        <styleUrl>#place_home</styleUrl>
        <Point>
          <coordinates>-71.1114458017,42.3754311174</coordinates>
        </Point>
      </Placemark>
      <Placemark id="1410401273000">
        <name><![CDATA[Will Whitney and Benjana Guraziu Home]]></name>
        <description><![CDATA[<p>9/10/14<br/> 9:07 PM to 9:20 PM<br/> 13 min</p>]]></description>
        <TimeSpan>
          <begin>2014-09-10T21:07:54-05:00</begin>
          <end>2014-09-10T21:20:54-05:00</end>
        </TimeSpan>
        <styleUrl>#place_home</styleUrl>
        <Point>
          <coordinates>-71.1114357056,42.3700145918</coordinates>
        </Point>
      </Placemark>
      <Placemark id="1410403357000">
        <name><![CDATA[Whisky Saigon]]></name>
        <atom:link href="http://foursquare.com/venue/5279339111d23f7e3e40c260"/>
        <description><![CDATA[<p>9/10/14<br/> 9:42 PM to 10:43 PM<br/> 1:00 hours</p> <p>Nightclub<br/> <a href="http://foursquare.com/venue/5279339111d23f7e3e40c260">More details (Foursquare)</a> </p>]]></description>
        <TimeSpan>
          <begin>2014-09-10T21:42:38-05:00</begin>
          <end>2014-09-10T22:43:20-05:00</end>
        </TimeSpan>
        <styleUrl>#place_Nightclub</styleUrl>
        <Point>
          <coordinates>-71.06571601465738,42.35241910162504</coordinates>
        </Point>
      </Placemark>
      <Placemark id="1410408530000">
        <name><![CDATA[Home]]></name>
        <description><![CDATA[<p>9/10/14<br/> 11:08 PM to 12:00 AM<br/> 51 min</p>]]></description>
        <TimeSpan>
          <begin>2014-09-10T23:08:51-05:00</begin>
          <end>2014-09-10T23:59:59-05:00</end>
        </TimeSpan>
        <styleUrl>#place_home</styleUrl>
        <Point>
          <coordinates>-71.1114458017,42.3754311174</coordinates>
        </Point>
      </Placemark>
    </Folder>
    <Folder>
      <name><![CDATA[9/11/14]]></name>
      <Placemark id="1410411600000">
        <name><![CDATA[Home]]></name>
        <description><![CDATA[<p>9/11/14<br/> 12:00 AM to 6:30 AM<br/> 6:30 hours</p>]]></description>
        <TimeSpan>
          <begin>2014-09-11T00:00:01-05:00</begin>
          <end>2014-09-11T06:30:25-05:00</end>
        </TimeSpan>
        <styleUrl>#place_home</styleUrl>
        <Point>
          <coordinates>-71.1114458017,42.3754311174</coordinates>
        </Point>
      </Placemark>
      <Placemark id="1410435809000">
        <name><![CDATA[Starbucks]]></name>
        <atom:link href="http://foursquare.com/venue/49bc4e56f964a52028541fe3"/>
        <description><![CDATA[<p>9/11/14<br/> 6:43 AM to 6:47 AM<br/> 3 min</p> <p>Café<br/> <a href="http://foursquare.com/venue/49bc4e56f964a52028541fe3">More details (Foursquare)</a> </p>]]></description>
        <TimeSpan>
          <begin>2014-09-11T06:43:30-05:00</begin>
          <end>2014-09-11T06:47:22-05:00</end>
        </TimeSpan>
        <styleUrl>#place_Café</styleUrl>
        <Point>
          <coordinates>-71.119452,42.372485</coordinates>
        </Point>
      </Placemark>
      <Placemark id="1410436935000">
        <name><![CDATA[Aldrich Hall]]></name>
        <atom:link href="http://foursquare.com/venue/4ac64359f964a5206eb320e3"/>
        <description><![CDATA[<p>9/11/14<br/> 7:02 AM to 8:47 AM<br/> 1:44 hours</p> <p>College Academic Building<br/> <a href="http://foursquare.com/venue/4ac64359f964a5206eb320e3">More details (Foursquare)</a> </p>]]></description>
        <TimeSpan>
          <begin>2014-09-11T07:02:16-05:00</begin>
          <end>2014-09-11T08:47:07-05:00</end>
        </TimeSpan>
        <styleUrl>#place_College Academic Building</styleUrl>
        <Point>
          <coordinates>-71.12210915179602,42.36578780710847</coordinates>
        </Point>
      </Placemark>
      <Placemark id="1410444058000">
        <name><![CDATA[Harvard Innovation Lab]]></name>
        <atom:link href="http://foursquare.com/venue/4e5d4676ae60839ea2e29e64"/>
        <description><![CDATA[<p>9/11/14<br/> 9:00 AM to 11:04 AM<br/> 2:03 hours</p> <p>College Technology Building<br/> <a href="http://foursquare.com/venue/4e5d4676ae60839ea2e29e64">More details (Foursquare)</a> </p>]]></description>
        <TimeSpan>
          <begin>2014-09-11T09:00:59-05:00</begin>
          <end>2014-09-11T11:04:10-05:00</end>
        </TimeSpan>
        <styleUrl>#place_College Technology Building</styleUrl>
        <Point>
          <coordinates>-71.12402979165076,42.36427488545988</coordinates>
        </Point>
      </Placemark>
      <Placemark id="1410452575000">
        <name><![CDATA[Orinoco]]></name>
        <atom:link href="http://foursquare.com/venue/4f106cace4b072565b8bd1b6"/>
        <description><![CDATA[<p>9/11/14<br/> 11:22 AM to 12:35 PM<br/> 1:12 hours</p> <p>Arepa Restaurant<br/> <a href="http://foursquare.com/venue/4f106cace4b072565b8bd1b6">More details (Foursquare)</a> </p>]]></description>
        <TimeSpan>
          <begin>2014-09-11T11:22:56-05:00</begin>
          <end>2014-09-11T12:35:22-05:00</end>
        </TimeSpan>
        <styleUrl>#place_Arepa Restaurant</styleUrl>
        <Point>
          <coordinates>-71.12049603929978,42.37190996862827</coordinates>
        </Point>
      </Placemark>
      <Placemark id="1410457084000">
        <name><![CDATA[The Red House Restaurant]]></name>
        <atom:link href="http://foursquare.com/venue/4409e8acf964a52068301fe3"/>
        <description><![CDATA[<p>9/11/14<br/> 12:38 PM to 1:39 PM<br/> 1:01 hours</p> <p>New American Restaurant<br/> <a href="http://foursquare.com/venue/4409e8acf964a52068301fe3">More details (Foursquare)</a> </p>]]></description>
        <TimeSpan>
          <begin>2014-09-11T12:38:05-05:00</begin>
          <end>2014-09-11T13:39:33-05:00</end>
        </TimeSpan>
        <styleUrl>#place_New American Restaurant</styleUrl>
        <Point>
          <coordinates>-71.121291,42.37249515</coordinates>
        </Point>
      </Placemark>
      <Placemark id="1410461919000">
        <name><![CDATA[Place in Allston]]></name>
        <description><![CDATA[<p>9/11/14<br/> 1:58 PM to 5:09 PM<br/> 3:10 hours</p>]]></description>
        <TimeSpan>
          <begin>2014-09-11T13:58:40-05:00</begin>
          <end>2014-09-11T17:09:03-05:00</end>
        </TimeSpan>
        <styleUrl>#place_unknown</styleUrl>
        <Point>
          <coordinates>-71.1209586691,42.3654244908</coordinates>
        </Point>
      </Placemark>
      <Placemark id="1410474110000">
        <name><![CDATA[Park]]></name>
        <atom:link href="http://foursquare.com/venue/4f7c8902e4b032c26c6798db"/>
        <description><![CDATA[<p>9/11/14<br/> 5:21 PM to 6:49 PM<br/> 1:27 hours</p> <p>Gastropub<br/> <a href="http://foursquare.com/venue/4f7c8902e4b032c26c6798db">More details (Foursquare)</a> </p>]]></description>
        <TimeSpan>
          <begin>2014-09-11T17:21:51-05:00</begin>
          <end>2014-09-11T18:49:04-05:00</end>
        </TimeSpan>
        <styleUrl>#place_Gastropub</styleUrl>
        <Point>
          <coordinates>-71.12097185013617,42.37169409933257</coordinates>
        </Point>
      </Placemark>
      <Placemark id="1410480099000">
        <name><![CDATA[Place in Old Cambridge]]></name>
        <description><![CDATA[<p>9/11/14<br/> 7:01 PM to 7:07 PM<br/> 5 min</p>]]></description>
        <TimeSpan>
          <begin>2014-09-11T19:01:40-05:00</begin>
          <end>2014-09-11T19:07:32-05:00</end>
        </TimeSpan>
        <styleUrl>#place_unknown</styleUrl>
        <Point>
          <coordinates>-71.1146211906,42.3687046575</coordinates>
        </Point>
      </Placemark>
      <Placemark id="1410480766000">
        <name><![CDATA[Place in Cambridgeport]]></name>
        <description><![CDATA[<p>9/11/14<br/> 7:12 PM to 8:46 PM<br/> 1:33 hours</p>]]></description>
        <TimeSpan>
          <begin>2014-09-11T19:12:47-05:00</begin>
          <end>2014-09-11T20:45:59-05:00</end>
        </TimeSpan>
        <styleUrl>#place_unknown</styleUrl>
        <Point>
          <coordinates>-71.1136032727,42.3660799784</coordinates>
        </Point>
      </Placemark>
      <Placemark id="1410487329000">
        <name><![CDATA[Home]]></name>
        <description><![CDATA[<p>9/11/14<br/> 9:02 PM to 12:00 AM<br/> 2:57 hours</p>]]></description>
        <TimeSpan>
          <begin>2014-09-11T21:02:10-05:00</begin>
          <end>2014-09-11T23:59:59-05:00</end>
        </TimeSpan>
        <styleUrl>#place_home</styleUrl>
        <Point>
          <coordinates>-71.1114458017,42.3754311174</coordinates>
        </Point>
      </Placemark>
    </Folder>
    <Folder>
      <name><![CDATA[9/12/14]]></name>
      <Placemark id="1410498000000">
        <name><![CDATA[Home]]></name>
        <description><![CDATA[<p>9/12/14<br/> 12:00 AM to 5:48 AM<br/> 5:48 hours</p>]]></description>
        <TimeSpan>
          <begin>2014-09-12T00:00:01-05:00</begin>
          <end>2014-09-12T05:48:37-05:00</end>
        </TimeSpan>
        <styleUrl>#place_home</styleUrl>
        <Point>
          <coordinates>-71.1114458017,42.3754311174</coordinates>
        </Point>
      </Placemark>
      <Placemark id="1410519653000">
        <name><![CDATA[Starbucks]]></name>
        <atom:link href="http://foursquare.com/venue/49bc4e56f964a52028541fe3"/>
        <description><![CDATA[<p>9/12/14<br/> 6:00 AM to 6:03 AM<br/> 2 min</p> <p>Café<br/> <a href="http://foursquare.com/venue/49bc4e56f964a52028541fe3">More details (Foursquare)</a> </p>]]></description>
        <TimeSpan>
          <begin>2014-09-12T06:00:54-05:00</begin>
          <end>2014-09-12T06:03:05-05:00</end>
        </TimeSpan>
        <styleUrl>#place_Café</styleUrl>
        <Point>
          <coordinates>-71.119452,42.372485</coordinates>
        </Point>
      </Placemark>
      <Placemark id="1410520897000">
        <name><![CDATA[Harvard Innovation Lab]]></name>
        <atom:link href="http://foursquare.com/venue/4e5d4676ae60839ea2e29e64"/>
        <description><![CDATA[<p>9/12/14<br/> 6:21 AM to 7:52 AM<br/> 1:30 hours</p> <p>College Technology Building<br/> <a href="http://foursquare.com/venue/4e5d4676ae60839ea2e29e64">More details (Foursquare)</a> </p>]]></description>
        <TimeSpan>
          <begin>2014-09-12T06:21:38-05:00</begin>
          <end>2014-09-12T07:52:30-05:00</end>
        </TimeSpan>
        <styleUrl>#place_College Technology Building</styleUrl>
        <Point>
          <coordinates>-71.12402979165076,42.36427488545988</coordinates>
        </Point>
      </Placemark>
      <Placemark id="1410526907000">
        <name><![CDATA[Aldrich Hall]]></name>
        <atom:link href="http://foursquare.com/venue/4ac64359f964a5206eb320e3"/>
        <description><![CDATA[<p>9/12/14<br/> 8:01 AM to 2:01 PM<br/> 5:59 hours</p> <p>College Academic Building<br/> <a href="http://foursquare.com/venue/4ac64359f964a5206eb320e3">More details (Foursquare)</a> </p>]]></description>
        <TimeSpan>
          <begin>2014-09-12T08:01:48-05:00</begin>
          <end>2014-09-12T14:01:37-05:00</end>
        </TimeSpan>
        <styleUrl>#place_College Academic Building</styleUrl>
        <Point>
          <coordinates>-71.12210915179602,42.36578780710847</coordinates>
        </Point>
      </Placemark>
      <Placemark id="1410548782000">
        <name><![CDATA[Place in Allston]]></name>
        <description><![CDATA[<p>9/12/14<br/> 2:06 PM to 2:10 PM<br/> 3 min</p>]]></description>
        <TimeSpan>
          <begin>2014-09-12T14:06:23-05:00</begin>
          <end>2014-09-12T14:10:12-05:00</end>
        </TimeSpan>
        <styleUrl>#place_unknown</styleUrl>
        <Point>
          <coordinates>-71.1218881979,42.365625742</coordinates>
        </Point>
      </Placemark>
      <Placemark id="1410549306000">
        <name><![CDATA[Aldrich Hall]]></name>
        <atom:link href="http://foursquare.com/venue/4ac64359f964a5206eb320e3"/>
        <description><![CDATA[<p>9/12/14<br/> 2:15 PM to 4:42 PM<br/> 2:26 hours</p> <p>College Academic Building<br/> <a href="http://foursquare.com/venue/4ac64359f964a5206eb320e3">More details (Foursquare)</a> </p>]]></description>
        <TimeSpan>
          <begin>2014-09-12T14:15:07-05:00</begin>
          <end>2014-09-12T16:42:04-05:00</end>
        </TimeSpan>
        <styleUrl>#place_College Academic Building</styleUrl>
        <Point>
          <coordinates>-71.12210915179602,42.36578780710847</coordinates>
        </Point>
      </Placemark>
      <Placemark id="1410559088000">
        <name><![CDATA[The Charles Hotel]]></name>
        <atom:link href="http://foursquare.com/venue/4a3eb3f3f964a5204fa31fe3"/>
        <description><![CDATA[<p>9/12/14<br/> 4:58 PM to 6:41 PM<br/> 1:43 hours</p> <p>Hotel<br/> <a href="http://foursquare.com/venue/4a3eb3f3f964a5204fa31fe3">More details (Foursquare)</a> </p>]]></description>
        <TimeSpan>
          <begin>2014-09-12T16:58:09-05:00</begin>
          <end>2014-09-12T18:41:50-05:00</end>
        </TimeSpan>
        <styleUrl>#place_Hotel</styleUrl>
        <Point>
          <coordinates>-71.12295627593994,42.3724718672702</coordinates>
        </Point>
      </Placemark>
      <Placemark id="1410566363000">
        <name><![CDATA[Home]]></name>
        <description><![CDATA[<p>9/12/14<br/> 6:59 PM to 12:00 AM<br/> 5:00 hours</p>]]></description>
        <TimeSpan>
          <begin>2014-09-12T18:59:24-05:00</begin>
          <end>2014-09-12T23:59:59-05:00</end>
        </TimeSpan>
        <styleUrl>#place_home</styleUrl>
        <Point>
          <coordinates>-71.1114458017,42.3754311174</coordinates>
        </Point>
      </Placemark>
    </Folder>
    <Folder>
      <name><![CDATA[9/13/14]]></name>
      <Placemark id="1410584400000">
        <name><![CDATA[Home]]></name>
        <description><![CDATA[<p>9/13/14<br/> 12:00 AM to 2:34 PM<br/> 14:34 hours</p>]]></description>
        <TimeSpan>
          <begin>2014-09-13T00:00:01-05:00</begin>
          <end>2014-09-13T14:34:06-05:00</end>
        </TimeSpan>
        <styleUrl>#place_home</styleUrl>
        <Point>
          <coordinates>-71.1114458017,42.3754311174</coordinates>
        </Point>
      </Placemark>
      <Placemark id="1410637706000">
        <name><![CDATA[Hemenway Gym]]></name>
        <atom:link href="http://foursquare.com/venue/4a9d3432f964a520ed3720e3"/>
        <description><![CDATA[<p>9/13/14<br/> 2:48 PM to 3:23 PM<br/> 34 min</p> <p>Gym<br/> <a href="http://foursquare.com/venue/4a9d3432f964a520ed3720e3">More details (Foursquare)</a> </p>]]></description>
        <TimeSpan>
          <begin>2014-09-13T14:48:27-05:00</begin>
          <end>2014-09-13T15:23:07-05:00</end>
        </TimeSpan>
        <styleUrl>#place_Gym</styleUrl>
        <Point>
          <coordinates>-71.11979972974,42.37697342388555</coordinates>
        </Point>
      </Placemark>
      <Placemark id="1410640686000">
        <name><![CDATA[Home]]></name>
        <description><![CDATA[<p>9/13/14<br/> 3:38 PM to 12:00 AM<br/> 8:21 hours</p>]]></description>
        <TimeSpan>
          <begin>2014-09-13T15:38:07-05:00</begin>
          <end>2014-09-13T23:59:59-05:00</end>
        </TimeSpan>
        <styleUrl>#place_home</styleUrl>
        <Point>
          <coordinates>-71.1114458017,42.3754311174</coordinates>
        </Point>
      </Placemark>
    </Folder>
    <Folder>
      <name><![CDATA[9/14/14]]></name>
      <Placemark id="1410670800000">
        <name><![CDATA[Home]]></name>
        <description><![CDATA[<p>9/14/14<br/> 12:00 AM to 12:03 PM<br/> 12:03 hours</p>]]></description>
        <TimeSpan>
          <begin>2014-09-14T00:00:01-05:00</begin>
          <end>2014-09-14T12:03:41-05:00</end>
        </TimeSpan>
        <styleUrl>#place_home</styleUrl>
        <Point>
          <coordinates>-71.1114458017,42.3754311174</coordinates>
        </Point>
      </Placemark>
      <Placemark id="1410715106000">
        <name><![CDATA[Staples]]></name>
        <atom:link href="http://foursquare.com/venue/4b1e88eaf964a520321b24e3"/>
        <description><![CDATA[<p>9/14/14<br/> 12:18 PM to 12:24 PM<br/> 6 min</p> <p>Paper / Office Supplies Store<br/> <a href="http://foursquare.com/venue/4b1e88eaf964a520321b24e3">More details (Foursquare)</a> </p>]]></description>
        <TimeSpan>
          <begin>2014-09-14T12:18:27-05:00</begin>
          <end>2014-09-14T12:24:39-05:00</end>
        </TimeSpan>
        <styleUrl>#place_Paper / Office Supplies Store</styleUrl>
        <Point>
          <coordinates>-71.119043,42.373776</coordinates>
        </Point>
      </Placemark>
      <Placemark id="1410715852000">
        <name><![CDATA[Adams House]]></name>
        <atom:link href="http://foursquare.com/venue/4b5e4514f964a520f28629e3"/>
        <description><![CDATA[<p>9/14/14<br/> 12:30 PM to 12:33 PM<br/> 2 min</p> <p>College Residence Hall<br/> <a href="http://foursquare.com/venue/4b5e4514f964a520f28629e3">More details (Foursquare)</a> </p>]]></description>
        <TimeSpan>
          <begin>2014-09-14T12:30:53-05:00</begin>
          <end>2014-09-14T12:33:18-05:00</end>
        </TimeSpan>
        <styleUrl>#place_College Residence Hall</styleUrl>
        <Point>
          <coordinates>-71.11655026913272,42.3717166982379</coordinates>
        </Point>
      </Placemark>
      <Placemark id="1410716721000">
        <name><![CDATA[Home]]></name>
        <description><![CDATA[<p>9/14/14<br/> 12:45 PM to 12:00 AM<br/> 11:14 hours</p>]]></description>
        <TimeSpan>
          <begin>2014-09-14T12:45:22-05:00</begin>
          <end>2014-09-14T23:59:59-05:00</end>
        </TimeSpan>
        <styleUrl>#place_home</styleUrl>
        <Point>
          <coordinates>-71.1114458017,42.3754311174</coordinates>
        </Point>
      </Placemark>
    </Folder>
    <Folder>
      <name><![CDATA[9/15/14]]></name>
      <Placemark id="1410757200000">
        <name><![CDATA[Home]]></name>
        <description><![CDATA[<p>9/15/14<br/> 12:00 AM to 6:26 AM<br/> 6:26 hours</p>]]></description>
        <TimeSpan>
          <begin>2014-09-15T00:00:01-05:00</begin>
          <end>2014-09-15T06:26:05-05:00</end>
        </TimeSpan>
        <styleUrl>#place_home</styleUrl>
        <Point>
          <coordinates>-71.1114458017,42.3754311174</coordinates>
        </Point>
      </Placemark>
      <Placemark id="1410782067000">
        <name><![CDATA[Harvard Innovation Lab]]></name>
        <atom:link href="http://foursquare.com/venue/4e5d4676ae60839ea2e29e64"/>
        <description><![CDATA[<p>9/15/14<br/> 6:54 AM to 7:55 AM<br/> 1:01 hours</p> <p>College Technology Building<br/> <a href="http://foursquare.com/venue/4e5d4676ae60839ea2e29e64">More details (Foursquare)</a> </p>]]></description>
        <TimeSpan>
          <begin>2014-09-15T06:54:28-05:00</begin>
          <end>2014-09-15T07:55:48-05:00</end>
        </TimeSpan>
        <styleUrl>#place_College Technology Building</styleUrl>
        <Point>
          <coordinates>-71.12402979165076,42.36427488545988</coordinates>
        </Point>
      </Placemark>
      <Placemark id="1410786297000">
        <name><![CDATA[Aldrich Hall]]></name>
        <atom:link href="http://foursquare.com/venue/4ac64359f964a5206eb320e3"/>
        <description><![CDATA[<p>9/15/14<br/> 8:04 AM to 12:01 PM<br/> 3:56 hours</p> <p>College Academic Building<br/> <a href="http://foursquare.com/venue/4ac64359f964a5206eb320e3">More details (Foursquare)</a> </p>]]></description>
        <TimeSpan>
          <begin>2014-09-15T08:04:58-05:00</begin>
          <end>2014-09-15T12:01:07-05:00</end>
        </TimeSpan>
        <styleUrl>#place_College Academic Building</styleUrl>
        <Point>
          <coordinates>-71.12210915179602,42.36578780710847</coordinates>
        </Point>
      </Placemark>
      <Placemark id="1410801899000">
        <name><![CDATA[Broadway Marketplace]]></name>
        <atom:link href="http://foursquare.com/venue/4a661612f964a520ffc71fe3"/>
        <description><![CDATA[<p>9/15/14<br/> 12:24 PM to 12:31 PM<br/> 6 min</p> <p>Grocery Store<br/> <a href="http://foursquare.com/venue/4a661612f964a520ffc71fe3">More details (Foursquare)</a> </p>]]></description>
        <TimeSpan>
          <begin>2014-09-15T12:25:00-05:00</begin>
          <end>2014-09-15T12:31:19-05:00</end>
        </TimeSpan>
        <styleUrl>#place_Grocery Store</styleUrl>
        <Point>
          <coordinates>-71.11300484548056,42.37405171427381</coordinates>
        </Point>
      </Placemark>
      <Placemark id="1410802561000">
        <name><![CDATA[Home]]></name>
        <description><![CDATA[<p>9/15/14<br/> 12:36 PM to 2:30 PM<br/> 1:54 hours</p>]]></description>
        <TimeSpan>
          <begin>2014-09-15T12:36:02-05:00</begin>
          <end>2014-09-15T14:30:02-05:00</end>
        </TimeSpan>
        <styleUrl>#place_home</styleUrl>
        <Point>
          <coordinates>-71.1114458017,42.3754311174</coordinates>
        </Point>
      </Placemark>
      <Placemark id="1410810841000">
        <name><![CDATA[Aldrich Hall]]></name>
        <atom:link href="http://foursquare.com/venue/4ac64359f964a5206eb320e3"/>
        <description><![CDATA[<p>9/15/14<br/> 2:54 PM to 3:32 PM<br/> 38 min</p> <p>College Academic Building<br/> <a href="http://foursquare.com/venue/4ac64359f964a5206eb320e3">More details (Foursquare)</a> </p>]]></description>
        <TimeSpan>
          <begin>2014-09-15T14:54:02-05:00</begin>
          <end>2014-09-15T15:32:15-05:00</end>
        </TimeSpan>
        <styleUrl>#place_College Academic Building</styleUrl>
        <Point>
          <coordinates>-71.12210915179602,42.36578780710847</coordinates>
        </Point>
      </Placemark>
      <Placemark id="1410813418000">
        <name><![CDATA[Harvard Innovation Lab]]></name>
        <atom:link href="http://foursquare.com/venue/4e5d4676ae60839ea2e29e64"/>
        <description><![CDATA[<p>9/15/14<br/> 3:36 PM to 5:00 PM<br/> 1:23 hours</p> <p>College Technology Building<br/> <a href="http://foursquare.com/venue/4e5d4676ae60839ea2e29e64">More details (Foursquare)</a> </p>]]></description>
        <TimeSpan>
          <begin>2014-09-15T15:36:59-05:00</begin>
          <end>2014-09-15T17:00:28-05:00</end>
        </TimeSpan>
        <styleUrl>#place_College Technology Building</styleUrl>
        <Point>
          <coordinates>-71.12402979165076,42.36427488545988</coordinates>
        </Point>
      </Placemark>
      <Placemark id="1410820890000">
        <name><![CDATA[Home]]></name>
        <description><![CDATA[<p>9/15/14<br/> 5:41 PM to 8:12 PM<br/> 2:30 hours</p>]]></description>
        <TimeSpan>
          <begin>2014-09-15T17:41:31-05:00</begin>
          <end>2014-09-15T20:12:03-05:00</end>
        </TimeSpan>
        <styleUrl>#place_home</styleUrl>
        <Point>
          <coordinates>-71.1114458017,42.3754311174</coordinates>
        </Point>
      </Placemark>
      <Placemark id="1410830398000">
        <name><![CDATA[The Kirkland Tap & Trotter]]></name>
        <atom:link href="http://foursquare.com/venue/52268df493cd24f393bf6d33"/>
        <description><![CDATA[<p>9/15/14<br/> 8:19 PM to 9:45 PM<br/> 1:25 hours</p> <p>Gastropub<br/> <a href="http://foursquare.com/venue/52268df493cd24f393bf6d33">More details (Foursquare)</a> </p>]]></description>
        <TimeSpan>
          <begin>2014-09-15T20:19:59-05:00</begin>
          <end>2014-09-15T21:45:09-05:00</end>
        </TimeSpan>
        <styleUrl>#place_Gastropub</styleUrl>
        <Point>
          <coordinates>-71.10686302185059,42.37823398029997</coordinates>
        </Point>
      </Placemark>
      <Placemark id="1410836119000">
        <name><![CDATA[Home]]></name>
        <description><![CDATA[<p>9/15/14<br/> 9:55 PM to 12:00 AM<br/> 2:04 hours</p>]]></description>
        <TimeSpan>
          <begin>2014-09-15T21:55:20-05:00</begin>
          <end>2014-09-15T23:59:59-05:00</end>
        </TimeSpan>
        <styleUrl>#place_home</styleUrl>
        <Point>
          <coordinates>-71.1114458017,42.3754311174</coordinates>
        </Point>
      </Placemark>
    </Folder>
    <Folder>
      <name><![CDATA[9/16/14]]></name>
      <Placemark id="1410843600000">
        <name><![CDATA[Home]]></name>
        <description><![CDATA[<p>9/16/14<br/> 12:00 AM to 5:48 AM<br/> 5:48 hours</p>]]></description>
        <TimeSpan>
          <begin>2014-09-16T00:00:01-05:00</begin>
          <end>2014-09-16T05:48:18-05:00</end>
        </TimeSpan>
        <styleUrl>#place_home</styleUrl>
        <Point>
          <coordinates>-71.1114458017,42.3754311174</coordinates>
        </Point>
      </Placemark>
      <Placemark id="1410865195000">
        <name><![CDATA[Starbucks]]></name>
        <atom:link href="http://foursquare.com/venue/49bc4e56f964a52028541fe3"/>
        <description><![CDATA[<p>9/16/14<br/> 5:59 AM to 6:04 AM<br/> 4 min</p> <p>Café<br/> <a href="http://foursquare.com/venue/49bc4e56f964a52028541fe3">More details (Foursquare)</a> </p>]]></description>
        <TimeSpan>
          <begin>2014-09-16T05:59:56-05:00</begin>
          <end>2014-09-16T06:04:18-05:00</end>
        </TimeSpan>
        <styleUrl>#place_Café</styleUrl>
        <Point>
          <coordinates>-71.119452,42.372485</coordinates>
        </Point>
      </Placemark>
      <Placemark id="1410866577000">
        <name><![CDATA[Harvard Innovation Lab]]></name>
        <atom:link href="http://foursquare.com/venue/4e5d4676ae60839ea2e29e64"/>
        <description><![CDATA[<p>9/16/14<br/> 6:22 AM to 7:52 AM<br/> 1:29 hours</p> <p>College Technology Building<br/> <a href="http://foursquare.com/venue/4e5d4676ae60839ea2e29e64">More details (Foursquare)</a> </p>]]></description>
        <TimeSpan>
          <begin>2014-09-16T06:22:58-05:00</begin>
          <end>2014-09-16T07:52:31-05:00</end>
        </TimeSpan>
        <styleUrl>#place_College Technology Building</styleUrl>
        <Point>
          <coordinates>-71.12402979165076,42.36427488545988</coordinates>
        </Point>
      </Placemark>
      <Placemark id="1410872411000">
        <name><![CDATA[Aldrich Hall]]></name>
        <atom:link href="http://foursquare.com/venue/4ac64359f964a5206eb320e3"/>
        <description><![CDATA[<p>9/16/14<br/> 8:00 AM to 11:15 AM<br/> 3:15 hours</p> <p>College Academic Building<br/> <a href="http://foursquare.com/venue/4ac64359f964a5206eb320e3">More details (Foursquare)</a> </p>]]></description>
        <TimeSpan>
          <begin>2014-09-16T08:00:12-05:00</begin>
          <end>2014-09-16T11:15:38-05:00</end>
        </TimeSpan>
        <styleUrl>#place_College Academic Building</styleUrl>
        <Point>
          <coordinates>-71.12210915179602,42.36578780710847</coordinates>
        </Point>
      </Placemark>
      <Placemark id="1410884501000">
        <name><![CDATA[Morgan Hall]]></name>
        <atom:link href="http://foursquare.com/venue/4adf6b74f964a520697a21e3"/>
        <description><![CDATA[<p>9/16/14<br/> 11:21 AM to 11:46 AM<br/> 24 min</p> <p>College Administrative Building<br/> <a href="http://foursquare.com/venue/4adf6b74f964a520697a21e3">More details (Foursquare)</a> </p>]]></description>
        <TimeSpan>
          <begin>2014-09-16T11:21:42-05:00</begin>
          <end>2014-09-16T11:45:59-05:00</end>
        </TimeSpan>
        <styleUrl>#place_College Administrative Building</styleUrl>
        <Point>
          <coordinates>-71.1239079386408,42.36670606297722</coordinates>
        </Point>
      </Placemark>
      <Placemark id="1410886803000">
        <name><![CDATA[Aldrich Hall]]></name>
        <atom:link href="http://foursquare.com/venue/4ac64359f964a5206eb320e3"/>
        <description><![CDATA[<p>9/16/14<br/> 12:00 PM to 3:08 PM<br/> 3:08 hours</p> <p>College Academic Building<br/> <a href="http://foursquare.com/venue/4ac64359f964a5206eb320e3">More details (Foursquare)</a> </p>]]></description>
        <TimeSpan>
          <begin>2014-09-16T12:00:04-05:00</begin>
          <end>2014-09-16T15:08:14-05:00</end>
        </TimeSpan>
        <styleUrl>#place_College Academic Building</styleUrl>
        <Point>
          <coordinates>-71.12210915179602,42.36578780710847</coordinates>
        </Point>
      </Placemark>
      <Placemark id="1410899479000">
        <name><![CDATA[Broadway Marketplace]]></name>
        <atom:link href="http://foursquare.com/venue/4a661612f964a520ffc71fe3"/>
        <description><![CDATA[<p>9/16/14<br/> 3:31 PM to 3:41 PM<br/> 10 min</p> <p>Grocery Store<br/> <a href="http://foursquare.com/venue/4a661612f964a520ffc71fe3">More details (Foursquare)</a> </p>]]></description>
        <TimeSpan>
          <begin>2014-09-16T15:31:20-05:00</begin>
          <end>2014-09-16T15:41:34-05:00</end>
        </TimeSpan>
        <styleUrl>#place_Grocery Store</styleUrl>
        <Point>
          <coordinates>-71.11300484548056,42.37405171427381</coordinates>
        </Point>
      </Placemark>
      <Placemark id="1410900421000">
        <name><![CDATA[Home]]></name>
        <description><![CDATA[<p>9/16/14<br/> 3:47 PM to 6:51 PM<br/> 3:04 hours</p>]]></description>
        <TimeSpan>
          <begin>2014-09-16T15:47:02-05:00</begin>
          <end>2014-09-16T18:51:05-05:00</end>
        </TimeSpan>
        <styleUrl>#place_home</styleUrl>
        <Point>
          <coordinates>-71.1114458017,42.3754311174</coordinates>
        </Point>
      </Placemark>
      <Placemark id="1410913054000">
        <name><![CDATA[Park]]></name>
        <atom:link href="http://foursquare.com/venue/4f7c8902e4b032c26c6798db"/>
        <description><![CDATA[<p>9/16/14<br/> 7:17 PM to 8:57 PM<br/> 1:39 hours</p> <p>Gastropub<br/> <a href="http://foursquare.com/venue/4f7c8902e4b032c26c6798db">More details (Foursquare)</a> </p>]]></description>
        <TimeSpan>
          <begin>2014-09-16T19:17:35-05:00</begin>
          <end>2014-09-16T20:57:22-05:00</end>
        </TimeSpan>
        <styleUrl>#place_Gastropub</styleUrl>
        <Point>
          <coordinates>-71.12097185013617,42.37169409933257</coordinates>
        </Point>
      </Placemark>
      <Placemark id="1410920253000">
        <name><![CDATA[Home]]></name>
        <description><![CDATA[<p>9/16/14<br/> 9:17 PM to 12:00 AM<br/> 2:42 hours</p>]]></description>
        <TimeSpan>
          <begin>2014-09-16T21:17:34-05:00</begin>
          <end>2014-09-16T23:59:59-05:00</end>
        </TimeSpan>
        <styleUrl>#place_home</styleUrl>
        <Point>
          <coordinates>-71.1114458017,42.3754311174</coordinates>
        </Point>
      </Placemark>
    </Folder>
    <Folder>
      <name><![CDATA[9/17/14]]></name>
      <Placemark id="1410930000000">
        <name><![CDATA[Home]]></name>
        <description><![CDATA[<p>9/17/14<br/> 12:00 AM to 5:54 AM<br/> 5:54 hours</p>]]></description>
        <TimeSpan>
          <begin>2014-09-17T00:00:01-05:00</begin>
          <end>2014-09-17T05:54:39-05:00</end>
        </TimeSpan>
        <styleUrl>#place_home</styleUrl>
        <Point>
          <coordinates>-71.1114458017,42.3754311174</coordinates>
        </Point>
      </Placemark>
      <Placemark id="1410952889000">
        <name><![CDATA[Harvard Innovation Lab]]></name>
        <atom:link href="http://foursquare.com/venue/4e5d4676ae60839ea2e29e64"/>
        <description><![CDATA[<p>9/17/14<br/> 6:21 AM to 7:53 AM<br/> 1:32 hours</p> <p>College Technology Building<br/> <a href="http://foursquare.com/venue/4e5d4676ae60839ea2e29e64">More details (Foursquare)</a> </p>]]></description>
        <TimeSpan>
          <begin>2014-09-17T06:21:30-05:00</begin>
          <end>2014-09-17T07:53:28-05:00</end>
        </TimeSpan>
        <styleUrl>#place_College Technology Building</styleUrl>
        <Point>
          <coordinates>-71.12407621183526,42.36403242532342</coordinates>
        </Point>
      </Placemark>
      <Placemark id="1410958858000">
        <name><![CDATA[Aldrich Hall]]></name>
        <atom:link href="http://foursquare.com/venue/4ac64359f964a5206eb320e3"/>
        <description><![CDATA[<p>9/17/14<br/> 8:00 AM to 1:50 PM<br/> 5:49 hours</p> <p>College Academic Building<br/> <a href="http://foursquare.com/venue/4ac64359f964a5206eb320e3">More details (Foursquare)</a> </p>]]></description>
        <TimeSpan>
          <begin>2014-09-17T08:00:59-05:00</begin>
          <end>2014-09-17T13:50:02-05:00</end>
        </TimeSpan>
        <styleUrl>#place_College Academic Building</styleUrl>
        <Point>
          <coordinates>-71.12210915179602,42.36578780710847</coordinates>
        </Point>
      </Placemark>
      <Placemark id="1410985089000">
        <name><![CDATA[Home]]></name>
        <description><![CDATA[<p>9/17/14<br/> 3:18 PM to 5:59 PM<br/> 2:41 hours</p>]]></description>
        <TimeSpan>
          <begin>2014-09-17T15:18:10-05:00</begin>
          <end>2014-09-17T17:59:29-05:00</end>
        </TimeSpan>
        <styleUrl>#place_home</styleUrl>
        <Point>
          <coordinates>-71.1114458017,42.3754311174</coordinates>
        </Point>
      </Placemark>
      <Placemark id="1410995406000">
        <name><![CDATA[Border Cafe]]></name>
        <atom:link href="http://foursquare.com/venue/3fd66200f964a520bded1ee3"/>
        <description><![CDATA[<p>9/17/14<br/> 6:10 PM to 7:06 PM<br/> 56 min</p> <p>Mexican Restaurant<br/> <a href="http://foursquare.com/venue/3fd66200f964a520bded1ee3">More details (Foursquare)</a> </p>]]></description>
        <TimeSpan>
          <begin>2014-09-17T18:10:07-05:00</begin>
          <end>2014-09-17T19:06:36-05:00</end>
        </TimeSpan>
        <styleUrl>#place_Mexican Restaurant</styleUrl>
        <Point>
          <coordinates>-71.120141,42.3743468</coordinates>
        </Point>
      </Placemark>
      <Placemark id="1410999767000">
        <name><![CDATA[Home]]></name>
        <description><![CDATA[<p>9/17/14<br/> 7:22 PM to 12:00 AM<br/> 4:37 hours</p>]]></description>
        <TimeSpan>
          <begin>2014-09-17T19:22:48-05:00</begin>
          <end>2014-09-17T23:59:59-05:00</end>
        </TimeSpan>
        <styleUrl>#place_home</styleUrl>
        <Point>
          <coordinates>-71.1114458017,42.3754311174</coordinates>
        </Point>
      </Placemark>
    </Folder>
    <Folder>
      <name><![CDATA[9/18/14]]></name>
      <Placemark id="1411016400000">
        <name><![CDATA[Home]]></name>
        <description><![CDATA[<p>9/18/14<br/> 12:00 AM to 6:26 AM<br/> 6:26 hours</p>]]></description>
        <TimeSpan>
          <begin>2014-09-18T00:00:01-05:00</begin>
          <end>2014-09-18T06:26:14-05:00</end>
        </TimeSpan>
        <styleUrl>#place_home</styleUrl>
        <Point>
          <coordinates>-71.1114458017,42.3754311174</coordinates>
        </Point>
      </Placemark>
      <Placemark id="1411041154000">
        <name><![CDATA[Harvard Innovation Lab]]></name>
        <atom:link href="http://foursquare.com/venue/4e5d4676ae60839ea2e29e64"/>
        <description><![CDATA[<p>9/18/14<br/> 6:52 AM to 7:53 AM<br/> 1:00 hours</p> <p>College Technology Building<br/> <a href="http://foursquare.com/venue/4e5d4676ae60839ea2e29e64">More details (Foursquare)</a> </p>]]></description>
        <TimeSpan>
          <begin>2014-09-18T06:52:35-05:00</begin>
          <end>2014-09-18T07:53:31-05:00</end>
        </TimeSpan>
        <styleUrl>#place_College Technology Building</styleUrl>
        <Point>
          <coordinates>-71.12402979165076,42.36427488545988</coordinates>
        </Point>
      </Placemark>
      <Placemark id="1411045216000">
        <name><![CDATA[Aldrich Hall]]></name>
        <atom:link href="http://foursquare.com/venue/4ac64359f964a5206eb320e3"/>
        <description><![CDATA[<p>9/18/14<br/> 8:00 AM to 2:08 PM<br/> 6:07 hours</p> <p>College Academic Building<br/> <a href="http://foursquare.com/venue/4ac64359f964a5206eb320e3">More details (Foursquare)</a> </p>]]></description>
        <TimeSpan>
          <begin>2014-09-18T08:00:17-05:00</begin>
          <end>2014-09-18T14:08:06-05:00</end>
        </TimeSpan>
        <styleUrl>#place_College Academic Building</styleUrl>
        <Point>
          <coordinates>-71.12210915179602,42.36578780710847</coordinates>
        </Point>
      </Placemark>
      <Placemark id="1411068088000">
        <name><![CDATA[RadioShack]]></name>
        <atom:link href="http://foursquare.com/venue/4af22b6bf964a5204fe621e3"/>
        <description><![CDATA[<p>9/18/14<br/> 2:21 PM to 2:28 PM<br/> 7 min</p> <p>Electronics Store<br/> <a href="http://foursquare.com/venue/4af22b6bf964a5204fe621e3">More details (Foursquare)</a> </p>]]></description>
        <TimeSpan>
          <begin>2014-09-18T14:21:29-05:00</begin>
          <end>2014-09-18T14:28:55-05:00</end>
        </TimeSpan>
        <styleUrl>#place_Electronics Store</styleUrl>
        <Point>
          <coordinates>-71.11988313496113,42.37280711531639</coordinates>
        </Point>
      </Placemark>
      <Placemark id="1411072073000">
        <name><![CDATA[Place in Logan International Airport]]></name>
        <description><![CDATA[<p>9/18/14<br/> 3:27 PM to 4:11 PM<br/> 43 min</p>]]></description>
        <TimeSpan>
          <begin>2014-09-18T15:27:54-05:00</begin>
          <end>2014-09-18T16:11:22-05:00</end>
        </TimeSpan>
        <styleUrl>#place_unknown</styleUrl>
        <Point>
          <coordinates>-71.0153481493,42.3663871252</coordinates>
        </Point>
      </Placemark>
      <Placemark id="1411082492000">
        <name><![CDATA[Place in Buckingham]]></name>
        <description><![CDATA[<p>9/18/14<br/> 6:21 PM to 6:30 PM<br/> 9 min</p>]]></description>
        <TimeSpan>
          <begin>2014-09-18T18:21:33-05:00</begin>
          <end>2014-09-18T18:30:51-05:00</end>
        </TimeSpan>
        <styleUrl>#place_unknown</styleUrl>
        <Point>
          <coordinates>-77.1080911337,38.8760558318</coordinates>
        </Point>
      </Placemark>
      <Placemark id="1411084321000">
        <name><![CDATA[NTN24-Washington, DC]]></name>
        <atom:link href="http://foursquare.com/venue/4ec5b5509a52756c53a0be9c"/>
        <description><![CDATA[<p>9/18/14<br/> 6:52 PM to 7:47 PM<br/> 55 min</p> <p>Office<br/> <a href="http://foursquare.com/venue/4ec5b5509a52756c53a0be9c">More details (Foursquare)</a> </p>]]></description>
        <TimeSpan>
          <begin>2014-09-18T18:52:02-05:00</begin>
          <end>2014-09-18T19:47:56-05:00</end>
        </TimeSpan>
        <styleUrl>#place_Office</styleUrl>
        <Point>
          <coordinates>-77.03193625222163,38.900182458396</coordinates>
        </Point>
      </Placemark>
      <Placemark id="1411094950000">
        <name><![CDATA[Laura's Home]]></name>
        <description><![CDATA[<p>9/18/14<br/> 9:49 PM to 12:00 AM<br/> 2:10 hours</p>]]></description>
        <TimeSpan>
          <begin>2014-09-18T21:49:11-05:00</begin>
          <end>2014-09-18T23:59:59-05:00</end>
        </TimeSpan>
        <styleUrl>#place_home</styleUrl>
        <Point>
          <coordinates>-77.0772744833,38.9219057145</coordinates>
        </Point>
      </Placemark>
    </Folder>
    <Folder>
      <name><![CDATA[9/19/14]]></name>
      <Placemark id="1411102800000">
        <name><![CDATA[Laura's Home]]></name>
        <description><![CDATA[<p>9/19/14<br/> 12:00 AM to 8:53 AM<br/> 8:53 hours</p>]]></description>
        <TimeSpan>
          <begin>2014-09-19T00:00:01-05:00</begin>
          <end>2014-09-19T08:53:28-05:00</end>
        </TimeSpan>
        <styleUrl>#place_home</styleUrl>
        <Point>
          <coordinates>-77.0772744833,38.9219057145</coordinates>
        </Point>
      </Placemark>
      <Placemark id="1411135418000">
        <name><![CDATA[Starbucks]]></name>
        <atom:link href="http://foursquare.com/venue/4ae84ab0f964a52085ae21e3"/>
        <description><![CDATA[<p>9/19/14<br/> 9:03 AM to 11:17 AM<br/> 2:13 hours</p> <p>Coffee Shop<br/> <a href="http://foursquare.com/venue/4ae84ab0f964a52085ae21e3">More details (Foursquare)</a> </p>]]></description>
        <TimeSpan>
          <begin>2014-09-19T09:03:39-05:00</begin>
          <end>2014-09-19T11:17:14-05:00</end>
        </TimeSpan>
        <styleUrl>#place_Coffee Shop</styleUrl>
        <Point>
          <coordinates>-77.07147493555041,38.92009508267315</coordinates>
        </Point>
      </Placemark>
      <Placemark id="1411144028000">
        <name><![CDATA[Laura's Home]]></name>
        <description><![CDATA[<p>9/19/14<br/> 11:27 AM to 11:56 AM<br/> 28 min</p>]]></description>
        <TimeSpan>
          <begin>2014-09-19T11:27:09-05:00</begin>
          <end>2014-09-19T11:56:00-05:00</end>
        </TimeSpan>
        <styleUrl>#place_home</styleUrl>
        <Point>
          <coordinates>-77.0772744833,38.9219057145</coordinates>
        </Point>
      </Placemark>
      <Placemark id="1411146195000">
        <name><![CDATA[Surfside]]></name>
        <atom:link href="http://foursquare.com/venue/4a02762ef964a52056711fe3"/>
        <description><![CDATA[<p>9/19/14<br/> 12:03 PM to 12:07 PM<br/> 4 min</p> <p>Mexican Restaurant<br/> <a href="http://foursquare.com/venue/4a02762ef964a52056711fe3">More details (Foursquare)</a> </p>]]></description>
        <TimeSpan>
          <begin>2014-09-19T12:03:16-05:00</begin>
          <end>2014-09-19T12:07:28-05:00</end>
        </TimeSpan>
        <styleUrl>#place_Mexican Restaurant</styleUrl>
        <Point>
          <coordinates>-77.072873711586,38.92206976004444</coordinates>
        </Point>
      </Placemark>
      <Placemark id="1411146867000">
        <name><![CDATA[Laura's Home]]></name>
        <description><![CDATA[<p>9/19/14<br/> 12:14 PM to 12:00 AM<br/> 11:45 hours</p>]]></description>
        <TimeSpan>
          <begin>2014-09-19T12:14:28-05:00</begin>
          <end>2014-09-19T23:59:59-05:00</end>
        </TimeSpan>
        <styleUrl>#place_home</styleUrl>
        <Point>
          <coordinates>-77.0772744833,38.9219057145</coordinates>
        </Point>
      </Placemark>
    </Folder>
    <Folder>
      <name><![CDATA[9/20/14]]></name>
      <Placemark id="1411189200000">
        <name><![CDATA[Laura's Home]]></name>
        <description><![CDATA[<p>9/20/14<br/> 12:00 AM to 2:11 PM<br/> 14:11 hours</p>]]></description>
        <TimeSpan>
          <begin>2014-09-20T00:00:01-05:00</begin>
          <end>2014-09-20T14:11:28-05:00</end>
        </TimeSpan>
        <styleUrl>#place_home</styleUrl>
        <Point>
          <coordinates>-77.0772744833,38.9219057145</coordinates>
        </Point>
      </Placemark>
      <Placemark id="1411240985000">
        <name><![CDATA[CVS/pharmacy]]></name>
        <atom:link href="http://foursquare.com/venue/4a89f3c7f964a520790920e3"/>
        <description><![CDATA[<p>9/20/14<br/> 2:23 PM to 2:30 PM<br/> 7 min</p> <p>Drugstore / Pharmacy<br/> <a href="http://foursquare.com/venue/4a89f3c7f964a520790920e3">More details (Foursquare)</a> </p>]]></description>
        <TimeSpan>
          <begin>2014-09-20T14:23:06-05:00</begin>
          <end>2014-09-20T14:30:27-05:00</end>
        </TimeSpan>
        <styleUrl>#place_Drugstore / Pharmacy</styleUrl>
        <Point>
          <coordinates>-77.071487,38.92005</coordinates>
        </Point>
      </Placemark>
