<?xml version="1.0" encoding="UTF-8"?><kml xmlns="http://www.opengis.net/kml/2.2" xmlns:gx="http://www.google.com/kml/ext/2.2" xmlns:atom="http://www.w3.org/2005/Atom" xmlns:xal="urn:oasis:names:tc:ciq:xsdschema:xAL:2.0" xmlns:xsi="http://www.w3.org/2001/XMLSchema-instance">
  <Document>
    <atom:link href="http://www.moves-app.com"/>
    <description><![CDATA[<p align="center"><a href="http://www.moves-app.com"> <img src="http://www.moves-app.com/assets/moves.png"/> </a></p> <p align="center">Moves Storyline</p>]]></description>
    <Style id="place_Home (private)">
      <IconStyle>
        <scale>1.0</scale>
        <heading>0.0</heading>
        <Icon>
          <href>https://ss1.4sqi.net/img/categories/building/home.png</href>
          <refreshInterval>0.0</refreshInterval>
          <viewRefreshTime>0.0</viewRefreshTime>
          <viewBoundScale>0.0</viewBoundScale>
        </Icon>
      </IconStyle>
    </Style>
    <Style id="place_Furniture / Home Store">
      <IconStyle>
        <scale>1.0</scale>
        <heading>0.0</heading>
        <Icon>
          <href>https://ss1.4sqi.net/img/categories/shops/furniture.png</href>
          <refreshInterval>0.0</refreshInterval>
          <viewRefreshTime>0.0</viewRefreshTime>
          <viewBoundScale>0.0</viewBoundScale>
        </Icon>
      </IconStyle>
    </Style>
    <Style id="place_Mexican Restaurant">
      <IconStyle>
        <scale>1.0</scale>
        <heading>0.0</heading>
        <Icon>
          <href>https://ss1.4sqi.net/img/categories/food/mexican.png</href>
          <refreshInterval>0.0</refreshInterval>
          <viewRefreshTime>0.0</viewRefreshTime>
          <viewBoundScale>0.0</viewBoundScale>
        </Icon>
      </IconStyle>
    </Style>
    <Style id="place_College Residence Hall">
      <IconStyle>
        <scale>1.0</scale>
        <heading>0.0</heading>
        <Icon>
          <href>https://ss1.4sqi.net/img/categories/education/default.png</href>
          <refreshInterval>0.0</refreshInterval>
          <viewRefreshTime>0.0</viewRefreshTime>
          <viewBoundScale>0.0</viewBoundScale>
        </Icon>
      </IconStyle>
    </Style>
    <Style id="place_school">
      <IconStyle>
        <scale>1.0</scale>
        <heading>0.0</heading>
        <Icon>
          <href>http://ss1.4sqi.net/img/categories/building/school.png</href>
          <refreshInterval>0.0</refreshInterval>
          <viewRefreshTime>0.0</viewRefreshTime>
          <viewBoundScale>0.0</viewBoundScale>
        </Icon>
      </IconStyle>
    </Style>
    <Style id="place_Arepa Restaurant">
      <IconStyle>
        <scale>1.0</scale>
        <heading>0.0</heading>
        <Icon>
          <href>https://ss1.4sqi.net/img/categories/food/default.png</href>
          <refreshInterval>0.0</refreshInterval>
          <viewRefreshTime>0.0</viewRefreshTime>
          <viewBoundScale>0.0</viewBoundScale>
        </Icon>
      </IconStyle>
    </Style>
    <Style id="place_Electronics Store">
      <IconStyle>
        <scale>1.0</scale>
        <heading>0.0</heading>
        <Icon>
          <href>https://ss1.4sqi.net/img/categories/shops/technology.png</href>
          <refreshInterval>0.0</refreshInterval>
          <viewRefreshTime>0.0</viewRefreshTime>
          <viewBoundScale>0.0</viewBoundScale>
        </Icon>
      </IconStyle>
    </Style>
    <Style id="place_College Technology Building">
      <IconStyle>
        <scale>1.0</scale>
        <heading>0.0</heading>
        <Icon>
          <href>https://ss1.4sqi.net/img/categories/education/default.png</href>
          <refreshInterval>0.0</refreshInterval>
          <viewRefreshTime>0.0</viewRefreshTime>
          <viewBoundScale>0.0</viewBoundScale>
        </Icon>
      </IconStyle>
    </Style>
    <Style id="place_Plaza">
      <IconStyle>
        <scale>1.0</scale>
        <heading>0.0</heading>
        <Icon>
          <href>https://ss1.4sqi.net/img/categories/parks_outdoors/default.png</href>
          <refreshInterval>0.0</refreshInterval>
          <viewRefreshTime>0.0</viewRefreshTime>
          <viewBoundScale>0.0</viewBoundScale>
        </Icon>
      </IconStyle>
    </Style>
    <Style id="place_Coffee Shop">
      <IconStyle>
        <scale>1.0</scale>
        <heading>0.0</heading>
        <Icon>
          <href>https://ss1.4sqi.net/img/categories/food/coffeeshop.png</href>
          <refreshInterval>0.0</refreshInterval>
          <viewRefreshTime>0.0</viewRefreshTime>
          <viewBoundScale>0.0</viewBoundScale>
        </Icon>
      </IconStyle>
    </Style>
    <Style id="place_Train Station">
      <IconStyle>
        <scale>1.0</scale>
        <heading>0.0</heading>
        <Icon>
          <href>https://ss1.4sqi.net/img/categories/travel/trainstation.png</href>
          <refreshInterval>0.0</refreshInterval>
          <viewRefreshTime>0.0</viewRefreshTime>
          <viewBoundScale>0.0</viewBoundScale>
        </Icon>
      </IconStyle>
    </Style>
    <Style id="place_American Restaurant">
      <IconStyle>
        <scale>1.0</scale>
        <heading>0.0</heading>
        <Icon>
          <href>https://ss1.4sqi.net/img/categories/food/default.png</href>
          <refreshInterval>0.0</refreshInterval>
          <viewRefreshTime>0.0</viewRefreshTime>
          <viewBoundScale>0.0</viewBoundScale>
        </Icon>
      </IconStyle>
    </Style>
    <Style id="place_work">
      <IconStyle>
        <scale>1.0</scale>
        <heading>0.0</heading>
        <Icon>
          <href>http://ss1.4sqi.net/img/categories/building/default.png</href>
          <refreshInterval>0.0</refreshInterval>
          <viewRefreshTime>0.0</viewRefreshTime>
          <viewBoundScale>0.0</viewBoundScale>
        </Icon>
      </IconStyle>
    </Style>
    <Style id="place_user">
      <IconStyle>
        <scale>1.0</scale>
        <heading>0.0</heading>
        <Icon>
          <href>http://maps.google.com/mapfiles/marker_white.png</href>
          <refreshInterval>0.0</refreshInterval>
          <viewRefreshTime>0.0</viewRefreshTime>
          <viewBoundScale>0.0</viewBoundScale>
        </Icon>
      </IconStyle>
    </Style>
    <Style id="place_College Cafeteria">
      <IconStyle>
        <scale>1.0</scale>
        <heading>0.0</heading>
        <Icon>
          <href>https://ss1.4sqi.net/img/categories/education/cafeteria.png</href>
          <refreshInterval>0.0</refreshInterval>
          <viewRefreshTime>0.0</viewRefreshTime>
          <viewBoundScale>0.0</viewBoundScale>
        </Icon>
      </IconStyle>
    </Style>
    <Style id="place_Seafood Restaurant">
      <IconStyle>
        <scale>1.0</scale>
        <heading>0.0</heading>
        <Icon>
          <href>https://ss1.4sqi.net/img/categories/food/seafood.png</href>
          <refreshInterval>0.0</refreshInterval>
          <viewRefreshTime>0.0</viewRefreshTime>
          <viewBoundScale>0.0</viewBoundScale>
        </Icon>
      </IconStyle>
    </Style>
    <Style id="place_Gastropub">
      <IconStyle>
        <scale>1.0</scale>
        <heading>0.0</heading>
        <Icon>
          <href>https://ss1.4sqi.net/img/categories/food/default.png</href>
          <refreshInterval>0.0</refreshInterval>
          <viewRefreshTime>0.0</viewRefreshTime>
          <viewBoundScale>0.0</viewBoundScale>
        </Icon>
      </IconStyle>
    </Style>
    <Style id="place_Platform">
      <IconStyle>
        <scale>1.0</scale>
        <heading>0.0</heading>
        <Icon>
          <href>https://ss1.4sqi.net/img/categories/travel/trainstation.png</href>
          <refreshInterval>0.0</refreshInterval>
          <viewRefreshTime>0.0</viewRefreshTime>
          <viewBoundScale>0.0</viewBoundScale>
        </Icon>
      </IconStyle>
    </Style>
    <Style id="place_Salon / Barbershop">
      <IconStyle>
        <scale>1.0</scale>
        <heading>0.0</heading>
        <Icon>
          <href>https://ss1.4sqi.net/img/categories/shops/salon_barber.png</href>
          <refreshInterval>0.0</refreshInterval>
          <viewRefreshTime>0.0</viewRefreshTime>
          <viewBoundScale>0.0</viewBoundScale>
        </Icon>
      </IconStyle>
    </Style>
    <Style id="place_foursquare">
      <IconStyle>
        <scale>1.0</scale>
        <heading>0.0</heading>
        <Icon>
          <href>http://maps.google.com/mapfiles/marker_white.png</href>
          <refreshInterval>0.0</refreshInterval>
          <viewRefreshTime>0.0</viewRefreshTime>
          <viewBoundScale>0.0</viewBoundScale>
        </Icon>
      </IconStyle>
    </Style>
    <Style id="place_Tech Startup">
      <IconStyle>
        <scale>1.0</scale>
        <heading>0.0</heading>
        <Icon>
          <href>https://ss1.4sqi.net/img/categories/shops/technology.png</href>
          <refreshInterval>0.0</refreshInterval>
          <viewRefreshTime>0.0</viewRefreshTime>
          <viewBoundScale>0.0</viewBoundScale>
        </Icon>
      </IconStyle>
    </Style>
    <Style id="place_Grocery Store">
      <IconStyle>
        <scale>1.0</scale>
        <heading>0.0</heading>
        <Icon>
          <href>https://ss1.4sqi.net/img/categories/shops/food_grocery.png</href>
          <refreshInterval>0.0</refreshInterval>
          <viewRefreshTime>0.0</viewRefreshTime>
          <viewBoundScale>0.0</viewBoundScale>
        </Icon>
      </IconStyle>
    </Style>
    <Style id="place_Hardware Store">
      <IconStyle>
        <scale>1.0</scale>
        <heading>0.0</heading>
        <Icon>
          <href>https://ss1.4sqi.net/img/categories/shops/hardware.png</href>
          <refreshInterval>0.0</refreshInterval>
          <viewRefreshTime>0.0</viewRefreshTime>
          <viewBoundScale>0.0</viewBoundScale>
        </Icon>
      </IconStyle>
    </Style>
    <Style id="place_Café">
      <IconStyle>
        <scale>1.0</scale>
        <heading>0.0</heading>
        <Icon>
          <href>https://ss1.4sqi.net/img/categories/food/cafe.png</href>
          <refreshInterval>0.0</refreshInterval>
          <viewRefreshTime>0.0</viewRefreshTime>
          <viewBoundScale>0.0</viewBoundScale>
        </Icon>
      </IconStyle>
    </Style>
    <Style id="place_Department Store">
      <IconStyle>
        <scale>1.0</scale>
        <heading>0.0</heading>
        <Icon>
          <href>https://ss1.4sqi.net/img/categories/shops/default.png</href>
          <refreshInterval>0.0</refreshInterval>
          <viewRefreshTime>0.0</viewRefreshTime>
          <viewBoundScale>0.0</viewBoundScale>
        </Icon>
      </IconStyle>
    </Style>
    <Style id="place_unknown">
      <IconStyle>
        <scale>1.0</scale>
        <heading>0.0</heading>
        <Icon>
          <href>http://maps.google.com/mapfiles/marker_white.png</href>
          <refreshInterval>0.0</refreshInterval>
          <viewRefreshTime>0.0</viewRefreshTime>
          <viewBoundScale>0.0</viewBoundScale>
        </Icon>
      </IconStyle>
    </Style>
    <Style id="place_University">
      <IconStyle>
        <scale>1.0</scale>
        <heading>0.0</heading>
        <Icon>
          <href>https://ss1.4sqi.net/img/categories/education/default.png</href>
          <refreshInterval>0.0</refreshInterval>
          <viewRefreshTime>0.0</viewRefreshTime>
          <viewBoundScale>0.0</viewBoundScale>
        </Icon>
      </IconStyle>
    </Style>
    <Style id="place_Bar">
      <IconStyle>
        <scale>1.0</scale>
        <heading>0.0</heading>
        <Icon>
          <href>https://ss1.4sqi.net/img/categories/nightlife/bar.png</href>
          <refreshInterval>0.0</refreshInterval>
          <viewRefreshTime>0.0</viewRefreshTime>
          <viewBoundScale>0.0</viewBoundScale>
        </Icon>
      </IconStyle>
    </Style>
    <Style id="place_Tea Room">
      <IconStyle>
        <scale>1.0</scale>
        <heading>0.0</heading>
        <Icon>
          <href>https://ss1.4sqi.net/img/categories/food/tearoom.png</href>
          <refreshInterval>0.0</refreshInterval>
          <viewRefreshTime>0.0</viewRefreshTime>
          <viewBoundScale>0.0</viewBoundScale>
        </Icon>
      </IconStyle>
    </Style>
    <Style id="place_home">
      <IconStyle>
        <scale>1.0</scale>
        <heading>0.0</heading>
        <Icon>
          <href>http://ss1.4sqi.net/img/categories/building/home.png</href>
          <refreshInterval>0.0</refreshInterval>
          <viewRefreshTime>0.0</viewRefreshTime>
          <viewBoundScale>0.0</viewBoundScale>
        </Icon>
      </IconStyle>
    </Style>
    <Style id="place_Office">
      <IconStyle>
        <scale>1.0</scale>
        <heading>0.0</heading>
        <Icon>
          <href>https://ss1.4sqi.net/img/categories/building/default.png</href>
          <refreshInterval>0.0</refreshInterval>
          <viewRefreshTime>0.0</viewRefreshTime>
          <viewBoundScale>0.0</viewBoundScale>
        </Icon>
      </IconStyle>
    </Style>
    <Folder>
      <name><![CDATA[2/1/14]]></name>
      <Placemark id="1391234400000">
        <name><![CDATA[Home]]></name>
        <description><![CDATA[<p>2/1/14<br/> 12:00 AM to 11:47 AM<br/> 11:47 hours</p>]]></description>
        <TimeSpan>
          <begin>2014-02-01T00:00:01-06:00</begin>
          <end>2014-02-01T11:47:16-06:00</end>
        </TimeSpan>
        <styleUrl>#place_home</styleUrl>
        <Point>
          <coordinates>-71.1114458017,42.3754311174</coordinates>
        </Point>
      </Placemark>
      <Placemark id="1391277636000">
        <name><![CDATA[Proximate]]></name>
        <atom:link href="http://foursquare.com/venue/51c8c0d1498e5d4d09a48362"/>
        <description><![CDATA[<p>2/1/14<br/> 12:00 PM to 1:41 PM<br/> 1:40 hours</p> <p>Tech Startup<br/> <a href="http://foursquare.com/venue/51c8c0d1498e5d4d09a48362">More details (Foursquare)</a> </p>]]></description>
        <TimeSpan>
          <begin>2014-02-01T12:00:37-06:00</begin>
          <end>2014-02-01T13:41:14-06:00</end>
        </TimeSpan>
        <styleUrl>#place_Tech Startup</styleUrl>
        <Point>
          <coordinates>-71.117205,42.378716</coordinates>
        </Point>
      </Placemark>
      <Placemark id="1391284437000">
        <name><![CDATA[Dickson Bros. True Value]]></name>
        <atom:link href="http://foursquare.com/venue/4aad3cf3f964a5202f5f20e3"/>
        <description><![CDATA[<p>2/1/14<br/> 1:53 PM to 3:08 PM<br/> 1:14 hours</p> <p>Hardware Store<br/> <a href="http://foursquare.com/venue/4aad3cf3f964a5202f5f20e3">More details (Foursquare)</a> </p>]]></description>
        <TimeSpan>
          <begin>2014-02-01T13:53:58-06:00</begin>
          <end>2014-02-01T15:08:14-06:00</end>
        </TimeSpan>
        <styleUrl>#place_Hardware Store</styleUrl>
        <Point>
          <coordinates>-71.120418,42.373343</coordinates>
        </Point>
      </Placemark>
      <Placemark id="1391289922000">
        <name><![CDATA[Home]]></name>
        <description><![CDATA[<p>2/1/14<br/> 3:25 PM to 12:00 AM<br/> 8:34 hours</p>]]></description>
        <TimeSpan>
          <begin>2014-02-01T15:25:23-06:00</begin>
          <end>2014-02-01T23:59:59-06:00</end>
        </TimeSpan>
        <styleUrl>#place_home</styleUrl>
        <Point>
          <coordinates>-71.1114458017,42.3754311174</coordinates>
        </Point>
      </Placemark>
    </Folder>
    <Folder>
      <name><![CDATA[2/2/14]]></name>
      <Placemark id="1391320800000">
        <name><![CDATA[Home]]></name>
        <description><![CDATA[<p>2/2/14<br/> 12:00 AM to 1:09 PM<br/> 13:09 hours</p>]]></description>
        <TimeSpan>
          <begin>2014-02-02T00:00:01-06:00</begin>
          <end>2014-02-02T13:09:38-06:00</end>
        </TimeSpan>
        <styleUrl>#place_home</styleUrl>
        <Point>
          <coordinates>-71.1114458017,42.3754311174</coordinates>
        </Point>
      </Placemark>
      <Placemark id="1391369367000">
        <name><![CDATA[Floyd's 99 Barbershop]]></name>
        <atom:link href="http://foursquare.com/venue/4a9d711ff964a520443820e3"/>
        <description><![CDATA[<p>2/2/14<br/> 1:29 PM to 2:17 PM<br/> 47 min</p> <p>Salon / Barbershop<br/> <a href="http://foursquare.com/venue/4a9d711ff964a520443820e3">More details (Foursquare)</a> </p>]]></description>
        <TimeSpan>
          <begin>2014-02-02T13:29:28-06:00</begin>
          <end>2014-02-02T14:17:18-06:00</end>
        </TimeSpan>
        <styleUrl>#place_Salon / Barbershop</styleUrl>
        <Point>
          <coordinates>-71.11979826,42.38213717937469</coordinates>
        </Point>
      </Placemark>
      <Placemark id="1391373209000">
        <name><![CDATA[Broadway Marketplace]]></name>
        <atom:link href="http://foursquare.com/venue/4a661612f964a520ffc71fe3"/>
        <description><![CDATA[<p>2/2/14<br/> 2:33 PM to 2:50 PM<br/> 17 min</p> <p>Grocery Store<br/> <a href="http://foursquare.com/venue/4a661612f964a520ffc71fe3">More details (Foursquare)</a> </p>]]></description>
        <TimeSpan>
          <begin>2014-02-02T14:33:30-06:00</begin>
          <end>2014-02-02T14:50:48-06:00</end>
        </TimeSpan>
        <styleUrl>#place_Grocery Store</styleUrl>
        <Point>
          <coordinates>-71.11300484548056,42.37405171427381</coordinates>
        </Point>
      </Placemark>
      <Placemark id="1391374529000">
        <name><![CDATA[Home]]></name>
        <description><![CDATA[<p>2/2/14<br/> 2:55 PM to 5:49 PM<br/> 2:53 hours</p>]]></description>
        <TimeSpan>
          <begin>2014-02-02T14:55:30-06:00</begin>
          <end>2014-02-02T17:49:05-06:00</end>
        </TimeSpan>
        <styleUrl>#place_home</styleUrl>
        <Point>
          <coordinates>-71.1114458017,42.3754311174</coordinates>
        </Point>
      </Placemark>
      <Placemark id="1391386389000">
        <name><![CDATA[Place in Coolidge Hill]]></name>
        <description><![CDATA[<p>2/2/14<br/> 6:13 PM to 9:20 PM<br/> 3:07 hours</p>]]></description>
        <TimeSpan>
          <begin>2014-02-02T18:13:10-06:00</begin>
          <end>2014-02-02T21:20:34-06:00</end>
        </TimeSpan>
        <styleUrl>#place_unknown</styleUrl>
        <Point>
          <coordinates>-71.1320735788,42.3742313284</coordinates>
        </Point>
      </Placemark>
      <Placemark id="1391399173000">
        <name><![CDATA[Home]]></name>
        <description><![CDATA[<p>2/2/14<br/> 9:46 PM to 12:00 AM<br/> 2:13 hours</p>]]></description>
        <TimeSpan>
          <begin>2014-02-02T21:46:14-06:00</begin>
          <end>2014-02-02T23:59:59-06:00</end>
        </TimeSpan>
        <styleUrl>#place_home</styleUrl>
        <Point>
          <coordinates>-71.1114458017,42.3754311174</coordinates>
        </Point>
      </Placemark>
    </Folder>
    <Folder>
      <name><![CDATA[2/3/14]]></name>
      <Placemark id="1391407200000">
        <name><![CDATA[Home]]></name>
        <description><![CDATA[<p>2/3/14<br/> 12:00 AM to 12:00 AM<br/> 24:00 hours</p>]]></description>
        <TimeSpan>
          <begin>2014-02-03T00:00:01-06:00</begin>
          <end>2014-02-03T23:59:59-06:00</end>
        </TimeSpan>
        <styleUrl>#place_home</styleUrl>
        <Point>
          <coordinates>-71.1114458017,42.3754311174</coordinates>
        </Point>
      </Placemark>
    </Folder>
    <Folder>
      <name><![CDATA[2/4/14]]></name>
      <Placemark id="1391493600000">
        <name><![CDATA[Home]]></name>
        <description><![CDATA[<p>2/4/14<br/> 12:00 AM to 8:37 AM<br/> 8:37 hours</p>]]></description>
        <TimeSpan>
          <begin>2014-02-04T00:00:01-06:00</begin>
          <end>2014-02-04T08:37:42-06:00</end>
        </TimeSpan>
        <styleUrl>#place_home</styleUrl>
        <Point>
          <coordinates>-71.1114458017,42.3754311174</coordinates>
        </Point>
      </Placemark>
      <Placemark id="1391525127000">
        <name><![CDATA[Proximate]]></name>
        <atom:link href="http://foursquare.com/venue/51c8c0d1498e5d4d09a48362"/>
        <description><![CDATA[<p>2/4/14<br/> 8:45 AM to 11:37 AM<br/> 2:51 hours</p> <p>Tech Startup<br/> <a href="http://foursquare.com/venue/51c8c0d1498e5d4d09a48362">More details (Foursquare)</a> </p>]]></description>
        <TimeSpan>
          <begin>2014-02-04T08:45:28-06:00</begin>
          <end>2014-02-04T11:36:59-06:00</end>
        </TimeSpan>
        <styleUrl>#place_Tech Startup</styleUrl>
        <Point>
          <coordinates>-71.117205,42.378716</coordinates>
        </Point>
      </Placemark>
      <Placemark id="1391536024000">
        <name><![CDATA[Border Cafe]]></name>
        <atom:link href="http://foursquare.com/venue/3fd66200f964a520bded1ee3"/>
        <description><![CDATA[<p>2/4/14<br/> 11:47 AM to 1:47 PM<br/> 2:00 hours</p> <p>Mexican Restaurant<br/> <a href="http://foursquare.com/venue/3fd66200f964a520bded1ee3">More details (Foursquare)</a> </p>]]></description>
        <TimeSpan>
          <begin>2014-02-04T11:47:05-06:00</begin>
          <end>2014-02-04T13:47:38-06:00</end>
        </TimeSpan>
        <styleUrl>#place_Mexican Restaurant</styleUrl>
        <Point>
          <coordinates>-71.120141,42.3743468</coordinates>
        </Point>
      </Placemark>
      <Placemark id="1391543914000">
        <name><![CDATA[Proximate]]></name>
        <atom:link href="http://foursquare.com/venue/51c8c0d1498e5d4d09a48362"/>
        <description><![CDATA[<p>2/4/14<br/> 1:58 PM to 6:35 PM<br/> 4:36 hours</p> <p>Tech Startup<br/> <a href="http://foursquare.com/venue/51c8c0d1498e5d4d09a48362">More details (Foursquare)</a> </p>]]></description>
        <TimeSpan>
          <begin>2014-02-04T13:58:35-06:00</begin>
          <end>2014-02-04T18:35:28-06:00</end>
        </TimeSpan>
        <styleUrl>#place_Tech Startup</styleUrl>
        <Point>
          <coordinates>-71.117205,42.378716</coordinates>
        </Point>
      </Placemark>
      <Placemark id="1391561618000">
        <name><![CDATA[Home]]></name>
        <description><![CDATA[<p>2/4/14<br/> 6:53 PM to 12:00 AM<br/> 5:06 hours</p>]]></description>
        <TimeSpan>
          <begin>2014-02-04T18:53:39-06:00</begin>
          <end>2014-02-04T23:59:59-06:00</end>
        </TimeSpan>
        <styleUrl>#place_home</styleUrl>
        <Point>
          <coordinates>-71.1114458017,42.3754311174</coordinates>
        </Point>
      </Placemark>
    </Folder>
    <Folder>
      <name><![CDATA[2/5/14]]></name>
      <Placemark id="1391580000000">
        <name><![CDATA[Home]]></name>
        <description><![CDATA[<p>2/5/14<br/> 12:00 AM to 10:00 AM<br/> 10:00 hours</p>]]></description>
        <TimeSpan>
          <begin>2014-02-05T00:00:01-06:00</begin>
          <end>2014-02-05T10:00:31-06:00</end>
        </TimeSpan>
        <styleUrl>#place_home</styleUrl>
        <Point>
          <coordinates>-71.1114458017,42.3754311174</coordinates>
        </Point>
      </Placemark>
      <Placemark id="1391616678000">
        <name><![CDATA[Proximate]]></name>
        <atom:link href="http://foursquare.com/venue/51c8c0d1498e5d4d09a48362"/>
        <description><![CDATA[<p>2/5/14<br/> 10:11 AM to 12:33 PM<br/> 2:22 hours</p> <p>Tech Startup<br/> <a href="http://foursquare.com/venue/51c8c0d1498e5d4d09a48362">More details (Foursquare)</a> </p>]]></description>
        <TimeSpan>
          <begin>2014-02-05T10:11:19-06:00</begin>
          <end>2014-02-05T12:33:56-06:00</end>
        </TimeSpan>
        <styleUrl>#place_Tech Startup</styleUrl>
        <Point>
          <coordinates>-71.117205,42.378716</coordinates>
        </Point>
      </Placemark>
      <Placemark id="1391626026000">
        <name><![CDATA[Proximate]]></name>
        <atom:link href="http://foursquare.com/venue/51c8c0d1498e5d4d09a48362"/>
        <description><![CDATA[<p>2/5/14<br/> 12:47 PM to 7:02 PM<br/> 6:15 hours</p> <p>Tech Startup<br/> <a href="http://foursquare.com/venue/51c8c0d1498e5d4d09a48362">More details (Foursquare)</a> </p>]]></description>
        <TimeSpan>
          <begin>2014-02-05T12:47:07-06:00</begin>
          <end>2014-02-05T19:02:43-06:00</end>
        </TimeSpan>
        <styleUrl>#place_Tech Startup</styleUrl>
        <Point>
          <coordinates>-71.117205,42.378716</coordinates>
        </Point>
      </Placemark>
      <Placemark id="1391649088000">
        <name><![CDATA[Home]]></name>
        <description><![CDATA[<p>2/5/14<br/> 7:11 PM to 12:00 AM<br/> 4:48 hours</p>]]></description>
        <TimeSpan>
          <begin>2014-02-05T19:11:29-06:00</begin>
          <end>2014-02-05T23:59:59-06:00</end>
        </TimeSpan>
        <styleUrl>#place_home</styleUrl>
        <Point>
          <coordinates>-71.1114458017,42.3754311174</coordinates>
        </Point>
      </Placemark>
    </Folder>
    <Folder>
      <name><![CDATA[2/6/14]]></name>
      <Placemark id="1391666400000">
        <name><![CDATA[Home]]></name>
        <description><![CDATA[<p>2/6/14<br/> 12:00 AM to 8:14 AM<br/> 8:14 hours</p>]]></description>
        <TimeSpan>
          <begin>2014-02-06T00:00:01-06:00</begin>
          <end>2014-02-06T08:14:54-06:00</end>
        </TimeSpan>
        <styleUrl>#place_home</styleUrl>
        <Point>
          <coordinates>-71.1114458017,42.3754311174</coordinates>
        </Point>
      </Placemark>
      <Placemark id="1391696331000">
        <name><![CDATA[Place in Old Cambridge]]></name>
        <description><![CDATA[<p>2/6/14<br/> 8:18 AM to 8:22 AM<br/> 4 min</p>]]></description>
        <TimeSpan>
          <begin>2014-02-06T08:18:52-06:00</begin>
          <end>2014-02-06T08:22:55-06:00</end>
        </TimeSpan>
        <styleUrl>#place_unknown</styleUrl>
        <Point>
          <coordinates>-71.1114403623,42.3753690939</coordinates>
        </Point>
      </Placemark>
      <Placemark id="1391697248000">
        <name><![CDATA[Mitchell Dong]]></name>
        <description><![CDATA[<p>2/6/14<br/> 8:34 AM to 10:21 AM<br/> 1:47 hours</p>]]></description>
        <TimeSpan>
          <begin>2014-02-06T08:34:09-06:00</begin>
          <end>2014-02-06T10:21:19-06:00</end>
        </TimeSpan>
        <styleUrl>#place_home</styleUrl>
        <Point>
          <coordinates>-71.123998503,42.3774394608</coordinates>
        </Point>
      </Placemark>
      <Placemark id="1391704662000">
        <name><![CDATA[Grendel's Den Restaurant & Bar]]></name>
        <atom:link href="http://foursquare.com/venue/3fd66200f964a520bced1ee3"/>
        <description><![CDATA[<p>2/6/14<br/> 10:37 AM to 11:52 AM<br/> 1:15 hours</p> <p>Bar<br/> <a href="http://foursquare.com/venue/3fd66200f964a520bced1ee3">More details (Foursquare)</a> </p>]]></description>
        <TimeSpan>
          <begin>2014-02-06T10:37:43-06:00</begin>
          <end>2014-02-06T11:52:41-06:00</end>
        </TimeSpan>
        <styleUrl>#place_Bar</styleUrl>
        <Point>
          <coordinates>-71.12077832221985,42.37237675230346</coordinates>
        </Point>
      </Placemark>
      <Placemark id="1391710225000">
        <name><![CDATA[Proximate]]></name>
        <atom:link href="http://foursquare.com/venue/51c8c0d1498e5d4d09a48362"/>
        <description><![CDATA[<p>2/6/14<br/> 12:10 PM to 2:46 PM<br/> 2:36 hours</p> <p>Tech Startup<br/> <a href="http://foursquare.com/venue/51c8c0d1498e5d4d09a48362">More details (Foursquare)</a> </p>]]></description>
        <TimeSpan>
          <begin>2014-02-06T12:10:26-06:00</begin>
          <end>2014-02-06T14:46:54-06:00</end>
        </TimeSpan>
        <styleUrl>#place_Tech Startup</styleUrl>
        <Point>
          <coordinates>-71.117205,42.378716</coordinates>
        </Point>
      </Placemark>
      <Placemark id="1391720693000">
        <name><![CDATA[Home]]></name>
        <description><![CDATA[<p>2/6/14<br/> 3:04 PM to 6:44 PM<br/> 3:40 hours</p>]]></description>
        <TimeSpan>
          <begin>2014-02-06T15:04:54-06:00</begin>
          <end>2014-02-06T18:44:56-06:00</end>
        </TimeSpan>
        <styleUrl>#place_home</styleUrl>
        <Point>
          <coordinates>-71.1114458017,42.3754311174</coordinates>
        </Point>
      </Placemark>
      <Placemark id="1391748674000">
        <name><![CDATA[Home]]></name>
        <description><![CDATA[<p>2/6/14<br/> 10:51 PM to 12:00 AM<br/> 1:08 hours</p>]]></description>
        <TimeSpan>
          <begin>2014-02-06T22:51:15-06:00</begin>
          <end>2014-02-06T23:59:59-06:00</end>
        </TimeSpan>
        <styleUrl>#place_home</styleUrl>
        <Point>
          <coordinates>-71.1114458017,42.3754311174</coordinates>
        </Point>
      </Placemark>
    </Folder>
    <Folder>
      <name><![CDATA[2/7/14]]></name>
      <Placemark id="1391752800000">
        <name><![CDATA[Home]]></name>
        <description><![CDATA[<p>2/7/14<br/> 12:00 AM to 9:19 AM<br/> 9:19 hours</p>]]></description>
        <TimeSpan>
          <begin>2014-02-07T00:00:01-06:00</begin>
          <end>2014-02-07T09:19:25-06:00</end>
        </TimeSpan>
        <styleUrl>#place_home</styleUrl>
        <Point>
          <coordinates>-71.1114458017,42.3754311174</coordinates>
        </Point>
      </Placemark>
      <Placemark id="1391787058000">
        <name><![CDATA[Proximate]]></name>
        <atom:link href="http://foursquare.com/venue/51c8c0d1498e5d4d09a48362"/>
        <description><![CDATA[<p>2/7/14<br/> 9:30 AM to 10:02 AM<br/> 31 min</p> <p>Tech Startup<br/> <a href="http://foursquare.com/venue/51c8c0d1498e5d4d09a48362">More details (Foursquare)</a> </p>]]></description>
        <TimeSpan>
          <begin>2014-02-07T09:30:59-06:00</begin>
          <end>2014-02-07T10:02:16-06:00</end>
        </TimeSpan>
        <styleUrl>#place_Tech Startup</styleUrl>
        <Point>
          <coordinates>-71.117205,42.378716</coordinates>
        </Point>
      </Placemark>
      <Placemark id="1391789857000">
        <name><![CDATA[Legal Sea Foods - Charles Square]]></name>
        <atom:link href="http://foursquare.com/venue/4bdcb5fa3904a59331664f9e"/>
        <description><![CDATA[<p>2/7/14<br/> 10:17 AM to 11:40 AM<br/> 1:22 hours</p> <p>Seafood Restaurant<br/> <a href="http://foursquare.com/venue/4bdcb5fa3904a59331664f9e">More details (Foursquare)</a> </p>]]></description>
        <TimeSpan>
          <begin>2014-02-07T10:17:38-06:00</begin>
          <end>2014-02-07T11:40:28-06:00</end>
        </TimeSpan>
        <styleUrl>#place_Seafood Restaurant</styleUrl>
        <Point>
          <coordinates>-71.1230027436908,42.37220351484281</coordinates>
        </Point>
      </Placemark>
      <Placemark id="1391795865000">
        <name><![CDATA[Harvard Innovation Lab]]></name>
        <atom:link href="http://foursquare.com/venue/4e5d4676ae60839ea2e29e64"/>
        <description><![CDATA[<p>2/7/14<br/> 11:57 AM to 3:39 PM<br/> 3:41 hours</p> <p>College Technology Building<br/> <a href="http://foursquare.com/venue/4e5d4676ae60839ea2e29e64">More details (Foursquare)</a> </p>]]></description>
        <TimeSpan>
          <begin>2014-02-07T11:57:46-06:00</begin>
          <end>2014-02-07T15:39:05-06:00</end>
        </TimeSpan>
        <styleUrl>#place_College Technology Building</styleUrl>
        <Point>
          <coordinates>-71.12407621183526,42.36403242532342</coordinates>
        </Point>
      </Placemark>
      <Placemark id="1391810377000">
        <name><![CDATA[Proximate]]></name>
        <atom:link href="http://foursquare.com/venue/51c8c0d1498e5d4d09a48362"/>
        <description><![CDATA[<p>2/7/14<br/> 3:59 PM to 4:11 PM<br/> 11 min</p> <p>Tech Startup<br/> <a href="http://foursquare.com/venue/51c8c0d1498e5d4d09a48362">More details (Foursquare)</a> </p>]]></description>
        <TimeSpan>
          <begin>2014-02-07T15:59:38-06:00</begin>
          <end>2014-02-07T16:10:59-06:00</end>
        </TimeSpan>
        <styleUrl>#place_Tech Startup</styleUrl>
        <Point>
          <coordinates>-71.117205,42.378716</coordinates>
        </Point>
      </Placemark>
      <Placemark id="1391811769000">
        <name><![CDATA[Park]]></name>
        <atom:link href="http://foursquare.com/venue/4f7c8902e4b032c26c6798db"/>
        <description><![CDATA[<p>2/7/14<br/> 4:22 PM to 6:05 PM<br/> 1:43 hours</p> <p>Gastropub<br/> <a href="http://foursquare.com/venue/4f7c8902e4b032c26c6798db">More details (Foursquare)</a> </p>]]></description>
        <TimeSpan>
          <begin>2014-02-07T16:22:50-06:00</begin>
          <end>2014-02-07T18:05:58-06:00</end>
        </TimeSpan>
        <styleUrl>#place_Gastropub</styleUrl>
        <Point>
          <coordinates>-71.12097185013617,42.37169409933257</coordinates>
        </Point>
      </Placemark>
      <Placemark id="1391819087000">
        <name><![CDATA[Home]]></name>
        <description><![CDATA[<p>2/7/14<br/> 6:24 PM to 12:00 AM<br/> 5:35 hours</p>]]></description>
        <TimeSpan>
          <begin>2014-02-07T18:24:48-06:00</begin>
          <end>2014-02-07T23:59:59-06:00</end>
        </TimeSpan>
        <styleUrl>#place_home</styleUrl>
        <Point>
          <coordinates>-71.1114458017,42.3754311174</coordinates>
        </Point>
      </Placemark>
    </Folder>
    <Folder>
      <name><![CDATA[2/8/14]]></name>
      <Placemark id="1391839200000">
        <name><![CDATA[Home]]></name>
        <description><![CDATA[<p>2/8/14<br/> 12:00 AM to 10:04 AM<br/> 10:04 hours</p>]]></description>
        <TimeSpan>
          <begin>2014-02-08T00:00:01-06:00</begin>
          <end>2014-02-08T10:04:31-06:00</end>
        </TimeSpan>
        <styleUrl>#place_home</styleUrl>
        <Point>
          <coordinates>-71.1114458017,42.3754311174</coordinates>
        </Point>
      </Placemark>
      <Placemark id="1391876186000">
        <name><![CDATA[Dickson Bros. True Value]]></name>
        <atom:link href="http://foursquare.com/venue/4aad3cf3f964a5202f5f20e3"/>
        <description><![CDATA[<p>2/8/14<br/> 10:16 AM to 11:46 AM<br/> 1:30 hours</p> <p>Hardware Store<br/> <a href="http://foursquare.com/venue/4aad3cf3f964a5202f5f20e3">More details (Foursquare)</a> </p>]]></description>
        <TimeSpan>
          <begin>2014-02-08T10:16:27-06:00</begin>
          <end>2014-02-08T11:46:34-06:00</end>
        </TimeSpan>
        <styleUrl>#place_Hardware Store</styleUrl>
        <Point>
          <coordinates>-71.120418,42.373343</coordinates>
        </Point>
      </Placemark>
      <Placemark id="1391881723000">
        <name><![CDATA[Starbucks]]></name>
        <atom:link href="http://foursquare.com/venue/49bc4e56f964a52028541fe3"/>
        <description><![CDATA[<p>2/8/14<br/> 11:48 AM to 12:12 PM<br/> 23 min</p> <p>Café<br/> <a href="http://foursquare.com/venue/49bc4e56f964a52028541fe3">More details (Foursquare)</a> </p>]]></description>
        <TimeSpan>
          <begin>2014-02-08T11:48:44-06:00</begin>
          <end>2014-02-08T12:12:07-06:00</end>
        </TimeSpan>
        <styleUrl>#place_Café</styleUrl>
        <Point>
          <coordinates>-71.119452,42.372485</coordinates>
        </Point>
      </Placemark>
      <Placemark id="1391883758000">
        <name><![CDATA[Broadway Marketplace]]></name>
        <atom:link href="http://foursquare.com/venue/4a661612f964a520ffc71fe3"/>
        <description><![CDATA[<p>2/8/14<br/> 12:22 PM to 12:32 PM<br/> 9 min</p> <p>Grocery Store<br/> <a href="http://foursquare.com/venue/4a661612f964a520ffc71fe3">More details (Foursquare)</a> </p>]]></description>
        <TimeSpan>
          <begin>2014-02-08T12:22:39-06:00</begin>
          <end>2014-02-08T12:31:59-06:00</end>
        </TimeSpan>
        <styleUrl>#place_Grocery Store</styleUrl>
        <Point>
          <coordinates>-71.11300484548056,42.37405171427381</coordinates>
        </Point>
      </Placemark>
      <Placemark id="1391884550000">
        <name><![CDATA[Home]]></name>
        <description><![CDATA[<p>2/8/14<br/> 12:35 PM to 12:49 PM<br/> 13 min</p>]]></description>
        <TimeSpan>
          <begin>2014-02-08T12:35:51-06:00</begin>
          <end>2014-02-08T12:49:04-06:00</end>
        </TimeSpan>
        <styleUrl>#place_home</styleUrl>
        <Point>
          <coordinates>-71.1114458017,42.3754311174</coordinates>
        </Point>
      </Placemark>
      <Placemark id="1391885718000">
        <name><![CDATA[Science Center Plaza]]></name>
        <atom:link href="http://foursquare.com/venue/517c126de4b0db4bc4f91b0a"/>
        <description><![CDATA[<p>2/8/14<br/> 12:55 PM to 12:59 PM<br/> 3 min</p> <p>Plaza<br/> <a href="http://foursquare.com/venue/517c126de4b0db4bc4f91b0a">More details (Foursquare)</a> </p>]]></description>
        <TimeSpan>
          <begin>2014-02-08T12:55:19-06:00</begin>
          <end>2014-02-08T12:59:01-06:00</end>
        </TimeSpan>
        <styleUrl>#place_Plaza</styleUrl>
        <Point>
          <coordinates>-71.11671274278848,42.37586051920407</coordinates>
        </Point>
      </Placemark>
      <Placemark id="1391886400000">
        <name><![CDATA[Boston Tea Stop]]></name>
        <atom:link href="http://foursquare.com/venue/49fe1e48f964a520716f1fe3"/>
        <description><![CDATA[<p>2/8/14<br/> 1:06 PM to 1:56 PM<br/> 50 min</p> <p>Tea Room<br/> <a href="http://foursquare.com/venue/49fe1e48f964a520716f1fe3">More details (Foursquare)</a> </p>]]></description>
        <TimeSpan>
          <begin>2014-02-08T13:06:41-06:00</begin>
          <end>2014-02-08T13:56:49-06:00</end>
        </TimeSpan>
        <styleUrl>#place_Tea Room</styleUrl>
        <Point>
          <coordinates>-71.12067591907267,42.37202556731354</coordinates>
        </Point>
      </Placemark>
      <Placemark id="1391890346000">
        <name><![CDATA[Home]]></name>
        <description><![CDATA[<p>2/8/14<br/> 2:12 PM to 12:00 AM<br/> 9:47 hours</p>]]></description>
        <TimeSpan>
          <begin>2014-02-08T14:12:27-06:00</begin>
          <end>2014-02-08T23:59:59-06:00</end>
        </TimeSpan>
        <styleUrl>#place_home</styleUrl>
        <Point>
          <coordinates>-71.1114458017,42.3754311174</coordinates>
        </Point>
      </Placemark>
    </Folder>
    <Folder>
      <name><![CDATA[2/9/14]]></name>
      <Placemark id="1391925600000">
        <name><![CDATA[Home]]></name>
        <description><![CDATA[<p>2/9/14<br/> 12:00 AM to 1:45 PM<br/> 13:45 hours</p>]]></description>
        <TimeSpan>
          <begin>2014-02-09T00:00:01-06:00</begin>
          <end>2014-02-09T13:45:27-06:00</end>
        </TimeSpan>
        <styleUrl>#place_home</styleUrl>
        <Point>
          <coordinates>-71.1114458017,42.3754311174</coordinates>
        </Point>
      </Placemark>
      <Placemark id="1391976138000">
        <name><![CDATA[The Home Depot]]></name>
        <atom:link href="http://foursquare.com/venue/4b24776ff964a520d76724e3"/>
        <description><![CDATA[<p>2/9/14<br/> 2:02 PM to 2:54 PM<br/> 52 min</p> <p>Hardware Store<br/> <a href="http://foursquare.com/venue/4b24776ff964a520d76724e3">More details (Foursquare)</a> </p>]]></description>
        <TimeSpan>
          <begin>2014-02-09T14:02:19-06:00</begin>
          <end>2014-02-09T14:54:28-06:00</end>
        </TimeSpan>
        <styleUrl>#place_Hardware Store</styleUrl>
        <Point>
          <coordinates>-71.07984114884522,42.38981956708074</coordinates>
        </Point>
      </Placemark>
      <Placemark id="1391980063000">
        <name><![CDATA[Home]]></name>
        <description><![CDATA[<p>2/9/14<br/> 3:07 PM to 8:02 PM<br/> 4:54 hours</p>]]></description>
        <TimeSpan>
          <begin>2014-02-09T15:07:44-06:00</begin>
          <end>2014-02-09T20:02:33-06:00</end>
        </TimeSpan>
        <styleUrl>#place_home</styleUrl>
        <Point>
          <coordinates>-71.1114458017,42.3754311174</coordinates>
        </Point>
      </Placemark>
      <Placemark id="1392001441000">
        <name><![CDATA[Home]]></name>
        <description><![CDATA[<p>2/9/14<br/> 9:04 PM to 12:00 AM<br/> 2:55 hours</p>]]></description>
        <TimeSpan>
          <begin>2014-02-09T21:04:02-06:00</begin>
          <end>2014-02-09T23:59:59-06:00</end>
        </TimeSpan>
        <styleUrl>#place_home</styleUrl>
        <Point>
          <coordinates>-71.1114458017,42.3754311174</coordinates>
        </Point>
      </Placemark>
    </Folder>
    <Folder>
      <name><![CDATA[2/10/14]]></name>
      <Placemark id="1392012000000">
        <name><![CDATA[Home]]></name>
        <description><![CDATA[<p>2/10/14<br/> 12:00 AM to 3:27 PM<br/> 15:27 hours</p>]]></description>
        <TimeSpan>
          <begin>2014-02-10T00:00:01-06:00</begin>
          <end>2014-02-10T15:27:55-06:00</end>
        </TimeSpan>
        <styleUrl>#place_home</styleUrl>
        <Point>
          <coordinates>-71.1114458017,42.3754311174</coordinates>
        </Point>
      </Placemark>
      <Placemark id="1392069207000">
        <name><![CDATA[T3 Innovation Studio]]></name>
        <atom:link href="http://foursquare.com/venue/520a556611d28b4a76ec352c"/>
        <description><![CDATA[<p>2/10/14<br/> 3:53 PM to 5:17 PM<br/> 1:24 hours</p> <p>Office<br/> <a href="http://foursquare.com/venue/520a556611d28b4a76ec352c">More details (Foursquare)</a> </p>]]></description>
        <TimeSpan>
          <begin>2014-02-10T15:53:28-06:00</begin>
          <end>2014-02-10T17:17:39-06:00</end>
        </TimeSpan>
        <styleUrl>#place_Office</styleUrl>
        <Point>
          <coordinates>-71.04524705235535,42.35303956039798</coordinates>
        </Point>
      </Placemark>
      <Placemark id="1392076392000">
        <name><![CDATA[Home]]></name>
        <description><![CDATA[<p>2/10/14<br/> 5:53 PM to 12:00 AM<br/> 6:06 hours</p>]]></description>
        <TimeSpan>
          <begin>2014-02-10T17:53:13-06:00</begin>
          <end>2014-02-10T23:59:59-06:00</end>
        </TimeSpan>
        <styleUrl>#place_home</styleUrl>
        <Point>
          <coordinates>-71.1114458017,42.3754311174</coordinates>
        </Point>
      </Placemark>
    </Folder>
    <Folder>
      <name><![CDATA[2/11/14]]></name>
      <Placemark id="1392098400000">
        <name><![CDATA[Home]]></name>
        <description><![CDATA[<p>2/11/14<br/> 12:00 AM to 8:54 AM<br/> 8:54 hours</p>]]></description>
        <TimeSpan>
          <begin>2014-02-11T00:00:01-06:00</begin>
          <end>2014-02-11T08:54:41-06:00</end>
        </TimeSpan>
        <styleUrl>#place_home</styleUrl>
        <Point>
          <coordinates>-71.1114458017,42.3754311174</coordinates>
        </Point>
      </Placemark>
      <Placemark id="1392130873000">
        <name><![CDATA[Place in Old Cambridge]]></name>
        <description><![CDATA[<p>2/11/14<br/> 9:01 AM to 9:09 AM<br/> 8 min</p>]]></description>
        <TimeSpan>
          <begin>2014-02-11T09:01:14-06:00</begin>
          <end>2014-02-11T09:09:57-06:00</end>
        </TimeSpan>
        <styleUrl>#place_unknown</styleUrl>
        <Point>
          <coordinates>-71.1168284018,42.3770093257</coordinates>
        </Point>
      </Placemark>
      <Placemark id="1392131679000">
        <name><![CDATA[Proximate]]></name>
        <atom:link href="http://foursquare.com/venue/51c8c0d1498e5d4d09a48362"/>
        <description><![CDATA[<p>2/11/14<br/> 9:14 AM to 6:11 PM<br/> 8:56 hours</p> <p>Tech Startup<br/> <a href="http://foursquare.com/venue/51c8c0d1498e5d4d09a48362">More details (Foursquare)</a> </p>]]></description>
        <TimeSpan>
          <begin>2014-02-11T09:14:40-06:00</begin>
          <end>2014-02-11T18:11:15-06:00</end>
        </TimeSpan>
        <styleUrl>#place_Tech Startup</styleUrl>
        <Point>
          <coordinates>-71.117205,42.378716</coordinates>
        </Point>
      </Placemark>
      <Placemark id="1392164452000">
        <name><![CDATA[Home]]></name>
        <description><![CDATA[<p>2/11/14<br/> 6:20 PM to 12:00 AM<br/> 5:39 hours</p>]]></description>
        <TimeSpan>
          <begin>2014-02-11T18:20:53-06:00</begin>
          <end>2014-02-11T23:59:59-06:00</end>
        </TimeSpan>
        <styleUrl>#place_home</styleUrl>
        <Point>
          <coordinates>-71.1114458017,42.3754311174</coordinates>
        </Point>
      </Placemark>
    </Folder>
    <Folder>
      <name><![CDATA[2/12/14]]></name>
      <Placemark id="1392184800000">
        <name><![CDATA[Home]]></name>
        <description><![CDATA[<p>2/12/14<br/> 12:00 AM to 9:10 AM<br/> 9:10 hours</p>]]></description>
        <TimeSpan>
          <begin>2014-02-12T00:00:01-06:00</begin>
          <end>2014-02-12T09:10:20-06:00</end>
        </TimeSpan>
        <styleUrl>#place_home</styleUrl>
        <Point>
          <coordinates>-71.1114458017,42.3754311174</coordinates>
        </Point>
      </Placemark>
      <Placemark id="1392219580000">
        <name><![CDATA[Amtrak South Station]]></name>
        <atom:link href="http://foursquare.com/venue/52e42895498eb9e24848960b"/>
        <description><![CDATA[<p>2/12/14<br/> 9:39 AM to 10:04 AM<br/> 25 min</p> <p>Train Station<br/> <a href="http://foursquare.com/venue/52e42895498eb9e24848960b">More details (Foursquare)</a> </p>]]></description>
        <TimeSpan>
          <begin>2014-02-12T09:39:41-06:00</begin>
          <end>2014-02-12T10:04:57-06:00</end>
        </TimeSpan>
        <styleUrl>#place_Train Station</styleUrl>
        <Point>
          <coordinates>-71.0551073348505,42.35141860782156</coordinates>
        </Point>
      </Placemark>
      <Placemark id="1392251830000">
        <name><![CDATA[Place in East End]]></name>
        <description><![CDATA[<p>2/12/14<br/> 6:37 PM to 6:42 PM<br/> 5 min</p>]]></description>
        <TimeSpan>
          <begin>2014-02-12T18:37:11-06:00</begin>
          <end>2014-02-12T18:42:58-06:00</end>
        </TimeSpan>
        <styleUrl>#place_unknown</styleUrl>
        <Point>
          <coordinates>-77.0059959584,38.8967316187</coordinates>
        </Point>
      </Placemark>
      <Placemark id="1392253550000">
        <name><![CDATA[2440 39th Street NW]]></name>
        <atom:link href="http://foursquare.com/venue/520fad54498e47affbce37d4"/>
        <description><![CDATA[<p>2/12/14<br/> 7:05 PM to 9:03 PM<br/> 1:57 hours</p> <p>Home (private)<br/> <a href="http://foursquare.com/venue/520fad54498e47affbce37d4">More details (Foursquare)</a> </p>]]></description>
        <TimeSpan>
          <begin>2014-02-12T19:05:51-06:00</begin>
          <end>2014-02-12T21:03:23-06:00</end>
        </TimeSpan>
        <styleUrl>#place_Home (private)</styleUrl>
        <Point>
          <coordinates>-77.07371486668141,38.92592014653639</coordinates>
        </Point>
      </Placemark>
    </Folder>
    <Folder>
      <name><![CDATA[2/13/14]]></name>
      <Placemark id="1392301712000">
        <name><![CDATA[2440 39th Street NW]]></name>
        <atom:link href="http://foursquare.com/venue/520fad54498e47affbce37d4"/>
        <description><![CDATA[<p>2/13/14<br/> 8:28 AM to 12:26 PM<br/> 3:57 hours</p> <p>Home (private)<br/> <a href="http://foursquare.com/venue/520fad54498e47affbce37d4">More details (Foursquare)</a> </p>]]></description>
        <TimeSpan>
          <begin>2014-02-13T08:28:33-06:00</begin>
          <end>2014-02-13T12:26:30-06:00</end>
        </TimeSpan>
        <styleUrl>#place_Home (private)</styleUrl>
        <Point>
          <coordinates>-77.07371486668141,38.92592014653639</coordinates>
        </Point>
      </Placemark>
      <Placemark id="1392316594000">
        <name><![CDATA[Whole Foods Market]]></name>
        <atom:link href="http://foursquare.com/venue/4aad58b8f964a520d25f20e3"/>
        <description><![CDATA[<p>2/13/14<br/> 12:36 PM to 1:32 PM<br/> 56 min</p> <p>Grocery Store<br/> <a href="http://foursquare.com/venue/4aad58b8f964a520d25f20e3">More details (Foursquare)</a> </p>]]></description>
        <TimeSpan>
          <begin>2014-02-13T12:36:35-06:00</begin>
          <end>2014-02-13T13:32:52-06:00</end>
        </TimeSpan>
        <styleUrl>#place_Grocery Store</styleUrl>
        <Point>
          <coordinates>-77.071804,38.920938</coordinates>
        </Point>
      </Placemark>
      <Placemark id="1392320756000">
        <name><![CDATA[2440 39th Street NW]]></name>
        <atom:link href="http://foursquare.com/venue/520fad54498e47affbce37d4"/>
        <description><![CDATA[<p>2/13/14<br/> 1:45 PM to 12:00 AM<br/> 10:14 hours</p> <p>Home (private)<br/> <a href="http://foursquare.com/venue/520fad54498e47affbce37d4">More details (Foursquare)</a> </p>]]></description>
        <TimeSpan>
          <begin>2014-02-13T13:45:57-06:00</begin>
          <end>2014-02-13T23:59:59-06:00</end>
        </TimeSpan>
        <styleUrl>#place_Home (private)</styleUrl>
        <Point>
          <coordinates>-77.07371486668141,38.92592014653639</coordinates>
        </Point>
      </Placemark>
    </Folder>
    <Folder>
      <name><![CDATA[2/14/14]]></name>
      <Placemark id="1392357600000">
        <name><![CDATA[2440 39th Street NW]]></name>
        <atom:link href="http://foursquare.com/venue/520fad54498e47affbce37d4"/>
        <description><![CDATA[<p>2/14/14<br/> 12:00 AM to 12:00 AM<br/> 24:00 hours</p> <p>Home (private)<br/> <a href="http://foursquare.com/venue/520fad54498e47affbce37d4">More details (Foursquare)</a> </p>]]></description>
        <TimeSpan>
          <begin>2014-02-14T00:00:01-06:00</begin>
          <end>2014-02-14T23:59:59-06:00</end>
        </TimeSpan>
        <styleUrl>#place_Home (private)</styleUrl>
        <Point>
          <coordinates>-77.07371486668141,38.92592014653639</coordinates>
        </Point>
      </Placemark>
    </Folder>
    <Folder>
      <name><![CDATA[2/15/14]]></name>
      <Placemark id="1392444000000">
        <name><![CDATA[2440 39th Street NW]]></name>
        <atom:link href="http://foursquare.com/venue/520fad54498e47affbce37d4"/>
        <description><![CDATA[<p>2/15/14<br/> 12:00 AM to 11:27 AM<br/> 11:27 hours</p> <p>Home (private)<br/> <a href="http://foursquare.com/venue/520fad54498e47affbce37d4">More details (Foursquare)</a> </p>]]></description>
        <TimeSpan>
          <begin>2014-02-15T00:00:01-06:00</begin>
          <end>2014-02-15T11:27:13-06:00</end>
        </TimeSpan>
        <styleUrl>#place_Home (private)</styleUrl>
        <Point>
          <coordinates>-77.07371486668141,38.92592014653639</coordinates>
        </Point>
      </Placemark>
      <Placemark id="1392485706000">
        <name><![CDATA[Surfside]]></name>
        <atom:link href="http://foursquare.com/venue/4a02762ef964a52056711fe3"/>
        <description><![CDATA[<p>2/15/14<br/> 11:35 AM to 11:44 AM<br/> 9 min</p> <p>Mexican Restaurant<br/> <a href="http://foursquare.com/venue/4a02762ef964a52056711fe3">More details (Foursquare)</a> </p>]]></description>
        <TimeSpan>
          <begin>2014-02-15T11:35:07-06:00</begin>
          <end>2014-02-15T11:44:11-06:00</end>
        </TimeSpan>
        <styleUrl>#place_Mexican Restaurant</styleUrl>
        <Point>
          <coordinates>-77.072873711586,38.92206976004444</coordinates>
        </Point>
      </Placemark>
      <Placemark id="1392486752000">
        <name><![CDATA[Place in Glover Park]]></name>
        <description><![CDATA[<p>2/15/14<br/> 11:52 AM to 3:05 PM<br/> 3:12 hours</p>]]></description>
        <TimeSpan>
          <begin>2014-02-15T11:52:33-06:00</begin>
          <end>2014-02-15T15:05:22-06:00</end>
        </TimeSpan>
        <styleUrl>#place_unknown</styleUrl>
        <Point>
          <coordinates>-77.0772055012,38.9219317032</coordinates>
        </Point>
      </Placemark>
      <Placemark id="1392498807000">
        <name><![CDATA[Whole Foods Market]]></name>
        <atom:link href="http://foursquare.com/venue/4aad58b8f964a520d25f20e3"/>
        <description><![CDATA[<p>2/15/14<br/> 3:13 PM to 4:27 PM<br/> 1:13 hours</p> <p>Grocery Store<br/> <a href="http://foursquare.com/venue/4aad58b8f964a520d25f20e3">More details (Foursquare)</a> </p>]]></description>
        <TimeSpan>
          <begin>2014-02-15T15:13:28-06:00</begin>
          <end>2014-02-15T16:27:19-06:00</end>
        </TimeSpan>
        <styleUrl>#place_Grocery Store</styleUrl>
        <Point>
          <coordinates>-77.071804,38.920938</coordinates>
        </Point>
      </Placemark>
      <Placemark id="1392503784000">
        <name><![CDATA[2440 39th Street NW]]></name>
        <atom:link href="http://foursquare.com/venue/520fad54498e47affbce37d4"/>
        <description><![CDATA[<p>2/15/14<br/> 4:36 PM to 12:00 AM<br/> 7:23 hours</p> <p>Home (private)<br/> <a href="http://foursquare.com/venue/520fad54498e47affbce37d4">More details (Foursquare)</a> </p>]]></description>
        <TimeSpan>
          <begin>2014-02-15T16:36:25-06:00</begin>
          <end>2014-02-15T23:59:59-06:00</end>
        </TimeSpan>
        <styleUrl>#place_Home (private)</styleUrl>
        <Point>
          <coordinates>-77.07371486668141,38.92592014653639</coordinates>
        </Point>
      </Placemark>
    </Folder>
    <Folder>
      <name><![CDATA[2/16/14]]></name>
      <Placemark id="1392530400000">
        <name><![CDATA[2440 39th Street NW]]></name>
        <atom:link href="http://foursquare.com/venue/520fad54498e47affbce37d4"/>
        <description><![CDATA[<p>2/16/14<br/> 12:00 AM to 1:16 PM<br/> 13:16 hours</p> <p>Home (private)<br/> <a href="http://foursquare.com/venue/520fad54498e47affbce37d4">More details (Foursquare)</a> </p>]]></description>
        <TimeSpan>
          <begin>2014-02-16T00:00:01-06:00</begin>
          <end>2014-02-16T13:16:21-06:00</end>
        </TimeSpan>
        <styleUrl>#place_Home (private)</styleUrl>
        <Point>
          <coordinates>-77.07371486668141,38.92592014653639</coordinates>
        </Point>
      </Placemark>
      <Placemark id="1392579969000">
        <name><![CDATA[Place in Cloisters]]></name>
        <description><![CDATA[<p>2/16/14<br/> 1:46 PM to 1:49 PM<br/> 3 min</p>]]></description>
        <TimeSpan>
          <begin>2014-02-16T13:46:10-06:00</begin>
          <end>2014-02-16T13:49:34-06:00</end>
        </TimeSpan>
        <styleUrl>#place_unknown</styleUrl>
        <Point>
          <coordinates>-77.0641352982,38.9089122568</coordinates>
        </Point>
      </Placemark>
      <Placemark id="1392580459000">
        <name><![CDATA[Apple Store]]></name>
        <atom:link href="http://foursquare.com/venue/4bdb67c03904a59377434a9e"/>
        <description><![CDATA[<p>2/16/14<br/> 1:54 PM to 2:12 PM<br/> 18 min</p> <p>Electronics Store<br/> <a href="http://foursquare.com/venue/4bdb67c03904a59377434a9e">More details (Foursquare)</a> </p>]]></description>
        <TimeSpan>
          <begin>2014-02-16T13:54:20-06:00</begin>
          <end>2014-02-16T14:12:28-06:00</end>
        </TimeSpan>
        <styleUrl>#place_Electronics Store</styleUrl>
        <Point>
          <coordinates>-77.0626272217989,38.90590722335151</coordinates>
        </Point>
      </Placemark>
      <Placemark id="1392581792000">
        <name><![CDATA[CB2]]></name>
        <atom:link href="http://foursquare.com/venue/4d2e1c6f79dd6ea8b66786d3"/>
        <description><![CDATA[<p>2/16/14<br/> 2:16 PM to 3:11 PM<br/> 54 min</p> <p>Furniture / Home Store<br/> <a href="http://foursquare.com/venue/4d2e1c6f79dd6ea8b66786d3">More details (Foursquare)</a> </p>]]></description>
        <TimeSpan>
          <begin>2014-02-16T14:16:33-06:00</begin>
          <end>2014-02-16T15:11:28-06:00</end>
        </TimeSpan>
        <styleUrl>#place_Furniture / Home Store</styleUrl>
        <Point>
          <coordinates>-77.06643283017698,38.90516808750274</coordinates>
        </Point>
      </Placemark>
      <Placemark id="1392585609000">
        <name><![CDATA[TJ Maxx & HomeGoods]]></name>
        <atom:link href="http://foursquare.com/venue/522c8c8011d277f9f23b1a0c"/>
        <description><![CDATA[<p>2/16/14<br/> 3:20 PM to 5:25 PM<br/> 2:05 hours</p> <p>Department Store<br/> <a href="http://foursquare.com/venue/522c8c8011d277f9f23b1a0c">More details (Foursquare)</a> </p>]]></description>
        <TimeSpan>
          <begin>2014-02-16T15:20:10-06:00</begin>
          <end>2014-02-16T17:25:58-06:00</end>
        </TimeSpan>
        <styleUrl>#place_Department Store</styleUrl>
        <Point>
          <coordinates>-77.06456095806466,38.90506846179218</coordinates>
        </Point>
      </Placemark>
      <Placemark id="1392593498000">
        <name><![CDATA[H&M]]></name>
        <description><![CDATA[<p>2/16/14<br/> 5:31 PM to 6:06 PM<br/> 35 min</p>]]></description>
        <TimeSpan>
          <begin>2014-02-16T17:31:39-06:00</begin>
          <end>2014-02-16T18:06:51-06:00</end>
        </TimeSpan>
        <styleUrl>#place_work</styleUrl>
        <Point>
          <coordinates>-77.0602639566,38.9052623578</coordinates>
        </Point>
      </Placemark>
      <Placemark id="1392596017000">
        <name><![CDATA[Safeway]]></name>
        <atom:link href="http://foursquare.com/venue/4bb614dc2f70c9b656d68430"/>
        <description><![CDATA[<p>2/16/14<br/> 6:13 PM to 6:51 PM<br/> 37 min</p> <p>Grocery Store<br/> <a href="http://foursquare.com/venue/4bb614dc2f70c9b656d68430">More details (Foursquare)</a> </p>]]></description>
        <TimeSpan>
          <begin>2014-02-16T18:13:38-06:00</begin>
          <end>2014-02-16T18:51:00-06:00</end>
        </TimeSpan>
        <styleUrl>#place_Grocery Store</styleUrl>
        <Point>
          <coordinates>-77.06758975982666,38.91567980755536</coordinates>
        </Point>
      </Placemark>
      <Placemark id="1392598627000">
        <name><![CDATA[2440 39th Street NW]]></name>
        <atom:link href="http://foursquare.com/venue/520fad54498e47affbce37d4"/>
        <description><![CDATA[<p>2/16/14<br/> 6:57 PM to 12:00 AM<br/> 5:02 hours</p> <p>Home (private)<br/> <a href="http://foursquare.com/venue/520fad54498e47affbce37d4">More details (Foursquare)</a> </p>]]></description>
        <TimeSpan>
          <begin>2014-02-16T18:57:08-06:00</begin>
          <end>2014-02-16T23:59:59-06:00</end>
        </TimeSpan>
        <styleUrl>#place_Home (private)</styleUrl>
        <Point>
          <coordinates>-77.07371486668141,38.92592014653639</coordinates>
        </Point>
      </Placemark>
    </Folder>
    <Folder>
      <name><![CDATA[2/17/14]]></name>
      <Placemark id="1392616800000">
        <name><![CDATA[2440 39th Street NW]]></name>
        <atom:link href="http://foursquare.com/venue/520fad54498e47affbce37d4"/>
        <description><![CDATA[<p>2/17/14<br/> 12:00 AM to 12:03 PM<br/> 12:03 hours</p> <p>Home (private)<br/> <a href="http://foursquare.com/venue/520fad54498e47affbce37d4">More details (Foursquare)</a> </p>]]></description>
        <TimeSpan>
          <begin>2014-02-17T00:00:01-06:00</begin>
          <end>2014-02-17T12:03:34-06:00</end>
        </TimeSpan>
        <styleUrl>#place_Home (private)</styleUrl>
        <Point>
          <coordinates>-77.07371486668141,38.92592014653639</coordinates>
        </Point>
      </Placemark>
      <Placemark id="1392660665000">
        <name><![CDATA[Chipotle Mexican Grill]]></name>
        <atom:link href="http://foursquare.com/venue/4dd3006345dd45f71925c819"/>
        <description><![CDATA[<p>2/17/14<br/> 12:11 PM to 12:27 PM<br/> 16 min</p> <p>Mexican Restaurant<br/> <a href="http://foursquare.com/venue/4dd3006345dd45f71925c819">More details (Foursquare)</a> </p>]]></description>
        <TimeSpan>
          <begin>2014-02-17T12:11:06-06:00</begin>
          <end>2014-02-17T12:27:41-06:00</end>
        </TimeSpan>
        <styleUrl>#place_Mexican Restaurant</styleUrl>
        <Point>
          <coordinates>-77.07226186717197,38.92092198295547</coordinates>
        </Point>
      </Placemark>
      <Placemark id="1392662162000">
        <name><![CDATA[2440 39th Street NW]]></name>
        <atom:link href="http://foursquare.com/venue/520fad54498e47affbce37d4"/>
        <description><![CDATA[<p>2/17/14<br/> 12:36 PM to 12:00 AM<br/> 11:23 hours</p> <p>Home (private)<br/> <a href="http://foursquare.com/venue/520fad54498e47affbce37d4">More details (Foursquare)</a> </p>]]></description>
        <TimeSpan>
          <begin>2014-02-17T12:36:03-06:00</begin>
          <end>2014-02-17T23:59:59-06:00</end>
        </TimeSpan>
        <styleUrl>#place_Home (private)</styleUrl>
        <Point>
          <coordinates>-77.07371486668141,38.92592014653639</coordinates>
        </Point>
      </Placemark>
    </Folder>
    <Folder>
      <name><![CDATA[2/18/14]]></name>
      <Placemark id="1392703200000">
        <name><![CDATA[2440 39th Street NW]]></name>
        <atom:link href="http://foursquare.com/venue/520fad54498e47affbce37d4"/>
        <description><![CDATA[<p>2/18/14<br/> 12:00 AM to 8:41 AM<br/> 8:41 hours</p> <p>Home (private)<br/> <a href="http://foursquare.com/venue/520fad54498e47affbce37d4">More details (Foursquare)</a> </p>]]></description>
        <TimeSpan>
          <begin>2014-02-18T00:00:01-06:00</begin>
          <end>2014-02-18T08:41:30-06:00</end>
        </TimeSpan>
        <styleUrl>#place_Home (private)</styleUrl>
        <Point>
          <coordinates>-77.07371486668141,38.92592014653639</coordinates>
        </Point>
      </Placemark>
      <Placemark id="1392736353000">
        <name><![CDATA[Place in East End]]></name>
        <description><![CDATA[<p>2/18/14<br/> 9:12 AM to 9:14 AM<br/> 2 min</p>]]></description>
        <TimeSpan>
          <begin>2014-02-18T09:12:34-06:00</begin>
          <end>2014-02-18T09:14:52-06:00</end>
        </TimeSpan>
        <styleUrl>#place_unknown</styleUrl>
        <Point>
          <coordinates>-77.005702946,38.8980210188</coordinates>
        </Point>
      </Placemark>
      <Placemark id="1392765213000">
        <name><![CDATA[Place in Neponset River Reservation]]></name>
        <description><![CDATA[<p>2/18/14<br/> 5:13 PM to 5:17 PM<br/> 4 min</p>]]></description>
        <TimeSpan>
          <begin>2014-02-18T17:13:34-06:00</begin>
          <end>2014-02-18T17:17:49-06:00</end>
        </TimeSpan>
        <styleUrl>#place_unknown</styleUrl>
        <Point>
          <coordinates>-71.1442122739,42.2163763896</coordinates>
        </Point>
      </Placemark>
      <Placemark id="1392768343000">
        <name><![CDATA[Home]]></name>
        <description><![CDATA[<p>2/18/14<br/> 6:05 PM to 12:00 AM<br/> 5:54 hours</p>]]></description>
        <TimeSpan>
          <begin>2014-02-18T18:05:44-06:00</begin>
          <end>2014-02-18T23:59:59-06:00</end>
        </TimeSpan>
        <styleUrl>#place_home</styleUrl>
        <Point>
          <coordinates>-71.1114458017,42.3754311174</coordinates>
        </Point>
      </Placemark>
    </Folder>
    <Folder>
      <name><![CDATA[2/19/14]]></name>
      <Placemark id="1392789600000">
        <name><![CDATA[Home]]></name>
        <description><![CDATA[<p>2/19/14<br/> 12:00 AM to 9:08 AM<br/> 9:08 hours</p>]]></description>
        <TimeSpan>
          <begin>2014-02-19T00:00:01-06:00</begin>
          <end>2014-02-19T09:08:25-06:00</end>
        </TimeSpan>
        <styleUrl>#place_home</styleUrl>
        <Point>
          <coordinates>-71.1114458017,42.3754311174</coordinates>
        </Point>
      </Placemark>
      <Placemark id="1392823748000">
        <name><![CDATA[Mitchell Dong]]></name>
        <description><![CDATA[<p>2/19/14<br/> 9:29 AM to 1:38 PM<br/> 4:09 hours</p>]]></description>
        <TimeSpan>
          <begin>2014-02-19T09:29:09-06:00</begin>
          <end>2014-02-19T13:38:53-06:00</end>
        </TimeSpan>
        <styleUrl>#place_home</styleUrl>
        <Point>
          <coordinates>-71.123998503,42.3774394608</coordinates>
        </Point>
      </Placemark>
      <Placemark id="1392839374000">
        <name><![CDATA[Border Cafe]]></name>
        <atom:link href="http://foursquare.com/venue/3fd66200f964a520bded1ee3"/>
        <description><![CDATA[<p>2/19/14<br/> 1:49 PM to 3:10 PM<br/> 1:21 hours</p> <p>Mexican Restaurant<br/> <a href="http://foursquare.com/venue/3fd66200f964a520bded1ee3">More details (Foursquare)</a> </p>]]></description>
        <TimeSpan>
          <begin>2014-02-19T13:49:35-06:00</begin>
          <end>2014-02-19T15:10:41-06:00</end>
        </TimeSpan>
        <styleUrl>#place_Mexican Restaurant</styleUrl>
        <Point>
          <coordinates>-71.120141,42.3743468</coordinates>
        </Point>
      </Placemark>
      <Placemark id="1392844816000">
        <name><![CDATA[Eliot House]]></name>
        <atom:link href="http://foursquare.com/venue/4b6c63ccf964a52019362ce3"/>
        <description><![CDATA[<p>2/19/14<br/> 3:20 PM to 5:50 PM<br/> 2:30 hours</p> <p>College Residence Hall<br/> <a href="http://foursquare.com/venue/4b6c63ccf964a52019362ce3">More details (Foursquare)</a> </p>]]></description>
        <TimeSpan>
          <begin>2014-02-19T15:20:17-06:00</begin>
          <end>2014-02-19T17:50:28-06:00</end>
        </TimeSpan>
        <styleUrl>#place_College Residence Hall</styleUrl>
        <Point>
          <coordinates>-71.12128257751465,42.37018114178375</coordinates>
        </Point>
      </Placemark>
      <Placemark id="1392854412000">
        <name><![CDATA[Cafe Gato Rojo]]></name>
        <atom:link href="http://foursquare.com/venue/4b63076ff964a5208c5e2ae3"/>
        <description><![CDATA[<p>2/19/14<br/> 6:00 PM to 7:26 PM<br/> 1:26 hours</p> <p>Café<br/> <a href="http://foursquare.com/venue/4b63076ff964a5208c5e2ae3">More details (Foursquare)</a> </p>]]></description>
        <TimeSpan>
          <begin>2014-02-19T18:00:13-06:00</begin>
          <end>2014-02-19T19:26:42-06:00</end>
        </TimeSpan>
        <styleUrl>#place_Café</styleUrl>
        <Point>
          <coordinates>-71.11834019422531,42.37359441115208</coordinates>
        </Point>
      </Placemark>
      <Placemark id="1392860168000">
        <name><![CDATA[Home]]></name>
        <description><![CDATA[<p>2/19/14<br/> 7:36 PM to 12:00 AM<br/> 4:23 hours</p>]]></description>
        <TimeSpan>
          <begin>2014-02-19T19:36:09-06:00</begin>
          <end>2014-02-19T23:59:59-06:00</end>
        </TimeSpan>
        <styleUrl>#place_home</styleUrl>
        <Point>
          <coordinates>-71.1114458017,42.3754311174</coordinates>
        </Point>
      </Placemark>
    </Folder>
    <Folder>
      <name><![CDATA[2/20/14]]></name>
      <Placemark id="1392876000000">
        <name><![CDATA[Home]]></name>
        <description><![CDATA[<p>2/20/14<br/> 12:00 AM to 10:11 AM<br/> 10:11 hours</p>]]></description>
        <TimeSpan>
          <begin>2014-02-20T00:00:01-06:00</begin>
          <end>2014-02-20T10:11:57-06:00</end>
        </TimeSpan>
        <styleUrl>#place_home</styleUrl>
        <Point>
          <coordinates>-71.1114458017,42.3754311174</coordinates>
        </Point>
      </Placemark>
      <Placemark id="1392913602000">
        <name><![CDATA[Mitchell Dong]]></name>
        <description><![CDATA[<p>2/20/14<br/> 10:26 AM to 1:17 PM<br/> 2:51 hours</p>]]></description>
        <TimeSpan>
          <begin>2014-02-20T10:26:43-06:00</begin>
          <end>2014-02-20T13:17:47-06:00</end>
        </TimeSpan>
        <styleUrl>#place_home</styleUrl>
        <Point>
          <coordinates>-71.123998503,42.3774394608</coordinates>
        </Point>
      </Placemark>
      <Placemark id="1392924764000">
        <name><![CDATA[Caspersen Student Center]]></name>
        <atom:link href="http://foursquare.com/venue/4e790134b0fb5d40982b00d0"/>
        <description><![CDATA[<p>2/20/14<br/> 1:32 PM to 1:54 PM<br/> 22 min</p> <p>College Cafeteria<br/> <a href="http://foursquare.com/venue/4e790134b0fb5d40982b00d0">More details (Foursquare)</a> </p>]]></description>
        <TimeSpan>
          <begin>2014-02-20T13:32:45-06:00</begin>
          <end>2014-02-20T13:54:54-06:00</end>
        </TimeSpan>
        <styleUrl>#place_College Cafeteria</styleUrl>
        <Point>
          <coordinates>-71.11866242152347,42.37890166598297</coordinates>
        </Point>
      </Placemark>
      <Placemark id="1392926344000">
        <name><![CDATA[Proximate]]></name>
        <atom:link href="http://foursquare.com/venue/51c8c0d1498e5d4d09a48362"/>
        <description><![CDATA[<p>2/20/14<br/> 1:59 PM to 4:30 PM<br/> 2:31 hours</p> <p>Tech Startup<br/> <a href="http://foursquare.com/venue/51c8c0d1498e5d4d09a48362">More details (Foursquare)</a> </p>]]></description>
        <TimeSpan>
          <begin>2014-02-20T13:59:05-06:00</begin>
          <end>2014-02-20T16:30:42-06:00</end>
        </TimeSpan>
        <styleUrl>#place_Tech Startup</styleUrl>
        <Point>
          <coordinates>-71.117205,42.378716</coordinates>
        </Point>
      </Placemark>
      <Placemark id="1392935939000">
        <name><![CDATA[Queens Head Pub]]></name>
        <atom:link href="http://foursquare.com/venue/4ad6a980f964a5201a0821e3"/>
        <description><![CDATA[<p>2/20/14<br/> 4:38 PM to 6:11 PM<br/> 1:32 hours</p> <p>Bar<br/> <a href="http://foursquare.com/venue/4ad6a980f964a5201a0821e3">More details (Foursquare)</a> </p>]]></description>
        <TimeSpan>
          <begin>2014-02-20T16:39:00-06:00</begin>
          <end>2014-02-20T18:11:45-06:00</end>
        </TimeSpan>
        <styleUrl>#place_Bar</styleUrl>
        <Point>
          <coordinates>-71.115435,42.375886</coordinates>
        </Point>
      </Placemark>
      <Placemark id="1392941890000">
        <name><![CDATA[Home]]></name>
        <description><![CDATA[<p>2/20/14<br/> 6:18 PM to 12:00 AM<br/> 5:41 hours</p>]]></description>
        <TimeSpan>
          <begin>2014-02-20T18:18:11-06:00</begin>
          <end>2014-02-20T23:59:59-06:00</end>
        </TimeSpan>
        <styleUrl>#place_home</styleUrl>
        <Point>
          <coordinates>-71.1114458017,42.3754311174</coordinates>
        </Point>
      </Placemark>
    </Folder>
    <Folder>
      <name><![CDATA[2/21/14]]></name>
      <Placemark id="1392962400000">
        <name><![CDATA[Home]]></name>
        <description><![CDATA[<p>2/21/14<br/> 12:00 AM to 8:43 AM<br/> 8:43 hours</p>]]></description>
        <TimeSpan>
          <begin>2014-02-21T00:00:01-06:00</begin>
          <end>2014-02-21T08:43:53-06:00</end>
        </TimeSpan>
        <styleUrl>#place_home</styleUrl>
        <Point>
          <coordinates>-71.1114458017,42.3754311174</coordinates>
        </Point>
      </Placemark>
      <Placemark id="1392994879000">
        <name><![CDATA[Harvard Alumni Association]]></name>
        <atom:link href="http://foursquare.com/venue/4b5dc68df964a520026b29e3"/>
        <description><![CDATA[<p>2/21/14<br/> 9:01 AM to 9:45 AM<br/> 44 min</p> <p>University<br/> <a href="http://foursquare.com/venue/4b5dc68df964a520026b29e3">More details (Foursquare)</a> </p>]]></description>
        <TimeSpan>
          <begin>2014-02-21T09:01:20-06:00</begin>
          <end>2014-02-21T09:45:23-06:00</end>
        </TimeSpan>
        <styleUrl>#place_University</styleUrl>
        <Point>
          <coordinates>-71.12325225275964,42.37317592010315</coordinates>
        </Point>
      </Placemark>
      <Placemark id="1392998964000">
        <name><![CDATA[Proximate]]></name>
        <atom:link href="http://foursquare.com/venue/51c8c0d1498e5d4d09a48362"/>
        <description><![CDATA[<p>2/21/14<br/> 10:09 AM to 12:43 PM<br/> 2:34 hours</p> <p>Tech Startup<br/> <a href="http://foursquare.com/venue/51c8c0d1498e5d4d09a48362">More details (Foursquare)</a> </p>]]></description>
        <TimeSpan>
          <begin>2014-02-21T10:09:25-06:00</begin>
          <end>2014-02-21T12:43:41-06:00</end>
        </TimeSpan>
        <styleUrl>#place_Tech Startup</styleUrl>
        <Point>
          <coordinates>-71.117205,42.378716</coordinates>
        </Point>
      </Placemark>
      <Placemark id="1393008843000">
        <name><![CDATA[Border Cafe]]></name>
        <atom:link href="http://foursquare.com/venue/3fd66200f964a520bded1ee3"/>
        <description><![CDATA[<p>2/21/14<br/> 12:54 PM to 2:20 PM<br/> 1:26 hours</p> <p>Mexican Restaurant<br/> <a href="http://foursquare.com/venue/3fd66200f964a520bded1ee3">More details (Foursquare)</a> </p>]]></description>
        <TimeSpan>
          <begin>2014-02-21T12:54:04-06:00</begin>
          <end>2014-02-21T14:20:12-06:00</end>
        </TimeSpan>
        <styleUrl>#place_Mexican Restaurant</styleUrl>
        <Point>
          <coordinates>-71.120141,42.3743468</coordinates>
        </Point>
      </Placemark>
      <Placemark id="1393014748000">
        <name><![CDATA[Proximate]]></name>
        <atom:link href="http://foursquare.com/venue/51c8c0d1498e5d4d09a48362"/>
        <description><![CDATA[<p>2/21/14<br/> 2:32 PM to 3:39 PM<br/> 1:06 hours</p> <p>Tech Startup<br/> <a href="http://foursquare.com/venue/51c8c0d1498e5d4d09a48362">More details (Foursquare)</a> </p>]]></description>
        <TimeSpan>
          <begin>2014-02-21T14:32:29-06:00</begin>
          <end>2014-02-21T15:39:23-06:00</end>
        </TimeSpan>
        <styleUrl>#place_Tech Startup</styleUrl>
        <Point>
          <coordinates>-71.117205,42.378716</coordinates>
        </Point>
      </Placemark>
      <Placemark id="1393019306000">
        <name><![CDATA[Home]]></name>
        <description><![CDATA[<p>2/21/14<br/> 3:48 PM to 5:10 PM<br/> 1:21 hours</p>]]></description>
        <TimeSpan>
          <begin>2014-02-21T15:48:27-06:00</begin>
          <end>2014-02-21T17:10:16-06:00</end>
        </TimeSpan>
        <styleUrl>#place_home</styleUrl>
        <Point>
          <coordinates>-71.1114458017,42.3754311174</coordinates>
        </Point>
      </Placemark>
      <Placemark id="1393045009000">
        <name><![CDATA[Home]]></name>
        <description><![CDATA[<p>2/21/14<br/> 10:56 PM to 12:00 AM<br/> 1:03 hours</p>]]></description>
        <TimeSpan>
          <begin>2014-02-21T22:56:50-06:00</begin>
          <end>2014-02-21T23:59:59-06:00</end>
        </TimeSpan>
        <styleUrl>#place_home</styleUrl>
        <Point>
          <coordinates>-71.1114458017,42.3754311174</coordinates>
        </Point>
      </Placemark>
    </Folder>
    <Folder>
      <name><![CDATA[2/22/14]]></name>
      <Placemark id="1393048800000">
        <name><![CDATA[Home]]></name>
        <description><![CDATA[<p>2/22/14<br/> 12:00 AM to 11:23 AM<br/> 11:23 hours</p>]]></description>
        <TimeSpan>
          <begin>2014-02-22T00:00:01-06:00</begin>
          <end>2014-02-22T11:23:20-06:00</end>
        </TimeSpan>
        <styleUrl>#place_home</styleUrl>
        <Point>
          <coordinates>-71.1114458017,42.3754311174</coordinates>
        </Point>
      </Placemark>
      <Placemark id="1393090535000">
        <name><![CDATA[Harvest]]></name>
        <atom:link href="http://foursquare.com/venue/49cf65d9f964a520a75a1fe3"/>
        <description><![CDATA[<p>2/22/14<br/> 11:35 AM to 12:56 PM<br/> 1:21 hours</p> <p>American Restaurant<br/> <a href="http://foursquare.com/venue/49cf65d9f964a520a75a1fe3">More details (Foursquare)</a> </p>]]></description>
        <TimeSpan>
          <begin>2014-02-22T11:35:36-06:00</begin>
          <end>2014-02-22T12:56:55-06:00</end>
        </TimeSpan>
        <styleUrl>#place_American Restaurant</styleUrl>
        <Point>
          <coordinates>-71.12188865478788,42.37360135042072</coordinates>
        </Point>
      </Placemark>
      <Placemark id="1393095719000">
        <name><![CDATA[Experiment Fund]]></name>
        <description><![CDATA[<p>2/22/14<br/> 1:01 PM to 6:25 PM<br/> 5:23 hours</p>]]></description>
        <TimeSpan>
          <begin>2014-02-22T13:02:00-06:00</begin>
          <end>2014-02-22T18:25:06-06:00</end>
        </TimeSpan>
        <styleUrl>#place_work</styleUrl>
        <Point>
          <coordinates>-71.11951231956482,42.37313766800413</coordinates>
        </Point>
      </Placemark>
      <Placemark id="1393115324000">
        <name><![CDATA[Orinoco]]></name>
        <atom:link href="http://foursquare.com/venue/4f106cace4b072565b8bd1b6"/>
        <description><![CDATA[<p>2/22/14<br/> 6:28 PM to 8:24 PM<br/> 1:55 hours</p> <p>Arepa Restaurant<br/> <a href="http://foursquare.com/venue/4f106cace4b072565b8bd1b6">More details (Foursquare)</a> </p>]]></description>
        <TimeSpan>
          <begin>2014-02-22T18:28:45-06:00</begin>
          <end>2014-02-22T20:24:11-06:00</end>
        </TimeSpan>
        <styleUrl>#place_Arepa Restaurant</styleUrl>
        <Point>
          <coordinates>-71.12049603929978,42.37190996862827</coordinates>
        </Point>
      </Placemark>
      <Placemark id="1393122573000">
        <name><![CDATA[Legal Sea Foods - Charles Square]]></name>
        <atom:link href="http://foursquare.com/venue/4bdcb5fa3904a59331664f9e"/>
        <description><![CDATA[<p>2/22/14<br/> 8:29 PM to 10:11 PM<br/> 1:42 hours</p> <p>Seafood Restaurant<br/> <a href="http://foursquare.com/venue/4bdcb5fa3904a59331664f9e">More details (Foursquare)</a> </p>]]></description>
        <TimeSpan>
          <begin>2014-02-22T20:29:34-06:00</begin>
          <end>2014-02-22T22:11:53-06:00</end>
        </TimeSpan>
        <styleUrl>#place_Seafood Restaurant</styleUrl>
        <Point>
          <coordinates>-71.1230027436908,42.37220351484281</coordinates>
        </Point>
      </Placemark>
      <Placemark id="1393129676000">
        <name><![CDATA[Home]]></name>
        <description><![CDATA[<p>2/22/14<br/> 10:27 PM to 12:00 AM<br/> 1:32 hours</p>]]></description>
        <TimeSpan>
          <begin>2014-02-22T22:27:57-06:00</begin>
          <end>2014-02-22T23:59:59-06:00</end>
        </TimeSpan>
        <styleUrl>#place_home</styleUrl>
        <Point>
          <coordinates>-71.1114458017,42.3754311174</coordinates>
        </Point>
      </Placemark>
    </Folder>
    <Folder>
      <name><![CDATA[2/23/14]]></name>
      <Placemark id="1393135200000">
        <name><![CDATA[Home]]></name>
        <description><![CDATA[<p>2/23/14<br/> 12:00 AM to 11:23 AM<br/> 11:23 hours</p>]]></description>
        <TimeSpan>
          <begin>2014-02-23T00:00:01-06:00</begin>
          <end>2014-02-23T11:23:22-06:00</end>
        </TimeSpan>
        <styleUrl>#place_home</styleUrl>
        <Point>
          <coordinates>-71.1114458017,42.3754311174</coordinates>
        </Point>
      </Placemark>
      <Placemark id="1393176847000">
        <name><![CDATA[Proximate]]></name>
        <atom:link href="http://foursquare.com/venue/51c8c0d1498e5d4d09a48362"/>
        <description><![CDATA[<p>2/23/14<br/> 11:34 AM to 4:28 PM<br/> 4:54 hours</p> <p>Tech Startup<br/> <a href="http://foursquare.com/venue/51c8c0d1498e5d4d09a48362">More details (Foursquare)</a> </p>]]></description>
        <TimeSpan>
          <begin>2014-02-23T11:34:08-06:00</begin>
          <end>2014-02-23T16:28:41-06:00</end>
        </TimeSpan>
        <styleUrl>#place_Tech Startup</styleUrl>
        <Point>
          <coordinates>-71.117205,42.378716</coordinates>
        </Point>
      </Placemark>
      <Placemark id="1393195279000">
        <name><![CDATA[Home]]></name>
        <description><![CDATA[<p>2/23/14<br/> 4:41 PM to 12:00 AM<br/> 7:18 hours</p>]]></description>
        <TimeSpan>
          <begin>2014-02-23T16:41:20-06:00</begin>
          <end>2014-02-23T23:59:59-06:00</end>
        </TimeSpan>
        <styleUrl>#place_home</styleUrl>
        <Point>
          <coordinates>-71.1114458017,42.3754311174</coordinates>
        </Point>
      </Placemark>
    </Folder>
    <Folder>
      <name><![CDATA[2/24/14]]></name>
      <Placemark id="1393221600000">
        <name><![CDATA[Home]]></name>
        <description><![CDATA[<p>2/24/14<br/> 12:00 AM to 7:44 AM<br/> 7:44 hours</p>]]></description>
        <TimeSpan>
          <begin>2014-02-24T00:00:01-06:00</begin>
          <end>2014-02-24T07:44:56-06:00</end>
        </TimeSpan>
        <styleUrl>#place_home</styleUrl>
        <Point>
          <coordinates>-71.1114458017,42.3754311174</coordinates>
        </Point>
      </Placemark>
      <Placemark id="1393250595000">
        <name><![CDATA[Mitchell Dong]]></name>
        <description><![CDATA[<p>2/24/14<br/> 8:03 AM to 9:27 AM<br/> 1:24 hours</p>]]></description>
        <TimeSpan>
          <begin>2014-02-24T08:03:16-06:00</begin>
          <end>2014-02-24T09:27:56-06:00</end>
        </TimeSpan>
        <styleUrl>#place_home</styleUrl>
        <Point>
          <coordinates>-71.123998503,42.3774394608</coordinates>
        </Point>
      </Placemark>
      <Placemark id="1393256188000">
        <name><![CDATA[Caspersen Student Center]]></name>
        <atom:link href="http://foursquare.com/venue/4e790134b0fb5d40982b00d0"/>
        <description><![CDATA[<p>2/24/14<br/> 9:36 AM to 9:53 AM<br/> 17 min</p> <p>College Cafeteria<br/> <a href="http://foursquare.com/venue/4e790134b0fb5d40982b00d0">More details (Foursquare)</a> </p>]]></description>
        <TimeSpan>
          <begin>2014-02-24T09:36:29-06:00</begin>
          <end>2014-02-24T09:53:55-06:00</end>
        </TimeSpan>
        <styleUrl>#place_College Cafeteria</styleUrl>
        <Point>
          <coordinates>-71.11866242152347,42.37890166598297</coordinates>
        </Point>
      </Placemark>
      <Placemark id="1393257453000">
        <name><![CDATA[Proximate]]></name>
        <atom:link href="http://foursquare.com/venue/51c8c0d1498e5d4d09a48362"/>
        <description><![CDATA[<p>2/24/14<br/> 9:57 AM to 11:32 AM<br/> 1:35 hours</p> <p>Tech Startup<br/> <a href="http://foursquare.com/venue/51c8c0d1498e5d4d09a48362">More details (Foursquare)</a> </p>]]></description>
        <TimeSpan>
          <begin>2014-02-24T09:57:34-06:00</begin>
          <end>2014-02-24T11:32:47-06:00</end>
        </TimeSpan>
        <styleUrl>#place_Tech Startup</styleUrl>
        <Point>
          <coordinates>-71.117205,42.378716</coordinates>
        </Point>
      </Placemark>
      <Placemark id="1393263753000">
        <name><![CDATA[Border Cafe]]></name>
        <atom:link href="http://foursquare.com/venue/3fd66200f964a520bded1ee3"/>
        <description><![CDATA[<p>2/24/14<br/> 11:42 AM to 12:50 PM<br/> 1:08 hours</p> <p>Mexican Restaurant<br/> <a href="http://foursquare.com/venue/3fd66200f964a520bded1ee3">More details (Foursquare)</a> </p>]]></description>
        <TimeSpan>
          <begin>2014-02-24T11:42:34-06:00</begin>
          <end>2014-02-24T12:50:58-06:00</end>
        </TimeSpan>
        <styleUrl>#place_Mexican Restaurant</styleUrl>
        <Point>
          <coordinates>-71.120141,42.3743468</coordinates>
        </Point>
      </Placemark>
      <Placemark id="1393268495000">
        <name><![CDATA[Proximate]]></name>
        <atom:link href="http://foursquare.com/venue/51c8c0d1498e5d4d09a48362"/>
        <description><![CDATA[<p>2/24/14<br/> 1:01 PM to 3:08 PM<br/> 2:06 hours</p> <p>Tech Startup<br/> <a href="http://foursquare.com/venue/51c8c0d1498e5d4d09a48362">More details (Foursquare)</a> </p>]]></description>
        <TimeSpan>
          <begin>2014-02-24T13:01:36-06:00</begin>
          <end>2014-02-24T15:08:01-06:00</end>
        </TimeSpan>
        <styleUrl>#place_Tech Startup</styleUrl>
        <Point>
          <coordinates>-71.117205,42.378716</coordinates>
        </Point>
      </Placemark>
      <Placemark id="1393276723000">
        <name><![CDATA[Starbucks]]></name>
        <atom:link href="http://foursquare.com/venue/49cabb79f964a520d8581fe3"/>
        <description><![CDATA[<p>2/24/14<br/> 3:18 PM to 3:21 PM<br/> 2 min</p> <p>Coffee Shop<br/> <a href="http://foursquare.com/venue/49cabb79f964a520d8581fe3">More details (Foursquare)</a> </p>]]></description>
        <TimeSpan>
          <begin>2014-02-24T15:18:44-06:00</begin>
          <end>2014-02-24T15:21:03-06:00</end>
        </TimeSpan>
        <styleUrl>#place_Coffee Shop</styleUrl>
        <Point>
          <coordinates>-71.12017,42.374494</coordinates>
        </Point>
      </Placemark>
      <Placemark id="1393277114000">
        <name><![CDATA[Harvard Alumni Association]]></name>
        <atom:link href="http://foursquare.com/venue/4b5dc68df964a520026b29e3"/>
        <description><![CDATA[<p>2/24/14<br/> 3:25 PM to 4:36 PM<br/> 1:10 hours</p> <p>University<br/> <a href="http://foursquare.com/venue/4b5dc68df964a520026b29e3">More details (Foursquare)</a> </p>]]></description>
        <TimeSpan>
          <begin>2014-02-24T15:25:15-06:00</begin>
          <end>2014-02-24T16:36:02-06:00</end>
        </TimeSpan>
        <styleUrl>#place_University</styleUrl>
        <Point>
          <coordinates>-71.12325225275964,42.37317592010315</coordinates>
        </Point>
      </Placemark>
      <Placemark id="1393281860000">
        <name><![CDATA[Place in Old Cambridge]]></name>
        <description><![CDATA[<p>2/24/14<br/> 4:44 PM to 4:51 PM<br/> 6 min</p>]]></description>
        <TimeSpan>
          <begin>2014-02-24T16:44:21-06:00</begin>
          <end>2014-02-24T16:51:06-06:00</end>
        </TimeSpan>
        <styleUrl>#place_unknown</styleUrl>
        <Point>
          <coordinates>-71.1213492043,42.3756232629</coordinates>
        </Point>
      </Placemark>
      <Placemark id="1393282879000">
        <name><![CDATA[Broadway Marketplace]]></name>
        <atom:link href="http://foursquare.com/venue/4a661612f964a520ffc71fe3"/>
        <description><![CDATA[<p>2/24/14<br/> 5:01 PM to 5:09 PM<br/> 8 min</p> <p>Grocery Store<br/> <a href="http://foursquare.com/venue/4a661612f964a520ffc71fe3">More details (Foursquare)</a> </p>]]></description>
        <TimeSpan>
          <begin>2014-02-24T17:01:20-06:00</begin>
          <end>2014-02-24T17:09:42-06:00</end>
        </TimeSpan>
        <styleUrl>#place_Grocery Store</styleUrl>
        <Point>
          <coordinates>-71.11300484548056,42.37405171427381</coordinates>
        </Point>
      </Placemark>
      <Placemark id="1393283668000">
        <name><![CDATA[Home]]></name>
        <description><![CDATA[<p>2/24/14<br/> 5:14 PM to 12:00 AM<br/> 6:45 hours</p>]]></description>
        <TimeSpan>
          <begin>2014-02-24T17:14:29-06:00</begin>
          <end>2014-02-24T23:59:59-06:00</end>
        </TimeSpan>
        <styleUrl>#place_home</styleUrl>
        <Point>
          <coordinates>-71.1114458017,42.3754311174</coordinates>
        </Point>
      </Placemark>
    </Folder>
    <Folder>
      <name><![CDATA[2/25/14]]></name>
      <Placemark id="1393308000000">
        <name><![CDATA[Home]]></name>
        <description><![CDATA[<p>2/25/14<br/> 12:00 AM to 9:57 AM<br/> 9:57 hours</p>]]></description>
        <TimeSpan>
          <begin>2014-02-25T00:00:01-06:00</begin>
          <end>2014-02-25T09:57:58-06:00</end>
        </TimeSpan>
        <styleUrl>#place_home</styleUrl>
        <Point>
          <coordinates>-71.1114458017,42.3754311174</coordinates>
        </Point>
      </Placemark>
      <Placemark id="1393344128000">
        <name><![CDATA[Place in Old Cambridge]]></name>
        <description><![CDATA[<p>2/25/14<br/> 10:02 AM to 10:04 AM<br/> 2 min</p>]]></description>
        <TimeSpan>
          <begin>2014-02-25T10:02:09-06:00</begin>
          <end>2014-02-25T10:04:58-06:00</end>
        </TimeSpan>
        <styleUrl>#place_unknown</styleUrl>
        <Point>
          <coordinates>-71.1132681841,42.37582268</coordinates>
        </Point>
      </Placemark>
      <Placemark id="1393344970000">
        <name><![CDATA[Proximate]]></name>
        <atom:link href="http://foursquare.com/venue/51c8c0d1498e5d4d09a48362"/>
        <description><![CDATA[<p>2/25/14<br/> 10:16 AM to 11:47 AM<br/> 1:31 hours</p> <p>Tech Startup<br/> <a href="http://foursquare.com/venue/51c8c0d1498e5d4d09a48362">More details (Foursquare)</a> </p>]]></description>
        <TimeSpan>
          <begin>2014-02-25T10:16:11-06:00</begin>
          <end>2014-02-25T11:47:10-06:00</end>
        </TimeSpan>
        <styleUrl>#place_Tech Startup</styleUrl>
        <Point>
          <coordinates>-71.117205,42.378716</coordinates>
        </Point>
      </Placemark>
      <Placemark id="1393350681000">
        <name><![CDATA[Caspersen Student Center]]></name>
        <atom:link href="http://foursquare.com/venue/4e790134b0fb5d40982b00d0"/>
        <description><![CDATA[<p>2/25/14<br/> 11:51 AM to 12:37 PM<br/> 45 min</p> <p>College Cafeteria<br/> <a href="http://foursquare.com/venue/4e790134b0fb5d40982b00d0">More details (Foursquare)</a> </p>]]></description>
        <TimeSpan>
          <begin>2014-02-25T11:51:22-06:00</begin>
          <end>2014-02-25T12:37:00-06:00</end>
        </TimeSpan>
        <styleUrl>#place_College Cafeteria</styleUrl>
        <Point>
          <coordinates>-71.11866242152347,42.37890166598297</coordinates>
        </Point>
      </Placemark>
      <Placemark id="1393353613000">
        <name><![CDATA[Proximate]]></name>
        <atom:link href="http://foursquare.com/venue/51c8c0d1498e5d4d09a48362"/>
        <description><![CDATA[<p>2/25/14<br/> 12:40 PM to 12:43 PM<br/> 3 min</p> <p>Tech Startup<br/> <a href="http://foursquare.com/venue/51c8c0d1498e5d4d09a48362">More details (Foursquare)</a> </p>]]></description>
        <TimeSpan>
          <begin>2014-02-25T12:40:14-06:00</begin>
          <end>2014-02-25T12:43:29-06:00</end>
        </TimeSpan>
        <styleUrl>#place_Tech Startup</styleUrl>
        <Point>
          <coordinates>-71.117205,42.378716</coordinates>
        </Point>
      </Placemark>
      <Placemark id="1393354588000">
        <name><![CDATA[Home]]></name>
        <description><![CDATA[<p>2/25/14<br/> 12:56 PM to 12:00 AM<br/> 11:03 hours</p>]]></description>
        <TimeSpan>
          <begin>2014-02-25T12:56:29-06:00</begin>
          <end>2014-02-25T23:59:59-06:00</end>
        </TimeSpan>
        <styleUrl>#place_home</styleUrl>
        <Point>
          <coordinates>-71.1114458017,42.3754311174</coordinates>
        </Point>
      </Placemark>
    </Folder>
    <Folder>
      <name><![CDATA[2/26/14]]></name>
      <Placemark id="1393394400000">
        <name><![CDATA[Home]]></name>
        <description><![CDATA[<p>2/26/14<br/> 12:00 AM to 12:00 AM<br/> 24:00 hours</p>]]></description>
        <TimeSpan>
          <begin>2014-02-26T00:00:01-06:00</begin>
          <end>2014-02-26T23:59:59-06:00</end>
        </TimeSpan>
        <styleUrl>#place_home</styleUrl>
        <Point>
          <coordinates>-71.1114458017,42.3754311174</coordinates>
        </Point>
      </Placemark>
    </Folder>
    <Folder>
      <name><![CDATA[2/27/14]]></name>
      <Placemark id="1393480800000">
        <name><![CDATA[Home]]></name>
        <description><![CDATA[<p>2/27/14<br/> 12:00 AM to 7:22 AM<br/> 7:22 hours</p>]]></description>
        <TimeSpan>
          <begin>2014-02-27T00:00:01-06:00</begin>
          <end>2014-02-27T07:22:08-06:00</end>
        </TimeSpan>
        <styleUrl>#place_home</styleUrl>
        <Point>
          <coordinates>-71.1114458017,42.3754311174</coordinates>
        </Point>
      </Placemark>
      <Placemark id="1393509603000">
        <name><![CDATA[Amtrak South Station]]></name>
        <atom:link href="http://foursquare.com/venue/52e42895498eb9e24848960b"/>
        <description><![CDATA[<p>2/27/14<br/> 8:00 AM to 8:30 AM<br/> 30 min</p> <p>Train Station<br/> <a href="http://foursquare.com/venue/52e42895498eb9e24848960b">More details (Foursquare)</a> </p>]]></description>
        <TimeSpan>
          <begin>2014-02-27T08:00:04-06:00</begin>
          <end>2014-02-27T08:30:57-06:00</end>
        </TimeSpan>
        <styleUrl>#place_Train Station</styleUrl>
        <Point>
          <coordinates>-71.0551073348505,42.35141860782156</coordinates>
        </Point>
      </Placemark>
      <Placemark id="1393540544000">
        <name><![CDATA[Union Station | Gate K]]></name>
        <atom:link href="http://foursquare.com/venue/4fa9356ee4b08cc7d9bbddb5"/>
        <description><![CDATA[<p>2/27/14<br/> 4:35 PM to 4:48 PM<br/> 12 min</p> <p>Platform<br/> <a href="http://foursquare.com/venue/4fa9356ee4b08cc7d9bbddb5">More details (Foursquare)</a> </p>]]></description>
        <TimeSpan>
          <begin>2014-02-27T16:35:45-06:00</begin>
          <end>2014-02-27T16:48:09-06:00</end>
        </TimeSpan>
        <styleUrl>#place_Platform</styleUrl>
        <Point>
          <coordinates>-77.00518563613092,38.89803898801969</coordinates>
        </Point>
      </Placemark>
      <Placemark id="1393542230000">
        <name><![CDATA[NTN24]]></name>
        <atom:link href="http://foursquare.com/venue/4ec5b4b38b81dcfdc16568d3"/>
        <description><![CDATA[<p>2/27/14<br/> 5:03 PM to 10:57 PM<br/> 5:54 hours</p> <p>Office<br/> <a href="http://foursquare.com/venue/4ec5b4b38b81dcfdc16568d3">More details (Foursquare)</a> </p>]]></description>
        <TimeSpan>
          <begin>2014-02-27T17:03:51-06:00</begin>
          <end>2014-02-27T22:57:57-06:00</end>
        </TimeSpan>
        <styleUrl>#place_Office</styleUrl>
        <Point>
          <coordinates>-77.032106,38.901567</coordinates>
        </Point>
      </Placemark>
      <Placemark id="1393564442000">
        <name><![CDATA[2440 39th St NW]]></name>
        <atom:link href="http://foursquare.com/venue/520fad0811d2245250b13cd1"/>
        <description><![CDATA[<p>2/27/14<br/> 11:14 PM to 12:00 AM<br/> 45 min</p> <p>Home (private)<br/> <a href="http://foursquare.com/venue/520fad0811d2245250b13cd1">More details (Foursquare)</a> </p>]]></description>
        <TimeSpan>
          <begin>2014-02-27T23:14:03-06:00</begin>
          <end>2014-02-27T23:59:59-06:00</end>
        </TimeSpan>
        <styleUrl>#place_Home (private)</styleUrl>
        <Point>
          <coordinates>-77.07371486668141,38.92592014653639</coordinates>
        </Point>
      </Placemark>
    </Folder>
    <Folder>
      <name><![CDATA[2/28/14]]></name>
      <Placemark id="1393567200000">
        <name><![CDATA[2440 39th St NW]]></name>
        <atom:link href="http://foursquare.com/venue/520fad0811d2245250b13cd1"/>
        <description><![CDATA[<p>2/28/14<br/> 12:00 AM to 4:24 PM<br/> 16:24 hours</p> <p>Home (private)<br/> <a href="http://foursquare.com/venue/520fad0811d2245250b13cd1">More details (Foursquare)</a> </p>]]></description>
        <TimeSpan>
          <begin>2014-02-28T00:00:01-06:00</begin>
          <end>2014-02-28T16:24:09-06:00</end>
        </TimeSpan>
        <styleUrl>#place_Home (private)</styleUrl>
        <Point>
          <coordinates>-77.07371486668141,38.92592014653639</coordinates>
        </Point>
      </Placemark>
      <Placemark id="1393626731000">
        <name><![CDATA[Surfside]]></name>
        <atom:link href="http://foursquare.com/venue/4a02762ef964a52056711fe3"/>
        <description><![CDATA[<p>2/28/14<br/> 4:32 PM to 4:36 PM<br/> 4 min</p> <p>Mexican Restaurant<br/> <a href="http://foursquare.com/venue/4a02762ef964a52056711fe3">More details (Foursquare)</a> </p>]]></description>
        <TimeSpan>
          <begin>2014-02-28T16:32:12-06:00</begin>
          <end>2014-02-28T16:36:19-06:00</end>
        </TimeSpan>
        <styleUrl>#place_Mexican Restaurant</styleUrl>
        <Point>
          <coordinates>-77.072873711586,38.92206976004444</coordinates>
        </Point>
      </Placemark>
      <Placemark id="1393629785000">
        <name><![CDATA[NTN24]]></name>
        <atom:link href="http://foursquare.com/venue/4ec5b4b38b81dcfdc16568d3"/>
        <description><![CDATA[<p>2/28/14<br/> 5:23 PM to 10:17 PM<br/> 4:54 hours</p> <p>Office<br/> <a href="http://foursquare.com/venue/4ec5b4b38b81dcfdc16568d3">More details (Foursquare)</a> </p>]]></description>
        <TimeSpan>
          <begin>2014-02-28T17:23:06-06:00</begin>
          <end>2014-02-28T22:17:14-06:00</end>
        </TimeSpan>
        <styleUrl>#place_Office</styleUrl>
        <Point>
          <coordinates>-77.032106,38.901567</coordinates>
        </Point>
      </Placemark>
      <Placemark id="1393648930000">
        <name><![CDATA[2440 39th St NW]]></name>
        <atom:link href="http://foursquare.com/venue/520fad0811d2245250b13cd1"/>
        <description><![CDATA[<p>2/28/14<br/> 10:42 PM to 12:00 AM<br/> 1:17 hours</p> <p>Home (private)<br/> <a href="http://foursquare.com/venue/520fad0811d2245250b13cd1">More details (Foursquare)</a> </p>]]></description>
        <TimeSpan>
          <begin>2014-02-28T22:42:11-06:00</begin>
          <end>2014-02-28T23:59:59-06:00</end>
        </TimeSpan>
        <styleUrl>#place_Home (private)</styleUrl>
        <Point>
          <coordinates>-77.07371486668141,38.92592014653639</coordinates>
        </Point>
      </Placemark>
    </Folder>
    <gx:Tour>
      <name><![CDATA[Moves tour]]></name>
      <gx:Playlist>
        <gx:FlyTo>
          <gx:duration>0.33</gx:duration>
          <gx:flyToMode>bounce</gx:flyToMode>
          <LookAt>
            <TimeStamp>
              <when>2014-02-01T00:00:00-06:00</when>
            </TimeStamp>
            <longitude>-71.1114458017</longitude>
            <latitude>42.3754311174</latitude>
            <altitude>0.0</altitude>
            <heading>0.0</heading>
            <tilt>45.0</tilt>
            <range>600.0</range>
            <altitudeMode>relativeToGround</altitudeMode>
          </LookAt>
        </gx:FlyTo>
        <gx:FlyTo>
          <gx:duration>8.240097086806683</gx:duration>
          <gx:flyToMode>bounce</gx:flyToMode>
          <LookAt>
            <TimeSpan>
              <begin>2014-02-01T00:00:01-06:00</begin>
              <end>2014-02-01T11:47:16-06:00</end>
            </TimeSpan>
            <longitude>-71.1114458017</longitude>
            <latitude>42.3754311174</latitude>
            <altitude>0.0</altitude>
            <heading>0.0</heading>
            <tilt>45.0</tilt>
            <range>600.0</range>
            <altitudeMode>relativeToGround</altitudeMode>
          </LookAt>
        </gx:FlyTo>
        <gx:FlyTo>
          <gx:duration>0.33</gx:duration>
          <gx:flyToMode>bounce</gx:flyToMode>
          <LookAt>
            <TimeStamp>
              <when>2014-02-01T12:00:36-06:00</when>
            </TimeStamp>
            <longitude>-71.117205</longitude>
            <latitude>42.378716</latitude>
            <altitude>0.0</altitude>
            <heading>0.0</heading>
            <tilt>45.0</tilt>
            <range>600.0</range>
            <altitudeMode>relativeToGround</altitudeMode>
          </LookAt>
        </gx:FlyTo>
        <gx:FlyTo>
          <gx:duration>3.1084401232772683</gx:duration>
          <gx:flyToMode>bounce</gx:flyToMode>
          <LookAt>
            <TimeSpan>
              <begin>2014-02-01T12:00:37-06:00</begin>
              <end>2014-02-01T13:41:14-06:00</end>
            </TimeSpan>
            <longitude>-71.117205</longitude>
            <latitude>42.378716</latitude>
            <altitude>0.0</altitude>
            <heading>0.0</heading>
            <tilt>45.0</tilt>
            <range>600.0</range>
            <altitudeMode>relativeToGround</altitudeMode>
          </LookAt>
        </gx:FlyTo>
        <gx:FlyTo>
          <gx:duration>0.33</gx:duration>
          <gx:flyToMode>bounce</gx:flyToMode>
          <LookAt>
            <TimeStamp>
              <when>2014-02-01T13:53:57-06:00</when>
            </TimeStamp>
            <longitude>-71.120418</longitude>
            <latitude>42.373343</latitude>
            <altitude>0.0</altitude>
            <heading>0.0</heading>
            <tilt>45.0</tilt>
            <range>600.0</range>
            <altitudeMode>relativeToGround</altitudeMode>
          </LookAt>
        </gx:FlyTo>
        <gx:FlyTo>
          <gx:duration>2.6707302372197756</gx:duration>
          <gx:flyToMode>bounce</gx:flyToMode>
          <LookAt>
            <TimeSpan>
              <begin>2014-02-01T13:53:58-06:00</begin>
              <end>2014-02-01T15:08:14-06:00</end>
            </TimeSpan>
            <longitude>-71.120418</longitude>
            <latitude>42.373343</latitude>
            <altitude>0.0</altitude>
            <heading>0.0</heading>
            <tilt>45.0</tilt>
            <range>600.0</range>
            <altitudeMode>relativeToGround</altitudeMode>
          </LookAt>
        </gx:FlyTo>
        <gx:FlyTo>
          <gx:duration>0.33</gx:duration>
          <gx:flyToMode>bounce</gx:flyToMode>
          <LookAt>
            <TimeStamp>
              <when>2014-02-01T15:25:22-06:00</when>
