<?xml version="1.0" encoding="UTF-8"?><kml xmlns="http://www.opengis.net/kml/2.2" xmlns:gx="http://www.google.com/kml/ext/2.2" xmlns:atom="http://www.w3.org/2005/Atom" xmlns:xal="urn:oasis:names:tc:ciq:xsdschema:xAL:2.0" xmlns:xsi="http://www.w3.org/2001/XMLSchema-instance">
  <Document>
    <atom:link href="http://www.moves-app.com"/>
    <description><![CDATA[<p align="center"><a href="http://www.moves-app.com"> <img src="http://www.moves-app.com/assets/moves.png"/> </a></p> <p align="center">Moves Storyline</p>]]></description>
    <Style id="place_Gym">
      <IconStyle>
        <scale>1.0</scale>
        <heading>0.0</heading>
        <Icon>
          <href>https://ss1.4sqi.net/img/categories/building/gym.png</href>
          <refreshInterval>0.0</refreshInterval>
          <viewRefreshTime>0.0</viewRefreshTime>
          <viewBoundScale>0.0</viewBoundScale>
        </Icon>
      </IconStyle>
    </Style>
    <Style id="place_Sushi Restaurant">
      <IconStyle>
        <scale>1.0</scale>
        <heading>0.0</heading>
        <Icon>
          <href>https://ss1.4sqi.net/img/categories/food/sushi.png</href>
          <refreshInterval>0.0</refreshInterval>
          <viewRefreshTime>0.0</viewRefreshTime>
          <viewBoundScale>0.0</viewBoundScale>
        </Icon>
      </IconStyle>
    </Style>
    <Style id="place_Furniture / Home Store">
      <IconStyle>
        <scale>1.0</scale>
        <heading>0.0</heading>
        <Icon>
          <href>https://ss1.4sqi.net/img/categories/shops/furniture.png</href>
          <refreshInterval>0.0</refreshInterval>
          <viewRefreshTime>0.0</viewRefreshTime>
          <viewBoundScale>0.0</viewBoundScale>
        </Icon>
      </IconStyle>
    </Style>
    <Style id="place_Home (private)">
      <IconStyle>
        <scale>1.0</scale>
        <heading>0.0</heading>
        <Icon>
          <href>https://ss1.4sqi.net/img/categories/building/home.png</href>
          <refreshInterval>0.0</refreshInterval>
          <viewRefreshTime>0.0</viewRefreshTime>
          <viewBoundScale>0.0</viewBoundScale>
        </Icon>
      </IconStyle>
    </Style>
    <Style id="place_French Restaurant">
      <IconStyle>
        <scale>1.0</scale>
        <heading>0.0</heading>
        <Icon>
          <href>https://ss1.4sqi.net/img/categories/food/french.png</href>
          <refreshInterval>0.0</refreshInterval>
          <viewRefreshTime>0.0</viewRefreshTime>
          <viewBoundScale>0.0</viewBoundScale>
        </Icon>
      </IconStyle>
    </Style>
    <Style id="place_Moving Target">
      <IconStyle>
        <scale>1.0</scale>
        <heading>0.0</heading>
        <Icon>
          <href>https://ss1.4sqi.net/img/categories/travel/default.png</href>
          <refreshInterval>0.0</refreshInterval>
          <viewRefreshTime>0.0</viewRefreshTime>
          <viewBoundScale>0.0</viewBoundScale>
        </Icon>
      </IconStyle>
    </Style>
    <Style id="place_Liquor Store">
      <IconStyle>
        <scale>1.0</scale>
        <heading>0.0</heading>
        <Icon>
          <href>https://ss1.4sqi.net/img/categories/shops/default.png</href>
          <refreshInterval>0.0</refreshInterval>
          <viewRefreshTime>0.0</viewRefreshTime>
          <viewBoundScale>0.0</viewBoundScale>
        </Icon>
      </IconStyle>
    </Style>
    <Style id="place_Food Court">
      <IconStyle>
        <scale>1.0</scale>
        <heading>0.0</heading>
        <Icon>
          <href>https://ss1.4sqi.net/img/categories/shops/food_foodcourt.png</href>
          <refreshInterval>0.0</refreshInterval>
          <viewRefreshTime>0.0</viewRefreshTime>
          <viewBoundScale>0.0</viewBoundScale>
        </Icon>
      </IconStyle>
    </Style>
    <Style id="place_Tapas Restaurant">
      <IconStyle>
        <scale>1.0</scale>
        <heading>0.0</heading>
        <Icon>
          <href>https://ss1.4sqi.net/img/categories/food/default.png</href>
          <refreshInterval>0.0</refreshInterval>
          <viewRefreshTime>0.0</viewRefreshTime>
          <viewBoundScale>0.0</viewBoundScale>
        </Icon>
      </IconStyle>
    </Style>
    <Style id="place_Mexican Restaurant">
      <IconStyle>
        <scale>1.0</scale>
        <heading>0.0</heading>
        <Icon>
          <href>https://ss1.4sqi.net/img/categories/food/mexican.png</href>
          <refreshInterval>0.0</refreshInterval>
          <viewRefreshTime>0.0</viewRefreshTime>
          <viewBoundScale>0.0</viewBoundScale>
        </Icon>
      </IconStyle>
    </Style>
    <Style id="place_Community Center">
      <IconStyle>
        <scale>1.0</scale>
        <heading>0.0</heading>
        <Icon>
          <href>https://ss1.4sqi.net/img/categories/building/default.png</href>
          <refreshInterval>0.0</refreshInterval>
          <viewRefreshTime>0.0</viewRefreshTime>
          <viewBoundScale>0.0</viewBoundScale>
        </Icon>
      </IconStyle>
    </Style>
    <Style id="place_Resort">
      <IconStyle>
        <scale>1.0</scale>
        <heading>0.0</heading>
        <Icon>
          <href>https://ss1.4sqi.net/img/categories/travel/resort.png</href>
          <refreshInterval>0.0</refreshInterval>
          <viewRefreshTime>0.0</viewRefreshTime>
          <viewBoundScale>0.0</viewBoundScale>
        </Icon>
      </IconStyle>
    </Style>
    <Style id="place_Paper / Office Supplies Store">
      <IconStyle>
        <scale>1.0</scale>
        <heading>0.0</heading>
        <Icon>
          <href>https://ss1.4sqi.net/img/categories/shops/papergoods.png</href>
          <refreshInterval>0.0</refreshInterval>
          <viewRefreshTime>0.0</viewRefreshTime>
          <viewBoundScale>0.0</viewBoundScale>
        </Icon>
      </IconStyle>
    </Style>
    <Style id="place_Spiritual Center">
      <IconStyle>
        <scale>1.0</scale>
        <heading>0.0</heading>
        <Icon>
          <href>https://ss1.4sqi.net/img/categories/building/religious.png</href>
          <refreshInterval>0.0</refreshInterval>
          <viewRefreshTime>0.0</viewRefreshTime>
          <viewBoundScale>0.0</viewBoundScale>
        </Icon>
      </IconStyle>
    </Style>
    <Style id="place_Building">
      <IconStyle>
        <scale>1.0</scale>
        <heading>0.0</heading>
        <Icon>
          <href>https://ss1.4sqi.net/img/categories/building/default.png</href>
          <refreshInterval>0.0</refreshInterval>
          <viewRefreshTime>0.0</viewRefreshTime>
          <viewBoundScale>0.0</viewBoundScale>
        </Icon>
      </IconStyle>
    </Style>
    <Style id="place_Hotel">
      <IconStyle>
        <scale>1.0</scale>
        <heading>0.0</heading>
        <Icon>
          <href>https://ss1.4sqi.net/img/categories/travel/hotel.png</href>
          <refreshInterval>0.0</refreshInterval>
          <viewRefreshTime>0.0</viewRefreshTime>
          <viewBoundScale>0.0</viewBoundScale>
        </Icon>
      </IconStyle>
    </Style>
    <Style id="place_College Residence Hall">
      <IconStyle>
        <scale>1.0</scale>
        <heading>0.0</heading>
        <Icon>
          <href>https://ss1.4sqi.net/img/categories/education/default.png</href>
          <refreshInterval>0.0</refreshInterval>
          <viewRefreshTime>0.0</viewRefreshTime>
          <viewBoundScale>0.0</viewBoundScale>
        </Icon>
      </IconStyle>
    </Style>
    <Style id="place_Garden">
      <IconStyle>
        <scale>1.0</scale>
        <heading>0.0</heading>
        <Icon>
          <href>https://ss1.4sqi.net/img/categories/parks_outdoors/garden.png</href>
          <refreshInterval>0.0</refreshInterval>
          <viewRefreshTime>0.0</viewRefreshTime>
          <viewBoundScale>0.0</viewBoundScale>
        </Icon>
      </IconStyle>
    </Style>
    <Style id="place_school">
      <IconStyle>
        <scale>1.0</scale>
        <heading>0.0</heading>
        <Icon>
          <href>http://ss1.4sqi.net/img/categories/building/school.png</href>
          <refreshInterval>0.0</refreshInterval>
          <viewRefreshTime>0.0</viewRefreshTime>
          <viewBoundScale>0.0</viewBoundScale>
        </Icon>
      </IconStyle>
    </Style>
    <Style id="place_Beach">
      <IconStyle>
        <scale>1.0</scale>
        <heading>0.0</heading>
        <Icon>
          <href>https://ss1.4sqi.net/img/categories/parks_outdoors/beach.png</href>
          <refreshInterval>0.0</refreshInterval>
          <viewRefreshTime>0.0</viewRefreshTime>
          <viewBoundScale>0.0</viewBoundScale>
        </Icon>
      </IconStyle>
    </Style>
    <Style id="place_Frozen Yogurt">
      <IconStyle>
        <scale>1.0</scale>
        <heading>0.0</heading>
        <Icon>
          <href>https://ss1.4sqi.net/img/categories/food/default.png</href>
          <refreshInterval>0.0</refreshInterval>
          <viewRefreshTime>0.0</viewRefreshTime>
          <viewBoundScale>0.0</viewBoundScale>
        </Icon>
      </IconStyle>
    </Style>
    <Style id="place_Arepa Restaurant">
      <IconStyle>
        <scale>1.0</scale>
        <heading>0.0</heading>
        <Icon>
          <href>https://ss1.4sqi.net/img/categories/food/default.png</href>
          <refreshInterval>0.0</refreshInterval>
          <viewRefreshTime>0.0</viewRefreshTime>
          <viewBoundScale>0.0</viewBoundScale>
        </Icon>
      </IconStyle>
    </Style>
    <Style id="place_Electronics Store">
      <IconStyle>
        <scale>1.0</scale>
        <heading>0.0</heading>
        <Icon>
          <href>https://ss1.4sqi.net/img/categories/shops/technology.png</href>
          <refreshInterval>0.0</refreshInterval>
          <viewRefreshTime>0.0</viewRefreshTime>
          <viewBoundScale>0.0</viewBoundScale>
        </Icon>
      </IconStyle>
    </Style>
    <Style id="place_Ski Area">
      <IconStyle>
        <scale>1.0</scale>
        <heading>0.0</heading>
        <Icon>
          <href>https://ss1.4sqi.net/img/categories/parks_outdoors/ski_snowboard.png</href>
          <refreshInterval>0.0</refreshInterval>
          <viewRefreshTime>0.0</viewRefreshTime>
          <viewBoundScale>0.0</viewBoundScale>
        </Icon>
      </IconStyle>
    </Style>
    <Style id="place_Warehouse Store">
      <IconStyle>
        <scale>1.0</scale>
        <heading>0.0</heading>
        <Icon>
          <href>https://ss1.4sqi.net/img/categories/shops/default.png</href>
          <refreshInterval>0.0</refreshInterval>
          <viewRefreshTime>0.0</viewRefreshTime>
          <viewBoundScale>0.0</viewBoundScale>
        </Icon>
      </IconStyle>
    </Style>
    <Style id="place_Monument / Landmark">
      <IconStyle>
        <scale>1.0</scale>
        <heading>0.0</heading>
        <Icon>
          <href>https://ss1.4sqi.net/img/categories/building/default.png</href>
          <refreshInterval>0.0</refreshInterval>
          <viewRefreshTime>0.0</viewRefreshTime>
          <viewBoundScale>0.0</viewBoundScale>
        </Icon>
      </IconStyle>
    </Style>
    <Style id="place_College Technology Building">
      <IconStyle>
        <scale>1.0</scale>
        <heading>0.0</heading>
        <Icon>
          <href>https://ss1.4sqi.net/img/categories/education/default.png</href>
          <refreshInterval>0.0</refreshInterval>
          <viewRefreshTime>0.0</viewRefreshTime>
          <viewBoundScale>0.0</viewBoundScale>
        </Icon>
      </IconStyle>
    </Style>
    <Style id="place_Aquarium">
      <IconStyle>
        <scale>1.0</scale>
        <heading>0.0</heading>
        <Icon>
          <href>https://ss1.4sqi.net/img/categories/arts_entertainment/default.png</href>
          <refreshInterval>0.0</refreshInterval>
          <viewRefreshTime>0.0</viewRefreshTime>
          <viewBoundScale>0.0</viewBoundScale>
        </Icon>
      </IconStyle>
    </Style>
    <Style id="place_Plaza">
      <IconStyle>
        <scale>1.0</scale>
        <heading>0.0</heading>
        <Icon>
          <href>https://ss1.4sqi.net/img/categories/parks_outdoors/default.png</href>
          <refreshInterval>0.0</refreshInterval>
          <viewRefreshTime>0.0</viewRefreshTime>
          <viewBoundScale>0.0</viewBoundScale>
        </Icon>
      </IconStyle>
    </Style>
    <Style id="place_Harbor / Marina">
      <IconStyle>
        <scale>1.0</scale>
        <heading>0.0</heading>
        <Icon>
          <href>https://ss1.4sqi.net/img/categories/parks_outdoors/harbor.png</href>
          <refreshInterval>0.0</refreshInterval>
          <viewRefreshTime>0.0</viewRefreshTime>
          <viewBoundScale>0.0</viewBoundScale>
        </Icon>
      </IconStyle>
    </Style>
    <Style id="place_Supermarket">
      <IconStyle>
        <scale>1.0</scale>
        <heading>0.0</heading>
        <Icon>
          <href>https://ss1.4sqi.net/img/categories/shops/food_grocery.png</href>
          <refreshInterval>0.0</refreshInterval>
          <viewRefreshTime>0.0</viewRefreshTime>
          <viewBoundScale>0.0</viewBoundScale>
        </Icon>
      </IconStyle>
    </Style>
    <Style id="place_Pub">
      <IconStyle>
        <scale>1.0</scale>
        <heading>0.0</heading>
        <Icon>
          <href>https://ss1.4sqi.net/img/categories/nightlife/pub.png</href>
          <refreshInterval>0.0</refreshInterval>
          <viewRefreshTime>0.0</viewRefreshTime>
          <viewBoundScale>0.0</viewBoundScale>
        </Icon>
      </IconStyle>
    </Style>
    <Style id="place_Cemetery">
      <IconStyle>
        <scale>1.0</scale>
        <heading>0.0</heading>
        <Icon>
          <href>https://ss1.4sqi.net/img/categories/parks_outdoors/cemetery.png</href>
          <refreshInterval>0.0</refreshInterval>
          <viewRefreshTime>0.0</viewRefreshTime>
          <viewBoundScale>0.0</viewBoundScale>
        </Icon>
      </IconStyle>
    </Style>
    <Style id="place_Diner">
      <IconStyle>
        <scale>1.0</scale>
        <heading>0.0</heading>
        <Icon>
          <href>https://ss1.4sqi.net/img/categories/food/default.png</href>
          <refreshInterval>0.0</refreshInterval>
          <viewRefreshTime>0.0</viewRefreshTime>
          <viewBoundScale>0.0</viewBoundScale>
        </Icon>
      </IconStyle>
    </Style>
    <Style id="place_Clothing Store">
      <IconStyle>
        <scale>1.0</scale>
        <heading>0.0</heading>
        <Icon>
          <href>https://ss1.4sqi.net/img/categories/shops/apparel.png</href>
          <refreshInterval>0.0</refreshInterval>
          <viewRefreshTime>0.0</viewRefreshTime>
          <viewBoundScale>0.0</viewBoundScale>
        </Icon>
      </IconStyle>
    </Style>
    <Style id="place_Latin American Restaurant">
      <IconStyle>
        <scale>1.0</scale>
        <heading>0.0</heading>
        <Icon>
          <href>https://ss1.4sqi.net/img/categories/food/default.png</href>
          <refreshInterval>0.0</refreshInterval>
          <viewRefreshTime>0.0</viewRefreshTime>
          <viewBoundScale>0.0</viewBoundScale>
        </Icon>
      </IconStyle>
    </Style>
    <Style id="place_Coffee Shop">
      <IconStyle>
        <scale>1.0</scale>
        <heading>0.0</heading>
        <Icon>
          <href>https://ss1.4sqi.net/img/categories/food/coffeeshop.png</href>
          <refreshInterval>0.0</refreshInterval>
          <viewRefreshTime>0.0</viewRefreshTime>
          <viewBoundScale>0.0</viewBoundScale>
        </Icon>
      </IconStyle>
    </Style>
    <Style id="place_Historic Site">
      <IconStyle>
        <scale>1.0</scale>
        <heading>0.0</heading>
        <Icon>
          <href>https://ss1.4sqi.net/img/categories/arts_entertainment/museum.png</href>
          <refreshInterval>0.0</refreshInterval>
          <viewRefreshTime>0.0</viewRefreshTime>
          <viewBoundScale>0.0</viewBoundScale>
        </Icon>
      </IconStyle>
    </Style>
    <Style id="place_Gas Station / Garage">
      <IconStyle>
        <scale>1.0</scale>
        <heading>0.0</heading>
        <Icon>
          <href>https://ss1.4sqi.net/img/categories/shops/gas.png</href>
          <refreshInterval>0.0</refreshInterval>
          <viewRefreshTime>0.0</viewRefreshTime>
          <viewBoundScale>0.0</viewBoundScale>
        </Icon>
      </IconStyle>
    </Style>
    <Style id="place_Performing Arts Venue">
      <IconStyle>
        <scale>1.0</scale>
        <heading>0.0</heading>
        <Icon>
          <href>https://ss1.4sqi.net/img/categories/arts_entertainment/default.png</href>
          <refreshInterval>0.0</refreshInterval>
          <viewRefreshTime>0.0</viewRefreshTime>
          <viewBoundScale>0.0</viewBoundScale>
        </Icon>
      </IconStyle>
    </Style>
    <Style id="place_Winery">
      <IconStyle>
        <scale>1.0</scale>
        <heading>0.0</heading>
        <Icon>
          <href>https://ss1.4sqi.net/img/categories/food/winery.png</href>
          <refreshInterval>0.0</refreshInterval>
          <viewRefreshTime>0.0</viewRefreshTime>
          <viewBoundScale>0.0</viewBoundScale>
        </Icon>
      </IconStyle>
    </Style>
    <Style id="place_Train Station">
      <IconStyle>
        <scale>1.0</scale>
        <heading>0.0</heading>
        <Icon>
          <href>https://ss1.4sqi.net/img/categories/travel/trainstation.png</href>
          <refreshInterval>0.0</refreshInterval>
          <viewRefreshTime>0.0</viewRefreshTime>
          <viewBoundScale>0.0</viewBoundScale>
        </Icon>
      </IconStyle>
    </Style>
    <Style id="place_Chinese Restaurant">
      <IconStyle>
        <scale>1.0</scale>
        <heading>0.0</heading>
        <Icon>
          <href>https://ss1.4sqi.net/img/categories/food/chinese.png</href>
          <refreshInterval>0.0</refreshInterval>
          <viewRefreshTime>0.0</viewRefreshTime>
          <viewBoundScale>0.0</viewBoundScale>
        </Icon>
      </IconStyle>
    </Style>
    <Style id="place_Mediterranean Restaurant">
      <IconStyle>
        <scale>1.0</scale>
        <heading>0.0</heading>
        <Icon>
          <href>https://ss1.4sqi.net/img/categories/food/default.png</href>
          <refreshInterval>0.0</refreshInterval>
          <viewRefreshTime>0.0</viewRefreshTime>
          <viewBoundScale>0.0</viewBoundScale>
        </Icon>
      </IconStyle>
    </Style>
    <Style id="place_American Restaurant">
      <IconStyle>
        <scale>1.0</scale>
        <heading>0.0</heading>
        <Icon>
          <href>https://ss1.4sqi.net/img/categories/food/default.png</href>
          <refreshInterval>0.0</refreshInterval>
          <viewRefreshTime>0.0</viewRefreshTime>
          <viewBoundScale>0.0</viewBoundScale>
        </Icon>
      </IconStyle>
    </Style>
    <Style id="place_Mall">
      <IconStyle>
        <scale>1.0</scale>
        <heading>0.0</heading>
        <Icon>
          <href>https://ss1.4sqi.net/img/categories/shops/default.png</href>
          <refreshInterval>0.0</refreshInterval>
          <viewRefreshTime>0.0</viewRefreshTime>
          <viewBoundScale>0.0</viewBoundScale>
        </Icon>
      </IconStyle>
    </Style>
    <Style id="place_Sandwich Place">
      <IconStyle>
        <scale>1.0</scale>
        <heading>0.0</heading>
        <Icon>
          <href>https://ss1.4sqi.net/img/categories/food/sandwiches.png</href>
          <refreshInterval>0.0</refreshInterval>
          <viewRefreshTime>0.0</viewRefreshTime>
          <viewBoundScale>0.0</viewBoundScale>
        </Icon>
      </IconStyle>
    </Style>
    <Style id="place_College Administrative Building">
      <IconStyle>
        <scale>1.0</scale>
        <heading>0.0</heading>
        <Icon>
          <href>https://ss1.4sqi.net/img/categories/education/default.png</href>
          <refreshInterval>0.0</refreshInterval>
          <viewRefreshTime>0.0</viewRefreshTime>
          <viewBoundScale>0.0</viewBoundScale>
        </Icon>
      </IconStyle>
    </Style>
    <Style id="place_Bank">
      <IconStyle>
        <scale>1.0</scale>
        <heading>0.0</heading>
        <Icon>
          <href>https://ss1.4sqi.net/img/categories/shops/financial.png</href>
          <refreshInterval>0.0</refreshInterval>
          <viewRefreshTime>0.0</viewRefreshTime>
          <viewBoundScale>0.0</viewBoundScale>
        </Icon>
      </IconStyle>
    </Style>
    <Style id="place_Women's Store">
      <IconStyle>
        <scale>1.0</scale>
        <heading>0.0</heading>
        <Icon>
          <href>https://ss1.4sqi.net/img/categories/shops/apparel_women.png</href>
          <refreshInterval>0.0</refreshInterval>
          <viewRefreshTime>0.0</viewRefreshTime>
          <viewBoundScale>0.0</viewBoundScale>
        </Icon>
      </IconStyle>
    </Style>
    <Style id="place_Neighborhood">
      <IconStyle>
        <scale>1.0</scale>
        <heading>0.0</heading>
        <Icon>
          <href>https://ss1.4sqi.net/img/categories/parks_outdoors/default.png</href>
          <refreshInterval>0.0</refreshInterval>
          <viewRefreshTime>0.0</viewRefreshTime>
          <viewBoundScale>0.0</viewBoundScale>
        </Icon>
      </IconStyle>
    </Style>
    <Style id="place_work">
      <IconStyle>
        <scale>1.0</scale>
        <heading>0.0</heading>
        <Icon>
          <href>http://ss1.4sqi.net/img/categories/building/default.png</href>
          <refreshInterval>0.0</refreshInterval>
          <viewRefreshTime>0.0</viewRefreshTime>
          <viewBoundScale>0.0</viewBoundScale>
        </Icon>
      </IconStyle>
    </Style>
    <Style id="place_Library">
      <IconStyle>
        <scale>1.0</scale>
        <heading>0.0</heading>
        <Icon>
          <href>https://ss1.4sqi.net/img/categories/building/library.png</href>
          <refreshInterval>0.0</refreshInterval>
          <viewRefreshTime>0.0</viewRefreshTime>
          <viewBoundScale>0.0</viewBoundScale>
        </Icon>
      </IconStyle>
    </Style>
    <Style id="place_Ice Cream Shop">
      <IconStyle>
        <scale>1.0</scale>
        <heading>0.0</heading>
        <Icon>
          <href>https://ss1.4sqi.net/img/categories/food/icecream.png</href>
          <refreshInterval>0.0</refreshInterval>
          <viewRefreshTime>0.0</viewRefreshTime>
          <viewBoundScale>0.0</viewBoundScale>
        </Icon>
      </IconStyle>
    </Style>
    <Style id="place_History Museum">
      <IconStyle>
        <scale>1.0</scale>
        <heading>0.0</heading>
        <Icon>
          <href>https://ss1.4sqi.net/img/categories/arts_entertainment/museum.png</href>
          <refreshInterval>0.0</refreshInterval>
          <viewRefreshTime>0.0</viewRefreshTime>
          <viewBoundScale>0.0</viewBoundScale>
        </Icon>
      </IconStyle>
    </Style>
    <Style id="place_user">
      <IconStyle>
        <scale>1.0</scale>
        <heading>0.0</heading>
        <Icon>
          <href>http://maps.google.com/mapfiles/marker_white.png</href>
          <refreshInterval>0.0</refreshInterval>
          <viewRefreshTime>0.0</viewRefreshTime>
          <viewBoundScale>0.0</viewBoundScale>
        </Icon>
      </IconStyle>
    </Style>
    <Style id="place_College Cafeteria">
      <IconStyle>
        <scale>1.0</scale>
        <heading>0.0</heading>
        <Icon>
          <href>https://ss1.4sqi.net/img/categories/education/cafeteria.png</href>
          <refreshInterval>0.0</refreshInterval>
          <viewRefreshTime>0.0</viewRefreshTime>
          <viewBoundScale>0.0</viewBoundScale>
        </Icon>
      </IconStyle>
    </Style>
    <Style id="place_Rental Car Location">
      <IconStyle>
        <scale>1.0</scale>
        <heading>0.0</heading>
        <Icon>
          <href>https://ss1.4sqi.net/img/categories/travel/airport_rentalcar.png</href>
          <refreshInterval>0.0</refreshInterval>
          <viewRefreshTime>0.0</viewRefreshTime>
          <viewBoundScale>0.0</viewBoundScale>
        </Icon>
      </IconStyle>
    </Style>
    <Style id="place_Seafood Restaurant">
      <IconStyle>
        <scale>1.0</scale>
        <heading>0.0</heading>
        <Icon>
          <href>https://ss1.4sqi.net/img/categories/food/seafood.png</href>
          <refreshInterval>0.0</refreshInterval>
          <viewRefreshTime>0.0</viewRefreshTime>
          <viewBoundScale>0.0</viewBoundScale>
        </Icon>
      </IconStyle>
    </Style>
    <Style id="place_Brazilian Restaurant">
      <IconStyle>
        <scale>1.0</scale>
        <heading>0.0</heading>
        <Icon>
          <href>https://ss1.4sqi.net/img/categories/food/brazilian.png</href>
          <refreshInterval>0.0</refreshInterval>
          <viewRefreshTime>0.0</viewRefreshTime>
          <viewBoundScale>0.0</viewBoundScale>
        </Icon>
      </IconStyle>
    </Style>
    <Style id="place_College Lab">
      <IconStyle>
        <scale>1.0</scale>
        <heading>0.0</heading>
        <Icon>
          <href>https://ss1.4sqi.net/img/categories/education/default.png</href>
          <refreshInterval>0.0</refreshInterval>
          <viewRefreshTime>0.0</viewRefreshTime>
          <viewBoundScale>0.0</viewBoundScale>
        </Icon>
      </IconStyle>
    </Style>
    <Style id="place_Nightclub">
      <IconStyle>
        <scale>1.0</scale>
        <heading>0.0</heading>
        <Icon>
          <href>https://ss1.4sqi.net/img/categories/nightlife/danceparty.png</href>
          <refreshInterval>0.0</refreshInterval>
          <viewRefreshTime>0.0</viewRefreshTime>
          <viewBoundScale>0.0</viewBoundScale>
        </Icon>
      </IconStyle>
    </Style>
    <Style id="place_Miscellaneous Shop">
      <IconStyle>
        <scale>1.0</scale>
        <heading>0.0</heading>
        <Icon>
          <href>https://ss1.4sqi.net/img/categories/shops/default.png</href>
          <refreshInterval>0.0</refreshInterval>
          <viewRefreshTime>0.0</viewRefreshTime>
          <viewBoundScale>0.0</viewBoundScale>
        </Icon>
      </IconStyle>
    </Style>
    <Style id="place_Deli / Bodega">
      <IconStyle>
        <scale>1.0</scale>
        <heading>0.0</heading>
        <Icon>
          <href>https://ss1.4sqi.net/img/categories/food/deli.png</href>
          <refreshInterval>0.0</refreshInterval>
          <viewRefreshTime>0.0</viewRefreshTime>
          <viewBoundScale>0.0</viewBoundScale>
        </Icon>
      </IconStyle>
    </Style>
    <Style id="place_High School">
      <IconStyle>
        <scale>1.0</scale>
        <heading>0.0</heading>
        <Icon>
          <href>https://ss1.4sqi.net/img/categories/building/school.png</href>
          <refreshInterval>0.0</refreshInterval>
          <viewRefreshTime>0.0</viewRefreshTime>
          <viewBoundScale>0.0</viewBoundScale>
        </Icon>
      </IconStyle>
    </Style>
    <Style id="place_Gastropub">
      <IconStyle>
        <scale>1.0</scale>
        <heading>0.0</heading>
        <Icon>
          <href>https://ss1.4sqi.net/img/categories/food/default.png</href>
          <refreshInterval>0.0</refreshInterval>
          <viewRefreshTime>0.0</viewRefreshTime>
          <viewBoundScale>0.0</viewBoundScale>
        </Icon>
      </IconStyle>
    </Style>
    <Style id="place_Hot Dog Joint">
      <IconStyle>
        <scale>1.0</scale>
        <heading>0.0</heading>
        <Icon>
          <href>https://ss1.4sqi.net/img/categories/food/hotdog.png</href>
          <refreshInterval>0.0</refreshInterval>
          <viewRefreshTime>0.0</viewRefreshTime>
          <viewBoundScale>0.0</viewBoundScale>
        </Icon>
      </IconStyle>
    </Style>
    <Style id="place_Taco Place">
      <IconStyle>
        <scale>1.0</scale>
        <heading>0.0</heading>
        <Icon>
          <href>https://ss1.4sqi.net/img/categories/food/tacos.png</href>
          <refreshInterval>0.0</refreshInterval>
          <viewRefreshTime>0.0</viewRefreshTime>
          <viewBoundScale>0.0</viewBoundScale>
        </Icon>
      </IconStyle>
    </Style>
    <Style id="place_Caribbean Restaurant">
      <IconStyle>
        <scale>1.0</scale>
        <heading>0.0</heading>
        <Icon>
          <href>https://ss1.4sqi.net/img/categories/food/default.png</href>
          <refreshInterval>0.0</refreshInterval>
          <viewRefreshTime>0.0</viewRefreshTime>
          <viewBoundScale>0.0</viewBoundScale>
        </Icon>
      </IconStyle>
    </Style>
    <Style id="place_College Academic Building">
      <IconStyle>
        <scale>1.0</scale>
        <heading>0.0</heading>
        <Icon>
          <href>https://ss1.4sqi.net/img/categories/education/default.png</href>
          <refreshInterval>0.0</refreshInterval>
          <viewRefreshTime>0.0</viewRefreshTime>
          <viewBoundScale>0.0</viewBoundScale>
        </Icon>
      </IconStyle>
    </Style>
    <Style id="place_Italian Restaurant">
      <IconStyle>
        <scale>1.0</scale>
        <heading>0.0</heading>
        <Icon>
          <href>https://ss1.4sqi.net/img/categories/food/italian.png</href>
          <refreshInterval>0.0</refreshInterval>
          <viewRefreshTime>0.0</viewRefreshTime>
          <viewBoundScale>0.0</viewBoundScale>
        </Icon>
      </IconStyle>
    </Style>
    <Style id="place_Fish Market">
      <IconStyle>
        <scale>1.0</scale>
        <heading>0.0</heading>
        <Icon>
          <href>https://ss1.4sqi.net/img/categories/shops/fish_market.png</href>
          <refreshInterval>0.0</refreshInterval>
          <viewRefreshTime>0.0</viewRefreshTime>
          <viewBoundScale>0.0</viewBoundScale>
        </Icon>
      </IconStyle>
    </Style>
    <Style id="place_Breakfast Spot">
      <IconStyle>
        <scale>1.0</scale>
        <heading>0.0</heading>
        <Icon>
          <href>https://ss1.4sqi.net/img/categories/food/default.png</href>
          <refreshInterval>0.0</refreshInterval>
          <viewRefreshTime>0.0</viewRefreshTime>
          <viewBoundScale>0.0</viewBoundScale>
        </Icon>
      </IconStyle>
    </Style>
    <Style id="place_Platform">
      <IconStyle>
        <scale>1.0</scale>
        <heading>0.0</heading>
        <Icon>
          <href>https://ss1.4sqi.net/img/categories/travel/trainstation.png</href>
          <refreshInterval>0.0</refreshInterval>
          <viewRefreshTime>0.0</viewRefreshTime>
          <viewBoundScale>0.0</viewBoundScale>
        </Icon>
      </IconStyle>
    </Style>
    <Style id="place_Salon / Barbershop">
      <IconStyle>
        <scale>1.0</scale>
        <heading>0.0</heading>
        <Icon>
          <href>https://ss1.4sqi.net/img/categories/shops/salon_barber.png</href>
          <refreshInterval>0.0</refreshInterval>
          <viewRefreshTime>0.0</viewRefreshTime>
          <viewBoundScale>0.0</viewBoundScale>
        </Icon>
      </IconStyle>
    </Style>
    <Style id="place_Food">
      <IconStyle>
        <scale>1.0</scale>
        <heading>0.0</heading>
        <Icon>
          <href>https://ss1.4sqi.net/img/categories/food/default.png</href>
          <refreshInterval>0.0</refreshInterval>
          <viewRefreshTime>0.0</viewRefreshTime>
          <viewBoundScale>0.0</viewBoundScale>
        </Icon>
      </IconStyle>
    </Style>
    <Style id="place_Flea Market">
      <IconStyle>
        <scale>1.0</scale>
        <heading>0.0</heading>
        <Icon>
          <href>https://ss1.4sqi.net/img/categories/shops/default.png</href>
          <refreshInterval>0.0</refreshInterval>
          <viewRefreshTime>0.0</viewRefreshTime>
          <viewBoundScale>0.0</viewBoundScale>
        </Icon>
      </IconStyle>
    </Style>
    <Style id="place_Multiplex">
      <IconStyle>
        <scale>1.0</scale>
        <heading>0.0</heading>
        <Icon>
          <href>https://ss1.4sqi.net/img/categories/arts_entertainment/movietheater.png</href>
          <refreshInterval>0.0</refreshInterval>
          <viewRefreshTime>0.0</viewRefreshTime>
          <viewBoundScale>0.0</viewBoundScale>
        </Icon>
      </IconStyle>
    </Style>
    <Style id="place_College Communications Building">
      <IconStyle>
        <scale>1.0</scale>
        <heading>0.0</heading>
        <Icon>
          <href>https://ss1.4sqi.net/img/categories/education/default.png</href>
          <refreshInterval>0.0</refreshInterval>
          <viewRefreshTime>0.0</viewRefreshTime>
          <viewBoundScale>0.0</viewBoundScale>
        </Icon>
      </IconStyle>
    </Style>
    <Style id="place_Jazz Club">
      <IconStyle>
        <scale>1.0</scale>
        <heading>0.0</heading>
        <Icon>
          <href>https://ss1.4sqi.net/img/categories/arts_entertainment/musicvenue.png</href>
          <refreshInterval>0.0</refreshInterval>
          <viewRefreshTime>0.0</viewRefreshTime>
          <viewBoundScale>0.0</viewBoundScale>
        </Icon>
      </IconStyle>
    </Style>
    <Style id="place_foursquare">
      <IconStyle>
        <scale>1.0</scale>
        <heading>0.0</heading>
        <Icon>
          <href>http://maps.google.com/mapfiles/marker_white.png</href>
          <refreshInterval>0.0</refreshInterval>
          <viewRefreshTime>0.0</viewRefreshTime>
          <viewBoundScale>0.0</viewBoundScale>
        </Icon>
      </IconStyle>
    </Style>
    <Style id="place_College Gym">
      <IconStyle>
        <scale>1.0</scale>
        <heading>0.0</heading>
        <Icon>
          <href>https://ss1.4sqi.net/img/categories/education/gym.png</href>
          <refreshInterval>0.0</refreshInterval>
          <viewRefreshTime>0.0</viewRefreshTime>
          <viewBoundScale>0.0</viewBoundScale>
        </Icon>
      </IconStyle>
    </Style>
    <Style id="place_Airport Gate">
      <IconStyle>
        <scale>1.0</scale>
        <heading>0.0</heading>
        <Icon>
          <href>https://ss1.4sqi.net/img/categories/travel/airport_gate.png</href>
          <refreshInterval>0.0</refreshInterval>
          <viewRefreshTime>0.0</viewRefreshTime>
          <viewBoundScale>0.0</viewBoundScale>
        </Icon>
      </IconStyle>
    </Style>
    <Style id="place_Dumpling Restaurant">
      <IconStyle>
        <scale>1.0</scale>
        <heading>0.0</heading>
        <Icon>
          <href>https://ss1.4sqi.net/img/categories/food/dumplings.png</href>
          <refreshInterval>0.0</refreshInterval>
          <viewRefreshTime>0.0</viewRefreshTime>
          <viewBoundScale>0.0</viewBoundScale>
        </Icon>
      </IconStyle>
    </Style>
    <Style id="place_Tech Startup">
      <IconStyle>
        <scale>1.0</scale>
        <heading>0.0</heading>
        <Icon>
          <href>https://ss1.4sqi.net/img/categories/shops/technology.png</href>
          <refreshInterval>0.0</refreshInterval>
          <viewRefreshTime>0.0</viewRefreshTime>
          <viewBoundScale>0.0</viewBoundScale>
        </Icon>
      </IconStyle>
    </Style>
    <Style id="place_Residential Building (Apartment / Condo)">
      <IconStyle>
        <scale>1.0</scale>
        <heading>0.0</heading>
        <Icon>
          <href>https://ss1.4sqi.net/img/categories/building/default.png</href>
          <refreshInterval>0.0</refreshInterval>
          <viewRefreshTime>0.0</viewRefreshTime>
          <viewBoundScale>0.0</viewBoundScale>
        </Icon>
      </IconStyle>
    </Style>
    <Style id="place_Pizza Place">
      <IconStyle>
        <scale>1.0</scale>
        <heading>0.0</heading>
        <Icon>
          <href>https://ss1.4sqi.net/img/categories/food/pizza.png</href>
          <refreshInterval>0.0</refreshInterval>
          <viewRefreshTime>0.0</viewRefreshTime>
          <viewBoundScale>0.0</viewBoundScale>
        </Icon>
      </IconStyle>
    </Style>
    <Style id="place_Wine Bar">
      <IconStyle>
        <scale>1.0</scale>
        <heading>0.0</heading>
        <Icon>
          <href>https://ss1.4sqi.net/img/categories/nightlife/wine.png</href>
          <refreshInterval>0.0</refreshInterval>
          <viewRefreshTime>0.0</viewRefreshTime>
          <viewBoundScale>0.0</viewBoundScale>
        </Icon>
      </IconStyle>
    </Style>
    <Style id="place_Post Office">
      <IconStyle>
        <scale>1.0</scale>
        <heading>0.0</heading>
        <Icon>
          <href>https://ss1.4sqi.net/img/categories/building/postoffice.png</href>
          <refreshInterval>0.0</refreshInterval>
          <viewRefreshTime>0.0</viewRefreshTime>
          <viewBoundScale>0.0</viewBoundScale>
        </Icon>
      </IconStyle>
    </Style>
    <Style id="place_Grocery Store">
      <IconStyle>
        <scale>1.0</scale>
        <heading>0.0</heading>
        <Icon>
          <href>https://ss1.4sqi.net/img/categories/shops/food_grocery.png</href>
          <refreshInterval>0.0</refreshInterval>
          <viewRefreshTime>0.0</viewRefreshTime>
          <viewBoundScale>0.0</viewBoundScale>
        </Icon>
      </IconStyle>
    </Style>
    <Style id="place_Hardware Store">
      <IconStyle>
        <scale>1.0</scale>
        <heading>0.0</heading>
        <Icon>
          <href>https://ss1.4sqi.net/img/categories/shops/hardware.png</href>
          <refreshInterval>0.0</refreshInterval>
          <viewRefreshTime>0.0</viewRefreshTime>
          <viewBoundScale>0.0</viewBoundScale>
        </Icon>
      </IconStyle>
    </Style>
    <Style id="place_Bus Line">
      <IconStyle>
        <scale>1.0</scale>
        <heading>0.0</heading>
        <Icon>
          <href>https://ss1.4sqi.net/img/categories/travel/busstation.png</href>
          <refreshInterval>0.0</refreshInterval>
          <viewRefreshTime>0.0</viewRefreshTime>
          <viewBoundScale>0.0</viewBoundScale>
        </Icon>
      </IconStyle>
    </Style>
    <Style id="place_Dessert Shop">
      <IconStyle>
        <scale>1.0</scale>
        <heading>0.0</heading>
        <Icon>
          <href>https://ss1.4sqi.net/img/categories/food/dessert.png</href>
          <refreshInterval>0.0</refreshInterval>
          <viewRefreshTime>0.0</viewRefreshTime>
          <viewBoundScale>0.0</viewBoundScale>
        </Icon>
      </IconStyle>
    </Style>
    <Style id="place_Tattoo Parlor">
      <IconStyle>
        <scale>1.0</scale>
        <heading>0.0</heading>
        <Icon>
          <href>https://ss1.4sqi.net/img/categories/shops/tattoos.png</href>
          <refreshInterval>0.0</refreshInterval>
          <viewRefreshTime>0.0</viewRefreshTime>
          <viewBoundScale>0.0</viewBoundScale>
        </Icon>
      </IconStyle>
    </Style>
    <Style id="place_Fried Chicken Joint">
      <IconStyle>
        <scale>1.0</scale>
        <heading>0.0</heading>
        <Icon>
          <href>https://ss1.4sqi.net/img/categories/food/friedchicken.png</href>
          <refreshInterval>0.0</refreshInterval>
          <viewRefreshTime>0.0</viewRefreshTime>
          <viewBoundScale>0.0</viewBoundScale>
        </Icon>
      </IconStyle>
    </Style>
    <Style id="place_Arts &amp; Crafts Store">
      <IconStyle>
        <scale>1.0</scale>
        <heading>0.0</heading>
        <Icon>
          <href>https://ss1.4sqi.net/img/categories/shops/artstore.png</href>
          <refreshInterval>0.0</refreshInterval>
          <viewRefreshTime>0.0</viewRefreshTime>
          <viewBoundScale>0.0</viewBoundScale>
        </Icon>
      </IconStyle>
    </Style>
    <Style id="place_BBQ Joint">
      <IconStyle>
        <scale>1.0</scale>
        <heading>0.0</heading>
        <Icon>
          <href>https://ss1.4sqi.net/img/categories/food/bbq.png</href>
          <refreshInterval>0.0</refreshInterval>
          <viewRefreshTime>0.0</viewRefreshTime>
          <viewBoundScale>0.0</viewBoundScale>
        </Icon>
      </IconStyle>
    </Style>
    <Style id="place_College Quad">
      <IconStyle>
        <scale>1.0</scale>
        <heading>0.0</heading>
        <Icon>
          <href>https://ss1.4sqi.net/img/categories/education/default.png</href>
          <refreshInterval>0.0</refreshInterval>
          <viewRefreshTime>0.0</viewRefreshTime>
          <viewBoundScale>0.0</viewBoundScale>
        </Icon>
      </IconStyle>
    </Style>
    <Style id="place_Coworking Space">
      <IconStyle>
        <scale>1.0</scale>
        <heading>0.0</heading>
        <Icon>
          <href>https://ss1.4sqi.net/img/categories/building/default.png</href>
          <refreshInterval>0.0</refreshInterval>
          <viewRefreshTime>0.0</viewRefreshTime>
          <viewBoundScale>0.0</viewBoundScale>
        </Icon>
      </IconStyle>
    </Style>
    <Style id="place_Café">
      <IconStyle>
        <scale>1.0</scale>
        <heading>0.0</heading>
        <Icon>
          <href>https://ss1.4sqi.net/img/categories/food/cafe.png</href>
          <refreshInterval>0.0</refreshInterval>
          <viewRefreshTime>0.0</viewRefreshTime>
          <viewBoundScale>0.0</viewBoundScale>
        </Icon>
      </IconStyle>
    </Style>
    <Style id="place_Department Store">
      <IconStyle>
        <scale>1.0</scale>
        <heading>0.0</heading>
        <Icon>
          <href>https://ss1.4sqi.net/img/categories/shops/default.png</href>
          <refreshInterval>0.0</refreshInterval>
          <viewRefreshTime>0.0</viewRefreshTime>
          <viewBoundScale>0.0</viewBoundScale>
        </Icon>
      </IconStyle>
    </Style>
    <Style id="place_Portuguese Restaurant">
      <IconStyle>
        <scale>1.0</scale>
        <heading>0.0</heading>
        <Icon>
          <href>https://ss1.4sqi.net/img/categories/food/default.png</href>
          <refreshInterval>0.0</refreshInterval>
          <viewRefreshTime>0.0</viewRefreshTime>
          <viewBoundScale>0.0</viewBoundScale>
        </Icon>
      </IconStyle>
    </Style>
    <Style id="place_Donut Shop">
      <IconStyle>
        <scale>1.0</scale>
        <heading>0.0</heading>
        <Icon>
          <href>https://ss1.4sqi.net/img/categories/food/bagels.png</href>
          <refreshInterval>0.0</refreshInterval>
          <viewRefreshTime>0.0</viewRefreshTime>
          <viewBoundScale>0.0</viewBoundScale>
        </Icon>
      </IconStyle>
    </Style>
    <Style id="place_Art Museum">
      <IconStyle>
        <scale>1.0</scale>
        <heading>0.0</heading>
        <Icon>
          <href>https://ss1.4sqi.net/img/categories/arts_entertainment/museum_art.png</href>
          <refreshInterval>0.0</refreshInterval>
          <viewRefreshTime>0.0</viewRefreshTime>
          <viewBoundScale>0.0</viewBoundScale>
        </Icon>
      </IconStyle>
    </Style>
    <Style id="place_unknown">
      <IconStyle>
        <scale>1.0</scale>
        <heading>0.0</heading>
        <Icon>
          <href>http://maps.google.com/mapfiles/marker_white.png</href>
          <refreshInterval>0.0</refreshInterval>
          <viewRefreshTime>0.0</viewRefreshTime>
          <viewBoundScale>0.0</viewBoundScale>
        </Icon>
      </IconStyle>
    </Style>
    <Style id="place_University">
      <IconStyle>
        <scale>1.0</scale>
        <heading>0.0</heading>
        <Icon>
          <href>https://ss1.4sqi.net/img/categories/education/default.png</href>
          <refreshInterval>0.0</refreshInterval>
          <viewRefreshTime>0.0</viewRefreshTime>
          <viewBoundScale>0.0</viewBoundScale>
        </Icon>
      </IconStyle>
    </Style>
    <Style id="place_Ramen / Noodle House">
      <IconStyle>
        <scale>1.0</scale>
        <heading>0.0</heading>
        <Icon>
          <href>https://ss1.4sqi.net/img/categories/food/ramen.png</href>
          <refreshInterval>0.0</refreshInterval>
          <viewRefreshTime>0.0</viewRefreshTime>
          <viewBoundScale>0.0</viewBoundScale>
        </Icon>
      </IconStyle>
    </Style>
    <Style id="place_Castle">
      <IconStyle>
        <scale>1.0</scale>
        <heading>0.0</heading>
        <Icon>
          <href>https://ss1.4sqi.net/img/categories/parks_outdoors/default.png</href>
          <refreshInterval>0.0</refreshInterval>
          <viewRefreshTime>0.0</viewRefreshTime>
          <viewBoundScale>0.0</viewBoundScale>
        </Icon>
      </IconStyle>
    </Style>
    <Style id="place_Airport Terminal">
      <IconStyle>
        <scale>1.0</scale>
        <heading>0.0</heading>
        <Icon>
          <href>https://ss1.4sqi.net/img/categories/travel/airport_terminal.png</href>
          <refreshInterval>0.0</refreshInterval>
          <viewRefreshTime>0.0</viewRefreshTime>
          <viewBoundScale>0.0</viewBoundScale>
        </Icon>
      </IconStyle>
    </Style>
    <Style id="place_Southern / Soul Food Restaurant">
      <IconStyle>
        <scale>1.0</scale>
        <heading>0.0</heading>
        <Icon>
          <href>https://ss1.4sqi.net/img/categories/food/southern.png</href>
          <refreshInterval>0.0</refreshInterval>
          <viewRefreshTime>0.0</viewRefreshTime>
          <viewBoundScale>0.0</viewBoundScale>
        </Icon>
      </IconStyle>
    </Style>
    <Style id="place_Shoe Store">
      <IconStyle>
        <scale>1.0</scale>
        <heading>0.0</heading>
        <Icon>
          <href>https://ss1.4sqi.net/img/categories/shops/apparel_shoestore.png</href>
          <refreshInterval>0.0</refreshInterval>
          <viewRefreshTime>0.0</viewRefreshTime>
          <viewBoundScale>0.0</viewBoundScale>
        </Icon>
      </IconStyle>
    </Style>
    <Style id="place_Bowling Alley">
      <IconStyle>
        <scale>1.0</scale>
        <heading>0.0</heading>
        <Icon>
          <href>https://ss1.4sqi.net/img/categories/arts_entertainment/bowling.png</href>
          <refreshInterval>0.0</refreshInterval>
          <viewRefreshTime>0.0</viewRefreshTime>
          <viewBoundScale>0.0</viewBoundScale>
        </Icon>
      </IconStyle>
    </Style>
    <Style id="place_Bar">
      <IconStyle>
        <scale>1.0</scale>
        <heading>0.0</heading>
        <Icon>
          <href>https://ss1.4sqi.net/img/categories/nightlife/bar.png</href>
          <refreshInterval>0.0</refreshInterval>
          <viewRefreshTime>0.0</viewRefreshTime>
          <viewBoundScale>0.0</viewBoundScale>
        </Icon>
      </IconStyle>
    </Style>
    <Style id="place_Restaurant">
      <IconStyle>
        <scale>1.0</scale>
        <heading>0.0</heading>
        <Icon>
          <href>https://ss1.4sqi.net/img/categories/food/default.png</href>
          <refreshInterval>0.0</refreshInterval>
          <viewRefreshTime>0.0</viewRefreshTime>
          <viewBoundScale>0.0</viewBoundScale>
        </Icon>
      </IconStyle>
    </Style>
    <Style id="place_Tea Room">
      <IconStyle>
        <scale>1.0</scale>
        <heading>0.0</heading>
        <Icon>
          <href>https://ss1.4sqi.net/img/categories/food/tearoom.png</href>
          <refreshInterval>0.0</refreshInterval>
          <viewRefreshTime>0.0</viewRefreshTime>
          <viewBoundScale>0.0</viewBoundScale>
        </Icon>
      </IconStyle>
    </Style>
    <Style id="place_College Stadium">
      <IconStyle>
        <scale>1.0</scale>
        <heading>0.0</heading>
        <Icon>
          <href>https://ss1.4sqi.net/img/categories/education/stadium.png</href>
          <refreshInterval>0.0</refreshInterval>
          <viewRefreshTime>0.0</viewRefreshTime>
          <viewBoundScale>0.0</viewBoundScale>
        </Icon>
      </IconStyle>
    </Style>
    <Style id="place_Airport">
      <IconStyle>
        <scale>1.0</scale>
        <heading>0.0</heading>
        <Icon>
          <href>https://ss1.4sqi.net/img/categories/travel/airport.png</href>
          <refreshInterval>0.0</refreshInterval>
          <viewRefreshTime>0.0</viewRefreshTime>
          <viewBoundScale>0.0</viewBoundScale>
        </Icon>
      </IconStyle>
    </Style>
    <Style id="place_Bakery">
      <IconStyle>
        <scale>1.0</scale>
        <heading>0.0</heading>
        <Icon>
          <href>https://ss1.4sqi.net/img/categories/food/bakery.png</href>
          <refreshInterval>0.0</refreshInterval>
          <viewRefreshTime>0.0</viewRefreshTime>
          <viewBoundScale>0.0</viewBoundScale>
        </Icon>
      </IconStyle>
    </Style>
    <Style id="place_College Classroom">
      <IconStyle>
        <scale>1.0</scale>
        <heading>0.0</heading>
        <Icon>
          <href>https://ss1.4sqi.net/img/categories/education/default.png</href>
          <refreshInterval>0.0</refreshInterval>
          <viewRefreshTime>0.0</viewRefreshTime>
          <viewBoundScale>0.0</viewBoundScale>
        </Icon>
      </IconStyle>
    </Style>
    <Style id="place_Asian Restaurant">
      <IconStyle>
        <scale>1.0</scale>
        <heading>0.0</heading>
        <Icon>
          <href>https://ss1.4sqi.net/img/categories/food/asian.png</href>
          <refreshInterval>0.0</refreshInterval>
          <viewRefreshTime>0.0</viewRefreshTime>
          <viewBoundScale>0.0</viewBoundScale>
        </Icon>
      </IconStyle>
    </Style>
    <Style id="place_home">
      <IconStyle>
        <scale>1.0</scale>
        <heading>0.0</heading>
        <Icon>
          <href>http://ss1.4sqi.net/img/categories/building/home.png</href>
          <refreshInterval>0.0</refreshInterval>
          <viewRefreshTime>0.0</viewRefreshTime>
          <viewBoundScale>0.0</viewBoundScale>
        </Icon>
      </IconStyle>
    </Style>
    <Style id="place_Baseball Stadium">
      <IconStyle>
        <scale>1.0</scale>
        <heading>0.0</heading>
        <Icon>
          <href>https://ss1.4sqi.net/img/categories/arts_entertainment/stadium_baseball.png</href>
          <refreshInterval>0.0</refreshInterval>
          <viewRefreshTime>0.0</viewRefreshTime>
          <viewBoundScale>0.0</viewBoundScale>
        </Icon>
      </IconStyle>
    </Style>
    <Style id="place_Drugstore / Pharmacy">
      <IconStyle>
        <scale>1.0</scale>
        <heading>0.0</heading>
        <Icon>
          <href>https://ss1.4sqi.net/img/categories/shops/drugstore.png</href>
          <refreshInterval>0.0</refreshInterval>
          <viewRefreshTime>0.0</viewRefreshTime>
          <viewBoundScale>0.0</viewBoundScale>
        </Icon>
      </IconStyle>
    </Style>
    <Style id="place_Office">
      <IconStyle>
        <scale>1.0</scale>
        <heading>0.0</heading>
        <Icon>
          <href>https://ss1.4sqi.net/img/categories/building/default.png</href>
          <refreshInterval>0.0</refreshInterval>
          <viewRefreshTime>0.0</viewRefreshTime>
          <viewBoundScale>0.0</viewBoundScale>
        </Icon>
      </IconStyle>
    </Style>
    <Style id="place_New American Restaurant">
      <IconStyle>
        <scale>1.0</scale>
        <heading>0.0</heading>
        <Icon>
          <href>https://ss1.4sqi.net/img/categories/food/default.png</href>
          <refreshInterval>0.0</refreshInterval>
          <viewRefreshTime>0.0</viewRefreshTime>
          <viewBoundScale>0.0</viewBoundScale>
        </Icon>
      </IconStyle>
    </Style>
    <Style id="place_Subway">
      <IconStyle>
        <scale>1.0</scale>
        <heading>0.0</heading>
        <Icon>
          <href>https://ss1.4sqi.net/img/categories/travel/subway.png</href>
          <refreshInterval>0.0</refreshInterval>
          <viewRefreshTime>0.0</viewRefreshTime>
          <viewBoundScale>0.0</viewBoundScale>
        </Icon>
      </IconStyle>
    </Style>
    <Style id="place_Lounge">
      <IconStyle>
        <scale>1.0</scale>
        <heading>0.0</heading>
        <Icon>
          <href>https://ss1.4sqi.net/img/categories/nightlife/lounge.png</href>
          <refreshInterval>0.0</refreshInterval>
          <viewRefreshTime>0.0</viewRefreshTime>
          <viewBoundScale>0.0</viewBoundScale>
        </Icon>
      </IconStyle>
    </Style>
    <Style id="place_Bus Station">
      <IconStyle>
        <scale>1.0</scale>
        <heading>0.0</heading>
        <Icon>
          <href>https://ss1.4sqi.net/img/categories/travel/busstation.png</href>
          <refreshInterval>0.0</refreshInterval>
          <viewRefreshTime>0.0</viewRefreshTime>
          <viewBoundScale>0.0</viewBoundScale>
        </Icon>
      </IconStyle>
    </Style>
    <Style id="place_Student Center">
      <IconStyle>
        <scale>1.0</scale>
        <heading>0.0</heading>
        <Icon>
          <href>https://ss1.4sqi.net/img/categories/education/default.png</href>
          <refreshInterval>0.0</refreshInterval>
          <viewRefreshTime>0.0</viewRefreshTime>
          <viewBoundScale>0.0</viewBoundScale>
        </Icon>
      </IconStyle>
    </Style>
    <Style id="place_Bagel Shop">
      <IconStyle>
        <scale>1.0</scale>
        <heading>0.0</heading>
        <Icon>
          <href>https://ss1.4sqi.net/img/categories/food/bagels.png</href>
          <refreshInterval>0.0</refreshInterval>
          <viewRefreshTime>0.0</viewRefreshTime>
          <viewBoundScale>0.0</viewBoundScale>
        </Icon>
      </IconStyle>
    </Style>
    <Style id="place_Print Shop">
      <IconStyle>
        <scale>1.0</scale>
        <heading>0.0</heading>
        <Icon>
          <href>https://ss1.4sqi.net/img/categories/shops/default.png</href>
          <refreshInterval>0.0</refreshInterval>
          <viewRefreshTime>0.0</viewRefreshTime>
          <viewBoundScale>0.0</viewBoundScale>
        </Icon>
      </IconStyle>
    </Style>
    <Style id="place_Park">
      <IconStyle>
        <scale>1.0</scale>
        <heading>0.0</heading>
        <Icon>
          <href>https://ss1.4sqi.net/img/categories/parks_outdoors/default.png</href>
          <refreshInterval>0.0</refreshInterval>
          <viewRefreshTime>0.0</viewRefreshTime>
          <viewBoundScale>0.0</viewBoundScale>
        </Icon>
      </IconStyle>
    </Style>
    <Style id="place_Burger Joint">
      <IconStyle>
        <scale>1.0</scale>
        <heading>0.0</heading>
        <Icon>
          <href>https://ss1.4sqi.net/img/categories/food/burger.png</href>
          <refreshInterval>0.0</refreshInterval>
          <viewRefreshTime>0.0</viewRefreshTime>
          <viewBoundScale>0.0</viewBoundScale>
        </Icon>
      </IconStyle>
    </Style>
    <Folder>
      <name><![CDATA[1/1/14]]></name>
      <Placemark id="1388556000000">
        <name><![CDATA[945 S Batavia Ave]]></name>
        <atom:link href="http://foursquare.com/venue/4f629428e4b075c7117d49d3"/>
        <description><![CDATA[<p>1/1/14<br/> 12:00 AM to 12:45 PM<br/> 12:45 hours</p> <p> <a href="http://foursquare.com/venue/4f629428e4b075c7117d49d3">More details (Foursquare)</a> </p>]]></description>
        <TimeSpan>
          <begin>2014-01-01T00:00:01-06:00</begin>
          <end>2014-01-01T12:45:44-06:00</end>
        </TimeSpan>
        <styleUrl>#place_foursquare</styleUrl>
        <Point>
          <coordinates>-88.30935165928999,41.87250621617115</coordinates>
        </Point>
      </Placemark>
      <Placemark id="1388602163000">
        <name><![CDATA[Egg Harbor Cafe]]></name>
        <atom:link href="http://foursquare.com/venue/4b6d65e3f964a520d3742ce3"/>
        <description><![CDATA[<p>1/1/14<br/> 12:49 PM to 2:27 PM<br/> 1:38 hours</p> <p>Breakfast Spot<br/> <a href="http://foursquare.com/venue/4b6d65e3f964a520d3742ce3">More details (Foursquare)</a> </p>]]></description>
        <TimeSpan>
          <begin>2014-01-01T12:49:24-06:00</begin>
          <end>2014-01-01T14:27:28-06:00</end>
        </TimeSpan>
        <styleUrl>#place_Breakfast Spot</styleUrl>
        <Point>
          <coordinates>-88.3081539,41.883009</coordinates>
        </Point>
      </Placemark>
      <Placemark id="1388608164000">
        <name><![CDATA[945 S Batavia Ave]]></name>
        <atom:link href="http://foursquare.com/venue/4f629428e4b075c7117d49d3"/>
        <description><![CDATA[<p>1/1/14<br/> 2:29 PM to 12:00 AM<br/> 9:30 hours</p> <p> <a href="http://foursquare.com/venue/4f629428e4b075c7117d49d3">More details (Foursquare)</a> </p>]]></description>
        <TimeSpan>
          <begin>2014-01-01T14:29:25-06:00</begin>
          <end>2014-01-01T23:59:59-06:00</end>
        </TimeSpan>
        <styleUrl>#place_foursquare</styleUrl>
        <Point>
          <coordinates>-88.30935165928999,41.87250621617115</coordinates>
        </Point>
      </Placemark>
    </Folder>
    <Folder>
      <name><![CDATA[1/2/14]]></name>
      <Placemark id="1388642400000">
        <name><![CDATA[945 S Batavia Ave]]></name>
        <atom:link href="http://foursquare.com/venue/4f629428e4b075c7117d49d3"/>
        <description><![CDATA[<p>1/2/14<br/> 12:00 AM to 1:06 PM<br/> 13:06 hours</p> <p> <a href="http://foursquare.com/venue/4f629428e4b075c7117d49d3">More details (Foursquare)</a> </p>]]></description>
        <TimeSpan>
          <begin>2014-01-02T00:00:01-06:00</begin>
          <end>2014-01-02T13:06:05-06:00</end>
        </TimeSpan>
        <styleUrl>#place_foursquare</styleUrl>
        <Point>
          <coordinates>-88.30935165928999,41.87250621617115</coordinates>
        </Point>
      </Placemark>
      <Placemark id="1388690258000">
        <name><![CDATA[Portillo's Hot Dogs]]></name>
        <atom:link href="http://foursquare.com/venue/4aac39aaf964a520005d20e3"/>
        <description><![CDATA[<p>1/2/14<br/> 1:17 PM to 1:49 PM<br/> 32 min</p> <p> <a href="http://foursquare.com/venue/4aac39aaf964a520005d20e3">More details (Foursquare)</a> </p>]]></description>
        <TimeSpan>
          <begin>2014-01-02T13:17:39-06:00</begin>
          <end>2014-01-02T13:49:47-06:00</end>
        </TimeSpan>
        <styleUrl>#place_foursquare</styleUrl>
        <Point>
          <coordinates>-88.34142002116754,41.86083671184147</coordinates>
        </Point>
      </Placemark>
      <Placemark id="1388692897000">
        <name><![CDATA[945 S Batavia Ave]]></name>
        <atom:link href="http://foursquare.com/venue/4f629428e4b075c7117d49d3"/>
        <description><![CDATA[<p>1/2/14<br/> 2:01 PM to 12:00 AM<br/> 9:58 hours</p> <p> <a href="http://foursquare.com/venue/4f629428e4b075c7117d49d3">More details (Foursquare)</a> </p>]]></description>
        <TimeSpan>
          <begin>2014-01-02T14:01:38-06:00</begin>
          <end>2014-01-02T23:59:59-06:00</end>
        </TimeSpan>
        <styleUrl>#place_foursquare</styleUrl>
        <Point>
          <coordinates>-88.30935165928999,41.87250621617115</coordinates>
        </Point>
      </Placemark>
    </Folder>
    <Folder>
      <name><![CDATA[1/3/14]]></name>
      <Placemark id="1388728800000">
        <name><![CDATA[945 S Batavia Ave]]></name>
        <atom:link href="http://foursquare.com/venue/4f629428e4b075c7117d49d3"/>
        <description><![CDATA[<p>1/3/14<br/> 12:00 AM to 1:52 PM<br/> 13:52 hours</p> <p> <a href="http://foursquare.com/venue/4f629428e4b075c7117d49d3">More details (Foursquare)</a> </p>]]></description>
        <TimeSpan>
          <begin>2014-01-03T00:00:01-06:00</begin>
          <end>2014-01-03T13:52:05-06:00</end>
        </TimeSpan>
        <styleUrl>#place_foursquare</styleUrl>
        <Point>
          <coordinates>-88.30935165928999,41.87250621617115</coordinates>
        </Point>
      </Placemark>
      <Placemark id="1388779271000">
        <name><![CDATA[Lindsay Home]]></name>
        <description><![CDATA[<p>1/3/14<br/> 2:01 PM to 2:11 PM<br/> 10 min</p>]]></description>
        <TimeSpan>
          <begin>2014-01-03T14:01:12-06:00</begin>
          <end>2014-01-03T14:11:38-06:00</end>
        </TimeSpan>
        <styleUrl>#place_home</styleUrl>
        <Point>
          <coordinates>-88.346432006,41.8707573192</coordinates>
        </Point>
      </Placemark>
      <Placemark id="1388780899000">
        <name><![CDATA[Sam's Club]]></name>
        <atom:link href="http://foursquare.com/venue/4b5b6c86f964a520f5fc28e3"/>
        <description><![CDATA[<p>1/3/14<br/> 2:28 PM to 3:10 PM<br/> 42 min</p> <p>Warehouse Store<br/> <a href="http://foursquare.com/venue/4b5b6c86f964a520f5fc28e3">More details (Foursquare)</a> </p>]]></description>
        <TimeSpan>
          <begin>2014-01-03T14:28:20-06:00</begin>
          <end>2014-01-03T15:10:53-06:00</end>
        </TimeSpan>
        <styleUrl>#place_Warehouse Store</styleUrl>
        <Point>
          <coordinates>-88.34321289020829,41.8598144603221</coordinates>
        </Point>
      </Placemark>
      <Placemark id="1388784351000">
        <name><![CDATA[999 S Batavia Ave]]></name>
        <description><![CDATA[<p>1/3/14<br/> 3:25 PM to 5:38 PM<br/> 2:12 hours</p>]]></description>
        <TimeSpan>
          <begin>2014-01-03T15:25:52-06:00</begin>
          <end>2014-01-03T17:38:48-06:00</end>
        </TimeSpan>
        <styleUrl>#place_home</styleUrl>
        <Point>
          <coordinates>-88.3111773419,41.8771046037</coordinates>
        </Point>
      </Placemark>
      <Placemark id="1388794431000">
        <name><![CDATA[Place in Naperville]]></name>
        <description><![CDATA[<p>1/3/14<br/> 6:13 PM to 9:52 PM<br/> 3:39 hours</p>]]></description>
        <TimeSpan>
          <begin>2014-01-03T18:13:52-06:00</begin>
          <end>2014-01-03T21:52:56-06:00</end>
        </TimeSpan>
        <styleUrl>#place_unknown</styleUrl>
        <Point>
          <coordinates>-88.1495348228,41.7717542691</coordinates>
        </Point>
      </Placemark>
      <Placemark id="1388809458000">
        <name><![CDATA[Place in Geneva]]></name>
        <description><![CDATA[<p>1/3/14<br/> 10:24 PM to 12:00 AM<br/> 1:35 hours</p>]]></description>
        <TimeSpan>
          <begin>2014-01-03T22:24:19-06:00</begin>
          <end>2014-01-03T23:59:59-06:00</end>
        </TimeSpan>
        <styleUrl>#place_unknown</styleUrl>
        <Point>
          <coordinates>-88.3112280718,41.877043308</coordinates>
        </Point>
      </Placemark>
    </Folder>
    <Folder>
      <name><![CDATA[1/4/14]]></name>
      <Placemark id="1388815200000">
        <name><![CDATA[Place in Geneva]]></name>
        <description><![CDATA[<p>1/4/14<br/> 12:00 AM to 9:38 AM<br/> 9:38 hours</p>]]></description>
        <TimeSpan>
          <begin>2014-01-04T00:00:01-06:00</begin>
          <end>2014-01-04T09:38:34-06:00</end>
        </TimeSpan>
        <styleUrl>#place_unknown</styleUrl>
        <Point>
          <coordinates>-88.3112280718,41.877043308</coordinates>
        </Point>
      </Placemark>
      <Placemark id="1388851185000">
        <name><![CDATA[Place in Aurora]]></name>
        <description><![CDATA[<p>1/4/14<br/> 9:59 AM to 11:24 AM<br/> 1:24 hours</p>]]></description>
        <TimeSpan>
          <begin>2014-01-04T09:59:46-06:00</begin>
          <end>2014-01-04T11:24:32-06:00</end>
        </TimeSpan>
        <styleUrl>#place_unknown</styleUrl>
        <Point>
          <coordinates>-88.2759720689,41.813005324</coordinates>
        </Point>
      </Placemark>
      <Placemark id="1388857390000">
        <name><![CDATA[Fitzsimmons Home]]></name>
        <description><![CDATA[<p>1/4/14<br/> 11:43 AM to 12:00 AM<br/> 12:16 hours</p>]]></description>
        <TimeSpan>
          <begin>2014-01-04T11:43:11-06:00</begin>
          <end>2014-01-04T23:59:59-06:00</end>
        </TimeSpan>
        <styleUrl>#place_home</styleUrl>
        <Point>
          <coordinates>-88.311048021,41.8771070061</coordinates>
        </Point>
      </Placemark>
    </Folder>
    <Folder>
      <name><![CDATA[1/5/14]]></name>
      <Placemark id="1388901600000">
        <name><![CDATA[Fitzsimmons Home]]></name>
        <description><![CDATA[<p>1/5/14<br/> 12:00 AM to 4:10 PM<br/> 16:10 hours</p>]]></description>
        <TimeSpan>
          <begin>2014-01-05T00:00:01-06:00</begin>
          <end>2014-01-05T16:10:34-06:00</end>
        </TimeSpan>
        <styleUrl>#place_home</styleUrl>
        <Point>
          <coordinates>-88.311048021,41.8771070061</coordinates>
        </Point>
      </Placemark>
      <Placemark id="1388960928000">
        <name><![CDATA[Place in Geneva Commons]]></name>
        <description><![CDATA[<p>1/5/14<br/> 4:28 PM to 4:47 PM<br/> 18 min</p>]]></description>
        <TimeSpan>
          <begin>2014-01-05T16:28:49-06:00</begin>
          <end>2014-01-05T16:47:30-06:00</end>
        </TimeSpan>
        <styleUrl>#place_unknown</styleUrl>
        <Point>
          <coordinates>-88.343332162,41.896466107</coordinates>
        </Point>
      </Placemark>
      <Placemark id="1388962755000">
        <name><![CDATA[945 S Batavia Ave]]></name>
        <atom:link href="http://foursquare.com/venue/4f629428e4b075c7117d49d3"/>
        <description><![CDATA[<p>1/5/14<br/> 4:59 PM to 12:00 AM<br/> 7:00 hours</p> <p> <a href="http://foursquare.com/venue/4f629428e4b075c7117d49d3">More details (Foursquare)</a> </p>]]></description>
        <TimeSpan>
          <begin>2014-01-05T16:59:16-06:00</begin>
          <end>2014-01-05T23:59:59-06:00</end>
        </TimeSpan>
        <styleUrl>#place_foursquare</styleUrl>
        <Point>
          <coordinates>-88.30935165928999,41.87250621617115</coordinates>
        </Point>
      </Placemark>
    </Folder>
    <Folder>
      <name><![CDATA[1/6/14]]></name>
      <Placemark id="1388988000000">
        <name><![CDATA[945 S Batavia Ave]]></name>
        <atom:link href="http://foursquare.com/venue/4f629428e4b075c7117d49d3"/>
        <description><![CDATA[<p>1/6/14<br/> 12:00 AM to 6:35 PM<br/> 18:35 hours</p> <p> <a href="http://foursquare.com/venue/4f629428e4b075c7117d49d3">More details (Foursquare)</a> </p>]]></description>
        <TimeSpan>
          <begin>2014-01-06T00:00:01-06:00</begin>
          <end>2014-01-06T18:35:44-06:00</end>
        </TimeSpan>
        <styleUrl>#place_foursquare</styleUrl>
        <Point>
          <coordinates>-88.30935165928999,41.87250621617115</coordinates>
        </Point>
      </Placemark>
      <Placemark id="1389064800000">
        <name><![CDATA[Fitzsimmons Home]]></name>
        <description><![CDATA[<p>1/6/14<br/> 9:20 PM to 12:00 AM<br/> 2:40 hours</p>]]></description>
        <TimeSpan>
          <begin>2014-01-06T21:20:01-06:00</begin>
          <end>2014-01-06T23:59:59-06:00</end>
        </TimeSpan>
        <styleUrl>#place_home</styleUrl>
        <Point>
          <coordinates>-88.311048021,41.8771070061</coordinates>
        </Point>
      </Placemark>
    </Folder>
    <Folder>
      <name><![CDATA[1/7/14]]></name>
      <Placemark id="1389074400000">
        <name><![CDATA[Fitzsimmons Home]]></name>
        <description><![CDATA[<p>1/7/14<br/> 12:00 AM to 3:46 PM<br/> 15:46 hours</p>]]></description>
        <TimeSpan>
          <begin>2014-01-07T00:00:01-06:00</begin>
          <end>2014-01-07T15:46:15-06:00</end>
        </TimeSpan>
        <styleUrl>#place_home</styleUrl>
        <Point>
          <coordinates>-88.311048021,41.8771070061</coordinates>
        </Point>
      </Placemark>
      <Placemark id="1389134353000">
        <name><![CDATA[Chicago O'Hare International Airport (ORD)]]></name>
        <atom:link href="http://foursquare.com/venue/4a5a77a4f964a52062ba1fe3"/>
        <description><![CDATA[<p>1/7/14<br/> 4:39 PM to 4:50 PM<br/> 11 min</p> <p> <a href="http://foursquare.com/venue/4a5a77a4f964a52062ba1fe3">More details (Foursquare)</a> </p>]]></description>
        <TimeSpan>
          <begin>2014-01-07T16:39:14-06:00</begin>
          <end>2014-01-07T16:50:17-06:00</end>
        </TimeSpan>
        <styleUrl>#place_foursquare</styleUrl>
        <Point>
          <coordinates>-87.90440082550049,41.97727092004163</coordinates>
        </Point>
      </Placemark>
      <Placemark id="1389135907000">
        <name><![CDATA[Hilton O'Hare Airport]]></name>
        <atom:link href="http://foursquare.com/venue/4a3abc54f964a5202ba01fe3"/>
        <description><![CDATA[<p>1/7/14<br/> 5:05 PM to 5:45 PM<br/> 40 min</p> <p>Hotel<br/> <a href="http://foursquare.com/venue/4a3abc54f964a5202ba01fe3">More details (Foursquare)</a> </p>]]></description>
        <TimeSpan>
          <begin>2014-01-07T17:05:08-06:00</begin>
          <end>2014-01-07T17:45:57-06:00</end>
        </TimeSpan>
        <styleUrl>#place_Hotel</styleUrl>
        <Point>
          <coordinates>-87.90431499481201,41.97735865517006</coordinates>
        </Point>
      </Placemark>
      <Placemark id="1389138941000">
        <name><![CDATA[Chicago O'Hare International Airport (ORD)]]></name>
        <atom:link href="http://foursquare.com/venue/4a5a77a4f964a52062ba1fe3"/>
        <description><![CDATA[<p>1/7/14<br/> 5:55 PM to 6:04 PM<br/> 8 min</p> <p> <a href="http://foursquare.com/venue/4a5a77a4f964a52062ba1fe3">More details (Foursquare)</a> </p>]]></description>
        <TimeSpan>
          <begin>2014-01-07T17:55:42-06:00</begin>
          <end>2014-01-07T18:04:34-06:00</end>
        </TimeSpan>
        <styleUrl>#place_foursquare</styleUrl>
        <Point>
          <coordinates>-87.90440082550049,41.97727092004163</coordinates>
        </Point>
      </Placemark>
      <Placemark id="1389139758000">
        <name><![CDATA[Gate L5]]></name>
        <atom:link href="http://foursquare.com/venue/4c9d09fb8afca09334ecf215"/>
        <description><![CDATA[<p>1/7/14<br/> 6:09 PM to 7:07 PM<br/> 58 min</p> <p>Airport Gate<br/> <a href="http://foursquare.com/venue/4c9d09fb8afca09334ecf215">More details (Foursquare)</a> </p>]]></description>
        <TimeSpan>
          <begin>2014-01-07T18:09:19-06:00</begin>
          <end>2014-01-07T19:07:54-06:00</end>
        </TimeSpan>
        <styleUrl>#place_Airport Gate</styleUrl>
        <Point>
          <coordinates>-87.897449,41.977036</coordinates>
        </Point>
      </Placemark>
      <Placemark id="1389151956000">
        <name><![CDATA[Boston Logan International Airport (BOS)]]></name>
        <atom:link href="http://foursquare.com/venue/452113b6f964a520bc3a1fe3"/>
        <description><![CDATA[<p>1/7/14<br/> 9:32 PM to 9:54 PM<br/> 21 min</p> <p>Airport<br/> <a href="http://foursquare.com/venue/452113b6f964a520bc3a1fe3">More details (Foursquare)</a> </p>]]></description>
        <TimeSpan>
          <begin>2014-01-07T21:32:37-06:00</begin>
          <end>2014-01-07T21:54:04-06:00</end>
        </TimeSpan>
        <styleUrl>#place_Airport</styleUrl>
        <Point>
          <coordinates>-71.01667642593384,42.36650312404415</coordinates>
        </Point>
      </Placemark>
      <Placemark id="1389154457000">
        <name><![CDATA[Home]]></name>
        <description><![CDATA[<p>1/7/14<br/> 10:14 PM to 12:00 AM<br/> 1:45 hours</p>]]></description>
        <TimeSpan>
          <begin>2014-01-07T22:14:18-06:00</begin>
          <end>2014-01-07T23:59:59-06:00</end>
        </TimeSpan>
        <styleUrl>#place_home</styleUrl>
        <Point>
          <coordinates>-71.1114458017,42.3754311174</coordinates>
        </Point>
      </Placemark>
    </Folder>
    <Folder>
      <name><![CDATA[1/8/14]]></name>
      <Placemark id="1389160800000">
        <name><![CDATA[Home]]></name>
        <description><![CDATA[<p>1/8/14<br/> 12:00 AM to 8:14 AM<br/> 8:14 hours</p>]]></description>
        <TimeSpan>
          <begin>2014-01-08T00:00:01-06:00</begin>
          <end>2014-01-08T08:14:05-06:00</end>
        </TimeSpan>
        <styleUrl>#place_home</styleUrl>
        <Point>
          <coordinates>-71.1114458017,42.3754311174</coordinates>
        </Point>
      </Placemark>
      <Placemark id="1389191438000">
        <name><![CDATA[Henrietta's Table]]></name>
        <atom:link href="http://foursquare.com/venue/4a51523bf964a520edb01fe3"/>
        <description><![CDATA[<p>1/8/14<br/> 8:30 AM to 10:40 AM<br/> 2:10 hours</p> <p>American Restaurant<br/> <a href="http://foursquare.com/venue/4a51523bf964a520edb01fe3">More details (Foursquare)</a> </p>]]></description>
        <TimeSpan>
          <begin>2014-01-08T08:30:39-06:00</begin>
          <end>2014-01-08T10:40:47-06:00</end>
        </TimeSpan>
        <styleUrl>#place_American Restaurant</styleUrl>
        <Point>
          <coordinates>-71.12299694115246,42.37210143005068</coordinates>
        </Point>
      </Placemark>
      <Placemark id="1389199550000">
        <name><![CDATA[Bank Of America]]></name>
        <atom:link href="http://foursquare.com/venue/4ab24fd3f964a520ea6a20e3"/>
        <description><![CDATA[<p>1/8/14<br/> 10:45 AM to 10:48 AM<br/> 2 min</p> <p>Bank<br/> <a href="http://foursquare.com/venue/4ab24fd3f964a520ea6a20e3">More details (Foursquare)</a> </p>]]></description>
        <TimeSpan>
          <begin>2014-01-08T10:45:51-06:00</begin>
          <end>2014-01-08T10:48:48-06:00</end>
        </TimeSpan>
        <styleUrl>#place_Bank</styleUrl>
        <Point>
          <coordinates>-71.11902218263484,42.37360433115195</coordinates>
        </Point>
      </Placemark>
      <Placemark id="1389200121000">
        <name><![CDATA[Broadway Marketplace]]></name>
        <atom:link href="http://foursquare.com/venue/4a661612f964a520ffc71fe3"/>
        <description><![CDATA[<p>1/8/14<br/> 10:55 AM to 10:58 AM<br/> 2 min</p> <p>Grocery Store<br/> <a href="http://foursquare.com/venue/4a661612f964a520ffc71fe3">More details (Foursquare)</a> </p>]]></description>
        <TimeSpan>
          <begin>2014-01-08T10:55:22-06:00</begin>
          <end>2014-01-08T10:58:17-06:00</end>
        </TimeSpan>
        <styleUrl>#place_Grocery Store</styleUrl>
        <Point>
          <coordinates>-71.11300484548056,42.37405171427381</coordinates>
        </Point>
      </Placemark>
      <Placemark id="1389200541000">
        <name><![CDATA[Home]]></name>
        <description><![CDATA[<p>1/8/14<br/> 11:02 AM to 7:08 PM<br/> 8:05 hours</p>]]></description>
        <TimeSpan>
          <begin>2014-01-08T11:02:22-06:00</begin>
          <end>2014-01-08T19:08:02-06:00</end>
        </TimeSpan>
        <styleUrl>#place_home</styleUrl>
        <Point>
          <coordinates>-71.1114458017,42.3754311174</coordinates>
        </Point>
      </Placemark>
      <Placemark id="1389230282000">
        <name><![CDATA[CVS/pharmacy]]></name>
        <atom:link href="http://foursquare.com/venue/49df6a3ff964a520c6601fe3"/>
        <description><![CDATA[<p>1/8/14<br/> 7:18 PM to 7:24 PM<br/> 6 min</p> <p>Drugstore / Pharmacy<br/> <a href="http://foursquare.com/venue/49df6a3ff964a520c6601fe3">More details (Foursquare)</a> </p>]]></description>
        <TimeSpan>
          <begin>2014-01-08T19:18:03-06:00</begin>
          <end>2014-01-08T19:24:01-06:00</end>
        </TimeSpan>
        <styleUrl>#place_Drugstore / Pharmacy</styleUrl>
        <Point>
          <coordinates>-71.11899197101593,42.37402935435937</coordinates>
        </Point>
      </Placemark>
      <Placemark id="1389231288000">
        <name><![CDATA[Home]]></name>
        <description><![CDATA[<p>1/8/14<br/> 7:34 PM to 12:00 AM<br/> 4:25 hours</p>]]></description>
        <TimeSpan>
          <begin>2014-01-08T19:34:49-06:00</begin>
          <end>2014-01-08T23:59:59-06:00</end>
        </TimeSpan>
        <styleUrl>#place_home</styleUrl>
        <Point>
          <coordinates>-71.1114458017,42.3754311174</coordinates>
        </Point>
      </Placemark>
    </Folder>
    <Folder>
      <name><![CDATA[1/9/14]]></name>
      <Placemark id="1389247200000">
        <name><![CDATA[Home]]></name>
        <description><![CDATA[<p>1/9/14<br/> 12:00 AM to 9:14 AM<br/> 9:14 hours</p>]]></description>
        <TimeSpan>
          <begin>2014-01-09T00:00:01-06:00</begin>
          <end>2014-01-09T09:14:57-06:00</end>
        </TimeSpan>
        <styleUrl>#place_home</styleUrl>
        <Point>
          <coordinates>-71.1114458017,42.3754311174</coordinates>
        </Point>
      </Placemark>
      <Placemark id="1389281318000">
        <name><![CDATA[Proximate]]></name>
        <atom:link href="http://foursquare.com/venue/51c8c0d1498e5d4d09a48362"/>
        <description><![CDATA[<p>1/9/14<br/> 9:28 AM to 11:59 AM<br/> 2:30 hours</p> <p>Tech Startup<br/> <a href="http://foursquare.com/venue/51c8c0d1498e5d4d09a48362">More details (Foursquare)</a> </p>]]></description>
        <TimeSpan>
          <begin>2014-01-09T09:28:39-06:00</begin>
          <end>2014-01-09T11:59:05-06:00</end>
        </TimeSpan>
        <styleUrl>#place_Tech Startup</styleUrl>
        <Point>
          <coordinates>-71.117205,42.378716</coordinates>
        </Point>
      </Placemark>
      <Placemark id="1389290920000">
        <name><![CDATA[Border Cafe]]></name>
        <atom:link href="http://foursquare.com/venue/3fd66200f964a520bded1ee3"/>
        <description><![CDATA[<p>1/9/14<br/> 12:08 PM to 1:08 PM<br/> 59 min</p> <p>Mexican Restaurant<br/> <a href="http://foursquare.com/venue/3fd66200f964a520bded1ee3">More details (Foursquare)</a> </p>]]></description>
        <TimeSpan>
          <begin>2014-01-09T12:08:41-06:00</begin>
          <end>2014-01-09T13:08:13-06:00</end>
        </TimeSpan>
        <styleUrl>#place_Mexican Restaurant</styleUrl>
        <Point>
          <coordinates>-71.120141,42.3743468</coordinates>
        </Point>
      </Placemark>
      <Placemark id="1389294936000">
        <name><![CDATA[Place in Old Cambridge]]></name>
        <description><![CDATA[<p>1/9/14<br/> 1:15 PM to 1:21 PM<br/> 5 min</p>]]></description>
        <TimeSpan>
          <begin>2014-01-09T13:15:37-06:00</begin>
          <end>2014-01-09T13:21:16-06:00</end>
        </TimeSpan>
        <styleUrl>#place_unknown</styleUrl>
        <Point>
          <coordinates>-71.1205674544,42.37215804</coordinates>
        </Point>
      </Placemark>
      <Placemark id="1389296314000">
        <name><![CDATA[Proximate]]></name>
        <atom:link href="http://foursquare.com/venue/51c8c0d1498e5d4d09a48362"/>
        <description><![CDATA[<p>1/9/14<br/> 1:38 PM to 6:38 PM<br/> 4:59 hours</p> <p>Tech Startup<br/> <a href="http://foursquare.com/venue/51c8c0d1498e5d4d09a48362">More details (Foursquare)</a> </p>]]></description>
        <TimeSpan>
          <begin>2014-01-09T13:38:35-06:00</begin>
          <end>2014-01-09T18:38:27-06:00</end>
        </TimeSpan>
        <styleUrl>#place_Tech Startup</styleUrl>
        <Point>
          <coordinates>-71.117205,42.378716</coordinates>
        </Point>
      </Placemark>
      <Placemark id="1389314999000">
        <name><![CDATA[Broadway Marketplace]]></name>
        <atom:link href="http://foursquare.com/venue/4a661612f964a520ffc71fe3"/>
        <description><![CDATA[<p>1/9/14<br/> 6:49 PM to 6:54 PM<br/> 4 min</p> <p>Grocery Store<br/> <a href="http://foursquare.com/venue/4a661612f964a520ffc71fe3">More details (Foursquare)</a> </p>]]></description>
        <TimeSpan>
          <begin>2014-01-09T18:50:00-06:00</begin>
          <end>2014-01-09T18:54:51-06:00</end>
        </TimeSpan>
        <styleUrl>#place_Grocery Store</styleUrl>
        <Point>
          <coordinates>-71.11300484548056,42.37405171427381</coordinates>
        </Point>
      </Placemark>
      <Placemark id="1389315637000">
        <name><![CDATA[Home]]></name>
        <description><![CDATA[<p>1/9/14<br/> 7:00 PM to 12:00 AM<br/> 4:59 hours</p>]]></description>
        <TimeSpan>
          <begin>2014-01-09T19:00:38-06:00</begin>
          <end>2014-01-09T23:59:59-06:00</end>
        </TimeSpan>
        <styleUrl>#place_home</styleUrl>
        <Point>
          <coordinates>-71.1114458017,42.3754311174</coordinates>
        </Point>
      </Placemark>
    </Folder>
    <Folder>
      <name><![CDATA[1/10/14]]></name>
      <Placemark id="1389333600000">
        <name><![CDATA[Home]]></name>
        <description><![CDATA[<p>1/10/14<br/> 12:00 AM to 8:48 AM<br/> 8:48 hours</p>]]></description>
        <TimeSpan>
          <begin>2014-01-10T00:00:01-06:00</begin>
          <end>2014-01-10T08:48:12-06:00</end>
        </TimeSpan>
        <styleUrl>#place_home</styleUrl>
        <Point>
          <coordinates>-71.1114458017,42.3754311174</coordinates>
        </Point>
      </Placemark>
      <Placemark id="1389366232000">
        <name><![CDATA[Proximate]]></name>
        <atom:link href="http://foursquare.com/venue/51c8c0d1498e5d4d09a48362"/>
        <description><![CDATA[<p>1/10/14<br/> 9:03 AM to 12:48 PM<br/> 3:44 hours</p> <p>Tech Startup<br/> <a href="http://foursquare.com/venue/51c8c0d1498e5d4d09a48362">More details (Foursquare)</a> </p>]]></description>
        <TimeSpan>
          <begin>2014-01-10T09:03:53-06:00</begin>
          <end>2014-01-10T12:48:45-06:00</end>
        </TimeSpan>
        <styleUrl>#place_Tech Startup</styleUrl>
        <Point>
          <coordinates>-71.117205,42.378716</coordinates>
        </Point>
      </Placemark>
      <Placemark id="1389380477000">
        <name><![CDATA[Shake Shack]]></name>
        <atom:link href="http://foursquare.com/venue/52b9c0cb498eaffe14f7e162"/>
        <description><![CDATA[<p>1/10/14<br/> 1:01 PM to 1:36 PM<br/> 34 min</p> <p>Burger Joint<br/> <a href="http://foursquare.com/venue/52b9c0cb498eaffe14f7e162">More details (Foursquare)</a> </p>]]></description>
        <TimeSpan>
          <begin>2014-01-10T13:01:18-06:00</begin>
          <end>2014-01-10T13:36:13-06:00</end>
        </TimeSpan>
        <styleUrl>#place_Burger Joint</styleUrl>
        <Point>
          <coordinates>-71.12084999619532,42.37224129812891</coordinates>
        </Point>
      </Placemark>
      <Placemark id="1389383556000">
        <name><![CDATA[Proximate]]></name>
        <atom:link href="http://foursquare.com/venue/51c8c0d1498e5d4d09a48362"/>
        <description><![CDATA[<p>1/10/14<br/> 1:52 PM to 6:26 PM<br/> 4:33 hours</p> <p>Tech Startup<br/> <a href="http://foursquare.com/venue/51c8c0d1498e5d4d09a48362">More details (Foursquare)</a> </p>]]></description>
        <TimeSpan>
          <begin>2014-01-10T13:52:37-06:00</begin>
          <end>2014-01-10T18:26:14-06:00</end>
        </TimeSpan>
        <styleUrl>#place_Tech Startup</styleUrl>
        <Point>
          <coordinates>-71.117205,42.378716</coordinates>
        </Point>
      </Placemark>
      <Placemark id="1389400518000">
        <name><![CDATA[Broadway Marketplace]]></name>
        <atom:link href="http://foursquare.com/venue/4a661612f964a520ffc71fe3"/>
        <description><![CDATA[<p>1/10/14<br/> 6:35 PM to 6:43 PM<br/> 8 min</p> <p>Grocery Store<br/> <a href="http://foursquare.com/venue/4a661612f964a520ffc71fe3">More details (Foursquare)</a> </p>]]></description>
        <TimeSpan>
          <begin>2014-01-10T18:35:19-06:00</begin>
          <end>2014-01-10T18:43:46-06:00</end>
        </TimeSpan>
        <styleUrl>#place_Grocery Store</styleUrl>
        <Point>
          <coordinates>-71.11300484548056,42.37405171427381</coordinates>
        </Point>
      </Placemark>
      <Placemark id="1389401361000">
        <name><![CDATA[Home]]></name>
        <description><![CDATA[<p>1/10/14<br/> 6:49 PM to 12:00 AM<br/> 5:10 hours</p>]]></description>
        <TimeSpan>
          <begin>2014-01-10T18:49:22-06:00</begin>
          <end>2014-01-10T23:59:59-06:00</end>
        </TimeSpan>
        <styleUrl>#place_home</styleUrl>
        <Point>
          <coordinates>-71.1114458017,42.3754311174</coordinates>
        </Point>
      </Placemark>
    </Folder>
    <Folder>
      <name><![CDATA[1/11/14]]></name>
      <Placemark id="1389420000000">
        <name><![CDATA[Home]]></name>
        <description><![CDATA[<p>1/11/14<br/> 12:00 AM to 12:05 PM<br/> 12:05 hours</p>]]></description>
        <TimeSpan>
          <begin>2014-01-11T00:00:01-06:00</begin>
          <end>2014-01-11T12:05:26-06:00</end>
        </TimeSpan>
        <styleUrl>#place_home</styleUrl>
        <Point>
          <coordinates>-71.1114458017,42.3754311174</coordinates>
        </Point>
      </Placemark>
      <Placemark id="1389464240000">
        <name><![CDATA[Dickson Bros. True Value]]></name>
        <atom:link href="http://foursquare.com/venue/4aad3cf3f964a5202f5f20e3"/>
        <description><![CDATA[<p>1/11/14<br/> 12:17 PM to 12:42 PM<br/> 24 min</p> <p>Hardware Store<br/> <a href="http://foursquare.com/venue/4aad3cf3f964a5202f5f20e3">More details (Foursquare)</a> </p>]]></description>
        <TimeSpan>
          <begin>2014-01-11T12:17:21-06:00</begin>
          <end>2014-01-11T12:42:17-06:00</end>
        </TimeSpan>
        <styleUrl>#place_Hardware Store</styleUrl>
        <Point>
          <coordinates>-71.120418,42.373343</coordinates>
        </Point>
      </Placemark>
      <Placemark id="1389466505000">
        <name><![CDATA[Home]]></name>
        <description><![CDATA[<p>1/11/14<br/> 12:55 PM to 12:00 AM<br/> 11:04 hours</p>]]></description>
        <TimeSpan>
          <begin>2014-01-11T12:55:06-06:00</begin>
          <end>2014-01-11T23:59:59-06:00</end>
        </TimeSpan>
        <styleUrl>#place_home</styleUrl>
        <Point>
          <coordinates>-71.1114458017,42.3754311174</coordinates>
        </Point>
      </Placemark>
    </Folder>
    <Folder>
      <name><![CDATA[1/12/14]]></name>
      <Placemark id="1389506400000">
        <name><![CDATA[Home]]></name>
        <description><![CDATA[<p>1/12/14<br/> 12:00 AM to 12:00 AM<br/> 24:00 hours</p>]]></description>
        <TimeSpan>
          <begin>2014-01-12T00:00:01-06:00</begin>
          <end>2014-01-12T23:59:59-06:00</end>
        </TimeSpan>
        <styleUrl>#place_home</styleUrl>
        <Point>
          <coordinates>-71.1114458017,42.3754311174</coordinates>
        </Point>
      </Placemark>
    </Folder>
    <Folder>
      <name><![CDATA[1/13/14]]></name>
      <Placemark id="1389592800000">
        <name><![CDATA[Home]]></name>
        <description><![CDATA[<p>1/13/14<br/> 12:00 AM to 8:56 AM<br/> 8:56 hours</p>]]></description>
        <TimeSpan>
          <begin>2014-01-13T00:00:01-06:00</begin>
          <end>2014-01-13T08:56:56-06:00</end>
        </TimeSpan>
        <styleUrl>#place_home</styleUrl>
        <Point>
          <coordinates>-71.1114458017,42.3754311174</coordinates>
        </Point>
      </Placemark>
      <Placemark id="1389625541000">
        <name><![CDATA[Proximate]]></name>
        <atom:link href="http://foursquare.com/venue/51c8c0d1498e5d4d09a48362"/>
        <description><![CDATA[<p>1/13/14<br/> 9:05 AM to 12:09 PM<br/> 3:03 hours</p> <p>Tech Startup<br/> <a href="http://foursquare.com/venue/51c8c0d1498e5d4d09a48362">More details (Foursquare)</a> </p>]]></description>
        <TimeSpan>
          <begin>2014-01-13T09:05:42-06:00</begin>
          <end>2014-01-13T12:09:03-06:00</end>
        </TimeSpan>
        <styleUrl>#place_Tech Startup</styleUrl>
        <Point>
          <coordinates>-71.117205,42.378716</coordinates>
        </Point>
      </Placemark>
      <Placemark id="1389637305000">
        <name><![CDATA[Grendel's Den Restaurant & Bar]]></name>
        <atom:link href="http://foursquare.com/venue/3fd66200f964a520bced1ee3"/>
        <description><![CDATA[<p>1/13/14<br/> 12:21 PM to 1:14 PM<br/> 52 min</p> <p>Bar<br/> <a href="http://foursquare.com/venue/3fd66200f964a520bced1ee3">More details (Foursquare)</a> </p>]]></description>
        <TimeSpan>
          <begin>2014-01-13T12:21:46-06:00</begin>
          <end>2014-01-13T13:14:43-06:00</end>
        </TimeSpan>
        <styleUrl>#place_Bar</styleUrl>
        <Point>
          <coordinates>-71.12077832221985,42.37237675230346</coordinates>
        </Point>
      </Placemark>
      <Placemark id="1389641356000">
        <name><![CDATA[Proximate]]></name>
        <atom:link href="http://foursquare.com/venue/51c8c0d1498e5d4d09a48362"/>
        <description><![CDATA[<p>1/13/14<br/> 1:29 PM to 4:03 PM<br/> 2:34 hours</p> <p>Tech Startup<br/> <a href="http://foursquare.com/venue/51c8c0d1498e5d4d09a48362">More details (Foursquare)</a> </p>]]></description>
        <TimeSpan>
          <begin>2014-01-13T13:29:17-06:00</begin>
          <end>2014-01-13T16:03:28-06:00</end>
        </TimeSpan>
        <styleUrl>#place_Tech Startup</styleUrl>
        <Point>
          <coordinates>-71.117205,42.378716</coordinates>
        </Point>
      </Placemark>
      <Placemark id="1389653085000">
        <name><![CDATA[Harvard Club of Boston]]></name>
        <atom:link href="http://foursquare.com/venue/4a7dac55f964a52020ef1fe3"/>
        <description><![CDATA[<p>1/13/14<br/> 4:44 PM to 6:16 PM<br/> 1:31 hours</p> <p> <a href="http://foursquare.com/venue/4a7dac55f964a52020ef1fe3">More details (Foursquare)</a> </p>]]></description>
        <TimeSpan>
          <begin>2014-01-13T16:44:46-06:00</begin>
          <end>2014-01-13T18:16:14-06:00</end>
        </TimeSpan>
        <styleUrl>#place_foursquare</styleUrl>
        <Point>
          <coordinates>-71.08902744588494,42.34856237912367</coordinates>
        </Point>
      </Placemark>
      <Placemark id="1389659026000">
        <name><![CDATA[Trattoria Newbury]]></name>
        <atom:link href="http://foursquare.com/venue/4ff3467ae4b0956dd37501b7"/>
        <description><![CDATA[<p>1/13/14<br/> 6:23 PM to 7:43 PM<br/> 1:20 hours</p> <p> <a href="http://foursquare.com/venue/4ff3467ae4b0956dd37501b7">More details (Foursquare)</a> </p>]]></description>
        <TimeSpan>
          <begin>2014-01-13T18:23:47-06:00</begin>
          <end>2014-01-13T19:43:55-06:00</end>
        </TimeSpan>
        <styleUrl>#place_foursquare</styleUrl>
        <Point>
          <coordinates>-71.083142,42.34925</coordinates>
        </Point>
      </Placemark>
      <Placemark id="1389664137000">
        <name><![CDATA[MBTA Bus Stop | Massachusetts Ave. & Newbury St.]]></name>
        <atom:link href="http://foursquare.com/venue/4e498e94b61c6886484fde5c"/>
        <description><![CDATA[<p>1/13/14<br/> 7:48 PM to 7:58 PM<br/> 9 min</p> <p>Bus Station<br/> <a href="http://foursquare.com/venue/4e498e94b61c6886484fde5c">More details (Foursquare)</a> </p>]]></description>
        <TimeSpan>
          <begin>2014-01-13T19:48:58-06:00</begin>
          <end>2014-01-13T19:58:23-06:00</end>
        </TimeSpan>
        <styleUrl>#place_Bus Station</styleUrl>
        <Point>
          <coordinates>-71.08813047409058,42.34801465325017</coordinates>
        </Point>
      </Placemark>
      <Placemark id="1389666118000">
        <name><![CDATA[Home]]></name>
        <description><![CDATA[<p>1/13/14<br/> 8:21 PM to 12:00 AM<br/> 3:38 hours</p>]]></description>
        <TimeSpan>
          <begin>2014-01-13T20:21:59-06:00</begin>
          <end>2014-01-13T23:59:59-06:00</end>
        </TimeSpan>
        <styleUrl>#place_home</styleUrl>
        <Point>
          <coordinates>-71.1114458017,42.3754311174</coordinates>
        </Point>
      </Placemark>
    </Folder>
    <Folder>
      <name><![CDATA[1/14/14]]></name>
      <Placemark id="1389679200000">
        <name><![CDATA[Home]]></name>
        <description><![CDATA[<p>1/14/14<br/> 12:00 AM to 8:44 AM<br/> 8:44 hours</p>]]></description>
        <TimeSpan>
          <begin>2014-01-14T00:00:01-06:00</begin>
          <end>2014-01-14T08:44:13-06:00</end>
        </TimeSpan>
        <styleUrl>#place_home</styleUrl>
        <Point>
          <coordinates>-71.1114458017,42.3754311174</coordinates>
        </Point>
      </Placemark>
      <Placemark id="1389711168000">
        <name><![CDATA[Proximate]]></name>
        <atom:link href="http://foursquare.com/venue/51c8c0d1498e5d4d09a48362"/>
        <description><![CDATA[<p>1/14/14<br/> 8:52 AM to 11:30 AM<br/> 2:37 hours</p> <p>Tech Startup<br/> <a href="http://foursquare.com/venue/51c8c0d1498e5d4d09a48362">More details (Foursquare)</a> </p>]]></description>
        <TimeSpan>
          <begin>2014-01-14T08:52:49-06:00</begin>
          <end>2014-01-14T11:30:25-06:00</end>
        </TimeSpan>
        <styleUrl>#place_Tech Startup</styleUrl>
        <Point>
          <coordinates>-71.117205,42.378716</coordinates>
        </Point>
      </Placemark>
      <Placemark id="1389721238000">
        <name><![CDATA[Dickson Bros. True Value]]></name>
        <atom:link href="http://foursquare.com/venue/4aad3cf3f964a5202f5f20e3"/>
        <description><![CDATA[<p>1/14/14<br/> 11:40 AM to 12:26 PM<br/> 46 min</p> <p>Hardware Store<br/> <a href="http://foursquare.com/venue/4aad3cf3f964a5202f5f20e3">More details (Foursquare)</a> </p>]]></description>
        <TimeSpan>
          <begin>2014-01-14T11:40:39-06:00</begin>
          <end>2014-01-14T12:26:38-06:00</end>
        </TimeSpan>
        <styleUrl>#place_Hardware Store</styleUrl>
        <Point>
          <coordinates>-71.120418,42.373343</coordinates>
        </Point>
      </Placemark>
      <Placemark id="1389724738000">
        <name><![CDATA[Proximate]]></name>
        <atom:link href="http://foursquare.com/venue/51c8c0d1498e5d4d09a48362"/>
        <description><![CDATA[<p>1/14/14<br/> 12:38 PM to 3:05 PM<br/> 2:26 hours</p> <p>Tech Startup<br/> <a href="http://foursquare.com/venue/51c8c0d1498e5d4d09a48362">More details (Foursquare)</a> </p>]]></description>
        <TimeSpan>
          <begin>2014-01-14T12:38:59-06:00</begin>
          <end>2014-01-14T15:05:12-06:00</end>
        </TimeSpan>
        <styleUrl>#place_Tech Startup</styleUrl>
        <Point>
          <coordinates>-71.117205,42.378716</coordinates>
        </Point>
      </Placemark>
      <Placemark id="1389734348000">
        <name><![CDATA[Starbucks]]></name>
        <atom:link href="http://foursquare.com/venue/49cabb79f964a520d8581fe3"/>
        <description><![CDATA[<p>1/14/14<br/> 3:19 PM to 3:32 PM<br/> 13 min</p> <p>Coffee Shop<br/> <a href="http://foursquare.com/venue/49cabb79f964a520d8581fe3">More details (Foursquare)</a> </p>]]></description>
        <TimeSpan>
          <begin>2014-01-14T15:19:09-06:00</begin>
          <end>2014-01-14T15:32:48-06:00</end>
        </TimeSpan>
        <styleUrl>#place_Coffee Shop</styleUrl>
        <Point>
          <coordinates>-71.12017,42.374494</coordinates>
        </Point>
      </Placemark>
      <Placemark id="1389735810000">
        <name><![CDATA[Proximate]]></name>
        <atom:link href="http://foursquare.com/venue/51c8c0d1498e5d4d09a48362"/>
        <description><![CDATA[<p>1/14/14<br/> 3:43 PM to 7:18 PM<br/> 3:34 hours</p> <p>Tech Startup<br/> <a href="http://foursquare.com/venue/51c8c0d1498e5d4d09a48362">More details (Foursquare)</a> </p>]]></description>
        <TimeSpan>
          <begin>2014-01-14T15:43:31-06:00</begin>
          <end>2014-01-14T19:18:02-06:00</end>
        </TimeSpan>
        <styleUrl>#place_Tech Startup</styleUrl>
        <Point>
          <coordinates>-71.117205,42.378716</coordinates>
        </Point>
      </Placemark>
      <Placemark id="1389749318000">
        <name><![CDATA[Broadway Marketplace]]></name>
        <atom:link href="http://foursquare.com/venue/4a661612f964a520ffc71fe3"/>
        <description><![CDATA[<p>1/14/14<br/> 7:28 PM to 7:40 PM<br/> 11 min</p> <p>Grocery Store<br/> <a href="http://foursquare.com/venue/4a661612f964a520ffc71fe3">More details (Foursquare)</a> </p>]]></description>
        <TimeSpan>
          <begin>2014-01-14T19:28:39-06:00</begin>
          <end>2014-01-14T19:40:30-06:00</end>
        </TimeSpan>
        <styleUrl>#place_Grocery Store</styleUrl>
        <Point>
          <coordinates>-71.11300484548056,42.37405171427381</coordinates>
        </Point>
      </Placemark>
      <Placemark id="1389750250000">
        <name><![CDATA[Home]]></name>
        <description><![CDATA[<p>1/14/14<br/> 7:44 PM to 12:00 AM<br/> 4:15 hours</p>]]></description>
        <TimeSpan>
          <begin>2014-01-14T19:44:11-06:00</begin>
          <end>2014-01-14T23:59:59-06:00</end>
        </TimeSpan>
        <styleUrl>#place_home</styleUrl>
        <Point>
          <coordinates>-71.1114458017,42.3754311174</coordinates>
        </Point>
      </Placemark>
    </Folder>
    <Folder>
      <name><![CDATA[1/15/14]]></name>
      <Placemark id="1389765600000">
        <name><![CDATA[Home]]></name>
        <description><![CDATA[<p>1/15/14<br/> 12:00 AM to 8:47 AM<br/> 8:47 hours</p>]]></description>
        <TimeSpan>
          <begin>2014-01-15T00:00:01-06:00</begin>
          <end>2014-01-15T08:47:19-06:00</end>
        </TimeSpan>
        <styleUrl>#place_home</styleUrl>
        <Point>
          <coordinates>-71.1114458017,42.3754311174</coordinates>
        </Point>
      </Placemark>
      <Placemark id="1389797876000">
        <name><![CDATA[Proximate]]></name>
        <atom:link href="http://foursquare.com/venue/51c8c0d1498e5d4d09a48362"/>
        <description><![CDATA[<p>1/15/14<br/> 8:57 AM to 12:33 PM<br/> 3:35 hours</p> <p>Tech Startup<br/> <a href="http://foursquare.com/venue/51c8c0d1498e5d4d09a48362">More details (Foursquare)</a> </p>]]></description>
        <TimeSpan>
          <begin>2014-01-15T08:57:57-06:00</begin>
          <end>2014-01-15T12:33:49-06:00</end>
        </TimeSpan>
        <styleUrl>#place_Tech Startup</styleUrl>
        <Point>
          <coordinates>-71.117205,42.378716</coordinates>
        </Point>
      </Placemark>
      <Placemark id="1389811504000">
        <name><![CDATA[Border Cafe]]></name>
        <atom:link href="http://foursquare.com/venue/3fd66200f964a520bded1ee3"/>
        <description><![CDATA[<p>1/15/14<br/> 12:45 PM to 1:30 PM<br/> 45 min</p> <p>Mexican Restaurant<br/> <a href="http://foursquare.com/venue/3fd66200f964a520bded1ee3">More details (Foursquare)</a> </p>]]></description>
        <TimeSpan>
          <begin>2014-01-15T12:45:05-06:00</begin>
          <end>2014-01-15T13:30:34-06:00</end>
        </TimeSpan>
        <styleUrl>#place_Mexican Restaurant</styleUrl>
        <Point>
          <coordinates>-71.120141,42.3743468</coordinates>
        </Point>
      </Placemark>
      <Placemark id="1389814873000">
        <name><![CDATA[Proximate]]></name>
        <atom:link href="http://foursquare.com/venue/51c8c0d1498e5d4d09a48362"/>
        <description><![CDATA[<p>1/15/14<br/> 1:41 PM to 8:11 PM<br/> 6:30 hours</p> <p>Tech Startup<br/> <a href="http://foursquare.com/venue/51c8c0d1498e5d4d09a48362">More details (Foursquare)</a> </p>]]></description>
        <TimeSpan>
          <begin>2014-01-15T13:41:14-06:00</begin>
          <end>2014-01-15T20:11:43-06:00</end>
        </TimeSpan>
        <styleUrl>#place_Tech Startup</styleUrl>
        <Point>
          <coordinates>-71.117205,42.378716</coordinates>
        </Point>
      </Placemark>
      <Placemark id="1389839243000">
        <name><![CDATA[Legal Sea Foods - Charles Square]]></name>
        <atom:link href="http://foursquare.com/venue/4bdcb5fa3904a59331664f9e"/>
        <description><![CDATA[<p>1/15/14<br/> 8:27 PM to 10:03 PM<br/> 1:36 hours</p> <p>Seafood Restaurant<br/> <a href="http://foursquare.com/venue/4bdcb5fa3904a59331664f9e">More details (Foursquare)</a> </p>]]></description>
        <TimeSpan>
          <begin>2014-01-15T20:27:24-06:00</begin>
          <end>2014-01-15T22:03:56-06:00</end>
        </TimeSpan>
        <styleUrl>#place_Seafood Restaurant</styleUrl>
        <Point>
          <coordinates>-71.1230027436908,42.37220351484281</coordinates>
        </Point>
      </Placemark>
      <Placemark id="1389846155000">
        <name><![CDATA[Home]]></name>
        <description><![CDATA[<p>1/15/14<br/> 10:22 PM to 12:00 AM<br/> 1:37 hours</p>]]></description>
        <TimeSpan>
          <begin>2014-01-15T22:22:36-06:00</begin>
          <end>2014-01-15T23:59:59-06:00</end>
        </TimeSpan>
        <styleUrl>#place_home</styleUrl>
        <Point>
          <coordinates>-71.1114458017,42.3754311174</coordinates>
        </Point>
      </Placemark>
    </Folder>
    <Folder>
      <name><![CDATA[1/16/14]]></name>
      <Placemark id="1389852000000">
        <name><![CDATA[Home]]></name>
        <description><![CDATA[<p>1/16/14<br/> 12:00 AM to 7:50 AM<br/> 7:50 hours</p>]]></description>
        <TimeSpan>
          <begin>2014-01-16T00:00:01-06:00</begin>
          <end>2014-01-16T07:50:49-06:00</end>
        </TimeSpan>
        <styleUrl>#place_home</styleUrl>
        <Point>
          <coordinates>-71.1114458017,42.3754311174</coordinates>
        </Point>
      </Placemark>
      <Placemark id="1389881573000">
        <name><![CDATA[Boston Logan International Airport (BOS)]]></name>
        <atom:link href="http://foursquare.com/venue/452113b6f964a520bc3a1fe3"/>
        <description><![CDATA[<p>1/16/14<br/> 8:12 AM to 9:15 AM<br/> 1:02 hours</p> <p>Airport<br/> <a href="http://foursquare.com/venue/452113b6f964a520bc3a1fe3">More details (Foursquare)</a> </p>]]></description>
        <TimeSpan>
